No.     Time               Source                Destination           Protocol Length Info
    461 03:40:38.769670    10.106.129.54         182.254.40.171        HTTP     811    POST / HTTP/1.1 

Frame 461: 811 bytes on wire (6488 bits), 811 bytes captured (6488 bits) on interface 0
Ethernet II, Src: AsustekC_34:f3:aa (9c:5c:8e:34:f3:aa), Dst: Hangzhou_75:c8:f5 (74:25:8a:75:c8:f5)
Internet Protocol Version 4, Src: 10.106.129.54, Dst: 182.254.40.171
Transmission Control Protocol, Src Port: 44039 (44039), Dst Port: 80 (80), Seq: 1, Ack: 1, Len: 757
Hypertext Transfer Protocol
    POST / HTTP/1.1\r\n
    User-Agent: Mozilla/4.0 (compatible; MSIE 7.0; Windows NT 5.1) QQBrowser/6.0\r\n
    Host: qbwup.imtt.qq.com\r\n
    Content-Length: 318\r\n
    Cache-Control: no-cache\r\n
     [truncated]Cookie: pt2gguin=o1641965841; ptcz=f2f770ba3177a10d6d32cc833f8390c1f20e5b0e4f1ec4c1d2b07a329d888810; pgv_pvid=6396173380; o_cookie=1641965841; eas_sid=51D4X6E8z8r3u0Q8B0S59330a1; tvfe_boss_uuid=b9dac764249e7385; RK=Htem85K6Wi; 
    \r\n
    [Full request URI: http://qbwup.imtt.qq.com/]
    [HTTP request 1/1]
    [Response in frame: 463]
    Data (318 bytes)

0000  00 00 01 3e 10 02 2c 3c 4c 56 08 71 62 70 63 73   ...>..,<LV.qbpcs
0010  74 61 74 66 04 73 74 61 74 7d 00 01 01 1b 08 00   tatf.stat}......
0020  01 06 05 63 72 79 70 74 18 00 01 06 0a 6c 69 73   ...crypt.....lis
0030  74 3c 63 68 61 72 3e 1d 00 01 00 fd 0d 00 01 00   t<char>.........
0040  f8 6e 19 1d fc 9b 51 85 8c 2d cb a9 bb 77 26 ba   .n....Q..-...w&.
0050  45 d6 ef 84 7c d1 9c 7d 34 4a ed d6 a0 2c be 9f   E...|..}4J...,..
0060  55 51 71 10 53 d7 96 79 c7 95 cf 32 6f 12 8a 6e   UQq.S..y...2o..n
0070  b2 55 bb b7 be 82 27 73 f0 4f db 31 9c f0 59 e3   .U....'s.O.1..Y.
0080  69 01 91 4c a3 a5 2a 72 e1 ea 33 b9 ae 51 fa ca   i..L..*r..3..Q..
0090  26 db 11 42 1c 6b 2a 25 4f 9f 15 d3 f0 15 c4 27   &..B.k*%O......'
00a0  00 31 0d 93 eb 93 e8 ee 34 e5 d0 2b c9 df 0a cc   .1......4..+....
00b0  7a 3f 55 87 36 d2 33 88 b0 69 b9 24 1a 18 72 e3   z?U.6.3..i.$..r.
00c0  d1 d7 48 3f 3e d4 88 32 50 d1 6d b1 7a 89 8d aa   ..H?>..2P.m.z...
00d0  d2 61 b9 cd 1f 0b 4a 41 ad 17 16 67 3f 25 f8 90   .a....JA...g?%..
00e0  95 08 35 2e aa a3 ba c0 7a 2e ab f2 dc 96 96 b8   ..5.....z.......
00f0  bb ef e9 7a 89 b8 a7 7e 7f 32 a4 6a 84 41 7a b7   ...z...~.2.j.Az.
0100  a0 e7 52 61 35 f0 38 57 76 32 47 3b 5b f1 0f a7   ..Ra5.8Wv2G;[...
0110  76 22 d0 f8 55 e0 de f6 7f a8 df de 23 0c c6 fc   v"..U.......#...
0120  6c a5 b8 8c d8 16 29 99 01 6c 55 5b 84 4c 58 6a   l.....)..lU[.LXj
0130  44 f4 67 ef 65 2d e9 8c 3e 8c 98 0c a8 0c         D.g.e-..>.....

No.     Time               Source                Destination           Protocol Length Info
    463 03:40:38.802082    182.254.40.171        10.106.129.54         HTTP     262    HTTP/1.1 200 OK  (application/multipart-formdata)

Frame 463: 262 bytes on wire (2096 bits), 262 bytes captured (2096 bits) on interface 0
Ethernet II, Src: Hangzhou_75:c8:f5 (74:25:8a:75:c8:f5), Dst: AsustekC_34:f3:aa (9c:5c:8e:34:f3:aa)
Internet Protocol Version 4, Src: 182.254.40.171, Dst: 10.106.129.54
Transmission Control Protocol, Src Port: 80 (80), Dst Port: 44039 (44039), Seq: 1, Ack: 758, Len: 208
Hypertext Transfer Protocol
    HTTP/1.1 200 OK\r\n
    Content-Length: 54\r\n
    Content-Type: application/multipart-formdata\r\n
    Date: Sun, 16 Jul 2017 03:40:36 GMT\r\n
    Server: HTTP Load Balancer/1.0\r\n
    \r\n
    [HTTP response 1/1]
    [Time since request: 0.032412000 seconds]
    [Request in frame: 461]
Media Type

No.     Time               Source                Destination           Protocol Length Info
   1007 03:40:45.666418    10.106.129.54         192.168.81.89         SSDP     480    HTTP/1.1 200 OK 

Frame 1007: 480 bytes on wire (3840 bits), 480 bytes captured (3840 bits) on interface 0
Ethernet II, Src: AsustekC_34:f3:aa (9c:5c:8e:34:f3:aa), Dst: Hangzhou_75:c8:f5 (74:25:8a:75:c8:f5)
Internet Protocol Version 4, Src: 10.106.129.54, Dst: 192.168.81.89
User Datagram Protocol, Src Port: 1900 (1900), Dst Port: 1900 (1900)
Hypertext Transfer Protocol
    HTTP/1.1 200 OK\r\n
    ST: upnp:rootdevice\r\n
    USN: uuid:3ced1185-a624-4fc1-be23-ce28fc76a1b5::upnp:rootdevice\r\n
    Location: http://10.106.129.54:2869/upnphost/udhisapi.dll?content=uuid:3ced1185-a624-4fc1-be23-ce28fc76a1b5\r\n
    OPT:"http://schemas.upnp.org/upnp/1/0/"; ns=01\r\n
    01-NLS: 3fca7df4a9594a241129c800108660dc\r\n
    Cache-Control: max-age=900\r\n
    Server: Microsoft-Windows/10.0 UPnP/1.0 UPnP-Device-Host/1.0\r\n
    Ext: \r\n
    Date: Sun, 16 Jul 2017 01:40:54 GMT\r\n
    \r\n
    [HTTP response 1/44]
    [Next response in frame: 1031]

No.     Time               Source                Destination           Protocol Length Info
   1031 03:40:47.347667    10.106.129.54         192.168.81.89         SSDP     480    HTTP/1.1 200 OK 

Frame 1031: 480 bytes on wire (3840 bits), 480 bytes captured (3840 bits) on interface 0
Ethernet II, Src: AsustekC_34:f3:aa (9c:5c:8e:34:f3:aa), Dst: Hangzhou_75:c8:f5 (74:25:8a:75:c8:f5)
Internet Protocol Version 4, Src: 10.106.129.54, Dst: 192.168.81.89
User Datagram Protocol, Src Port: 1900 (1900), Dst Port: 1900 (1900)
Hypertext Transfer Protocol
    HTTP/1.1 200 OK\r\n
    ST: upnp:rootdevice\r\n
    USN: uuid:3ced1185-a624-4fc1-be23-ce28fc76a1b5::upnp:rootdevice\r\n
    Location: http://10.106.129.54:2869/upnphost/udhisapi.dll?content=uuid:3ced1185-a624-4fc1-be23-ce28fc76a1b5\r\n
    OPT:"http://schemas.upnp.org/upnp/1/0/"; ns=01\r\n
    01-NLS: 3fca7df4a9594a241129c800108660dc\r\n
    Cache-Control: max-age=900\r\n
    Server: Microsoft-Windows/10.0 UPnP/1.0 UPnP-Device-Host/1.0\r\n
    Ext: \r\n
    Date: Sun, 16 Jul 2017 01:40:54 GMT\r\n
    \r\n
    [HTTP response 2/44]
    [Prev response in frame: 1007]
    [Next response in frame: 3457]

No.     Time               Source                Destination           Protocol Length Info
   1095 03:40:51.527256    10.106.129.54         182.254.21.82         HTTP     421    GET /cgi-bin/micromsg-bin/newgetdns?uin=2314646421&clientversion=1644430665&scene=0&net=1&md5=31c956de3bcce7775f3b16c117a1f26d&devicetype=Windows+UnKnow&lan=zh_CN&sigver=2 HTTP/1.0 

Frame 1095: 421 bytes on wire (3368 bits), 421 bytes captured (3368 bits) on interface 0
Ethernet II, Src: AsustekC_34:f3:aa (9c:5c:8e:34:f3:aa), Dst: Hangzhou_75:c8:f5 (74:25:8a:75:c8:f5)
Internet Protocol Version 4, Src: 10.106.129.54, Dst: 182.254.21.82
Transmission Control Protocol, Src Port: 44043 (44043), Dst Port: 8080 (8080), Seq: 1, Ack: 1, Len: 367
Hypertext Transfer Protocol
    GET /cgi-bin/micromsg-bin/newgetdns?uin=2314646421&clientversion=1644430665&scene=0&net=1&md5=31c956de3bcce7775f3b16c117a1f26d&devicetype=Windows+UnKnow&lan=zh_CN&sigver=2 HTTP/1.0\r\n
    Accept: */*\r\n
    Accept-Encoding: defalte\r\n
    Cache-Control: no-cache\r\n
    Connection: close\r\n
    Content-Type: application/octet-stream\r\n
    Host: dns.weixin.qq.com\r\n
    User-Agent: MicroMessenger Client\r\n
    \r\n
    [Full request URI: http://dns.weixin.qq.com/cgi-bin/micromsg-bin/newgetdns?uin=2314646421&clientversion=1644430665&scene=0&net=1&md5=31c956de3bcce7775f3b16c117a1f26d&devicetype=Windows+UnKnow&lan=zh_CN&sigver=2]
    [HTTP request 1/1]
    [Response in frame: 1097]

No.     Time               Source                Destination           Protocol Length Info
   1097 03:40:51.537454    182.254.21.82         10.106.129.54         HTTP/XML 1137   HTTP/1.0 200 OK 

Frame 1097: 1137 bytes on wire (9096 bits), 1137 bytes captured (9096 bits) on interface 0
Ethernet II, Src: Hangzhou_75:c8:f5 (74:25:8a:75:c8:f5), Dst: AsustekC_34:f3:aa (9c:5c:8e:34:f3:aa)
Internet Protocol Version 4, Src: 182.254.21.82, Dst: 10.106.129.54
Transmission Control Protocol, Src Port: 8080 (8080), Dst Port: 44043 (44043), Seq: 1, Ack: 368, Len: 1083
Hypertext Transfer Protocol
    HTTP/1.0 200 OK\r\n
    Cache-Control: no-cache\r\n
    Connection: close\r\n
    Content-Type: text/xml\r\n
    Content-Encoding: deflate\r\n
    Content-Length: 948\r\n
    \r\n
    [HTTP response 1/1]
    [Time since request: 0.010198000 seconds]
    [Request in frame: 1095]
    Content-encoded entity body (deflate): 948 bytes -> 7867 bytes
eXtensible Markup Language

No.     Time               Source                Destination           Protocol Length Info
   1105 03:40:51.602785    10.106.129.54         121.51.140.147        HTTP     416    POST /cgi-bin/micromsg-bin/getcdndns HTTP/1.0  (application/octet-stream)

Frame 1105: 416 bytes on wire (3328 bits), 416 bytes captured (3328 bits) on interface 0
Ethernet II, Src: AsustekC_34:f3:aa (9c:5c:8e:34:f3:aa), Dst: Hangzhou_75:c8:f5 (74:25:8a:75:c8:f5)
Internet Protocol Version 4, Src: 10.106.129.54, Dst: 121.51.140.147
Transmission Control Protocol, Src Port: 44044 (44044), Dst Port: 80 (80), Seq: 1, Ack: 1, Len: 362
Hypertext Transfer Protocol
    POST /cgi-bin/micromsg-bin/getcdndns HTTP/1.0\r\n
    Accept: */*\r\n
    Cache-Control: no-cache\r\n
    Connection: close\r\n
    Content-Length: 128\r\n
    Content-Type: application/octet-stream\r\n
    Host: szextshort.weixin.qq.com\r\n
    User-Agent: MicroMessenger Client\r\n
    \r\n
    [Full request URI: http://szextshort.weixin.qq.com/cgi-bin/micromsg-bin/getcdndns]
    [HTTP request 1/1]
    [Response in frame: 1135]
Media Type

No.     Time               Source                Destination           Protocol Length Info
   1135 03:40:51.681405    121.51.140.147        10.106.129.54         HTTP     570    HTTP/1.0 200 OK  (application/octet-stream)

Frame 1135: 570 bytes on wire (4560 bits), 570 bytes captured (4560 bits) on interface 0
Ethernet II, Src: Hangzhou_75:c8:f5 (74:25:8a:75:c8:f5), Dst: AsustekC_34:f3:aa (9c:5c:8e:34:f3:aa)
Internet Protocol Version 4, Src: 121.51.140.147, Dst: 10.106.129.54
Transmission Control Protocol, Src Port: 80 (80), Dst Port: 44044 (44044), Seq: 1, Ack: 363, Len: 516
Hypertext Transfer Protocol
    HTTP/1.0 200 OK\r\n
    Connection: close\r\n
    Content-Type: application/octet-stream\r\n
    Content-Length: 417\r\n
    \r\n
    [HTTP response 1/1]
    [Time since request: 0.078620000 seconds]
    [Request in frame: 1105]
Media Type

No.     Time               Source                Destination           Protocol Length Info
   1269 03:40:59.808859    fe80::c065:965c:5111:4a3c fe80::399b:546:ce8d:c523 HTTP     313    POST /5ba6a706-41d1-4e5f-ae5a-e724e77c379c/ HTTP/1.1 

Frame 1269: 313 bytes on wire (2504 bits), 313 bytes captured (2504 bits) on interface 0
Ethernet II, Src: AsustekC_59:e5:da (10:bf:48:59:e5:da), Dst: AsustekC_34:f3:aa (9c:5c:8e:34:f3:aa)
Internet Protocol Version 6, Src: fe80::c065:965c:5111:4a3c, Dst: fe80::399b:546:ce8d:c523
Transmission Control Protocol, Src Port: 7174 (7174), Dst Port: 5357 (5357), Seq: 1, Ack: 1, Len: 239
Hypertext Transfer Protocol
    POST /5ba6a706-41d1-4e5f-ae5a-e724e77c379c/ HTTP/1.1\r\n
    Cache-Control: no-cache\r\n
    Connection: Keep-Alive\r\n
    Pragma: no-cache\r\n
    Content-Type: application/soap+xml\r\n
    User-Agent: WSDAPI\r\n
    Content-Length: 733\r\n
    Host: [fe80::399b:546:ce8d:c523]:5357\r\n
    \r\n
    [Full request URI: http://[fe80::399b:546:ce8d:c523]:5357/5ba6a706-41d1-4e5f-ae5a-e724e77c379c/]
    [HTTP request 1/1]
    [Response in frame: 1304]

No.     Time               Source                Destination           Protocol Length Info
   1273 03:40:59.808862    10.106.129.123        10.106.129.54         HTTP     280    POST /5ba6a706-41d1-4e5f-ae5a-e724e77c379c/ HTTP/1.1 

Frame 1273: 280 bytes on wire (2240 bits), 280 bytes captured (2240 bits) on interface 0
Ethernet II, Src: LcfcHefe_fa:b5:54 (68:f7:28:fa:b5:54), Dst: AsustekC_34:f3:aa (9c:5c:8e:34:f3:aa)
Internet Protocol Version 4, Src: 10.106.129.123, Dst: 10.106.129.54
Transmission Control Protocol, Src Port: 54435 (54435), Dst Port: 5357 (5357), Seq: 1, Ack: 1, Len: 226
Hypertext Transfer Protocol
    POST /5ba6a706-41d1-4e5f-ae5a-e724e77c379c/ HTTP/1.1\r\n
    Cache-Control: no-cache\r\n
    Connection: Keep-Alive\r\n
    Pragma: no-cache\r\n
    Content-Type: application/soap+xml\r\n
    User-Agent: WSDAPI\r\n
    Content-Length: 733\r\n
    Host: 10.106.129.54:5357\r\n
    \r\n
    [Full request URI: http://10.106.129.54:5357/5ba6a706-41d1-4e5f-ae5a-e724e77c379c/]
    [HTTP request 1/1]
    [Response in frame: 1325]

No.     Time               Source                Destination           Protocol Length Info
   1280 03:40:59.810868    fe80::1c8a:ae9:b750:a21e fe80::399b:546:ce8d:c523 HTTP     313    POST /5ba6a706-41d1-4e5f-ae5a-e724e77c379c/ HTTP/1.1 

Frame 1280: 313 bytes on wire (2504 bits), 313 bytes captured (2504 bits) on interface 0
Ethernet II, Src: LcfcHefe_ec:4e:ed (50:7b:9d:ec:4e:ed), Dst: AsustekC_34:f3:aa (9c:5c:8e:34:f3:aa)
Internet Protocol Version 6, Src: fe80::1c8a:ae9:b750:a21e, Dst: fe80::399b:546:ce8d:c523
Transmission Control Protocol, Src Port: 9580 (9580), Dst Port: 5357 (5357), Seq: 1, Ack: 1, Len: 239
Hypertext Transfer Protocol
    POST /5ba6a706-41d1-4e5f-ae5a-e724e77c379c/ HTTP/1.1\r\n
    Cache-Control: no-cache\r\n
    Connection: Keep-Alive\r\n
    Pragma: no-cache\r\n
    Content-Type: application/soap+xml\r\n
    User-Agent: WSDAPI\r\n
    Content-Length: 733\r\n
    Host: [fe80::399b:546:ce8d:c523]:5357\r\n
    \r\n
    [Full request URI: http://[fe80::399b:546:ce8d:c523]:5357/5ba6a706-41d1-4e5f-ae5a-e724e77c379c/]
    [HTTP request 1/1]
    [Response in frame: 1324]

No.     Time               Source                Destination           Protocol Length Info
   1283 03:40:59.810869    fe80::18d0:e70b:f1e2:a0f6 fe80::399b:546:ce8d:c523 HTTP     313    POST /5ba6a706-41d1-4e5f-ae5a-e724e77c379c/ HTTP/1.1 

Frame 1283: 313 bytes on wire (2504 bits), 313 bytes captured (2504 bits) on interface 0
Ethernet II, Src: CompalIn_f8:ac:02 (b8:88:e3:f8:ac:02), Dst: AsustekC_34:f3:aa (9c:5c:8e:34:f3:aa)
Internet Protocol Version 6, Src: fe80::18d0:e70b:f1e2:a0f6, Dst: fe80::399b:546:ce8d:c523
Transmission Control Protocol, Src Port: 6474 (6474), Dst Port: 5357 (5357), Seq: 1, Ack: 1, Len: 239
Hypertext Transfer Protocol
    POST /5ba6a706-41d1-4e5f-ae5a-e724e77c379c/ HTTP/1.1\r\n
    Cache-Control: no-cache\r\n
    Connection: Keep-Alive\r\n
    Pragma: no-cache\r\n
    Content-Type: application/soap+xml\r\n
    User-Agent: WSDAPI\r\n
    Content-Length: 733\r\n
    Host: [fe80::399b:546:ce8d:c523]:5357\r\n
    \r\n
    [Full request URI: http://[fe80::399b:546:ce8d:c523]:5357/5ba6a706-41d1-4e5f-ae5a-e724e77c379c/]
    [HTTP request 1/1]
    [Response in frame: 1408]

No.     Time               Source                Destination           Protocol Length Info
   1293 03:40:59.812345    10.106.129.71         10.106.129.54         HTTP     280    POST /5ba6a706-41d1-4e5f-ae5a-e724e77c379c/ HTTP/1.1 

Frame 1293: 280 bytes on wire (2240 bits), 280 bytes captured (2240 bits) on interface 0
Ethernet II, Src: Giga-Byt_ea:7c:01 (40:8d:5c:ea:7c:01), Dst: AsustekC_34:f3:aa (9c:5c:8e:34:f3:aa)
Internet Protocol Version 4, Src: 10.106.129.71, Dst: 10.106.129.54
Transmission Control Protocol, Src Port: 62532 (62532), Dst Port: 5357 (5357), Seq: 1, Ack: 1, Len: 226
Hypertext Transfer Protocol
    POST /5ba6a706-41d1-4e5f-ae5a-e724e77c379c/ HTTP/1.1\r\n
    Cache-Control: no-cache\r\n
    Connection: Keep-Alive\r\n
    Pragma: no-cache\r\n
    Content-Type: application/soap+xml\r\n
    User-Agent: WSDAPI\r\n
    Content-Length: 733\r\n
    Host: 10.106.129.54:5357\r\n
    \r\n
    [Full request URI: http://10.106.129.54:5357/5ba6a706-41d1-4e5f-ae5a-e724e77c379c/]
    [HTTP request 1/1]
    [Response in frame: 1398]

No.     Time               Source                Destination           Protocol Length Info
   1298 03:40:59.813862    fe80::605c:b7ab:b61:a45a fe80::399b:546:ce8d:c523 HTTP     313    POST /5ba6a706-41d1-4e5f-ae5a-e724e77c379c/ HTTP/1.1 

Frame 1298: 313 bytes on wire (2504 bits), 313 bytes captured (2504 bits) on interface 0
Ethernet II, Src: HonHaiPr_05:22:a1 (44:37:e6:05:22:a1), Dst: AsustekC_34:f3:aa (9c:5c:8e:34:f3:aa)
Internet Protocol Version 6, Src: fe80::605c:b7ab:b61:a45a, Dst: fe80::399b:546:ce8d:c523
Transmission Control Protocol, Src Port: 52661 (52661), Dst Port: 5357 (5357), Seq: 1, Ack: 1, Len: 239
Hypertext Transfer Protocol
    POST /5ba6a706-41d1-4e5f-ae5a-e724e77c379c/ HTTP/1.1\r\n
    Cache-Control: no-cache\r\n
    Connection: Keep-Alive\r\n
    Pragma: no-cache\r\n
    Content-Type: application/soap+xml\r\n
    User-Agent: WSDAPI\r\n
    Content-Length: 733\r\n
    Host: [fe80::399b:546:ce8d:c523]:5357\r\n
    \r\n
    [Full request URI: http://[fe80::399b:546:ce8d:c523]:5357/5ba6a706-41d1-4e5f-ae5a-e724e77c379c/]
    [HTTP request 1/1]
    [Response in frame: 1436]

No.     Time               Source                Destination           Protocol Length Info
   1304 03:40:59.861900    fe80::399b:546:ce8d:c523 fe80::c065:965c:5111:4a3c HTTP/XML 1514   HTTP/1.1 200  

Frame 1304: 1514 bytes on wire (12112 bits), 1514 bytes captured (12112 bits) on interface 0
Ethernet II, Src: AsustekC_34:f3:aa (9c:5c:8e:34:f3:aa), Dst: AsustekC_59:e5:da (10:bf:48:59:e5:da)
Internet Protocol Version 6, Src: fe80::399b:546:ce8d:c523, Dst: fe80::c065:965c:5111:4a3c
Transmission Control Protocol, Src Port: 5357 (5357), Dst Port: 7174 (7174), Seq: 1, Ack: 973, Len: 1440
Hypertext Transfer Protocol
    HTTP/1.1 200 \r\n
    Content-Type: application/soap+xml\r\n
    Server: Microsoft-HTTPAPI/2.0\r\n
    Date: Sun, 16 Jul 2017 03:40:59 GMT\r\n
    Content-Length: 21694\r\n
    \r\n
    [HTTP response 1/1]
    [Time since request: 0.053041000 seconds]
    [Request in frame: 1269]
eXtensible Markup Language

No.     Time               Source                Destination           Protocol Length Info
   1324 03:40:59.864288    fe80::399b:546:ce8d:c523 fe80::1c8a:ae9:b750:a21e HTTP/XML 1514   HTTP/1.1 200  

Frame 1324: 1514 bytes on wire (12112 bits), 1514 bytes captured (12112 bits) on interface 0
Ethernet II, Src: AsustekC_34:f3:aa (9c:5c:8e:34:f3:aa), Dst: LcfcHefe_ec:4e:ed (50:7b:9d:ec:4e:ed)
Internet Protocol Version 6, Src: fe80::399b:546:ce8d:c523, Dst: fe80::1c8a:ae9:b750:a21e
Transmission Control Protocol, Src Port: 5357 (5357), Dst Port: 9580 (9580), Seq: 1, Ack: 973, Len: 1440
Hypertext Transfer Protocol
    HTTP/1.1 200 \r\n
    Content-Type: application/soap+xml\r\n
    Server: Microsoft-HTTPAPI/2.0\r\n
    Date: Sun, 16 Jul 2017 03:40:59 GMT\r\n
    Content-Length: 21694\r\n
    \r\n
    [HTTP response 1/1]
    [Time since request: 0.053420000 seconds]
    [Request in frame: 1280]
eXtensible Markup Language

No.     Time               Source                Destination           Protocol Length Info
   1325 03:40:59.864288    10.106.129.54         10.106.129.123        HTTP/XML 1514   HTTP/1.1 200  

Frame 1325: 1514 bytes on wire (12112 bits), 1514 bytes captured (12112 bits) on interface 0
Ethernet II, Src: AsustekC_34:f3:aa (9c:5c:8e:34:f3:aa), Dst: LcfcHefe_fa:b5:54 (68:f7:28:fa:b5:54)
Internet Protocol Version 4, Src: 10.106.129.54, Dst: 10.106.129.123
Transmission Control Protocol, Src Port: 5357 (5357), Dst Port: 54435 (54435), Seq: 1, Ack: 960, Len: 1460
Hypertext Transfer Protocol
    HTTP/1.1 200 \r\n
    Content-Type: application/soap+xml\r\n
    Server: Microsoft-HTTPAPI/2.0\r\n
    Date: Sun, 16 Jul 2017 03:40:59 GMT\r\n
    Content-Length: 21694\r\n
    \r\n
    [HTTP response 1/1]
    [Time since request: 0.055426000 seconds]
    [Request in frame: 1273]
eXtensible Markup Language

No.     Time               Source                Destination           Protocol Length Info
   1375 03:40:59.872406    10.106.129.75         10.106.129.54         HTTP     280    POST /5ba6a706-41d1-4e5f-ae5a-e724e77c379c/ HTTP/1.1 

Frame 1375: 280 bytes on wire (2240 bits), 280 bytes captured (2240 bits) on interface 0
Ethernet II, Src: AsustekC_59:e5:da (10:bf:48:59:e5:da), Dst: AsustekC_34:f3:aa (9c:5c:8e:34:f3:aa)
Internet Protocol Version 4, Src: 10.106.129.75, Dst: 10.106.129.54
Transmission Control Protocol, Src Port: 7175 (7175), Dst Port: 5357 (5357), Seq: 1, Ack: 1, Len: 226
Hypertext Transfer Protocol
    POST /5ba6a706-41d1-4e5f-ae5a-e724e77c379c/ HTTP/1.1\r\n
    Cache-Control: no-cache\r\n
    Connection: Keep-Alive\r\n
    Pragma: no-cache\r\n
    Content-Type: application/soap+xml\r\n
    User-Agent: WSDAPI\r\n
    Content-Length: 733\r\n
    Host: 10.106.129.54:5357\r\n
    \r\n
    [Full request URI: http://10.106.129.54:5357/5ba6a706-41d1-4e5f-ae5a-e724e77c379c/]
    [HTTP request 1/1]
    [Response in frame: 1509]

No.     Time               Source                Destination           Protocol Length Info
   1382 03:40:59.873895    10.106.129.58         10.106.129.54         HTTP     280    POST /5ba6a706-41d1-4e5f-ae5a-e724e77c379c/ HTTP/1.1 

Frame 1382: 280 bytes on wire (2240 bits), 280 bytes captured (2240 bits) on interface 0
Ethernet II, Src: LcfcHefe_ec:4e:ed (50:7b:9d:ec:4e:ed), Dst: AsustekC_34:f3:aa (9c:5c:8e:34:f3:aa)
Internet Protocol Version 4, Src: 10.106.129.58, Dst: 10.106.129.54
Transmission Control Protocol, Src Port: 9581 (9581), Dst Port: 5357 (5357), Seq: 1, Ack: 1, Len: 226
Hypertext Transfer Protocol
    POST /5ba6a706-41d1-4e5f-ae5a-e724e77c379c/ HTTP/1.1\r\n
    Cache-Control: no-cache\r\n
    Connection: Keep-Alive\r\n
    Pragma: no-cache\r\n
    Content-Type: application/soap+xml\r\n
    User-Agent: WSDAPI\r\n
    Content-Length: 733\r\n
    Host: 10.106.129.54:5357\r\n
    \r\n
    [Full request URI: http://10.106.129.54:5357/5ba6a706-41d1-4e5f-ae5a-e724e77c379c/]
    [HTTP request 1/1]
    [Response in frame: 1514]

No.     Time               Source                Destination           Protocol Length Info
   1388 03:40:59.878311    fe80::cd25:9747:b254:baa3 fe80::399b:546:ce8d:c523 HTTP     313    POST /5ba6a706-41d1-4e5f-ae5a-e724e77c379c/ HTTP/1.1 

Frame 1388: 313 bytes on wire (2504 bits), 313 bytes captured (2504 bits) on interface 0
Ethernet II, Src: LcfcHefe_fa:b5:54 (68:f7:28:fa:b5:54), Dst: AsustekC_34:f3:aa (9c:5c:8e:34:f3:aa)
Internet Protocol Version 6, Src: fe80::cd25:9747:b254:baa3, Dst: fe80::399b:546:ce8d:c523
Transmission Control Protocol, Src Port: 54437 (54437), Dst Port: 5357 (5357), Seq: 1, Ack: 1, Len: 239
Hypertext Transfer Protocol
    POST /5ba6a706-41d1-4e5f-ae5a-e724e77c379c/ HTTP/1.1\r\n
    Cache-Control: no-cache\r\n
    Connection: Keep-Alive\r\n
    Pragma: no-cache\r\n
    Content-Type: application/soap+xml\r\n
    User-Agent: WSDAPI\r\n
    Content-Length: 733\r\n
    Host: [fe80::399b:546:ce8d:c523]:5357\r\n
    \r\n
    [Full request URI: http://[fe80::399b:546:ce8d:c523]:5357/5ba6a706-41d1-4e5f-ae5a-e724e77c379c/]
    [HTTP request 1/1]
    [Response in frame: 1457]

No.     Time               Source                Destination           Protocol Length Info
   1398 03:40:59.918369    10.106.129.54         10.106.129.71         HTTP/XML 1514   HTTP/1.1 200  

Frame 1398: 1514 bytes on wire (12112 bits), 1514 bytes captured (12112 bits) on interface 0
Ethernet II, Src: AsustekC_34:f3:aa (9c:5c:8e:34:f3:aa), Dst: Giga-Byt_ea:7c:01 (40:8d:5c:ea:7c:01)
Internet Protocol Version 4, Src: 10.106.129.54, Dst: 10.106.129.71
Transmission Control Protocol, Src Port: 5357 (5357), Dst Port: 62532 (62532), Seq: 1, Ack: 960, Len: 1460
Hypertext Transfer Protocol
    HTTP/1.1 200 \r\n
    Content-Type: application/soap+xml\r\n
    Server: Microsoft-HTTPAPI/2.0\r\n
    Date: Sun, 16 Jul 2017 03:40:59 GMT\r\n
    Content-Length: 21694\r\n
    \r\n
    [HTTP response 1/1]
    [Time since request: 0.106024000 seconds]
    [Request in frame: 1293]
eXtensible Markup Language

No.     Time               Source                Destination           Protocol Length Info
   1408 03:40:59.919581    fe80::399b:546:ce8d:c523 fe80::18d0:e70b:f1e2:a0f6 HTTP/XML 1514   HTTP/1.1 200  

Frame 1408: 1514 bytes on wire (12112 bits), 1514 bytes captured (12112 bits) on interface 0
Ethernet II, Src: AsustekC_34:f3:aa (9c:5c:8e:34:f3:aa), Dst: CompalIn_f8:ac:02 (b8:88:e3:f8:ac:02)
Internet Protocol Version 6, Src: fe80::399b:546:ce8d:c523, Dst: fe80::18d0:e70b:f1e2:a0f6
Transmission Control Protocol, Src Port: 5357 (5357), Dst Port: 6474 (6474), Seq: 1, Ack: 973, Len: 1440
Hypertext Transfer Protocol
    HTTP/1.1 200 \r\n
    Content-Type: application/soap+xml\r\n
    Server: Microsoft-HTTPAPI/2.0\r\n
    Date: Sun, 16 Jul 2017 03:40:59 GMT\r\n
    Content-Length: 21694\r\n
    \r\n
    [HTTP response 1/1]
    [Time since request: 0.108712000 seconds]
    [Request in frame: 1283]
eXtensible Markup Language

No.     Time               Source                Destination           Protocol Length Info
   1436 03:40:59.921606    fe80::399b:546:ce8d:c523 fe80::605c:b7ab:b61:a45a HTTP/XML 1514   HTTP/1.1 200  

Frame 1436: 1514 bytes on wire (12112 bits), 1514 bytes captured (12112 bits) on interface 0
Ethernet II, Src: AsustekC_34:f3:aa (9c:5c:8e:34:f3:aa), Dst: HonHaiPr_05:22:a1 (44:37:e6:05:22:a1)
Internet Protocol Version 6, Src: fe80::399b:546:ce8d:c523, Dst: fe80::605c:b7ab:b61:a45a
Transmission Control Protocol, Src Port: 5357 (5357), Dst Port: 52661 (52661), Seq: 1, Ack: 973, Len: 1440
Hypertext Transfer Protocol
    HTTP/1.1 200 \r\n
    Content-Type: application/soap+xml\r\n
    Server: Microsoft-HTTPAPI/2.0\r\n
    Date: Sun, 16 Jul 2017 03:40:59 GMT\r\n
    Content-Length: 21694\r\n
    \r\n
    [HTTP response 1/1]
    [Time since request: 0.107744000 seconds]
    [Request in frame: 1298]
eXtensible Markup Language

No.     Time               Source                Destination           Protocol Length Info
   1457 03:40:59.923774    fe80::399b:546:ce8d:c523 fe80::cd25:9747:b254:baa3 HTTP/XML 1514   HTTP/1.1 200  

Frame 1457: 1514 bytes on wire (12112 bits), 1514 bytes captured (12112 bits) on interface 0
Ethernet II, Src: AsustekC_34:f3:aa (9c:5c:8e:34:f3:aa), Dst: LcfcHefe_fa:b5:54 (68:f7:28:fa:b5:54)
Internet Protocol Version 6, Src: fe80::399b:546:ce8d:c523, Dst: fe80::cd25:9747:b254:baa3
Transmission Control Protocol, Src Port: 5357 (5357), Dst Port: 54437 (54437), Seq: 1, Ack: 973, Len: 1440
Hypertext Transfer Protocol
    HTTP/1.1 200 \r\n
    Content-Type: application/soap+xml\r\n
    Server: Microsoft-HTTPAPI/2.0\r\n
    Date: Sun, 16 Jul 2017 03:40:59 GMT\r\n
    Content-Length: 21694\r\n
    \r\n
    [HTTP response 1/1]
    [Time since request: 0.045463000 seconds]
    [Request in frame: 1388]
eXtensible Markup Language

No.     Time               Source                Destination           Protocol Length Info
   1501 03:40:59.934935    fe80::14d0:8547:89ab:6d96 fe80::399b:546:ce8d:c523 HTTP     313    POST /5ba6a706-41d1-4e5f-ae5a-e724e77c379c/ HTTP/1.1 

Frame 1501: 313 bytes on wire (2504 bits), 313 bytes captured (2504 bits) on interface 0
Ethernet II, Src: Giga-Byt_ea:7c:01 (40:8d:5c:ea:7c:01), Dst: AsustekC_34:f3:aa (9c:5c:8e:34:f3:aa)
Internet Protocol Version 6, Src: fe80::14d0:8547:89ab:6d96, Dst: fe80::399b:546:ce8d:c523
Transmission Control Protocol, Src Port: 62533 (62533), Dst Port: 5357 (5357), Seq: 1, Ack: 1, Len: 239
Hypertext Transfer Protocol
    POST /5ba6a706-41d1-4e5f-ae5a-e724e77c379c/ HTTP/1.1\r\n
    Cache-Control: no-cache\r\n
    Connection: Keep-Alive\r\n
    Pragma: no-cache\r\n
    Content-Type: application/soap+xml\r\n
    User-Agent: WSDAPI\r\n
    Content-Length: 733\r\n
    Host: [fe80::399b:546:ce8d:c523]:5357\r\n
    \r\n
    [Full request URI: http://[fe80::399b:546:ce8d:c523]:5357/5ba6a706-41d1-4e5f-ae5a-e724e77c379c/]
    [HTTP request 1/1]
    [Response in frame: 1569]

No.     Time               Source                Destination           Protocol Length Info
   1509 03:40:59.936306    10.106.129.54         10.106.129.75         HTTP/XML 1514   HTTP/1.1 200  

Frame 1509: 1514 bytes on wire (12112 bits), 1514 bytes captured (12112 bits) on interface 0
Ethernet II, Src: AsustekC_34:f3:aa (9c:5c:8e:34:f3:aa), Dst: AsustekC_59:e5:da (10:bf:48:59:e5:da)
Internet Protocol Version 4, Src: 10.106.129.54, Dst: 10.106.129.75
Transmission Control Protocol, Src Port: 5357 (5357), Dst Port: 7175 (7175), Seq: 1, Ack: 960, Len: 1460
Hypertext Transfer Protocol
    HTTP/1.1 200 \r\n
    Content-Type: application/soap+xml\r\n
    Server: Microsoft-HTTPAPI/2.0\r\n
    Date: Sun, 16 Jul 2017 03:40:59 GMT\r\n
    Content-Length: 21694\r\n
    \r\n
    [HTTP response 1/1]
    [Time since request: 0.063900000 seconds]
    [Request in frame: 1375]
eXtensible Markup Language

No.     Time               Source                Destination           Protocol Length Info
   1514 03:40:59.936381    10.106.129.54         10.106.129.58         HTTP/XML 1514   HTTP/1.1 200  

Frame 1514: 1514 bytes on wire (12112 bits), 1514 bytes captured (12112 bits) on interface 0
Ethernet II, Src: AsustekC_34:f3:aa (9c:5c:8e:34:f3:aa), Dst: LcfcHefe_ec:4e:ed (50:7b:9d:ec:4e:ed)
Internet Protocol Version 4, Src: 10.106.129.54, Dst: 10.106.129.58
Transmission Control Protocol, Src Port: 5357 (5357), Dst Port: 9581 (9581), Seq: 1, Ack: 960, Len: 1460
Hypertext Transfer Protocol
    HTTP/1.1 200 \r\n
    Content-Type: application/soap+xml\r\n
    Server: Microsoft-HTTPAPI/2.0\r\n
    Date: Sun, 16 Jul 2017 03:40:59 GMT\r\n
    Content-Length: 21694\r\n
    \r\n
    [HTTP response 1/1]
    [Time since request: 0.062486000 seconds]
    [Request in frame: 1382]
eXtensible Markup Language

No.     Time               Source                Destination           Protocol Length Info
   1530 03:40:59.936526    10.106.129.88         10.106.129.54         HTTP     280    POST /5ba6a706-41d1-4e5f-ae5a-e724e77c379c/ HTTP/1.1 

Frame 1530: 280 bytes on wire (2240 bits), 280 bytes captured (2240 bits) on interface 0
Ethernet II, Src: CompalIn_f8:ac:02 (b8:88:e3:f8:ac:02), Dst: AsustekC_34:f3:aa (9c:5c:8e:34:f3:aa)
Internet Protocol Version 4, Src: 10.106.129.88, Dst: 10.106.129.54
Transmission Control Protocol, Src Port: 6475 (6475), Dst Port: 5357 (5357), Seq: 1, Ack: 1, Len: 226
Hypertext Transfer Protocol
    POST /5ba6a706-41d1-4e5f-ae5a-e724e77c379c/ HTTP/1.1\r\n
    Cache-Control: no-cache\r\n
    Connection: Keep-Alive\r\n
    Pragma: no-cache\r\n
    Content-Type: application/soap+xml\r\n
    User-Agent: WSDAPI\r\n
    Content-Length: 733\r\n
    Host: 10.106.129.54:5357\r\n
    \r\n
    [Full request URI: http://10.106.129.54:5357/5ba6a706-41d1-4e5f-ae5a-e724e77c379c/]
    [HTTP request 1/1]
    [Response in frame: 1593]

No.     Time               Source                Destination           Protocol Length Info
   1558 03:40:59.939956    10.106.129.239        10.106.129.54         HTTP     280    POST /5ba6a706-41d1-4e5f-ae5a-e724e77c379c/ HTTP/1.1 

Frame 1558: 280 bytes on wire (2240 bits), 280 bytes captured (2240 bits) on interface 0
Ethernet II, Src: HonHaiPr_05:22:a1 (44:37:e6:05:22:a1), Dst: AsustekC_34:f3:aa (9c:5c:8e:34:f3:aa)
Internet Protocol Version 4, Src: 10.106.129.239, Dst: 10.106.129.54
Transmission Control Protocol, Src Port: 52662 (52662), Dst Port: 5357 (5357), Seq: 1, Ack: 1, Len: 226
Hypertext Transfer Protocol
    POST /5ba6a706-41d1-4e5f-ae5a-e724e77c379c/ HTTP/1.1\r\n
    Cache-Control: no-cache\r\n
    Connection: Keep-Alive\r\n
    Pragma: no-cache\r\n
    Content-Type: application/soap+xml\r\n
    User-Agent: WSDAPI\r\n
    Content-Length: 733\r\n
    Host: 10.106.129.54:5357\r\n
    \r\n
    [Full request URI: http://10.106.129.54:5357/5ba6a706-41d1-4e5f-ae5a-e724e77c379c/]
    [HTTP request 1/1]
    [Response in frame: 1609]

No.     Time               Source                Destination           Protocol Length Info
   1569 03:40:59.953068    fe80::399b:546:ce8d:c523 fe80::14d0:8547:89ab:6d96 HTTP/XML 1514   HTTP/1.1 200  

Frame 1569: 1514 bytes on wire (12112 bits), 1514 bytes captured (12112 bits) on interface 0
Ethernet II, Src: AsustekC_34:f3:aa (9c:5c:8e:34:f3:aa), Dst: Giga-Byt_ea:7c:01 (40:8d:5c:ea:7c:01)
Internet Protocol Version 6, Src: fe80::399b:546:ce8d:c523, Dst: fe80::14d0:8547:89ab:6d96
Transmission Control Protocol, Src Port: 5357 (5357), Dst Port: 62533 (62533), Seq: 1, Ack: 973, Len: 1440
Hypertext Transfer Protocol
    HTTP/1.1 200 \r\n
    Content-Type: application/soap+xml\r\n
    Server: Microsoft-HTTPAPI/2.0\r\n
    Date: Sun, 16 Jul 2017 03:40:59 GMT\r\n
    Content-Length: 21694\r\n
    \r\n
    [HTTP response 1/1]
    [Time since request: 0.018133000 seconds]
    [Request in frame: 1501]
eXtensible Markup Language

No.     Time               Source                Destination           Protocol Length Info
   1593 03:40:59.955473    10.106.129.54         10.106.129.88         HTTP/XML 1514   HTTP/1.1 200  

Frame 1593: 1514 bytes on wire (12112 bits), 1514 bytes captured (12112 bits) on interface 0
Ethernet II, Src: AsustekC_34:f3:aa (9c:5c:8e:34:f3:aa), Dst: CompalIn_f8:ac:02 (b8:88:e3:f8:ac:02)
Internet Protocol Version 4, Src: 10.106.129.54, Dst: 10.106.129.88
Transmission Control Protocol, Src Port: 5357 (5357), Dst Port: 6475 (6475), Seq: 1, Ack: 960, Len: 1460
Hypertext Transfer Protocol
    HTTP/1.1 200 \r\n
    Content-Type: application/soap+xml\r\n
    Server: Microsoft-HTTPAPI/2.0\r\n
    Date: Sun, 16 Jul 2017 03:40:59 GMT\r\n
    Content-Length: 21694\r\n
    \r\n
    [HTTP response 1/1]
    [Time since request: 0.018947000 seconds]
    [Request in frame: 1530]
eXtensible Markup Language

No.     Time               Source                Destination           Protocol Length Info
   1609 03:40:59.956852    10.106.129.54         10.106.129.239        HTTP/XML 1514   HTTP/1.1 200  

Frame 1609: 1514 bytes on wire (12112 bits), 1514 bytes captured (12112 bits) on interface 0
Ethernet II, Src: AsustekC_34:f3:aa (9c:5c:8e:34:f3:aa), Dst: HonHaiPr_05:22:a1 (44:37:e6:05:22:a1)
Internet Protocol Version 4, Src: 10.106.129.54, Dst: 10.106.129.239
Transmission Control Protocol, Src Port: 5357 (5357), Dst Port: 52662 (52662), Seq: 1, Ack: 960, Len: 1460
Hypertext Transfer Protocol
    HTTP/1.1 200 \r\n
    Content-Type: application/soap+xml\r\n
    Server: Microsoft-HTTPAPI/2.0\r\n
    Date: Sun, 16 Jul 2017 03:40:59 GMT\r\n
    Content-Length: 21694\r\n
    \r\n
    [HTTP response 1/1]
    [Time since request: 0.016896000 seconds]
    [Request in frame: 1558]
eXtensible Markup Language

No.     Time               Source                Destination           Protocol Length Info
   1647 03:40:59.970964    10.106.129.1          10.106.129.54         SSDP     381    HTTP/1.1 200 OK 

Frame 1647: 381 bytes on wire (3048 bits), 381 bytes captured (3048 bits) on interface 0
Ethernet II, Src: Tp-LinkT_04:7d:99 (3c:46:d8:04:7d:99), Dst: AsustekC_34:f3:aa (9c:5c:8e:34:f3:aa)
Internet Protocol Version 4, Src: 10.106.129.1, Dst: 10.106.129.54
User Datagram Protocol, Src Port: 1900 (1900), Dst Port: 61503 (61503)
Hypertext Transfer Protocol
    HTTP/1.1 200 OK\r\n
    CACHE-CONTROL: max-age=600\r\n
    DATE: Sun, 18 Jan 1970 11:13:57 GMT\r\n
    EXT:\r\n
    LOCATION: http://10.106.129.1:1900/igd.xml\r\n
    SERVER: TP-LINK SOHO Router R860, UPnP/1.0\r\n
    ST: urn:schemas-upnp-org:device:InternetGatewayDevice:1\r\n
    USN: uuid:upnp-InternetGatewayDevice-3c46d8047d99::urn:schemas-upnp-org:device:InternetGatewayDevice:1\r\n
    \r\n
    [HTTP response 1/48]
    [Next response in frame: 1701]

No.     Time               Source                Destination           Protocol Length Info
   1701 03:41:02.968659    10.106.129.1          10.106.129.54         SSDP     381    HTTP/1.1 200 OK 

Frame 1701: 381 bytes on wire (3048 bits), 381 bytes captured (3048 bits) on interface 0
Ethernet II, Src: Tp-LinkT_04:7d:99 (3c:46:d8:04:7d:99), Dst: AsustekC_34:f3:aa (9c:5c:8e:34:f3:aa)
Internet Protocol Version 4, Src: 10.106.129.1, Dst: 10.106.129.54
User Datagram Protocol, Src Port: 1900 (1900), Dst Port: 61503 (61503)
Hypertext Transfer Protocol
    HTTP/1.1 200 OK\r\n
    CACHE-CONTROL: max-age=600\r\n
    DATE: Sun, 18 Jan 1970 11:14:00 GMT\r\n
    EXT:\r\n
    LOCATION: http://10.106.129.1:1900/igd.xml\r\n
    SERVER: TP-LINK SOHO Router R860, UPnP/1.0\r\n
    ST: urn:schemas-upnp-org:device:InternetGatewayDevice:1\r\n
    USN: uuid:upnp-InternetGatewayDevice-3c46d8047d99::urn:schemas-upnp-org:device:InternetGatewayDevice:1\r\n
    \r\n
    [HTTP response 2/48]
    [Prev response in frame: 1647]
    [Next response in frame: 1770]

No.     Time               Source                Destination           Protocol Length Info
   1770 03:41:05.968799    10.106.129.1          10.106.129.54         SSDP     381    HTTP/1.1 200 OK 

Frame 1770: 381 bytes on wire (3048 bits), 381 bytes captured (3048 bits) on interface 0
Ethernet II, Src: Tp-LinkT_04:7d:99 (3c:46:d8:04:7d:99), Dst: AsustekC_34:f3:aa (9c:5c:8e:34:f3:aa)
Internet Protocol Version 4, Src: 10.106.129.1, Dst: 10.106.129.54
User Datagram Protocol, Src Port: 1900 (1900), Dst Port: 61503 (61503)
Hypertext Transfer Protocol
    HTTP/1.1 200 OK\r\n
    CACHE-CONTROL: max-age=600\r\n
    DATE: Sun, 18 Jan 1970 11:14:03 GMT\r\n
    EXT:\r\n
    LOCATION: http://10.106.129.1:1900/igd.xml\r\n
    SERVER: TP-LINK SOHO Router R860, UPnP/1.0\r\n
    ST: urn:schemas-upnp-org:device:InternetGatewayDevice:1\r\n
    USN: uuid:upnp-InternetGatewayDevice-3c46d8047d99::urn:schemas-upnp-org:device:InternetGatewayDevice:1\r\n
    \r\n
    [HTTP response 3/48]
    [Prev response in frame: 1701]
    [Next response in frame: 1835]

No.     Time               Source                Destination           Protocol Length Info
   1835 03:41:08.974207    10.106.129.1          10.106.129.54         SSDP     381    HTTP/1.1 200 OK 

Frame 1835: 381 bytes on wire (3048 bits), 381 bytes captured (3048 bits) on interface 0
Ethernet II, Src: Tp-LinkT_04:7d:99 (3c:46:d8:04:7d:99), Dst: AsustekC_34:f3:aa (9c:5c:8e:34:f3:aa)
Internet Protocol Version 4, Src: 10.106.129.1, Dst: 10.106.129.54
User Datagram Protocol, Src Port: 1900 (1900), Dst Port: 61503 (61503)
Hypertext Transfer Protocol
    HTTP/1.1 200 OK\r\n
    CACHE-CONTROL: max-age=600\r\n
    DATE: Sun, 18 Jan 1970 11:14:06 GMT\r\n
    EXT:\r\n
    LOCATION: http://10.106.129.1:1900/igd.xml\r\n
    SERVER: TP-LINK SOHO Router R860, UPnP/1.0\r\n
    ST: urn:schemas-upnp-org:device:InternetGatewayDevice:1\r\n
    USN: uuid:upnp-InternetGatewayDevice-3c46d8047d99::urn:schemas-upnp-org:device:InternetGatewayDevice:1\r\n
    \r\n
    [HTTP response 4/48]
    [Prev response in frame: 1770]
    [Next response in frame: 1858]

No.     Time               Source                Destination           Protocol Length Info
   1858 03:41:11.974533    10.106.129.1          10.106.129.54         SSDP     381    HTTP/1.1 200 OK 

Frame 1858: 381 bytes on wire (3048 bits), 381 bytes captured (3048 bits) on interface 0
Ethernet II, Src: Tp-LinkT_04:7d:99 (3c:46:d8:04:7d:99), Dst: AsustekC_34:f3:aa (9c:5c:8e:34:f3:aa)
Internet Protocol Version 4, Src: 10.106.129.1, Dst: 10.106.129.54
User Datagram Protocol, Src Port: 1900 (1900), Dst Port: 61503 (61503)
Hypertext Transfer Protocol
    HTTP/1.1 200 OK\r\n
    CACHE-CONTROL: max-age=600\r\n
    DATE: Sun, 18 Jan 1970 11:14:09 GMT\r\n
    EXT:\r\n
    LOCATION: http://10.106.129.1:1900/igd.xml\r\n
    SERVER: TP-LINK SOHO Router R860, UPnP/1.0\r\n
    ST: urn:schemas-upnp-org:device:InternetGatewayDevice:1\r\n
    USN: uuid:upnp-InternetGatewayDevice-3c46d8047d99::urn:schemas-upnp-org:device:InternetGatewayDevice:1\r\n
    \r\n
    [HTTP response 5/48]
    [Prev response in frame: 1835]
    [Next response in frame: 1931]

No.     Time               Source                Destination           Protocol Length Info
   1931 03:41:14.975162    10.106.129.1          10.106.129.54         SSDP     381    HTTP/1.1 200 OK 

Frame 1931: 381 bytes on wire (3048 bits), 381 bytes captured (3048 bits) on interface 0
Ethernet II, Src: Tp-LinkT_04:7d:99 (3c:46:d8:04:7d:99), Dst: AsustekC_34:f3:aa (9c:5c:8e:34:f3:aa)
Internet Protocol Version 4, Src: 10.106.129.1, Dst: 10.106.129.54
User Datagram Protocol, Src Port: 1900 (1900), Dst Port: 61503 (61503)
Hypertext Transfer Protocol
    HTTP/1.1 200 OK\r\n
