No.     Time               Source                Destination           Protocol Length Info
    332 09:03:41.128205    10.106.129.54         125.39.213.73         HTTP     510    GET /livemsg?o=392&adtype=LD&soid=+jbGb4oAWv8HYgKQlgALM1+lAZuQ&r90=1&l=4018&refluence=4018&requestl=4018&tagid=0&pf=in&si=831780362&ev=6.0.408.408&aver_flag=6148&traffic=&ip_filter=0&ufc_filter=55&ufc_stra=0&ufc_match=55&backfunnel=401&use_axp=0&axpheader=1&use_txp=0&txpheader=1&st_id_t=0&flow_reuse=1&ping_data=dXBfdmVyc2lvbj1WNi4wLjQwOC40MDg=&vid=p0654q7wpej&pf_ex=pc&live=0&channelId=1&page=coolOpen&aid_tpid=28&aid_tpid2=1150&aid_tpid3=11667&aid_dura=220&aid_vid_drm=0&aid_copyright=107&aid_vip_type=1&url=https://v.qq.com/tech&from=0&pf=in&v=3.5.52&dura=&coverid=&vptag=www_baidu_com|v_tech_new:img&oadid=4018&lcount=1&t=0&pf_ex=pc&tpid=28&chid=0 HTTP/1.1 

Frame 332: 510 bytes on wire (4080 bits), 510 bytes captured (4080 bits) on interface 0
Ethernet II, Src: AsustekC_34:f3:aa (9c:5c:8e:34:f3:aa), Dst: Hangzhou_75:c8:f5 (74:25:8a:75:c8:f5)
Internet Protocol Version 4, Src: 10.106.129.54, Dst: 125.39.213.73
Transmission Control Protocol, Src Port: 20377 (20377), Dst Port: 80 (80), Seq: 2881, Ack: 1, Len: 456
[3 Reassembled TCP Segments (3336 bytes): #330(1440), #331(1440), #332(456)]
Hypertext Transfer Protocol
     [truncated]GET /livemsg?o=392&adtype=LD&soid=+jbGb4oAWv8HYgKQlgALM1+lAZuQ&r90=1&l=4018&refluence=4018&requestl=4018&tagid=0&pf=in&si=831780362&ev=6.0.408.408&aver_flag=6148&traffic=&ip_filter=0&ufc_filter=55&ufc_stra=0&ufc_match=55&backfu
    Host: livep.l.qq.com\r\n
    Connection: keep-alive\r\n
    User-Agent: Mozilla/5.0 (Windows NT 10.0; Win64; x64) AppleWebKit/537.36 (KHTML, like Gecko) Chrome/66.0.3359.139 Safari/537.36\r\n
    Accept: image/webp,image/apng,image/*,*/*;q=0.8\r\n
    Accept-Encoding: gzip, deflate\r\n
    Accept-Language: en-US,en;q=0.9,zh-TW;q=0.8,zh;q=0.7\r\n
     [truncated]Cookie: pgv_pvi=7659522048; pgv_si=s3813394432; RK=Olbs95KBUg; ptcz=2544f6f4ae92c346d1b59688e6f45a925ec0f9f8ef06a7a39332f6f8fe201348; _qpsvr_localtk=0.32806539237918764; tvfe_boss_uuid=3cdb9e54c3859a7f; appuser=3B22E15EAE54C942
    \r\n
    [Full request URI [truncated]: http://livep.l.qq.com/livemsg?o=392&adtype=LD&soid=+jbGb4oAWv8HYgKQlgALM1+lAZuQ&r90=1&l=4018&refluence=4018&requestl=4018&tagid=0&pf=in&si=831780362&ev=6.0.408.408&aver_flag=6148&traffic=&ip_filter=0&ufc_filte]
    [HTTP request 1/2]
    [Response in frame: 357]
    [Next request in frame: 367]

No.     Time               Source                Destination           Protocol Length Info
    351 09:03:41.136174    10.106.129.54         125.39.213.73         HTTP     483    GET /livemsg?o=392&adtype=LD&soid=+jbGb4oAWv8HYgKQlgFTs71yAZuQ&r90=1&l=4018&refluence=4018&requestl=4018&tagid=0&pf=in&si=831780362&ev=6.0.408.408&aver_flag=0&traffic=&ip_filter=0&ufc_filter=55&backfunnel=401&use_axp=0&axpheader=1&use_txp=0&txpheader=1&st_id_t=0&flow_reuse=1&ping_data=dXBfdmVyc2lvbj1WNi4wLjQwOC40MDg=&vid=p0654q7wpej&pf_ex=pc&live=0&channelId=1&page=coolOpen&aid_tpid=28&aid_tpid2=1150&aid_tpid3=11667&aid_dura=220&aid_vid_drm=0&aid_copyright=107&aid_vip_type=1&url=https://v.qq.com/tech&from=0&pf=in&v=3.5.52&dura=&coverid=&vptag=www_baidu_com|v_tech_new:img&oadid=4018&lcount=2&t=0&pf_ex=pc&tpid=28&chid=0 HTTP/1.1 

Frame 351: 483 bytes on wire (3864 bits), 483 bytes captured (3864 bits) on interface 0
Ethernet II, Src: AsustekC_34:f3:aa (9c:5c:8e:34:f3:aa), Dst: Hangzhou_75:c8:f5 (74:25:8a:75:c8:f5)
Internet Protocol Version 4, Src: 10.106.129.54, Dst: 125.39.213.73
Transmission Control Protocol, Src Port: 20388 (20388), Dst Port: 80 (80), Seq: 2881, Ack: 1, Len: 429
[3 Reassembled TCP Segments (3309 bytes): #349(1440), #350(1440), #351(429)]
Hypertext Transfer Protocol
     [truncated]GET /livemsg?o=392&adtype=LD&soid=+jbGb4oAWv8HYgKQlgFTs71yAZuQ&r90=1&l=4018&refluence=4018&requestl=4018&tagid=0&pf=in&si=831780362&ev=6.0.408.408&aver_flag=0&traffic=&ip_filter=0&ufc_filter=55&backfunnel=401&use_axp=0&axpheade
    Host: livep.l.qq.com\r\n
    Connection: keep-alive\r\n
    User-Agent: Mozilla/5.0 (Windows NT 10.0; Win64; x64) AppleWebKit/537.36 (KHTML, like Gecko) Chrome/66.0.3359.139 Safari/537.36\r\n
    Accept: image/webp,image/apng,image/*,*/*;q=0.8\r\n
    Accept-Encoding: gzip, deflate\r\n
    Accept-Language: en-US,en;q=0.9,zh-TW;q=0.8,zh;q=0.7\r\n
     [truncated]Cookie: pgv_pvi=7659522048; pgv_si=s3813394432; RK=Olbs95KBUg; ptcz=2544f6f4ae92c346d1b59688e6f45a925ec0f9f8ef06a7a39332f6f8fe201348; _qpsvr_localtk=0.32806539237918764; tvfe_boss_uuid=3cdb9e54c3859a7f; appuser=3B22E15EAE54C942
    \r\n
    [Full request URI [truncated]: http://livep.l.qq.com/livemsg?o=392&adtype=LD&soid=+jbGb4oAWv8HYgKQlgFTs71yAZuQ&r90=1&l=4018&refluence=4018&requestl=4018&tagid=0&pf=in&si=831780362&ev=6.0.408.408&aver_flag=0&traffic=&ip_filter=0&ufc_filter=5]
    [HTTP request 1/1]
    [Response in frame: 380]

No.     Time               Source                Destination           Protocol Length Info
    354 09:03:41.136317    10.106.129.54         125.39.213.73         HTTP     483    GET /livemsg?o=392&adtype=LD&soid=+jbGb4oAWv8HYgKQlgL6NevRAZuQ&r90=1&l=4018&refluence=4018&requestl=4018&tagid=0&pf=in&si=831780362&ev=6.0.408.408&aver_flag=0&traffic=&ip_filter=0&ufc_filter=55&backfunnel=401&use_axp=0&axpheader=1&use_txp=0&txpheader=1&st_id_t=0&flow_reuse=1&ping_data=dXBfdmVyc2lvbj1WNi4wLjQwOC40MDg=&vid=p0654q7wpej&pf_ex=pc&live=0&channelId=1&page=coolOpen&aid_tpid=28&aid_tpid2=1150&aid_tpid3=11667&aid_dura=220&aid_vid_drm=0&aid_copyright=107&aid_vip_type=1&url=https://v.qq.com/tech&from=0&pf=in&v=3.5.52&dura=&coverid=&vptag=www_baidu_com|v_tech_new:img&oadid=4018&lcount=3&t=0&pf_ex=pc&tpid=28&chid=0 HTTP/1.1 

Frame 354: 483 bytes on wire (3864 bits), 483 bytes captured (3864 bits) on interface 0
Ethernet II, Src: AsustekC_34:f3:aa (9c:5c:8e:34:f3:aa), Dst: Hangzhou_75:c8:f5 (74:25:8a:75:c8:f5)
Internet Protocol Version 4, Src: 10.106.129.54, Dst: 125.39.213.73
Transmission Control Protocol, Src Port: 20389 (20389), Dst Port: 80 (80), Seq: 2881, Ack: 1, Len: 429
[3 Reassembled TCP Segments (3309 bytes): #352(1440), #353(1440), #354(429)]
Hypertext Transfer Protocol
     [truncated]GET /livemsg?o=392&adtype=LD&soid=+jbGb4oAWv8HYgKQlgL6NevRAZuQ&r90=1&l=4018&refluence=4018&requestl=4018&tagid=0&pf=in&si=831780362&ev=6.0.408.408&aver_flag=0&traffic=&ip_filter=0&ufc_filter=55&backfunnel=401&use_axp=0&axpheade
    Host: livep.l.qq.com\r\n
    Connection: keep-alive\r\n
    User-Agent: Mozilla/5.0 (Windows NT 10.0; Win64; x64) AppleWebKit/537.36 (KHTML, like Gecko) Chrome/66.0.3359.139 Safari/537.36\r\n
    Accept: image/webp,image/apng,image/*,*/*;q=0.8\r\n
    Accept-Encoding: gzip, deflate\r\n
    Accept-Language: en-US,en;q=0.9,zh-TW;q=0.8,zh;q=0.7\r\n
     [truncated]Cookie: pgv_pvi=7659522048; pgv_si=s3813394432; RK=Olbs95KBUg; ptcz=2544f6f4ae92c346d1b59688e6f45a925ec0f9f8ef06a7a39332f6f8fe201348; _qpsvr_localtk=0.32806539237918764; tvfe_boss_uuid=3cdb9e54c3859a7f; appuser=3B22E15EAE54C942
    \r\n
    [Full request URI [truncated]: http://livep.l.qq.com/livemsg?o=392&adtype=LD&soid=+jbGb4oAWv8HYgKQlgL6NevRAZuQ&r90=1&l=4018&refluence=4018&requestl=4018&tagid=0&pf=in&si=831780362&ev=6.0.408.408&aver_flag=0&traffic=&ip_filter=0&ufc_filter=5]
    [HTTP request 1/1]
    [Response in frame: 386]

No.     Time               Source                Destination           Protocol Length Info
    357 09:03:41.137375    125.39.213.73         10.106.129.54         HTTP     326    HTTP/1.1 200 OK  (text/html)

Frame 357: 326 bytes on wire (2608 bits), 326 bytes captured (2608 bits) on interface 0
Ethernet II, Src: Hangzhou_75:c8:f5 (74:25:8a:75:c8:f5), Dst: AsustekC_34:f3:aa (9c:5c:8e:34:f3:aa)
Internet Protocol Version 4, Src: 125.39.213.73, Dst: 10.106.129.54
Transmission Control Protocol, Src Port: 80 (80), Dst Port: 20377 (20377), Seq: 1, Ack: 3337, Len: 272
Hypertext Transfer Protocol
    HTTP/1.1 200 OK\r\n
    Date: Fri, 18 May 2018 09:03:30 GMT\r\n
    Content-Type: text/html; charset=GB2312\r\n
    Transfer-Encoding: chunked\r\n
    Connection: keep-alive\r\n
    Cache-Control: no-cache\r\n
    Set-Cookie: short_video=; Domain=.l.qq.com; Path=/; Expires=Thu, 01 Jan 1970 08:00:00 GMT;\r\n
    \r\n
    [HTTP response 1/2]
    [Time since request: 0.009170000 seconds]
    [Request in frame: 332]
    [Next request in frame: 367]
    [Next response in frame: 402]
    HTTP chunked response
Line-based text data: text/html

No.     Time               Source                Destination           Protocol Length Info
    364 09:03:41.139792    10.106.129.54         125.39.213.73         HTTP     483    GET /livemsg?o=392&adtype=LD&soid=+jbGb4oAWv8HYgKQlgOitQkGAZuQ&r90=1&l=4018&refluence=4018&requestl=4018&tagid=0&pf=in&si=831780362&ev=6.0.408.408&aver_flag=0&traffic=&ip_filter=0&ufc_filter=55&backfunnel=401&use_axp=0&axpheader=1&use_txp=0&txpheader=1&st_id_t=0&flow_reuse=1&ping_data=dXBfdmVyc2lvbj1WNi4wLjQwOC40MDg=&vid=p0654q7wpej&pf_ex=pc&live=0&channelId=1&page=coolOpen&aid_tpid=28&aid_tpid2=1150&aid_tpid3=11667&aid_dura=220&aid_vid_drm=0&aid_copyright=107&aid_vip_type=1&url=https://v.qq.com/tech&from=0&pf=in&v=3.5.52&dura=&coverid=&vptag=www_baidu_com|v_tech_new:img&oadid=4018&lcount=4&t=0&pf_ex=pc&tpid=28&chid=0 HTTP/1.1 

Frame 364: 483 bytes on wire (3864 bits), 483 bytes captured (3864 bits) on interface 0
Ethernet II, Src: AsustekC_34:f3:aa (9c:5c:8e:34:f3:aa), Dst: Hangzhou_75:c8:f5 (74:25:8a:75:c8:f5)
Internet Protocol Version 4, Src: 10.106.129.54, Dst: 125.39.213.73
Transmission Control Protocol, Src Port: 20390 (20390), Dst Port: 80 (80), Seq: 2881, Ack: 1, Len: 429
[3 Reassembled TCP Segments (3309 bytes): #362(1440), #363(1440), #364(429)]
Hypertext Transfer Protocol
     [truncated]GET /livemsg?o=392&adtype=LD&soid=+jbGb4oAWv8HYgKQlgOitQkGAZuQ&r90=1&l=4018&refluence=4018&requestl=4018&tagid=0&pf=in&si=831780362&ev=6.0.408.408&aver_flag=0&traffic=&ip_filter=0&ufc_filter=55&backfunnel=401&use_axp=0&axpheade
    Host: livep.l.qq.com\r\n
    Connection: keep-alive\r\n
    User-Agent: Mozilla/5.0 (Windows NT 10.0; Win64; x64) AppleWebKit/537.36 (KHTML, like Gecko) Chrome/66.0.3359.139 Safari/537.36\r\n
    Accept: image/webp,image/apng,image/*,*/*;q=0.8\r\n
    Accept-Encoding: gzip, deflate\r\n
    Accept-Language: en-US,en;q=0.9,zh-TW;q=0.8,zh;q=0.7\r\n
     [truncated]Cookie: pgv_pvi=7659522048; pgv_si=s3813394432; RK=Olbs95KBUg; ptcz=2544f6f4ae92c346d1b59688e6f45a925ec0f9f8ef06a7a39332f6f8fe201348; _qpsvr_localtk=0.32806539237918764; tvfe_boss_uuid=3cdb9e54c3859a7f; appuser=3B22E15EAE54C942
    \r\n
    [Full request URI [truncated]: http://livep.l.qq.com/livemsg?o=392&adtype=LD&soid=+jbGb4oAWv8HYgKQlgOitQkGAZuQ&r90=1&l=4018&refluence=4018&requestl=4018&tagid=0&pf=in&si=831780362&ev=6.0.408.408&aver_flag=0&traffic=&ip_filter=0&ufc_filter=5]
    [HTTP request 1/1]
    [Response in frame: 399]

No.     Time               Source                Destination           Protocol Length Info
    367 09:03:41.140058    10.106.129.54         125.39.213.73         HTTP     483    GET /livemsg?o=392&adtype=LD&soid=+jbGb4oAWv8HYgKQlgTpPjdMAZuQ&r90=1&l=4018&refluence=4018&requestl=4018&tagid=0&pf=in&si=831780362&ev=6.0.408.408&aver_flag=0&traffic=&ip_filter=0&ufc_filter=55&backfunnel=401&use_axp=0&axpheader=1&use_txp=0&txpheader=1&st_id_t=0&flow_reuse=1&ping_data=dXBfdmVyc2lvbj1WNi4wLjQwOC40MDg=&vid=p0654q7wpej&pf_ex=pc&live=0&channelId=1&page=coolOpen&aid_tpid=28&aid_tpid2=1150&aid_tpid3=11667&aid_dura=220&aid_vid_drm=0&aid_copyright=107&aid_vip_type=1&url=https://v.qq.com/tech&from=0&pf=in&v=3.5.52&dura=&coverid=&vptag=www_baidu_com|v_tech_new:img&oadid=4018&lcount=5&t=0&pf_ex=pc&tpid=28&chid=0 HTTP/1.1 

Frame 367: 483 bytes on wire (3864 bits), 483 bytes captured (3864 bits) on interface 0
Ethernet II, Src: AsustekC_34:f3:aa (9c:5c:8e:34:f3:aa), Dst: Hangzhou_75:c8:f5 (74:25:8a:75:c8:f5)
Internet Protocol Version 4, Src: 10.106.129.54, Dst: 125.39.213.73
Transmission Control Protocol, Src Port: 20377 (20377), Dst Port: 80 (80), Seq: 6217, Ack: 278, Len: 429
[3 Reassembled TCP Segments (3309 bytes): #365(1440), #366(1440), #367(429)]
Hypertext Transfer Protocol
     [truncated]GET /livemsg?o=392&adtype=LD&soid=+jbGb4oAWv8HYgKQlgTpPjdMAZuQ&r90=1&l=4018&refluence=4018&requestl=4018&tagid=0&pf=in&si=831780362&ev=6.0.408.408&aver_flag=0&traffic=&ip_filter=0&ufc_filter=55&backfunnel=401&use_axp=0&axpheade
    Host: livep.l.qq.com\r\n
    Connection: keep-alive\r\n
    User-Agent: Mozilla/5.0 (Windows NT 10.0; Win64; x64) AppleWebKit/537.36 (KHTML, like Gecko) Chrome/66.0.3359.139 Safari/537.36\r\n
    Accept: image/webp,image/apng,image/*,*/*;q=0.8\r\n
    Accept-Encoding: gzip, deflate\r\n
    Accept-Language: en-US,en;q=0.9,zh-TW;q=0.8,zh;q=0.7\r\n
     [truncated]Cookie: pgv_pvi=7659522048; pgv_si=s3813394432; RK=Olbs95KBUg; ptcz=2544f6f4ae92c346d1b59688e6f45a925ec0f9f8ef06a7a39332f6f8fe201348; _qpsvr_localtk=0.32806539237918764; tvfe_boss_uuid=3cdb9e54c3859a7f; appuser=3B22E15EAE54C942
    \r\n
    [Full request URI [truncated]: http://livep.l.qq.com/livemsg?o=392&adtype=LD&soid=+jbGb4oAWv8HYgKQlgTpPjdMAZuQ&r90=1&l=4018&refluence=4018&requestl=4018&tagid=0&pf=in&si=831780362&ev=6.0.408.408&aver_flag=0&traffic=&ip_filter=0&ufc_filter=5]
    [HTTP request 2/2]
    [Prev request in frame: 332]
    [Response in frame: 402]

No.     Time               Source                Destination           Protocol Length Info
    380 09:03:41.144609    125.39.213.73         10.106.129.54         HTTP     234    HTTP/1.1 200 OK  (text/html)

Frame 380: 234 bytes on wire (1872 bits), 234 bytes captured (1872 bits) on interface 0
Ethernet II, Src: Hangzhou_75:c8:f5 (74:25:8a:75:c8:f5), Dst: AsustekC_34:f3:aa (9c:5c:8e:34:f3:aa)
Internet Protocol Version 4, Src: 125.39.213.73, Dst: 10.106.129.54
Transmission Control Protocol, Src Port: 80 (80), Dst Port: 20388 (20388), Seq: 1, Ack: 3310, Len: 180
Hypertext Transfer Protocol
    HTTP/1.1 200 OK\r\n
    Date: Fri, 18 May 2018 09:03:30 GMT\r\n
    Content-Type: text/html; charset=GB2312\r\n
    Transfer-Encoding: chunked\r\n
    Connection: keep-alive\r\n
    Cache-Control: no-cache\r\n
    \r\n
    [HTTP response 1/1]
    [Time since request: 0.008435000 seconds]
    [Request in frame: 351]
    HTTP chunked response
Line-based text data: text/html

No.     Time               Source                Destination           Protocol Length Info
    386 09:03:41.145567    125.39.213.73         10.106.129.54         HTTP     234    HTTP/1.1 200 OK  (text/html)

Frame 386: 234 bytes on wire (1872 bits), 234 bytes captured (1872 bits) on interface 0
Ethernet II, Src: Hangzhou_75:c8:f5 (74:25:8a:75:c8:f5), Dst: AsustekC_34:f3:aa (9c:5c:8e:34:f3:aa)
Internet Protocol Version 4, Src: 125.39.213.73, Dst: 10.106.129.54
Transmission Control Protocol, Src Port: 80 (80), Dst Port: 20389 (20389), Seq: 1, Ack: 3310, Len: 180
Hypertext Transfer Protocol
    HTTP/1.1 200 OK\r\n
    Date: Fri, 18 May 2018 09:03:30 GMT\r\n
    Content-Type: text/html; charset=GB2312\r\n
    Transfer-Encoding: chunked\r\n
    Connection: keep-alive\r\n
    Cache-Control: no-cache\r\n
    \r\n
    [HTTP response 1/1]
    [Time since request: 0.009250000 seconds]
    [Request in frame: 354]
    HTTP chunked response
Line-based text data: text/html

No.     Time               Source                Destination           Protocol Length Info
    390 09:03:41.145586    10.106.129.54         125.39.213.73         HTTP     483    GET /livemsg?o=392&adtype=LD&soid=+jbGb4oAWv8HYgKQlgWxvtWbAZuQ&r90=1&l=4018&refluence=4018&requestl=4018&tagid=0&pf=in&si=831780362&ev=6.0.408.408&aver_flag=0&traffic=&ip_filter=0&ufc_filter=55&backfunnel=401&use_axp=0&axpheader=1&use_txp=0&txpheader=1&st_id_t=0&flow_reuse=1&ping_data=dXBfdmVyc2lvbj1WNi4wLjQwOC40MDg=&vid=p0654q7wpej&pf_ex=pc&live=0&channelId=1&page=coolOpen&aid_tpid=28&aid_tpid2=1150&aid_tpid3=11667&aid_dura=220&aid_vid_drm=0&aid_copyright=107&aid_vip_type=1&url=https://v.qq.com/tech&from=0&pf=in&v=3.5.52&dura=&coverid=&vptag=www_baidu_com|v_tech_new:img&oadid=4018&lcount=6&t=0&pf_ex=pc&tpid=28&chid=0 HTTP/1.1 

Frame 390: 483 bytes on wire (3864 bits), 483 bytes captured (3864 bits) on interface 0
Ethernet II, Src: AsustekC_34:f3:aa (9c:5c:8e:34:f3:aa), Dst: Hangzhou_75:c8:f5 (74:25:8a:75:c8:f5)
Internet Protocol Version 4, Src: 10.106.129.54, Dst: 125.39.213.73
Transmission Control Protocol, Src Port: 20391 (20391), Dst Port: 80 (80), Seq: 2881, Ack: 1, Len: 429
[3 Reassembled TCP Segments (3309 bytes): #388(1440), #389(1440), #390(429)]
Hypertext Transfer Protocol
     [truncated]GET /livemsg?o=392&adtype=LD&soid=+jbGb4oAWv8HYgKQlgWxvtWbAZuQ&r90=1&l=4018&refluence=4018&requestl=4018&tagid=0&pf=in&si=831780362&ev=6.0.408.408&aver_flag=0&traffic=&ip_filter=0&ufc_filter=55&backfunnel=401&use_axp=0&axpheade
    Host: livep.l.qq.com\r\n
    Connection: keep-alive\r\n
    User-Agent: Mozilla/5.0 (Windows NT 10.0; Win64; x64) AppleWebKit/537.36 (KHTML, like Gecko) Chrome/66.0.3359.139 Safari/537.36\r\n
    Accept: image/webp,image/apng,image/*,*/*;q=0.8\r\n
    Accept-Encoding: gzip, deflate\r\n
    Accept-Language: en-US,en;q=0.9,zh-TW;q=0.8,zh;q=0.7\r\n
     [truncated]Cookie: pgv_pvi=7659522048; pgv_si=s3813394432; RK=Olbs95KBUg; ptcz=2544f6f4ae92c346d1b59688e6f45a925ec0f9f8ef06a7a39332f6f8fe201348; _qpsvr_localtk=0.32806539237918764; tvfe_boss_uuid=3cdb9e54c3859a7f; appuser=3B22E15EAE54C942
    \r\n
    [Full request URI [truncated]: http://livep.l.qq.com/livemsg?o=392&adtype=LD&soid=+jbGb4oAWv8HYgKQlgWxvtWbAZuQ&r90=1&l=4018&refluence=4018&requestl=4018&tagid=0&pf=in&si=831780362&ev=6.0.408.408&aver_flag=0&traffic=&ip_filter=0&ufc_filter=5]
    [HTTP request 1/1]
    [Response in frame: 415]

No.     Time               Source                Destination           Protocol Length Info
    399 09:03:41.148851    125.39.213.73         10.106.129.54         HTTP     234    HTTP/1.1 200 OK  (text/html)

Frame 399: 234 bytes on wire (1872 bits), 234 bytes captured (1872 bits) on interface 0
Ethernet II, Src: Hangzhou_75:c8:f5 (74:25:8a:75:c8:f5), Dst: AsustekC_34:f3:aa (9c:5c:8e:34:f3:aa)
Internet Protocol Version 4, Src: 125.39.213.73, Dst: 10.106.129.54
Transmission Control Protocol, Src Port: 80 (80), Dst Port: 20390 (20390), Seq: 1, Ack: 3310, Len: 180
Hypertext Transfer Protocol
    HTTP/1.1 200 OK\r\n
    Date: Fri, 18 May 2018 09:03:30 GMT\r\n
    Content-Type: text/html; charset=GB2312\r\n
    Transfer-Encoding: chunked\r\n
    Connection: keep-alive\r\n
    Cache-Control: no-cache\r\n
    \r\n
    [HTTP response 1/1]
    [Time since request: 0.009059000 seconds]
    [Request in frame: 364]
    HTTP chunked response
Line-based text data: text/html

No.     Time               Source                Destination           Protocol Length Info
    402 09:03:41.149690    125.39.213.73         10.106.129.54         HTTP     234    HTTP/1.1 200 OK  (text/html)

Frame 402: 234 bytes on wire (1872 bits), 234 bytes captured (1872 bits) on interface 0
Ethernet II, Src: Hangzhou_75:c8:f5 (74:25:8a:75:c8:f5), Dst: AsustekC_34:f3:aa (9c:5c:8e:34:f3:aa)
Internet Protocol Version 4, Src: 125.39.213.73, Dst: 10.106.129.54
Transmission Control Protocol, Src Port: 80 (80), Dst Port: 20377 (20377), Seq: 278, Ack: 6646, Len: 180
Hypertext Transfer Protocol
    HTTP/1.1 200 OK\r\n
    Date: Fri, 18 May 2018 09:03:30 GMT\r\n
    Content-Type: text/html; charset=GB2312\r\n
    Transfer-Encoding: chunked\r\n
    Connection: keep-alive\r\n
    Cache-Control: no-cache\r\n
    \r\n
    [HTTP response 2/2]
    [Time since request: 0.009632000 seconds]
    [Prev request in frame: 332]
    [Prev response in frame: 357]
    [Request in frame: 367]
    HTTP chunked response
Line-based text data: text/html

No.     Time               Source                Destination           Protocol Length Info
    415 09:03:41.154319    125.39.213.73         10.106.129.54         HTTP     234    HTTP/1.1 200 OK  (text/html)

Frame 415: 234 bytes on wire (1872 bits), 234 bytes captured (1872 bits) on interface 0
Ethernet II, Src: Hangzhou_75:c8:f5 (74:25:8a:75:c8:f5), Dst: AsustekC_34:f3:aa (9c:5c:8e:34:f3:aa)
Internet Protocol Version 4, Src: 125.39.213.73, Dst: 10.106.129.54
Transmission Control Protocol, Src Port: 80 (80), Dst Port: 20391 (20391), Seq: 1, Ack: 3310, Len: 180
Hypertext Transfer Protocol
    HTTP/1.1 200 OK\r\n
    Date: Fri, 18 May 2018 09:03:30 GMT\r\n
    Content-Type: text/html; charset=GB2312\r\n
    Transfer-Encoding: chunked\r\n
    Connection: keep-alive\r\n
    Cache-Control: no-cache\r\n
    \r\n
    [HTTP response 1/1]
    [Time since request: 0.008733000 seconds]
    [Request in frame: 390]
    HTTP chunked response
Line-based text data: text/html

No.     Time               Source                Destination           Protocol Length Info
    429 09:03:41.167059    10.106.129.54         125.39.213.73         HTTP     510    GET /livemsg?o=392&adtype=KB&soid=+jbGb4oAWv8HYgKQlgD5AH0DAZuQ&r90=1&l=4018&refluence=4018&requestl=4018&tagid=0&pf=in&si=831780362&ev=6.0.408.408&aver_flag=6148&traffic=&ip_filter=0&ufc_filter=63&ufc_stra=0&ufc_match=63&backfunnel=401&use_axp=0&axpheader=1&use_txp=0&txpheader=1&st_id_t=0&flow_reuse=1&ping_data=dXBfdmVyc2lvbj1WNi4wLjQwOC40MDg=&vid=p0654q7wpej&pf_ex=pc&live=0&channelId=1&page=coolOpen&aid_tpid=28&aid_tpid2=1150&aid_tpid3=11667&aid_dura=220&aid_vid_drm=0&aid_copyright=107&aid_vip_type=1&url=https://v.qq.com/tech&from=0&pf=in&v=3.5.52&dura=&coverid=&vptag=www_baidu_com|v_tech_new:img&oadid=4018&lcount=1&t=0&pf_ex=pc&tpid=28&chid=0 HTTP/1.1 

Frame 429: 510 bytes on wire (4080 bits), 510 bytes captured (4080 bits) on interface 0
Ethernet II, Src: AsustekC_34:f3:aa (9c:5c:8e:34:f3:aa), Dst: Hangzhou_75:c8:f5 (74:25:8a:75:c8:f5)
Internet Protocol Version 4, Src: 10.106.129.54, Dst: 125.39.213.73
Transmission Control Protocol, Src Port: 20392 (20392), Dst Port: 80 (80), Seq: 2881, Ack: 1, Len: 456
[3 Reassembled TCP Segments (3336 bytes): #427(1440), #428(1440), #429(456)]
Hypertext Transfer Protocol
     [truncated]GET /livemsg?o=392&adtype=KB&soid=+jbGb4oAWv8HYgKQlgD5AH0DAZuQ&r90=1&l=4018&refluence=4018&requestl=4018&tagid=0&pf=in&si=831780362&ev=6.0.408.408&aver_flag=6148&traffic=&ip_filter=0&ufc_filter=63&ufc_stra=0&ufc_match=63&backfu
    Host: livep.l.qq.com\r\n
    Connection: keep-alive\r\n
    User-Agent: Mozilla/5.0 (Windows NT 10.0; Win64; x64) AppleWebKit/537.36 (KHTML, like Gecko) Chrome/66.0.3359.139 Safari/537.36\r\n
    Accept: image/webp,image/apng,image/*,*/*;q=0.8\r\n
    Accept-Encoding: gzip, deflate\r\n
    Accept-Language: en-US,en;q=0.9,zh-TW;q=0.8,zh;q=0.7\r\n
     [truncated]Cookie: pgv_pvi=7659522048; pgv_si=s3813394432; RK=Olbs95KBUg; ptcz=2544f6f4ae92c346d1b59688e6f45a925ec0f9f8ef06a7a39332f6f8fe201348; _qpsvr_localtk=0.32806539237918764; tvfe_boss_uuid=3cdb9e54c3859a7f; appuser=3B22E15EAE54C942
    \r\n
    [Full request URI [truncated]: http://livep.l.qq.com/livemsg?o=392&adtype=KB&soid=+jbGb4oAWv8HYgKQlgD5AH0DAZuQ&r90=1&l=4018&refluence=4018&requestl=4018&tagid=0&pf=in&si=831780362&ev=6.0.408.408&aver_flag=6148&traffic=&ip_filter=0&ufc_filte]
    [HTTP request 1/2]
    [Next request in frame: 10722]

No.     Time               Source                Destination           Protocol Length Info
    453 09:03:41.224110    10.106.129.54         60.10.117.125         HTTP     696    GET /p0654q7wpej.p703.1.mp4?sdtfrom=v1105&guid=8cac8c1cdb2011882bd4fa2e4f586fc0&vkey=AC217032B5B84D97D281312A86A6F9F8D5D96939E501B56E545490BE534452C397DE1FA074E7F762AF8EAADA981CA2C6D75EFE4C2FE5B9A8C8F0E9DD130A7C72F6347877A162D67CEE41447D4FA063E894228244E336C61EC0D0708275B4DFE8BC2CD0F15E54A5A1866F5D20D25B35C8ADDE40623E0C9C7B HTTP/1.1 

Frame 453: 696 bytes on wire (5568 bits), 696 bytes captured (5568 bits) on interface 0
Ethernet II, Src: AsustekC_34:f3:aa (9c:5c:8e:34:f3:aa), Dst: Hangzhou_75:c8:f5 (74:25:8a:75:c8:f5)
Internet Protocol Version 4, Src: 10.106.129.54, Dst: 60.10.117.125
Transmission Control Protocol, Src Port: 20393 (20393), Dst Port: 80 (80), Seq: 1, Ack: 1, Len: 642
Hypertext Transfer Protocol
     [truncated]GET /p0654q7wpej.p703.1.mp4?sdtfrom=v1105&guid=8cac8c1cdb2011882bd4fa2e4f586fc0&vkey=AC217032B5B84D97D281312A86A6F9F8D5D96939E501B56E545490BE534452C397DE1FA074E7F762AF8EAADA981CA2C6D75EFE4C2FE5B9A8C8F0E9DD130A7C72F6347877A162D6
    Host: ugcdl.video.gtimg.com\r\n
    Connection: keep-alive\r\n
    Accept-Encoding: identity;q=1, *;q=0\r\n
    User-Agent: Mozilla/5.0 (Windows NT 10.0; Win64; x64) AppleWebKit/537.36 (KHTML, like Gecko) Chrome/66.0.3359.139 Safari/537.36\r\n
    Accept: */*\r\n
    Accept-Language: en-US,en;q=0.9,zh-TW;q=0.8,zh;q=0.7\r\n
    Range: bytes=0-\r\n
    \r\n
    [Full request URI [truncated]: http://ugcdl.video.gtimg.com/p0654q7wpej.p703.1.mp4?sdtfrom=v1105&guid=8cac8c1cdb2011882bd4fa2e4f586fc0&vkey=AC217032B5B84D97D281312A86A6F9F8D5D96939E501B56E545490BE534452C397DE1FA074E7F762AF8EAADA981CA2C6D75E]
    [HTTP request 1/1]
    [Response in frame: 478]

No.     Time               Source                Destination           Protocol Length Info
    478 09:03:41.260430    60.10.117.125         10.106.129.54         TCP      74     [TCP segment of a reassembled PDU]

Frame 478: 74 bytes on wire (592 bits), 74 bytes captured (592 bits) on interface 0
Ethernet II, Src: Hangzhou_75:c8:f5 (74:25:8a:75:c8:f5), Dst: AsustekC_34:f3:aa (9c:5c:8e:34:f3:aa)
Internet Protocol Version 4, Src: 60.10.117.125, Dst: 10.106.129.54
Transmission Control Protocol, Src Port: 80 (80), Dst Port: 20393 (20393), Seq: 1, Ack: 643, Len: 1460

No.     Time               Source                Destination           Protocol Length Info
   1205 09:03:41.310893    60.10.117.125         10.106.129.54         HTTP     74     Continuation

Frame 1205: 74 bytes on wire (592 bits), 74 bytes captured (592 bits) on interface 0
Ethernet II, Src: Hangzhou_75:c8:f5 (74:25:8a:75:c8:f5), Dst: AsustekC_34:f3:aa (9c:5c:8e:34:f3:aa)
Internet Protocol Version 4, Src: 60.10.117.125, Dst: 10.106.129.54
Transmission Control Protocol, Src Port: 80 (80), Dst Port: 20393 (20393), Seq: 423009, Ack: 643, Len: 1460
Hypertext Transfer Protocol
     [truncated]A:\313U\316w\225\273\240u\017:\352\326"UP\234\002\332\3536\216!KfH\371L\267^\241\235b\341:\333\372\030\376\035\3470cU\357~\242\230\310\343J\336\307\350\b\217\006\211\212\222\321i~\231\270%-\334\036G\254\335\255\330f\211\272\366
    Data (1268 bytes)

0000  4f 04 52 ca f4 1e 55 ce 6c d2 4b d6 f5 ab 0f 0f   O.R...U.l.K.....
0010  c8 fb 0d 07 62 b2 23 f3 ab 87 91 6b 4d fa 24 bd   ....b.#....kM.$.
0020  c6 c2 e8 88 a8 98 67 b4 c5 65 9c 6f ba eb 7c 55   ......g..e.o..|U
0030  67 13 9d 2c 65 65 cf 60 f7 65 c5 69 84 d8 ed 4d   g..,ee.`.e.i...M
0040  a5 e1 da 71 0c b6 47 b1 51 da 6a 05 d8 11 b9 c3   ...q..G.Q.j.....
0050  04 39 da 43 52 f3 c5 3f 3c 4c ef 43 47 d8 ad 19   .9.CR..?<L.CG...
0060  e4 b9 95 9d 78 9c 78 b0 c1 22 53 25 51 f0 79 2c   ....x.x.."S%Q.y,
0070  3c 80 f1 6a c0 10 17 91 94 21 95 39 a3 86 b2 9b   <..j.....!.9....
0080  ce 88 1e 44 b5 79 13 14 d5 90 af 7a dd c1 3d 75   ...D.y.....z..=u
0090  11 c4 14 56 87 58 1e 15 2b 45 21 52 0b 04 a6 5a   ...V.X..+E!R...Z
00a0  63 66 fe 24 ac 83 40 62 8d 89 16 47 88 78 fb 49   cf.$..@b...G.x.I
00b0  5d a3 b9 00 00 03 d7 41 9e 84 22 88 96 ed ff 65   ]......A.."....e
00c0  f3 8c 62 9a 67 c3 a9 2c 21 ca 70 f7 eb 67 b2 ca   ..b.g..,!.p..g..
00d0  a0 d9 d7 32 72 91 48 55 e4 11 4b 8a 01 28 5e 85   ...2r.HU..K..(^.
00e0  fe 42 7a ae 8f b2 c3 95 87 87 30 10 4b b3 6d b4   .Bz.......0.K.m.
00f0  62 bc a0 4f a9 61 b7 27 e7 24 75 40 b5 c9 0c 8e   b..O.a.'.$u@....
0100  6b 19 56 91 f3 b8 b7 33 e5 32 8c ba 75 05 ce a4   k.V....3.2..u...
0110  f4 7c f9 d0 25 73 e1 73 b6 ae 9e 87 e1 71 c6 09   .|..%s.s.....q..
0120  71 86 6f 4b 82 bd 7c 8a e8 82 5c f6 65 cf c8 ca   q.oK..|...\.e...
0130  da af 02 28 7e f7 24 44 55 1c 9f 5a ae 54 a6 ee   ...(~.$DU..Z.T..
0140  0e 0d 91 56 e8 48 15 db f3 31 5d 04 d2 cd d5 99   ...V.H...1].....
0150  d4 b2 9b 30 29 6e 67 33 a2 f3 e2 8a f5 3f 83 85   ...0)ng3.....?..
0160  12 df 86 bd 6b 99 f8 c8 90 da 28 e4 bb 42 f8 62   ....k.....(..B.b
0170  53 9a 32 7f de 93 7c 82 fa 0d 4c 81 5d da d2 3c   S.2...|...L.]..<
0180  e9 36 6a 72 31 2d 90 95 0b b4 34 e9 ba f6 3c e8   .6jr1-....4...<.
0190  4a c6 58 b9 c0 98 ee fe 5c 71 e5 2b 2f 61 94 f2   J.X.....\q.+/a..
01a0  26 09 aa 10 35 be 03 82 ed 40 b8 5c 88 69 f1 95   &...5....@.\.i..
01b0  4f fe 22 df 09 23 0c a2 e7 6b 1a 04 95 4b 03 bf   O."..#...k...K..
01c0  69 96 3c 4a 8e 55 35 f7 df 8b ca cb 15 c2 14 e2   i.<J.U5.........
01d0  f8 8d 81 f1 7b 70 46 43 bc 80 0f 75 73 47 32 0e   ....{pFC...usG2.
01e0  f6 7c 01 4c c4 c0 1f 79 b3 f6 23 2f 05 e2 55 26   .|.L...y..#/..U&
01f0  74 5e 2f ae 70 d4 cc dc 02 07 c6 a4 ec 33 b5 49   t^/.p........3.I
0200  23 49 f8 20 42 2c f9 83 e8 85 30 51 ed d8 5b 39   #I. B,....0Q..[9
0210  72 69 cd 95 6e 94 4b 36 f0 bb 67 15 2b 15 2f 49   ri..n.K6..g.+./I
0220  fa 67 a1 ff 22 f9 60 46 7f e1 a1 d3 8a 33 e0 21   .g..".`F.....3.!
0230  7f f6 18 79 6e 1a 04 dc f8 d6 d8 d9 88 8d 05 b2   ...yn...........
0240  40 a9 94 ca 48 0a 0b a0 00 78 f1 5e 00 c1 4e bb   @...H....x.^..N.
0250  10 63 b2 29 7a a6 01 24 1f c9 3d 7e ac 7a bd b5   .c.)z..$..=~.z..
0260  82 2e 40 fb 10 f6 35 d5 f2 14 b8 98 d0 f0 51 3b   ..@...5.......Q;
0270  1a 2e ce 4a f7 e3 9f a3 08 f6 45 63 39 d0 f1 d6   ...J......Ec9...
0280  a0 d6 ec d4 5f fb e1 2c 67 99 eb 01 92 c2 91 5f   ...._..,g......_
0290  67 be 36 95 51 79 a2 af 08 72 d3 bb af 00 c1 48   g.6.Qy...r.....H
02a0  f7 5b 76 93 e7 c0 8c 8b dc 6f 55 45 71 1d aa 78   .[v......oUEq..x
02b0  8e 17 86 6b ed a8 92 b0 42 94 00 c8 83 b2 34 1a   ...k....B.....4.
02c0  4c 1a 15 a2 93 37 3f 55 3e 9b a7 9c 82 9d 5b 29   L....7?U>.....[)
02d0  19 c8 15 a9 74 0e 09 4b f7 f1 0b 82 7e 00 83 aa   ....t..K....~...
02e0  c5 76 02 81 3f 20 de 64 1e e3 7c bb 73 48 65 df   .v..? .d..|.sHe.
02f0  1a f9 db c8 63 25 e4 07 dc e5 91 6f bd 8d cd 67   ....c%.....o...g
0300  9c c7 4b 21 e5 9f 49 f4 ff da eb d6 e1 36 b7 25   ..K!..I......6.%
0310  31 62 d7 a7 5e 51 f5 a9 78 5f 7f 2f 54 d3 a3 a4   1b..^Q..x_./T...
0320  0c e8 79 9c 8f 15 f2 d7 1e 2b 4a 94 32 20 0c c4   ..y......+J.2 ..
0330  a0 94 fb 97 7e 51 fc ec 06 cf f8 13 85 50 6b 41   ....~Q.......PkA
0340  33 92 e6 3d c8 ad ca a4 73 c9 9e c3 67 2c b1 fa   3..=....s...g,..
0350  98 11 48 3c 36 ff 1d 5b f5 f8 8a 3b 66 90 90 10   ..H<6..[...;f...
0360  bb 67 76 a6 5d 8f 1d 59 d2 df 76 6a 6b 09 ad db   .gv.]..Y..vjk...
0370  da 12 68 34 95 d0 9f e6 a7 bc 53 af 7c 16 42 dc   ..h4......S.|.B.
0380  bb 2c 93 1b f8 b6 b5 b5 af e7 f2 18 8f 6d 4a 41   .,...........mJA
0390  99 10 a4 19 6c a2 c3 fd 20 23 4b 08 ab b5 52 c2   ....l... #K...R.
03a0  01 d6 50 f3 d1 7e 65 fb f3 44 f1 fc 29 98 f3 e3   ..P..~e..D..)...
03b0  75 29 41 c1 11 21 05 c0 2c 94 91 5e 3a 87 e9 b6   u)A..!..,..^:...
03c0  9b 68 70 ac 96 b4 1d 59 7e e9 8a d9 d5 b0 af 8b   .hp....Y~.......
03d0  10 88 2d 57 55 f5 d8 1b 0b fe 25 64 d5 dc ec 31   ..-WU.....%d...1
03e0  0b 7d 2b ab 32 bd 56 ff a8 dd 45 27 27 94 7b 28   .}+.2.V...E''.{(
03f0  c2 de ab 26 4a 84 62 31 51 4d 99 4a ae 5f 97 6d   ...&J.b1QM.J._.m
0400  33 df 40 b9 ce 53 3d 73 5a f6 e9 d4 36 44 4d 38   3.@..S=sZ...6DM8
0410  ee e6 ac 71 da e4 9c f3 c0 1c 52 c2 b4 a1 86 e5   ...q......R.....
0420  68 69 a1 57 50 28 89 c7 fd ca 76 4c 41 4d 2a f8   hi.WP(....vLAM*.
0430  8b 0a db 81 3f 4f 4c d8 e7 6e 8b ae ce 84 85 39   ....?OL..n.....9
0440  58 e0 93 a7 3e 68 33 b3 99 e8 c3 81 24 bc 5d 1a   X...>h3.....$.].
0450  1e c0 91 88 b9 0e 1f 9c b6 68 d5 4d 46 21 3b 6a   .........h.MF!;j
0460  97 06 c8 9a ad 5c 3d 34 e0 5e f0 01 97 05 4c cf   .....\=4.^....L.
0470  44 ac 07 b7 33 3d bf a1 6b 3a a5 19 47 02 3a 3f   D...3=..k:..G.:?
0480  88 a2 e6 5d d1 77 a6 d6 02 75 1a d6 3d 2a 00 00   ...].w...u..=*..
0490  00 fc 01 9e a3 3a 26 b7 03 35 ae ae 27 e8 34 01   .....:&..5..'.4.
04a0  fc db f5 28 4f a9 23 9c 0b 03 e6 e2 81 47 72 15   ...(O.#......Gr.
04b0  8d ca 5c 3e b5 94 81 fb 97 e7 b1 57 50 a1 f2 5a   ..\>.......WP..Z
04c0  ae ca 07 25 e1 34 b1 8c d6 fc 3e 73 fb ec 0a cf   ...%.4....>s....
04d0  df 41 a2 05 01 ce bc be b9 6c b3 a5 76 1e 9d 21   .A.......l..v..!
04e0  d5 89 4d f0 61 50 41 08 c8 2d 58 17 af 1b f4 8b   ..M.aPA..-X.....
04f0  4c fd 35 02                                       L.5.

No.     Time               Source                Destination           Protocol Length Info
   3341 09:03:41.426492    60.10.117.125         10.106.129.54         HTTP     74     Continuation

Frame 3341: 74 bytes on wire (592 bits), 74 bytes captured (592 bits) on interface 0
Ethernet II, Src: Hangzhou_75:c8:f5 (74:25:8a:75:c8:f5), Dst: AsustekC_34:f3:aa (9c:5c:8e:34:f3:aa)
Internet Protocol Version 4, Src: 60.10.117.125, Dst: 10.106.129.54
Transmission Control Protocol, Src Port: 80 (80), Dst Port: 20393 (20393), Seq: 1553049, Ack: 643, Len: 1460
Hypertext Transfer Protocol
    :\024\v\312F\003\304TYm\365D\207\375\353W\027\270\272L\225\257p\332\244\327\351\331+\000\000\020kK6 \314\n
    Data (1422 bytes)

0000  0e 2c 85 67 da 4e 31 1d bc 23 c1 cf 20 84 b1 95   .,.g.N1..#.. ...
0010  8e 6b a9 df 4d 87 3d 59 30 d2 19 0b b1 31 61 18   .k..M.=Y0....1a.
0020  15 4a 65 5e 87 08 c9 8e 53 8e d2 6a 46 60 5a 47   .Je^....S..jF`ZG
0030  43 a2 e2 24 13 cf 2b 8e 4c 98 2c 00 00 30 d6 e5   C..$..+.L.,..0..
0040  7e 5e 5b c9 ac fe 76 21 92 56 d8 9d a6 db 84 dc   ~^[...v!.V......
0050  8a 56 a8 6b 8a 42 57 ec 49 74 5c 03 32 f0 4f c1   .V.k.BW.It\.2.O.
0060  53 59 44 c0 12 09 01 94 63 01 b9 98 cf af 85 3a   SYD.....c......:
0070  06 1c 08 f3 9a 3d 0f af ac a1 a4 c6 56 62 4d 91   .....=......VbM.
0080  dd 80 12 d8 2c de 0c a7 be 48 a8 ec cf b8 68 19   ....,....H....h.
0090  f8 dd f1 94 39 45 c9 a9 88 e4 d9 21 c5 3f e4 f3   ....9E.....!.?..
00a0  41 03 4f 23 46 9d e8 d0 4e 61 ee b6 48 8c 19 4f   A.O#F...Na..H..O
00b0  cb 65 15 31 fa da c3 f6 d8 bb cd a2 a9 c9 31 cc   .e.1..........1.
00c0  0e 4c fd 98 10 9d cd db a8 68 4e 81 ec d7 73 76   .L.......hN...sv
00d0  5c 21 42 53 fc 65 d8 61 73 c5 88 6b 92 e1 cc 82   \!BS.e.as..k....
00e0  3d 67 60 20 13 a0 f4 bc 38 6b 2e be ac de c7 e5   =g` ....8k......
00f0  9b fe 44 7f f9 2d 44 a3 dc 7e 14 20 f1 03 9e 89   ..D..-D..~. ....
0100  d2 ed a9 08 55 ea 70 4e 72 0c 88 63 70 df d6 cd   ....U.pNr..cp...
0110  30 06 f3 b6 64 3c b8 9e 2b 8c e5 d0 3d 92 22 18   0...d<..+...=.".
0120  a3 7b 5f 67 80 b3 17 6b be 2f 5c ca 42 7f 9e 30   .{_g...k./\.B..0
0130  1a 4e 3f 07 14 d1 40 cb e8 4e 02 f8 35 be f5 2f   .N?...@..N..5../
0140  76 bd 42 b7 ab 21 c3 6b 5f a1 de 84 5e c7 5e 91   v.B..!.k_...^.^.
0150  7c 12 d3 2f 75 61 b7 64 f5 e3 53 ea 67 2b df dd   |../ua.d..S.g+..
0160  45 d0 8f 3b b5 84 88 fd 37 8b d3 9e f5 a0 7a ea   E..;....7.....z.
0170  9e 88 ab 41 8f 60 84 f7 6e 74 87 b6 6b 23 9b e2   ...A.`..nt..k#..
0180  4d 80 fe f1 ca a3 13 f0 b9 18 c2 5f cc df 62 24   M.........._..b$
0190  21 92 50 c8 54 e0 a8 f2 c7 1e 93 10 26 9f 5a 1c   !.P.T.......&.Z.
01a0  4b 2c 85 c1 4b c3 92 b1 24 db 2d 02 28 96 0b b9   K,..K...$.-.(...
01b0  ee 79 96 b1 e6 71 21 24 cd ff 2b 28 ff b5 9a 88   .y...q!$..+(....
01c0  7e 15 15 e6 a2 21 10 6e 0a 22 7f 38 56 ca f4 47   ~....!.n.".8V..G
01d0  a0 52 bc 96 53 17 0d 29 63 e7 62 3a d5 ff 33 b9   .R..S..)c.b:..3.
01e0  d5 ff 0d 37 a5 5a 84 af f4 ca 6b 00 a3 53 5d a4   ...7.Z....k..S].
01f0  73 6d 7e b3 b6 73 62 d6 52 d6 4a 44 ed 7f 7c 11   sm~..sb.R.JD..|.
0200  f1 59 52 8f 75 85 59 05 9b e8 fe 33 b5 59 ff fb   .YR.u.Y....3.Y..
0210  a8 0a 05 a4 88 72 c6 84 60 01 73 83 88 cf 76 75   .....r..`.s...vu
0220  6b 4e d8 b3 98 9f e7 7d 1b c7 da ae e8 d2 15 3f   kN.....}.......?
0230  6a b6 54 ef a3 5d 47 53 38 6f 3d ca 7a 03 47 d8   j.T..]GS8o=.z.G.
0240  06 fb 09 b6 e3 96 5a 66 72 54 db 80 df 37 82 08   ......ZfrT...7..
0250  32 86 93 fd e7 07 4e 0f 9c 50 f3 d3 1a 24 e1 6b   2.....N..P...$.k
0260  9f 92 0c 33 42 9b 48 f4 95 86 61 a3 08 f8 95 d8   ...3B.H...a.....
0270  4e d3 05 23 04 db 25 c6 12 7b 37 55 51 1e 37 26   N..#..%..{7UQ.7&
0280  f5 42 4f 74 2e 4e 6b 70 92 7e bc a6 c9 71 2e aa   .BOt.Nkp.~...q..
0290  90 54 e2 32 bc a8 7d d6 51 e5 00 a6 44 56 d4 79   .T.2..}.Q...DV.y
02a0  3d 87 dc 91 5e 79 e8 5b 42 16 fa ab 89 b2 06 3b   =...^y.[B......;
02b0  e3 0e 98 98 0d 9f e5 7c ec 71 ce b0 07 ae 01 71   .......|.q.....q
02c0  06 62 5f a4 32 d7 50 e2 d9 f8 5d e3 4e aa 02 c2   .b_.2.P...].N...
02d0  4f cf f8 00 92 6f 90 bc 04 64 07 47 1e e7 af 92   O....o...d.G....
02e0  de aa 70 d7 32 41 1f 4e 18 9c 95 63 61 c2 33 14   ..p.2A.N...ca.3.
02f0  6c 5e 8f c1 ed 13 48 7d 6c c7 3d 5a ee 88 9f 9f   l^....H}l.=Z....
0300  9f 4f 61 1a 37 0c aa 4a 7b d1 3f 55 47 83 c0 e1   .Oa.7..J{.?UG...
0310  48 7f 13 3a 09 4e 3a 58 cc bc e8 60 b1 1b 04 3f   H..:.N:X...`...?
0320  e4 7b 1e 81 d8 a5 b9 6d d1 b7 f8 66 56 32 76 fa   .{.....m...fV2v.
0330  8c 67 90 73 ee df c5 bb 21 12 87 7d 1d 43 c8 bd   .g.s....!..}.C..
0340  03 42 39 bc ca c9 00 53 53 dd 48 0c de 8f 6d e0   .B9....SS.H...m.
0350  d0 98 86 2d bc b0 53 dc f9 2b 2b 95 a9 48 0e fb   ...-..S..++..H..
0360  4d 2e 8a 57 1a 71 1e 6f 18 2e 88 e3 c7 6b 68 c7   M..W.q.o.....kh.
0370  0e 49 34 34 89 83 da d6 29 87 5f d3 85 fa 4c e5   .I44....)._...L.
0380  83 6a ac 63 69 c2 4a fc a5 9e bb 04 f3 f8 6e 49   .j.ci.J.......nI
0390  8e fa 0d 63 c5 ab e8 d5 e1 36 90 6e 18 5a 07 a7   ...c.....6.n.Z..
03a0  e2 9d eb b4 d9 b7 22 c3 95 44 e3 68 dd 1d e4 3b   ......"..D.h...;
03b0  dc d0 7d 8a db 3b 0c f9 18 40 73 22 dd 7d c3 e1   ..}..;...@s".}..
03c0  a3 fb 84 21 7e 45 11 f8 29 b4 3d 6e 56 07 60 0a   ...!~E..).=nV.`.
03d0  01 ef da e8 24 bd 95 64 05 d7 0e 87 dd dd af 11   ....$..d........
03e0  5e 86 7d 2f 08 86 a5 d4 ba ac 98 9e a3 81 2c 80   ^.}/..........,.
03f0  12 11 37 ef c9 c2 f5 ea f4 99 05 7a 4e c0 3f e0   ..7........zN.?.
0400  a4 19 f7 fd 2a 3e 7e cd 17 f7 81 e6 9e 94 09 87   ....*>~.........
0410  a6 f4 9a ea 9f 00 79 dd 0f e7 b3 6b 50 24 c6 1e   ......y....kP$..
0420  34 9e ef e3 89 01 da a8 0d bd b6 43 05 21 5c af   4..........C.!\.
0430  20 ba 10 4c 71 ce 3b 35 65 09 5c 60 be 37 2b 1e    ..Lq.;5e.\`.7+.
0440  bb 86 69 cc bb 24 14 13 cc 71 0f d1 63 78 30 ca   ..i..$...q..cx0.
0450  e1 4e 92 5d 00 0b a8 64 d9 ac bf 7a 49 4b a3 ed   .N.]...d...zIK..
0460  92 19 95 b7 60 62 9d 31 43 3c 1a fb 06 4b 0f d3   ....`b.1C<...K..
0470  28 ca 91 50 27 e0 12 54 96 37 e6 dc 33 1e 7d d0   (..P'..T.7..3.}.
0480  0d e2 76 ad de 37 7c e6 11 89 cf 8c c5 c0 6a 6c   ..v..7|.......jl
0490  24 ad 25 8b c7 66 a6 51 03 07 86 db 02 58 12 70   $.%..f.Q.....X.p
04a0  8f 1a 72 7d e3 ca 6d 32 ca 3b 85 1e e8 63 0e ec   ..r}..m2.;...c..
04b0  b4 5a 1f b6 6f 36 5b 45 cd 70 69 27 e2 eb 81 a0   .Z..o6[E.pi'....
04c0  e3 ff ea 33 1c 94 29 c2 a9 95 e2 3d 66 75 d7 9d   ...3..)....=fu..
04d0  af 45 c2 25 0c 72 43 71 60 14 8c 93 07 8e 31 65   .E.%.rCq`.....1e
04e0  20 51 19 17 82 4c 24 c1 06 6f a7 09 10 ef c6 7b    Q...L$..o.....{
04f0  70 bc bd 32 82 71 ef e6 90 bc 0c af 9d cb a2 4a   p..2.q.........J
0500  a5 40 e0 b8 2a 04 ba 76 6b 32 cb f5 92 1e 64 9f   .@..*..vk2....d.
0510  38 1c 32 39 1d 03 a0 20 90 b5 6f 2e b3 89 1f b5   8.29... ..o.....
0520  ab 8f 29 e5 a7 aa 3d b5 83 d6 1f 9e 40 40 b5 4e   ..)...=.....@@.N
0530  79 11 06 4f 73 7e a6 92 54 0f c6 64 74 11 54 f4   y..Os~..T..dt.T.
0540  99 bc 02 60 98 b7 c4 14 5f d7 ca 9f fa b5 87 45   ...`...._......E
0550  d0 eb 75 a5 31 ae 76 dd 05 9f 7a 19 10 6f 5a 42   ..u.1.v...z..oZB
0560  e0 3a f0 00 b1 a7 5c 95 ee da 67 66 38 c2 46 2e   .:....\...gf8.F.
0570  85 a4 b3 39 d8 41 1d 1c 9f 81 5a a0 67 c4 7e fc   ...9.A....Z.g.~.
0580  eb d1 b9 ab 69 56 0d 4e c4 49 1b aa fe e4         ....iV.N.I....

No.     Time               Source                Destination           Protocol Length Info
   4074 09:03:41.467739    60.10.117.125         10.106.129.54         HTTP     74     Continuation

Frame 4074: 74 bytes on wire (592 bits), 74 bytes captured (592 bits) on interface 0
Ethernet II, Src: Hangzhou_75:c8:f5 (74:25:8a:75:c8:f5), Dst: AsustekC_34:f3:aa (9c:5c:8e:34:f3:aa)
Internet Protocol Version 4, Src: 60.10.117.125, Dst: 10.106.129.54
