No.     Time               Source                Destination           Protocol Length Info
     33 16:08:37.282633    10.210.66.82          119.90.20.10          HTTP     668    GET /sohu/v1/TmPd0EI4fDcIfI78t64hDNeoV4Ve2XBoSAtqVy2PFXUyYbSoO2B0p.mp4?k=umkXI5&p=j9lvzSw3oLsUqSsmqmsmqmoCqprAqpwBhRYCzSwWsU1IyLNS0mEAZDbtWBNsWhyS0pviNF2mqLKBgr&r=TUqvtvGDXixnyLbUZDWSqTPGRDNOfhoioMycY&q=OpCmhW7IWhodRDbswmfCyY2sWYNHfhvs5GvsfGXsWFNS0F2OfDb4fFWXfOoURD64WOoUZDJ&cip=106.120.206.146&pid=9427604&tvid=101987227&ch=tv&sz=1349_662&md=/A9WRp+GWMrmwVusD2VqPPknoWF0fxKXgPilMA==201&prod=flash&pt=1&uuid=32af2f11-1cb3-143f-411f-73fe6ba6132d HTTP/1.1 

Frame 33: 668 bytes on wire (5344 bits), 668 bytes captured (5344 bits) on interface 0
Ethernet II, Src: AsustekC_34:f3:aa (9c:5c:8e:34:f3:aa), Dst: Hangzhou_d2:34:0d (3c:e5:a6:d2:34:0d)
Internet Protocol Version 4, Src: 10.210.66.82, Dst: 119.90.20.10
Transmission Control Protocol, Src Port: 38601 (38601), Dst Port: 80 (80), Seq: 1, Ack: 1, Len: 614
Hypertext Transfer Protocol
     [truncated]GET /sohu/v1/TmPd0EI4fDcIfI78t64hDNeoV4Ve2XBoSAtqVy2PFXUyYbSoO2B0p.mp4?k=umkXI5&p=j9lvzSw3oLsUqSsmqmsmqmoCqprAqpwBhRYCzSwWsU1IyLNS0mEAZDbtWBNsWhyS0pviNF2mqLKBgr&r=TUqvtvGDXixnyLbUZDWSqTPGRDNOfhoioMycY&q=OpCmhW7IWhodRDbswmfCyY2s
    Host:621-10.vod.tv.itc.cn:80\r\n
    Connection:keep-alive\r\n
    Cache-Control: no-cache, must-revalidate\r\n
    User-Agent:sohuce:17112281723\r\n
    Range:Bytes=14548992-15204351\r\n
    \r\n
    [Full request URI [truncated]: http://621-10.vod.tv.itc.cn:80/sohu/v1/TmPd0EI4fDcIfI78t64hDNeoV4Ve2XBoSAtqVy2PFXUyYbSoO2B0p.mp4?k=umkXI5&p=j9lvzSw3oLsUqSsmqmsmqmoCqprAqpwBhRYCzSwWsU1IyLNS0mEAZDbtWBNsWhyS0pviNF2mqLKBgr&r=TUqvtvGDXixnyLbUZDWS]
    [HTTP request 1/1]
    [Response in frame: 35]

No.     Time               Source                Destination           Protocol Length Info
     35 16:08:37.315685    119.90.20.10          10.210.66.82          HTTP     1494   HTTP/1.1 206 Partial Content  (video/mp4)

Frame 35: 1494 bytes on wire (11952 bits), 1494 bytes captured (11952 bits) on interface 0
Ethernet II, Src: Hangzhou_d2:34:0d (3c:e5:a6:d2:34:0d), Dst: AsustekC_34:f3:aa (9c:5c:8e:34:f3:aa)
Internet Protocol Version 4, Src: 119.90.20.10, Dst: 10.210.66.82
Transmission Control Protocol, Src Port: 80 (80), Dst Port: 38601 (38601), Seq: 1, Ack: 615, Len: 1440
Hypertext Transfer Protocol
Media Type

No.     Time               Source                Destination           Protocol Length Info
   1304 16:08:47.068947    10.210.66.82          103.254.190.5         HTTP     374    GET /img/20180516/101942197_4773376_short_H_091426_3675_seg_1_snap_001_36_b_8T2P7_pic23.jpg HTTP/1.1 

Frame 1304: 374 bytes on wire (2992 bits), 374 bytes captured (2992 bits) on interface 0
Ethernet II, Src: AsustekC_34:f3:aa (9c:5c:8e:34:f3:aa), Dst: Hangzhou_d2:34:0d (3c:e5:a6:d2:34:0d)
Internet Protocol Version 4, Src: 10.210.66.82, Dst: 103.254.190.5
Transmission Control Protocol, Src Port: 38647 (38647), Dst Port: 80 (80), Seq: 2881, Ack: 1, Len: 320
[3 Reassembled TCP Segments (3200 bytes): #1302(1440), #1303(1440), #1304(320)]
Hypertext Transfer Protocol
    GET /img/20180516/101942197_4773376_short_H_091426_3675_seg_1_snap_001_36_b_8T2P7_pic23.jpg HTTP/1.1\r\n
    Host: photocdn.tv.sohu.com\r\n
    Connection: keep-alive\r\n
    User-Agent: Mozilla/5.0 (Windows NT 10.0; Win64; x64) AppleWebKit/537.36 (KHTML, like Gecko) Chrome/66.0.3359.139 Safari/537.36\r\n
    Accept: image/webp,image/apng,image/*,*/*;q=0.8\r\n
    Accept-Encoding: gzip, deflate\r\n
    Accept-Language: en-US,en;q=0.9,zh-TW;q=0.8,zh;q=0.7\r\n
     [truncated]Cookie: SUV=1801261248337106; reqtype=pc; gidinf=x099980109ee0d6dc0266280e000622638cc2c66f137; ch_key=50e48c6168d7b908; ifoxinstalled=false; newpuid=15266562953178784720; landingrefer=https%3A%2F%2Fwww.baidu.com%2Flink%3Furl%3D
    \r\n
    [Full request URI: http://photocdn.tv.sohu.com/img/20180516/101942197_4773376_short_H_091426_3675_seg_1_snap_001_36_b_8T2P7_pic23.jpg]
    [HTTP request 1/3]
    [Response in frame: 1308]
    [Next request in frame: 3695]

No.     Time               Source                Destination           Protocol Length Info
   1308 16:08:47.072775    103.254.190.5         10.210.66.82          HTTP     1494   HTTP/1.1 200 OK  (JPEG JFIF image)

Frame 1308: 1494 bytes on wire (11952 bits), 1494 bytes captured (11952 bits) on interface 0
Ethernet II, Src: Hangzhou_d2:34:0d (3c:e5:a6:d2:34:0d), Dst: AsustekC_34:f3:aa (9c:5c:8e:34:f3:aa)
Internet Protocol Version 4, Src: 103.254.190.5, Dst: 10.210.66.82
Transmission Control Protocol, Src Port: 80 (80), Dst Port: 38647 (38647), Seq: 1, Ack: 3201, Len: 1440
Hypertext Transfer Protocol
    HTTP/1.1 200 OK\r\n
    Date: Fri, 18 May 2018 16:08:36 GMT\r\n
    Content-Type: image/jpeg\r\n
    Content-Length: 6964\r\n
    Connection: keep-alive\r\n
    Last-Modified: Wed, 16 May 2018 01:17:51 GMT\r\n
    Server: SCSImageServer\r\n
    ETag: "e7cdcde2e8794e66e0e68541aefd1689"\r\n
    Access-Control-Allow-Origin: *\r\n
    Cache-Control: max-age=7776000\r\n
    FSS-Cache: HIT from 4033458.6654908.4787162\r\n
    FSS-Proxy: Powered by 3509162.5606324.4262858\r\n
    Age: 1\r\n
    X-Via: 1.1 PSjsczBGPkl159:8 (Cdn Cache Server V2.0), 1.1 fuzhoudianxin50:2 (Cdn Cache Server V2.0), 1.1 wdx47:2 (Cdn Cache Server V2.0)\r\n
    X-Dscp-Value: 0\r\n
    \r\n
    [HTTP response 1/3]
    [Time since request: 0.003828000 seconds]
    [Request in frame: 1304]
    [Next request in frame: 3695]
    [Next response in frame: 3730]
JPEG File Interchange Format

No.     Time               Source                Destination           Protocol Length Info
   1441 16:08:47.200033    10.210.66.82          220.181.61.199        HTTP     1297   GET /r.gif?url=https%3A//tv.sohu.com/20180517/n600519362.shtml&refer=https%3A//tv.sohu.com/20180517/n600519490.shtml&fuid=15266563763734402419&yyid=&passport=&sid=1801261248337106&vid=4776050&pid=9427604&cid=25&msg=impression&formwork=22&rec=0_4776664_122520101_7_20_0,1_4777118_122520101_7_20_0,2_4773376_122520101_7_20_0,3_4777110_122520101_7_20_0,4_4769274_122520101_7_20_0,5_4758475_122520101_7_20_0,6_4773917_122520101_7_20_0,7_4777116_122520101_7_20_0,8_4764334_122520101_7_20_0,9_4777126_122520101_7_20_0,10_4774957_122520101_7_20_0,11_4775859_122520101_7_20_0,12_4775853_122520101_7_20_0,13_4775855_122520101_7_20_0&ab=0&Lb=&v=maybelike_25_v20130829&uuid=1526659726788&type=100&landing_refer=https%3A%2F%2Fwww.baidu.com%2Flink%3Furl%3DFldphujrjjc0bLDPTtbLG0e_L2FWiBbYDqVdXlPTSbS%26wd%3D%26eqid%3Dd45c4bd000027ee3000000035afeed13&fuuid=2dd6b1a5-f341-4db4-c227-7402b743afe7&lcode=&lqd=&page=1&_=1526659727161 HTTP/1.1 

Frame 1441: 1297 bytes on wire (10376 bits), 1297 bytes captured (10376 bits) on interface 0
Ethernet II, Src: AsustekC_34:f3:aa (9c:5c:8e:34:f3:aa), Dst: Hangzhou_d2:34:0d (3c:e5:a6:d2:34:0d)
Internet Protocol Version 4, Src: 10.210.66.82, Dst: 220.181.61.199
Transmission Control Protocol, Src Port: 38648 (38648), Dst Port: 80 (80), Seq: 1, Ack: 1, Len: 1243
Hypertext Transfer Protocol
     [truncated]GET /r.gif?url=https%3A//tv.sohu.com/20180517/n600519362.shtml&refer=https%3A//tv.sohu.com/20180517/n600519490.shtml&fuid=15266563763734402419&yyid=&passport=&sid=1801261248337106&vid=4776050&pid=9427604&cid=25&msg=impression&f
    Host: click.hd.sohu.com.cn\r\n
    Connection: keep-alive\r\n
    User-Agent: Mozilla/5.0 (Windows NT 10.0; Win64; x64) AppleWebKit/537.36 (KHTML, like Gecko) Chrome/66.0.3359.139 Safari/537.36\r\n
    Accept: image/webp,image/apng,image/*,*/*;q=0.8\r\n
    Accept-Encoding: gzip, deflate\r\n
    Accept-Language: en-US,en;q=0.9,zh-TW;q=0.8,zh;q=0.7\r\n
    \r\n
    [Full request URI [truncated]: http://click.hd.sohu.com.cn/r.gif?url=https%3A//tv.sohu.com/20180517/n600519362.shtml&refer=https%3A//tv.sohu.com/20180517/n600519490.shtml&fuid=15266563763734402419&yyid=&passport=&sid=1801261248337106&vid=47]
    [HTTP request 1/1]
    [Response in frame: 1443]

No.     Time               Source                Destination           Protocol Length Info
   1443 16:08:47.201776    220.181.61.199        10.210.66.82          HTTP     291    HTTP/1.1 200 OK 

Frame 1443: 291 bytes on wire (2328 bits), 291 bytes captured (2328 bits) on interface 0
Ethernet II, Src: Hangzhou_d2:34:0d (3c:e5:a6:d2:34:0d), Dst: AsustekC_34:f3:aa (9c:5c:8e:34:f3:aa)
Internet Protocol Version 4, Src: 220.181.61.199, Dst: 10.210.66.82
Transmission Control Protocol, Src Port: 80 (80), Dst Port: 38648 (38648), Seq: 1, Ack: 1244, Len: 237
Hypertext Transfer Protocol
    HTTP/1.1 200 OK\r\n
    Server: nginx/SohuTv-N2162\r\n
    Date: Fri, 18 May 2018 16:08:36 GMT\r\n
    Content-Type: image/gif\r\n
    Content-Length: 43\r\n
    Last-Modified: Tue, 23 May 2017 03:02:21 GMT\r\n
    Connection: close\r\n
    ETag: "5923a63d-2b"\r\n
    Accept-Ranges: bytes\r\n
    \r\n
    [HTTP response 1/1]
    [Time since request: 0.001743000 seconds]
    [Request in frame: 1441]

No.     Time               Source                Destination           Protocol Length Info
   1455 16:08:47.241559    10.210.66.82          123.126.104.150       HTTP     338    GET /ctr.gif?url=https%3A//tv.sohu.com/20180517/n600519362.shtml&refer=https%3A//tv.sohu.com/20180517/n600519490.shtml&fuid=15266563763734402419&yyid=&passport=&sid=1801261248337106&vid=4776050&pid=9427604&cid=25&msg=impression&formwork=22&rec=0_4776664_122520101_7_20_0,1_4777118_122520101_7_20_0,2_4773376_122520101_7_20_0,3_4777110_122520101_7_20_0,4_4769274_122520101_7_20_0,5_4758475_122520101_7_20_0,6_4773917_122520101_7_20_0,7_4777116_122520101_7_20_0,8_4764334_122520101_7_20_0,9_4777126_122520101_7_20_0,10_4774957_122520101_7_20_0,11_4775859_122520101_7_20_0,12_4775853_122520101_7_20_0,13_4775855_122520101_7_20_0&ab=0&Lb=&v=maybelike_25_v20130829&uuid=1526659726788&type=100&landing_refer=https%3A%2F%2Fwww.baidu.com%2Flink%3Furl%3DFldphujrjjc0bLDPTtbLG0e_L2FWiBbYDqVdXlPTSbS%26wd%3D%26eqid%3Dd45c4bd000027ee3000000035afeed13&fuuid=2dd6b1a5-f341-4db4-c227-7402b743afe7&lcode=&lqd=&page=1&_=1526659727161 HTTP/1.1 

Frame 1455: 338 bytes on wire (2704 bits), 338 bytes captured (2704 bits) on interface 0
Ethernet II, Src: AsustekC_34:f3:aa (9c:5c:8e:34:f3:aa), Dst: Hangzhou_d2:34:0d (3c:e5:a6:d2:34:0d)
Internet Protocol Version 4, Src: 10.210.66.82, Dst: 123.126.104.150
Transmission Control Protocol, Src Port: 38649 (38649), Dst Port: 80 (80), Seq: 1441, Ack: 1, Len: 284
[2 Reassembled TCP Segments (1724 bytes): #1454(1440), #1455(284)]
Hypertext Transfer Protocol
     [truncated]GET /ctr.gif?url=https%3A//tv.sohu.com/20180517/n600519362.shtml&refer=https%3A//tv.sohu.com/20180517/n600519490.shtml&fuid=15266563763734402419&yyid=&passport=&sid=1801261248337106&vid=4776050&pid=9427604&cid=25&msg=impression
    Host: ctr.hd.sohu.com\r\n
    Connection: keep-alive\r\n
    User-Agent: Mozilla/5.0 (Windows NT 10.0; Win64; x64) AppleWebKit/537.36 (KHTML, like Gecko) Chrome/66.0.3359.139 Safari/537.36\r\n
    Accept: image/webp,image/apng,image/*,*/*;q=0.8\r\n
    Accept-Encoding: gzip, deflate\r\n
    Accept-Language: en-US,en;q=0.9,zh-TW;q=0.8,zh;q=0.7\r\n
     [truncated]Cookie: SUV=1801261248337106; reqtype=pc; gidinf=x099980109ee0d6dc0266280e000622638cc2c66f137; IPLOC=CN1100; beans_dmp=%7B%22admaster%22%3A1526656297%2C%22shunfei%22%3A1526656297%2C%22reachmax%22%3A1526656297%2C%22lingji%22%3A1
    \r\n
    [Full request URI [truncated]: http://ctr.hd.sohu.com/ctr.gif?url=https%3A//tv.sohu.com/20180517/n600519362.shtml&refer=https%3A//tv.sohu.com/20180517/n600519490.shtml&fuid=15266563763734402419&yyid=&passport=&sid=1801261248337106&vid=47760]
    [HTTP request 1/2]
    [Response in frame: 1458]
    [Next request in frame: 4759]

No.     Time               Source                Destination           Protocol Length Info
   1458 16:08:47.250826    123.126.104.150       10.210.66.82          HTTP     361    HTTP/1.1 200 OK  (GIF89a)

Frame 1458: 361 bytes on wire (2888 bits), 361 bytes captured (2888 bits) on interface 0
Ethernet II, Src: Hangzhou_d2:34:0d (3c:e5:a6:d2:34:0d), Dst: AsustekC_34:f3:aa (9c:5c:8e:34:f3:aa)
Internet Protocol Version 4, Src: 123.126.104.150, Dst: 10.210.66.82
Transmission Control Protocol, Src Port: 80 (80), Dst Port: 38649 (38649), Seq: 1, Ack: 1725, Len: 307
Hypertext Transfer Protocol
    HTTP/1.1 200 OK\r\n
    Server: nginx/SohuTv-N2162\r\n
    Date: Fri, 18 May 2018 16:08:36 GMT\r\n
    Content-Type: image/gif\r\n
    Content-Length: 43\r\n
    Last-Modified: Mon, 28 Sep 1970 06:00:00 GMT\r\n
    Connection: keep-alive\r\n
    Expires: Fri, 18 May 2018 16:08:35 GMT\r\n
    Cache-Control: no-cache\r\n
    \r\n
    [HTTP response 1/2]
    [Time since request: 0.009267000 seconds]
    [Request in frame: 1455]
    [Next request in frame: 4759]
    [Next response in frame: 4767]
Compuserve GIF, Version: GIF89a

No.     Time               Source                Destination           Protocol Length Info
   1534 16:08:48.013229    10.210.66.82          115.25.217.29         HTTP     1154   GET /count/stat.do?videoId=4776050&tvid=101976387&playlistId=9427604&categoryId=157&catecode=122100&uid=15266563763734402419&plat=flash&os=Windows10&online=0&type=vms&r=https%3A//tv.sohu.com/20180517/n600519362.shtml&t=1526659727958.9424&enc=lq3yfL28HEVn%2BvP5nQCJjWpZpKw0%2B%2BY4 HTTP/1.1 

Frame 1534: 1154 bytes on wire (9232 bits), 1154 bytes captured (9232 bits) on interface 0
Ethernet II, Src: AsustekC_34:f3:aa (9c:5c:8e:34:f3:aa), Dst: Hangzhou_d2:34:0d (3c:e5:a6:d2:34:0d)
Internet Protocol Version 4, Src: 10.210.66.82, Dst: 115.25.217.29
Transmission Control Protocol, Src Port: 38654 (38654), Dst Port: 80 (80), Seq: 1, Ack: 1, Len: 1100
Hypertext Transfer Protocol
     [truncated]GET /count/stat.do?videoId=4776050&tvid=101976387&playlistId=9427604&categoryId=157&catecode=122100&uid=15266563763734402419&plat=flash&os=Windows10&online=0&type=vms&r=https%3A//tv.sohu.com/20180517/n600519362.shtml&t=15266597
    Host: count.vrs.sohu.com\r\n
    Connection: keep-alive\r\n
    User-Agent: Mozilla/5.0 (Windows NT 10.0; Win64; x64) AppleWebKit/537.36 (KHTML, like Gecko) Chrome/66.0.3359.139 Safari/537.36\r\n
    X-Requested-With: ShockwaveFlash/29.0.0.171\r\n
    Accept: */*\r\n
    Accept-Encoding: gzip, deflate\r\n
    Accept-Language: en-US,en;q=0.9,zh-TW;q=0.8,zh;q=0.7\r\n
     [truncated]Cookie: SUV=1801261248337106; reqtype=pc; gidinf=x099980109ee0d6dc0266280e000622638cc2c66f137; IPLOC=CN1100; beans_dmp=%7B%22admaster%22%3A1526656297%2C%22shunfei%22%3A1526656297%2C%22reachmax%22%3A1526656297%2C%22lingji%22%3A1
    \r\n
    [Full request URI [truncated]: http://count.vrs.sohu.com/count/stat.do?videoId=4776050&tvid=101976387&playlistId=9427604&categoryId=157&catecode=122100&uid=15266563763734402419&plat=flash&os=Windows10&online=0&type=vms&r=https%3A//tv.sohu.c]
    [HTTP request 1/1]
    [Response in frame: 1542]

No.     Time               Source                Destination           Protocol Length Info
   1542 16:08:48.021779    115.25.217.29         10.210.66.82          HTTP     502    HTTP/1.1 200   (text/html)

Frame 1542: 502 bytes on wire (4016 bits), 502 bytes captured (4016 bits) on interface 0
Ethernet II, Src: Hangzhou_d2:34:0d (3c:e5:a6:d2:34:0d), Dst: AsustekC_34:f3:aa (9c:5c:8e:34:f3:aa)
Internet Protocol Version 4, Src: 115.25.217.29, Dst: 10.210.66.82
Transmission Control Protocol, Src Port: 80 (80), Dst Port: 38654 (38654), Seq: 1, Ack: 1101, Len: 448
Hypertext Transfer Protocol
    HTTP/1.1 200 \r\n
    Content-Type: text/html;charset=UTF-8\r\n
    Transfer-Encoding: chunked\r\n
    Connection: keep-alive\r\n
    Server: nginx/1.4.1\r\n
    Date: Fri, 18 May 2018 16:08:37 GMT\r\n
    X-Application-Context: index.count.online:online:8080\r\n
    Cache-Control: no-cache\r\n
    Pragma: no-cache\r\n
    Expires: Thu, 01 Jan 1970 00:00:00 GMT\r\n
    Content-Encoding: gzip\r\n
    Vary: Accept-Encoding\r\n
    FSS-Proxy: Powered by 3705773.5999543.4459472\r\n
    \r\n
    [HTTP response 1/1]
    [Time since request: 0.008550000 seconds]
    [Request in frame: 1534]
    HTTP chunked response
    Content-encoded entity body (gzip): 39 bytes -> 13 bytes
Line-based text data: text/html

No.     Time               Source                Destination           Protocol Length Info
   1585 16:08:48.094352    10.210.66.82          113.200.91.91         HTTP     671    GET /irt?_iwt_id=null&_iwt_UA=UA-sohu-100009&jsonp=SetIDA0&_iwt_p1=A-0-0&_iwt_p2=101976387&_iwt_p3=24-0-0-0&_iwt_p4=4776050&_iwt_p5=https%253A//tv.sohu.com/20180517/n600519362.shtml&_iwt_muid=1801261248337106%257C15266563763734402419&p_Site=0&r=4088 HTTP/1.1 

Frame 1585: 671 bytes on wire (5368 bits), 671 bytes captured (5368 bits) on interface 0
Ethernet II, Src: AsustekC_34:f3:aa (9c:5c:8e:34:f3:aa), Dst: Hangzhou_d2:34:0d (3c:e5:a6:d2:34:0d)
Internet Protocol Version 4, Src: 10.210.66.82, Dst: 113.200.91.91
Transmission Control Protocol, Src Port: 38655 (38655), Dst Port: 80 (80), Seq: 1, Ack: 1, Len: 617
Hypertext Transfer Protocol
     [truncated]GET /irt?_iwt_id=null&_iwt_UA=UA-sohu-100009&jsonp=SetIDA0&_iwt_p1=A-0-0&_iwt_p2=101976387&_iwt_p3=24-0-0-0&_iwt_p4=4776050&_iwt_p5=https%253A//tv.sohu.com/20180517/n600519362.shtml&_iwt_muid=1801261248337106%257C15266563763734
    Host: irs01.com\r\n
    Connection: keep-alive\r\n
    User-Agent: Mozilla/5.0 (Windows NT 10.0; Win64; x64) AppleWebKit/537.36 (KHTML, like Gecko) Chrome/66.0.3359.139 Safari/537.36\r\n
    X-Requested-With: ShockwaveFlash/29.0.0.171\r\n
    Accept: */*\r\n
    Accept-Encoding: gzip, deflate\r\n
    Accept-Language: en-US,en;q=0.9,zh-TW;q=0.8,zh;q=0.7\r\n
    Cookie: _iwt_id=WOlSATOKZVrh8I15R1UVVQA\r\n
    \r\n
    [Full request URI [truncated]: http://irs01.com/irt?_iwt_id=null&_iwt_UA=UA-sohu-100009&jsonp=SetIDA0&_iwt_p1=A-0-0&_iwt_p2=101976387&_iwt_p3=24-0-0-0&_iwt_p4=4776050&_iwt_p5=https%253A//tv.sohu.com/20180517/n600519362.shtml&_iwt_muid=18012]
    [HTTP request 1/1]
    [Response in frame: 1599]

No.     Time               Source                Destination           Protocol Length Info
   1599 16:08:48.123230    113.200.91.91         10.210.66.82          HTTP     514    HTTP/1.1 200 OK  (text/javascript)

Frame 1599: 514 bytes on wire (4112 bits), 514 bytes captured (4112 bits) on interface 0
Ethernet II, Src: Hangzhou_d2:34:0d (3c:e5:a6:d2:34:0d), Dst: AsustekC_34:f3:aa (9c:5c:8e:34:f3:aa)
Internet Protocol Version 4, Src: 113.200.91.91, Dst: 10.210.66.82
Transmission Control Protocol, Src Port: 80 (80), Dst Port: 38655 (38655), Seq: 1, Ack: 618, Len: 460
Hypertext Transfer Protocol
    HTTP/1.1 200 OK\r\n
    Date: Fri, 18 May 2018 16:08:37 GMT\r\n
    Content-Type: text/javascript\r\n
    Content-Length: 36\r\n
    Connection: close\r\n
    Set-Cookie: _iwt_id=WOlSATOKZVrh8I15R1UVVQA; expires=Sun, 17-May-20 16:08:37 GMT; domain=.irs01.com; path=/\r\n
    P3P: policyref="/w3c/p3p.xml", CP="CUR ADM OUR NOR STA NID"\r\n
    Cache-Control: private,no-store,no-cache,must-revalidate,proxy-revalidate,no-transform,max-age=0\r\n
    Pragma: no-cache\r\n
    Expires: 0\r\n
    \r\n
    [HTTP response 1/1]
    [Time since request: 0.028878000 seconds]
    [Request in frame: 1585]
Line-based text data: text/javascript

No.     Time               Source                Destination           Protocol Length Info
   2079 16:08:48.933587    10.210.66.82          123.125.123.168       HTTP     917    GET /pv?type=1&freq=1&du=25&adtime=5&trule=36839&mx=1&al=9427604&out=0&au=1&vid=4776050&tvid=101976387&qd=50e48c6168d7b908&rt=b11fe6f8013be1ddfac6901c8deb899f&spead=0&uv=15266563764651963691&uuid=2dd6b1a5-f341-4db4-c227-7402b743afe7&UUID=2dd6b1a5-f341-4db4-c227-7402b743afe7&vt=vms2&rd=tv.sohu.com&fee=0&isIf=0&suv=1801261248337106&uid=15266563764651963691&sz=1349_662&md=mE9yLS6c4+3Wt+n14KfqV1BoW7W2PNZZ3iAecA==201&crid=0&scookie=2&ar=52&sign=VuKdG_52to80hYJeF7wU1QP9axOzLv7Cw4YdS8HSIF3Qlv3L7lIj_lCZfKn64b2F3vvS5P-WzBs.&rip=114.255.41.146&sip=10.13.91.50&fip=114.255.41.146&url=https%3A//tv.sohu.com/20180517/n600519362.shtml&pagerefer=https%253A//tv.sohu.com/20180517/n600519490.shtml&ti=54m55pyX5pmu77ya5oiR5Lus5rKh5o6l5Yiw5Lu75L2V6YCa55+l6K+06KaB5Y+W5raI4oCc54m56YeR5Lya4oCd&lrd=https%253A%252F%252Fwww.baidu.com%252Flink%253Furl%253DFldphujrjjc0bLDPTtbLG0e_L2FWiBbYDqVdXlPTSbS%2526wd%253D%2526eqid%253Dd45c4bd000027ee3000000035afeed13&plat=pc&adplat=0&v1=1068&v2=1249&offline=0&endtime=20180531&ad=535577&b=606466&bk=140744526&pagetype=1&suid=1801261248337106&seq=1&w=960&h=462&cheattype=0&sperotime=1526659717&tuv=15266563764651963691&dkey=91400351&template=normal,null&platsource=tvpc&vp=s&at=5&c=1&v1=1068&v2=1249&p=oad1&loc=CN1100&adstyle=oad&ac=23858&ad=535577&pt=28653&b=606466&bk=140744526&pagetype=1&spead=0&err=0&encrypt=H6_GYdd1BWPRSR9WKPBLoosGJOUYUcwl107kDG6tJ7g1pQV6 HTTP/1.1 

Frame 2079: 917 bytes on wire (7336 bits), 917 bytes captured (7336 bits) on interface 0
Ethernet II, Src: AsustekC_34:f3:aa (9c:5c:8e:34:f3:aa), Dst: Hangzhou_d2:34:0d (3c:e5:a6:d2:34:0d)
Internet Protocol Version 4, Src: 10.210.66.82, Dst: 123.125.123.168
Transmission Control Protocol, Src Port: 38660 (38660), Dst Port: 80 (80), Seq: 1441, Ack: 1, Len: 863
[2 Reassembled TCP Segments (2303 bytes): #2078(1440), #2079(863)]
Hypertext Transfer Protocol
     [truncated]GET /pv?type=1&freq=1&du=25&adtime=5&trule=36839&mx=1&al=9427604&out=0&au=1&vid=4776050&tvid=101976387&qd=50e48c6168d7b908&rt=b11fe6f8013be1ddfac6901c8deb899f&spead=0&uv=15266563764651963691&uuid=2dd6b1a5-f341-4db4-c227-7402b74
    Host: vm.aty.sohu.com\r\n
    Connection: keep-alive\r\n
    User-Agent: Mozilla/5.0 (Windows NT 10.0; Win64; x64) AppleWebKit/537.36 (KHTML, like Gecko) Chrome/66.0.3359.139 Safari/537.36\r\n
    X-Requested-With: ShockwaveFlash/29.0.0.171\r\n
    Accept: */*\r\n
    Accept-Encoding: gzip, deflate\r\n
    Accept-Language: en-US,en;q=0.9,zh-TW;q=0.8,zh;q=0.7\r\n
     [truncated]Cookie: SUV=1801261248337106; reqtype=pc; gidinf=x099980109ee0d6dc0266280e000622638cc2c66f137; SCookie=2018-05-18 23:11:23; IPLOC=CN1100; beans_dmp=%7B%22admaster%22%3A1526656297%2C%22shunfei%22%3A1526656297%2C%22reachmax%22%3A
    \r\n
    [Full request URI [truncated]: http://vm.aty.sohu.com/pv?type=1&freq=1&du=25&adtime=5&trule=36839&mx=1&al=9427604&out=0&au=1&vid=4776050&tvid=101976387&qd=50e48c6168d7b908&rt=b11fe6f8013be1ddfac6901c8deb899f&spead=0&uv=15266563764651963691&]
    [HTTP request 1/1]
    [Response in frame: 2084]

No.     Time               Source                Destination           Protocol Length Info
   2084 16:08:48.943500    123.125.123.168       10.210.66.82          HTTP     319    HTTP/1.1 200 OK 

Frame 2084: 319 bytes on wire (2552 bits), 319 bytes captured (2552 bits) on interface 0
Ethernet II, Src: Hangzhou_d2:34:0d (3c:e5:a6:d2:34:0d), Dst: AsustekC_34:f3:aa (9c:5c:8e:34:f3:aa)
Internet Protocol Version 4, Src: 123.125.123.168, Dst: 10.210.66.82
Transmission Control Protocol, Src Port: 80 (80), Dst Port: 38660 (38660), Seq: 1, Ack: 2304, Len: 265
Hypertext Transfer Protocol
    HTTP/1.1 200 OK\r\n
    Server: nginx/1.10.1\r\n
    Date: Fri, 18 May 2018 16:08:38 GMT\r\n
    Content-Type: text/html; charset=utf-8\r\n
    Content-Length: 0\r\n
    Connection: close\r\n
    Set-Cookie: CC=MTE0LjI1NS40MS4xNDY= ; expires=Sat May 19 16:08:38 2018\r\n
    [HTTP response 1/1]
    [Time since request: 0.009913000 seconds]
    [Request in frame: 2079]

No.     Time               Source                Destination           Protocol Length Info
   2234 16:08:48.992261    10.210.66.82          111.202.126.57        HTTP     1062   GET /i/a107913,b2559298,c1849,i0,m202,8a1,8b1,0k10060,0iPUB_672143,h HTTP/1.1 

Frame 2234: 1062 bytes on wire (8496 bits), 1062 bytes captured (8496 bits) on interface 0
Ethernet II, Src: AsustekC_34:f3:aa (9c:5c:8e:34:f3:aa), Dst: Hangzhou_d2:34:0d (3c:e5:a6:d2:34:0d)
Internet Protocol Version 4, Src: 10.210.66.82, Dst: 111.202.126.57
Transmission Control Protocol, Src Port: 38663 (38663), Dst Port: 80 (80), Seq: 1, Ack: 1, Len: 1008
Hypertext Transfer Protocol
    GET /i/a107913,b2559298,c1849,i0,m202,8a1,8b1,0k10060,0iPUB_672143,h HTTP/1.1\r\n
    Host: vsohu.admaster.com.cn\r\n
    Connection: keep-alive\r\n
    User-Agent: Mozilla/5.0 (Windows NT 10.0; Win64; x64) AppleWebKit/537.36 (KHTML, like Gecko) Chrome/66.0.3359.139 Safari/537.36\r\n
    X-Requested-With: ShockwaveFlash/29.0.0.171\r\n
    Accept: */*\r\n
    Accept-Encoding: gzip, deflate\r\n
    Accept-Language: en-US,en;q=0.9,zh-TW;q=0.8,zh;q=0.7\r\n
     [truncated]Cookie: admckid=1801221453051959643; admses=1453051759926; mapping_hist=szeJxFjFEOwiAQBW_0ouxC2eOsZWP5oFXApN5eEjF-vsnMA.Q1LYardyF4uVAAbtbmjuIYyM_8.pMs5Al4lHZP_YuIYhxSNV23oucPihOgHdtrhoH9uO62r7b_SxnS2asmq5MxM30Ax8coBw**; viewlis
    \r\n
    [Full request URI: http://vsohu.admaster.com.cn/i/a107913,b2559298,c1849,i0,m202,8a1,8b1,0k10060,0iPUB_672143,h]
    [HTTP request 1/1]
    [Response in frame: 2242]

No.     Time               Source                Destination           Protocol Length Info
   2240 16:08:48.997295    10.210.66.82          58.215.168.157        HTTP     1040   GET /?tid=1849&type=1&uid=1801261248337106 HTTP/1.1 

Frame 2240: 1040 bytes on wire (8320 bits), 1040 bytes captured (8320 bits) on interface 0
Ethernet II, Src: AsustekC_34:f3:aa (9c:5c:8e:34:f3:aa), Dst: Hangzhou_d2:34:0d (3c:e5:a6:d2:34:0d)
Internet Protocol Version 4, Src: 10.210.66.82, Dst: 58.215.168.157
Transmission Control Protocol, Src Port: 38661 (38661), Dst Port: 80 (80), Seq: 1, Ack: 1, Len: 986
Hypertext Transfer Protocol
    GET /?tid=1849&type=1&uid=1801261248337106 HTTP/1.1\r\n
    Host: sohutv.cm.admaster.com.cn\r\n
    Connection: keep-alive\r\n
    User-Agent: Mozilla/5.0 (Windows NT 10.0; Win64; x64) AppleWebKit/537.36 (KHTML, like Gecko) Chrome/66.0.3359.139 Safari/537.36\r\n
    X-Requested-With: ShockwaveFlash/29.0.0.171\r\n
    Accept: */*\r\n
    Accept-Encoding: gzip, deflate\r\n
    Accept-Language: en-US,en;q=0.9,zh-TW;q=0.8,zh;q=0.7\r\n
     [truncated]Cookie: admckid=1801221453051959643; admses=1453051759926; mapping_hist=szeJxFjFEOwiAQBW_0ouxC2eOsZWP5oFXApN5eEjF-vsnMA.Q1LYardyF4uVAAbtbmjuIYyM_8.pMs5Al4lHZP_YuIYhxSNV23oucPihOgHdtrhoH9uO62r7b_SxnS2asmq5MxM30Ax8coBw**; viewlis
    \r\n
    [Full request URI: http://sohutv.cm.admaster.com.cn/?tid=1849&type=1&uid=1801261248337106]
    [HTTP request 1/1]
    [Response in frame: 2250]

No.     Time               Source                Destination           Protocol Length Info
   2242 16:08:49.002351    111.202.126.57        10.210.66.82          HTTP     1091   HTTP/1.1 200 OK  (GIF87a)

Frame 2242: 1091 bytes on wire (8728 bits), 1091 bytes captured (8728 bits) on interface 0
Ethernet II, Src: Hangzhou_d2:34:0d (3c:e5:a6:d2:34:0d), Dst: AsustekC_34:f3:aa (9c:5c:8e:34:f3:aa)
Internet Protocol Version 4, Src: 111.202.126.57, Dst: 10.210.66.82
Transmission Control Protocol, Src Port: 80 (80), Dst Port: 38663 (38663), Seq: 1, Ack: 1009, Len: 1037
Hypertext Transfer Protocol
    HTTP/1.1 200 OK\r\n
    Server: nginx/cedb2db58f045af3d0210e8b2b245f93f5b4d259 U2FsdGVkX18WaI5gIsRR/XTL2KgWH9C9mKt2ozPWSZM=\r\n
    Date: Fri, 18 May 2018 16:08:34 GMT\r\n
    Content-Type: image/gif\r\n
    Content-Length: 35\r\n
    Connection: keep-alive\r\n
    P3P: CP=CURa ADMa DEVa PSAo PSDo OUR BUS UNI PUR INT DEM STA PRE COM NAV OTC NOI DSP COR\r\n
    Cache-Control: private, no-cache, no-store, must-revalidate, proxy-revalidate, no-transform, max-age=0\r\n
    Pragma: no-cache\r\n
    Set-Cookie: admckid=1801221453051959643;expires=Sun, 19 May 2019 00:08:34 GMT;domain=.admaster.com.cn;path=/\r\n
     [truncated]Set-Cookie: viewlist=szeJxt0tuNxSAMBNCOkD1-4f4bWwN7CRJ8hpxYk8GtWQ_.BjMW9kaNDW6QTG48Hus1nDl6a0waJg2KrvS.LoQuDxsUqLmchr6tU72Ul5Vlux420fy2YTT.mn8ZVFUec.0wMlBk8M9akviyiRRoqs-5iCiLmqSfVZe37ctqHLYO_bKVYVjK8KMHZTw6c9OsfqMny57bXew11w.L
    \r\n
    [HTTP response 1/1]
    [Time since request: 0.010090000 seconds]
    [Request in frame: 2234]
Compuserve GIF, Version: GIF87a

No.     Time               Source                Destination           Protocol Length Info
   2250 16:08:49.024091    58.215.168.157        10.210.66.82          HTTP     549    HTTP/1.1 200 OK  (GIF87a)

Frame 2250: 549 bytes on wire (4392 bits), 549 bytes captured (4392 bits) on interface 0
Ethernet II, Src: Hangzhou_d2:34:0d (3c:e5:a6:d2:34:0d), Dst: AsustekC_34:f3:aa (9c:5c:8e:34:f3:aa)
Internet Protocol Version 4, Src: 58.215.168.157, Dst: 10.210.66.82
Transmission Control Protocol, Src Port: 80 (80), Dst Port: 38661 (38661), Seq: 1, Ack: 987, Len: 495
Hypertext Transfer Protocol
    HTTP/1.1 200 OK\r\n
    Server: nginx/1.10.2\r\n
    Date: Fri, 18 May 2018 16:08:38 GMT\r\n
    Content-Type: image/gif\r\n
    Content-Length: 35\r\n
    Connection: keep-alive\r\n
    P3P: CP=CURa ADMa DEVa PSAo PSDo OUR BUS UNI PUR INT DEM STA PRE COM NAV OTC NOI DSP COR\r\n
    Cache-Control: private, no-cache, no-store, must-revalidate, proxy-revalidate, no-transform, max-age=0\r\n
    Pragma: no-cache\r\n
    Set-Cookie: admckid=1801221453051959643;expires=Sun, 19 May 2019 00:08:38 GMT;domain=.n1q.co;path=/\r\n
    \r\n
    [HTTP response 1/1]
    [Time since request: 0.026796000 seconds]
    [Request in frame: 2240]
Compuserve GIF, Version: GIF87a

No.     Time               Source                Destination           Protocol Length Info
   2452 16:08:49.895621    10.210.66.82          119.90.20.5           HTTP     659    GET /sohu/v1/TmviTmwAoAIUgAdWR81M0Mc6Rp0XD8xOeYvlg6cFlm47fFoGRMvBY.mp4?k=Uj37yY&p=j9lvzSw3oLsUqSsmqmsmqmoCqprAqpwBhRYCzSwWsU1IyLNS0mEAZDbtWBNsfD1S0pviNF2mqLKBgr&r=TUqvtvGDXixnyLbUZDWSqTPGRDNOfhoioMycY&q=OpC3hW7IWhodRDbswmfCyY2sWYNHfhvs5GvsfGXsWFNS0F2OfDb4fFWXZYoURD64WOoUZDJ&cip=106.120.206.146&pid=9427604&tvid=101976387&ch=tv&sz=1349_662&md=/A9WRp+GWMrmwVusD2VqPPknoWF0fxKXgPilMA==201&prod=flash&pt=1&uuid=2dd6b1a5-f341-4db4-c227-7402b743afe7 HTTP/1.1 

Frame 2452: 659 bytes on wire (5272 bits), 659 bytes captured (5272 bits) on interface 0
Ethernet II, Src: AsustekC_34:f3:aa (9c:5c:8e:34:f3:aa), Dst: Hangzhou_d2:34:0d (3c:e5:a6:d2:34:0d)
Internet Protocol Version 4, Src: 10.210.66.82, Dst: 119.90.20.5
Transmission Control Protocol, Src Port: 38675 (38675), Dst Port: 80 (80), Seq: 1, Ack: 1, Len: 605
Hypertext Transfer Protocol
     [truncated]GET /sohu/v1/TmviTmwAoAIUgAdWR81M0Mc6Rp0XD8xOeYvlg6cFlm47fFoGRMvBY.mp4?k=Uj37yY&p=j9lvzSw3oLsUqSsmqmsmqmoCqprAqpwBhRYCzSwWsU1IyLNS0mEAZDbtWBNsfD1S0pviNF2mqLKBgr&r=TUqvtvGDXixnyLbUZDWSqTPGRDNOfhoioMycY&q=OpC3hW7IWhodRDbswmfCyY2s
    Host:621-6.vod.tv.itc.cn:80\r\n
    Connection:keep-alive\r\n
    Cache-Control: no-cache, must-revalidate\r\n
    User-Agent:sohuce:17112281723\r\n
    Range:Bytes=0-1337417\r\n
    \r\n
    [Full request URI [truncated]: http://621-6.vod.tv.itc.cn:80/sohu/v1/TmviTmwAoAIUgAdWR81M0Mc6Rp0XD8xOeYvlg6cFlm47fFoGRMvBY.mp4?k=Uj37yY&p=j9lvzSw3oLsUqSsmqmsmqmoCqprAqpwBhRYCzSwWsU1IyLNS0mEAZDbtWBNsfD1S0pviNF2mqLKBgr&r=TUqvtvGDXixnyLbUZDWSq]
    [HTTP request 1/1]
    [Response in frame: 2455]

No.     Time               Source                Destination           Protocol Length Info
   2455 16:08:49.925531    119.90.20.5           10.210.66.82          MP4      1494   [Malformed Packet]

Frame 2455: 1494 bytes on wire (11952 bits), 1494 bytes captured (11952 bits) on interface 0
Ethernet II, Src: Hangzhou_d2:34:0d (3c:e5:a6:d2:34:0d), Dst: AsustekC_34:f3:aa (9c:5c:8e:34:f3:aa)
Internet Protocol Version 4, Src: 119.90.20.5, Dst: 10.210.66.82
Transmission Control Protocol, Src Port: 80 (80), Dst Port: 38675 (38675), Seq: 1, Ack: 606, Len: 1440
Hypertext Transfer Protocol
    HTTP/1.1 206 Partial Content\r\n
    Server: nginx\r\n
    Date: Fri, 18 May 2018 16:09:05 GMT\r\n
    Content-Type: video/mp4\r\n
    Content-Length: 1337418\r\n
    Last-Modified: Thu, 17 May 2018 01:19:51 GMT\r\n
    Connection: keep-alive\r\n
    ETag: "5afcd8b7-14684a"\r\n
    Expires: Sat, 15 Sep 2018 16:09:05 GMT\r\n
    Cache-Control: max-age=10368000\r\n
    Access-Control-Allow-Origin: *\r\n
    Content-Range: bytes 0-1337417/1337418\r\n
    \r\n
    [HTTP response 1/1]
    [Time since request: 0.029910000 seconds]
    [Request in frame: 2452]
MP4
[Malformed Packet: mp4]

No.     Time               Source                Destination           Protocol Length Info
   2489 16:08:49.940446    119.90.20.5           10.210.66.82          HTTP     1494   Continuation

Frame 2489: 1494 bytes on wire (11952 bits), 1494 bytes captured (11952 bits) on interface 0
Ethernet II, Src: Hangzhou_d2:34:0d (3c:e5:a6:d2:34:0d), Dst: AsustekC_34:f3:aa (9c:5c:8e:34:f3:aa)
Internet Protocol Version 4, Src: 119.90.20.5, Dst: 10.210.66.82
Transmission Control Protocol, Src Port: 80 (80), Dst Port: 38675 (38675), Seq: 43201, Ack: 606, Len: 1440
Hypertext Transfer Protocol
    :\002\213\337\211y\005\377\332\305\330ml;s\224\027\2055E\227\321\030\020\315]y\261)\313\374\240V\2613\310\025t+\006\246\207uo\355M\261\243\004\362\350*\343j\026a\242\201\263A\332\224^w`,\r
    Data (1373 bytes)

0000  f5 f2 b7 f4 a4 6f df fc 46 1f 6a 8e 36 3b ef c8   .....o..F.j.6;..
0010  27 d1 29 08 4f 6e 8b 29 30 66 9b 12 cc 68 d8 51   '.).On.)0f...h.Q
0020  f4 69 75 d5 33 22 41 ea 50 cf b5 17 72 ad d5 6a   .iu.3"A.P...r..j
0030  10 25 55 b5 dd 60 5d 09 58 fd fb 9d 6a 8f 92 a9   .%U..`].X...j...
0040  01 62 b4 15 74 3b d2 fa e7 cb ad 96 43 09 6b 93   .b..t;......C.k.
0050  45 f0 0a 4e a2 b0 45 b8 c5 b9 cd b9 dd 31 57 86   E..N..E......1W.
0060  39 0d a6 9f 68 07 a0 32 66 ef 29 bc ad ca 49 e5   9...h..2f.)...I.
0070  d7 9d 62 4b 07 18 9b 4b a9 23 3e aa cb 41 ea 14   ..bK...K.#>..A..
0080  75 0f d1 9e 5e 23 eb 62 98 5a 9b 90 ea 44 3f e7   u...^#.b.Z...D?.
0090  53 b3 8e 2d d8 cc 38 26 b8 05 69 bb 60 f5 b7 62   S..-..8&..i.`..b
00a0  a0 50 b8 65 3a 40 08 92 ab 59 3f 67 4f 66 00 78   .P.e:@...Y?gOf.x
00b0  ab 85 b9 c7 66 55 71 3a 60 de 58 bc 69 5d 53 da   ....fUq:`.X.i]S.
00c0  07 0a b6 0e e6 63 92 ca 4a 38 70 8e fd 6b da 08   .....c..J8p..k..
00d0  8f 09 bd d2 2e 33 ff 46 8f 9b bb 6a f3 1a 06 d3   .....3.F...j....
00e0  e2 5c 30 bc e1 b1 32 78 42 16 96 1d 60 a4 f0 dd   .\0...2xB...`...
00f0  b0 61 c1 72 ad f1 cd e9 69 d0 01 45 50 17 f9 9d   .a.r....i..EP...
0100  7e 7c c2 da a0 38 cf f5 c5 17 fe c0 f9 d8 b7 1d   ~|...8..........
0110  37 a0 c1 71 77 db d0 18 75 46 f5 a5 7c 73 22 4e   7..qw...uF..|s"N
0120  47 1b 52 68 2e 2c ba e2 d8 f4 54 44 49 2f 27 af   G.Rh.,....TDI/'.
0130  13 2a 5b 32 5b 63 64 cb ff 6f f0 c9 28 61 6a bf   .*[2[cd..o..(aj.
0140  39 1d 38 9c 97 b3 ea 2a 9c e1 6f 79 bb db 39 b7   9.8....*..oy..9.
0150  05 48 10 55 15 37 a6 ae f5 28 1f a0 9e 8f c8 1e   .H.U.7...(......
0160  6a 06 13 aa ba cd 19 2f e2 ab 1b fb cc f6 4a 95   j....../......J.
0170  b4 75 3f 4f 32 7a d2 a5 b8 20 18 16 10 4c 92 e3   .u?O2z... ...L..
0180  c2 65 90 4c 09 a1 e4 d0 98 a6 85 5d 64 fc b8 ad   .e.L.......]d...
0190  09 61 35 09 88 7c e8 92 35 40 1b 94 f1 a0 e1 6d   .a5..|..5@.....m
01a0  9a 4a 97 27 9b a3 52 b2 89 4c d1 b5 57 c0 33 c2   .J.'..R..L..W.3.
01b0  0b 00 d9 86 1c 11 d9 9d 99 fd 0d f5 19 04 7b af   ..............{.
01c0  0c f5 4f 92 37 d1 0f 2e 97 22 3c b0 59 20 dc 1f   ..O.7...."<.Y ..
01d0  6d 46 6b 7c 3c fb c8 c8 70 28 09 4b d2 c7 d3 e9   mFk|<...p(.K....
01e0  df 70 a9 51 a3 e2 e1 44 13 50 1a ef 90 94 91 ab   .p.Q...D.P......
01f0  9b ef 6f f9 19 af 24 5d 4e b4 fa 7a fd d0 ba 3a   ..o...$]N..z...:
0200  59 1c 34 1d 8f b5 63 dc 24 ac 47 10 40 46 c8 5e   Y.4...c.$.G.@F.^
0210  58 9c 83 5c e3 f0 58 ca 4f 40 3d 65 87 c7 df 2d   X..\..X.O@=e...-
0220  f5 6a 19 b5 5b ac 86 91 a9 0f 3d 7c 80 4b fe 64   .j..[.....=|.K.d
0230  ac f7 c4 bc 87 21 7c 99 de aa fd 00 ec 5e a6 bf   .....!|......^..
0240  bf 06 68 54 0b 2b 26 07 e1 c5 bb 3a 71 be 73 72   ..hT.+&....:q.sr
0250  b4 17 18 61 7a 81 51 01 8c 4a 29 0f bd de dd 04   ...az.Q..J).....
0260  9d ae 81 7e 21 16 21 a4 dd 94 26 b6 54 4f f0 67   ...~!.!...&.TO.g
0270  d5 ce ad 46 81 c8 5f a0 fa 25 c1 78 ff 87 b9 e3   ...F.._..%.x....
0280  b5 27 5f b3 e0 db 72 99 23 60 57 74 02 31 2a c5   .'_...r.#`Wt.1*.
0290  13 4e 79 c7 85 65 b8 f9 07 9b 0f b6 db de 5f 2b   .Ny..e........_+
02a0  23 ec 48 02 cf 74 1d 28 94 b0 b8 b8 6d 23 f5 e1   #.H..t.(....m#..
02b0  0d 9f c8 cb 13 f7 6b 4e 56 5c 97 82 ee 6d 42 1b   ......kNV\...mB.
02c0  fd e4 59 f9 8d 07 d7 01 e0 78 93 45 f4 33 ab b2   ..Y......x.E.3..
02d0  38 b6 22 9b d5 db e4 28 b9 4b 2d 14 70 55 75 97   8."....(.K-.pUu.
02e0  d1 2b 5a 82 ff e2 21 5c b8 53 24 d8 74 c3 68 46   .+Z...!\.S$.t.hF
02f0  50 a8 96 2d 2a 95 ca 68 1d 6c 6b c2 58 20 b7 88   P..-*..h.lk.X ..
0300  a1 ec 87 62 79 8e 27 28 5e 2d 5c 65 11 f5 4e a8   ...by.'(^-\e..N.
0310  87 1e 8e 53 c2 74 9e 60 09 c4 27 91 c3 3c f8 a0   ...S.t.`..'..<..
0320  1e 40 bf 1d c8 97 81 e0 f8 d9 d8 fb da 1d ad 5b   .@.............[
0330  a4 47 5c 64 a6 42 f1 b7 48 5d e1 3b 57 a8 37 ef   .G\d.B..H].;W.7.
0340  a1 57 c4 59 14 a5 7a 1d 80 94 fb e8 5a b4 fe 71   .W.Y..z.....Z..q
0350  85 eb e5 e1 dc d5 96 a2 0d 2f 37 65 31 e0 9b 93   ........./7e1...
0360  d7 9a c1 f8 18 27 da ed a8 9c b9 59 1a d3 bf 9c   .....'.....Y....
0370  13 08 c2 c8 ac de 97 7f 49 b8 87 88 5e 67 e6 f4   ........I...^g..
0380  be 33 dd cf 88 6d 7f 0b 36 7c 36 3b 5b c9 2d 6f   .3...m..6|6;[.-o
0390  f4 a3 65 fd 62 3f e4 5a 39 af c5 e5 c6 26 b0 a3   ..e.b?.Z9....&..
03a0  06 af b3 e5 25 32 41 3f 19 b4 0b e6 5c a2 11 cf   ....%2A?....\...
03b0  fe e4 84 1a 0d 6b 7a 9d 96 be 5a 21 0d 69 05 75   .....kz...Z!.i.u
03c0  da 82 c7 bc 1d 5b 86 62 b3 05 fb df 9b 84 c1 dc   .....[.b........
03d0  34 1a 61 73 67 7e 74 79 d6 d5 2e a1 bf 5b 41 a1   4.asg~ty.....[A.
03e0  ec c4 a1 6a c6 b8 3b dd 70 a8 f2 83 ed 8c 3b ef   ...j..;.p.....;.
03f0  be 22 08 da 68 dc 24 50 f8 ef 80 df 53 39 aa 2b   ."..h.$P....S9.+
0400  26 2f 57 c5 9f c9 0c ce 2f 24 ba 98 1a a9 07 ea   &/W...../$......
0410  0f be 83 8d 84 f7 9f 3d 7d c2 e1 70 de 36 67 b5   .......=}..p.6g.
0420  6a c5 01 5e fc af 6d 34 a3 3e e6 6c 7c c4 df ca   j..^..m4.>.l|...
0430  4e 3e c6 81 4a 4c c3 52 72 98 45 f8 ae f6 35 51   N>..JL.Rr.E...5Q
0440  a9 d4 50 26 51 75 8e 98 c6 f1 87 87 43 32 80 af   ..P&Qu......C2..
0450  30 06 05 a3 33 e5 1c 9e 79 67 35 80 93 0b b6 84   0...3...yg5.....
0460  01 9a f8 b5 2a b6 00 da e5 8a 21 fd 65 c3 00 a4   ....*.....!.e...
0470  02 79 c0 07 a8 7a b0 54 fd 7d 91 b8 d2 9e 0a 1e   .y...z.T.}......
0480  95 a0 74 94 23 f2 dd 20 8c 41 58 a6 05 6b aa bc   ..t.#.. .AX..k..
0490  ec c5 08 98 9a 6c 6b 61 2c 3a 2b 5a 3e 6c 09 5e   .....lka,:+Z>l.^
04a0  27 46 ff 20 a0 54 da 92 17 bc 33 7a 0b f4 88 d8   'F. .T....3z....
04b0  19 f3 1d 1c 9c d2 60 17 77 08 bb 43 c4 c5 02 86   ......`.w..C....
04c0  02 97 18 cc 33 ef 5c 8f 9d 47 10 b1 3c 3f 68 83   ....3.\..G..<?h.
04d0  dd ae b5 28 95 91 7e 82 f6 f6 06 c2 3a 5b bd ca   ...(..~.....:[..
04e0  b6 31 17 30 dc 65 8f 5b 23 b8 6c 38 91 51 43 d5   .1.0.e.[#.l8.QC.
04f0  af 7e 1b 20 86 d0 c6 93 fc 3c 9e 26 10 72 fb 15   .~. .....<.&.r..
0500  09 98 2c c6 86 c9 61 35 de 79 fc 34 c4 eb 0b a4   ..,...a5.y.4....
0510  e1 f8 79 59 f8 08 be 5f 45 01 30 b8 a7 89 9f fa   ..yY..._E.0.....
0520  28 fa 52 ec b0 b8 6f 99 1b 81 10 2c 99 b9 f3 25   (.R...o....,...%
0530  0f 05 c0 4f 01 94 09 4e 2d 7f 85 b1 29 79 bd ab   ...O...N-...)y..
0540  d8 12 9b 83 88 39 a6 bd ba e8 54 cf 6a cf 7b 8d   .....9....T.j.{.
0550  40 c4 e5 2b 16 5a f8 dc 64 f6 73 44 3e            @..+.Z..d.sD>

No.     Time               Source                Destination           Protocol Length Info
   2795 16:08:49.994606    119.90.20.5           10.210.66.82          HTTP     1494   Continuation

Frame 2795: 1494 bytes on wire (11952 bits), 1494 bytes captured (11952 bits) on interface 0
Ethernet II, Src: Hangzhou_d2:34:0d (3c:e5:a6:d2:34:0d), Dst: AsustekC_34:f3:aa (9c:5c:8e:34:f3:aa)
Internet Protocol Version 4, Src: 119.90.20.5, Dst: 10.210.66.82
Transmission Control Protocol, Src Port: 80 (80), Dst Port: 38675 (38675), Seq: 424801, Ack: 606, Len: 1440
Hypertext Transfer Protocol
    :b\230b]\201\325\306\201\267T\273d\261\331\267 W\205\230b\334\347\025\377\267\244$\372\262=\376\035\352[\254\020!\367O\274\200\024[\177\266\vT>\2656\325=\256\363W\020\322\231\277I\222x\236\r
