No.     Time               Source                Destination           Protocol Length Info
      4 16:35:54.020892    10.210.66.82          119.90.20.7           HTTP     668    GET /sohu/v1/Tmx7TmsCTCIDqS1W8SCGetvI9afXL5WtSFlE5YpTW3dqKOLzHhm.mp4?k=7chN0r&p=j9lvzSw3oLsUqSsmqmsmqmoCqprAqpwBhRYCzSwWsU1IyLNS0mEAZDbtWBeXfJ1S0pviNF2mqLKBgr&r=TUqvtvGDXixnyLbUZDWSqTPGRDNOfhoioMycY&q=OpCGoKOyzSwWsSCCoKOL4HrIWh1t5G6OfYXOfYNHfhbtwmbcWJe4fFb4fhvSqD2sWFASqF2sY&cip=106.120.206.146&pid=9427604&tvid=101968170&ch=tv&sz=1349_662&md=/A9WRp+GWMrmwVusD2VqPPknoWF0fxKXgPilMA==201&prod=flash&pt=1&uuid=3d4d64fb-9483-ac28-1785-741875459884 HTTP/1.1 

Frame 4: 668 bytes on wire (5344 bits), 668 bytes captured (5344 bits) on interface 0
Ethernet II, Src: AsustekC_34:f3:aa (9c:5c:8e:34:f3:aa), Dst: Hangzhou_d2:34:0d (3c:e5:a6:d2:34:0d)
Internet Protocol Version 4, Src: 10.210.66.82, Dst: 119.90.20.7
Transmission Control Protocol, Src Port: 41106 (41106), Dst Port: 80 (80), Seq: 1, Ack: 1, Len: 614
Hypertext Transfer Protocol
     [truncated]GET /sohu/v1/Tmx7TmsCTCIDqS1W8SCGetvI9afXL5WtSFlE5YpTW3dqKOLzHhm.mp4?k=7chN0r&p=j9lvzSw3oLsUqSsmqmsmqmoCqprAqpwBhRYCzSwWsU1IyLNS0mEAZDbtWBeXfJ1S0pviNF2mqLKBgr&r=TUqvtvGDXixnyLbUZDWSqTPGRDNOfhoioMycY&q=OpCGoKOyzSwWsSCCoKOL4HrIWh
    Host:621-11.vod.tv.itc.cn:80\r\n
    Connection:keep-alive\r\n
    Cache-Control: no-cache, must-revalidate\r\n
    User-Agent:sohuce:17112281723\r\n
    Range:Bytes=10158080-10747903\r\n
    \r\n
    [Full request URI [truncated]: http://621-11.vod.tv.itc.cn:80/sohu/v1/Tmx7TmsCTCIDqS1W8SCGetvI9afXL5WtSFlE5YpTW3dqKOLzHhm.mp4?k=7chN0r&p=j9lvzSw3oLsUqSsmqmsmqmoCqprAqpwBhRYCzSwWsU1IyLNS0mEAZDbtWBeXfJ1S0pviNF2mqLKBgr&r=TUqvtvGDXixnyLbUZDWSqT]
    [HTTP request 1/1]
    [Response in frame: 6]

No.     Time               Source                Destination           Protocol Length Info
      6 16:35:54.026110    119.90.20.7           10.210.66.82          HTTP     1494   HTTP/1.1 206 Partial Content  (video/mp4)

Frame 6: 1494 bytes on wire (11952 bits), 1494 bytes captured (11952 bits) on interface 0
Ethernet II, Src: Hangzhou_d2:34:0d (3c:e5:a6:d2:34:0d), Dst: AsustekC_34:f3:aa (9c:5c:8e:34:f3:aa)
Internet Protocol Version 4, Src: 119.90.20.7, Dst: 10.210.66.82
Transmission Control Protocol, Src Port: 80 (80), Dst Port: 41106 (41106), Seq: 1, Ack: 615, Len: 1440
Hypertext Transfer Protocol
Media Type

No.     Time               Source                Destination           Protocol Length Info
    294 16:35:54.101009    119.90.20.7           10.210.66.82          HTTP     1494   Continuation

Frame 294: 1494 bytes on wire (11952 bits), 1494 bytes captured (11952 bits) on interface 0
Ethernet II, Src: Hangzhou_d2:34:0d (3c:e5:a6:d2:34:0d), Dst: AsustekC_34:f3:aa (9c:5c:8e:34:f3:aa)
Internet Protocol Version 4, Src: 119.90.20.7, Dst: 10.210.66.82
Transmission Control Protocol, Src Port: 80 (80), Dst Port: 41106 (41106), Seq: 352801, Ack: 615, Len: 1440
Hypertext Transfer Protocol
    :\2317\372\034a\255\361\373fH\370\311\037B\\3549\252\326\361\327\351_\003\271\252\211o\270H\306\000\215\305!\233\004\274U_>2J\334}\372\271B\272\265P\bU\365\202N_\037\n
    Data (1380 bytes)

0000  e4 eb 72 b8 f7 05 02 18 a0 d8 fa 0a ac 12 29 cf   ..r...........).
0010  16 6c 9c fa fc a4 ad 89 b4 a0 5e 0c 91 2b ff 7f   .l........^..+..
0020  d0 ed 55 9e 26 a9 3e 23 cc 2b 20 e7 0a 82 4b 29   ..U.&.>#.+ ...K)
0030  42 24 7d b1 dc 97 68 02 40 bd 32 6f 45 bf 0a b2   B$}...h.@.2oE...
0040  b2 bb bb 26 21 b2 65 2d 29 9c 4f 9f 3c 0d 5a 29   ...&!.e-).O.<.Z)
0050  ce f5 ae 59 db 19 33 c0 ce 5e b1 6f cf 98 55 57   ...Y..3..^.o..UW
0060  17 67 3e f8 97 48 08 f3 a8 14 46 bb ee 7e b5 d6   .g>..H....F..~..
0070  b2 6a 67 7a 4a 99 54 05 65 4a 6b 9a 5f 9c 0e f4   .jgzJ.T.eJk._...
0080  8a cc 16 a7 00 a4 9b d0 e7 57 7b 36 c3 5c 14 a6   .........W{6.\..
0090  be 31 24 5e b6 99 e8 88 c8 07 97 27 e9 41 46 bc   .1$^.......'.AF.
00a0  39 9e 93 39 80 7e 90 da 1b 94 0e 42 c3 1a 4a bb   9..9.~.....B..J.
00b0  d6 ea 15 aa c2 90 2b eb bc b1 77 41 ea e3 63 42   ......+...wA..cB
00c0  d9 ae 45 21 a4 eb 25 d9 e0 f5 ae 4e ef e8 f1 ec   ..E!..%....N....
00d0  12 0d 4c e3 e8 e0 21 4d 21 03 ab 4e 5a 92 6e 36   ..L...!M!..NZ.n6
00e0  fe cf 8e e0 fa af 02 6c 55 58 c5 01 3e 57 59 e4   .......lUX..>WY.
00f0  18 d9 b8 f2 c2 d3 9c 53 d8 5f 3d c6 6e 7d 28 01   .......S._=.n}(.
0100  35 a7 44 46 77 7d 0b 2e 7f 2b 19 b2 05 4b ed be   5.DFw}...+...K..
0110  61 c8 73 18 c5 61 f3 95 33 ff 77 4c a5 1e d9 15   a.s..a..3.wL....
0120  e9 a3 ba 72 d2 ee c0 7f b8 0f d5 77 37 74 eb 67   ...r.......w7t.g
0130  a3 87 d7 24 89 41 50 26 f5 5b cc 8b 6d e1 4c 5a   ...$.AP&.[..m.LZ
0140  25 32 67 6c 2a 1f 1e 48 08 dc 85 6c 22 1f 9d cf   %2gl*..H...l"...
0150  10 f5 f1 e8 63 21 fe ae 59 e6 89 17 4a c8 5c 90   ....c!..Y...J.\.
0160  2d 40 9a ac 80 c3 47 3d 2c 3f ec cc 71 f4 8a b7   -@....G=,?..q...
0170  d8 31 6b 51 2f d1 f2 6d ae d7 45 df 13 ac a5 7e   .1kQ/..m..E....~
0180  0f b3 1e ea c8 d8 01 7b fc ab 3e 24 8e 20 17 d9   .......{..>$. ..
0190  49 e9 9c 87 88 50 57 a5 fa fb c8 4f 11 0c 36 2c   I....PW....O..6,
01a0  84 92 2c 31 ee a4 50 80 2f 75 78 eb 27 56 25 f8   ..,1..P./ux.'V%.
01b0  64 fb c9 e7 2f de 35 60 e6 58 06 08 5e 39 f1 6a   d.../.5`.X..^9.j
01c0  bb b9 17 ec e3 f7 f8 6e ad 39 4a 0a 59 17 97 a3   .......n.9J.Y...
01d0  ac 20 ec d1 c5 35 3f 1c 25 c8 58 5e 19 44 c7 4c   . ...5?.%.X^.D.L
01e0  b5 c8 98 00 57 73 eb 16 b7 bf 61 a6 a3 6e c0 06   ....Ws....a..n..
01f0  94 24 68 e7 65 72 cd 32 c8 c4 53 39 a2 8b 67 64   .$h.er.2..S9..gd
0200  96 0d 27 82 90 a5 54 59 d9 18 2d 35 88 c9 4d 2a   ..'...TY..-5..M*
0210  3b 21 19 d4 e9 0a c7 51 43 11 10 42 40 08 00 5c   ;!.....QC..B@..\
0220  31 26 31 70 20 94 2d b0 ac 9e 91 72 27 68 d6 63   1&1p .-....r'h.c
0230  f9 48 fb 19 95 57 64 26 8d 29 c0 fd 2c c1 61 92   .H...Wd&.)..,.a.
0240  54 1f 1b 9a cd 76 71 b4 74 04 b2 0c ec fe 7f 93   T....vq.t.......
0250  c7 72 59 b9 81 26 ab 87 04 dc c9 06 86 02 59 5f   .rY..&........Y_
0260  7f 6e e4 86 6c a9 15 8a e4 72 76 c4 23 2b d0 51   .n..l....rv.#+.Q
0270  16 f2 8a b9 ea 61 0f 68 c7 7b bc b0 a5 4f d7 f4   .....a.h.{...O..
0280  01 fc 59 4a 9c a9 1e 29 a0 e0 63 3b bd 9c a8 db   ..YJ...)..c;....
0290  2d c0 75 9b b6 31 9d 5e 1c 10 a5 b7 af 84 41 19   -.u..1.^......A.
02a0  56 29 ae 5a 3f c7 e1 8c 83 40 7d 0b 6c 2b 6f 06   V).Z?....@}.l+o.
02b0  d2 31 55 4f 42 b5 af bf ea 36 3b 2c 74 70 18 00   .1UOB....6;,tp..
02c0  00 00 18 00 e0 21 19 d4 da 0a cd 4d 43 11 10 c2   .....!.....MC...
02d0  10 08 aa 37 2e 45 09 a2 20 a5 90 40 93 86 8e 3e   ...7.E.. ..@...>
02e0  d9 45 41 aa 9d 4b 6d 3a 0d 32 aa 03 21 cf ae 60   .EA..Km:.2..!..`
02f0  bc c5 be b8 f4 6a 3a 6c 07 0c 0b 84 d3 d0 dc 76   .....j:l.......v
0300  94 23 24 bc d5 59 2a 35 13 ab 11 64 b2 9e 29 e4   .#$..Y*5...d..).
0310  90 83 62 d5 6c 51 7f 35 15 d9 38 22 76 eb 10 63   ..b.lQ.5..8"v..c
0320  bf a5 cd 34 45 29 e9 26 f1 e2 20 19 a7 78 e4 3a   ...4E).&.. ..x.:
0330  39 cf 58 21 2a 1d ac 60 b7 78 3b 4a 75 8a 48 cf   9.X!*..`.x;Ju.H.
0340  19 93 b2 b8 15 8b 93 b5 51 36 bd 48 f2 e4 b3 ae   ........Q6.H....
0350  52 d5 bd ec a7 be ea c6 21 0d 87 b0 b4 38 88 b4   R.......!....8..
0360  07 d0 37 69 08 2a 6d 02 c0 6b 9f f9 38 60 00 d1   ..7i.*m..k..8`..
0370  80 70 00 00 02 2b 01 9e a5 74 42 7f 29 18 fb f5   .p...+...tB.)...
0380  32 a0 55 f2 2b 61 85 cf 00 9f d2 3e f0 0a 51 00   2.U.+a.....>..Q.
0390  01 a3 04 99 52 1a bd 08 1b 9d 65 62 70 75 e8 61   ....R.....ebpu.a
03a0  4e b0 d2 3f 1a 7e 3c 1d 13 3d 48 95 8c ad 36 69   N..?.~<..=H...6i
03b0  5a 94 e5 b5 a2 9c ba 54 08 d2 8a 4c 48 b0 6b f1   Z......T...LH.k.
03c0  b5 18 2d 20 87 51 5f 87 4f 34 69 0e 7e df 54 11   ..- .Q_.O4i.~.T.
03d0  72 63 6c f8 63 f1 4f 9c 27 30 01 03 a3 fb 69 5b   rcl.c.O.'0....i[
03e0  c1 b8 16 25 7b 02 89 46 ed db c1 4f 1a a7 5b 4d   ...%{..F...O..[M
03f0  e8 ad ec 16 35 5d 63 fc 3a b3 98 e0 65 e9 d0 7d   ....5]c.:...e..}
0400  8f 1a e3 43 86 ec f0 f0 6c 3d 25 f1 a5 09 c9 a2   ...C....l=%.....
0410  49 6b e8 b6 d8 f2 1f 51 d0 6f 05 b4 05 a6 ee ed   Ik.....Q.o......
0420  93 5f db 41 fe 95 41 fa c0 02 36 07 24 bc d9 24   ._.A..A...6.$..$
0430  c3 c6 7e 18 27 80 69 47 0e 0a 3b ef 37 36 16 75   ..~.'.iG..;.76.u
0440  3f 72 fa 8b 08 9f c2 82 7d 3f a3 09 6d 9c d9 60   ?r......}?..m..`
0450  79 ba 3d 2c b7 d3 bb c6 69 aa ac 73 58 21 3b c1   y.=,....i..sX!;.
0460  5b dc 32 44 05 5f 08 1a cf e4 e6 7a e9 f7 b3 54   [.2D._.....z...T
0470  e8 d2 07 40 9f fd 96 e1 4f 59 10 c7 e3 0f 7a db   ...@....OY....z.
0480  bd 48 63 3d 3e 61 10 57 ce ac 69 ee 9b b8 dc 95   .Hc=>a.W..i.....
0490  b6 ba 3f 48 77 91 52 cd 24 10 08 48 17 cb 66 b8   ..?Hw.R.$..H..f.
04a0  24 7f b6 02 81 b6 c1 f0 89 73 09 5b bf 96 45 61   $........s.[..Ea
04b0  a0 a3 b7 0a 1f 27 cf 95 90 8c 51 2a c3 47 33 06   .....'....Q*.G3.
04c0  b5 39 cc 24 1f e3 f4 51 82 b9 46 d2 28 2f 4f 21   .9.$...Q..F.(/O!
04d0  9a 95 57 80 37 2f 19 c6 00 a3 bf 6a 94 5a b3 ac   ..W.7/.....j.Z..
04e0  bf a9 d6 2e a8 25 75 f9 a3 7e c7 f8 cc e9 52 17   .....%u..~....R.
04f0  20 2e 19 b5 87 9e 8c 39 38 88 f2 bd 04 e9 08 cc    ......98.......
0500  f7 bb 8a 13 bf 4a c0 85 30 4a b8 16 29 55 87 e1   .....J..0J..)U..
0510  b8 7b 33 2f e9 9d 5a 15 d9 b0 96 4a d4 8a eb 44   .{3/..Z....J...D
0520  9b 61 37 64 d8 fa 49 c3 43 19 40 8b 2a a9 cd 70   .a7d..I.C.@.*..p
0530  76 29 f2 f2 ef 6b 91 52 4b a2 bd 4d d5 34 7a c9   v)...k.RK..M.4z.
0540  07 8f c7 44 be 53 e8 d2 ae 64 75 b0 3b 15 38 13   ...D.S...du.;.8.
0550  8b 89 b9 b2 3d 7c 94 bb 4c 26 dc 3d 14 b5 ea a1   ....=|..L&.=....
0560  9d db f0 5b                                       ...[

No.     Time               Source                Destination           Protocol Length Info
   1036 16:36:01.575549    10.210.66.82          103.254.188.216       HTTP     512    GET /group3/M09/82/FD/MTAuMTAuODguODM=/MTAwMTE0XzE1MTM2NTgxOTQ0NDY=/cut@m=resize,w=400,h=400_cut@m=crop,x=5,y=0,w=395,h=395.png HTTP/1.1 

Frame 1036: 512 bytes on wire (4096 bits), 512 bytes captured (4096 bits) on interface 0
Ethernet II, Src: AsustekC_34:f3:aa (9c:5c:8e:34:f3:aa), Dst: Hangzhou_d2:34:0d (3c:e5:a6:d2:34:0d)
Internet Protocol Version 4, Src: 10.210.66.82, Dst: 103.254.188.216
Transmission Control Protocol, Src Port: 41121 (41121), Dst Port: 80 (80), Seq: 1, Ack: 1, Len: 458
Hypertext Transfer Protocol
    GET /group3/M09/82/FD/MTAuMTAuODguODM=/MTAwMTE0XzE1MTM2NTgxOTQ0NDY=/cut@m=resize,w=400,h=400_cut@m=crop,x=5,y=0,w=395,h=395.png HTTP/1.1\r\n
    Host: 001.img.pu.sohu.com.cn\r\n
    Connection: keep-alive\r\n
    User-Agent: Mozilla/5.0 (Windows NT 10.0; Win64; x64) AppleWebKit/537.36 (KHTML, like Gecko) Chrome/66.0.3359.139 Safari/537.36\r\n
    Accept: image/webp,image/apng,image/*,*/*;q=0.8\r\n
    Accept-Encoding: gzip, deflate\r\n
    Accept-Language: en-US,en;q=0.9,zh-TW;q=0.8,zh;q=0.7\r\n
    \r\n
    [Full request URI: http://001.img.pu.sohu.com.cn/group3/M09/82/FD/MTAuMTAuODguODM=/MTAwMTE0XzE1MTM2NTgxOTQ0NDY=/cut@m=resize,w=400,h=400_cut@m=crop,x=5,y=0,w=395,h=395.png]
    [HTTP request 1/25]
    [Response in frame: 1043]
    [Next request in frame: 1823]

No.     Time               Source                Destination           Protocol Length Info
   1037 16:36:01.575652    10.210.66.82          103.254.188.216       HTTP     504    GET /group2/M10/21/74/MTAuMTAuODguODI=/MTAwMTE0XzE1MjY1NTM0MTE1MDRfMTAyMDEwMTkwX3VnY3ZjdXQ=/cut@m=force,w=640,h=360.jpg HTTP/1.1 

Frame 1037: 504 bytes on wire (4032 bits), 504 bytes captured (4032 bits) on interface 0
Ethernet II, Src: AsustekC_34:f3:aa (9c:5c:8e:34:f3:aa), Dst: Hangzhou_d2:34:0d (3c:e5:a6:d2:34:0d)
Internet Protocol Version 4, Src: 10.210.66.82, Dst: 103.254.188.216
Transmission Control Protocol, Src Port: 41120 (41120), Dst Port: 80 (80), Seq: 1, Ack: 1, Len: 450
Hypertext Transfer Protocol
    GET /group2/M10/21/74/MTAuMTAuODguODI=/MTAwMTE0XzE1MjY1NTM0MTE1MDRfMTAyMDEwMTkwX3VnY3ZjdXQ=/cut@m=force,w=640,h=360.jpg HTTP/1.1\r\n
    Host: 001.img.pu.sohu.com.cn\r\n
    Connection: keep-alive\r\n
    User-Agent: Mozilla/5.0 (Windows NT 10.0; Win64; x64) AppleWebKit/537.36 (KHTML, like Gecko) Chrome/66.0.3359.139 Safari/537.36\r\n
    Accept: image/webp,image/apng,image/*,*/*;q=0.8\r\n
    Accept-Encoding: gzip, deflate\r\n
    Accept-Language: en-US,en;q=0.9,zh-TW;q=0.8,zh;q=0.7\r\n
    \r\n
    [Full request URI: http://001.img.pu.sohu.com.cn/group2/M10/21/74/MTAuMTAuODguODI=/MTAwMTE0XzE1MjY1NTM0MTE1MDRfMTAyMDEwMTkwX3VnY3ZjdXQ=/cut@m=force,w=640,h=360.jpg]
    [HTTP request 1/20]
    [Response in frame: 1040]
    [Next request in frame: 1800]

No.     Time               Source                Destination           Protocol Length Info
   1040 16:36:01.578839    103.254.188.216       10.210.66.82          HTTP     1494   HTTP/1.1 200 OK  (JPEG JFIF image)

Frame 1040: 1494 bytes on wire (11952 bits), 1494 bytes captured (11952 bits) on interface 0
Ethernet II, Src: Hangzhou_d2:34:0d (3c:e5:a6:d2:34:0d), Dst: AsustekC_34:f3:aa (9c:5c:8e:34:f3:aa)
Internet Protocol Version 4, Src: 103.254.188.216, Dst: 10.210.66.82
Transmission Control Protocol, Src Port: 80 (80), Dst Port: 41120 (41120), Seq: 1, Ack: 451, Len: 1440
Hypertext Transfer Protocol
    HTTP/1.1 200 OK\r\n
    Expires: Sat, 16 Jun 2018 23:02:20 GMT\r\n
    Date: Thu, 17 May 2018 23:02:20 GMT\r\n
    Server: nginx\r\n
    Content-Type: image/jpeg\r\n
    Content-Length: 64229\r\n
    Cache-Control: max-age=2592000\r\n
    Last-Modified: Thu, 17 May 2018 11:10:00 GMT\r\n
    Age: 1\r\n
    X-Via: 1.1 PSlnlydxnr31:3 (Cdn Cache Server V2.0), 1.1 PSbjzwdx3uy192:6 (Cdn Cache Server V2.0)\r\n
    Connection: keep-alive\r\n
    X-Dscp-Value: 0\r\n
    \r\n
    [HTTP response 1/20]
    [Time since request: 0.003187000 seconds]
    [Request in frame: 1037]
    [Next request in frame: 1800]
    [Next response in frame: 1801]
JPEG File Interchange Format

No.     Time               Source                Destination           Protocol Length Info
   1043 16:36:01.579747    103.254.188.216       10.210.66.82          HTTP     1494   HTTP/1.1 200 OK  (JPEG JFIF image)

Frame 1043: 1494 bytes on wire (11952 bits), 1494 bytes captured (11952 bits) on interface 0
Ethernet II, Src: Hangzhou_d2:34:0d (3c:e5:a6:d2:34:0d), Dst: AsustekC_34:f3:aa (9c:5c:8e:34:f3:aa)
Internet Protocol Version 4, Src: 103.254.188.216, Dst: 10.210.66.82
Transmission Control Protocol, Src Port: 80 (80), Dst Port: 41121 (41121), Seq: 1, Ack: 459, Len: 1440
Hypertext Transfer Protocol
    HTTP/1.1 200 OK\r\n
    Expires: Sat, 02 Jun 2018 08:57:21 GMT\r\n
    Date: Thu, 03 May 2018 08:57:21 GMT\r\n
    Server: nginx\r\n
    Content-Type: image/jpeg\r\n
    Content-Length: 10450\r\n
    Cache-Control: max-age=2592000\r\n
    Last-Modified: Thu, 19 Apr 2018 10:14:42 GMT\r\n
    Age: 1\r\n
    X-Via: 1.1 PShnlydx2pz82:3 (Cdn Cache Server V2.0), 1.1 PSbjzwdx3wo185:6 (Cdn Cache Server V2.0)\r\n
    Connection: keep-alive\r\n
    X-Dscp-Value: 0\r\n
    \r\n
    [HTTP response 1/25]
    [Time since request: 0.004198000 seconds]
    [Request in frame: 1036]
    [Next request in frame: 1823]
    [Next response in frame: 1841]
JPEG File Interchange Format

No.     Time               Source                Destination           Protocol Length Info
   1110 16:36:01.604366    10.210.66.82          211.65.195.74         HTTP     440    GET /photocloud/20180517/56push_1526536791703.jpg HTTP/1.1 

Frame 1110: 440 bytes on wire (3520 bits), 440 bytes captured (3520 bits) on interface 0
Ethernet II, Src: AsustekC_34:f3:aa (9c:5c:8e:34:f3:aa), Dst: Hangzhou_d2:34:0d (3c:e5:a6:d2:34:0d)
Internet Protocol Version 4, Src: 10.210.66.82, Dst: 211.65.195.74
Transmission Control Protocol, Src Port: 41119 (41119), Dst Port: 80 (80), Seq: 1, Ack: 1, Len: 386
Hypertext Transfer Protocol
    GET /photocloud/20180517/56push_1526536791703.jpg HTTP/1.1\r\n
    Host: 199b5714a29a2.cdn.sohucs.com\r\n
    Connection: keep-alive\r\n
    User-Agent: Mozilla/5.0 (Windows NT 10.0; Win64; x64) AppleWebKit/537.36 (KHTML, like Gecko) Chrome/66.0.3359.139 Safari/537.36\r\n
    Accept: image/webp,image/apng,image/*,*/*;q=0.8\r\n
    Accept-Encoding: gzip, deflate\r\n
    Accept-Language: en-US,en;q=0.9,zh-TW;q=0.8,zh;q=0.7\r\n
    \r\n
    [Full request URI: http://199b5714a29a2.cdn.sohucs.com/photocloud/20180517/56push_1526536791703.jpg]
    [HTTP request 1/1]
    [Response in frame: 1133]

No.     Time               Source                Destination           Protocol Length Info
   1113 16:36:01.607858    10.210.66.82          211.65.195.74         HTTP     440    GET /photocloud/20180517/56push_1526519978542.jpg HTTP/1.1 

Frame 1113: 440 bytes on wire (3520 bits), 440 bytes captured (3520 bits) on interface 0
Ethernet II, Src: AsustekC_34:f3:aa (9c:5c:8e:34:f3:aa), Dst: Hangzhou_d2:34:0d (3c:e5:a6:d2:34:0d)
Internet Protocol Version 4, Src: 10.210.66.82, Dst: 211.65.195.74
Transmission Control Protocol, Src Port: 41118 (41118), Dst Port: 80 (80), Seq: 1, Ack: 1, Len: 386
Hypertext Transfer Protocol
    GET /photocloud/20180517/56push_1526519978542.jpg HTTP/1.1\r\n
    Host: 199b5714a29a2.cdn.sohucs.com\r\n
    Connection: keep-alive\r\n
    User-Agent: Mozilla/5.0 (Windows NT 10.0; Win64; x64) AppleWebKit/537.36 (KHTML, like Gecko) Chrome/66.0.3359.139 Safari/537.36\r\n
    Accept: image/webp,image/apng,image/*,*/*;q=0.8\r\n
    Accept-Encoding: gzip, deflate\r\n
    Accept-Language: en-US,en;q=0.9,zh-TW;q=0.8,zh;q=0.7\r\n
    \r\n
    [Full request URI: http://199b5714a29a2.cdn.sohucs.com/photocloud/20180517/56push_1526519978542.jpg]
    [HTTP request 1/1]
    [Response in frame: 1178]

No.     Time               Source                Destination           Protocol Length Info
   1133 16:36:01.640393    211.65.195.74         10.210.66.82          HTTP     547    HTTP/1.1 200 OK 

Frame 1133: 547 bytes on wire (4376 bits), 547 bytes captured (4376 bits) on interface 0
Ethernet II, Src: Hangzhou_d2:34:0d (3c:e5:a6:d2:34:0d), Dst: AsustekC_34:f3:aa (9c:5c:8e:34:f3:aa)
Internet Protocol Version 4, Src: 211.65.195.74, Dst: 10.210.66.82
Transmission Control Protocol, Src Port: 80 (80), Dst Port: 41119 (41119), Seq: 1, Ack: 387, Len: 493
Hypertext Transfer Protocol
    HTTP/1.1 200 OK\r\n
    Server: NWS_TCloud_S1\r\n
    Connection: keep-alive\r\n
    Date: Fri, 18 May 2018 16:35:50 GMT\r\n
    Cache-Control: max-age=7776000\r\n
    Expires: Thu, 16 Aug 2018 16:35:50 GMT\r\n
    Last-Modified: Thu, 17 May 2018 06:00:01 GMT\r\n
    Content-Type: image/jpeg\r\n
    Content-Length: 53010\r\n
    X-NWS-LOG-UUID: 5e721d96-4a9c-4718-86eb-cbed5acee9ff edb2b83f633978103ea871fe88b0d591\r\n
    X-Cache-Lookup: Hit From Disktank3\r\n
    Access-Control-Allow-Origin: *\r\n
    X-Daa-Tunnel: hop_count=1\r\n
    X-Cache-Lookup: Hit From Inner Cluster \r\n
    \r\n
    [HTTP response 1/1]
    [Time since request: 0.036027000 seconds]
    [Request in frame: 1110]

No.     Time               Source                Destination           Protocol Length Info
   1178 16:36:01.647172    211.65.195.74         10.210.66.82          HTTP     547    HTTP/1.1 200 OK 

Frame 1178: 547 bytes on wire (4376 bits), 547 bytes captured (4376 bits) on interface 0
Ethernet II, Src: Hangzhou_d2:34:0d (3c:e5:a6:d2:34:0d), Dst: AsustekC_34:f3:aa (9c:5c:8e:34:f3:aa)
Internet Protocol Version 4, Src: 211.65.195.74, Dst: 10.210.66.82
Transmission Control Protocol, Src Port: 80 (80), Dst Port: 41118 (41118), Seq: 1, Ack: 387, Len: 493
Hypertext Transfer Protocol
    HTTP/1.1 200 OK\r\n
    Server: NWS_TCloud_S1\r\n
    Connection: keep-alive\r\n
    Date: Fri, 18 May 2018 16:35:50 GMT\r\n
    Cache-Control: max-age=7776000\r\n
    Expires: Thu, 16 Aug 2018 16:35:50 GMT\r\n
    Last-Modified: Thu, 17 May 2018 01:19:47 GMT\r\n
    Content-Type: image/jpeg\r\n
    Content-Length: 23982\r\n
    X-NWS-LOG-UUID: 634550c0-c6ec-413a-953e-eed573fe7b2f edb2b83f633978103ea871fe88b0d591\r\n
    X-Cache-Lookup: Hit From Disktank3\r\n
    Access-Control-Allow-Origin: *\r\n
    X-Daa-Tunnel: hop_count=1\r\n
    X-Cache-Lookup: Hit From Inner Cluster \r\n
    \r\n
    [HTTP response 1/1]
    [Time since request: 0.039314000 seconds]
    [Request in frame: 1113]

No.     Time               Source                Destination           Protocol Length Info
   1800 16:36:02.140490    10.210.66.82          103.254.188.216       HTTP     489    GET /group2/M07/FC/09/MTAuMTAuODguODI=/MTAwMTE0XzE1MjM2MDc5MjE3MTU=/cut@m=crop,x=36,y=36,w=126,h=126.png HTTP/1.1 

Frame 1800: 489 bytes on wire (3912 bits), 489 bytes captured (3912 bits) on interface 0
Ethernet II, Src: AsustekC_34:f3:aa (9c:5c:8e:34:f3:aa), Dst: Hangzhou_d2:34:0d (3c:e5:a6:d2:34:0d)
Internet Protocol Version 4, Src: 10.210.66.82, Dst: 103.254.188.216
Transmission Control Protocol, Src Port: 41120 (41120), Dst Port: 80 (80), Seq: 451, Ack: 64614, Len: 435
Hypertext Transfer Protocol
    GET /group2/M07/FC/09/MTAuMTAuODguODI=/MTAwMTE0XzE1MjM2MDc5MjE3MTU=/cut@m=crop,x=36,y=36,w=126,h=126.png HTTP/1.1\r\n
    Host: 001.img.pu.sohu.com.cn\r\n
    Connection: keep-alive\r\n
    User-Agent: Mozilla/5.0 (Windows NT 10.0; Win64; x64) AppleWebKit/537.36 (KHTML, like Gecko) Chrome/66.0.3359.139 Safari/537.36\r\n
    Accept: image/webp,image/apng,image/*,*/*;q=0.8\r\n
    Accept-Encoding: gzip, deflate\r\n
    Accept-Language: en-US,en;q=0.9,zh-TW;q=0.8,zh;q=0.7\r\n
    \r\n
    [Full request URI: http://001.img.pu.sohu.com.cn/group2/M07/FC/09/MTAuMTAuODguODI=/MTAwMTE0XzE1MjM2MDc5MjE3MTU=/cut@m=crop,x=36,y=36,w=126,h=126.png]
    [HTTP request 2/20]
    [Prev request in frame: 1037]
    [Response in frame: 1801]
    [Next request in frame: 1812]

No.     Time               Source                Destination           Protocol Length Info
   1801 16:36:02.143995    103.254.188.216       10.210.66.82          HTTP     1494   HTTP/1.1 200 OK  (JPEG JFIF image)

Frame 1801: 1494 bytes on wire (11952 bits), 1494 bytes captured (11952 bits) on interface 0
Ethernet II, Src: Hangzhou_d2:34:0d (3c:e5:a6:d2:34:0d), Dst: AsustekC_34:f3:aa (9c:5c:8e:34:f3:aa)
Internet Protocol Version 4, Src: 103.254.188.216, Dst: 10.210.66.82
Transmission Control Protocol, Src Port: 80 (80), Dst Port: 41120 (41120), Seq: 64614, Ack: 886, Len: 1440
Hypertext Transfer Protocol
    HTTP/1.1 200 OK\r\n
    Expires: Thu, 07 Jun 2018 09:15:59 GMT\r\n
    Date: Tue, 08 May 2018 09:15:59 GMT\r\n
    Server: nginx\r\n
    Content-Type: image/jpeg\r\n
    Content-Length: 7150\r\n
    Cache-Control: max-age=2592000\r\n
    Last-Modified: Fri, 13 Apr 2018 08:25:24 GMT\r\n
    Age: 1\r\n
    X-Via: 1.1 PSlnlydxnr31:5 (Cdn Cache Server V2.0), 1.1 PSbjzwdx3lw191:4 (Cdn Cache Server V2.0)\r\n
    Connection: keep-alive\r\n
    X-Dscp-Value: 0\r\n
    \r\n
    [HTTP response 2/20]
    [Time since request: 0.003505000 seconds]
    [Prev request in frame: 1037]
    [Prev response in frame: 1040]
    [Request in frame: 1800]
    [Next request in frame: 1812]
    [Next response in frame: 1825]
JPEG File Interchange Format

No.     Time               Source                Destination           Protocol Length Info
   1812 16:36:02.154418    10.210.66.82          103.254.188.216       HTTP     502    GET /group3/M01/22/4A/MTAuMTAuODguODM=/6_1645ffdae39g104SysCutcloudSrcimag_102039972_7_4b/cut@m=force,w=190,h=110.jpg HTTP/1.1 

Frame 1812: 502 bytes on wire (4016 bits), 502 bytes captured (4016 bits) on interface 0
Ethernet II, Src: AsustekC_34:f3:aa (9c:5c:8e:34:f3:aa), Dst: Hangzhou_d2:34:0d (3c:e5:a6:d2:34:0d)
Internet Protocol Version 4, Src: 10.210.66.82, Dst: 103.254.188.216
Transmission Control Protocol, Src Port: 41120 (41120), Dst Port: 80 (80), Seq: 886, Ack: 72147, Len: 448
Hypertext Transfer Protocol
    GET /group3/M01/22/4A/MTAuMTAuODguODM=/6_1645ffdae39g104SysCutcloudSrcimag_102039972_7_4b/cut@m=force,w=190,h=110.jpg HTTP/1.1\r\n
    Host: 001.img.pu.sohu.com.cn\r\n
    Connection: keep-alive\r\n
    User-Agent: Mozilla/5.0 (Windows NT 10.0; Win64; x64) AppleWebKit/537.36 (KHTML, like Gecko) Chrome/66.0.3359.139 Safari/537.36\r\n
    Accept: image/webp,image/apng,image/*,*/*;q=0.8\r\n
    Accept-Encoding: gzip, deflate\r\n
    Accept-Language: en-US,en;q=0.9,zh-TW;q=0.8,zh;q=0.7\r\n
    \r\n
    [Full request URI: http://001.img.pu.sohu.com.cn/group3/M01/22/4A/MTAuMTAuODguODM=/6_1645ffdae39g104SysCutcloudSrcimag_102039972_7_4b/cut@m=force,w=190,h=110.jpg]
    [HTTP request 3/20]
    [Prev request in frame: 1800]
    [Response in frame: 1825]
    [Next request in frame: 1940]

No.     Time               Source                Destination           Protocol Length Info
   1823 16:36:02.155757    10.210.66.82          103.254.188.216       HTTP     504    GET /group3/M10/22/7E/MTAuMTAuODguODQ=/MTAwMTE0XzE1MjY2NTAwMDQzNDRfMTAyMDQ0MDE3X3VnY3ZjdXQ=/cut@m=force,w=190,h=110.jpg HTTP/1.1 

Frame 1823: 504 bytes on wire (4032 bits), 504 bytes captured (4032 bits) on interface 0
Ethernet II, Src: AsustekC_34:f3:aa (9c:5c:8e:34:f3:aa), Dst: Hangzhou_d2:34:0d (3c:e5:a6:d2:34:0d)
Internet Protocol Version 4, Src: 10.210.66.82, Dst: 103.254.188.216
Transmission Control Protocol, Src Port: 41121 (41121), Dst Port: 80 (80), Seq: 459, Ack: 10836, Len: 450
Hypertext Transfer Protocol
    GET /group3/M10/22/7E/MTAuMTAuODguODQ=/MTAwMTE0XzE1MjY2NTAwMDQzNDRfMTAyMDQ0MDE3X3VnY3ZjdXQ=/cut@m=force,w=190,h=110.jpg HTTP/1.1\r\n
    Host: 001.img.pu.sohu.com.cn\r\n
    Connection: keep-alive\r\n
    User-Agent: Mozilla/5.0 (Windows NT 10.0; Win64; x64) AppleWebKit/537.36 (KHTML, like Gecko) Chrome/66.0.3359.139 Safari/537.36\r\n
    Accept: image/webp,image/apng,image/*,*/*;q=0.8\r\n
    Accept-Encoding: gzip, deflate\r\n
    Accept-Language: en-US,en;q=0.9,zh-TW;q=0.8,zh;q=0.7\r\n
    \r\n
    [Full request URI: http://001.img.pu.sohu.com.cn/group3/M10/22/7E/MTAuMTAuODguODQ=/MTAwMTE0XzE1MjY2NTAwMDQzNDRfMTAyMDQ0MDE3X3VnY3ZjdXQ=/cut@m=force,w=190,h=110.jpg]
    [HTTP request 2/25]
    [Prev request in frame: 1036]
    [Response in frame: 1841]
    [Next request in frame: 1939]

No.     Time               Source                Destination           Protocol Length Info
   1825 16:36:02.157893    103.254.188.216       10.210.66.82          HTTP     1494   HTTP/1.1 200 OK  (JPEG JFIF image)

Frame 1825: 1494 bytes on wire (11952 bits), 1494 bytes captured (11952 bits) on interface 0
Ethernet II, Src: Hangzhou_d2:34:0d (3c:e5:a6:d2:34:0d), Dst: AsustekC_34:f3:aa (9c:5c:8e:34:f3:aa)
Internet Protocol Version 4, Src: 103.254.188.216, Dst: 10.210.66.82
Transmission Control Protocol, Src Port: 80 (80), Dst Port: 41120 (41120), Seq: 72147, Ack: 1334, Len: 1440
Hypertext Transfer Protocol
    HTTP/1.1 200 OK\r\n
    Expires: Sun, 17 Jun 2018 10:41:11 GMT\r\n
    Date: Fri, 18 May 2018 10:41:11 GMT\r\n
    Server: nginx\r\n
    Content-Type: image/jpeg\r\n
    Content-Length: 10399\r\n
    Cache-Control: max-age=2592000\r\n
    Last-Modified: Fri, 18 May 2018 10:24:52 GMT\r\n
    Age: 1\r\n
    X-Via: 1.1 PShnlydx2ol77:1 (Cdn Cache Server V2.0), 1.1 PSbjzwdx3ni184:4 (Cdn Cache Server V2.0)\r\n
    Connection: keep-alive\r\n
    X-Dscp-Value: 0\r\n
    \r\n
    [HTTP response 3/20]
    [Time since request: 0.003475000 seconds]
    [Prev request in frame: 1800]
    [Prev response in frame: 1801]
    [Request in frame: 1812]
    [Next request in frame: 1940]
    [Next response in frame: 1989]
JPEG File Interchange Format

No.     Time               Source                Destination           Protocol Length Info
   1838 16:36:02.160483    10.210.66.82          61.149.9.217          HTTP     412    GET /wemedia/global/images/cpr02.png HTTP/1.1 

Frame 1838: 412 bytes on wire (3296 bits), 412 bytes captured (3296 bits) on interface 0
Ethernet II, Src: AsustekC_34:f3:aa (9c:5c:8e:34:f3:aa), Dst: Hangzhou_d2:34:0d (3c:e5:a6:d2:34:0d)
Internet Protocol Version 4, Src: 10.210.66.82, Dst: 61.149.9.217
Transmission Control Protocol, Src Port: 41138 (41138), Dst Port: 80 (80), Seq: 1, Ack: 1, Len: 358
Hypertext Transfer Protocol
    GET /wemedia/global/images/cpr02.png HTTP/1.1\r\n
    Host: css.tv.itc.cn\r\n
    Connection: keep-alive\r\n
    User-Agent: Mozilla/5.0 (Windows NT 10.0; Win64; x64) AppleWebKit/537.36 (KHTML, like Gecko) Chrome/66.0.3359.139 Safari/537.36\r\n
    Accept: image/webp,image/apng,image/*,*/*;q=0.8\r\n
    Accept-Encoding: gzip, deflate\r\n
    Accept-Language: en-US,en;q=0.9,zh-TW;q=0.8,zh;q=0.7\r\n
    \r\n
    [Full request URI: http://css.tv.itc.cn/wemedia/global/images/cpr02.png]
    [HTTP request 1/1]
    [Response in frame: 1855]

No.     Time               Source                Destination           Protocol Length Info
   1841 16:36:02.161576    103.254.188.216       10.210.66.82          HTTP     1494   HTTP/1.1 200 OK  (JPEG JFIF image)

Frame 1841: 1494 bytes on wire (11952 bits), 1494 bytes captured (11952 bits) on interface 0
Ethernet II, Src: Hangzhou_d2:34:0d (3c:e5:a6:d2:34:0d), Dst: AsustekC_34:f3:aa (9c:5c:8e:34:f3:aa)
Internet Protocol Version 4, Src: 103.254.188.216, Dst: 10.210.66.82
Transmission Control Protocol, Src Port: 80 (80), Dst Port: 41121 (41121), Seq: 10836, Ack: 909, Len: 1440
Hypertext Transfer Protocol
    HTTP/1.1 200 OK\r\n
    Expires: Sun, 17 Jun 2018 14:03:01 GMT\r\n
    Date: Fri, 18 May 2018 14:03:01 GMT\r\n
    Server: nginx\r\n
    Content-Type: image/jpeg\r\n
    Content-Length: 9076\r\n
    Cache-Control: max-age=2592000\r\n
    Last-Modified: Fri, 18 May 2018 13:43:38 GMT\r\n
    Age: 1\r\n
    X-Via: 1.1 PSlnlydxaj35:2 (Cdn Cache Server V2.0), 1.1 PSbjzwdx3uy192:0 (Cdn Cache Server V2.0)\r\n
    Connection: keep-alive\r\n
    X-Dscp-Value: 0\r\n
    \r\n
    [HTTP response 2/25]
    [Time since request: 0.005819000 seconds]
    [Prev request in frame: 1036]
    [Prev response in frame: 1043]
    [Request in frame: 1823]
    [Next request in frame: 1939]
    [Next response in frame: 1979]
JPEG File Interchange Format

No.     Time               Source                Destination           Protocol Length Info
   1854 16:36:02.163280    10.210.66.82          103.254.188.216       HTTP     502    GET /group3/M11/21/12/MTAuMTAuODguODM=/6_1645ab55c2fg102SysCutcloudSrcimag_102008113_7_2b/cut@m=force,w=190,h=110.jpg HTTP/1.1 

Frame 1854: 502 bytes on wire (4016 bits), 502 bytes captured (4016 bits) on interface 0
Ethernet II, Src: AsustekC_34:f3:aa (9c:5c:8e:34:f3:aa), Dst: Hangzhou_d2:34:0d (3c:e5:a6:d2:34:0d)
Internet Protocol Version 4, Src: 10.210.66.82, Dst: 103.254.188.216
Transmission Control Protocol, Src Port: 41139 (41139), Dst Port: 80 (80), Seq: 1, Ack: 1, Len: 448
Hypertext Transfer Protocol
    GET /group3/M11/21/12/MTAuMTAuODguODM=/6_1645ab55c2fg102SysCutcloudSrcimag_102008113_7_2b/cut@m=force,w=190,h=110.jpg HTTP/1.1\r\n
    Host: 001.img.pu.sohu.com.cn\r\n
    Connection: keep-alive\r\n
    User-Agent: Mozilla/5.0 (Windows NT 10.0; Win64; x64) AppleWebKit/537.36 (KHTML, like Gecko) Chrome/66.0.3359.139 Safari/537.36\r\n
    Accept: image/webp,image/apng,image/*,*/*;q=0.8\r\n
    Accept-Encoding: gzip, deflate\r\n
    Accept-Language: en-US,en;q=0.9,zh-TW;q=0.8,zh;q=0.7\r\n
    \r\n
    [Full request URI: http://001.img.pu.sohu.com.cn/group3/M11/21/12/MTAuMTAuODguODM=/6_1645ab55c2fg102SysCutcloudSrcimag_102008113_7_2b/cut@m=force,w=190,h=110.jpg]
    [HTTP request 1/20]
    [Response in frame: 1864]
    [Next request in frame: 1938]

No.     Time               Source                Destination           Protocol Length Info
   1855 16:36:02.163962    61.149.9.217          10.210.66.82          HTTP     1494   HTTP/1.1 200 OK  (PNG)[Malformed Packet]

Frame 1855: 1494 bytes on wire (11952 bits), 1494 bytes captured (11952 bits) on interface 0
Ethernet II, Src: Hangzhou_d2:34:0d (3c:e5:a6:d2:34:0d), Dst: AsustekC_34:f3:aa (9c:5c:8e:34:f3:aa)
Internet Protocol Version 4, Src: 61.149.9.217, Dst: 10.210.66.82
Transmission Control Protocol, Src Port: 80 (80), Dst Port: 41138 (41138), Seq: 1, Ack: 359, Len: 1440
Hypertext Transfer Protocol
    HTTP/1.1 200 OK\r\n
    Date: Fri, 18 May 2018 16:35:51 GMT\r\n
    Content-Type: image/png\r\n
    Content-Length: 1991\r\n
    Connection: keep-alive\r\n
    Expires: Fri, 18 May 2018 10:24:50 GMT\r\n
    Server: nginx/SohuTv-N2162\r\n
    Last-Modified: Tue, 03 May 2016 04:05:47 GMT\r\n
    ETag: "5728239b-7c7"\r\n
    Cache-Control: max-age=1800\r\n
    X-Cache-Hit: by css.tv.itc.cn\r\n
    Accept-Ranges: bytes\r\n
    FSS-Cache: MISS from 8096752.14781434.8850518\r\n
    FSS-Proxy: Powered by 2853792.4295594.3607478\r\n
    Age: 1\r\n
    X-Via: 1.1 jinzhong197:2 (Cdn Cache Server V2.0), 1.1 PSbjsjqwtsb149:8 (Cdn Cache Server V2.0)\r\n
    X-Dscp-Value: 0\r\n
    \r\n
    [HTTP response 1/1]
    [Time since request: 0.003479000 seconds]
    [Request in frame: 1838]
Portable Network Graphics
[Malformed Packet: PNG]

No.     Time               Source                Destination           Protocol Length Info
   1858 16:36:02.163964    61.149.9.217          10.210.66.82          HTTP     1145   Continuation

Frame 1858: 1145 bytes on wire (9160 bits), 1145 bytes captured (9160 bits) on interface 0
Ethernet II, Src: Hangzhou_d2:34:0d (3c:e5:a6:d2:34:0d), Dst: AsustekC_34:f3:aa (9c:5c:8e:34:f3:aa)
Internet Protocol Version 4, Src: 61.149.9.217, Dst: 10.210.66.82
Transmission Control Protocol, Src Port: 80 (80), Dst Port: 41138 (41138), Seq: 1461, Ack: 359, Len: 1091
[2 Reassembled TCP Segments (1111 bytes): #1857(20), #1858(1091)]
Hypertext Transfer Protocol
     [truncated]M:DerivedFrom stRef:instanceID="xmp.iid:149966FF007B11E6B1C59F5E08A4BB17" stRef:documentID="xmp.did:14996700007B11E6B1C59F5E08A4BB17"/> </rdf:Description> </rdf:RDF> </x:xmpmeta> <?xpacket end="r"?>\034:(\257\000\000\003uIDATx\
    Data (829 bytes)

0000  51 bb ee 6e 77 cf bd bd dd 7e 33 7b ff ba f6 ce   Q..nw....~3{....
0010  b4 24 7f 77 7b 3b 3b 33 3b 33 9f f9 7d bf 73 cc   .$.w{;;3;3..}.s.
0020  71 1c 60 e0 18 fd cc 61 30 26 7e 64 d1 b1 2d 38   q.`....a0&~d..-8
0030  89 18 12 71 1d b6 a5 c1 a6 32 63 2a b8 1a 84 e2   ...q.....2c*....
0040  0b d0 bd 04 8c fb a9 3b 17 bd e9 eb b8 f7 19 cc   .......;........
0050  13 9e f8 8c 85 8d 37 19 73 fa 8f 3a 73 09 43 24   ......7.s..:s.C$
0060  04 60 4a 10 17 c8 20 40 93 d6 6c 53 0f e6 f6 15   .`J... @..lS....
0070  0c f4 91 6f 70 02 55 8a a1 a8 04 ea 0b d2 63 31   ...op.U.......c1
0080  71 aa a2 61 1a 58 7a 9b 13 d8 78 3f b4 d0 90 ac   q..a.Xz...x?....
0090  51 f3 ad 6f 68 54 c3 89 f3 6f d1 d3 3b 0e bf 8f   Q..ohT...o..;...
00a0  63 6b cb 32 1c df b7 0a aa ca bd 07 66 29 18 9b   ck.2........f)..
00b0  78 4c f0 ba 33 98 ea dd 45 30 ba 84 13 30 2e b7   xL..3...E0...0..
00c0  0b 5e da d4 95 77 6f b4 9e 2d b4 11 11 30 83 83   .^...wo..-...0..
00d0  29 3e 09 2b 40 25 30 95 03 8d 77 a1 bf d9 91 81   )>.+@%0...w.....
00e0  4d 8e 19 91 60 c3 c9 cd c8 03 37 36 19 c3 f6 03   M...`.....76....
00f0  cf 10 d5 2d f9 6c c6 6d dc 79 38 88 81 e1 28 6e   ...-.l.m.y8...(n
0100  9c 6a ce 82 61 2e 0c 49 8d d7 9d 86 f9 6e 0f 12   .j..a..I.....n..
0110  12 26 26 df 8b c7 26 d3 d9 29 6d 7a 00 ed 55 eb   .&&...&..)mz..U.
0120  af 10 39 cf 22 82 6b 3a a4 24 93 5b 45 63 c7 91   ..9.".k:.$.[Ec..
0130  a0 cd b1 cc 1f 34 8c 42 4d 3e 59 6f d1 d8 42 c2   .....4.BM>Yo..B.
0140  02 56 f4 0f a7 c1 94 f4 58 9e 70 d7 db fb a0 19   .V......X.p.....
0150  16 41 39 88 27 5c b9 f8 7d 0c af df 8d e3 f1 cb   .A9.'\..}.......
0160  6f d8 b8 ae 1c 8e 95 e5 1b cb 85 31 8d b1 8c d4   o..........1....
0170  64 96 f8 bf d0 b8 1c 2f 0d 4b a0 22 a6 a2 2e 88   d....../.K."....
0180  42 70 86 ae 41 d7 26 d2 19 4b 59 c2 13 ae ef 4b   Bp..A.&..KY....K
0190  58 de 17 04 39 65 cf 86 4f 65 28 f2 33 18 53 0e   X...9e..Oe(.3.S.
01a0  3e 7c 1c 42 f3 8a 48 d2 37 49 9f a4 61 14 cc 79   >|.B..H.7I..a..y
01b0  64 6d 1c 23 59 46 42 23 88 e9 61 39 b7 c3 e2 04   dm.#YFB#..a9....
01c0  c8 d3 eb 50 7f f7 0d 43 c5 92 00 06 be 9a 38 b9   ...P...C......8.
01d0  bf 02 07 db aa 80 ef 16 76 b7 0d a2 fd 69 18 e5   ........v....i..
01e0  65 96 04 13 fd 58 ca 67 d9 92 2a f0 ec 29 c1 59   e....X.g..*..).Y
01f0  33 32 68 d1 10 62 46 34 2b 63 8e 7b 1a c3 4a c2   32h..bF4+c.{..J.
0200  b1 cc 11 6d c7 0d 29 b5 6d 1b fc b8 d6 ae a0 f3   ...m..).m.......
0210  79 18 eb 57 07 31 30 62 a2 fb bd 81 35 0d 01 6c   y..W.10b....5..l
0220  5e bf c8 fb 10 c8 f1 8f 58 b8 97 a7 0a f9 6d 26   ^.......X.....m&
0230  21 c1 f4 88 87 f4 33 1b ae 4e 85 07 65 41 f8 c6   !.....3..N..eA..
0240  a5 b6 b1 bc 9a a1 f3 6c 0d 0e 9f 1b 45 f3 9e 3e   .......l....E..>
0250  f8 c8 6f 3b 5a ca 70 e6 50 25 f8 5f da c8 2b 5b   ..o;Z.p.P%._..+[
0260  02 34 5f 7d 6e 2c 69 79 8f a1 8e 6a 2c 6d 1d c6   .4_}n,iy...j,m..
0270  a7 5b 65 05 e7 e2 96 19 81 b8 1c c7 72 8d 2b f4   .[e.........r.+.
0280  4a bb d1 50 5b 8c b5 2b 03 a8 5f 56 84 9a 4a 3f   J..P[..+.._V..J?
0290  6a ab fc 28 29 e2 b3 96 58 76 bb 58 74 ea ca 85   j..()...Xv.Xt...
02a0  f1 aa cf 05 33 c8 63 02 ac 7e 67 a8 30 9c 34 a6   ....3.c..~g.0.4.
02b0  4c ed af fe 39 72 61 14 5d 2f c2 52 b5 e2 ba fd   L...9ra.]/.R....
02c0  28 84 a3 17 47 f1 bf 22 1b 2c 25 c5 e9 00 3d 53   (...G..".,%...=S
02d0  71 a5 63 12 4f 7a a2 d2 6b d9 d7 e3 ee 28 ae 52   q.c.Oz..k....(.R
02e0  db 7c 00 4b 45 21 40 d5 0b ec f2 bd 89 bc 13 5d   .|.KE!@........]
02f0  4a b6 ed 6d 5d 3c ad 34 f3 49 75 26 f5 19 b0 48   J..m]<.4.Iu&...H
0300  de ff cd 14 60 ae 07 19 e9 db c1 3c 0d 71 dc eb   ....`......<.q..
0310  74 2a 7a 65 ec 4f 82 07 1a ef b3 f9 0d 16 99 15   t*ze.O..........
0320  58 d5 a6 1e f6 53 80 01 00 21 10 bd 37 04 69 4e   X....S...!..7.iN
0330  5d 00 00 00 00 49 45 4e 44 ae 42 60 82            ]....IEND.B`.

No.     Time               Source                Destination           Protocol Length Info
   1862 16:36:02.167347    10.210.66.82          103.254.188.216       HTTP     504    GET /group2/M10/22/7F/MTAuMTAuODguODI=/MTAwMTE0XzE1MjY2MzU1NDI0MDRfMTAyMDM4ODk4X3VnY3ZjdXQ=/cut@m=force,w=190,h=110.jpg HTTP/1.1 

Frame 1862: 504 bytes on wire (4032 bits), 504 bytes captured (4032 bits) on interface 0
Ethernet II, Src: AsustekC_34:f3:aa (9c:5c:8e:34:f3:aa), Dst: Hangzhou_d2:34:0d (3c:e5:a6:d2:34:0d)
Internet Protocol Version 4, Src: 10.210.66.82, Dst: 103.254.188.216
Transmission Control Protocol, Src Port: 41140 (41140), Dst Port: 80 (80), Seq: 1, Ack: 1, Len: 450
Hypertext Transfer Protocol
    GET /group2/M10/22/7F/MTAuMTAuODguODI=/MTAwMTE0XzE1MjY2MzU1NDI0MDRfMTAyMDM4ODk4X3VnY3ZjdXQ=/cut@m=force,w=190,h=110.jpg HTTP/1.1\r\n
    Host: 001.img.pu.sohu.com.cn\r\n
    Connection: keep-alive\r\n
    User-Agent: Mozilla/5.0 (Windows NT 10.0; Win64; x64) AppleWebKit/537.36 (KHTML, like Gecko) Chrome/66.0.3359.139 Safari/537.36\r\n
    Accept: image/webp,image/apng,image/*,*/*;q=0.8\r\n
    Accept-Encoding: gzip, deflate\r\n
    Accept-Language: en-US,en;q=0.9,zh-TW;q=0.8,zh;q=0.7\r\n
    \r\n
    [Full request URI: http://001.img.pu.sohu.com.cn/group2/M10/22/7F/MTAuMTAuODguODI=/MTAwMTE0XzE1MjY2MzU1NDI0MDRfMTAyMDM4ODk4X3VnY3ZjdXQ=/cut@m=force,w=190,h=110.jpg]
    [HTTP request 1/22]
    [Response in frame: 1878]
    [Next request in frame: 1937]

No.     Time               Source                Destination           Protocol Length Info
   1863 16:36:02.168495    10.210.66.82          103.254.188.216       HTTP     506    GET /group2/M12/20/01/MTAuMTAuODguODI=/6_164556aaa42g104SysCutcloudSrcimag_101970462_7_3b_o_h/cut@m=force,w=190,h=110.jpg HTTP/1.1 

Frame 1863: 506 bytes on wire (4048 bits), 506 bytes captured (4048 bits) on interface 0
Ethernet II, Src: AsustekC_34:f3:aa (9c:5c:8e:34:f3:aa), Dst: Hangzhou_d2:34:0d (3c:e5:a6:d2:34:0d)
Internet Protocol Version 4, Src: 10.210.66.82, Dst: 103.254.188.216
Transmission Control Protocol, Src Port: 41141 (41141), Dst Port: 80 (80), Seq: 1, Ack: 1, Len: 452
Hypertext Transfer Protocol
    GET /group2/M12/20/01/MTAuMTAuODguODI=/6_164556aaa42g104SysCutcloudSrcimag_101970462_7_3b_o_h/cut@m=force,w=190,h=110.jpg HTTP/1.1\r\n
    Host: 001.img.pu.sohu.com.cn\r\n
    Connection: keep-alive\r\n
    User-Agent: Mozilla/5.0 (Windows NT 10.0; Win64; x64) AppleWebKit/537.36 (KHTML, like Gecko) Chrome/66.0.3359.139 Safari/537.36\r\n
    Accept: image/webp,image/apng,image/*,*/*;q=0.8\r\n
    Accept-Encoding: gzip, deflate\r\n
    Accept-Language: en-US,en;q=0.9,zh-TW;q=0.8,zh;q=0.7\r\n
    \r\n
