No.     Time               Source                Destination           Protocol Length Info
   3689 15:12:42.695055    10.210.66.82          220.181.2.223         HTTP     1257   GET /r.gif?url=https%3A//tv.sohu.com/20180518/n600520312.shtml&refer=https%3A//tv.sohu.com/news/&fuid=&yyid=&passport=&sid=1801261248337106&vid=4777470&pid=9427604&cid=25&msg=impression&formwork=22&rec=0_4776664_122520101_7_20_0,1_4759251_122520101_7_20_0,2_4776106_122520101_7_20_0,3_4774957_122520101_7_20_0,4_4777130_122520101_7_20_0,5_4773917_122520101_7_20_0,6_4771499_122520101_7_20_0,7_4776949_122520101_7_20_0,8_4764334_122520101_7_20_0,9_4777116_122520101_7_20_0,10_4762724_122520101_7_20_0,11_4777118_122520101_7_20_0,12_4761698_122520101_7_20_0,13_4759688_122520101_7_20_0&ab=0&Lb=&v=maybelike_25_v20130829&uuid=1526656361519&type=100&landing_refer=https%3A%2F%2Fwww.baidu.com%2Flink%3Furl%3DFldphujrjjc0bLDPTtbLG0e_L2FWiBbYDqVdXlPTSbS%26wd%3D%26eqid%3Dd45c4bd000027ee3000000035afeed13&fuuid=597e3c71-4004-8c5b-5f1c-73cf61ff8165&lcode=&lqd=&page=1&_=1526656362178 HTTP/1.1 

Frame 3689: 1257 bytes on wire (10056 bits), 1257 bytes captured (10056 bits) on interface 0
Ethernet II, Src: AsustekC_34:f3:aa (9c:5c:8e:34:f3:aa), Dst: Hangzhou_d2:34:0d (3c:e5:a6:d2:34:0d)
Internet Protocol Version 4, Src: 10.210.66.82, Dst: 220.181.2.223
Transmission Control Protocol, Src Port: 34010 (34010), Dst Port: 80 (80), Seq: 1, Ack: 1, Len: 1203
Hypertext Transfer Protocol
     [truncated]GET /r.gif?url=https%3A//tv.sohu.com/20180518/n600520312.shtml&refer=https%3A//tv.sohu.com/news/&fuid=&yyid=&passport=&sid=1801261248337106&vid=4777470&pid=9427604&cid=25&msg=impression&formwork=22&rec=0_4776664_122520101_7_20_
        [ [truncated]Expert Info (Chat/Sequence): GET /r.gif?url=https%3A//tv.sohu.com/20180518/n600520312.shtml&refer=https%3A//tv.sohu.com/news/&fuid=&yyid=&passport=&sid=1801261248337106&vid=4777470&pid=9427604&cid=25&msg=impression&formwork=22&]
        Request Method: GET
        Request URI [truncated]: /r.gif?url=https%3A//tv.sohu.com/20180518/n600520312.shtml&refer=https%3A//tv.sohu.com/news/&fuid=&yyid=&passport=&sid=1801261248337106&vid=4777470&pid=9427604&cid=25&msg=impression&formwork=22&rec=0_4776664_122520
        Request Version: HTTP/1.1
    Host: click.hd.sohu.com.cn\r\n
    Connection: keep-alive\r\n
    User-Agent: Mozilla/5.0 (Windows NT 10.0; Win64; x64) AppleWebKit/537.36 (KHTML, like Gecko) Chrome/66.0.3359.139 Safari/537.36\r\n
    Accept: image/webp,image/apng,image/*,*/*;q=0.8\r\n
    Accept-Encoding: gzip, deflate\r\n
    Accept-Language: en-US,en;q=0.9,zh-TW;q=0.8,zh;q=0.7\r\n
    \r\n
    [Full request URI [truncated]: http://click.hd.sohu.com.cn/r.gif?url=https%3A//tv.sohu.com/20180518/n600520312.shtml&refer=https%3A//tv.sohu.com/news/&fuid=&yyid=&passport=&sid=1801261248337106&vid=4777470&pid=9427604&cid=25&msg=impression&]
    [HTTP request 1/1]
    [Response in frame: 3692]

No.     Time               Source                Destination           Protocol Length Info
   3692 15:12:42.696401    220.181.2.223         10.210.66.82          HTTP     291    HTTP/1.1 200 OK 

Frame 3692: 291 bytes on wire (2328 bits), 291 bytes captured (2328 bits) on interface 0
Ethernet II, Src: Hangzhou_d2:34:0d (3c:e5:a6:d2:34:0d), Dst: AsustekC_34:f3:aa (9c:5c:8e:34:f3:aa)
Internet Protocol Version 4, Src: 220.181.2.223, Dst: 10.210.66.82
Transmission Control Protocol, Src Port: 80 (80), Dst Port: 34010 (34010), Seq: 1, Ack: 1204, Len: 237
Hypertext Transfer Protocol
    HTTP/1.1 200 OK\r\n
        [Expert Info (Chat/Sequence): HTTP/1.1 200 OK\r\n]
        Request Version: HTTP/1.1
        Status Code: 200
        Response Phrase: OK
    Server: nginx/SohuTv-N2162\r\n
    Date: Fri, 18 May 2018 15:12:31 GMT\r\n
    Content-Type: image/gif\r\n
    Content-Length: 43\r\n
    Last-Modified: Tue, 23 May 2017 03:02:22 GMT\r\n
    Connection: close\r\n
    ETag: "5923a63e-2b"\r\n
    Accept-Ranges: bytes\r\n
    \r\n
    [HTTP response 1/1]
    [Time since request: 0.001346000 seconds]
    [Request in frame: 3689]

No.     Time               Source                Destination           Protocol Length Info
   3719 15:12:42.709833    10.210.66.82          123.126.104.149       HTTP     316    GET /ctr.gif?url=https%3A//tv.sohu.com/20180518/n600520312.shtml&refer=https%3A//tv.sohu.com/news/&fuid=&yyid=&passport=&sid=1801261248337106&vid=4777470&pid=9427604&cid=25&msg=impression&formwork=22&rec=0_4776664_122520101_7_20_0,1_4759251_122520101_7_20_0,2_4776106_122520101_7_20_0,3_4774957_122520101_7_20_0,4_4777130_122520101_7_20_0,5_4773917_122520101_7_20_0,6_4771499_122520101_7_20_0,7_4776949_122520101_7_20_0,8_4764334_122520101_7_20_0,9_4777116_122520101_7_20_0,10_4762724_122520101_7_20_0,11_4777118_122520101_7_20_0,12_4761698_122520101_7_20_0,13_4759688_122520101_7_20_0&ab=0&Lb=&v=maybelike_25_v20130829&uuid=1526656361519&type=100&landing_refer=https%3A%2F%2Fwww.baidu.com%2Flink%3Furl%3DFldphujrjjc0bLDPTtbLG0e_L2FWiBbYDqVdXlPTSbS%26wd%3D%26eqid%3Dd45c4bd000027ee3000000035afeed13&fuuid=597e3c71-4004-8c5b-5f1c-73cf61ff8165&lcode=&lqd=&page=1&_=1526656362178 HTTP/1.1 

Frame 3719: 316 bytes on wire (2528 bits), 316 bytes captured (2528 bits) on interface 0
Ethernet II, Src: AsustekC_34:f3:aa (9c:5c:8e:34:f3:aa), Dst: Hangzhou_d2:34:0d (3c:e5:a6:d2:34:0d)
Internet Protocol Version 4, Src: 10.210.66.82, Dst: 123.126.104.149
Transmission Control Protocol, Src Port: 34011 (34011), Dst Port: 80 (80), Seq: 1441, Ack: 1, Len: 262
[2 Reassembled TCP Segments (1702 bytes): #3718(1440), #3719(262)]
Hypertext Transfer Protocol
     [truncated]GET /ctr.gif?url=https%3A//tv.sohu.com/20180518/n600520312.shtml&refer=https%3A//tv.sohu.com/news/&fuid=&yyid=&passport=&sid=1801261248337106&vid=4777470&pid=9427604&cid=25&msg=impression&formwork=22&rec=0_4776664_122520101_7_2
        [ [truncated]Expert Info (Chat/Sequence): GET /ctr.gif?url=https%3A//tv.sohu.com/20180518/n600520312.shtml&refer=https%3A//tv.sohu.com/news/&fuid=&yyid=&passport=&sid=1801261248337106&vid=4777470&pid=9427604&cid=25&msg=impression&formwork=2]
        Request Method: GET
        Request URI [truncated]: /ctr.gif?url=https%3A//tv.sohu.com/20180518/n600520312.shtml&refer=https%3A//tv.sohu.com/news/&fuid=&yyid=&passport=&sid=1801261248337106&vid=4777470&pid=9427604&cid=25&msg=impression&formwork=22&rec=0_4776664_1225
        Request Version: HTTP/1.1
    Host: ctr.hd.sohu.com\r\n
    Connection: keep-alive\r\n
    User-Agent: Mozilla/5.0 (Windows NT 10.0; Win64; x64) AppleWebKit/537.36 (KHTML, like Gecko) Chrome/66.0.3359.139 Safari/537.36\r\n
    Accept: image/webp,image/apng,image/*,*/*;q=0.8\r\n
    Accept-Encoding: gzip, deflate\r\n
    Accept-Language: en-US,en;q=0.9,zh-TW;q=0.8,zh;q=0.7\r\n
     [truncated]Cookie: SUV=1801261248337106; reqtype=pc; gidinf=x099980109ee0d6dc0266280e000622638cc2c66f137; beans_freq=1; IPLOC=CN1100; beans_dmp=%7B%22admaster%22%3A1526656297%2C%22shunfei%22%3A1526656297%2C%22reachmax%22%3A1526656297%2C%2
    \r\n
    [Full request URI [truncated]: http://ctr.hd.sohu.com/ctr.gif?url=https%3A//tv.sohu.com/20180518/n600520312.shtml&refer=https%3A//tv.sohu.com/news/&fuid=&yyid=&passport=&sid=1801261248337106&vid=4777470&pid=9427604&cid=25&msg=impression&for]
    [HTTP request 1/4]
    [Response in frame: 3726]
    [Next request in frame: 4841]

No.     Time               Source                Destination           Protocol Length Info
   3726 15:12:42.721544    123.126.104.149       10.210.66.82          HTTP     361    HTTP/1.1 200 OK  (GIF89a)

Frame 3726: 361 bytes on wire (2888 bits), 361 bytes captured (2888 bits) on interface 0
Ethernet II, Src: Hangzhou_d2:34:0d (3c:e5:a6:d2:34:0d), Dst: AsustekC_34:f3:aa (9c:5c:8e:34:f3:aa)
Internet Protocol Version 4, Src: 123.126.104.149, Dst: 10.210.66.82
Transmission Control Protocol, Src Port: 80 (80), Dst Port: 34011 (34011), Seq: 1, Ack: 1703, Len: 307
Hypertext Transfer Protocol
    HTTP/1.1 200 OK\r\n
        [Expert Info (Chat/Sequence): HTTP/1.1 200 OK\r\n]
        Request Version: HTTP/1.1
        Status Code: 200
        Response Phrase: OK
    Server: nginx/SohuTv-N2162\r\n
    Date: Fri, 18 May 2018 15:12:31 GMT\r\n
    Content-Type: image/gif\r\n
    Content-Length: 43\r\n
    Last-Modified: Mon, 28 Sep 1970 06:00:00 GMT\r\n
    Connection: keep-alive\r\n
    Expires: Fri, 18 May 2018 15:12:30 GMT\r\n
    Cache-Control: no-cache\r\n
    \r\n
    [HTTP response 1/4]
    [Time since request: 0.011711000 seconds]
    [Request in frame: 3719]
    [Next request in frame: 4841]
    [Next response in frame: 4852]
Compuserve GIF, Version: GIF89a

No.     Time               Source                Destination           Protocol Length Info
   3817 15:12:43.463199    10.210.66.82          59.47.162.84          HTTP     1308   GET /img/20180517/101993905_4776664_short_H_144211_3665_seg_1_snap_001_54_b_59Iy0_pic23.jpg HTTP/1.1 

Frame 3817: 1308 bytes on wire (10464 bits), 1308 bytes captured (10464 bits) on interface 0
Ethernet II, Src: AsustekC_34:f3:aa (9c:5c:8e:34:f3:aa), Dst: Hangzhou_d2:34:0d (3c:e5:a6:d2:34:0d)
Internet Protocol Version 4, Src: 10.210.66.82, Dst: 59.47.162.84
Transmission Control Protocol, Src Port: 34017 (34017), Dst Port: 80 (80), Seq: 1, Ack: 1, Len: 1254
Hypertext Transfer Protocol
    GET /img/20180517/101993905_4776664_short_H_144211_3665_seg_1_snap_001_54_b_59Iy0_pic23.jpg HTTP/1.1\r\n
        [Expert Info (Chat/Sequence): GET /img/20180517/101993905_4776664_short_H_144211_3665_seg_1_snap_001_54_b_59Iy0_pic23.jpg HTTP/1.1\r\n]
        Request Method: GET
        Request URI: /img/20180517/101993905_4776664_short_H_144211_3665_seg_1_snap_001_54_b_59Iy0_pic23.jpg
        Request Version: HTTP/1.1
    Host: photocdn.tv.sohu.com\r\n
    Connection: keep-alive\r\n
    User-Agent: Mozilla/5.0 (Windows NT 10.0; Win64; x64) AppleWebKit/537.36 (KHTML, like Gecko) Chrome/66.0.3359.139 Safari/537.36\r\n
    Accept: image/webp,image/apng,image/*,*/*;q=0.8\r\n
    Accept-Encoding: gzip, deflate\r\n
    Accept-Language: en-US,en;q=0.9,zh-TW;q=0.8,zh;q=0.7\r\n
     [truncated]Cookie: SUV=1801261248337106; reqtype=pc; gidinf=x099980109ee0d6dc0266280e000622638cc2c66f137; ch_key=50e48c6168d7b908; ifoxinstalled=false; newpuid=15266562953178784720; landingrefer=https%3A%2F%2Fwww.baidu.com%2Flink%3Furl%3D
    \r\n
    [Full request URI: http://photocdn.tv.sohu.com/img/20180517/101993905_4776664_short_H_144211_3665_seg_1_snap_001_54_b_59Iy0_pic23.jpg]
    [HTTP request 1/2]
    [Response in frame: 3835]
    [Next request in frame: 3891]

No.     Time               Source                Destination           Protocol Length Info
   3822 15:12:43.464026    10.210.66.82          59.47.162.84          HTTP     1309   GET /img/20180509/101731804_4759251_short_H_094025_19748_seg_1_snap_001_91_b_t7o9p_pic23.jpg HTTP/1.1 

Frame 3822: 1309 bytes on wire (10472 bits), 1309 bytes captured (10472 bits) on interface 0
Ethernet II, Src: AsustekC_34:f3:aa (9c:5c:8e:34:f3:aa), Dst: Hangzhou_d2:34:0d (3c:e5:a6:d2:34:0d)
Internet Protocol Version 4, Src: 10.210.66.82, Dst: 59.47.162.84
Transmission Control Protocol, Src Port: 34020 (34020), Dst Port: 80 (80), Seq: 1, Ack: 1, Len: 1255
Hypertext Transfer Protocol
    GET /img/20180509/101731804_4759251_short_H_094025_19748_seg_1_snap_001_91_b_t7o9p_pic23.jpg HTTP/1.1\r\n
        [Expert Info (Chat/Sequence): GET /img/20180509/101731804_4759251_short_H_094025_19748_seg_1_snap_001_91_b_t7o9p_pic23.jpg HTTP/1.1\r\n]
        Request Method: GET
        Request URI: /img/20180509/101731804_4759251_short_H_094025_19748_seg_1_snap_001_91_b_t7o9p_pic23.jpg
        Request Version: HTTP/1.1
    Host: photocdn.tv.sohu.com\r\n
    Connection: keep-alive\r\n
    User-Agent: Mozilla/5.0 (Windows NT 10.0; Win64; x64) AppleWebKit/537.36 (KHTML, like Gecko) Chrome/66.0.3359.139 Safari/537.36\r\n
    Accept: image/webp,image/apng,image/*,*/*;q=0.8\r\n
    Accept-Encoding: gzip, deflate\r\n
    Accept-Language: en-US,en;q=0.9,zh-TW;q=0.8,zh;q=0.7\r\n
     [truncated]Cookie: SUV=1801261248337106; reqtype=pc; gidinf=x099980109ee0d6dc0266280e000622638cc2c66f137; ch_key=50e48c6168d7b908; ifoxinstalled=false; newpuid=15266562953178784720; landingrefer=https%3A%2F%2Fwww.baidu.com%2Flink%3Furl%3D
    \r\n
    [Full request URI: http://photocdn.tv.sohu.com/img/20180509/101731804_4759251_short_H_094025_19748_seg_1_snap_001_91_b_t7o9p_pic23.jpg]
    [HTTP request 1/4]
    [Response in frame: 3843]
    [Next request in frame: 3887]

No.     Time               Source                Destination           Protocol Length Info
   3823 15:12:43.464102    10.210.66.82          59.47.162.84          HTTP     1310   GET /img/20180517/101987218_4776106_short_H_095153_19752_seg_1_snap_001_225_b_13RUg_pic23.jpg HTTP/1.1 

Frame 3823: 1310 bytes on wire (10480 bits), 1310 bytes captured (10480 bits) on interface 0
Ethernet II, Src: AsustekC_34:f3:aa (9c:5c:8e:34:f3:aa), Dst: Hangzhou_d2:34:0d (3c:e5:a6:d2:34:0d)
Internet Protocol Version 4, Src: 10.210.66.82, Dst: 59.47.162.84
Transmission Control Protocol, Src Port: 34019 (34019), Dst Port: 80 (80), Seq: 1, Ack: 1, Len: 1256
Hypertext Transfer Protocol
    GET /img/20180517/101987218_4776106_short_H_095153_19752_seg_1_snap_001_225_b_13RUg_pic23.jpg HTTP/1.1\r\n
        [Expert Info (Chat/Sequence): GET /img/20180517/101987218_4776106_short_H_095153_19752_seg_1_snap_001_225_b_13RUg_pic23.jpg HTTP/1.1\r\n]
        Request Method: GET
        Request URI: /img/20180517/101987218_4776106_short_H_095153_19752_seg_1_snap_001_225_b_13RUg_pic23.jpg
        Request Version: HTTP/1.1
    Host: photocdn.tv.sohu.com\r\n
    Connection: keep-alive\r\n
    User-Agent: Mozilla/5.0 (Windows NT 10.0; Win64; x64) AppleWebKit/537.36 (KHTML, like Gecko) Chrome/66.0.3359.139 Safari/537.36\r\n
    Accept: image/webp,image/apng,image/*,*/*;q=0.8\r\n
    Accept-Encoding: gzip, deflate\r\n
    Accept-Language: en-US,en;q=0.9,zh-TW;q=0.8,zh;q=0.7\r\n
     [truncated]Cookie: SUV=1801261248337106; reqtype=pc; gidinf=x099980109ee0d6dc0266280e000622638cc2c66f137; ch_key=50e48c6168d7b908; ifoxinstalled=false; newpuid=15266562953178784720; landingrefer=https%3A%2F%2Fwww.baidu.com%2Flink%3Furl%3D
    \r\n
    [Full request URI: http://photocdn.tv.sohu.com/img/20180517/101987218_4776106_short_H_095153_19752_seg_1_snap_001_225_b_13RUg_pic23.jpg]
    [HTTP request 1/4]
    [Response in frame: 3851]
    [Next request in frame: 3886]

No.     Time               Source                Destination           Protocol Length Info
   3826 15:12:43.466467    10.210.66.82          59.47.162.84          HTTP     1309   GET /img/20180516/101959565_4774957_short_H_134641_19750_seg_1_snap_001_69_b_3S42I_pic23.jpg HTTP/1.1 

Frame 3826: 1309 bytes on wire (10472 bits), 1309 bytes captured (10472 bits) on interface 0
Ethernet II, Src: AsustekC_34:f3:aa (9c:5c:8e:34:f3:aa), Dst: Hangzhou_d2:34:0d (3c:e5:a6:d2:34:0d)
Internet Protocol Version 4, Src: 10.210.66.82, Dst: 59.47.162.84
Transmission Control Protocol, Src Port: 34016 (34016), Dst Port: 80 (80), Seq: 1, Ack: 1, Len: 1255
Hypertext Transfer Protocol
    GET /img/20180516/101959565_4774957_short_H_134641_19750_seg_1_snap_001_69_b_3S42I_pic23.jpg HTTP/1.1\r\n
        [Expert Info (Chat/Sequence): GET /img/20180516/101959565_4774957_short_H_134641_19750_seg_1_snap_001_69_b_3S42I_pic23.jpg HTTP/1.1\r\n]
        Request Method: GET
        Request URI: /img/20180516/101959565_4774957_short_H_134641_19750_seg_1_snap_001_69_b_3S42I_pic23.jpg
        Request Version: HTTP/1.1
    Host: photocdn.tv.sohu.com\r\n
    Connection: keep-alive\r\n
    User-Agent: Mozilla/5.0 (Windows NT 10.0; Win64; x64) AppleWebKit/537.36 (KHTML, like Gecko) Chrome/66.0.3359.139 Safari/537.36\r\n
    Accept: image/webp,image/apng,image/*,*/*;q=0.8\r\n
    Accept-Encoding: gzip, deflate\r\n
    Accept-Language: en-US,en;q=0.9,zh-TW;q=0.8,zh;q=0.7\r\n
     [truncated]Cookie: SUV=1801261248337106; reqtype=pc; gidinf=x099980109ee0d6dc0266280e000622638cc2c66f137; ch_key=50e48c6168d7b908; ifoxinstalled=false; newpuid=15266562953178784720; landingrefer=https%3A%2F%2Fwww.baidu.com%2Flink%3Furl%3D
    \r\n
    [Full request URI: http://photocdn.tv.sohu.com/img/20180516/101959565_4774957_short_H_134641_19750_seg_1_snap_001_69_b_3S42I_pic23.jpg]
    [HTTP request 1/3]
    [Response in frame: 3861]
    [Next request in frame: 3890]

No.     Time               Source                Destination           Protocol Length Info
   3831 15:12:43.468036    10.210.66.82          59.47.162.84          HTTP     1308   GET /img/20180517/101993991_4777130_short_H_191613_3669_seg_1_snap_001_46_b_62D25_pic23.jpg HTTP/1.1 

Frame 3831: 1308 bytes on wire (10464 bits), 1308 bytes captured (10464 bits) on interface 0
Ethernet II, Src: AsustekC_34:f3:aa (9c:5c:8e:34:f3:aa), Dst: Hangzhou_d2:34:0d (3c:e5:a6:d2:34:0d)
Internet Protocol Version 4, Src: 10.210.66.82, Dst: 59.47.162.84
Transmission Control Protocol, Src Port: 34018 (34018), Dst Port: 80 (80), Seq: 1, Ack: 1, Len: 1254
Hypertext Transfer Protocol
    GET /img/20180517/101993991_4777130_short_H_191613_3669_seg_1_snap_001_46_b_62D25_pic23.jpg HTTP/1.1\r\n
        [Expert Info (Chat/Sequence): GET /img/20180517/101993991_4777130_short_H_191613_3669_seg_1_snap_001_46_b_62D25_pic23.jpg HTTP/1.1\r\n]
        Request Method: GET
        Request URI: /img/20180517/101993991_4777130_short_H_191613_3669_seg_1_snap_001_46_b_62D25_pic23.jpg
        Request Version: HTTP/1.1
    Host: photocdn.tv.sohu.com\r\n
    Connection: keep-alive\r\n
    User-Agent: Mozilla/5.0 (Windows NT 10.0; Win64; x64) AppleWebKit/537.36 (KHTML, like Gecko) Chrome/66.0.3359.139 Safari/537.36\r\n
    Accept: image/webp,image/apng,image/*,*/*;q=0.8\r\n
    Accept-Encoding: gzip, deflate\r\n
    Accept-Language: en-US,en;q=0.9,zh-TW;q=0.8,zh;q=0.7\r\n
     [truncated]Cookie: SUV=1801261248337106; reqtype=pc; gidinf=x099980109ee0d6dc0266280e000622638cc2c66f137; ch_key=50e48c6168d7b908; ifoxinstalled=false; newpuid=15266562953178784720; landingrefer=https%3A%2F%2Fwww.baidu.com%2Flink%3Furl%3D
    \r\n
    [Full request URI: http://photocdn.tv.sohu.com/img/20180517/101993991_4777130_short_H_191613_3669_seg_1_snap_001_46_b_62D25_pic23.jpg]
    [HTTP request 1/5]
    [Response in frame: 3869]
    [Next request in frame: 3889]

No.     Time               Source                Destination           Protocol Length Info
   3832 15:12:43.468105    10.210.66.82          59.47.162.84          HTTP     1308   GET /img/20180516/101956612_4773917_short_H_115523_19748_seg_1_snap_001_9_b_816t5_pic23.jpg HTTP/1.1 

Frame 3832: 1308 bytes on wire (10464 bits), 1308 bytes captured (10464 bits) on interface 0
Ethernet II, Src: AsustekC_34:f3:aa (9c:5c:8e:34:f3:aa), Dst: Hangzhou_d2:34:0d (3c:e5:a6:d2:34:0d)
Internet Protocol Version 4, Src: 10.210.66.82, Dst: 59.47.162.84
Transmission Control Protocol, Src Port: 34015 (34015), Dst Port: 80 (80), Seq: 1, Ack: 1, Len: 1254
Hypertext Transfer Protocol
    GET /img/20180516/101956612_4773917_short_H_115523_19748_seg_1_snap_001_9_b_816t5_pic23.jpg HTTP/1.1\r\n
        [Expert Info (Chat/Sequence): GET /img/20180516/101956612_4773917_short_H_115523_19748_seg_1_snap_001_9_b_816t5_pic23.jpg HTTP/1.1\r\n]
        Request Method: GET
        Request URI: /img/20180516/101956612_4773917_short_H_115523_19748_seg_1_snap_001_9_b_816t5_pic23.jpg
        Request Version: HTTP/1.1
    Host: photocdn.tv.sohu.com\r\n
    Connection: keep-alive\r\n
    User-Agent: Mozilla/5.0 (Windows NT 10.0; Win64; x64) AppleWebKit/537.36 (KHTML, like Gecko) Chrome/66.0.3359.139 Safari/537.36\r\n
    Accept: image/webp,image/apng,image/*,*/*;q=0.8\r\n
    Accept-Encoding: gzip, deflate\r\n
    Accept-Language: en-US,en;q=0.9,zh-TW;q=0.8,zh;q=0.7\r\n
     [truncated]Cookie: SUV=1801261248337106; reqtype=pc; gidinf=x099980109ee0d6dc0266280e000622638cc2c66f137; ch_key=50e48c6168d7b908; ifoxinstalled=false; newpuid=15266562953178784720; landingrefer=https%3A%2F%2Fwww.baidu.com%2Flink%3Furl%3D
    \r\n
    [Full request URI: http://photocdn.tv.sohu.com/img/20180516/101956612_4773917_short_H_115523_19748_seg_1_snap_001_9_b_816t5_pic23.jpg]
    [HTTP request 1/2]
    [Response in frame: 3877]
    [Next request in frame: 3888]

No.     Time               Source                Destination           Protocol Length Info
   3835 15:12:43.483811    59.47.162.84          10.210.66.82          HTTP     1494   HTTP/1.1 200 OK  (JPEG JFIF image)

Frame 3835: 1494 bytes on wire (11952 bits), 1494 bytes captured (11952 bits) on interface 0
Ethernet II, Src: Hangzhou_d2:34:0d (3c:e5:a6:d2:34:0d), Dst: AsustekC_34:f3:aa (9c:5c:8e:34:f3:aa)
Internet Protocol Version 4, Src: 59.47.162.84, Dst: 10.210.66.82
Transmission Control Protocol, Src Port: 80 (80), Dst Port: 34017 (34017), Seq: 1, Ack: 1255, Len: 1440
Hypertext Transfer Protocol
    HTTP/1.1 200 OK\r\n
        [Expert Info (Chat/Sequence): HTTP/1.1 200 OK\r\n]
        Request Version: HTTP/1.1
        Status Code: 200
        Response Phrase: OK
    Date: Fri, 18 May 2018 15:12:32 GMT\r\n
    Content-Type: image/jpeg\r\n
    Content-Length: 8083\r\n
    Connection: keep-alive\r\n
    Last-Modified: Thu, 17 May 2018 06:44:00 GMT\r\n
    Server: SCSImageServer\r\n
    ETag: "da270461e735960e35afd264a6b668fc"\r\n
    Access-Control-Allow-Origin: *\r\n
    Cache-Control: max-age=7776000\r\n
    FSS-Cache: MISS from 9580427.16723861.11355128\r\n
    FSS-Proxy: Powered by 3747634.5058364.5522246\r\n
    Age: 1\r\n
    X-Via: 1.1 PSjsczsx2ct39:4 (Cdn Cache Server V2.0), 1.1 jfzhdx51:2 (Cdn Cache Server V2.0), 1.1 PSlnlydxom27:10 (Cdn Cache Server V2.0)\r\n
    X-Dscp-Value: 0\r\n
    \r\n
    [HTTP response 1/2]
    [Time since request: 0.020612000 seconds]
    [Request in frame: 3817]
    [Next request in frame: 3891]
    [Next response in frame: 3907]
JPEG File Interchange Format

No.     Time               Source                Destination           Protocol Length Info
   3843 15:12:43.484641    59.47.162.84          10.210.66.82          HTTP     1494   HTTP/1.1 200 OK  (JPEG JFIF image)

Frame 3843: 1494 bytes on wire (11952 bits), 1494 bytes captured (11952 bits) on interface 0
Ethernet II, Src: Hangzhou_d2:34:0d (3c:e5:a6:d2:34:0d), Dst: AsustekC_34:f3:aa (9c:5c:8e:34:f3:aa)
Internet Protocol Version 4, Src: 59.47.162.84, Dst: 10.210.66.82
Transmission Control Protocol, Src Port: 80 (80), Dst Port: 34020 (34020), Seq: 1, Ack: 1256, Len: 1440
Hypertext Transfer Protocol
    HTTP/1.1 200 OK\r\n
        [Expert Info (Chat/Sequence): HTTP/1.1 200 OK\r\n]
        Request Version: HTTP/1.1
        Status Code: 200
        Response Phrase: OK
    Date: Fri, 18 May 2018 15:12:32 GMT\r\n
    Content-Type: image/jpeg\r\n
    Content-Length: 5591\r\n
    Connection: keep-alive\r\n
    Last-Modified: Fri, 18 May 2018 13:31:28 GMT\r\n
    Server: SCSImageServer\r\n
    ETag: "4f27ffe6aa03e3bf9a225b1c563cd56c"\r\n
    Access-Control-Allow-Origin: *\r\n
    Cache-Control: max-age=7776000\r\n
    FSS-Cache: MISS from 9842575.17248153.11617280\r\n
    FSS-Proxy: Powered by 3747634.5058364.5522246\r\n
    Age: 1\r\n
    X-Via: 1.1 jfzhdx51:4 (Cdn Cache Server V2.0), 1.1 PSlnlydxom27:9 (Cdn Cache Server V2.0)\r\n
    X-Dscp-Value: 0\r\n
    \r\n
    [HTTP response 1/4]
    [Time since request: 0.020615000 seconds]
    [Request in frame: 3822]
    [Next request in frame: 3887]
    [Next response in frame: 3892]
JPEG File Interchange Format

No.     Time               Source                Destination           Protocol Length Info
   3851 15:12:43.485511    59.47.162.84          10.210.66.82          HTTP     1494   HTTP/1.1 200 OK  (JPEG JFIF image)

Frame 3851: 1494 bytes on wire (11952 bits), 1494 bytes captured (11952 bits) on interface 0
Ethernet II, Src: Hangzhou_d2:34:0d (3c:e5:a6:d2:34:0d), Dst: AsustekC_34:f3:aa (9c:5c:8e:34:f3:aa)
Internet Protocol Version 4, Src: 59.47.162.84, Dst: 10.210.66.82
Transmission Control Protocol, Src Port: 80 (80), Dst Port: 34019 (34019), Seq: 1, Ack: 1257, Len: 1440
Hypertext Transfer Protocol
    HTTP/1.1 200 OK\r\n
        [Expert Info (Chat/Sequence): HTTP/1.1 200 OK\r\n]
        Request Version: HTTP/1.1
        Status Code: 200
        Response Phrase: OK
    Date: Fri, 18 May 2018 15:12:32 GMT\r\n
    Content-Type: image/jpeg\r\n
    Content-Length: 7187\r\n
    Connection: keep-alive\r\n
    Last-Modified: Thu, 17 May 2018 02:02:15 GMT\r\n
    Server: SCSImageServer\r\n
    ETag: "a36c3b43b6ff70915806dcba0c01fef2"\r\n
    Access-Control-Allow-Origin: *\r\n
    Cache-Control: max-age=7776000\r\n
    FSS-Cache: MISS from 10104723.17772445.11879432\r\n
    FSS-Proxy: Powered by 3878708.5320510.5653322\r\n
    Age: 1\r\n
    X-Via: 1.1 PSjsczsx2ct39:2 (Cdn Cache Server V2.0), 1.1 jfzhdx51:6 (Cdn Cache Server V2.0), 1.1 PSlnlydxhw29:0 (Cdn Cache Server V2.0)\r\n
    X-Dscp-Value: 0\r\n
    \r\n
    [HTTP response 1/4]
    [Time since request: 0.021409000 seconds]
    [Request in frame: 3823]
    [Next request in frame: 3886]
    [Next response in frame: 3897]
JPEG File Interchange Format

No.     Time               Source                Destination           Protocol Length Info
   3861 15:12:43.491093    59.47.162.84          10.210.66.82          HTTP     1494   HTTP/1.1 200 OK  (JPEG JFIF image)

Frame 3861: 1494 bytes on wire (11952 bits), 1494 bytes captured (11952 bits) on interface 0
Ethernet II, Src: Hangzhou_d2:34:0d (3c:e5:a6:d2:34:0d), Dst: AsustekC_34:f3:aa (9c:5c:8e:34:f3:aa)
Internet Protocol Version 4, Src: 59.47.162.84, Dst: 10.210.66.82
Transmission Control Protocol, Src Port: 80 (80), Dst Port: 34016 (34016), Seq: 1, Ack: 1256, Len: 1440
Hypertext Transfer Protocol
    HTTP/1.1 200 OK\r\n
        [Expert Info (Chat/Sequence): HTTP/1.1 200 OK\r\n]
        Request Version: HTTP/1.1
        Status Code: 200
        Response Phrase: OK
    Date: Fri, 18 May 2018 15:12:32 GMT\r\n
    Content-Type: image/jpeg\r\n
    Content-Length: 4862\r\n
    Connection: keep-alive\r\n
    Last-Modified: Wed, 16 May 2018 05:48:33 GMT\r\n
    Server: SCSImageServer\r\n
    ETag: "8dbb675b4a3edf7f9ec22b6d7365dfae"\r\n
    Access-Control-Allow-Origin: *\r\n
    Cache-Control: max-age=7776000\r\n
    FSS-Cache: MISS from 13998460.19372422.21936590\r\n
    FSS-Proxy: Powered by 10066240.11508042.18004310\r\n
    Age: 1\r\n
    X-Via: 1.1 PSzjlssx4ls121:6 (Cdn Cache Server V2.0), 1.1 uzhoudianxin52:2 (Cdn Cache Server V2.0), 1.1 PSlnlydxkv28:8 (Cdn Cache Server V2.0)\r\n
    X-Dscp-Value: 0\r\n
    \r\n
    [HTTP response 1/3]
    [Time since request: 0.024626000 seconds]
    [Request in frame: 3826]
    [Next request in frame: 3890]
    [Next response in frame: 3931]
JPEG File Interchange Format

No.     Time               Source                Destination           Protocol Length Info
   3869 15:12:43.493477    59.47.162.84          10.210.66.82          HTTP     1494   HTTP/1.1 200 OK  (JPEG JFIF image)

Frame 3869: 1494 bytes on wire (11952 bits), 1494 bytes captured (11952 bits) on interface 0
Ethernet II, Src: Hangzhou_d2:34:0d (3c:e5:a6:d2:34:0d), Dst: AsustekC_34:f3:aa (9c:5c:8e:34:f3:aa)
Internet Protocol Version 4, Src: 59.47.162.84, Dst: 10.210.66.82
Transmission Control Protocol, Src Port: 80 (80), Dst Port: 34018 (34018), Seq: 1, Ack: 1255, Len: 1440
Hypertext Transfer Protocol
    HTTP/1.1 200 OK\r\n
        [Expert Info (Chat/Sequence): HTTP/1.1 200 OK\r\n]
        Request Version: HTTP/1.1
        Status Code: 200
        Response Phrase: OK
    Date: Fri, 18 May 2018 15:12:32 GMT\r\n
    Content-Type: image/jpeg\r\n
    Content-Length: 7951\r\n
    Connection: keep-alive\r\n
    Last-Modified: Thu, 17 May 2018 11:17:17 GMT\r\n
    Server: SCSImageServer\r\n
    ETag: "d7df6a6645e52a636691dd2ea95eed8c"\r\n
    Access-Control-Allow-Origin: *\r\n
    Cache-Control: max-age=7776000\r\n
    FSS-Cache: MISS from 13801849.18979203.21739976\r\n
    FSS-Proxy: Powered by 3693417.5331827.5087618\r\n
    Age: 1\r\n
    X-Via: 1.1 uzhoudianxin53:5 (Cdn Cache Server V2.0), 1.1 PSlnlydxhw29:8 (Cdn Cache Server V2.0)\r\n
    X-Dscp-Value: 0\r\n
    \r\n
    [HTTP response 1/5]
    [Time since request: 0.025441000 seconds]
    [Request in frame: 3831]
    [Next request in frame: 3889]
    [Next response in frame: 3924]
JPEG File Interchange Format

No.     Time               Source                Destination           Protocol Length Info
   3877 15:12:43.494323    59.47.162.84          10.210.66.82          HTTP     1494   HTTP/1.1 200 OK  (JPEG JFIF image)

Frame 3877: 1494 bytes on wire (11952 bits), 1494 bytes captured (11952 bits) on interface 0
Ethernet II, Src: Hangzhou_d2:34:0d (3c:e5:a6:d2:34:0d), Dst: AsustekC_34:f3:aa (9c:5c:8e:34:f3:aa)
Internet Protocol Version 4, Src: 59.47.162.84, Dst: 10.210.66.82
Transmission Control Protocol, Src Port: 80 (80), Dst Port: 34015 (34015), Seq: 1, Ack: 1255, Len: 1440
Hypertext Transfer Protocol
    HTTP/1.1 200 OK\r\n
        [Expert Info (Chat/Sequence): HTTP/1.1 200 OK\r\n]
        Request Version: HTTP/1.1
        Status Code: 200
        Response Phrase: OK
    Date: Fri, 18 May 2018 15:12:32 GMT\r\n
    Content-Type: image/jpeg\r\n
    Content-Length: 8242\r\n
    Connection: keep-alive\r\n
    Last-Modified: Wed, 16 May 2018 04:16:45 GMT\r\n
    Server: SCSImageServer\r\n
    ETag: "e66774d3453ba44ab215bdeabff157c7"\r\n
    Access-Control-Allow-Origin: *\r\n
    Cache-Control: max-age=7776000\r\n
    FSS-Cache: MISS from 13539701.18454911.21477824\r\n
    FSS-Proxy: Powered by 9935166.11245896.17873234\r\n
    Age: 1\r\n
    X-Via: 1.1 fuzhoudianxin50:1 (Cdn Cache Server V2.0), 1.1 PSlnlydxom27:5 (Cdn Cache Server V2.0)\r\n
    X-Dscp-Value: 0\r\n
    \r\n
    [HTTP response 1/2]
    [Time since request: 0.026218000 seconds]
    [Request in frame: 3832]
    [Next request in frame: 3888]
    [Next response in frame: 3913]
JPEG File Interchange Format

No.     Time               Source                Destination           Protocol Length Info
   3886 15:12:43.495369    10.210.66.82          59.47.162.84          HTTP     1308   GET /img/20180515/101918063_4771499_short_H_115251_3661_seg_1_snap_001_91_b_OP2of_pic23.jpg HTTP/1.1 

Frame 3886: 1308 bytes on wire (10464 bits), 1308 bytes captured (10464 bits) on interface 0
Ethernet II, Src: AsustekC_34:f3:aa (9c:5c:8e:34:f3:aa), Dst: Hangzhou_d2:34:0d (3c:e5:a6:d2:34:0d)
Internet Protocol Version 4, Src: 10.210.66.82, Dst: 59.47.162.84
Transmission Control Protocol, Src Port: 34019 (34019), Dst Port: 80 (80), Seq: 1257, Ack: 7749, Len: 1254
Hypertext Transfer Protocol
    GET /img/20180515/101918063_4771499_short_H_115251_3661_seg_1_snap_001_91_b_OP2of_pic23.jpg HTTP/1.1\r\n
        [Expert Info (Chat/Sequence): GET /img/20180515/101918063_4771499_short_H_115251_3661_seg_1_snap_001_91_b_OP2of_pic23.jpg HTTP/1.1\r\n]
        Request Method: GET
        Request URI: /img/20180515/101918063_4771499_short_H_115251_3661_seg_1_snap_001_91_b_OP2of_pic23.jpg
        Request Version: HTTP/1.1
    Host: photocdn.tv.sohu.com\r\n
    Connection: keep-alive\r\n
    User-Agent: Mozilla/5.0 (Windows NT 10.0; Win64; x64) AppleWebKit/537.36 (KHTML, like Gecko) Chrome/66.0.3359.139 Safari/537.36\r\n
    Accept: image/webp,image/apng,image/*,*/*;q=0.8\r\n
    Accept-Encoding: gzip, deflate\r\n
    Accept-Language: en-US,en;q=0.9,zh-TW;q=0.8,zh;q=0.7\r\n
     [truncated]Cookie: SUV=1801261248337106; reqtype=pc; gidinf=x099980109ee0d6dc0266280e000622638cc2c66f137; ch_key=50e48c6168d7b908; ifoxinstalled=false; newpuid=15266562953178784720; landingrefer=https%3A%2F%2Fwww.baidu.com%2Flink%3Furl%3D
    \r\n
    [Full request URI: http://photocdn.tv.sohu.com/img/20180515/101918063_4771499_short_H_115251_3661_seg_1_snap_001_91_b_OP2of_pic23.jpg]
    [HTTP request 2/4]
    [Prev request in frame: 3823]
    [Response in frame: 3897]
    [Next request in frame: 3905]

No.     Time               Source                Destination           Protocol Length Info
   3887 15:12:43.495543    10.210.66.82          59.47.162.84          HTTP     1308   GET /img/20180517/101993947_4776949_short_H_172833_3667_seg_1_snap_001_33_b_92fjX_pic23.jpg HTTP/1.1 

Frame 3887: 1308 bytes on wire (10464 bits), 1308 bytes captured (10464 bits) on interface 0
Ethernet II, Src: AsustekC_34:f3:aa (9c:5c:8e:34:f3:aa), Dst: Hangzhou_d2:34:0d (3c:e5:a6:d2:34:0d)
Internet Protocol Version 4, Src: 10.210.66.82, Dst: 59.47.162.84
Transmission Control Protocol, Src Port: 34020 (34020), Dst Port: 80 (80), Seq: 1256, Ack: 6107, Len: 1254
Hypertext Transfer Protocol
    GET /img/20180517/101993947_4776949_short_H_172833_3667_seg_1_snap_001_33_b_92fjX_pic23.jpg HTTP/1.1\r\n
        [Expert Info (Chat/Sequence): GET /img/20180517/101993947_4776949_short_H_172833_3667_seg_1_snap_001_33_b_92fjX_pic23.jpg HTTP/1.1\r\n]
        Request Method: GET
        Request URI: /img/20180517/101993947_4776949_short_H_172833_3667_seg_1_snap_001_33_b_92fjX_pic23.jpg
        Request Version: HTTP/1.1
    Host: photocdn.tv.sohu.com\r\n
    Connection: keep-alive\r\n
    User-Agent: Mozilla/5.0 (Windows NT 10.0; Win64; x64) AppleWebKit/537.36 (KHTML, like Gecko) Chrome/66.0.3359.139 Safari/537.36\r\n
    Accept: image/webp,image/apng,image/*,*/*;q=0.8\r\n
    Accept-Encoding: gzip, deflate\r\n
    Accept-Language: en-US,en;q=0.9,zh-TW;q=0.8,zh;q=0.7\r\n
     [truncated]Cookie: SUV=1801261248337106; reqtype=pc; gidinf=x099980109ee0d6dc0266280e000622638cc2c66f137; ch_key=50e48c6168d7b908; ifoxinstalled=false; newpuid=15266562953178784720; landingrefer=https%3A%2F%2Fwww.baidu.com%2Flink%3Furl%3D
    \r\n
    [Full request URI: http://photocdn.tv.sohu.com/img/20180517/101993947_4776949_short_H_172833_3667_seg_1_snap_001_33_b_92fjX_pic23.jpg]
    [HTTP request 2/4]
    [Prev request in frame: 3822]
    [Response in frame: 3892]
    [Next request in frame: 3906]

No.     Time               Source                Destination           Protocol Length Info
   3888 15:12:43.500759    10.210.66.82          59.47.162.84          HTTP     1309   GET /img/20180511/101798030_4764334_short_H_095935_19748_seg_1_snap_001_43_b_u40K7_pic23.jpg HTTP/1.1 

Frame 3888: 1309 bytes on wire (10472 bits), 1309 bytes captured (10472 bits) on interface 0
Ethernet II, Src: AsustekC_34:f3:aa (9c:5c:8e:34:f3:aa), Dst: Hangzhou_d2:34:0d (3c:e5:a6:d2:34:0d)
Internet Protocol Version 4, Src: 10.210.66.82, Dst: 59.47.162.84
Transmission Control Protocol, Src Port: 34015 (34015), Dst Port: 80 (80), Seq: 1255, Ack: 8768, Len: 1255
Hypertext Transfer Protocol
    GET /img/20180511/101798030_4764334_short_H_095935_19748_seg_1_snap_001_43_b_u40K7_pic23.jpg HTTP/1.1\r\n
        [Expert Info (Chat/Sequence): GET /img/20180511/101798030_4764334_short_H_095935_19748_seg_1_snap_001_43_b_u40K7_pic23.jpg HTTP/1.1\r\n]
        Request Method: GET
        Request URI: /img/20180511/101798030_4764334_short_H_095935_19748_seg_1_snap_001_43_b_u40K7_pic23.jpg
        Request Version: HTTP/1.1
    Host: photocdn.tv.sohu.com\r\n
    Connection: keep-alive\r\n
    User-Agent: Mozilla/5.0 (Windows NT 10.0; Win64; x64) AppleWebKit/537.36 (KHTML, like Gecko) Chrome/66.0.3359.139 Safari/537.36\r\n
    Accept: image/webp,image/apng,image/*,*/*;q=0.8\r\n
    Accept-Encoding: gzip, deflate\r\n
    Accept-Language: en-US,en;q=0.9,zh-TW;q=0.8,zh;q=0.7\r\n
     [truncated]Cookie: SUV=1801261248337106; reqtype=pc; gidinf=x099980109ee0d6dc0266280e000622638cc2c66f137; ch_key=50e48c6168d7b908; ifoxinstalled=false; newpuid=15266562953178784720; landingrefer=https%3A%2F%2Fwww.baidu.com%2Flink%3Furl%3D
    \r\n
    [Full request URI: http://photocdn.tv.sohu.com/img/20180511/101798030_4764334_short_H_095935_19748_seg_1_snap_001_43_b_u40K7_pic23.jpg]
    [HTTP request 2/2]
    [Prev request in frame: 3832]
    [Response in frame: 3913]

No.     Time               Source                Destination           Protocol Length Info
   3889 15:12:43.502284    10.210.66.82          59.47.162.84          HTTP     1309   GET /img/20180517/101993984_4777116_short_H_191328_19750_seg_1_snap_001_39_b_N59zB_pic23.jpg HTTP/1.1 

Frame 3889: 1309 bytes on wire (10472 bits), 1309 bytes captured (10472 bits) on interface 0
Ethernet II, Src: AsustekC_34:f3:aa (9c:5c:8e:34:f3:aa), Dst: Hangzhou_d2:34:0d (3c:e5:a6:d2:34:0d)
Internet Protocol Version 4, Src: 10.210.66.82, Dst: 59.47.162.84
Transmission Control Protocol, Src Port: 34018 (34018), Dst Port: 80 (80), Seq: 1255, Ack: 8474, Len: 1255
Hypertext Transfer Protocol
    GET /img/20180517/101993984_4777116_short_H_191328_19750_seg_1_snap_001_39_b_N59zB_pic23.jpg HTTP/1.1\r\n
        [Expert Info (Chat/Sequence): GET /img/20180517/101993984_4777116_short_H_191328_19750_seg_1_snap_001_39_b_N59zB_pic23.jpg HTTP/1.1\r\n]
        Request Method: GET
        Request URI: /img/20180517/101993984_4777116_short_H_191328_19750_seg_1_snap_001_39_b_N59zB_pic23.jpg
        Request Version: HTTP/1.1
    Host: photocdn.tv.sohu.com\r\n
    Connection: keep-alive\r\n
    User-Agent: Mozilla/5.0 (Windows NT 10.0; Win64; x64) AppleWebKit/537.36 (KHTML, like Gecko) Chrome/66.0.3359.139 Safari/537.36\r\n
    Accept: image/webp,image/apng,image/*,*/*;q=0.8\r\n
    Accept-Encoding: gzip, deflate\r\n
    Accept-Language: en-US,en;q=0.9,zh-TW;q=0.8,zh;q=0.7\r\n
     [truncated]Cookie: SUV=1801261248337106; reqtype=pc; gidinf=x099980109ee0d6dc0266280e000622638cc2c66f137; ch_key=50e48c6168d7b908; ifoxinstalled=false; newpuid=15266562953178784720; landingrefer=https%3A%2F%2Fwww.baidu.com%2Flink%3Furl%3D
    \r\n
    [Full request URI: http://photocdn.tv.sohu.com/img/20180517/101993984_4777116_short_H_191328_19750_seg_1_snap_001_39_b_N59zB_pic23.jpg]
    [HTTP request 2/5]
    [Prev request in frame: 3831]
    [Response in frame: 3924]
    [Next request in frame: 4798]

No.     Time               Source                Destination           Protocol Length Info
   3890 15:12:43.503164    10.210.66.82          59.47.162.84          HTTP     1309   GET /img/20180510/101772104_4762724_short_H_132012_19758_seg_1_snap_001_52_b_nM235_pic23.jpg HTTP/1.1 

Frame 3890: 1309 bytes on wire (10472 bits), 1309 bytes captured (10472 bits) on interface 0
Ethernet II, Src: AsustekC_34:f3:aa (9c:5c:8e:34:f3:aa), Dst: Hangzhou_d2:34:0d (3c:e5:a6:d2:34:0d)
Internet Protocol Version 4, Src: 10.210.66.82, Dst: 59.47.162.84
Transmission Control Protocol, Src Port: 34016 (34016), Dst Port: 80 (80), Seq: 1256, Ack: 5434, Len: 1255
Hypertext Transfer Protocol
    GET /img/20180510/101772104_4762724_short_H_132012_19758_seg_1_snap_001_52_b_nM235_pic23.jpg HTTP/1.1\r\n
        [Expert Info (Chat/Sequence): GET /img/20180510/101772104_4762724_short_H_132012_19758_seg_1_snap_001_52_b_nM235_pic23.jpg HTTP/1.1\r\n]
        Request Method: GET
        Request URI: /img/20180510/101772104_4762724_short_H_132012_19758_seg_1_snap_001_52_b_nM235_pic23.jpg
        Request Version: HTTP/1.1
    Host: photocdn.tv.sohu.com\r\n
    Connection: keep-alive\r\n
    User-Agent: Mozilla/5.0 (Windows NT 10.0; Win64; x64) AppleWebKit/537.36 (KHTML, like Gecko) Chrome/66.0.3359.139 Safari/537.36\r\n
    Accept: image/webp,image/apng,image/*,*/*;q=0.8\r\n
    Accept-Encoding: gzip, deflate\r\n
    Accept-Language: en-US,en;q=0.9,zh-TW;q=0.8,zh;q=0.7\r\n
     [truncated]Cookie: SUV=1801261248337106; reqtype=pc; gidinf=x099980109ee0d6dc0266280e000622638cc2c66f137; ch_key=50e48c6168d7b908; ifoxinstalled=false; newpuid=15266562953178784720; landingrefer=https%3A%2F%2Fwww.baidu.com%2Flink%3Furl%3D
    \r\n
    [Full request URI: http://photocdn.tv.sohu.com/img/20180510/101772104_4762724_short_H_132012_19758_seg_1_snap_001_52_b_nM235_pic23.jpg]
    [HTTP request 2/3]
    [Prev request in frame: 3826]
    [Response in frame: 3931]
    [Next request in frame: 4797]

No.     Time               Source                Destination           Protocol Length Info
   3891 15:12:43.504472    10.210.66.82          59.47.162.84          HTTP     1309   GET /img/20180517/101993985_4777118_short_H_191345_3665_seg_1_snap_001_160_b_JpUw4_pic23.jpg HTTP/1.1 

