No.     Time               Source                Destination           Protocol Length Info
    177 06:52:25.332673    10.106.129.54         219.238.20.86         HTTP     444    GET /050C000059658EE0ADC0AE13F80B18D4 HTTP/1.1 

Frame 177: 444 bytes on wire (3552 bits), 444 bytes captured (3552 bits) on interface 0
Ethernet II, Src: AsustekC_34:f3:aa (9c:5c:8e:34:f3:aa), Dst: Hangzhou_75:c8:f5 (74:25:8a:75:c8:f5)
Internet Protocol Version 4, Src: 10.106.129.54, Dst: 219.238.20.86
Transmission Control Protocol, Src Port: 61307 (61307), Dst Port: 80 (80), Seq: 1, Ack: 1, Len: 390
Hypertext Transfer Protocol
    GET /050C000059658EE0ADC0AE13F80B18D4 HTTP/1.1\r\n
    Host: r1.ykimg.com\r\n
    Connection: keep-alive\r\n
    User-Agent: Mozilla/5.0 (Windows NT 10.0; Win64; x64) AppleWebKit/537.36 (KHTML, like Gecko) Chrome/59.0.3071.115 Safari/537.36\r\n
    Accept: image/webp,image/apng,image/*,*/*;q=0.8\r\n
    Referer: http://www.youku.com/\r\n
    Accept-Encoding: gzip, deflate\r\n
    Accept-Language: en-US,en;q=0.8,zh-TW;q=0.6,zh;q=0.4\r\n
    \r\n
    [Full request URI: http://r1.ykimg.com/050C000059658EE0ADC0AE13F80B18D4]
    [HTTP request 1/6]
    [Response in frame: 181]
    [Next request in frame: 586]

No.     Time               Source                Destination           Protocol Length Info
    178 06:52:25.334074    10.106.129.54         219.238.20.86         HTTP     444    GET /0515000059633DF7ADC0AE08BD06F04B HTTP/1.1 

Frame 178: 444 bytes on wire (3552 bits), 444 bytes captured (3552 bits) on interface 0
Ethernet II, Src: AsustekC_34:f3:aa (9c:5c:8e:34:f3:aa), Dst: Hangzhou_75:c8:f5 (74:25:8a:75:c8:f5)
Internet Protocol Version 4, Src: 10.106.129.54, Dst: 219.238.20.86
Transmission Control Protocol, Src Port: 61308 (61308), Dst Port: 80 (80), Seq: 1, Ack: 1, Len: 390
Hypertext Transfer Protocol
    GET /0515000059633DF7ADC0AE08BD06F04B HTTP/1.1\r\n
    Host: r1.ykimg.com\r\n
    Connection: keep-alive\r\n
    User-Agent: Mozilla/5.0 (Windows NT 10.0; Win64; x64) AppleWebKit/537.36 (KHTML, like Gecko) Chrome/59.0.3071.115 Safari/537.36\r\n
    Accept: image/webp,image/apng,image/*,*/*;q=0.8\r\n
    Referer: http://www.youku.com/\r\n
    Accept-Encoding: gzip, deflate\r\n
    Accept-Language: en-US,en;q=0.8,zh-TW;q=0.6,zh;q=0.4\r\n
    \r\n
    [Full request URI: http://r1.ykimg.com/0515000059633DF7ADC0AE08BD06F04B]
    [HTTP request 1/3]
    [Response in frame: 336]
    [Next request in frame: 2560]

No.     Time               Source                Destination           Protocol Length Info
    179 06:52:25.334569    10.106.129.54         219.238.20.86         HTTP     444    GET /0515000059633E37ADC0B0AD820BEE8E HTTP/1.1 

Frame 179: 444 bytes on wire (3552 bits), 444 bytes captured (3552 bits) on interface 0
Ethernet II, Src: AsustekC_34:f3:aa (9c:5c:8e:34:f3:aa), Dst: Hangzhou_75:c8:f5 (74:25:8a:75:c8:f5)
Internet Protocol Version 4, Src: 10.106.129.54, Dst: 219.238.20.86
Transmission Control Protocol, Src Port: 61306 (61306), Dst Port: 80 (80), Seq: 1, Ack: 1, Len: 390
Hypertext Transfer Protocol
    GET /0515000059633E37ADC0B0AD820BEE8E HTTP/1.1\r\n
    Host: r1.ykimg.com\r\n
    Connection: keep-alive\r\n
    User-Agent: Mozilla/5.0 (Windows NT 10.0; Win64; x64) AppleWebKit/537.36 (KHTML, like Gecko) Chrome/59.0.3071.115 Safari/537.36\r\n
    Accept: image/webp,image/apng,image/*,*/*;q=0.8\r\n
    Referer: http://www.youku.com/\r\n
    Accept-Encoding: gzip, deflate\r\n
    Accept-Language: en-US,en;q=0.8,zh-TW;q=0.6,zh;q=0.4\r\n
    \r\n
    [Full request URI: http://r1.ykimg.com/0515000059633E37ADC0B0AD820BEE8E]
    [HTTP request 1/5]
    [Next request in frame: 416]

No.     Time               Source                Destination           Protocol Length Info
    180 06:52:25.335031    10.106.129.54         219.238.20.86         HTTP     444    GET /0510000059658F1BAD9E07797E00BD50 HTTP/1.1 

Frame 180: 444 bytes on wire (3552 bits), 444 bytes captured (3552 bits) on interface 0
Ethernet II, Src: AsustekC_34:f3:aa (9c:5c:8e:34:f3:aa), Dst: Hangzhou_75:c8:f5 (74:25:8a:75:c8:f5)
Internet Protocol Version 4, Src: 10.106.129.54, Dst: 219.238.20.86
Transmission Control Protocol, Src Port: 61309 (61309), Dst Port: 80 (80), Seq: 1, Ack: 1, Len: 390
Hypertext Transfer Protocol
    GET /0510000059658F1BAD9E07797E00BD50 HTTP/1.1\r\n
    Host: r1.ykimg.com\r\n
    Connection: keep-alive\r\n
    User-Agent: Mozilla/5.0 (Windows NT 10.0; Win64; x64) AppleWebKit/537.36 (KHTML, like Gecko) Chrome/59.0.3071.115 Safari/537.36\r\n
    Accept: image/webp,image/apng,image/*,*/*;q=0.8\r\n
    Referer: http://www.youku.com/\r\n
    Accept-Encoding: gzip, deflate\r\n
    Accept-Language: en-US,en;q=0.8,zh-TW;q=0.6,zh;q=0.4\r\n
    \r\n
    [Full request URI: http://r1.ykimg.com/0510000059658F1BAD9E07797E00BD50]
    [HTTP request 1/13]
    [Response in frame: 1174]
    [Next request in frame: 1434]

No.     Time               Source                Destination           Protocol Length Info
    181 06:52:25.335717    219.238.20.86         10.106.129.54         HTTP     1514   HTTP/1.1 200 OK  (JPEG JFIF image)[Malformed Packet]

Frame 181: 1514 bytes on wire (12112 bits), 1514 bytes captured (12112 bits) on interface 0
Ethernet II, Src: Hangzhou_75:c8:f5 (74:25:8a:75:c8:f5), Dst: AsustekC_34:f3:aa (9c:5c:8e:34:f3:aa)
Internet Protocol Version 4, Src: 219.238.20.86, Dst: 10.106.129.54
Transmission Control Protocol, Src Port: 80 (80), Dst Port: 61307 (61307), Seq: 1, Ack: 391, Len: 1460
Hypertext Transfer Protocol
    HTTP/1.1 200 OK\r\n
    Server: Tengine\r\n
    Content-Type: image/jpeg\r\n
    Content-Length: 92684\r\n
    Connection: keep-alive\r\n
    Date: Wed, 12 Jul 2017 02:46:11 GMT\r\n
    x-oss-request-id: 59658F4C1CA8B61D72963B9F\r\n
    Accept-Ranges: bytes\r\n
    ETag: "FF1461E9CDAAC1B1ED6D26F7B76DDBCF"\r\n
    Last-Modified: Wed, 12 Jul 2017 02:52:16 GMT\r\n
    x-oss-object-type: Normal\r\n
    x-oss-hash-crc64ecma: 14828250548974009458\r\n
    x-oss-storage-class: Standard\r\n
    Content-MD5: /xRh6c2qwbHtbSb3t23bzw==\r\n
    x-oss-server-time: 8\r\n
    Via: cache1.l2nu17[0,200-0,H], cache15.l2nu17[0,0], cache5.cn548[0,200-0,H], cache6.cn548[0,0]\r\n
    Age: 14771\r\n
    X-Cache: HIT TCP_MEM_HIT dirn:3:338638388\r\n
    X-Swift-SaveTime: Wed, 12 Jul 2017 02:54:20 GMT\r\n
    X-Swift-CacheTime: 2592000\r\n
    Timing-Allow-Origin: *\r\n
    EagleId: dbee144614998423427283992e\r\n
    \r\n
    [HTTP response 1/6]
    [Time since request: 0.003044000 seconds]
    [Request in frame: 177]
    [Next request in frame: 586]
    [Next response in frame: 717]
JPEG File Interchange Format
[Malformed Packet: JFIF (JPEG) image]

No.     Time               Source                Destination           Protocol Length Info
    206 06:52:25.339611    10.106.129.54         219.238.20.86         HTTP     444    GET /0515000059625AACADC0AE196604D826 HTTP/1.1 

Frame 206: 444 bytes on wire (3552 bits), 444 bytes captured (3552 bits) on interface 0
Ethernet II, Src: AsustekC_34:f3:aa (9c:5c:8e:34:f3:aa), Dst: Hangzhou_75:c8:f5 (74:25:8a:75:c8:f5)
Internet Protocol Version 4, Src: 10.106.129.54, Dst: 219.238.20.86
Transmission Control Protocol, Src Port: 61305 (61305), Dst Port: 80 (80), Seq: 1, Ack: 1, Len: 390
Hypertext Transfer Protocol
    GET /0515000059625AACADC0AE196604D826 HTTP/1.1\r\n
    Host: r1.ykimg.com\r\n
    Connection: keep-alive\r\n
    User-Agent: Mozilla/5.0 (Windows NT 10.0; Win64; x64) AppleWebKit/537.36 (KHTML, like Gecko) Chrome/59.0.3071.115 Safari/537.36\r\n
    Accept: image/webp,image/apng,image/*,*/*;q=0.8\r\n
    Referer: http://www.youku.com/\r\n
    Accept-Encoding: gzip, deflate\r\n
    Accept-Language: en-US,en;q=0.8,zh-TW;q=0.6,zh;q=0.4\r\n
    \r\n
    [Full request URI: http://r1.ykimg.com/0515000059625AACADC0AE196604D826]
    [HTTP request 1/8]
    [Next request in frame: 1438]

No.     Time               Source                Destination           Protocol Length Info
    280 06:52:25.346991    219.238.20.86         10.106.129.54         HTTP     1514   Continuation

Frame 280: 1514 bytes on wire (12112 bits), 1514 bytes captured (12112 bits) on interface 0
Ethernet II, Src: Hangzhou_75:c8:f5 (74:25:8a:75:c8:f5), Dst: AsustekC_34:f3:aa (9c:5c:8e:34:f3:aa)
Internet Protocol Version 4, Src: 219.238.20.86, Dst: 10.106.129.54
Transmission Control Protocol, Src Port: 80 (80), Dst Port: 61307 (61307), Seq: 65804, Ack: 391, Len: 1460
Hypertext Transfer Protocol
     [truncated]!+:\b\210;\227[\347\024\324\266\367\202\363g\364\333\027R\247-2\354\274\363b\204\355+\340J\323\267\342\366'7j\341X\214\232\305I\372\275N\243T\224\230\342UV|\332\234\244GdG\212\227\352\022\235\227 E\216\222C\f\a\236PCc!)\302A\35
    Data (1301 bytes)

0000  08 2e b4 86 a4 31 ae 78 28 a8 60 9e 3d 0c 0c 7c   .....1.x(.`.=..|
0010  81 90 74 82 71 c1 c9 16 e5 80 84 08 a5 51 ca 32   ..t.q........Q.2
0020  38 67 18 f7 eb a2 33 80 a0 0e 01 1e c3 bd 3a a9   8g....3.......:.
0030  54 1e c9 17 34 12 aa 22 55 62 c9 e4 53 9c e0 95   T...4.."Ub..S...
0040  0e c1 c7 5d a7 1e df 1d 69 f1 ab 6b 52 d4 84 9c   ...]....i..kR...
0050  6d ba 1b 55 bc 2a 90 24 12 9c 81 8c 60 0c fd d5   m..U.*.$....`...
0060  9f be 3f 30 d3 2f b8 9c cb c2 90 60 2a 89 9f 34   ..?0./.....`*..4
0070  4d 0f d1 63 7e 7c 15 ed a6 fc 5e 3b 51 e3 6e 9a   M..c~|....^;Q.n.
0080  9b 56 d2 df 65 5b 70 36 cf c4 83 12 56 d0 d9 9d   .V..e[p6....V...
0090  c4 a6 16 69 b0 68 37 32 3c b5 25 ab 36 aa be 2e   ...i.h72<.%.6...
00a0  ae 5b 98 65 99 0a 02 47 94 d7 27 93 91 da 1d 98   .[.e...G..'.....
00b0  67 69 70 e2 97 9a 6d c2 26 56 a0 42 54 34 d3 a9   gip...m.&V.BT4..
00c0  43 a7 f1 76 91 22 d3 0f da 6c 57 66 df 19 9c 36   C..v."...lWf...6
00d0  c2 66 62 d1 36 8f 52 12 70 40 bb 88 d7 8d dd f1   .fb.6.R.p@......
00e0  db 65 b3 e0 d7 72 36 5e e4 7a e9 a7 7e c8 dc 0b   .e...r6^.z..~...
00f0  32 b5 1e 33 94 7b b2 cd 71 b9 08 9f 42 79 29 76   2..3.{..q...By)v
0100  05 46 54 46 d6 42 90 a8 ea 6d 5e 63 2a 71 b5 05   .FTF.B...m^c*q..
0110  72 4f a5 59 d7 9e cf e4 db 18 c1 e7 26 26 18 2f   rO.Y........&&./
0120  da 12 84 b4 45 6d 2d 34 14 2e 06 1d f4 e6 b6 eb   ....Em-4........
0130  bb 31 d8 a4 7e 51 36 77 1f 61 25 a6 1c 5c 26 79   .1..~Q6w.a%..\&y
0140  3b 0f 66 0a 74 d4 22 7c 13 d5 15 b7 db 0e 0d e8   ;.f.t."|........
0150  c9 54 20 c3 c5 c4 b8 1b 00 a5 f6 96 ca d1 81 de   .T .............
0160  42 d2 3d b1 f3 f7 d5 a9 48 a8 85 8e 8a 8f d4 54   B.=.....H......T
0170  fd f1 31 ba 11 b6 4d da e3 65 da 45 12 fe 18 22   ..1...M..e.E..."
0180  4b a3 a9 e2 af 29 c4 29 5d 80 8c a4 a9 61 5d 0c   K....).)]....a].
0190  7a b3 83 8d 40 7e 40 11 a2 14 d4 43 cd f5 a2 e5   z...@~@....C....
01a0  b4 50 11 b8 6e 2f e5 86 69 e3 6b 79 ee 5f 09 be   .P..n/..i.ky._..
01b0  1d af 6d eb b5 36 f1 8d c6 ba 6d a7 69 cd c2 b5   ..m..6....m.i...
01c0  6a d5 35 d0 68 6e 22 7c b6 a2 bb 51 a9 d7 3f 0a   j.5.hn"|...Q..?.
01d0  ea 61 41 8e 87 bc d5 a8 a0 fa 5b 23 50 70 bc 36   .aA.......[#Pp.6
01e0  5a 6f 19 91 c2 66 e6 0a 54 27 0e cd e2 02 bb 4c   Zo...f..T'.....L
01f0  b2 ca e4 cd 4b 4f 18 6a 75 d7 db 93 9d 9b 61 bd   ....KO.ju.....a.
0200  e0 c8 b4 ae d8 45 62 18 8f 66 f2 4d 23 da 22 a2   .....Eb..f.M#.".
0210  e9 18 4a b6 73 c5 0d b7 bc 3e 1c 2c 4f 10 37 c5   ..J.s....>.,O.7.
0220  72 c5 db 46 ae aa 3b aa af c4 95 76 40 5d 06 8f   r..F..;....v@]..
0230  56 86 b1 fb 46 1d 22 4c 92 d3 95 16 52 0b 65 2b   V...F."L....R.e+
0240  0d 27 9f 2f 48 d4 0c 77 08 9e c2 71 39 ec 31 25   .'./H..w...q9.1%
0250  5f 9a 98 93 34 40 46 9b 35 de 01 d6 c3 a2 22 db   _...4@F.5.....".
0260  eb 71 a4 33 84 4e c8 ce ca 4a cd 13 80 c3 53 09   .q.3.N...J....S.
0270  72 ad e3 60 17 69 11 d5 a0 2a 8c 42 8d df f5 cf   r..`.i...*.B....
0280  b6 29 db 9b 51 b7 0e c0 c9 7b 67 e9 57 6a a8 95   .)..Q....{g.Wj..
0290  2b d2 55 79 28 bb aa 14 56 66 26 13 f7 5d 3e 88   +.Uy(...Vf&..]>.
02a0  23 16 85 3f 0b 53 cd b6 a9 01 4b 65 95 2b df 00   #..?.S....Ke.+..
02b0  f4 46 fe 45 66 f1 0c 1d 1c 7f 14 46 31 37 99 17   .F.Ef......F17..
02c0  11 95 02 b2 ab 9d 86 7c 44 ba 16 59 5d cb 19 17   .......|D..Y]...
02d0  7e 54 24 e5 b1 07 98 0c 34 8a 41 83 56 89 e4 31   ~T$.....4.A.V..1
02e0  53 a2 7f e4 b3 aa 7d 31 28 fe 3c be 88 f0 7c 64   S.....}1(.<...|d
02f0  ec 65 b5 b8 d6 0e e3 b1 4d de 99 76 e4 1b e7 63   .e......M..v...c
0300  e4 3c 92 8b 06 74 6b a6 99 16 a8 c5 a7 74 4a ed   .<...tk......tJ.
0310  41 ba 9c 0f 25 a4 bc 06 23 4b 65 1f 99 3a ba d8   A...%...#Ke..:..
0320  3f 93 cc 6b 61 1b 9a c5 13 12 0c 41 71 6a 04 dc   ?..ka......Aqj..
0330  9a 06 80 b2 b4 26 cf 98 8c 10 b4 91 08 89 70 f0   .....&........p.
0340  c5 16 d3 ed ec 86 d7 04 ae 1c 52 be 8e 98 79 11   ..........R...y.
0350  31 36 5c 46 e1 b4 af 04 ec 18 e4 a3 c6 b6 97 66   16\F...........f
0360  d8 e1 53 72 b6 f6 fe da 1d c0 bc b6 af 74 ec da   ..Sr.........t..
0370  d6 de ee 56 de d6 24 50 6f 2b 2e e0 8c e4 6a 8d   ...V..$Po+....j.
0380  1a a5 1d 6b 4a 5d 64 38 91 f8 da 4c 86 d2 a7 62   ...kJ]d8...L...b
0390  4a 6f 93 4f b2 f0 52 55 94 90 3a d2 3e 85 2e 07   Jo.O..RU..:.>...
03a0  bc de 37 ca 9d 95 4f 25 f5 84 b9 a3 01 2c b4 75   ..7...O%.....,.u
03b0  c1 31 b0 99 5a 6a e6 31 f1 8f 14 b4 bb 25 dc 3d   .1..Zj.1.....%.=
03c0  f7 42 7d c4 2c e0 f4 95 1c e3 e4 12 3d bb eb d8   .B}.,.......=...
03d0  68 a2 c1 5b a9 53 b3 18 e5 59 57 02 00 48 5f 1c   h..[.S...YW..H_.
03e0  fb e4 1c 75 fa 13 9d 08 2e 0b fe 5d 06 3c b4 f6   ...u.......].<..
03f0  3d b0 ac 90 47 bf 47 db 3f 07 42 08 9b 05 e2 2b   =...G.G.?.B....+
0400  4f 8e 68 b7 83 ee 8c 83 d8 24 f6 4f 67 ef 8f fd   O.h......$.Og...
0410  1d 08 24 a2 26 43 98 f5 8a 82 7e 7b 1c b0 47 a5   ..$.&C....~{..G.
0420  5c bb fe 13 fc 23 42 01 2a ae 6a 54 58 f1 00 72   \....#B.*.jTX..r
0430  51 0a f7 c0 00 8e 8e 32 15 de 3f 4f e7 a1 0b d5   Q......2..?O....
0440  6f ab 19 4d bc 50 0f ab 81 c8 24 90 4f 15 27 1d   o..M.P....$.O.'.
0450  f7 fc f4 32 eb c2 12 8a aa 42 8b c2 33 03 ad c8   ...2.....B..3...
0460  71 95 48 4f 37 5a 03 c8 92 db 8a 8f 29 a2 0e 41   q.HO7Z......)..A
0470  44 a6 b0 be bf c2 a2 a4 7f 89 07 49 71 b1 30 b5   D..........Iq.0.
0480  45 1c 0e e2 d5 f7 bc 3f 56 1b 20 40 52 54 15 71   E......?V. @RT.q
0490  4b b2 5c 20 f5 06 f1 a8 46 8c 86 5c 89 6d 55 d4   K.\ ....F..\.mU.
04a0  9f ff 00 9d ad c5 7d aa 9a c2 80 57 19 4e 41 c3   ......}....W.NA.
04b0  72 96 09 3f bc 4a 1a c8 21 3e 58 e1 c9 55 8f 6c   r..?.J..!>X..U.l
04c0  fc 99 b8 a4 c4 d3 8c 87 85 33 4a f5 cf f0 fa 21   .........3J....!
04d0  b6 df 98 6c 6c 56 9a 2a 75 51 5a fe 19 42 d9 63   ...llV.*uQZ..B.c
04e0  dd ad cd 8b 13 cd 78 79 6a 6d 9c 85 38 95 72 52   ......xyjm..8.rR
04f0  d0 47 1e 3d 61 49 18 3a ca 12 2a 0d 52 30 e4 aa   .G.=aI.:..*.R0..
0500  97 10 8d c0 5c 3b e9 0a 82 d9 80 b7 9d 7d 0a 51   ....\;.......}.Q
0510  95 c1 08 47 11                                    ...G.

No.     Time               Source                Destination           Protocol Length Info
    310 06:52:25.349992    10.106.129.54         219.238.20.86         HTTP     444    GET /0515000059610523ADC0AE0E5F0C1331 HTTP/1.1 

Frame 310: 444 bytes on wire (3552 bits), 444 bytes captured (3552 bits) on interface 0
Ethernet II, Src: AsustekC_34:f3:aa (9c:5c:8e:34:f3:aa), Dst: Hangzhou_75:c8:f5 (74:25:8a:75:c8:f5)
Internet Protocol Version 4, Src: 10.106.129.54, Dst: 219.238.20.86
Transmission Control Protocol, Src Port: 61413 (61413), Dst Port: 80 (80), Seq: 1, Ack: 1, Len: 390
Hypertext Transfer Protocol
    GET /0515000059610523ADC0AE0E5F0C1331 HTTP/1.1\r\n
    Host: r1.ykimg.com\r\n
    Connection: keep-alive\r\n
    User-Agent: Mozilla/5.0 (Windows NT 10.0; Win64; x64) AppleWebKit/537.36 (KHTML, like Gecko) Chrome/59.0.3071.115 Safari/537.36\r\n
    Accept: image/webp,image/apng,image/*,*/*;q=0.8\r\n
    Referer: http://www.youku.com/\r\n
    Accept-Encoding: gzip, deflate\r\n
    Accept-Language: en-US,en;q=0.8,zh-TW;q=0.6,zh;q=0.4\r\n
    \r\n
    [Full request URI: http://r1.ykimg.com/0515000059610523ADC0AE0E5F0C1331]
    [HTTP request 1/5]
    [Response in frame: 397]
    [Next request in frame: 415]

No.     Time               Source                Destination           Protocol Length Info
    336 06:52:25.352654    219.238.20.86         10.106.129.54         HTTP     716    HTTP/1.1 200 OK  (JPEG JFIF image)

Frame 336: 716 bytes on wire (5728 bits), 716 bytes captured (5728 bits) on interface 0
Ethernet II, Src: Hangzhou_75:c8:f5 (74:25:8a:75:c8:f5), Dst: AsustekC_34:f3:aa (9c:5c:8e:34:f3:aa)
Internet Protocol Version 4, Src: 219.238.20.86, Dst: 10.106.129.54
Transmission Control Protocol, Src Port: 80 (80), Dst Port: 61308 (61308), Seq: 27844, Ack: 391, Len: 662
[21 Reassembled TCP Segments (28505 bytes): #234(1460), #235(1460), #236(103), #242(1460), #243(1460), #244(1460), #247(1460), #248(1460), #249(1460), #250(1460), #251(1460), #252(1460), #254(1460), #317(1460), #322(1460), #323(1460), #324(]
Hypertext Transfer Protocol
    HTTP/1.1 200 OK\r\n
    Server: Tengine\r\n
    Content-Type: image/jpeg\r\n
    Content-Length: 27753\r\n
    Connection: keep-alive\r\n
    Date: Mon, 10 Jul 2017 08:41:40 GMT\r\n
    x-oss-request-id: 59633E8E2BC0194B416619D7\r\n
    Accept-Ranges: bytes\r\n
    ETag: "A5DFDA5B55508237258234CF45820B90"\r\n
    Last-Modified: Mon, 10 Jul 2017 08:42:31 GMT\r\n
    x-oss-object-type: Normal\r\n
    x-oss-hash-crc64ecma: 4560526655343592821\r\n
    x-oss-storage-class: Standard\r\n
    Content-MD5: pd/aW1VQgjclgjTPRYILkA==\r\n
    x-oss-server-time: 4\r\n
    Via: cache3.l2nu17[0,200-0,H], cache10.l2nu17[1,0], cache6.cn548[0,200-0,H], cache8.cn548[1,0]\r\n
    Age: 166242\r\n
    X-Cache: HIT TCP_MEM_HIT dirn:1:278669055\r\n
    X-Swift-SaveTime: Mon, 10 Jul 2017 08:45:09 GMT\r\n
    X-Swift-CacheTime: 2592000\r\n
    Timing-Allow-Origin: *\r\n
    EagleId: dbee144814998423427347051e\r\n
    \r\n
    [HTTP response 1/3]
    [Time since request: 0.018580000 seconds]
    [Request in frame: 178]
    [Next request in frame: 2560]
    [Next response in frame: 2783]
JPEG File Interchange Format

No.     Time               Source                Destination           Protocol Length Info
    397 06:52:25.360449    219.238.20.86         10.106.129.54         HTTP     197    HTTP/1.1 200 OK  (JPEG JFIF image)

Frame 397: 197 bytes on wire (1576 bits), 197 bytes captured (1576 bits) on interface 0
Ethernet II, Src: Hangzhou_75:c8:f5 (74:25:8a:75:c8:f5), Dst: AsustekC_34:f3:aa (9c:5c:8e:34:f3:aa)
Internet Protocol Version 4, Src: 219.238.20.86, Dst: 10.106.129.54
Transmission Control Protocol, Src Port: 80 (80), Dst Port: 61413 (61413), Seq: 27844, Ack: 391, Len: 143
[21 Reassembled TCP Segments (27986 bytes): #349(1460), #350(1460), #351(103), #352(1460), #355(1460), #356(1460), #357(1460), #358(1460), #359(1460), #360(1460), #377(1460), #378(1460), #379(1460), #380(1460), #384(1460), #391(1460), #392(]
Hypertext Transfer Protocol
    HTTP/1.1 200 OK\r\n
    Server: Tengine\r\n
    Content-Type: image/jpeg\r\n
    Content-Length: 27235\r\n
    Connection: keep-alive\r\n
    Date: Sat, 08 Jul 2017 16:26:49 GMT\r\n
    x-oss-request-id: 596105BC1D72D83C35391A91\r\n
    Accept-Ranges: bytes\r\n
    ETag: "13C16E3427F550DAD11866347524F568"\r\n
    Last-Modified: Sat, 08 Jul 2017 16:15:31 GMT\r\n
    x-oss-object-type: Normal\r\n
    x-oss-hash-crc64ecma: 6173526148338423397\r\n
    x-oss-storage-class: Standard\r\n
    Content-MD5: E8FuNCf1UNrRGGY0dST1aA==\r\n
    x-oss-server-time: 4\r\n
    Via: cache3.l2nu17[0,200-0,H], cache9.l2nu17[0,0], cache5.cn548[0,200-0,H], cache2.cn548[0,0]\r\n
    Age: 311133\r\n
    X-Cache: HIT TCP_MEM_HIT dirn:3:233384529\r\n
    X-Swift-SaveTime: Sat, 08 Jul 2017 16:46:39 GMT\r\n
    X-Swift-CacheTime: 2592000\r\n
    Timing-Allow-Origin: *\r\n
    EagleId: dbee144214998423427483443e\r\n
    \r\n
    [HTTP response 1/5]
    [Time since request: 0.010457000 seconds]
    [Request in frame: 310]
    [Next request in frame: 415]
    [Next response in frame: 468]
JPEG File Interchange Format

No.     Time               Source                Destination           Protocol Length Info
    415 06:52:25.363461    10.106.129.54         219.238.20.86         HTTP     444    GET /0515000059610E34ADB912B50D0A41E1 HTTP/1.1 

Frame 415: 444 bytes on wire (3552 bits), 444 bytes captured (3552 bits) on interface 0
Ethernet II, Src: AsustekC_34:f3:aa (9c:5c:8e:34:f3:aa), Dst: Hangzhou_75:c8:f5 (74:25:8a:75:c8:f5)
Internet Protocol Version 4, Src: 10.106.129.54, Dst: 219.238.20.86
Transmission Control Protocol, Src Port: 61413 (61413), Dst Port: 80 (80), Seq: 391, Ack: 27987, Len: 390
Hypertext Transfer Protocol
    GET /0515000059610E34ADB912B50D0A41E1 HTTP/1.1\r\n
    Host: r1.ykimg.com\r\n
    Connection: keep-alive\r\n
    User-Agent: Mozilla/5.0 (Windows NT 10.0; Win64; x64) AppleWebKit/537.36 (KHTML, like Gecko) Chrome/59.0.3071.115 Safari/537.36\r\n
    Accept: image/webp,image/apng,image/*,*/*;q=0.8\r\n
    Referer: http://www.youku.com/\r\n
    Accept-Encoding: gzip, deflate\r\n
    Accept-Language: en-US,en;q=0.8,zh-TW;q=0.6,zh;q=0.4\r\n
    \r\n
    [Full request URI: http://r1.ykimg.com/0515000059610E34ADB912B50D0A41E1]
    [HTTP request 2/5]
    [Prev request in frame: 310]
    [Response in frame: 468]
    [Next request in frame: 2545]

No.     Time               Source                Destination           Protocol Length Info
    416 06:52:25.364064    10.106.129.54         219.238.20.86         HTTP     444    GET /05150000596104B1ADC0B0BA8A0966A3 HTTP/1.1 

Frame 416: 444 bytes on wire (3552 bits), 444 bytes captured (3552 bits) on interface 0
Ethernet II, Src: AsustekC_34:f3:aa (9c:5c:8e:34:f3:aa), Dst: Hangzhou_75:c8:f5 (74:25:8a:75:c8:f5)
Internet Protocol Version 4, Src: 10.106.129.54, Dst: 219.238.20.86
Transmission Control Protocol, Src Port: 61306 (61306), Dst Port: 80 (80), Seq: 391, Ack: 24589, Len: 390
Hypertext Transfer Protocol
    GET /05150000596104B1ADC0B0BA8A0966A3 HTTP/1.1\r\n
    Host: r1.ykimg.com\r\n
    Connection: keep-alive\r\n
    User-Agent: Mozilla/5.0 (Windows NT 10.0; Win64; x64) AppleWebKit/537.36 (KHTML, like Gecko) Chrome/59.0.3071.115 Safari/537.36\r\n
    Accept: image/webp,image/apng,image/*,*/*;q=0.8\r\n
    Referer: http://www.youku.com/\r\n
    Accept-Encoding: gzip, deflate\r\n
    Accept-Language: en-US,en;q=0.8,zh-TW;q=0.6,zh;q=0.4\r\n
    \r\n
    [Full request URI: http://r1.ykimg.com/05150000596104B1ADC0B0BA8A0966A3]
    [HTTP request 2/5]
    [Prev request in frame: 179]
    [Response in frame: 553]
    [Next request in frame: 2537]

No.     Time               Source                Destination           Protocol Length Info
    468 06:52:25.373400    219.238.20.86         10.106.129.54         HTTP     1093   HTTP/1.1 200 OK  (JPEG JFIF image)

Frame 468: 1093 bytes on wire (8744 bits), 1093 bytes captured (8744 bits) on interface 0
Ethernet II, Src: Hangzhou_75:c8:f5 (74:25:8a:75:c8:f5), Dst: AsustekC_34:f3:aa (9c:5c:8e:34:f3:aa)
Internet Protocol Version 4, Src: 219.238.20.86, Dst: 10.106.129.54
Transmission Control Protocol, Src Port: 80 (80), Dst Port: 61413 (61413), Seq: 61670, Ack: 781, Len: 1039
[25 Reassembled TCP Segments (34722 bytes): #423(1460), #424(1460), #425(103), #427(1460), #428(1460), #429(1460), #430(1460), #431(1460), #433(1460), #435(1460), #436(1460), #437(1460), #438(1460), #439(1460), #440(1460), #458(1460), #459(]
Hypertext Transfer Protocol
    HTTP/1.1 200 OK\r\n
    Server: Tengine\r\n
    Content-Type: image/jpeg\r\n
    Content-Length: 33968\r\n
    Connection: keep-alive\r\n
    Date: Sat, 08 Jul 2017 17:03:03 GMT\r\n
    x-oss-request-id: 59610E715A1498177D47195D\r\n
    Accept-Ranges: bytes\r\n
    ETag: "BEA09E19D13B68F867403465A1E8E303"\r\n
    Last-Modified: Sat, 08 Jul 2017 16:54:12 GMT\r\n
    x-oss-object-type: Normal\r\n
    x-oss-hash-crc64ecma: 1655100334931769804\r\n
    x-oss-storage-class: Standard\r\n
    Content-MD5: vqCeGdE7aPhnQDRloejjAw==\r\n
    x-oss-server-time: 14\r\n
    Via: cache19.l2nu17[0,200-0,H], cache18.l2nu17[2,0], cache5.cn548[0,200-0,H], cache2.cn548[1,0]\r\n
    Age: 308959\r\n
    X-Cache: HIT TCP_MEM_HIT dirn:3:235160524\r\n
    X-Swift-SaveTime: Sat, 08 Jul 2017 17:11:43 GMT\r\n
    X-Swift-CacheTime: 2592000\r\n
    Timing-Allow-Origin: *\r\n
    EagleId: dbee144214998423427623540e\r\n
    \r\n
    [HTTP response 2/5]
    [Time since request: 0.009939000 seconds]
    [Prev request in frame: 310]
    [Prev response in frame: 397]
    [Request in frame: 415]
    [Next request in frame: 2545]
JPEG File Interchange Format

No.     Time               Source                Destination           Protocol Length Info
    553 06:52:25.395879    219.238.20.86         10.106.129.54         HTTP     1253   HTTP/1.1 200 OK  (JPEG JFIF image)

Frame 553: 1253 bytes on wire (10024 bits), 1253 bytes captured (10024 bits) on interface 0
Ethernet II, Src: Hangzhou_75:c8:f5 (74:25:8a:75:c8:f5), Dst: AsustekC_34:f3:aa (9c:5c:8e:34:f3:aa)
Internet Protocol Version 4, Src: 219.238.20.86, Dst: 10.106.129.54
Transmission Control Protocol, Src Port: 80 (80), Dst Port: 61306 (61306), Seq: 50869, Ack: 781, Len: 1199
[19 Reassembled TCP Segments (27479 bytes): #451(1460), #452(1460), #483(1460), #484(1460), #485(1460), #486(1460), #498(1460), #499(1460), #501(1460), #502(1460), #516(1460), #517(1460), #518(1460), #519(1460), #533(1460), #534(1460), #535]
Hypertext Transfer Protocol
    HTTP/1.1 200 OK\r\n
    Server: Tengine\r\n
    Content-Type: image/jpeg\r\n
    Content-Length: 26726\r\n
    Connection: keep-alive\r\n
    Date: Sat, 08 Jul 2017 16:11:41 GMT\r\n
    x-oss-request-id: 5961053796BDF5A41238EAB1\r\n
    Accept-Ranges: bytes\r\n
    ETag: "85E7468056367E368F5697A254696F5E"\r\n
    Last-Modified: Sat, 08 Jul 2017 16:13:37 GMT\r\n
    x-oss-object-type: Normal\r\n
    x-oss-hash-crc64ecma: 3349245100584440436\r\n
    x-oss-storage-class: Standard\r\n
    Content-MD5: hedGgFY2fjaPVpeiVGlvXg==\r\n
    x-oss-server-time: 4\r\n
    Via: cache11.l2nu17[0,200-0,H], cache12.l2nu17[0,0], cache2.cn548[0,200-0,H], cache7.cn548[0,0]\r\n
    Age: 312041\r\n
    X-Cache: HIT TCP_MEM_HIT dirn:1:198254801\r\n
    X-Swift-SaveTime: Sat, 08 Jul 2017 16:20:51 GMT\r\n
    X-Swift-CacheTime: 2592000\r\n
    Timing-Allow-Origin: *\r\n
    EagleId: dbee144714998423427621449e\r\n
    \r\n
    [HTTP response 2/5]
    [Time since request: 0.031815000 seconds]
    [Prev request in frame: 179]
    [Request in frame: 416]
    [Next request in frame: 2537]
    [Next response in frame: 2818]
JPEG File Interchange Format

No.     Time               Source                Destination           Protocol Length Info
    586 06:52:25.406378    10.106.129.54         219.238.20.86         HTTP     444    GET /05150000596589CEAD9E07601E0E120A HTTP/1.1 

Frame 586: 444 bytes on wire (3552 bits), 444 bytes captured (3552 bits) on interface 0
Ethernet II, Src: AsustekC_34:f3:aa (9c:5c:8e:34:f3:aa), Dst: Hangzhou_75:c8:f5 (74:25:8a:75:c8:f5)
Internet Protocol Version 4, Src: 10.106.129.54, Dst: 219.238.20.86
Transmission Control Protocol, Src Port: 61307 (61307), Dst Port: 80 (80), Seq: 391, Ack: 93437, Len: 390
Hypertext Transfer Protocol
    GET /05150000596589CEAD9E07601E0E120A HTTP/1.1\r\n
    Host: r1.ykimg.com\r\n
    Connection: keep-alive\r\n
    User-Agent: Mozilla/5.0 (Windows NT 10.0; Win64; x64) AppleWebKit/537.36 (KHTML, like Gecko) Chrome/59.0.3071.115 Safari/537.36\r\n
    Accept: image/webp,image/apng,image/*,*/*;q=0.8\r\n
    Referer: http://www.youku.com/\r\n
    Accept-Encoding: gzip, deflate\r\n
    Accept-Language: en-US,en;q=0.8,zh-TW;q=0.6,zh;q=0.4\r\n
    \r\n
    [Full request URI: http://r1.ykimg.com/05150000596589CEAD9E07601E0E120A]
    [HTTP request 2/6]
    [Prev request in frame: 177]
    [Response in frame: 717]
    [Next request in frame: 2460]

No.     Time               Source                Destination           Protocol Length Info
    717 06:52:25.444964    219.238.20.86         10.106.129.54         HTTP     641    HTTP/1.1 200 OK  (JPEG JFIF image)

Frame 717: 641 bytes on wire (5128 bits), 641 bytes captured (5128 bits) on interface 0
Ethernet II, Src: Hangzhou_75:c8:f5 (74:25:8a:75:c8:f5), Dst: AsustekC_34:f3:aa (9c:5c:8e:34:f3:aa)
Internet Protocol Version 4, Src: 219.238.20.86, Dst: 10.106.129.54
Transmission Control Protocol, Src Port: 80 (80), Dst Port: 61307 (61307), Seq: 128580, Ack: 781, Len: 587
[26 Reassembled TCP Segments (35730 bytes): #600(1460), #601(103), #616(1460), #618(1460), #619(1460), #634(1460), #635(1460), #636(1460), #650(1460), #651(1460), #654(1460), #655(1460), #657(1460), #658(1460), #675(1460), #676(1460), #678(]
Hypertext Transfer Protocol
    HTTP/1.1 200 OK\r\n
    Server: Tengine\r\n
    Content-Type: image/jpeg\r\n
    Content-Length: 34978\r\n
    Connection: keep-alive\r\n
    Date: Wed, 12 Jul 2017 02:25:15 GMT\r\n
    x-oss-request-id: 59658A64BE5087650395F7C4\r\n
    Accept-Ranges: bytes\r\n
    ETag: "0D4941495F707D4FFBE1405F3E0613D4"\r\n
    Last-Modified: Wed, 12 Jul 2017 02:30:38 GMT\r\n
    x-oss-object-type: Normal\r\n
    x-oss-hash-crc64ecma: 9375087642353634940\r\n
    x-oss-storage-class: Standard\r\n
    Content-MD5: DUlBSV9wfU/74UBfPgYT1A==\r\n
    x-oss-server-time: 3\r\n
    Via: cache17.l2nu17[0,200-0,H], cache11.l2nu17[0,0], cache2.cn548[0,200-0,H], cache6.cn548[0,0]\r\n
    Age: 16027\r\n
    X-Cache: HIT TCP_MEM_HIT dirn:6:245287892\r\n
    X-Swift-SaveTime: Wed, 12 Jul 2017 02:33:41 GMT\r\n
    X-Swift-CacheTime: 2592000\r\n
    Timing-Allow-Origin: *\r\n
    EagleId: dbee144614998423428024420e\r\n
    \r\n
    [HTTP response 2/6]
    [Time since request: 0.038586000 seconds]
    [Prev request in frame: 177]
    [Prev response in frame: 181]
    [Request in frame: 586]
    [Next request in frame: 2460]
    [Next response in frame: 2464]
JPEG File Interchange Format

No.     Time               Source                Destination           Protocol Length Info
   1174 06:52:25.524368    219.238.20.86         10.106.129.54         HTTP     785    HTTP/1.1 200 OK  (GIF89a)

Frame 1174: 785 bytes on wire (6280 bits), 785 bytes captured (6280 bits) on interface 0
Ethernet II, Src: Hangzhou_75:c8:f5 (74:25:8a:75:c8:f5), Dst: AsustekC_34:f3:aa (9c:5c:8e:34:f3:aa)
Internet Protocol Version 4, Src: 219.238.20.86, Dst: 10.106.129.54
Transmission Control Protocol, Src Port: 80 (80), Dst Port: 61309 (61309), Seq: 795804, Ack: 391, Len: 731
[547 Reassembled TCP Segments (796534 bytes): #215(1460), #216(1460), #217(103), #230(1460), #231(1460), #232(1460), #233(1460), #239(1460), #240(1460), #241(1460), #302(1460), #303(1460), #304(1460), #311(1460), #312(1460), #313(1460), #31]
Hypertext Transfer Protocol
    HTTP/1.1 200 OK\r\n
    Server: Tengine\r\n
    Content-Type: image/gif\r\n
    Content-Length: 795781\r\n
    Connection: keep-alive\r\n
    Date: Wed, 12 Jul 2017 02:50:52 GMT\r\n
    x-oss-request-id: 59658F20FCE86D606C9648A2\r\n
    Accept-Ranges: bytes\r\n
    ETag: "BFD092CA41E92CC4417C0F939F0028E9"\r\n
    Last-Modified: Wed, 12 Jul 2017 02:53:15 GMT\r\n
    x-oss-object-type: Normal\r\n
    x-oss-hash-crc64ecma: 16484387009194577820\r\n
    x-oss-storage-class: Standard\r\n
    Content-MD5: v9CSykHpLMRBfA+TnwAo6Q==\r\n
    x-oss-server-time: 21\r\n
    Via: cache20.l2nu17[0,200-0,H], cache3.l2nu17[0,0], cache3.cn548[0,200-0,H], cache2.cn548[1,0]\r\n
    Age: 14490\r\n
    X-Cache: HIT TCP_MEM_HIT dirn:3:365855283\r\n
    X-Swift-SaveTime: Wed, 12 Jul 2017 02:54:20 GMT\r\n
    X-Swift-CacheTime: 2592000\r\n
    Timing-Allow-Origin: *\r\n
    EagleId: dbee144214998423427333352e\r\n
    \r\n
    [HTTP response 1/13]
    [Time since request: 0.189337000 seconds]
    [Request in frame: 180]
    [Next request in frame: 1434]
    [Next response in frame: 1439]
Compuserve GIF, Version: GIF89a

No.     Time               Source                Destination           Protocol Length Info
   1199 06:52:25.735360    10.106.129.54         140.205.94.22         HTTP     653    GET /yt/show.index.module?mid=231965&pvid=1bkqp28n8316q&did=1&SPM=undefined.20023042&etime=1499842345684 HTTP/1.1 

Frame 1199: 653 bytes on wire (5224 bits), 653 bytes captured (5224 bits) on interface 0
Ethernet II, Src: AsustekC_34:f3:aa (9c:5c:8e:34:f3:aa), Dst: Hangzhou_75:c8:f5 (74:25:8a:75:c8:f5)
Internet Protocol Version 4, Src: 10.106.129.54, Dst: 140.205.94.22
Transmission Control Protocol, Src Port: 61415 (61415), Dst Port: 80 (80), Seq: 1, Ack: 1, Len: 599
Hypertext Transfer Protocol
    GET /yt/show.index.module?mid=231965&pvid=1bkqp28n8316q&did=1&SPM=undefined.20023042&etime=1499842345684 HTTP/1.1\r\n
    Host: gm.mmstat.com\r\n
    Connection: keep-alive\r\n
    User-Agent: Mozilla/5.0 (Windows NT 10.0; Win64; x64) AppleWebKit/537.36 (KHTML, like Gecko) Chrome/59.0.3071.115 Safari/537.36\r\n
    Accept: image/webp,image/apng,image/*,*/*;q=0.8\r\n
    Referer: http://www.youku.com/\r\n
    Accept-Encoding: gzip, deflate\r\n
    Accept-Language: en-US,en;q=0.8,zh-TW;q=0.6,zh;q=0.4\r\n
    Cookie: cna=F64qEX1rIxkCAXt+Ru5yuEXd; aimx=8rmkES0FwWcCAXLxKBcOGFIf_1495436142; sca=66723852; atpsida=a0060002e9a887b16afd5f8c_1499842288_2\r\n
    \r\n
    [Full request URI: http://gm.mmstat.com/yt/show.index.module?mid=231965&pvid=1bkqp28n8316q&did=1&SPM=undefined.20023042&etime=1499842345684]
    [HTTP request 1/1]
    [Response in frame: 1207]

No.     Time               Source                Destination           Protocol Length Info
   1204 06:52:25.736326    10.106.129.54         140.205.94.22         HTTP     743    GET /yt/show.index.module?mid=231966&pvid=1bkqp28n8316q&did=1&SPM=undefined.20023042&mname=%E4%BC%98%E9%85%B7%E6%87%82%E4%BD%A0&etime=1499842345684&ext=1487147638427MG8||N1499842290570ti4_bcWU|| HTTP/1.1 

Frame 1204: 743 bytes on wire (5944 bits), 743 bytes captured (5944 bits) on interface 0
Ethernet II, Src: AsustekC_34:f3:aa (9c:5c:8e:34:f3:aa), Dst: Hangzhou_75:c8:f5 (74:25:8a:75:c8:f5)
Internet Protocol Version 4, Src: 10.106.129.54, Dst: 140.205.94.22
Transmission Control Protocol, Src Port: 61416 (61416), Dst Port: 80 (80), Seq: 1, Ack: 1, Len: 689
Hypertext Transfer Protocol
    GET /yt/show.index.module?mid=231966&pvid=1bkqp28n8316q&did=1&SPM=undefined.20023042&mname=%E4%BC%98%E9%85%B7%E6%87%82%E4%BD%A0&etime=1499842345684&ext=1487147638427MG8||N1499842290570ti4_bcWU|| HTTP/1.1\r\n
    Host: gm.mmstat.com\r\n
    Connection: keep-alive\r\n
    User-Agent: Mozilla/5.0 (Windows NT 10.0; Win64; x64) AppleWebKit/537.36 (KHTML, like Gecko) Chrome/59.0.3071.115 Safari/537.36\r\n
    Accept: image/webp,image/apng,image/*,*/*;q=0.8\r\n
    Referer: http://www.youku.com/\r\n
    Accept-Encoding: gzip, deflate\r\n
    Accept-Language: en-US,en;q=0.8,zh-TW;q=0.6,zh;q=0.4\r\n
    Cookie: cna=F64qEX1rIxkCAXt+Ru5yuEXd; aimx=8rmkES0FwWcCAXLxKBcOGFIf_1495436142; sca=66723852; atpsida=a0060002e9a887b16afd5f8c_1499842288_2\r\n
    \r\n
    [Full request URI: http://gm.mmstat.com/yt/show.index.module?mid=231966&pvid=1bkqp28n8316q&did=1&SPM=undefined.20023042&mname=%E4%BC%98%E9%85%B7%E6%87%82%E4%BD%A0&etime=1499842345684&ext=1487147638427MG8||N1499842290570ti4_bcWU||]
    [HTTP request 1/4]
    [Response in frame: 1211]
    [Next request in frame: 1268]

No.     Time               Source                Destination           Protocol Length Info
   1205 06:52:25.736438    10.106.129.54         140.205.94.22         HTTP     696    GET /yt/show.index.module?mid=231967&pvid=1bkqp28n8316q&did=1&SPM=undefined.20023042&mname=%E4%BA%A7%E5%93%81%E5%A4%A7%E5%85%A8&etime=1499842345686 HTTP/1.1 

Frame 1205: 696 bytes on wire (5568 bits), 696 bytes captured (5568 bits) on interface 0
Ethernet II, Src: AsustekC_34:f3:aa (9c:5c:8e:34:f3:aa), Dst: Hangzhou_75:c8:f5 (74:25:8a:75:c8:f5)
Internet Protocol Version 4, Src: 10.106.129.54, Dst: 140.205.94.22
Transmission Control Protocol, Src Port: 61414 (61414), Dst Port: 80 (80), Seq: 1, Ack: 1, Len: 642
Hypertext Transfer Protocol
    GET /yt/show.index.module?mid=231967&pvid=1bkqp28n8316q&did=1&SPM=undefined.20023042&mname=%E4%BA%A7%E5%93%81%E5%A4%A7%E5%85%A8&etime=1499842345686 HTTP/1.1\r\n
    Host: gm.mmstat.com\r\n
    Connection: keep-alive\r\n
    User-Agent: Mozilla/5.0 (Windows NT 10.0; Win64; x64) AppleWebKit/537.36 (KHTML, like Gecko) Chrome/59.0.3071.115 Safari/537.36\r\n
    Accept: image/webp,image/apng,image/*,*/*;q=0.8\r\n
    Referer: http://www.youku.com/\r\n
    Accept-Encoding: gzip, deflate\r\n
    Accept-Language: en-US,en;q=0.8,zh-TW;q=0.6,zh;q=0.4\r\n
    Cookie: cna=F64qEX1rIxkCAXt+Ru5yuEXd; aimx=8rmkES0FwWcCAXLxKBcOGFIf_1495436142; sca=66723852; atpsida=a0060002e9a887b16afd5f8c_1499842288_2\r\n
    \r\n
    [Full request URI: http://gm.mmstat.com/yt/show.index.module?mid=231967&pvid=1bkqp28n8316q&did=1&SPM=undefined.20023042&mname=%E4%BA%A7%E5%93%81%E5%A4%A7%E5%85%A8&etime=1499842345686]
    [HTTP request 1/3]
    [Response in frame: 1209]
    [Next request in frame: 1269]

No.     Time               Source                Destination           Protocol Length Info
   1207 06:52:25.772385    140.205.94.22         10.106.129.54         HTTP     373    HTTP/1.1 200 OK  (GIF89a)

Frame 1207: 373 bytes on wire (2984 bits), 373 bytes captured (2984 bits) on interface 0
Ethernet II, Src: Hangzhou_75:c8:f5 (74:25:8a:75:c8:f5), Dst: AsustekC_34:f3:aa (9c:5c:8e:34:f3:aa)
Internet Protocol Version 4, Src: 140.205.94.22, Dst: 10.106.129.54
Transmission Control Protocol, Src Port: 80 (80), Dst Port: 61415 (61415), Seq: 1, Ack: 600, Len: 319
Hypertext Transfer Protocol
    HTTP/1.1 200 OK\r\n
    Date: Wed, 12 Jul 2017 06:52:23 GMT\r\n
    Content-Type: image/gif\r\n
    Content-Length: 43\r\n
    Connection: keep-alive\r\n
    P3P: CP="NOI DSP COR CURa ADMa DEVa PSAa PSDa OUR IND UNI PUR NAV"\r\n
    Expires: Thu, 01 Jan 1970 00:00:01 GMT\r\n
    Cache-Control: no-cache\r\n
    Pragma: no-cache\r\n
    \r\n
    [HTTP response 1/1]
    [Time since request: 0.037025000 seconds]
    [Request in frame: 1199]
Compuserve GIF, Version: GIF89a

No.     Time               Source                Destination           Protocol Length Info
   1209 06:52:25.772386    140.205.94.22         10.106.129.54         HTTP     373    HTTP/1.1 200 OK  (GIF89a)

Frame 1209: 373 bytes on wire (2984 bits), 373 bytes captured (2984 bits) on interface 0
Ethernet II, Src: Hangzhou_75:c8:f5 (74:25:8a:75:c8:f5), Dst: AsustekC_34:f3:aa (9c:5c:8e:34:f3:aa)
Internet Protocol Version 4, Src: 140.205.94.22, Dst: 10.106.129.54
Transmission Control Protocol, Src Port: 80 (80), Dst Port: 61414 (61414), Seq: 1, Ack: 643, Len: 319
Hypertext Transfer Protocol
    HTTP/1.1 200 OK\r\n
    Date: Wed, 12 Jul 2017 06:52:23 GMT\r\n
    Content-Type: image/gif\r\n
    Content-Length: 43\r\n
    Connection: keep-alive\r\n
    P3P: CP="NOI DSP COR CURa ADMa DEVa PSAa PSDa OUR IND UNI PUR NAV"\r\n
    Expires: Thu, 01 Jan 1970 00:00:01 GMT\r\n
    Cache-Control: no-cache\r\n
    Pragma: no-cache\r\n
    \r\n
    [HTTP response 1/3]
    [Time since request: 0.035948000 seconds]
    [Request in frame: 1205]
    [Next request in frame: 1269]
    [Next response in frame: 1271]
Compuserve GIF, Version: GIF89a

No.     Time               Source                Destination           Protocol Length Info
   1211 06:52:25.772386    140.205.94.22         10.106.129.54         HTTP     373    HTTP/1.1 200 OK  (GIF89a)

Frame 1211: 373 bytes on wire (2984 bits), 373 bytes captured (2984 bits) on interface 0
Ethernet II, Src: Hangzhou_75:c8:f5 (74:25:8a:75:c8:f5), Dst: AsustekC_34:f3:aa (9c:5c:8e:34:f3:aa)
Internet Protocol Version 4, Src: 140.205.94.22, Dst: 10.106.129.54
Transmission Control Protocol, Src Port: 80 (80), Dst Port: 61416 (61416), Seq: 1, Ack: 690, Len: 319
Hypertext Transfer Protocol
    HTTP/1.1 200 OK\r\n
    Date: Wed, 12 Jul 2017 06:52:23 GMT\r\n
    Content-Type: image/gif\r\n
    Content-Length: 43\r\n
    Connection: keep-alive\r\n
    P3P: CP="NOI DSP COR CURa ADMa DEVa PSAa PSDa OUR IND UNI PUR NAV"\r\n
    Expires: Thu, 01 Jan 1970 00:00:01 GMT\r\n
    Cache-Control: no-cache\r\n
    Pragma: no-cache\r\n
    \r\n
    [HTTP response 1/4]
    [Time since request: 0.036060000 seconds]
    [Request in frame: 1204]
    [Next request in frame: 1268]
