No.     Time               Source                Destination           Protocol Length Info
      7 09:01:08.152544    10.210.66.82          74.80.130.236         HTTP     173    GET /?build=2018030801&ip=59.64.129.119&tz=-480 HTTP/1.1 

Frame 7: 173 bytes on wire (1384 bits), 173 bytes captured (1384 bits) on interface 0
Ethernet II, Src: AsustekC_34:f3:aa (9c:5c:8e:34:f3:aa), Dst: Hangzhou_d2:34:0d (3c:e5:a6:d2:34:0d)
Internet Protocol Version 4, Src: 10.210.66.82, Dst: 74.80.130.236
Transmission Control Protocol, Src Port: 64002 (64002), Dst Port: 80 (80), Seq: 1, Ack: 1, Len: 119
Hypertext Transfer Protocol
    GET /?build=2018030801&ip=59.64.129.119&tz=-480 HTTP/1.1\r\n
    Host: workdistribute.charityengine.com\r\n
    Connection: close\r\n
    \r\n
    [Full request URI: http://workdistribute.charityengine.com/?build=2018030801&ip=59.64.129.119&tz=-480]
    [HTTP request 1/1]
    [Response in frame: 9]

No.     Time               Source                Destination           Protocol Length Info
      9 09:01:08.425583    74.80.130.236         10.210.66.82          HTTP     261    HTTP/1.1 450 unknown  (application/json)

Frame 9: 261 bytes on wire (2088 bits), 261 bytes captured (2088 bits) on interface 0
Ethernet II, Src: Hangzhou_d2:34:0d (3c:e5:a6:d2:34:0d), Dst: AsustekC_34:f3:aa (9c:5c:8e:34:f3:aa)
Internet Protocol Version 4, Src: 74.80.130.236, Dst: 10.210.66.82
Transmission Control Protocol, Src Port: 80 (80), Dst Port: 64002 (64002), Seq: 1, Ack: 120, Len: 207
Hypertext Transfer Protocol
    HTTP/1.1 450 unknown\r\n
    Content-Type: application/json\r\n
    Date: Sat, 19 May 2018 09:00:57 GMT\r\n
    Connection: close\r\n
    Transfer-Encoding: chunked\r\n
    \r\n
    [HTTP response 1/1]
    [Time since request: 0.273039000 seconds]
    [Request in frame: 7]
    HTTP chunked response
JavaScript Object Notation: application/json

No.     Time               Source                Destination           Protocol Length Info
    101 09:01:33.642638    10.210.66.82          74.80.130.236         HTTP     173    GET /?build=2018030801&ip=59.64.129.119&tz=-480 HTTP/1.1 

Frame 101: 173 bytes on wire (1384 bits), 173 bytes captured (1384 bits) on interface 0
Ethernet II, Src: AsustekC_34:f3:aa (9c:5c:8e:34:f3:aa), Dst: Hangzhou_d2:34:0d (3c:e5:a6:d2:34:0d)
Internet Protocol Version 4, Src: 10.210.66.82, Dst: 74.80.130.236
Transmission Control Protocol, Src Port: 64013 (64013), Dst Port: 80 (80), Seq: 1, Ack: 1, Len: 119
Hypertext Transfer Protocol
    GET /?build=2018030801&ip=59.64.129.119&tz=-480 HTTP/1.1\r\n
    Host: workdistribute.charityengine.com\r\n
    Connection: close\r\n
    \r\n
    [Full request URI: http://workdistribute.charityengine.com/?build=2018030801&ip=59.64.129.119&tz=-480]
    [HTTP request 1/1]
    [Response in frame: 113]

No.     Time               Source                Destination           Protocol Length Info
    113 09:01:34.099175    74.80.130.236         10.210.66.82          HTTP     261    HTTP/1.1 450 unknown  (application/json)

Frame 113: 261 bytes on wire (2088 bits), 261 bytes captured (2088 bits) on interface 0
Ethernet II, Src: Hangzhou_d2:34:0d (3c:e5:a6:d2:34:0d), Dst: AsustekC_34:f3:aa (9c:5c:8e:34:f3:aa)
Internet Protocol Version 4, Src: 74.80.130.236, Dst: 10.210.66.82
Transmission Control Protocol, Src Port: 80 (80), Dst Port: 64013 (64013), Seq: 1, Ack: 120, Len: 207
Hypertext Transfer Protocol
    HTTP/1.1 450 unknown\r\n
    Content-Type: application/json\r\n
    Date: Sat, 19 May 2018 09:01:23 GMT\r\n
    Connection: close\r\n
    Transfer-Encoding: chunked\r\n
    \r\n
    [HTTP response 1/1]
    [Time since request: 0.456537000 seconds]
    [Request in frame: 101]
    HTTP chunked response
JavaScript Object Notation: application/json

No.     Time               Source                Destination           Protocol Length Info
    186 09:01:59.311396    10.210.66.82          74.80.130.236         HTTP     173    GET /?build=2018030801&ip=59.64.129.119&tz=-480 HTTP/1.1 

Frame 186: 173 bytes on wire (1384 bits), 173 bytes captured (1384 bits) on interface 0
Ethernet II, Src: AsustekC_34:f3:aa (9c:5c:8e:34:f3:aa), Dst: Hangzhou_d2:34:0d (3c:e5:a6:d2:34:0d)
Internet Protocol Version 4, Src: 10.210.66.82, Dst: 74.80.130.236
Transmission Control Protocol, Src Port: 64022 (64022), Dst Port: 80 (80), Seq: 1, Ack: 1, Len: 119
Hypertext Transfer Protocol
    GET /?build=2018030801&ip=59.64.129.119&tz=-480 HTTP/1.1\r\n
    Host: workdistribute.charityengine.com\r\n
    Connection: close\r\n
    \r\n
    [Full request URI: http://workdistribute.charityengine.com/?build=2018030801&ip=59.64.129.119&tz=-480]
    [HTTP request 1/1]
    [Response in frame: 187]

No.     Time               Source                Destination           Protocol Length Info
    187 09:01:59.549926    74.80.130.236         10.210.66.82          HTTP     261    HTTP/1.1 450 unknown  (application/json)

Frame 187: 261 bytes on wire (2088 bits), 261 bytes captured (2088 bits) on interface 0
Ethernet II, Src: Hangzhou_d2:34:0d (3c:e5:a6:d2:34:0d), Dst: AsustekC_34:f3:aa (9c:5c:8e:34:f3:aa)
Internet Protocol Version 4, Src: 74.80.130.236, Dst: 10.210.66.82
Transmission Control Protocol, Src Port: 80 (80), Dst Port: 64022 (64022), Seq: 1, Ack: 120, Len: 207
Hypertext Transfer Protocol
    HTTP/1.1 450 unknown\r\n
    Content-Type: application/json\r\n
    Date: Sat, 19 May 2018 09:01:48 GMT\r\n
    Connection: close\r\n
    Transfer-Encoding: chunked\r\n
    \r\n
    [HTTP response 1/1]
    [Time since request: 0.238530000 seconds]
    [Request in frame: 186]
    HTTP chunked response
JavaScript Object Notation: application/json

No.     Time               Source                Destination           Protocol Length Info
    324 09:02:24.765563    10.210.66.82          74.80.130.236         HTTP     173    GET /?build=2018030801&ip=59.64.129.119&tz=-480 HTTP/1.1 

Frame 324: 173 bytes on wire (1384 bits), 173 bytes captured (1384 bits) on interface 0
Ethernet II, Src: AsustekC_34:f3:aa (9c:5c:8e:34:f3:aa), Dst: Hangzhou_d2:34:0d (3c:e5:a6:d2:34:0d)
Internet Protocol Version 4, Src: 10.210.66.82, Dst: 74.80.130.236
Transmission Control Protocol, Src Port: 64051 (64051), Dst Port: 80 (80), Seq: 1, Ack: 1, Len: 119
Hypertext Transfer Protocol
    GET /?build=2018030801&ip=59.64.129.119&tz=-480 HTTP/1.1\r\n
    Host: workdistribute.charityengine.com\r\n
    Connection: close\r\n
    \r\n
    [Full request URI: http://workdistribute.charityengine.com/?build=2018030801&ip=59.64.129.119&tz=-480]
    [HTTP request 1/1]
    [Response in frame: 340]

No.     Time               Source                Destination           Protocol Length Info
    340 09:02:25.533249    74.80.130.236         10.210.66.82          HTTP     261    HTTP/1.1 450 unknown  (application/json)

Frame 340: 261 bytes on wire (2088 bits), 261 bytes captured (2088 bits) on interface 0
Ethernet II, Src: Hangzhou_d2:34:0d (3c:e5:a6:d2:34:0d), Dst: AsustekC_34:f3:aa (9c:5c:8e:34:f3:aa)
Internet Protocol Version 4, Src: 74.80.130.236, Dst: 10.210.66.82
Transmission Control Protocol, Src Port: 80 (80), Dst Port: 64051 (64051), Seq: 1, Ack: 120, Len: 207
Hypertext Transfer Protocol
    HTTP/1.1 450 unknown\r\n
    Content-Type: application/json\r\n
    Date: Sat, 19 May 2018 09:02:14 GMT\r\n
    Connection: close\r\n
    Transfer-Encoding: chunked\r\n
    \r\n
    [HTTP response 1/1]
    [Time since request: 0.767686000 seconds]
    [Request in frame: 324]
    HTTP chunked response
JavaScript Object Notation: application/json

No.     Time               Source                Destination           Protocol Length Info
    446 09:02:50.752025    10.210.66.82          74.80.130.236         HTTP     173    GET /?build=2018030801&ip=59.64.129.119&tz=-480 HTTP/1.1 

Frame 446: 173 bytes on wire (1384 bits), 173 bytes captured (1384 bits) on interface 0
Ethernet II, Src: AsustekC_34:f3:aa (9c:5c:8e:34:f3:aa), Dst: Hangzhou_d2:34:0d (3c:e5:a6:d2:34:0d)
Internet Protocol Version 4, Src: 10.210.66.82, Dst: 74.80.130.236
Transmission Control Protocol, Src Port: 64062 (64062), Dst Port: 80 (80), Seq: 1, Ack: 1, Len: 119
Hypertext Transfer Protocol
    GET /?build=2018030801&ip=59.64.129.119&tz=-480 HTTP/1.1\r\n
    Host: workdistribute.charityengine.com\r\n
    Connection: close\r\n
    \r\n
    [Full request URI: http://workdistribute.charityengine.com/?build=2018030801&ip=59.64.129.119&tz=-480]
    [HTTP request 1/1]
    [Response in frame: 448]

No.     Time               Source                Destination           Protocol Length Info
    448 09:02:51.213530    74.80.130.236         10.210.66.82          HTTP     261    HTTP/1.1 450 unknown  (application/json)

Frame 448: 261 bytes on wire (2088 bits), 261 bytes captured (2088 bits) on interface 0
Ethernet II, Src: Hangzhou_d2:34:0d (3c:e5:a6:d2:34:0d), Dst: AsustekC_34:f3:aa (9c:5c:8e:34:f3:aa)
Internet Protocol Version 4, Src: 74.80.130.236, Dst: 10.210.66.82
Transmission Control Protocol, Src Port: 80 (80), Dst Port: 64062 (64062), Seq: 1, Ack: 120, Len: 207
Hypertext Transfer Protocol
    HTTP/1.1 450 unknown\r\n
    Content-Type: application/json\r\n
    Date: Sat, 19 May 2018 09:02:40 GMT\r\n
    Connection: close\r\n
    Transfer-Encoding: chunked\r\n
    \r\n
    [HTTP response 1/1]
    [Time since request: 0.461505000 seconds]
    [Request in frame: 446]
    HTTP chunked response
JavaScript Object Notation: application/json

No.     Time               Source                Destination           Protocol Length Info
    476 09:02:59.430259    10.210.66.82          123.58.180.5          HTTP     834    POST /open/mob/record/sync.do HTTP/1.1 

Frame 476: 834 bytes on wire (6672 bits), 834 bytes captured (6672 bits) on interface 0
Ethernet II, Src: AsustekC_34:f3:aa (9c:5c:8e:34:f3:aa), Dst: Hangzhou_d2:34:0d (3c:e5:a6:d2:34:0d)
Internet Protocol Version 4, Src: 10.210.66.82, Dst: 123.58.180.5
Transmission Control Protocol, Src Port: 64067 (64067), Dst Port: 80 (80), Seq: 1441, Ack: 1, Len: 780
[2 Reassembled TCP Segments (2220 bytes): #475(1440), #476(780)]
Hypertext Transfer Protocol
    POST /open/mob/record/sync.do HTTP/1.1\r\n
    Host: c.open.163.com\r\n
    Connection: keep-alive\r\n
    Content-Length: 171\r\n
    Origin: http://swf.ws.126.net\r\n
    X-Requested-With: ShockwaveFlash/29.0.0.171\r\n
    User-Agent: Mozilla/5.0 (Windows NT 10.0; Win64; x64) AppleWebKit/537.36 (KHTML, like Gecko) Chrome/66.0.3359.139 Safari/537.36\r\n
    Content-Type: application/x-www-form-urlencoded\r\n
    Accept: */*\r\n
    Referer: http://swf.ws.126.net/openplayer/v01/-0-2_M7GF17HPS_M7GHGQTFG-vimg1_ws_126_net//image/snapshot_movie/2011/11/B/S/M7HBBBQBS-1430711943278.swf\r\n
    Accept-Encoding: gzip, deflate\r\n
    Accept-Language: en-US,en;q=0.9,zh-TW;q=0.8,zh;q=0.7\r\n
     [truncated]Cookie: _ntes_nnid=1f983bbb19f587d903825b029b84bd36,1516798611503; _ntes_nuid=1f983bbb19f587d903825b029b84bd36; starttime=; nts_mail_user=18801120356@163.com:-1:1; df=mail163_letter; _ngd_tid=gZ5L1GNfSjPRjDUxM65L36DYXg7hVnlC; m
    \r\n
    [Full request URI: http://c.open.163.com/open/mob/record/sync.do]
    [HTTP request 1/1]
    [Response in frame: 481]

No.     Time               Source                Destination           Protocol Length Info
    481 09:02:59.507075    123.58.180.5          10.210.66.82          HTTP     415    HTTP/1.1 200 OK  (application/json)

Frame 481: 415 bytes on wire (3320 bits), 415 bytes captured (3320 bits) on interface 0
Ethernet II, Src: Hangzhou_d2:34:0d (3c:e5:a6:d2:34:0d), Dst: AsustekC_34:f3:aa (9c:5c:8e:34:f3:aa)
Internet Protocol Version 4, Src: 123.58.180.5, Dst: 10.210.66.82
Transmission Control Protocol, Src Port: 80 (80), Dst Port: 64067 (64067), Seq: 1, Ack: 2392, Len: 361
Hypertext Transfer Protocol
    HTTP/1.1 200 OK\r\n
    Server: nginx\r\n
    Date: Sat, 19 May 2018 09:02:48 GMT\r\n
    Content-Type: application/json;charset=UTF-8\r\n
    Transfer-Encoding: chunked\r\n
    Connection: keep-alive\r\n
    Vary: Accept-Encoding\r\n
    Vary: Accept-Encoding\r\n
    Set-Cookie: NTESOPENSI=264dd92fb54c4687ab932d6eb61ef114; Domain=c.open.163.com; Path=/\r\n
    Content-Encoding: gzip\r\n
    \r\n
    [HTTP response 1/1]
    [Time since request: 0.076816000 seconds]
    [Request in frame: 476]
    HTTP chunked response
    Content-encoded entity body (gzip): 28 bytes -> 12 bytes
JavaScript Object Notation: application/json

No.     Time               Source                Destination           Protocol Length Info
    558 09:03:16.608072    10.210.66.82          74.80.130.236         HTTP     173    GET /?build=2018030801&ip=59.64.129.119&tz=-480 HTTP/1.1 

Frame 558: 173 bytes on wire (1384 bits), 173 bytes captured (1384 bits) on interface 0
Ethernet II, Src: AsustekC_34:f3:aa (9c:5c:8e:34:f3:aa), Dst: Hangzhou_d2:34:0d (3c:e5:a6:d2:34:0d)
Internet Protocol Version 4, Src: 10.210.66.82, Dst: 74.80.130.236
Transmission Control Protocol, Src Port: 64074 (64074), Dst Port: 80 (80), Seq: 1, Ack: 1, Len: 119
Hypertext Transfer Protocol
    GET /?build=2018030801&ip=59.64.129.119&tz=-480 HTTP/1.1\r\n
    Host: workdistribute.charityengine.com\r\n
    Connection: close\r\n
    \r\n
    [Full request URI: http://workdistribute.charityengine.com/?build=2018030801&ip=59.64.129.119&tz=-480]
    [HTTP request 1/1]
    [Response in frame: 560]

No.     Time               Source                Destination           Protocol Length Info
    560 09:03:16.977942    74.80.130.236         10.210.66.82          HTTP     261    HTTP/1.1 450 unknown  (application/json)

Frame 560: 261 bytes on wire (2088 bits), 261 bytes captured (2088 bits) on interface 0
Ethernet II, Src: Hangzhou_d2:34:0d (3c:e5:a6:d2:34:0d), Dst: AsustekC_34:f3:aa (9c:5c:8e:34:f3:aa)
Internet Protocol Version 4, Src: 74.80.130.236, Dst: 10.210.66.82
Transmission Control Protocol, Src Port: 80 (80), Dst Port: 64074 (64074), Seq: 1, Ack: 120, Len: 207
Hypertext Transfer Protocol
    HTTP/1.1 450 unknown\r\n
    Content-Type: application/json\r\n
    Date: Sat, 19 May 2018 09:03:05 GMT\r\n
    Connection: close\r\n
    Transfer-Encoding: chunked\r\n
    \r\n
    [HTTP response 1/1]
    [Time since request: 0.369870000 seconds]
    [Request in frame: 558]
    HTTP chunked response
JavaScript Object Notation: application/json

No.     Time               Source                Destination           Protocol Length Info
    570 09:03:17.406459    10.210.66.82          120.241.2.167         HTTP     449    GET /lv=1.0&encrypt_data=bTkwAkdkAOSDpRrlR4hoP1Nzl7UEu93v7snk1VkkrxRjvSXpCcuVFuoqftQMjRawYYsWZQNuYbfvc9USIT1VVW+xiAgh8T3X6Qt8OXJC2PQ+m2dLIwOvIurz7bp95qrJMBGimS+6H5fnipX1fA00MGJ6Tuct2wUx5ZdTymCvO4FgTKpzZmnRVeAvqVkmcLVhOfk4bTTc+Pz3AQtALgIFTHrxX7F0K2YR/neWqWvtTL0lgLzaPyJp5q7vZ40WSpEMezt8w1DPiMe5wBs1V6ahpn4LjRRAKRUvoOyRVkW0Adc0EVgpD5RZ2LacIRECL8L+ HTTP/1.1 

Frame 570: 449 bytes on wire (3592 bits), 449 bytes captured (3592 bits) on interface 0
Ethernet II, Src: AsustekC_34:f3:aa (9c:5c:8e:34:f3:aa), Dst: Hangzhou_d2:34:0d (3c:e5:a6:d2:34:0d)
Internet Protocol Version 4, Src: 10.210.66.82, Dst: 120.241.2.167
Transmission Control Protocol, Src Port: 64077 (64077), Dst Port: 80 (80), Seq: 1, Ack: 1, Len: 395
Hypertext Transfer Protocol
     [truncated]GET /lv=1.0&encrypt_data=bTkwAkdkAOSDpRrlR4hoP1Nzl7UEu93v7snk1VkkrxRjvSXpCcuVFuoqftQMjRawYYsWZQNuYbfvc9USIT1VVW+xiAgh8T3X6Qt8OXJC2PQ+m2dLIwOvIurz7bp95qrJMBGimS+6H5fnipX1fA00MGJ6Tuct2wUx5ZdTymCvO4FgTKpzZmnRVeAvqVkmcLVhOfk4bTTc+P
    Host: mmstat.ucweb.com\r\n
    Accept: */*\r\n
    \r\n
    [Full request URI [truncated]: http://mmstat.ucweb.com/lv=1.0&encrypt_data=bTkwAkdkAOSDpRrlR4hoP1Nzl7UEu93v7snk1VkkrxRjvSXpCcuVFuoqftQMjRawYYsWZQNuYbfvc9USIT1VVW+xiAgh8T3X6Qt8OXJC2PQ+m2dLIwOvIurz7bp95qrJMBGimS+6H5fnipX1fA00MGJ6Tuct2wUx5ZdTy]
    [HTTP request 1/1]

No.     Time               Source                Destination           Protocol Length Info
    704 09:03:29.740793    10.210.66.82          122.226.166.49        HTTP     497    POST /dmdt/index.php HTTP/1.1  (application/x-www-form-urlencoded)

Frame 704: 497 bytes on wire (3976 bits), 497 bytes captured (3976 bits) on interface 0
Ethernet II, Src: AsustekC_34:f3:aa (9c:5c:8e:34:f3:aa), Dst: Hangzhou_d2:34:0d (3c:e5:a6:d2:34:0d)
Internet Protocol Version 4, Src: 10.210.66.82, Dst: 122.226.166.49
Transmission Control Protocol, Src Port: 64086 (64086), Dst Port: 80 (80), Seq: 1, Ack: 1, Len: 443
Hypertext Transfer Protocol
    POST /dmdt/index.php HTTP/1.1\r\n
    Content-Type: application/x-www-form-urlencoded; charset=UTF-8\r\n
    Host: t.safe.2345.com\r\n
    Content-Length: 277\r\n
    Cache-Control: no-cache\r\n
    \r\n
    [Full request URI: http://t.safe.2345.com/dmdt/index.php]
    [HTTP request 1/1]
    [Response in frame: 706]
HTML Form URL Encoded: application/x-www-form-urlencoded

No.     Time               Source                Destination           Protocol Length Info
    706 09:03:29.791457    122.226.166.49        10.210.66.82          HTTP     284    HTTP/1.1 200 OK  (text/html)

Frame 706: 284 bytes on wire (2272 bits), 284 bytes captured (2272 bits) on interface 0
Ethernet II, Src: Hangzhou_d2:34:0d (3c:e5:a6:d2:34:0d), Dst: AsustekC_34:f3:aa (9c:5c:8e:34:f3:aa)
Internet Protocol Version 4, Src: 122.226.166.49, Dst: 10.210.66.82
Transmission Control Protocol, Src Port: 80 (80), Dst Port: 64086 (64086), Seq: 1, Ack: 444, Len: 230
Hypertext Transfer Protocol
    HTTP/1.1 200 OK\r\n
    Date: Sat, 19 May 2018 09:03:17 GMT\r\n
    Content-Type: text/html\r\n
    Transfer-Encoding: chunked\r\n
    Connection: keep-alive\r\n
    Vary: Accept-Encoding\r\n
    Vary: Accept-Encoding\r\n
    \r\n
    [HTTP response 1/1]
    [Time since request: 0.050664000 seconds]
    [Request in frame: 704]
    HTTP chunked response
Line-based text data: text/html

No.     Time               Source                Destination           Protocol Length Info
    757 09:03:42.201856    10.210.66.82          74.80.130.236         HTTP     173    GET /?build=2018030801&ip=59.64.129.119&tz=-480 HTTP/1.1 

Frame 757: 173 bytes on wire (1384 bits), 173 bytes captured (1384 bits) on interface 0
Ethernet II, Src: AsustekC_34:f3:aa (9c:5c:8e:34:f3:aa), Dst: Hangzhou_d2:34:0d (3c:e5:a6:d2:34:0d)
Internet Protocol Version 4, Src: 10.210.66.82, Dst: 74.80.130.236
Transmission Control Protocol, Src Port: 64091 (64091), Dst Port: 80 (80), Seq: 1, Ack: 1, Len: 119
Hypertext Transfer Protocol
    GET /?build=2018030801&ip=59.64.129.119&tz=-480 HTTP/1.1\r\n
    Host: workdistribute.charityengine.com\r\n
    Connection: close\r\n
    \r\n
    [Full request URI: http://workdistribute.charityengine.com/?build=2018030801&ip=59.64.129.119&tz=-480]
    [HTTP request 1/1]
    [Response in frame: 759]

No.     Time               Source                Destination           Protocol Length Info
    759 09:03:42.640330    74.80.130.236         10.210.66.82          HTTP     261    HTTP/1.1 450 unknown  (application/json)

Frame 759: 261 bytes on wire (2088 bits), 261 bytes captured (2088 bits) on interface 0
Ethernet II, Src: Hangzhou_d2:34:0d (3c:e5:a6:d2:34:0d), Dst: AsustekC_34:f3:aa (9c:5c:8e:34:f3:aa)
Internet Protocol Version 4, Src: 74.80.130.236, Dst: 10.210.66.82
Transmission Control Protocol, Src Port: 80 (80), Dst Port: 64091 (64091), Seq: 1, Ack: 120, Len: 207
Hypertext Transfer Protocol
    HTTP/1.1 450 unknown\r\n
    Content-Type: application/json\r\n
    Date: Sat, 19 May 2018 09:03:31 GMT\r\n
    Connection: close\r\n
    Transfer-Encoding: chunked\r\n
    \r\n
    [HTTP response 1/1]
    [Time since request: 0.438474000 seconds]
    [Request in frame: 757]
    HTTP chunked response
JavaScript Object Notation: application/json

No.     Time               Source                Destination           Protocol Length Info
    824 09:04:03.981510    10.210.66.82          74.80.130.236         HTTP     323    POST /cgi/cgi HTTP/1.1 

Frame 824: 323 bytes on wire (2584 bits), 323 bytes captured (2584 bits) on interface 0
Ethernet II, Src: AsustekC_34:f3:aa (9c:5c:8e:34:f3:aa), Dst: Hangzhou_d2:34:0d (3c:e5:a6:d2:34:0d)
Internet Protocol Version 4, Src: 10.210.66.82, Dst: 74.80.130.236
Transmission Control Protocol, Src Port: 64097 (64097), Dst Port: 80 (80), Seq: 1, Ack: 1, Len: 269
Hypertext Transfer Protocol
    POST /cgi/cgi HTTP/1.1\r\n
    Host: work.charityengine.com\r\n
    User-Agent: BOINC client (windows_x86_64 7.6.33)\r\n
    Accept: */*\r\n
    Accept-Encoding: deflate, gzip\r\n
    Content-Type: application/x-www-form-urlencoded\r\n
    Accept-Language: zh_CN\r\n
    Content-Length: 14840\r\n
    Expect: 100-continue\r\n
    \r\n
    [Full request URI: http://work.charityengine.com/cgi/cgi]
    [HTTP request 1/2]
    [Response in frame: 826]

No.     Time               Source                Destination           Protocol Length Info
    826 09:04:04.196464    74.80.130.236         10.210.66.82          HTTP     79     HTTP/1.1 100 Continue 

Frame 826: 79 bytes on wire (632 bits), 79 bytes captured (632 bits) on interface 0
Ethernet II, Src: Hangzhou_d2:34:0d (3c:e5:a6:d2:34:0d), Dst: AsustekC_34:f3:aa (9c:5c:8e:34:f3:aa)
Internet Protocol Version 4, Src: 74.80.130.236, Dst: 10.210.66.82
Transmission Control Protocol, Src Port: 80 (80), Dst Port: 64097 (64097), Seq: 1, Ack: 270, Len: 25
Hypertext Transfer Protocol
    HTTP/1.1 100 Continue\r\n
    \r\n
    [HTTP response 1/2]
    [Time since request: 0.214954000 seconds]
    [Request in frame: 824]
    [Next response in frame: 847]

No.     Time               Source                Destination           Protocol Length Info
    847 09:04:04.635280    74.80.130.236         10.210.66.82          HTTP/XML 898    HTTP/1.1 200 OK 

Frame 847: 898 bytes on wire (7184 bits), 898 bytes captured (7184 bits) on interface 0
Ethernet II, Src: Hangzhou_d2:34:0d (3c:e5:a6:d2:34:0d), Dst: AsustekC_34:f3:aa (9c:5c:8e:34:f3:aa)
Internet Protocol Version 4, Src: 74.80.130.236, Dst: 10.210.66.82
Transmission Control Protocol, Src Port: 80 (80), Dst Port: 64097 (64097), Seq: 26, Ack: 15110, Len: 844
Hypertext Transfer Protocol
    HTTP/1.1 200 OK\r\n
    Date: Sat, 19 May 2018 09:03:53 GMT\r\n
    Server: Apache/2.4.10 (Debian) mod_fcgid/2.3.9 OpenSSL/1.0.1t\r\n
    Vary: Accept-Encoding\r\n
    Content-Encoding: gzip\r\n
    Content-Length: 633\r\n
    Content-Type: text/xml\r\n
    \r\n
    [HTTP response 2/2]
    [Prev request in frame: 824]
    [Prev response in frame: 826]
    Content-encoded entity body (gzip): 633 bytes -> 1540 bytes
eXtensible Markup Language

No.     Time               Source                Destination           Protocol Length Info
    863 09:04:07.871543    10.210.66.82          74.80.130.236         HTTP     173    GET /?build=2018030801&ip=59.64.129.119&tz=-480 HTTP/1.1 

Frame 863: 173 bytes on wire (1384 bits), 173 bytes captured (1384 bits) on interface 0
Ethernet II, Src: AsustekC_34:f3:aa (9c:5c:8e:34:f3:aa), Dst: Hangzhou_d2:34:0d (3c:e5:a6:d2:34:0d)
Internet Protocol Version 4, Src: 10.210.66.82, Dst: 74.80.130.236
Transmission Control Protocol, Src Port: 64101 (64101), Dst Port: 80 (80), Seq: 1, Ack: 1, Len: 119
Hypertext Transfer Protocol
    GET /?build=2018030801&ip=59.64.129.119&tz=-480 HTTP/1.1\r\n
    Host: workdistribute.charityengine.com\r\n
    Connection: close\r\n
    \r\n
    [Full request URI: http://workdistribute.charityengine.com/?build=2018030801&ip=59.64.129.119&tz=-480]
    [HTTP request 1/1]
    [Response in frame: 865]

No.     Time               Source                Destination           Protocol Length Info
    865 09:04:08.306736    74.80.130.236         10.210.66.82          HTTP     261    HTTP/1.1 450 unknown  (application/json)

Frame 865: 261 bytes on wire (2088 bits), 261 bytes captured (2088 bits) on interface 0
Ethernet II, Src: Hangzhou_d2:34:0d (3c:e5:a6:d2:34:0d), Dst: AsustekC_34:f3:aa (9c:5c:8e:34:f3:aa)
Internet Protocol Version 4, Src: 74.80.130.236, Dst: 10.210.66.82
Transmission Control Protocol, Src Port: 80 (80), Dst Port: 64101 (64101), Seq: 1, Ack: 120, Len: 207
Hypertext Transfer Protocol
    HTTP/1.1 450 unknown\r\n
    Content-Type: application/json\r\n
    Date: Sat, 19 May 2018 09:03:57 GMT\r\n
    Connection: close\r\n
    Transfer-Encoding: chunked\r\n
    \r\n
    [HTTP response 1/1]
    [Time since request: 0.435193000 seconds]
    [Request in frame: 863]
    HTTP chunked response
JavaScript Object Notation: application/json

No.     Time               Source                Destination           Protocol Length Info
    931 09:04:33.516457    10.210.66.82          74.80.130.236         HTTP     173    GET /?build=2018030801&ip=59.64.129.119&tz=-480 HTTP/1.1 

Frame 931: 173 bytes on wire (1384 bits), 173 bytes captured (1384 bits) on interface 0
Ethernet II, Src: AsustekC_34:f3:aa (9c:5c:8e:34:f3:aa), Dst: Hangzhou_d2:34:0d (3c:e5:a6:d2:34:0d)
Internet Protocol Version 4, Src: 10.210.66.82, Dst: 74.80.130.236
Transmission Control Protocol, Src Port: 64107 (64107), Dst Port: 80 (80), Seq: 1, Ack: 1, Len: 119
Hypertext Transfer Protocol
    GET /?build=2018030801&ip=59.64.129.119&tz=-480 HTTP/1.1\r\n
    Host: workdistribute.charityengine.com\r\n
    Connection: close\r\n
    \r\n
    [Full request URI: http://workdistribute.charityengine.com/?build=2018030801&ip=59.64.129.119&tz=-480]
    [HTTP request 1/1]
    [Response in frame: 933]

No.     Time               Source                Destination           Protocol Length Info
    933 09:04:34.029761    74.80.130.236         10.210.66.82          HTTP     261    HTTP/1.1 450 unknown  (application/json)

Frame 933: 261 bytes on wire (2088 bits), 261 bytes captured (2088 bits) on interface 0
Ethernet II, Src: Hangzhou_d2:34:0d (3c:e5:a6:d2:34:0d), Dst: AsustekC_34:f3:aa (9c:5c:8e:34:f3:aa)
Internet Protocol Version 4, Src: 74.80.130.236, Dst: 10.210.66.82
Transmission Control Protocol, Src Port: 80 (80), Dst Port: 64107 (64107), Seq: 1, Ack: 120, Len: 207
Hypertext Transfer Protocol
    HTTP/1.1 450 unknown\r\n
    Content-Type: application/json\r\n
    Date: Sat, 19 May 2018 09:04:22 GMT\r\n
    Connection: close\r\n
    Transfer-Encoding: chunked\r\n
    \r\n
    [HTTP response 1/1]
    [Time since request: 0.513304000 seconds]
    [Request in frame: 931]
    HTTP chunked response
JavaScript Object Notation: application/json

No.     Time               Source                Destination           Protocol Length Info
   1033 09:04:59.241588    10.210.66.82          74.80.130.236         HTTP     173    GET /?build=2018030801&ip=59.64.129.119&tz=-480 HTTP/1.1 

Frame 1033: 173 bytes on wire (1384 bits), 173 bytes captured (1384 bits) on interface 0
Ethernet II, Src: AsustekC_34:f3:aa (9c:5c:8e:34:f3:aa), Dst: Hangzhou_d2:34:0d (3c:e5:a6:d2:34:0d)
Internet Protocol Version 4, Src: 10.210.66.82, Dst: 74.80.130.236
Transmission Control Protocol, Src Port: 64119 (64119), Dst Port: 80 (80), Seq: 1, Ack: 1, Len: 119
Hypertext Transfer Protocol
    GET /?build=2018030801&ip=59.64.129.119&tz=-480 HTTP/1.1\r\n
    Host: workdistribute.charityengine.com\r\n
    Connection: close\r\n
    \r\n
    [Full request URI: http://workdistribute.charityengine.com/?build=2018030801&ip=59.64.129.119&tz=-480]
    [HTTP request 1/1]
    [Response in frame: 1035]

No.     Time               Source                Destination           Protocol Length Info
   1035 09:04:59.595273    74.80.130.236         10.210.66.82          HTTP     261    HTTP/1.1 450 unknown  (application/json)

Frame 1035: 261 bytes on wire (2088 bits), 261 bytes captured (2088 bits) on interface 0
Ethernet II, Src: Hangzhou_d2:34:0d (3c:e5:a6:d2:34:0d), Dst: AsustekC_34:f3:aa (9c:5c:8e:34:f3:aa)
Internet Protocol Version 4, Src: 74.80.130.236, Dst: 10.210.66.82
Transmission Control Protocol, Src Port: 80 (80), Dst Port: 64119 (64119), Seq: 1, Ack: 120, Len: 207
Hypertext Transfer Protocol
    HTTP/1.1 450 unknown\r\n
    Content-Type: application/json\r\n
    Date: Sat, 19 May 2018 09:04:48 GMT\r\n
    Connection: close\r\n
    Transfer-Encoding: chunked\r\n
    \r\n
    [HTTP response 1/1]
    [Time since request: 0.353685000 seconds]
    [Request in frame: 1033]
    HTTP chunked response
JavaScript Object Notation: application/json

No.     Time               Source                Destination           Protocol Length Info
   1094 09:05:24.811252    10.210.66.82          74.80.130.236         HTTP     173    GET /?build=2018030801&ip=59.64.129.119&tz=-480 HTTP/1.1 

Frame 1094: 173 bytes on wire (1384 bits), 173 bytes captured (1384 bits) on interface 0
Ethernet II, Src: AsustekC_34:f3:aa (9c:5c:8e:34:f3:aa), Dst: Hangzhou_d2:34:0d (3c:e5:a6:d2:34:0d)
Internet Protocol Version 4, Src: 10.210.66.82, Dst: 74.80.130.236
Transmission Control Protocol, Src Port: 64126 (64126), Dst Port: 80 (80), Seq: 1, Ack: 1, Len: 119
Hypertext Transfer Protocol
    GET /?build=2018030801&ip=59.64.129.119&tz=-480 HTTP/1.1\r\n
    Host: workdistribute.charityengine.com\r\n
    Connection: close\r\n
    \r\n
    [Full request URI: http://workdistribute.charityengine.com/?build=2018030801&ip=59.64.129.119&tz=-480]
    [HTTP request 1/1]
    [Response in frame: 1096]

No.     Time               Source                Destination           Protocol Length Info
   1096 09:05:25.072678    74.80.130.236         10.210.66.82          HTTP     261    HTTP/1.1 450 unknown  (application/json)

Frame 1096: 261 bytes on wire (2088 bits), 261 bytes captured (2088 bits) on interface 0
Ethernet II, Src: Hangzhou_d2:34:0d (3c:e5:a6:d2:34:0d), Dst: AsustekC_34:f3:aa (9c:5c:8e:34:f3:aa)
Internet Protocol Version 4, Src: 74.80.130.236, Dst: 10.210.66.82
Transmission Control Protocol, Src Port: 80 (80), Dst Port: 64126 (64126), Seq: 1, Ack: 120, Len: 207
Hypertext Transfer Protocol
    HTTP/1.1 450 unknown\r\n
    Content-Type: application/json\r\n
    Date: Sat, 19 May 2018 09:05:14 GMT\r\n
    Connection: close\r\n
    Transfer-Encoding: chunked\r\n
    \r\n
    [HTTP response 1/1]
    [Time since request: 0.261426000 seconds]
    [Request in frame: 1094]
    HTTP chunked response
JavaScript Object Notation: application/json

No.     Time               Source                Destination           Protocol Length Info
   1168 09:05:50.284147    10.210.66.82          74.80.130.236         HTTP     173    GET /?build=2018030801&ip=59.64.129.119&tz=-480 HTTP/1.1 

Frame 1168: 173 bytes on wire (1384 bits), 173 bytes captured (1384 bits) on interface 0
Ethernet II, Src: AsustekC_34:f3:aa (9c:5c:8e:34:f3:aa), Dst: Hangzhou_d2:34:0d (3c:e5:a6:d2:34:0d)
Internet Protocol Version 4, Src: 10.210.66.82, Dst: 74.80.130.236
Transmission Control Protocol, Src Port: 64134 (64134), Dst Port: 80 (80), Seq: 1, Ack: 1, Len: 119
Hypertext Transfer Protocol
    GET /?build=2018030801&ip=59.64.129.119&tz=-480 HTTP/1.1\r\n
    Host: workdistribute.charityengine.com\r\n
    Connection: close\r\n
    \r\n
    [Full request URI: http://workdistribute.charityengine.com/?build=2018030801&ip=59.64.129.119&tz=-480]
    [HTTP request 1/1]
    [Response in frame: 1173]

No.     Time               Source                Destination           Protocol Length Info
   1173 09:05:50.618880    74.80.130.236         10.210.66.82          HTTP     261    HTTP/1.1 450 unknown  (application/json)

Frame 1173: 261 bytes on wire (2088 bits), 261 bytes captured (2088 bits) on interface 0
Ethernet II, Src: Hangzhou_d2:34:0d (3c:e5:a6:d2:34:0d), Dst: AsustekC_34:f3:aa (9c:5c:8e:34:f3:aa)
Internet Protocol Version 4, Src: 74.80.130.236, Dst: 10.210.66.82
Transmission Control Protocol, Src Port: 80 (80), Dst Port: 64134 (64134), Seq: 1, Ack: 120, Len: 207
Hypertext Transfer Protocol
    HTTP/1.1 450 unknown\r\n
    Content-Type: application/json\r\n
    Date: Sat, 19 May 2018 09:05:39 GMT\r\n
    Connection: close\r\n
    Transfer-Encoding: chunked\r\n
    \r\n
    [HTTP response 1/1]
    [Time since request: 0.334733000 seconds]
    [Request in frame: 1168]
    HTTP chunked response
JavaScript Object Notation: application/json

No.     Time               Source                Destination           Protocol Length Info
   1196 09:05:59.425820    10.210.66.82          123.58.180.5          HTTP     834    POST /open/mob/record/sync.do HTTP/1.1 

Frame 1196: 834 bytes on wire (6672 bits), 834 bytes captured (6672 bits) on interface 0
Ethernet II, Src: AsustekC_34:f3:aa (9c:5c:8e:34:f3:aa), Dst: Hangzhou_d2:34:0d (3c:e5:a6:d2:34:0d)
Internet Protocol Version 4, Src: 10.210.66.82, Dst: 123.58.180.5
Transmission Control Protocol, Src Port: 64138 (64138), Dst Port: 80 (80), Seq: 1441, Ack: 1, Len: 780
[2 Reassembled TCP Segments (2220 bytes): #1195(1440), #1196(780)]
Hypertext Transfer Protocol
    POST /open/mob/record/sync.do HTTP/1.1\r\n
    Host: c.open.163.com\r\n
    Connection: keep-alive\r\n
    Content-Length: 171\r\n
    Origin: http://swf.ws.126.net\r\n
    X-Requested-With: ShockwaveFlash/29.0.0.171\r\n
    User-Agent: Mozilla/5.0 (Windows NT 10.0; Win64; x64) AppleWebKit/537.36 (KHTML, like Gecko) Chrome/66.0.3359.139 Safari/537.36\r\n
    Content-Type: application/x-www-form-urlencoded\r\n
    Accept: */*\r\n
    Referer: http://swf.ws.126.net/openplayer/v01/-0-2_M7GF17HPS_M7GHGQTFG-vimg1_ws_126_net//image/snapshot_movie/2011/11/B/S/M7HBBBQBS-1430711943278.swf\r\n
    Accept-Encoding: gzip, deflate\r\n
    Accept-Language: en-US,en;q=0.9,zh-TW;q=0.8,zh;q=0.7\r\n
     [truncated]Cookie: _ntes_nnid=1f983bbb19f587d903825b029b84bd36,1516798611503; _ntes_nuid=1f983bbb19f587d903825b029b84bd36; starttime=; nts_mail_user=18801120356@163.com:-1:1; df=mail163_letter; _ngd_tid=gZ5L1GNfSjPRjDUxM65L36DYXg7hVnlC; m
    \r\n
    [Full request URI: http://c.open.163.com/open/mob/record/sync.do]
    [HTTP request 1/1]
    [Response in frame: 1203]

No.     Time               Source                Destination           Protocol Length Info
   1203 09:05:59.501916    123.58.180.5          10.210.66.82          HTTP     415    HTTP/1.1 200 OK  (application/json)

Frame 1203: 415 bytes on wire (3320 bits), 415 bytes captured (3320 bits) on interface 0
Ethernet II, Src: Hangzhou_d2:34:0d (3c:e5:a6:d2:34:0d), Dst: AsustekC_34:f3:aa (9c:5c:8e:34:f3:aa)
Internet Protocol Version 4, Src: 123.58.180.5, Dst: 10.210.66.82
Transmission Control Protocol, Src Port: 80 (80), Dst Port: 64138 (64138), Seq: 1, Ack: 2392, Len: 361
Hypertext Transfer Protocol
    HTTP/1.1 200 OK\r\n
    Server: nginx\r\n
    Date: Sat, 19 May 2018 09:05:48 GMT\r\n
    Content-Type: application/json;charset=UTF-8\r\n
    Transfer-Encoding: chunked\r\n
    Connection: keep-alive\r\n
    Vary: Accept-Encoding\r\n
    Vary: Accept-Encoding\r\n
    Set-Cookie: NTESOPENSI=d41e058830934378abe26f30a93d1fe9; Domain=c.open.163.com; Path=/\r\n
    Content-Encoding: gzip\r\n
    \r\n
    [HTTP response 1/1]
    [Time since request: 0.076096000 seconds]
    [Request in frame: 1196]
    HTTP chunked response
    Content-encoded entity body (gzip): 28 bytes -> 12 bytes
JavaScript Object Notation: application/json

No.     Time               Source                Destination           Protocol Length Info
   1279 09:06:15.834306    10.210.66.82          74.80.130.236         HTTP     173    GET /?build=2018030801&ip=59.64.129.119&tz=-480 HTTP/1.1 

Frame 1279: 173 bytes on wire (1384 bits), 173 bytes captured (1384 bits) on interface 0
Ethernet II, Src: AsustekC_34:f3:aa (9c:5c:8e:34:f3:aa), Dst: Hangzhou_d2:34:0d (3c:e5:a6:d2:34:0d)
Internet Protocol Version 4, Src: 10.210.66.82, Dst: 74.80.130.236
Transmission Control Protocol, Src Port: 64147 (64147), Dst Port: 80 (80), Seq: 1, Ack: 1, Len: 119
Hypertext Transfer Protocol
    GET /?build=2018030801&ip=59.64.129.119&tz=-480 HTTP/1.1\r\n
    Host: workdistribute.charityengine.com\r\n
    Connection: close\r\n
    \r\n
    [Full request URI: http://workdistribute.charityengine.com/?build=2018030801&ip=59.64.129.119&tz=-480]
    [HTTP request 1/1]
    [Response in frame: 1281]

No.     Time               Source                Destination           Protocol Length Info
   1281 09:06:17.012049    74.80.130.236         10.210.66.82          HTTP     261    HTTP/1.1 450 unknown  (application/json)

Frame 1281: 261 bytes on wire (2088 bits), 261 bytes captured (2088 bits) on interface 0
Ethernet II, Src: Hangzhou_d2:34:0d (3c:e5:a6:d2:34:0d), Dst: AsustekC_34:f3:aa (9c:5c:8e:34:f3:aa)
Internet Protocol Version 4, Src: 74.80.130.236, Dst: 10.210.66.82
Transmission Control Protocol, Src Port: 80 (80), Dst Port: 64147 (64147), Seq: 1, Ack: 120, Len: 207
Hypertext Transfer Protocol
    HTTP/1.1 450 unknown\r\n
    Content-Type: application/json\r\n
    Date: Sat, 19 May 2018 09:06:05 GMT\r\n
    Connection: close\r\n
    Transfer-Encoding: chunked\r\n
    \r\n
    [HTTP response 1/1]
    [Time since request: 1.177743000 seconds]
    [Request in frame: 1279]
    HTTP chunked response
JavaScript Object Notation: application/json

No.     Time               Source                Destination           Protocol Length Info
   2205 09:06:42.225750    10.210.66.82          74.80.130.236         HTTP     173    GET /?build=2018030801&ip=59.64.129.119&tz=-480 HTTP/1.1 

Frame 2205: 173 bytes on wire (1384 bits), 173 bytes captured (1384 bits) on interface 0
Ethernet II, Src: AsustekC_34:f3:aa (9c:5c:8e:34:f3:aa), Dst: Hangzhou_d2:34:0d (3c:e5:a6:d2:34:0d)
Internet Protocol Version 4, Src: 10.210.66.82, Dst: 74.80.130.236
Transmission Control Protocol, Src Port: 64159 (64159), Dst Port: 80 (80), Seq: 1, Ack: 1, Len: 119
Hypertext Transfer Protocol
    GET /?build=2018030801&ip=59.64.129.119&tz=-480 HTTP/1.1\r\n
    Host: workdistribute.charityengine.com\r\n
    Connection: close\r\n
    \r\n
    [Full request URI: http://workdistribute.charityengine.com/?build=2018030801&ip=59.64.129.119&tz=-480]
    [HTTP request 1/1]
    [Response in frame: 2397]

No.     Time               Source                Destination           Protocol Length Info
   2397 09:06:42.686854    74.80.130.236         10.210.66.82          HTTP     261    HTTP/1.1 450 unknown  (application/json)

Frame 2397: 261 bytes on wire (2088 bits), 261 bytes captured (2088 bits) on interface 0
Ethernet II, Src: Hangzhou_d2:34:0d (3c:e5:a6:d2:34:0d), Dst: AsustekC_34:f3:aa (9c:5c:8e:34:f3:aa)
Internet Protocol Version 4, Src: 74.80.130.236, Dst: 10.210.66.82
Transmission Control Protocol, Src Port: 80 (80), Dst Port: 64159 (64159), Seq: 1, Ack: 120, Len: 207
Hypertext Transfer Protocol
    HTTP/1.1 450 unknown\r\n
    Content-Type: application/json\r\n
    Date: Sat, 19 May 2018 09:06:31 GMT\r\n
    Connection: close\r\n
    Transfer-Encoding: chunked\r\n
    \r\n
    [HTTP response 1/1]
    [Time since request: 0.461104000 seconds]
    [Request in frame: 2205]
    HTTP chunked response
JavaScript Object Notation: application/json

No.     Time               Source                Destination           Protocol Length Info
   3309 09:07:07.900093    10.210.66.82          74.80.130.236         HTTP     173    GET /?build=2018030801&ip=59.64.129.119&tz=-480 HTTP/1.1 

Frame 3309: 173 bytes on wire (1384 bits), 173 bytes captured (1384 bits) on interface 0
Ethernet II, Src: AsustekC_34:f3:aa (9c:5c:8e:34:f3:aa), Dst: Hangzhou_d2:34:0d (3c:e5:a6:d2:34:0d)
Internet Protocol Version 4, Src: 10.210.66.82, Dst: 74.80.130.236
Transmission Control Protocol, Src Port: 64190 (64190), Dst Port: 80 (80), Seq: 1, Ack: 1, Len: 119
Hypertext Transfer Protocol
    GET /?build=2018030801&ip=59.64.129.119&tz=-480 HTTP/1.1\r\n
    Host: workdistribute.charityengine.com\r\n
    Connection: close\r\n
    \r\n
    [Full request URI: http://workdistribute.charityengine.com/?build=2018030801&ip=59.64.129.119&tz=-480]
    [HTTP request 1/1]
    [Response in frame: 3311]

No.     Time               Source                Destination           Protocol Length Info
   3311 09:07:08.206815    74.80.130.236         10.210.66.82          HTTP     261    HTTP/1.1 450 unknown  (application/json)

Frame 3311: 261 bytes on wire (2088 bits), 261 bytes captured (2088 bits) on interface 0
