No.     Time               Source                Destination           Protocol Length Info
     98 08:53:36.215259    10.210.66.82          106.120.178.41        HTTP     683    GET /movie/2015/12/H/6/MB8EJB3QN_MB8OBFPH6.html HTTP/1.1 

Frame 98: 683 bytes on wire (5464 bits), 683 bytes captured (5464 bits) on interface 0
Ethernet II, Src: AsustekC_34:f3:aa (9c:5c:8e:34:f3:aa), Dst: Hangzhou_d2:34:0d (3c:e5:a6:d2:34:0d)
Internet Protocol Version 4, Src: 10.210.66.82, Dst: 106.120.178.41
Transmission Control Protocol, Src Port: 63573 (63573), Dst Port: 80 (80), Seq: 1441, Ack: 1, Len: 629
[2 Reassembled TCP Segments (2069 bytes): #97(1440), #98(629)]
Hypertext Transfer Protocol
    GET /movie/2015/12/H/6/MB8EJB3QN_MB8OBFPH6.html HTTP/1.1\r\n
    Host: open.163.com\r\n
    Connection: keep-alive\r\n
    Upgrade-Insecure-Requests: 1\r\n
    User-Agent: Mozilla/5.0 (Windows NT 10.0; Win64; x64) AppleWebKit/537.36 (KHTML, like Gecko) Chrome/66.0.3359.139 Safari/537.36\r\n
    Accept: text/html,application/xhtml+xml,application/xml;q=0.9,image/webp,image/apng,*/*;q=0.8\r\n
    Referer: http://open.163.com/special/openclass/womenhaha.html\r\n
    Accept-Encoding: gzip, deflate\r\n
    Accept-Language: en-US,en;q=0.9,zh-TW;q=0.8,zh;q=0.7\r\n
     [truncated]Cookie: _ntes_nnid=1f983bbb19f587d903825b029b84bd36,1516798611503; _ntes_nuid=1f983bbb19f587d903825b029b84bd36; starttime=; nts_mail_user=18801120356@163.com:-1:1; df=mail163_letter; _ngd_tid=gZ5L1GNfSjPRjDUxM65L36DYXg7hVnlC; m
    \r\n
    [Full request URI: http://open.163.com/movie/2015/12/H/6/MB8EJB3QN_MB8OBFPH6.html]
    [HTTP request 1/2]
    [Response in frame: 100]
    [Next request in frame: 691]

No.     Time               Source                Destination           Protocol Length Info
    100 08:53:36.356582    106.120.178.41        10.210.66.82          HTTP     443    HTTP/1.1 200 OK 

Frame 100: 443 bytes on wire (3544 bits), 443 bytes captured (3544 bits) on interface 0
Ethernet II, Src: Hangzhou_d2:34:0d (3c:e5:a6:d2:34:0d), Dst: AsustekC_34:f3:aa (9c:5c:8e:34:f3:aa)
Internet Protocol Version 4, Src: 106.120.178.41, Dst: 10.210.66.82
Transmission Control Protocol, Src Port: 80 (80), Dst Port: 63573 (63573), Seq: 1, Ack: 2070, Len: 389
Hypertext Transfer Protocol
    HTTP/1.1 200 OK\r\n
    Date: Sat, 19 May 2018 08:53:25 GMT\r\n
    Expires: Sat, 19 May 2018 08:57:25 GMT\r\n
    Server: nginx\r\n
    Content-Type: text/html; charset=GBK\r\n
    Transfer-Encoding: chunked\r\n
    Cache-Control: max-age=240\r\n
    P3P: CP=CAO PSA OUR\r\n
    Content-Encoding: gzip\r\n
    X-Via: 1.1 PSgdczdx4kz58:0 (Cdn Cache Server V2.0), 1.1 PSbjbgddxme154:8 (Cdn Cache Server V2.0)\r\n
    Connection: keep-alive\r\n
    X-Dscp-Value: 0\r\n
    \r\n
    [HTTP response 1/2]
    [Time since request: 0.141323000 seconds]
    [Request in frame: 98]
    [Next request in frame: 691]
    [Next response in frame: 792]

No.     Time               Source                Destination           Protocol Length Info
    206 08:53:36.408348    10.210.66.82          123.58.180.7          HTTP     598    GET /ocb/css/page/play.css?_ver=20160405093600 HTTP/1.1 

Frame 206: 598 bytes on wire (4784 bits), 598 bytes captured (4784 bits) on interface 0
Ethernet II, Src: AsustekC_34:f3:aa (9c:5c:8e:34:f3:aa), Dst: Hangzhou_d2:34:0d (3c:e5:a6:d2:34:0d)
Internet Protocol Version 4, Src: 10.210.66.82, Dst: 123.58.180.7
Transmission Control Protocol, Src Port: 63742 (63742), Dst Port: 80 (80), Seq: 1441, Ack: 1, Len: 544
[2 Reassembled TCP Segments (1984 bytes): #205(1440), #206(544)]
Hypertext Transfer Protocol
    GET /ocb/css/page/play.css?_ver=20160405093600 HTTP/1.1\r\n
    Host: s2.open.163.com\r\n
    Connection: keep-alive\r\n
    User-Agent: Mozilla/5.0 (Windows NT 10.0; Win64; x64) AppleWebKit/537.36 (KHTML, like Gecko) Chrome/66.0.3359.139 Safari/537.36\r\n
    Accept: text/css,*/*;q=0.1\r\n
    Referer: http://open.163.com/movie/2015/12/H/6/MB8EJB3QN_MB8OBFPH6.html\r\n
    Accept-Encoding: gzip, deflate\r\n
    Accept-Language: en-US,en;q=0.9,zh-TW;q=0.8,zh;q=0.7\r\n
     [truncated]Cookie: _ntes_nnid=1f983bbb19f587d903825b029b84bd36,1516798611503; _ntes_nuid=1f983bbb19f587d903825b029b84bd36; starttime=; nts_mail_user=18801120356@163.com:-1:1; df=mail163_letter; _ngd_tid=gZ5L1GNfSjPRjDUxM65L36DYXg7hVnlC; m
    \r\n
    [Full request URI: http://s2.open.163.com/ocb/css/page/play.css?_ver=20160405093600]
    [HTTP request 1/2]
    [Response in frame: 221]
    [Next request in frame: 235]

No.     Time               Source                Destination           Protocol Length Info
    221 08:53:36.439106    123.58.180.7          10.210.66.82          HTTP     918    HTTP/1.1 200 OK  (text/css)

Frame 221: 918 bytes on wire (7344 bits), 918 bytes captured (7344 bits) on interface 0
Ethernet II, Src: Hangzhou_d2:34:0d (3c:e5:a6:d2:34:0d), Dst: AsustekC_34:f3:aa (9c:5c:8e:34:f3:aa)
Internet Protocol Version 4, Src: 123.58.180.7, Dst: 10.210.66.82
Transmission Control Protocol, Src Port: 80 (80), Dst Port: 63742 (63742), Seq: 1, Ack: 1985, Len: 864
Hypertext Transfer Protocol
    HTTP/1.1 200 OK\r\n
    Server: nginx\r\n
    Date: Sat, 19 May 2018 08:53:25 GMT\r\n
    Content-Type: text/css\r\n
    Transfer-Encoding: chunked\r\n
    Connection: keep-alive\r\n
    Vary: Accept-Encoding\r\n
    Last-Modified: Thu, 26 Apr 2018 03:24:30 GMT\r\n
    Vary: Accept-Encoding\r\n
    Expires: Sat, 26 May 2018 08:53:25 GMT\r\n
    Cache-Control: max-age=604800\r\n
    Content-Encoding: gzip\r\n
    \r\n
    [HTTP response 1/2]
    [Time since request: 0.030758000 seconds]
    [Request in frame: 206]
    [Next request in frame: 235]
    [Next response in frame: 311]
    HTTP chunked response
    Content-encoded entity body (gzip): 523 bytes -> 1122 bytes
Line-based text data: text/css

No.     Time               Source                Destination           Protocol Length Info
    235 08:53:36.457332    10.210.66.82          123.58.180.7          HTTP     584    GET /ocb/js/opencourse.min.js?_ver=201710261122 HTTP/1.1 

Frame 235: 584 bytes on wire (4672 bits), 584 bytes captured (4672 bits) on interface 0
Ethernet II, Src: AsustekC_34:f3:aa (9c:5c:8e:34:f3:aa), Dst: Hangzhou_d2:34:0d (3c:e5:a6:d2:34:0d)
Internet Protocol Version 4, Src: 10.210.66.82, Dst: 123.58.180.7
Transmission Control Protocol, Src Port: 63742 (63742), Dst Port: 80 (80), Seq: 3425, Ack: 8052, Len: 530
[2 Reassembled TCP Segments (1970 bytes): #234(1440), #235(530)]
Hypertext Transfer Protocol
    GET /ocb/js/opencourse.min.js?_ver=201710261122 HTTP/1.1\r\n
    Host: s2.open.163.com\r\n
    Connection: keep-alive\r\n
    User-Agent: Mozilla/5.0 (Windows NT 10.0; Win64; x64) AppleWebKit/537.36 (KHTML, like Gecko) Chrome/66.0.3359.139 Safari/537.36\r\n
    Accept: */*\r\n
    Referer: http://open.163.com/movie/2015/12/H/6/MB8EJB3QN_MB8OBFPH6.html\r\n
    Accept-Encoding: gzip, deflate\r\n
    Accept-Language: en-US,en;q=0.9,zh-TW;q=0.8,zh;q=0.7\r\n
     [truncated]Cookie: _ntes_nnid=1f983bbb19f587d903825b029b84bd36,1516798611503; _ntes_nuid=1f983bbb19f587d903825b029b84bd36; starttime=; nts_mail_user=18801120356@163.com:-1:1; df=mail163_letter; _ngd_tid=gZ5L1GNfSjPRjDUxM65L36DYXg7hVnlC; m
    \r\n
    [Full request URI: http://s2.open.163.com/ocb/js/opencourse.min.js?_ver=201710261122]
    [HTTP request 2/2]
    [Prev request in frame: 206]
    [Response in frame: 311]

No.     Time               Source                Destination           Protocol Length Info
    304 08:53:36.483043    10.210.66.82          123.58.180.7          HTTP     589    GET /ocb/js/opencourse.play.min.js?_ver=201710261122 HTTP/1.1 

Frame 304: 589 bytes on wire (4712 bits), 589 bytes captured (4712 bits) on interface 0
Ethernet II, Src: AsustekC_34:f3:aa (9c:5c:8e:34:f3:aa), Dst: Hangzhou_d2:34:0d (3c:e5:a6:d2:34:0d)
Internet Protocol Version 4, Src: 10.210.66.82, Dst: 123.58.180.7
Transmission Control Protocol, Src Port: 63744 (63744), Dst Port: 80 (80), Seq: 1441, Ack: 1, Len: 535
[2 Reassembled TCP Segments (1975 bytes): #303(1440), #304(535)]
Hypertext Transfer Protocol
    GET /ocb/js/opencourse.play.min.js?_ver=201710261122 HTTP/1.1\r\n
    Host: s2.open.163.com\r\n
    Connection: keep-alive\r\n
    User-Agent: Mozilla/5.0 (Windows NT 10.0; Win64; x64) AppleWebKit/537.36 (KHTML, like Gecko) Chrome/66.0.3359.139 Safari/537.36\r\n
    Accept: */*\r\n
    Referer: http://open.163.com/movie/2015/12/H/6/MB8EJB3QN_MB8OBFPH6.html\r\n
    Accept-Encoding: gzip, deflate\r\n
    Accept-Language: en-US,en;q=0.9,zh-TW;q=0.8,zh;q=0.7\r\n
     [truncated]Cookie: _ntes_nnid=1f983bbb19f587d903825b029b84bd36,1516798611503; _ntes_nuid=1f983bbb19f587d903825b029b84bd36; starttime=; nts_mail_user=18801120356@163.com:-1:1; df=mail163_letter; _ngd_tid=gZ5L1GNfSjPRjDUxM65L36DYXg7hVnlC; m
    \r\n
    [Full request URI: http://s2.open.163.com/ocb/js/opencourse.play.min.js?_ver=201710261122]
    [HTTP request 1/1]
    [Response in frame: 334]

No.     Time               Source                Destination           Protocol Length Info
    311 08:53:36.487938    123.58.180.7          10.210.66.82          HTTP     1005   HTTP/1.1 200 OK  (application/javascript)

Frame 311: 1005 bytes on wire (8040 bits), 1005 bytes captured (8040 bits) on interface 0
Ethernet II, Src: Hangzhou_d2:34:0d (3c:e5:a6:d2:34:0d), Dst: AsustekC_34:f3:aa (9c:5c:8e:34:f3:aa)
Internet Protocol Version 4, Src: 123.58.180.7, Dst: 10.210.66.82
Transmission Control Protocol, Src Port: 80 (80), Dst Port: 63742 (63742), Seq: 8052, Ack: 3955, Len: 951
Hypertext Transfer Protocol
    HTTP/1.1 200 OK\r\n
    Server: nginx\r\n
    Date: Sat, 19 May 2018 08:53:25 GMT\r\n
    Content-Type: application/javascript\r\n
    Transfer-Encoding: chunked\r\n
    Connection: keep-alive\r\n
    Vary: Accept-Encoding\r\n
    Last-Modified: Wed, 02 May 2018 09:35:01 GMT\r\n
    Expires: Sat, 26 May 2018 08:53:25 GMT\r\n
    Cache-Control: max-age=604800\r\n
    Content-Encoding: gzip\r\n
    \r\n
    [HTTP response 2/2]
    [Time since request: 0.030606000 seconds]
    [Prev request in frame: 206]
    [Prev response in frame: 221]
    [Request in frame: 235]
    HTTP chunked response
    Content-encoded entity body (gzip): 619 bytes -> 1129 bytes
Media Type

No.     Time               Source                Destination           Protocol Length Info
    325 08:53:36.491526    10.210.66.82          123.58.180.7          HTTP     600    GET /ocb/res/img/liantu.png HTTP/1.1 

Frame 325: 600 bytes on wire (4800 bits), 600 bytes captured (4800 bits) on interface 0
Ethernet II, Src: AsustekC_34:f3:aa (9c:5c:8e:34:f3:aa), Dst: Hangzhou_d2:34:0d (3c:e5:a6:d2:34:0d)
Internet Protocol Version 4, Src: 10.210.66.82, Dst: 123.58.180.7
Transmission Control Protocol, Src Port: 63746 (63746), Dst Port: 80 (80), Seq: 1441, Ack: 1, Len: 546
[2 Reassembled TCP Segments (1986 bytes): #324(1440), #325(546)]
Hypertext Transfer Protocol
    GET /ocb/res/img/liantu.png HTTP/1.1\r\n
    Host: s2.open.163.com\r\n
    Connection: keep-alive\r\n
    User-Agent: Mozilla/5.0 (Windows NT 10.0; Win64; x64) AppleWebKit/537.36 (KHTML, like Gecko) Chrome/66.0.3359.139 Safari/537.36\r\n
    Accept: image/webp,image/apng,image/*,*/*;q=0.8\r\n
    Referer: http://open.163.com/movie/2015/12/H/6/MB8EJB3QN_MB8OBFPH6.html\r\n
    Accept-Encoding: gzip, deflate\r\n
    Accept-Language: en-US,en;q=0.9,zh-TW;q=0.8,zh;q=0.7\r\n
     [truncated]Cookie: _ntes_nnid=1f983bbb19f587d903825b029b84bd36,1516798611503; _ntes_nuid=1f983bbb19f587d903825b029b84bd36; starttime=; nts_mail_user=18801120356@163.com:-1:1; df=mail163_letter; _ngd_tid=gZ5L1GNfSjPRjDUxM65L36DYXg7hVnlC; m
    \r\n
    [Full request URI: http://s2.open.163.com/ocb/res/img/liantu.png]
    [HTTP request 1/1]
    [Response in frame: 358]

No.     Time               Source                Destination           Protocol Length Info
    334 08:53:36.509197    123.58.180.7          10.210.66.82          HTTP     965    HTTP/1.1 200 OK  (application/javascript)

Frame 334: 965 bytes on wire (7720 bits), 965 bytes captured (7720 bits) on interface 0
Ethernet II, Src: Hangzhou_d2:34:0d (3c:e5:a6:d2:34:0d), Dst: AsustekC_34:f3:aa (9c:5c:8e:34:f3:aa)
Internet Protocol Version 4, Src: 123.58.180.7, Dst: 10.210.66.82
Transmission Control Protocol, Src Port: 80 (80), Dst Port: 63744 (63744), Seq: 1, Ack: 1976, Len: 911
Hypertext Transfer Protocol
    HTTP/1.1 200 OK\r\n
    Server: nginx\r\n
    Date: Sat, 19 May 2018 08:53:25 GMT\r\n
    Content-Type: application/javascript\r\n
    Transfer-Encoding: chunked\r\n
    Connection: keep-alive\r\n
    Vary: Accept-Encoding\r\n
    Last-Modified: Thu, 14 Sep 2017 02:19:57 GMT\r\n
    Expires: Sat, 26 May 2018 08:53:25 GMT\r\n
    Cache-Control: max-age=604800\r\n
    Content-Encoding: gzip\r\n
    \r\n
    [HTTP response 1/1]
    [Time since request: 0.026154000 seconds]
    [Request in frame: 304]
    HTTP chunked response
    Content-encoded entity body (gzip): 579 bytes -> 1131 bytes
Media Type

No.     Time               Source                Destination           Protocol Length Info
    344 08:53:36.511053    123.58.180.7          10.210.66.82          HTTP     1494   Continuation

Frame 344: 1494 bytes on wire (11952 bits), 1494 bytes captured (11952 bits) on interface 0
Ethernet II, Src: Hangzhou_d2:34:0d (3c:e5:a6:d2:34:0d), Dst: AsustekC_34:f3:aa (9c:5c:8e:34:f3:aa)
Internet Protocol Version 4, Src: 123.58.180.7, Dst: 10.210.66.82
Transmission Control Protocol, Src Port: 80 (80), Dst Port: 63744 (63744), Seq: 6498, Ack: 1976, Len: 1440
Hypertext Transfer Protocol
     [truncated]:y\274+\367\361\027\325\347xs\037n>}\357\375\355\377\1|\376\377Q\237\303v\316\016\314A\225\333\2072\240\344\221\330*\f`\325\003#3\2404\\265\302\270\306~T\273\216\243\357\030@\362\021-\273\r!\245\342\344\004P9O\267;\255\352\221\
    Data (1187 bytes)

0000  4b fc 7c b7 4e ca 55 fc bc f2 80 87 3f 72 42 03   K.|.N.U.....?rB.
0010  31 ef 17 d7 4d 6a f0 0a 31 76 f5 32 04 bc 38 d7   1...Mj..1v.2..8.
0020  9e 57 0a 1f 1d 4e 27 25 ef 46 87 82 54 34 d8 4a   .W...N'%.F..T4.J
0030  c2 06 a3 43 34 ec 25 d9 cc c7 ea b5 9a 4f ec 4a   ...C4.%......O.J
0040  34 8e 84 be 8d d8 42 79 75 e8 d1 c0 2a 62 fe 09   4.....Byu...*b..
0050  78 36 70 4f 03 77 15 fe 66 2f 09 f3 22 10 c8 5c   x6pO.w..f/.."..\
0060  29 38 b1 94 ff 5d 9e e5 72 d5 c8 57 2d 5d c6 91   )8...]..r..W-]..
0070  65 2c 7d 44 9e d6 ba 53 79 db ab f3 ac 41 d5 35   e,}D...Sy....A.5
0080  c5 40 00 9f ac c0 35 44 74 76 23 7c 79 9b c9 52   .@....5Dtv#|y..R
0090  12 0e 2c 57 1c a6 91 1e 57 59 35 78 71 ae e9 a7   ..,W....WY5xq...
00a0  4e 46 44 95 9a 6e d4 33 0b 45 f8 4f 16 0a af 9a   NFD..n.3.E.O....
00b0  87 f5 56 11 6f 34 09 f2 58 d9 84 5d 82 fb 0d 19   ..V.o4..X..]....
00c0  67 91 54 b1 7d d4 4f c6 4c fb 30 22 d4 57 d0 6d   g.T.}.O.L.0".W.m
00d0  cd 80 11 c2 05 71 8d 1b 80 2d e8 d7 b7 de 8a 78   .....q...-.....x
00e0  19 d3 a7 3c 84 f5 01 59 4a d7 05 ad 0a 27 6d b8   ...<...YJ....'m.
00f0  99 6d b2 10 51 4f b7 cc ed f3 da f4 02 e2 82 79   .m..QO.........y
0100  d9 b0 b9 99 65 fb ac 6d 3a e2 12 c5 2d 0e e6 e9   ....e..m:...-...
0110  26 01 4a 5f b0 bd 75 37 ca 1c e8 1e b5 cb 2e 60   &.J_..u7.......`
0120  1a 13 92 e9 c5 58 02 93 76 e5 cb 32 92 2c ca 47   .....X..v..2.,.G
0130  80 15 ab 02 0d 96 1b 4c 0f 1e b1 fa dd 74 e0 29   .......L.....t.)
0140  ec db a8 38 f0 d9 38 45 26 89 ba 80 33 32 9b 50   ...8..8E&...32.P
0150  db 2d 59 0b 4a 98 63 57 1d 4e 60 b1 15 35 18 46   .-Y.J.cW.N`..5.F
0160  86 87 86 5e 1e 1a 79 f5 65 2b 49 df 26 c3 86 d9   ...^..y.e+I.&...
0170  5a d2 f8 13 9c ac 05 e2 4e be 9b 85 86 5a cd f6   Z.......N....Z..
0180  31 d0 8a 6b 8f ac 39 10 b2 00 16 e0 2f 24 7b 88   1..k..9...../${.
0190  af ac 40 14 a2 18 3a f5 da 42 ea 95 bd 8a 41 c8   ..@...:..B....A.
01a0  7e ab c7 d6 67 ec 45 7a 77 90 47 8c 74 63 2b 01   ~...g.Ezw.G.tc+.
01b0  b9 77 ee 5c c0 95 78 5f 61 c5 47 d9 0f 22 53 c1   .w.\..x_a.G.."S.
01c0  dd 62 e6 b5 ba 5b a5 50 ee 8c 02 42 9d 5a 4b a9   .b...[.P...B.ZK.
01d0  b8 b4 45 4f 21 bc 7a 0b e1 73 26 36 85 cf 43 e5   ..EO!.z..s&6..C.
01e0  ad 86 e4 fc 02 fd 49 f4 1d 55 85 54 95 0f 25 35   ......I..U.T..%5
01f0  38 ea 21 4c 3e ea a5 52 48 af d4 c8 50 71 3c d5   8.!L>..RH...Pq<.
0200  66 bd 39 25 18 0b 62 2f 81 3f f1 32 93 fc e8 67   f.9%..b/.?.2...g
0210  14 38 87 a2 a5 9c 79 67 d2 1f e0 01 70 5f 06 7e   .8....yg....p_.~
0220  87 09 86 4d e8 72 13 57 49 5f 21 59 02 54 47 c3   ...M.r.WI_!Y.TG.
0230  67 56 2b 36 fc cf 26 e8 1f f1 65 8b ea 69 dc a1   gV+6..&...e..i..
0240  e4 13 69 48 db 60 a4 88 f3 2e 18 cf cc 22 c6 87   ..iH.`......."..
0250  6e d5 91 77 79 1f 3d a2 e9 76 2c b4 02 3a 74 c6   n..wy.=..v,..:t.
0260  64 a8 52 a1 df fb 8c 51 28 4d 47 f3 80 92 18 6d   d.R....Q(MG....m
0270  0e 51 42 b0 86 0d 52 80 40 34 82 27 65 7f 02 5a   .QB...R.@4.'e..Z
0280  9b 69 2b 54 f1 2c 0c 26 c2 cd 98 75 a8 66 00 2d   .i+T.,.&...u.f.-
0290  4e 01 49 e7 45 00 a6 38 04 99 5c 6d 2f 59 1e 67   N.I.E..8..\m/Y.g
02a0  03 48 f8 a0 b0 03 bc 83 86 4b 48 b4 c6 ef 9c e0   .H.......KH.....
02b0  67 e2 6b 31 f6 12 4a cc 8e 8f e9 cd 8d 7b 6d 25   g.k1..J......{m%
02c0  eb c1 08 4c 26 0e c3 08 91 52 04 e1 0d a0 18 05   ...L&....R......
02d0  3c 43 ea 12 84 ad cc 4f 55 2e f3 14 70 1d 9e 7d   <C.....OU...p..}
02e0  d6 5d b4 6b be 58 4a bc 6b 01 0c 24 61 9c f6 c1   .].k.XJ.k..$a...
02f0  85 3b 39 05 6c 1a 22 0e ed 0d ba de 88 07 9d 54   .;9.l."........T
0300  28 5c d1 3b b7 1b 53 fb 86 dc 9c 90 cc 11 7a ab   (\.;..S.......z.
0310  81 28 45 96 11 73 80 fb 00 50 0c 90 0f b8 91 f8   .(E..s...P......
0320  00 bc 41 2d 05 f6 9b d9 d0 c0 8d e9 80 14 98 d4   ..A-............
0330  80 65 04 60 35 1e 66 d8 e1 14 a2 4a 91 b9 b8 51   .e.`5.f....J...Q
0340  c4 5a e2 37 54 23 20 00 cc 9e 44 87 0f e8 00 e9   .Z.7T# ...D.....
0350  d1 0c 1a c6 ab 88 50 d0 01 f4 19 97 72 88 4b b2   ......P.....r.K.
0360  d6 06 a3 40 36 b6 10 3c 17 64 2b b1 30 28 03 66   ...@6..<.d+.0(.f
0370  8f 0c 04 36 b8 e2 70 1f 0a 02 35 88 78 a9 88 42   ...6..p...5.x..B
0380  a7 53 4f 24 55 50 2c 8c 59 a2 06 85 c4 41 e3 8b   .SO$UP,.Y....A..
0390  15 9c 69 70 55 ce 08 57 80 f8 00 f8 14 fa 89 58   ..ipU..W.......X
03a0  dd 2a a9 1e f1 9b 43 17 52 81 4a 01 c4 3b 73 d0   .*....C.R.J..;s.
03b0  e7 dd ea 6b 7e de 05 90 10 c1 30 de 04 15 89 0f   ...k~.....0.....
03c0  12 ff 21 16 99 ca 0f 61 a7 38 e2 58 6e 00 62 5a   ..!....a.8.Xn.bZ
03d0  41 ca 23 79 8b f5 14 18 f5 71 7f d5 2b f9 76 51   A.#y.....q..+.vQ
03e0  65 3b a7 56 ec 6a 3c 31 14 d9 ca 46 9f 04 fa 1b   e;.V.j<1...F....
03f0  e7 13 c9 9e 08 76 10 87 21 05 6a 10 90 0a a9 da   .....v..!.j.....
0400  c5 f9 32 ae d5 76 46 48 ea 91 90 31 55 a9 e7 e0   ..2..vFH...1U...
0410  55 20 62 b6 37 9a 20 29 e9 ab 3a 21 35 48 32 95   U b.7. )..:!5H2.
0420  b4 6b 60 df cb 76 cf 72 4a e5 60 23 e5 10 89 a3   .k`..v.rJ.`#....
0430  3a 39 b5 2d bf 15 62 30 f2 28 96 fb 5a 76 0b 26   :9.-..b0.(..Zv.&
0440  51 52 f2 62 7f 35 b6 34 34 de fc fe ca ee ed 8b   QR.b.5.44.......
0450  cd 8b df 22 4b 75 77 eb c7 a3 e5 f2 58 06 cd a6   ..."Kuw.....X...
0460  c3 f0 78 f3 ee 25 b8 99 e0 f4 42 b7 dd c7 9f 6e   ..x..%....B....n
0470  3f fa 9c 0e e1 ab b7 77 bf f8 00 be aa a7 7f be   ?......w........
0480  ba f3 f1 0f f8 b7 b9 79 97 de e5 df dd 6b 6d 7e   .......y.....km~
0490  d0 bc fb 77 fc 3b 96 af 64 c6 5b 1f dd dd b9 b1   ...w.;..d.[.....
04a0  b5 f3 fb                                          ...

No.     Time               Source                Destination           Protocol Length Info
    358 08:53:36.516484    123.58.180.7          10.210.66.82          HTTP     1480   HTTP/1.1 200 OK  (PNG)[Malformed Packet]

Frame 358: 1480 bytes on wire (11840 bits), 1480 bytes captured (11840 bits) on interface 0
Ethernet II, Src: Hangzhou_d2:34:0d (3c:e5:a6:d2:34:0d), Dst: AsustekC_34:f3:aa (9c:5c:8e:34:f3:aa)
Internet Protocol Version 4, Src: 123.58.180.7, Dst: 10.210.66.82
Transmission Control Protocol, Src Port: 80 (80), Dst Port: 63746 (63746), Seq: 1, Ack: 1987, Len: 1426
Hypertext Transfer Protocol
    HTTP/1.1 200 OK\r\n
    Server: nginx\r\n
    Date: Sat, 19 May 2018 08:53:25 GMT\r\n
    Content-Type: image/png\r\n
    Content-Length: 26520\r\n
    Connection: keep-alive\r\n
    Last-Modified: Mon, 14 Nov 2016 08:22:57 GMT\r\n
    Expires: Sat, 26 May 2018 08:53:25 GMT\r\n
    Cache-Control: max-age=604800\r\n
    Access-Control-Allow-Origin: *\r\n
    Accept-Ranges: bytes\r\n
    \r\n
    [HTTP response 1/1]
    [Time since request: 0.024958000 seconds]
    [Request in frame: 325]
Portable Network Graphics
[Malformed Packet: PNG]

No.     Time               Source                Destination           Protocol Length Info
    359 08:53:36.517322    123.58.180.7          10.210.66.82          HTTP     1494   Continuation

Frame 359: 1494 bytes on wire (11952 bits), 1494 bytes captured (11952 bits) on interface 0
Ethernet II, Src: Hangzhou_d2:34:0d (3c:e5:a6:d2:34:0d), Dst: AsustekC_34:f3:aa (9c:5c:8e:34:f3:aa)
Internet Protocol Version 4, Src: 123.58.180.7, Dst: 10.210.66.82
Transmission Control Protocol, Src Port: 80 (80), Dst Port: 63746 (63746), Seq: 1427, Ack: 1987, Len: 1440
Hypertext Transfer Protocol
    hop:ColorMode>3</photoshop:ColorMode>\n
    Data (1402 bytes)

0000  20 20 20 20 20 20 20 20 20 3c 78 6d 70 4d 4d 3a            <xmpMM:
0010  49 6e 73 74 61 6e 63 65 49 44 3e 78 6d 70 2e 69   InstanceID>xmp.i
0020  69 64 3a 30 38 64 65 34 30 62 31 2d 34 37 33 63   id:08de40b1-473c
0030  2d 34 37 61 65 2d 62 64 32 31 2d 32 64 65 37 35   -47ae-bd21-2de75
0040  32 65 32 62 32 64 34 3c 2f 78 6d 70 4d 4d 3a 49   2e2b2d4</xmpMM:I
0050  6e 73 74 61 6e 63 65 49 44 3e 0a 20 20 20 20 20   nstanceID>.     
0060  20 20 20 20 3c 78 6d 70 4d 4d 3a 44 6f 63 75 6d       <xmpMM:Docum
0070  65 6e 74 49 44 3e 78 6d 70 2e 64 69 64 3a 30 38   entID>xmp.did:08
0080  64 65 34 30 62 31 2d 34 37 33 63 2d 34 37 61 65   de40b1-473c-47ae
0090  2d 62 64 32 31 2d 32 64 65 37 35 32 65 32 62 32   -bd21-2de752e2b2
00a0  64 34 3c 2f 78 6d 70 4d 4d 3a 44 6f 63 75 6d 65   d4</xmpMM:Docume
00b0  6e 74 49 44 3e 0a 20 20 20 20 20 20 20 20 20 3c   ntID>.         <
00c0  78 6d 70 4d 4d 3a 4f 72 69 67 69 6e 61 6c 44 6f   xmpMM:OriginalDo
00d0  63 75 6d 65 6e 74 49 44 3e 78 6d 70 2e 64 69 64   cumentID>xmp.did
00e0  3a 30 38 64 65 34 30 62 31 2d 34 37 33 63 2d 34   :08de40b1-473c-4
00f0  37 61 65 2d 62 64 32 31 2d 32 64 65 37 35 32 65   7ae-bd21-2de752e
0100  32 62 32 64 34 3c 2f 78 6d 70 4d 4d 3a 4f 72 69   2b2d4</xmpMM:Ori
0110  67 69 6e 61 6c 44 6f 63 75 6d 65 6e 74 49 44 3e   ginalDocumentID>
0120  0a 20 20 20 20 20 20 20 20 20 3c 78 6d 70 4d 4d   .         <xmpMM
0130  3a 48 69 73 74 6f 72 79 3e 0a 20 20 20 20 20 20   :History>.      
0140  20 20 20 20 20 20 3c 72 64 66 3a 53 65 71 3e 0a         <rdf:Seq>.
0150  20 20 20 20 20 20 20 20 20 20 20 20 20 20 20 3c                  <
0160  72 64 66 3a 6c 69 20 72 64 66 3a 70 61 72 73 65   rdf:li rdf:parse
0170  54 79 70 65 3d 22 52 65 73 6f 75 72 63 65 22 3e   Type="Resource">
0180  0a 20 20 20 20 20 20 20 20 20 20 20 20 20 20 20   .               
0190  20 20 20 3c 73 74 45 76 74 3a 61 63 74 69 6f 6e      <stEvt:action
01a0  3e 63 72 65 61 74 65 64 3c 2f 73 74 45 76 74 3a   >created</stEvt:
01b0  61 63 74 69 6f 6e 3e 0a 20 20 20 20 20 20 20 20   action>.        
01c0  20 20 20 20 20 20 20 20 20 20 3c 73 74 45 76 74             <stEvt
01d0  3a 69 6e 73 74 61 6e 63 65 49 44 3e 78 6d 70 2e   :instanceID>xmp.
01e0  69 69 64 3a 30 38 64 65 34 30 62 31 2d 34 37 33   iid:08de40b1-473
01f0  63 2d 34 37 61 65 2d 62 64 32 31 2d 32 64 65 37   c-47ae-bd21-2de7
0200  35 32 65 32 62 32 64 34 3c 2f 73 74 45 76 74 3a   52e2b2d4</stEvt:
0210  69 6e 73 74 61 6e 63 65 49 44 3e 0a 20 20 20 20   instanceID>.    
0220  20 20 20 20 20 20 20 20 20 20 20 20 20 20 3c 73                 <s
0230  74 45 76 74 3a 77 68 65 6e 3e 32 30 31 33 2d 31   tEvt:when>2013-1
0240  30 2d 33 30 54 31 39 3a 35 37 3a 30 33 2b 30 38   0-30T19:57:03+08
0250  3a 30 30 3c 2f 73 74 45 76 74 3a 77 68 65 6e 3e   :00</stEvt:when>
0260  0a 20 20 20 20 20 20 20 20 20 20 20 20 20 20 20   .               
0270  20 20 20 3c 73 74 45 76 74 3a 73 6f 66 74 77 61      <stEvt:softwa
0280  72 65 41 67 65 6e 74 3e 41 64 6f 62 65 20 50 68   reAgent>Adobe Ph
0290  6f 74 6f 73 68 6f 70 20 43 43 20 28 4d 61 63 69   otoshop CC (Maci
02a0  6e 74 6f 73 68 29 3c 2f 73 74 45 76 74 3a 73 6f   ntosh)</stEvt:so
02b0  66 74 77 61 72 65 41 67 65 6e 74 3e 0a 20 20 20   ftwareAgent>.   
02c0  20 20 20 20 20 20 20 20 20 20 20 20 3c 2f 72 64               </rd
02d0  66 3a 6c 69 3e 0a 20 20 20 20 20 20 20 20 20 20   f:li>.          
02e0  20 20 3c 2f 72 64 66 3a 53 65 71 3e 0a 20 20 20     </rdf:Seq>.   
02f0  20 20 20 20 20 20 3c 2f 78 6d 70 4d 4d 3a 48 69         </xmpMM:Hi
0300  73 74 6f 72 79 3e 0a 20 20 20 20 20 20 20 20 20   story>.         
0310  3c 74 69 66 66 3a 4f 72 69 65 6e 74 61 74 69 6f   <tiff:Orientatio
0320  6e 3e 31 3c 2f 74 69 66 66 3a 4f 72 69 65 6e 74   n>1</tiff:Orient
0330  61 74 69 6f 6e 3e 0a 20 20 20 20 20 20 20 20 20   ation>.         
0340  3c 74 69 66 66 3a 58 52 65 73 6f 6c 75 74 69 6f   <tiff:XResolutio
0350  6e 3e 37 32 30 30 30 30 2f 31 30 30 30 30 3c 2f   n>720000/10000</
0360  74 69 66 66 3a 58 52 65 73 6f 6c 75 74 69 6f 6e   tiff:XResolution
0370  3e 0a 20 20 20 20 20 20 20 20 20 3c 74 69 66 66   >.         <tiff
0380  3a 59 52 65 73 6f 6c 75 74 69 6f 6e 3e 37 32 30   :YResolution>720
0390  30 30 30 2f 31 30 30 30 30 3c 2f 74 69 66 66 3a   000/10000</tiff:
03a0  59 52 65 73 6f 6c 75 74 69 6f 6e 3e 0a 20 20 20   YResolution>.   
03b0  20 20 20 20 20 20 3c 74 69 66 66 3a 52 65 73 6f         <tiff:Reso
03c0  6c 75 74 69 6f 6e 55 6e 69 74 3e 32 3c 2f 74 69   lutionUnit>2</ti
03d0  66 66 3a 52 65 73 6f 6c 75 74 69 6f 6e 55 6e 69   ff:ResolutionUni
03e0  74 3e 0a 20 20 20 20 20 20 20 20 20 3c 65 78 69   t>.         <exi
03f0  66 3a 43 6f 6c 6f 72 53 70 61 63 65 3e 36 35 35   f:ColorSpace>655
0400  33 35 3c 2f 65 78 69 66 3a 43 6f 6c 6f 72 53 70   35</exif:ColorSp
0410  61 63 65 3e 0a 20 20 20 20 20 20 20 20 20 3c 65   ace>.         <e
0420  78 69 66 3a 50 69 78 65 6c 58 44 69 6d 65 6e 73   xif:PixelXDimens
0430  69 6f 6e 3e 38 35 3c 2f 65 78 69 66 3a 50 69 78   ion>85</exif:Pix
0440  65 6c 58 44 69 6d 65 6e 73 69 6f 6e 3e 0a 20 20   elXDimension>.  
0450  20 20 20 20 20 20 20 3c 65 78 69 66 3a 50 69 78          <exif:Pix
0460  65 6c 59 44 69 6d 65 6e 73 69 6f 6e 3e 38 35 3c   elYDimension>85<
0470  2f 65 78 69 66 3a 50 69 78 65 6c 59 44 69 6d 65   /exif:PixelYDime
0480  6e 73 69 6f 6e 3e 0a 20 20 20 20 20 20 3c 2f 72   nsion>.      </r
0490  64 66 3a 44 65 73 63 72 69 70 74 69 6f 6e 3e 0a   df:Description>.
04a0  20 20 20 3c 2f 72 64 66 3a 52 44 46 3e 0a 3c 2f      </rdf:RDF>.</
04b0  78 3a 78 6d 70 6d 65 74 61 3e 0a 20 20 20 20 20   x:xmpmeta>.     
04c0  20 20 20 20 20 20 20 20 20 20 20 20 20 20 20 20                   
04d0  20 20 20 20 20 20 20 20 20 20 20 20 20 20 20 20                   
04e0  20 20 20 20 20 20 20 20 20 20 20 20 20 20 20 20                   
04f0  20 20 20 20 20 20 20 20 20 20 20 20 20 20 20 20                   
0500  20 20 20 20 20 20 20 20 20 20 20 20 20 20 20 20                   
0510  20 20 20 20 20 20 20 20 20 20 20 20 20 20 20 0a                  .
0520  20 20 20 20 20 20 20 20 20 20 20 20 20 20 20 20                   
0530  20 20 20 20 20 20 20 20 20 20 20 20 20 20 20 20                   
0540  20 20 20 20 20 20 20 20 20 20 20 20 20 20 20 20                   
0550  20 20 20 20 20 20 20 20 20 20 20 20 20 20 20 20                   
0560  20 20 20 20 20 20 20 20 20 20 20 20 20 20 20 20                   
0570  20 20 20 20 20 20 20 20 20 20                               

No.     Time               Source                Destination           Protocol Length Info
    587 08:53:36.660599    10.210.66.82          124.164.9.14          HTTP     692    GET /api/v1/products/a2869674571f77b5a0867c3d71db5856/threads/B8OBFPH6008535RB?ibc=jssdk&callback=tool1009953701739820433_1526720016643&_=1526720016644 HTTP/1.1 

Frame 587: 692 bytes on wire (5536 bits), 692 bytes captured (5536 bits) on interface 0
Ethernet II, Src: AsustekC_34:f3:aa (9c:5c:8e:34:f3:aa), Dst: Hangzhou_d2:34:0d (3c:e5:a6:d2:34:0d)
Internet Protocol Version 4, Src: 10.210.66.82, Dst: 124.164.9.14
Transmission Control Protocol, Src Port: 63683 (63683), Dst Port: 80 (80), Seq: 1441, Ack: 1, Len: 638
[2 Reassembled TCP Segments (2078 bytes): #586(1440), #587(638)]
Hypertext Transfer Protocol
    GET /api/v1/products/a2869674571f77b5a0867c3d71db5856/threads/B8OBFPH6008535RB?ibc=jssdk&callback=tool1009953701739820433_1526720016643&_=1526720016644 HTTP/1.1\r\n
    Host: sdk.comment.163.com\r\n
    Connection: keep-alive\r\n
    User-Agent: Mozilla/5.0 (Windows NT 10.0; Win64; x64) AppleWebKit/537.36 (KHTML, like Gecko) Chrome/66.0.3359.139 Safari/537.36\r\n
    Accept: */*\r\n
    Referer: http://open.163.com/movie/2015/12/H/6/MB8EJB3QN_MB8OBFPH6.html\r\n
    Accept-Encoding: gzip, deflate\r\n
    Accept-Language: en-US,en;q=0.9,zh-TW;q=0.8,zh;q=0.7\r\n
     [truncated]Cookie: _ntes_nnid=1f983bbb19f587d903825b029b84bd36,1516798611503; _ntes_nuid=1f983bbb19f587d903825b029b84bd36; starttime=; nts_mail_user=18801120356@163.com:-1:1; df=mail163_letter; _ngd_tid=gZ5L1GNfSjPRjDUxM65L36DYXg7hVnlC; m
    \r\n
    [Full request URI: http://sdk.comment.163.com/api/v1/products/a2869674571f77b5a0867c3d71db5856/threads/B8OBFPH6008535RB?ibc=jssdk&callback=tool1009953701739820433_1526720016643&_=1526720016644]
    [HTTP request 1/2]
    [Response in frame: 641]
    [Next request in frame: 698]

No.     Time               Source                Destination           Protocol Length Info
    634 08:53:36.723189    10.210.66.82          59.111.160.204        HTTP     522    GET /getConf?callback=URSJSONP1526720016647&pkid=cGTVPrV&pd=tie&mode=2 HTTP/1.1 

Frame 634: 522 bytes on wire (4176 bits), 522 bytes captured (4176 bits) on interface 0
Ethernet II, Src: AsustekC_34:f3:aa (9c:5c:8e:34:f3:aa), Dst: Hangzhou_d2:34:0d (3c:e5:a6:d2:34:0d)
Internet Protocol Version 4, Src: 10.210.66.82, Dst: 59.111.160.204
Transmission Control Protocol, Src Port: 63754 (63754), Dst Port: 80 (80), Seq: 2881, Ack: 1, Len: 468
[3 Reassembled TCP Segments (3348 bytes): #612(1440), #613(1440), #634(468)]
Hypertext Transfer Protocol
    GET /getConf?callback=URSJSONP1526720016647&pkid=cGTVPrV&pd=tie&mode=2 HTTP/1.1\r\n
    Host: dl.reg.163.com\r\n
    Connection: keep-alive\r\n
    User-Agent: Mozilla/5.0 (Windows NT 10.0; Win64; x64) AppleWebKit/537.36 (KHTML, like Gecko) Chrome/66.0.3359.139 Safari/537.36\r\n
    Accept: */*\r\n
    Referer: http://open.163.com/movie/2015/12/H/6/MB8EJB3QN_MB8OBFPH6.html\r\n
    Accept-Encoding: gzip, deflate\r\n
    Accept-Language: en-US,en;q=0.9,zh-TW;q=0.8,zh;q=0.7\r\n
     [truncated]Cookie: _ntes_nnid=1f983bbb19f587d903825b029b84bd36,1516798611503; _ntes_nuid=1f983bbb19f587d903825b029b84bd36; T_INFO=73CEADF5DC4BAF6A33EEB68DF45D89E0; SID=ecc9ee12-aeea-4e42-a2bd-5deaeb073312; starttime=; c98xpt_=30; _ihtxzdi
    \r\n
    [Full request URI: http://dl.reg.163.com/getConf?callback=URSJSONP1526720016647&pkid=cGTVPrV&pd=tie&mode=2]
    [HTTP request 1/1]
    [Response in frame: 645]

No.     Time               Source                Destination           Protocol Length Info
    641 08:53:36.751847    124.164.9.14          10.210.66.82          HTTP     402    HTTP/1.1 200 OK 

Frame 641: 402 bytes on wire (3216 bits), 402 bytes captured (3216 bits) on interface 0
Ethernet II, Src: Hangzhou_d2:34:0d (3c:e5:a6:d2:34:0d), Dst: AsustekC_34:f3:aa (9c:5c:8e:34:f3:aa)
Internet Protocol Version 4, Src: 124.164.9.14, Dst: 10.210.66.82
Transmission Control Protocol, Src Port: 80 (80), Dst Port: 63683 (63683), Seq: 1, Ack: 2079, Len: 348
Hypertext Transfer Protocol
    HTTP/1.1 200 OK\r\n
    Date: Sat, 19 May 2018 08:53:25 GMT\r\n
    Server: nginx\r\n
    Content-Type: application/json;charset=UTF-8\r\n
    Transfer-Encoding: chunked\r\n
    Cache-Control: max-age=120\r\n
    X-Varnish-Cache: MISS\r\n
    Content-Encoding: gzip\r\n
    X-Via: 1.1 hzsx163:8 (Cdn Cache Server V2.0), 1.1 ngtong165:9 (Cdn Cache Server V2.0)\r\n
    Connection: keep-alive\r\n
    X-Dscp-Value: 0\r\n
    \r\n
    [HTTP response 1/2]
    [Time since request: 0.091248000 seconds]
    [Request in frame: 587]
    [Next request in frame: 698]
    [Next response in frame: 785]

No.     Time               Source                Destination           Protocol Length Info
    645 08:53:36.759835    59.111.160.204        10.210.66.82          HTTP     272    HTTP/1.1 200 OK  (text/json)

Frame 645: 272 bytes on wire (2176 bits), 272 bytes captured (2176 bits) on interface 0
Ethernet II, Src: Hangzhou_d2:34:0d (3c:e5:a6:d2:34:0d), Dst: AsustekC_34:f3:aa (9c:5c:8e:34:f3:aa)
Internet Protocol Version 4, Src: 59.111.160.204, Dst: 10.210.66.82
Transmission Control Protocol, Src Port: 80 (80), Dst Port: 63754 (63754), Seq: 1, Ack: 3349, Len: 218
Hypertext Transfer Protocol
    HTTP/1.1 200 OK\r\n
    Server: nginx\r\n
    Date: Sat, 19 May 2018 08:53:25 GMT\r\n
    Content-Type: text/json;charset=utf-8\r\n
    Content-Length: 64\r\n
    Connection: keep-alive\r\n
    \r\n
    [HTTP response 1/1]
    [Time since request: 0.036646000 seconds]
    [Request in frame: 634]
Media Type

No.     Time               Source                Destination           Protocol Length Info
    649 08:53:36.767818    10.210.66.82          223.252.195.133       HTTP     1018   GET /ntes?_nacc=163v&_nvid=1f983bbb19f587d903825b029b84bd36&_nvtm=0&_nvsf=1&_nvfi=0&_nlag=en-us&_nlmf=1526720016&_nres=1366x768&_nscd=24-bit&_nstm=1&_nurl=http%3A//open.163.com/movie/2015/12/H/6/MB8EJB3QN_MB8OBFPH6.html&_ntit=%u5973%u5B69%u5D1B%u8D77_%u5973%u5B69%u5D1B%u8D77_%u7F51%u6613%u516C%u5F00%u8BFE&_nref=http%3A//open.163.com/special/openclass/womenhaha.html&_nfla=%2029.0%20r0&_nssn=m18801120356_1@163.com&_nxkey=00167210.80704&_end1 HTTP/1.1 

Frame 649: 1018 bytes on wire (8144 bits), 1018 bytes captured (8144 bits) on interface 0
Ethernet II, Src: AsustekC_34:f3:aa (9c:5c:8e:34:f3:aa), Dst: Hangzhou_d2:34:0d (3c:e5:a6:d2:34:0d)
Internet Protocol Version 4, Src: 10.210.66.82, Dst: 223.252.195.133
Transmission Control Protocol, Src Port: 63755 (63755), Dst Port: 80 (80), Seq: 1441, Ack: 1, Len: 964
[2 Reassembled TCP Segments (2404 bytes): #648(1440), #649(964)]
Hypertext Transfer Protocol
     [truncated]GET /ntes?_nacc=163v&_nvid=1f983bbb19f587d903825b029b84bd36&_nvtm=0&_nvsf=1&_nvfi=0&_nlag=en-us&_nlmf=1526720016&_nres=1366x768&_nscd=24-bit&_nstm=1&_nurl=http%3A//open.163.com/movie/2015/12/H/6/MB8EJB3QN_MB8OBFPH6.html&_ntit=%
    Host: analytics.163.com\r\n
    Connection: keep-alive\r\n
    User-Agent: Mozilla/5.0 (Windows NT 10.0; Win64; x64) AppleWebKit/537.36 (KHTML, like Gecko) Chrome/66.0.3359.139 Safari/537.36\r\n
    Accept: image/webp,image/apng,image/*,*/*;q=0.8\r\n
    Referer: http://open.163.com/movie/2015/12/H/6/MB8EJB3QN_MB8OBFPH6.html\r\n
    Accept-Encoding: gzip, deflate\r\n
    Accept-Language: en-US,en;q=0.9,zh-TW;q=0.8,zh;q=0.7\r\n
     [truncated]Cookie: _ntes_nnid=1f983bbb19f587d903825b029b84bd36,1516798611503; _ntes_nuid=1f983bbb19f587d903825b029b84bd36; starttime=; nts_mail_user=18801120356@163.com:-1:1; df=mail163_letter; _ngd_tid=gZ5L1GNfSjPRjDUxM65L36DYXg7hVnlC; m
    \r\n
    [Full request URI [truncated]: http://analytics.163.com/ntes?_nacc=163v&_nvid=1f983bbb19f587d903825b029b84bd36&_nvtm=0&_nvsf=1&_nvfi=0&_nlag=en-us&_nlmf=1526720016&_nres=1366x768&_nscd=24-bit&_nstm=1&_nurl=http%3A//open.163.com/movie/2015/1]
    [HTTP request 1/1]
    [Response in frame: 652]

No.     Time               Source                Destination           Protocol Length Info
    652 08:53:36.797477    223.252.195.133       10.210.66.82          HTTP     409    HTTP/1.1 200 OK  (GIF89a)

Frame 652: 409 bytes on wire (3272 bits), 409 bytes captured (3272 bits) on interface 0
Ethernet II, Src: Hangzhou_d2:34:0d (3c:e5:a6:d2:34:0d), Dst: AsustekC_34:f3:aa (9c:5c:8e:34:f3:aa)
Internet Protocol Version 4, Src: 223.252.195.133, Dst: 10.210.66.82
Transmission Control Protocol, Src Port: 80 (80), Dst Port: 63755 (63755), Seq: 1, Ack: 2405, Len: 355
Hypertext Transfer Protocol
    HTTP/1.1 200 OK\r\n
    Server: nginx\r\n
    Date: Sat, 19 May 2018 08:53:25 GMT\r\n
    Content-Type: image/gif\r\n
    Content-Length: 43\r\n
    Connection: keep-alive\r\n
    Cache-Control: must-revalidate, no-cache, private\r\n
    Pragma: no-cache\r\n
    Last-Modified: Sat, 1 Jan 2000 00:00:00 GMT\r\n
    Expires: Sat, 1 Jan 2000 00:00:00 GMT\r\n
    X-Server-ID: S171\r\n
    \r\n
    [HTTP response 1/1]
    [Time since request: 0.029659000 seconds]
    [Request in frame: 649]
Compuserve GIF, Version: GIF89a

No.     Time               Source                Destination           Protocol Length Info
    668 08:53:37.058435    10.210.66.82          123.58.180.5          HTTP     754    GET /ua/view.do?pf=&pid=MB8EJB3QN&mid=MB8OBFPH6&ts=1526720017027&uuid=f761be20-5b41-11e8-9edd-ef44e1c2ea46 HTTP/1.1 

Frame 668: 754 bytes on wire (6032 bits), 754 bytes captured (6032 bits) on interface 0
Ethernet II, Src: AsustekC_34:f3:aa (9c:5c:8e:34:f3:aa), Dst: Hangzhou_d2:34:0d (3c:e5:a6:d2:34:0d)
Internet Protocol Version 4, Src: 10.210.66.82, Dst: 123.58.180.5
Transmission Control Protocol, Src Port: 63757 (63757), Dst Port: 80 (80), Seq: 1441, Ack: 1, Len: 700
[2 Reassembled TCP Segments (2140 bytes): #667(1440), #668(700)]
Hypertext Transfer Protocol
    GET /ua/view.do?pf=&pid=MB8EJB3QN&mid=MB8OBFPH6&ts=1526720017027&uuid=f761be20-5b41-11e8-9edd-ef44e1c2ea46 HTTP/1.1\r\n
    Host: c.open.163.com\r\n
    Connection: keep-alive\r\n
    Upgrade-Insecure-Requests: 1\r\n
    User-Agent: Mozilla/5.0 (Windows NT 10.0; Win64; x64) AppleWebKit/537.36 (KHTML, like Gecko) Chrome/66.0.3359.139 Safari/537.36\r\n
    Accept: text/html,application/xhtml+xml,application/xml;q=0.9,image/webp,image/apng,*/*;q=0.8\r\n
    Referer: http://open.163.com/movie/2015/12/H/6/MB8EJB3QN_MB8OBFPH6.html\r\n
    Accept-Encoding: gzip, deflate\r\n
    Accept-Language: en-US,en;q=0.9,zh-TW;q=0.8,zh;q=0.7\r\n
     [truncated]Cookie: _ntes_nnid=1f983bbb19f587d903825b029b84bd36,1516798611503; _ntes_nuid=1f983bbb19f587d903825b029b84bd36; starttime=; nts_mail_user=18801120356@163.com:-1:1; df=mail163_letter; _ngd_tid=gZ5L1GNfSjPRjDUxM65L36DYXg7hVnlC; m
    \r\n
    [Full request URI: http://c.open.163.com/ua/view.do?pf=&pid=MB8EJB3QN&mid=MB8OBFPH6&ts=1526720017027&uuid=f761be20-5b41-11e8-9edd-ef44e1c2ea46]
    [HTTP request 1/6]
    [Response in frame: 687]
    [Next request in frame: 804]

No.     Time               Source                Destination           Protocol Length Info
    687 08:53:37.127850    123.58.180.5          10.210.66.82          HTTP     409    HTTP/1.1 200 OK  (text/html)

Frame 687: 409 bytes on wire (3272 bits), 409 bytes captured (3272 bits) on interface 0
Ethernet II, Src: Hangzhou_d2:34:0d (3c:e5:a6:d2:34:0d), Dst: AsustekC_34:f3:aa (9c:5c:8e:34:f3:aa)
Internet Protocol Version 4, Src: 123.58.180.5, Dst: 10.210.66.82
Transmission Control Protocol, Src Port: 80 (80), Dst Port: 63757 (63757), Seq: 1, Ack: 2141, Len: 355
Hypertext Transfer Protocol
    HTTP/1.1 200 OK\r\n
    Server: nginx\r\n
    Date: Sat, 19 May 2018 08:53:26 GMT\r\n
    Content-Type: text/html;charset=utf-8\r\n
    Transfer-Encoding: chunked\r\n
    Connection: keep-alive\r\n
    Vary: Accept-Encoding\r\n
    Vary: Accept-Encoding\r\n
    Set-Cookie: NTESOPENSI=0b37c672ee414d01bf75525d23298521; Domain=m.open.163.com; Path=/\r\n
    Content-Encoding: gzip\r\n
    \r\n
    [HTTP response 1/6]
    [Time since request: 0.069415000 seconds]
    [Request in frame: 668]
    [Next request in frame: 804]
    [Next response in frame: 869]
    HTTP chunked response
    Content-encoded entity body (gzip): 29 bytes -> 13 bytes
Line-based text data: text/html

No.     Time               Source                Destination           Protocol Length Info
