No.     Time               Source                Destination           Protocol Length Info
     10 01:59:29.183805    124.193.231.109       10.106.129.54         HTTP     541    HTTP/1.1 200 OK  (text/html)

Frame 10: 541 bytes on wire (4328 bits), 541 bytes captured (4328 bits) on interface 0
Ethernet II, Src: Hangzhou_75:c8:f5 (74:25:8a:75:c8:f5), Dst: AsustekC_34:f3:aa (9c:5c:8e:34:f3:aa)
Internet Protocol Version 4, Src: 124.193.231.109, Dst: 10.106.129.54
Transmission Control Protocol, Src Port: 80 (80), Dst Port: 40622 (40622), Seq: 1, Ack: 1, Len: 487
Hypertext Transfer Protocol
    HTTP/1.1 200 OK\r\n
    Server: openresty\r\n
    Date: Sun, 16 Jul 2017 01:59:27 GMT\r\n
    Content-Type: text/html;charset=UTF-8\r\n
    Transfer-Encoding: chunked\r\n
    Connection: keep-alive\r\n
    Vary: Accept-Encoding\r\n
    Cache-Control: no-store\r\n
    Expires: Thu, 01 Jan 1970 00:00:00 GMT\r\n
    Pragma: no-cache\r\n
    Content-Encoding: gzip\r\n
    \r\n
    [HTTP response 1/1]
    HTTP chunked response
    Content-encoded entity body (gzip): 180 bytes -> 207 bytes
Line-based text data: text/html

No.     Time               Source                Destination           Protocol Length Info
     38 01:59:30.531765    10.106.129.54         45.55.41.223          HTTP     238    GET /updates/2/stable/updatecheck?version=2221&platform=windows&arch=x32&r=0&p=1 HTTP/1.1 

Frame 38: 238 bytes on wire (1904 bits), 238 bytes captured (1904 bits) on interface 0
Ethernet II, Src: AsustekC_34:f3:aa (9c:5c:8e:34:f3:aa), Dst: Hangzhou_75:c8:f5 (74:25:8a:75:c8:f5)
Internet Protocol Version 4, Src: 10.106.129.54, Dst: 45.55.41.223
Transmission Control Protocol, Src Port: 40626 (40626), Dst Port: 80 (80), Seq: 1, Ack: 1, Len: 184
Hypertext Transfer Protocol
    GET /updates/2/stable/updatecheck?version=2221&platform=windows&arch=x32&r=0&p=1 HTTP/1.1\r\n
    User-Agent: sublime-version-check/2.1\r\n
    Host: www.sublimetext.com\r\n
    Cache-Control: no-cache\r\n
    \r\n
    [Full request URI: http://www.sublimetext.com/updates/2/stable/updatecheck?version=2221&platform=windows&arch=x32&r=0&p=1]
    [HTTP request 1/1]
    [Response in frame: 42]

No.     Time               Source                Destination           Protocol Length Info
     42 01:59:30.789945    45.55.41.223          10.106.129.54         HTTP     135    HTTP/1.1 200 OK  (text/html)

Frame 42: 135 bytes on wire (1080 bits), 135 bytes captured (1080 bits) on interface 0
Ethernet II, Src: Hangzhou_75:c8:f5 (74:25:8a:75:c8:f5), Dst: AsustekC_34:f3:aa (9c:5c:8e:34:f3:aa)
Internet Protocol Version 4, Src: 45.55.41.223, Dst: 10.106.129.54
Transmission Control Protocol, Src Port: 80 (80), Dst Port: 40626 (40626), Seq: 333, Ack: 185, Len: 81
[2 Reassembled TCP Segments (413 bytes): #41(332), #42(81)]
Hypertext Transfer Protocol
    HTTP/1.1 200 OK\r\n
    Server: nginx\r\n
    Date: Sun, 16 Jul 2017 01:59:28 GMT\r\n
    Content-Type: text/html; charset=utf-8\r\n
    Content-Length: 81\r\n
    Last-Modified: Mon, 08 Jul 2013 06:41:44 GMT\r\n
    Connection: keep-alive\r\n
    Vary: Accept-Encoding\r\n
    ETag: "51da5f28-51"\r\n
    Expires: Thu, 01 Jan 1970 00:00:01 GMT\r\n
    Cache-Control: no-cache\r\n
    Accept-Ranges: bytes\r\n
    \r\n
    [HTTP response 1/1]
    [Time since request: 0.258180000 seconds]
    [Request in frame: 38]
Line-based text data: text/html

No.     Time               Source                Destination           Protocol Length Info
    140 01:59:33.699545    10.106.129.54         124.193.231.139       HTTP     476    GET /common/fix/images/lib-logo.ico HTTP/1.1 

Frame 140: 476 bytes on wire (3808 bits), 476 bytes captured (3808 bits) on interface 0
Ethernet II, Src: AsustekC_34:f3:aa (9c:5c:8e:34:f3:aa), Dst: Hangzhou_75:c8:f5 (74:25:8a:75:c8:f5)
Internet Protocol Version 4, Src: 10.106.129.54, Dst: 124.193.231.139
Transmission Control Protocol, Src Port: 40610 (40610), Dst Port: 80 (80), Seq: 1, Ack: 1, Len: 422
Hypertext Transfer Protocol
    GET /common/fix/images/lib-logo.ico HTTP/1.1\r\n
    Host: www.qiyipic.com\r\n
    Connection: keep-alive\r\n
    User-Agent: Mozilla/5.0 (Windows NT 10.0; Win64; x64) AppleWebKit/537.36 (KHTML, like Gecko) Chrome/59.0.3071.115 Safari/537.36\r\n
    Accept: image/webp,image/apng,image/*,*/*;q=0.8\r\n
    Referer: http://www.iqiyi.com/lib/m_207733514.html?src=search\r\n
    Accept-Encoding: gzip, deflate\r\n
    Accept-Language: en-US,en;q=0.8,zh-TW;q=0.6,zh;q=0.4\r\n
    \r\n
    [Full request URI: http://www.qiyipic.com/common/fix/images/lib-logo.ico]
    [HTTP request 1/1]
    [Response in frame: 162]

No.     Time               Source                Destination           Protocol Length Info
    151 01:59:33.702259    10.106.129.54         124.192.153.31        HTTP     787    GET /tmpstats.gif?type=jspfmc140109&pla=11&uid=46484ba4d09a483ea32b78d74a6e505c&ppuid=1427323987&brs=CHROME&pgtype=ysdq-alb&purl=http:%2F%2Fwww.iqiyi.com%2Flib%2Fm_207733514.html?src%3Dsearch&cid=0&tmplt=&tm1=16,0&tm11=71,784&iwtLoadReady=315,1865&tm13=324,1866&tm7=1882,782&tm8=17,2664&tm9=97,2687&tm10=13,2784&tm3=1002,1881&tm6=8494,0&_=1500170373643 HTTP/1.1 

Frame 151: 787 bytes on wire (6296 bits), 787 bytes captured (6296 bits) on interface 0
Ethernet II, Src: AsustekC_34:f3:aa (9c:5c:8e:34:f3:aa), Dst: Hangzhou_75:c8:f5 (74:25:8a:75:c8:f5)
Internet Protocol Version 4, Src: 10.106.129.54, Dst: 124.192.153.31
Transmission Control Protocol, Src Port: 40627 (40627), Dst Port: 80 (80), Seq: 1, Ack: 1, Len: 733
Hypertext Transfer Protocol
     [truncated]GET /tmpstats.gif?type=jspfmc140109&pla=11&uid=46484ba4d09a483ea32b78d74a6e505c&ppuid=1427323987&brs=CHROME&pgtype=ysdq-alb&purl=http:%2F%2Fwww.iqiyi.com%2Flib%2Fm_207733514.html?src%3Dsearch&cid=0&tmplt=&tm1=16,0&tm11=71,784&i
    Host: msg.71.am\r\n
    Connection: keep-alive\r\n
    User-Agent: Mozilla/5.0 (Windows NT 10.0; Win64; x64) AppleWebKit/537.36 (KHTML, like Gecko) Chrome/59.0.3071.115 Safari/537.36\r\n
    Accept: image/webp,image/apng,image/*,*/*;q=0.8\r\n
    Referer: http://www.iqiyi.com/lib/m_207733514.html?src=search\r\n
    Accept-Encoding: gzip, deflate\r\n
    Accept-Language: en-US,en;q=0.8,zh-TW;q=0.6,zh;q=0.4\r\n
    \r\n
    [Full request URI [truncated]: http://msg.71.am/tmpstats.gif?type=jspfmc140109&pla=11&uid=46484ba4d09a483ea32b78d74a6e505c&ppuid=1427323987&brs=CHROME&pgtype=ysdq-alb&purl=http:%2F%2Fwww.iqiyi.com%2Flib%2Fm_207733514.html?src%3Dsearch&cid=0]
    [HTTP request 1/1]
    [Response in frame: 178]

No.     Time               Source                Destination           Protocol Length Info
    161 01:59:33.703962    10.106.129.54         124.192.153.31        HTTP     805    GET /tmpstats.gif?type=jspfmc150104&pla=11&uid=46484ba4d09a483ea32b78d74a6e505c&ppuid=1427323987&brs=CHROME&pgtype=ysdq-alb&purl=http://www.iqiyi.com/lib/m_207733514.html?src=search&cid=0&tmplt=&tm1=0&tm2=0&tm3=0&tm4=0&tm5=0&tm6=32&tm7=32&tm8=32&tm9=38&tm10=0&tm11=38&tm12=169&tm13=195&tm14=175&tm15=2077&tm16=2077&tm17=2089&tm18=8701&tm19=8701&tm20=8705&_=1500170373668 HTTP/1.1 

Frame 161: 805 bytes on wire (6440 bits), 805 bytes captured (6440 bits) on interface 0
Ethernet II, Src: AsustekC_34:f3:aa (9c:5c:8e:34:f3:aa), Dst: Hangzhou_75:c8:f5 (74:25:8a:75:c8:f5)
Internet Protocol Version 4, Src: 10.106.129.54, Dst: 124.192.153.31
Transmission Control Protocol, Src Port: 40628 (40628), Dst Port: 80 (80), Seq: 1, Ack: 1, Len: 751
Hypertext Transfer Protocol
     [truncated]GET /tmpstats.gif?type=jspfmc150104&pla=11&uid=46484ba4d09a483ea32b78d74a6e505c&ppuid=1427323987&brs=CHROME&pgtype=ysdq-alb&purl=http://www.iqiyi.com/lib/m_207733514.html?src=search&cid=0&tmplt=&tm1=0&tm2=0&tm3=0&tm4=0&tm5=0&tm
    Host: msg.71.am\r\n
    Connection: keep-alive\r\n
    User-Agent: Mozilla/5.0 (Windows NT 10.0; Win64; x64) AppleWebKit/537.36 (KHTML, like Gecko) Chrome/59.0.3071.115 Safari/537.36\r\n
    Accept: image/webp,image/apng,image/*,*/*;q=0.8\r\n
    Referer: http://www.iqiyi.com/lib/m_207733514.html?src=search\r\n
    Accept-Encoding: gzip, deflate\r\n
    Accept-Language: en-US,en;q=0.8,zh-TW;q=0.6,zh;q=0.4\r\n
    \r\n
    [Full request URI [truncated]: http://msg.71.am/tmpstats.gif?type=jspfmc150104&pla=11&uid=46484ba4d09a483ea32b78d74a6e505c&ppuid=1427323987&brs=CHROME&pgtype=ysdq-alb&purl=http://www.iqiyi.com/lib/m_207733514.html?src=search&cid=0&tmplt=&tm]
    [HTTP request 1/1]
    [Response in frame: 188]

No.     Time               Source                Destination           Protocol Length Info
    162 01:59:33.704591    124.193.231.139       10.106.129.54         HTTP     1514   HTTP/1.1 200 OK  (image/x-icon)

Frame 162: 1514 bytes on wire (12112 bits), 1514 bytes captured (12112 bits) on interface 0
Ethernet II, Src: Hangzhou_75:c8:f5 (74:25:8a:75:c8:f5), Dst: AsustekC_34:f3:aa (9c:5c:8e:34:f3:aa)
Internet Protocol Version 4, Src: 124.193.231.139, Dst: 10.106.129.54
Transmission Control Protocol, Src Port: 80 (80), Dst Port: 40610 (40610), Seq: 1, Ack: 423, Len: 1460
Hypertext Transfer Protocol
    HTTP/1.1 200 OK\r\n
    Server: QWS\r\n
    Date: Sun, 16 Jul 2017 01:59:31 GMT\r\n
    Content-Type: image/x-icon\r\n
    Content-Length: 353118\r\n
    Connection: keep-alive\r\n
    Expires: Thu, 22 Feb 2018 07:15:24 GMT\r\n
    Cache-Control: max-age=31536000\r\n
    Last-Modified: Fri, 31 Jul 2015 03:19:27 GMT\r\n
    X-Cache: MISS from 10.10.131.240\r\n
    X-Cache: HIT from 124.193.231.139\r\n
    Accept-Ranges: bytes\r\n
    \r\n
    [HTTP response 1/1]
    [Time since request: 0.005046000 seconds]
    [Request in frame: 140]
Media Type

No.     Time               Source                Destination           Protocol Length Info
    178 01:59:33.707134    124.192.153.31        10.106.129.54         HTTP     199    HTTP/1.1 200 OK 

Frame 178: 199 bytes on wire (1592 bits), 199 bytes captured (1592 bits) on interface 0
Ethernet II, Src: Hangzhou_75:c8:f5 (74:25:8a:75:c8:f5), Dst: AsustekC_34:f3:aa (9c:5c:8e:34:f3:aa)
Internet Protocol Version 4, Src: 124.192.153.31, Dst: 10.106.129.54
Transmission Control Protocol, Src Port: 80 (80), Dst Port: 40627 (40627), Seq: 1, Ack: 734, Len: 145
Hypertext Transfer Protocol
    HTTP/1.1 200 OK\r\n
    Server: nginx/1.8.0\r\n
    Date: Sun, 16 Jul 2017 01:59:31 GMT\r\n
    Content-Type: image/gif\r\n
    Content-Length: 0\r\n
    Connection: keep-alive\r\n
    \r\n
    [HTTP response 1/1]
    [Time since request: 0.004875000 seconds]
    [Request in frame: 151]

No.     Time               Source                Destination           Protocol Length Info
    188 01:59:33.709143    124.192.153.31        10.106.129.54         HTTP     199    HTTP/1.1 200 OK 

Frame 188: 199 bytes on wire (1592 bits), 199 bytes captured (1592 bits) on interface 0
Ethernet II, Src: Hangzhou_75:c8:f5 (74:25:8a:75:c8:f5), Dst: AsustekC_34:f3:aa (9c:5c:8e:34:f3:aa)
Internet Protocol Version 4, Src: 124.192.153.31, Dst: 10.106.129.54
Transmission Control Protocol, Src Port: 80 (80), Dst Port: 40628 (40628), Seq: 1, Ack: 752, Len: 145
Hypertext Transfer Protocol
    HTTP/1.1 200 OK\r\n
    Server: nginx/1.8.0\r\n
    Date: Sun, 16 Jul 2017 01:59:31 GMT\r\n
    Content-Type: image/gif\r\n
    Content-Length: 0\r\n
    Connection: keep-alive\r\n
    \r\n
    [HTTP response 1/1]
    [Time since request: 0.005181000 seconds]
    [Request in frame: 161]

No.     Time               Source                Destination           Protocol Length Info
    652 01:59:33.855125    10.106.129.54         124.193.229.72        HTTP     499    GET /common/lego/20170712/0585b3ee6423462eae19b3dfe07868b2.jpg?src=focustat_0_20130527_3 HTTP/1.1 

Frame 652: 499 bytes on wire (3992 bits), 499 bytes captured (3992 bits) on interface 0
Ethernet II, Src: AsustekC_34:f3:aa (9c:5c:8e:34:f3:aa), Dst: Hangzhou_75:c8:f5 (74:25:8a:75:c8:f5)
Internet Protocol Version 4, Src: 10.106.129.54, Dst: 124.193.229.72
Transmission Control Protocol, Src Port: 40607 (40607), Dst Port: 80 (80), Seq: 1, Ack: 1, Len: 445
Hypertext Transfer Protocol
    GET /common/lego/20170712/0585b3ee6423462eae19b3dfe07868b2.jpg?src=focustat_0_20130527_3 HTTP/1.1\r\n
    Host: pic2.qiyipic.com\r\n
    Connection: keep-alive\r\n
    User-Agent: Mozilla/5.0 (Windows NT 10.0; Win64; x64) AppleWebKit/537.36 (KHTML, like Gecko) Chrome/59.0.3071.115 Safari/537.36\r\n
    Accept: image/webp,image/apng,image/*,*/*;q=0.8\r\n
    Referer: http://www.iqiyi.com/\r\n
    Accept-Encoding: gzip, deflate\r\n
    Accept-Language: en-US,en;q=0.8,zh-TW;q=0.6,zh;q=0.4\r\n
    \r\n
    [Full request URI: http://pic2.qiyipic.com/common/lego/20170712/0585b3ee6423462eae19b3dfe07868b2.jpg?src=focustat_0_20130527_3]
    [HTTP request 1/1]
    [Response in frame: 668]

No.     Time               Source                Destination           Protocol Length Info
    668 01:59:33.860096    124.193.229.72        10.106.129.54         HTTP     1514   HTTP/1.1 200 OK  (JPEG JFIF image)

Frame 668: 1514 bytes on wire (12112 bits), 1514 bytes captured (12112 bits) on interface 0
Ethernet II, Src: Hangzhou_75:c8:f5 (74:25:8a:75:c8:f5), Dst: AsustekC_34:f3:aa (9c:5c:8e:34:f3:aa)
Internet Protocol Version 4, Src: 124.193.229.72, Dst: 10.106.129.54
Transmission Control Protocol, Src Port: 80 (80), Dst Port: 40607 (40607), Seq: 1, Ack: 446, Len: 1460
Hypertext Transfer Protocol
    HTTP/1.1 200 OK\r\n
    Server: QWS\r\n
    Date: Sun, 16 Jul 2017 01:59:31 GMT\r\n
    Content-Type: image/jpeg\r\n
    Content-Length: 214520\r\n
    Connection: keep-alive\r\n
    Expires: Thu, 12 Jul 2018 15:45:55 GMT\r\n
    Cache-Control: max-age=31536000\r\n
    Last-Modified: Wed, 12 Jul 2017 15:44:06 GMT\r\n
    X-Cache: from 127.0.0.1\r\n
    Age: 120\r\n
    Via: http/1.1 QTS (QTS [cRs f ])\r\n
    X-Cache: from 10.10.17.12\r\n
    X-Cache: HIT from 124.193.229.72\r\n
    Accept-Ranges: bytes\r\n
    \r\n
    [HTTP response 1/1]
    [Time since request: 0.004971000 seconds]
    [Request in frame: 652]
JPEG File Interchange Format

No.     Time               Source                Destination           Protocol Length Info
    931 01:59:34.161042    10.106.129.54         202.108.23.152        HTTP     334    GET /hm.gif?cc=0&ck=1&cl=24-bit&ds=1366x768&ep=%7B%22netAll%22%3A38%2C%22netDns%22%3A0%2C%22netTcp%22%3A6%2C%22srv%22%3A131%2C%22dom%22%3A2077%2C%22loadEvent%22%3A8705%2C%22qid%22%3A%22%22%2C%22bdDom%22%3A0%2C%22bdRun%22%3A0%2C%22bdDef%22%3A0%7D&et=87&fl=26.0&ja=0&ln=zh-cn&lo=0&nv=1&rnd=603414363&si=5bd6c9d6dc07c01dbcfa83eecf0e44d0&st=3&su=http%3A%2F%2Fso.iqiyi.com%2Fso%2Fq_%25E8%25BF%25B7%25E5%25A4%25B1%25E4%25B8%259C%25E4%25BA%25AC%3Fsource%3Dinput%26sr%3D982466759951&v=1.2.16&lv=1 HTTP/1.1 

Frame 931: 334 bytes on wire (2672 bits), 334 bytes captured (2672 bits) on interface 0
Ethernet II, Src: AsustekC_34:f3:aa (9c:5c:8e:34:f3:aa), Dst: Hangzhou_75:c8:f5 (74:25:8a:75:c8:f5)
Internet Protocol Version 4, Src: 10.106.129.54, Dst: 202.108.23.152
Transmission Control Protocol, Src Port: 40507 (40507), Dst Port: 80 (80), Seq: 1453, Ack: 1, Len: 280
[2 Reassembled TCP Segments (1732 bytes): #930(1452), #931(280)]
Hypertext Transfer Protocol
     [truncated]GET /hm.gif?cc=0&ck=1&cl=24-bit&ds=1366x768&ep=%7B%22netAll%22%3A38%2C%22netDns%22%3A0%2C%22netTcp%22%3A6%2C%22srv%22%3A131%2C%22dom%22%3A2077%2C%22loadEvent%22%3A8705%2C%22qid%22%3A%22%22%2C%22bdDom%22%3A0%2C%22bdRun%22%3A0%2C
    Host: hm.baidu.com\r\n
    Connection: keep-alive\r\n
    User-Agent: Mozilla/5.0 (Windows NT 10.0; Win64; x64) AppleWebKit/537.36 (KHTML, like Gecko) Chrome/59.0.3071.115 Safari/537.36\r\n
    Accept: image/webp,image/apng,image/*,*/*;q=0.8\r\n
    Referer: http://www.iqiyi.com/lib/m_207733514.html?src=search\r\n
    Accept-Encoding: gzip, deflate\r\n
    Accept-Language: en-US,en;q=0.8,zh-TW;q=0.6,zh;q=0.4\r\n
     [truncated]Cookie: HMACCOUNT=A6A797B3551C1DFF; BAIDUID=2A78766D3BA9E0EAE1CD50BB3164CA21:FG=1; BIDUPSID=2A78766D3BA9E0EAE1CD50BB3164CA21; PSTM=1487049906; BDUSS=2UtNmhvUjg2SW1TQUs3VHVYc0x-QWdoaTNSTzUzcHJaZHJMN2prRlZhdEN2bjFaSUFBQUFBJCQAAAA
    \r\n
    [Full request URI [truncated]: http://hm.baidu.com/hm.gif?cc=0&ck=1&cl=24-bit&ds=1366x768&ep=%7B%22netAll%22%3A38%2C%22netDns%22%3A0%2C%22netTcp%22%3A6%2C%22srv%22%3A131%2C%22dom%22%3A2077%2C%22loadEvent%22%3A8705%2C%22qid%22%3A%22%22%2C%22]
    [HTTP request 1/1]
    [Response in frame: 949]

No.     Time               Source                Destination           Protocol Length Info
    933 01:59:34.161449    10.106.129.54         202.108.23.152        HTTP     348    GET /hm.gif?cc=0&ck=1&cl=24-bit&ds=1366x768&ep=%7B%22netAll%22%3A38%2C%22netDns%22%3A0%2C%22netTcp%22%3A6%2C%22srv%22%3A131%2C%22dom%22%3A2077%2C%22loadEvent%22%3A8705%2C%22qid%22%3A%22%22%2C%22bdDom%22%3A0%2C%22bdRun%22%3A0%2C%22bdDef%22%3A0%7D&et=87&fl=26.0&ja=0&ln=zh-cn&lo=0&lt=1500170352&nv=0&rnd=413215673&si=53b7374a63c37483e5dd97d78d9bb36e&st=4&su=http%3A%2F%2Fso.iqiyi.com%2Fso%2Fq_%25E8%25BF%25B7%25E5%25A4%25B1%25E4%25B8%259C%25E4%25BA%25AC%3Fsource%3Dinput%26sr%3D982466759951&v=1.2.16&lv=3 HTTP/1.1 

Frame 933: 348 bytes on wire (2784 bits), 348 bytes captured (2784 bits) on interface 0
Ethernet II, Src: AsustekC_34:f3:aa (9c:5c:8e:34:f3:aa), Dst: Hangzhou_75:c8:f5 (74:25:8a:75:c8:f5)
Internet Protocol Version 4, Src: 10.106.129.54, Dst: 202.108.23.152
Transmission Control Protocol, Src Port: 40613 (40613), Dst Port: 80 (80), Seq: 1453, Ack: 1, Len: 294
[2 Reassembled TCP Segments (1746 bytes): #932(1452), #933(294)]
Hypertext Transfer Protocol
     [truncated]GET /hm.gif?cc=0&ck=1&cl=24-bit&ds=1366x768&ep=%7B%22netAll%22%3A38%2C%22netDns%22%3A0%2C%22netTcp%22%3A6%2C%22srv%22%3A131%2C%22dom%22%3A2077%2C%22loadEvent%22%3A8705%2C%22qid%22%3A%22%22%2C%22bdDom%22%3A0%2C%22bdRun%22%3A0%2C
    Host: hm.baidu.com\r\n
    Connection: keep-alive\r\n
    User-Agent: Mozilla/5.0 (Windows NT 10.0; Win64; x64) AppleWebKit/537.36 (KHTML, like Gecko) Chrome/59.0.3071.115 Safari/537.36\r\n
    Accept: image/webp,image/apng,image/*,*/*;q=0.8\r\n
    Referer: http://www.iqiyi.com/lib/m_207733514.html?src=search\r\n
    Accept-Encoding: gzip, deflate\r\n
    Accept-Language: en-US,en;q=0.8,zh-TW;q=0.6,zh;q=0.4\r\n
     [truncated]Cookie: HMACCOUNT=A6A797B3551C1DFF; BAIDUID=2A78766D3BA9E0EAE1CD50BB3164CA21:FG=1; BIDUPSID=2A78766D3BA9E0EAE1CD50BB3164CA21; PSTM=1487049906; BDUSS=2UtNmhvUjg2SW1TQUs3VHVYc0x-QWdoaTNSTzUzcHJaZHJMN2prRlZhdEN2bjFaSUFBQUFBJCQAAAA
    \r\n
    [Full request URI [truncated]: http://hm.baidu.com/hm.gif?cc=0&ck=1&cl=24-bit&ds=1366x768&ep=%7B%22netAll%22%3A38%2C%22netDns%22%3A0%2C%22netTcp%22%3A6%2C%22srv%22%3A131%2C%22dom%22%3A2077%2C%22loadEvent%22%3A8705%2C%22qid%22%3A%22%22%2C%22]
    [HTTP request 1/1]
    [Response in frame: 948]

No.     Time               Source                Destination           Protocol Length Info
    948 01:59:34.167301    202.108.23.152        10.106.129.54         HTTP     310    HTTP/1.1 200 OK  (GIF89a)

Frame 948: 310 bytes on wire (2480 bits), 310 bytes captured (2480 bits) on interface 0
Ethernet II, Src: Hangzhou_75:c8:f5 (74:25:8a:75:c8:f5), Dst: AsustekC_34:f3:aa (9c:5c:8e:34:f3:aa)
Internet Protocol Version 4, Src: 202.108.23.152, Dst: 10.106.129.54
Transmission Control Protocol, Src Port: 80 (80), Dst Port: 40613 (40613), Seq: 1, Ack: 1747, Len: 256
Hypertext Transfer Protocol
    HTTP/1.1 200 OK\r\n
    Cache-Control: private, max-age=0, no-cache\r\n
    Content-Length: 43\r\n
    Content-Type: image/gif\r\n
    Date: Sun, 16 Jul 2017 01:59:32 GMT\r\n
    Pragma: no-cache\r\n
    Server: apache\r\n
    X-Content-Type-Options: nosniff\r\n
    \r\n
    [HTTP response 1/1]
    [Time since request: 0.005852000 seconds]
    [Request in frame: 933]
Compuserve GIF, Version: GIF89a

No.     Time               Source                Destination           Protocol Length Info
    949 01:59:34.170336    202.108.23.152        10.106.129.54         HTTP     310    HTTP/1.1 200 OK  (GIF89a)

Frame 949: 310 bytes on wire (2480 bits), 310 bytes captured (2480 bits) on interface 0
Ethernet II, Src: Hangzhou_75:c8:f5 (74:25:8a:75:c8:f5), Dst: AsustekC_34:f3:aa (9c:5c:8e:34:f3:aa)
Internet Protocol Version 4, Src: 202.108.23.152, Dst: 10.106.129.54
Transmission Control Protocol, Src Port: 80 (80), Dst Port: 40507 (40507), Seq: 1, Ack: 1733, Len: 256
Hypertext Transfer Protocol
    HTTP/1.1 200 OK\r\n
    Cache-Control: private, max-age=0, no-cache\r\n
    Content-Length: 43\r\n
    Content-Type: image/gif\r\n
    Date: Sun, 16 Jul 2017 01:59:32 GMT\r\n
    Pragma: no-cache\r\n
    Server: apache\r\n
    X-Content-Type-Options: nosniff\r\n
    \r\n
    [HTTP response 1/1]
    [Time since request: 0.009294000 seconds]
    [Request in frame: 931]
Compuserve GIF, Version: GIF89a

No.     Time               Source                Destination           Protocol Length Info
   1100 01:59:41.994602    10.106.129.54         10.106.129.164        SSDP     480    HTTP/1.1 200 OK 

Frame 1100: 480 bytes on wire (3840 bits), 480 bytes captured (3840 bits) on interface 0
Ethernet II, Src: AsustekC_34:f3:aa (9c:5c:8e:34:f3:aa), Dst: LcfcHefe_25:c7:b3 (68:f7:28:25:c7:b3)
Internet Protocol Version 4, Src: 10.106.129.54, Dst: 10.106.129.164
User Datagram Protocol, Src Port: 1900 (1900), Dst Port: 45510 (45510)
Hypertext Transfer Protocol
    HTTP/1.1 200 OK\r\n
    ST: upnp:rootdevice\r\n
    USN: uuid:3ced1185-a624-4fc1-be23-ce28fc76a1b5::upnp:rootdevice\r\n
    Location: http://10.106.129.54:2869/upnphost/udhisapi.dll?content=uuid:3ced1185-a624-4fc1-be23-ce28fc76a1b5\r\n
    OPT:"http://schemas.upnp.org/upnp/1/0/"; ns=01\r\n
    01-NLS: 3fca7df4a9594a241129c800108660dc\r\n
    Cache-Control: max-age=900\r\n
    Server: Microsoft-Windows/10.0 UPnP/1.0 UPnP-Device-Host/1.0\r\n
    Ext: \r\n
    Date: Sun, 16 Jul 2017 01:40:54 GMT\r\n
    \r\n
    [HTTP response 1/1]

No.     Time               Source                Destination           Protocol Length Info
   1147 01:59:45.514154    10.106.129.54         192.168.81.89         SSDP     480    HTTP/1.1 200 OK 

Frame 1147: 480 bytes on wire (3840 bits), 480 bytes captured (3840 bits) on interface 0
Ethernet II, Src: AsustekC_34:f3:aa (9c:5c:8e:34:f3:aa), Dst: Hangzhou_75:c8:f5 (74:25:8a:75:c8:f5)
Internet Protocol Version 4, Src: 10.106.129.54, Dst: 192.168.81.89
User Datagram Protocol, Src Port: 1900 (1900), Dst Port: 1900 (1900)
Hypertext Transfer Protocol
    HTTP/1.1 200 OK\r\n
    ST: upnp:rootdevice\r\n
    USN: uuid:3ced1185-a624-4fc1-be23-ce28fc76a1b5::upnp:rootdevice\r\n
    Location: http://10.106.129.54:2869/upnphost/udhisapi.dll?content=uuid:3ced1185-a624-4fc1-be23-ce28fc76a1b5\r\n
    OPT:"http://schemas.upnp.org/upnp/1/0/"; ns=01\r\n
    01-NLS: 3fca7df4a9594a241129c800108660dc\r\n
    Cache-Control: max-age=900\r\n
    Server: Microsoft-Windows/10.0 UPnP/1.0 UPnP-Device-Host/1.0\r\n
    Ext: \r\n
    Date: Sun, 16 Jul 2017 01:40:54 GMT\r\n
    \r\n
    [HTTP response 1/52]
    [Next response in frame: 1565]

No.     Time               Source                Destination           Protocol Length Info
   1183 01:59:45.853122    10.106.129.54         124.193.229.70        HTTP     499    GET /common/lego/20170715/0c42cbda0b404d8dbd1a116a7e45b820.jpg?src=focustat_0_20130527_5 HTTP/1.1 

Frame 1183: 499 bytes on wire (3992 bits), 499 bytes captured (3992 bits) on interface 0
Ethernet II, Src: AsustekC_34:f3:aa (9c:5c:8e:34:f3:aa), Dst: Hangzhou_75:c8:f5 (74:25:8a:75:c8:f5)
Internet Protocol Version 4, Src: 10.106.129.54, Dst: 124.193.229.70
Transmission Control Protocol, Src Port: 40634 (40634), Dst Port: 80 (80), Seq: 1, Ack: 1, Len: 445
Hypertext Transfer Protocol
    GET /common/lego/20170715/0c42cbda0b404d8dbd1a116a7e45b820.jpg?src=focustat_0_20130527_5 HTTP/1.1\r\n
    Host: pic5.qiyipic.com\r\n
    Connection: keep-alive\r\n
    User-Agent: Mozilla/5.0 (Windows NT 10.0; Win64; x64) AppleWebKit/537.36 (KHTML, like Gecko) Chrome/59.0.3071.115 Safari/537.36\r\n
    Accept: image/webp,image/apng,image/*,*/*;q=0.8\r\n
    Referer: http://www.iqiyi.com/\r\n
    Accept-Encoding: gzip, deflate\r\n
    Accept-Language: en-US,en;q=0.8,zh-TW;q=0.6,zh;q=0.4\r\n
    \r\n
    [Full request URI: http://pic5.qiyipic.com/common/lego/20170715/0c42cbda0b404d8dbd1a116a7e45b820.jpg?src=focustat_0_20130527_5]
    [HTTP request 1/1]
    [Response in frame: 1185]

No.     Time               Source                Destination           Protocol Length Info
   1185 01:59:45.858291    124.193.229.70        10.106.129.54         HTTP     1514   HTTP/1.1 200 OK  (JPEG JFIF image)

Frame 1185: 1514 bytes on wire (12112 bits), 1514 bytes captured (12112 bits) on interface 0
Ethernet II, Src: Hangzhou_75:c8:f5 (74:25:8a:75:c8:f5), Dst: AsustekC_34:f3:aa (9c:5c:8e:34:f3:aa)
Internet Protocol Version 4, Src: 124.193.229.70, Dst: 10.106.129.54
Transmission Control Protocol, Src Port: 80 (80), Dst Port: 40634 (40634), Seq: 1, Ack: 446, Len: 1460
Hypertext Transfer Protocol
    HTTP/1.1 200 OK\r\n
    Server: QWS\r\n
    Date: Sun, 16 Jul 2017 01:59:43 GMT\r\n
    Content-Type: image/jpeg\r\n
    Content-Length: 358360\r\n
    Connection: keep-alive\r\n
    Expires: Sun, 15 Jul 2018 03:58:04 GMT\r\n
    Cache-Control: max-age=31536000\r\n
    Last-Modified: Sat, 15 Jul 2017 03:39:29 GMT\r\n
    X-Cache: from 127.0.0.1\r\n
    Age: 111\r\n
    Via: http/1.1 QTS (QTS [cRs f ])\r\n
    X-Cache: from 10.10.17.12\r\n
    X-Cache: HIT from 124.193.229.70\r\n
    Accept-Ranges: bytes\r\n
    \r\n
    [HTTP response 1/1]
    [Time since request: 0.005169000 seconds]
    [Request in frame: 1183]
JPEG File Interchange Format

No.     Time               Source                Destination           Protocol Length Info
   1565 01:59:46.277241    10.106.129.54         192.168.81.89         SSDP     480    HTTP/1.1 200 OK 

Frame 1565: 480 bytes on wire (3840 bits), 480 bytes captured (3840 bits) on interface 0
Ethernet II, Src: AsustekC_34:f3:aa (9c:5c:8e:34:f3:aa), Dst: Hangzhou_75:c8:f5 (74:25:8a:75:c8:f5)
Internet Protocol Version 4, Src: 10.106.129.54, Dst: 192.168.81.89
User Datagram Protocol, Src Port: 1900 (1900), Dst Port: 1900 (1900)
Hypertext Transfer Protocol
    HTTP/1.1 200 OK\r\n
    ST: upnp:rootdevice\r\n
    USN: uuid:3ced1185-a624-4fc1-be23-ce28fc76a1b5::upnp:rootdevice\r\n
    Location: http://10.106.129.54:2869/upnphost/udhisapi.dll?content=uuid:3ced1185-a624-4fc1-be23-ce28fc76a1b5\r\n
    OPT:"http://schemas.upnp.org/upnp/1/0/"; ns=01\r\n
    01-NLS: 3fca7df4a9594a241129c800108660dc\r\n
    Cache-Control: max-age=900\r\n
    Server: Microsoft-Windows/10.0 UPnP/1.0 UPnP-Device-Host/1.0\r\n
    Ext: \r\n
    Date: Sun, 16 Jul 2017 01:40:54 GMT\r\n
    \r\n
    [HTTP response 2/52]
    [Prev response in frame: 1147]
    [Next response in frame: 14574]

No.     Time               Source                Destination           Protocol Length Info
   1650 01:59:50.158844    10.106.129.54         124.193.231.165       HTTP     513    GET /common/20150918/movieLib_images/logo-movielib_24.png HTTP/1.1 

Frame 1650: 513 bytes on wire (4104 bits), 513 bytes captured (4104 bits) on interface 0
Ethernet II, Src: AsustekC_34:f3:aa (9c:5c:8e:34:f3:aa), Dst: Hangzhou_75:c8:f5 (74:25:8a:75:c8:f5)
Internet Protocol Version 4, Src: 10.106.129.54, Dst: 124.193.231.165
Transmission Control Protocol, Src Port: 40637 (40637), Dst Port: 80 (80), Seq: 1, Ack: 1, Len: 459
Hypertext Transfer Protocol
    GET /common/20150918/movieLib_images/logo-movielib_24.png HTTP/1.1\r\n
    Host: pic1.qiyipic.com\r\n
    Connection: keep-alive\r\n
    User-Agent: Mozilla/5.0 (Windows NT 10.0; Win64; x64) AppleWebKit/537.36 (KHTML, like Gecko) Chrome/59.0.3071.115 Safari/537.36\r\n
    Accept: image/webp,image/apng,image/*,*/*;q=0.8\r\n
    Referer: http://static.qiyi.com/css/common/v3-movieLib/movieLib_details.css\r\n
    Accept-Encoding: gzip, deflate\r\n
    Accept-Language: en-US,en;q=0.8,zh-TW;q=0.6,zh;q=0.4\r\n
    \r\n
    [Full request URI: http://pic1.qiyipic.com/common/20150918/movieLib_images/logo-movielib_24.png]
    [HTTP request 1/6]
    [Next request in frame: 2185]

No.     Time               Source                Destination           Protocol Length Info
   1809 01:59:56.706316    10.106.129.54         124.192.153.31        HTTP     783    GET /b?t=20&p=10&p1=101&pf=1&block=body&rt=a&r=%E5%A4%A7%E5%A4%B4%E9%83%A8%E6%92%AD%E6%94%BE&rlink=http%3A%2F%2Fwww.iqiyi.com%2Fv_19rrhxx5lg.html&pu=1427323987&u=46484ba4d09a483ea32b78d74a6e505c&jsuid=i1c2hat4chtqogtfq6nc4mxn&ce=5df2e32ab06bc7be8fa4261c13a05064&re=1349*2739&clkx=455&clky=463&mod=cn_s&tm=31548&rtgt=iqiyi&client=web&_=1500170396698 HTTP/1.1 

Frame 1809: 783 bytes on wire (6264 bits), 783 bytes captured (6264 bits) on interface 0
Ethernet II, Src: AsustekC_34:f3:aa (9c:5c:8e:34:f3:aa), Dst: Hangzhou_75:c8:f5 (74:25:8a:75:c8:f5)
Internet Protocol Version 4, Src: 10.106.129.54, Dst: 124.192.153.31
Transmission Control Protocol, Src Port: 40640 (40640), Dst Port: 80 (80), Seq: 1, Ack: 1, Len: 729
Hypertext Transfer Protocol
     [truncated]GET /b?t=20&p=10&p1=101&pf=1&block=body&rt=a&r=%E5%A4%A7%E5%A4%B4%E9%83%A8%E6%92%AD%E6%94%BE&rlink=http%3A%2F%2Fwww.iqiyi.com%2Fv_19rrhxx5lg.html&pu=1427323987&u=46484ba4d09a483ea32b78d74a6e505c&jsuid=i1c2hat4chtqogtfq6nc4mxn&c
    Host: msg.71.am\r\n
    Connection: keep-alive\r\n
    User-Agent: Mozilla/5.0 (Windows NT 10.0; Win64; x64) AppleWebKit/537.36 (KHTML, like Gecko) Chrome/59.0.3071.115 Safari/537.36\r\n
    Accept: image/webp,image/apng,image/*,*/*;q=0.8\r\n
    Referer: http://www.iqiyi.com/lib/m_207733514.html?src=search\r\n
    Accept-Encoding: gzip, deflate\r\n
    Accept-Language: en-US,en;q=0.8,zh-TW;q=0.6,zh;q=0.4\r\n
    \r\n
    [Full request URI [truncated]: http://msg.71.am/b?t=20&p=10&p1=101&pf=1&block=body&rt=a&r=%E5%A4%A7%E5%A4%B4%E9%83%A8%E6%92%AD%E6%94%BE&rlink=http%3A%2F%2Fwww.iqiyi.com%2Fv_19rrhxx5lg.html&pu=1427323987&u=46484ba4d09a483ea32b78d74a6e505c&js]
    [HTTP request 1/13]
    [Response in frame: 1811]
    [Next request in frame: 1815]

No.     Time               Source                Destination           Protocol Length Info
   1811 01:59:56.715418    124.192.153.31        10.106.129.54         HTTP     199    HTTP/1.1 200 OK 

Frame 1811: 199 bytes on wire (1592 bits), 199 bytes captured (1592 bits) on interface 0
Ethernet II, Src: Hangzhou_75:c8:f5 (74:25:8a:75:c8:f5), Dst: AsustekC_34:f3:aa (9c:5c:8e:34:f3:aa)
Internet Protocol Version 4, Src: 124.192.153.31, Dst: 10.106.129.54
Transmission Control Protocol, Src Port: 80 (80), Dst Port: 40640 (40640), Seq: 1, Ack: 730, Len: 145
Hypertext Transfer Protocol
    HTTP/1.1 200 OK\r\n
    Server: nginx/1.8.0\r\n
    Date: Sun, 16 Jul 2017 01:59:54 GMT\r\n
    Content-Type: text/html\r\n
    Content-Length: 0\r\n
    Connection: keep-alive\r\n
    \r\n
    [HTTP response 1/13]
    [Time since request: 0.009102000 seconds]
    [Request in frame: 1809]
    [Next request in frame: 1815]
    [Next response in frame: 1823]

No.     Time               Source                Destination           Protocol Length Info
   1815 01:59:56.752986    10.106.129.54         124.192.153.31        HTTP     562    GET /tmpstats.gif?qpid=207733514&cid=1&ppuid=1427323987&uid=i1c2hat4chtqogtfq6nc4mxn&platform=11&usract=play&type=start20140430 HTTP/1.1 

Frame 1815: 562 bytes on wire (4496 bits), 562 bytes captured (4496 bits) on interface 0
Ethernet II, Src: AsustekC_34:f3:aa (9c:5c:8e:34:f3:aa), Dst: Hangzhou_75:c8:f5 (74:25:8a:75:c8:f5)
Internet Protocol Version 4, Src: 10.106.129.54, Dst: 124.192.153.31
Transmission Control Protocol, Src Port: 40640 (40640), Dst Port: 80 (80), Seq: 730, Ack: 146, Len: 508
Hypertext Transfer Protocol
    GET /tmpstats.gif?qpid=207733514&cid=1&ppuid=1427323987&uid=i1c2hat4chtqogtfq6nc4mxn&platform=11&usract=play&type=start20140430 HTTP/1.1\r\n
    Host: msg.71.am\r\n
    Connection: keep-alive\r\n
    User-Agent: Mozilla/5.0 (Windows NT 10.0; Win64; x64) AppleWebKit/537.36 (KHTML, like Gecko) Chrome/59.0.3071.115 Safari/537.36\r\n
    Accept: image/webp,image/apng,image/*,*/*;q=0.8\r\n
    Referer: http://www.iqiyi.com/lib/m_207733514.html?src=search\r\n
    Accept-Encoding: gzip, deflate\r\n
    Accept-Language: en-US,en;q=0.8,zh-TW;q=0.6,zh;q=0.4\r\n
    \r\n
    [Full request URI: http://msg.71.am/tmpstats.gif?qpid=207733514&cid=1&ppuid=1427323987&uid=i1c2hat4chtqogtfq6nc4mxn&platform=11&usract=play&type=start20140430]
    [HTTP request 2/13]
    [Prev request in frame: 1809]
    [Response in frame: 1823]
    [Next request in frame: 2609]

No.     Time               Source                Destination           Protocol Length Info
   1819 01:59:56.755502    10.106.129.54         124.193.229.74        HTTP     1314   GET /v_19rrhxx5lg.html HTTP/1.1 

Frame 1819: 1314 bytes on wire (10512 bits), 1314 bytes captured (10512 bits) on interface 0
Ethernet II, Src: AsustekC_34:f3:aa (9c:5c:8e:34:f3:aa), Dst: Hangzhou_75:c8:f5 (74:25:8a:75:c8:f5)
Internet Protocol Version 4, Src: 10.106.129.54, Dst: 124.193.229.74
Transmission Control Protocol, Src Port: 40643 (40643), Dst Port: 80 (80), Seq: 1461, Ack: 1, Len: 1260
[2 Reassembled TCP Segments (2720 bytes): #1818(1460), #1819(1260)]
Hypertext Transfer Protocol
    GET /v_19rrhxx5lg.html HTTP/1.1\r\n
    Host: www.iqiyi.com\r\n
    Connection: keep-alive\r\n
    Upgrade-Insecure-Requests: 1\r\n
    User-Agent: Mozilla/5.0 (Windows NT 10.0; Win64; x64) AppleWebKit/537.36 (KHTML, like Gecko) Chrome/59.0.3071.115 Safari/537.36\r\n
    Accept: text/html,application/xhtml+xml,application/xml;q=0.9,image/webp,image/apng,*/*;q=0.8\r\n
    Referer: http://www.iqiyi.com/lib/m_207733514.html?src=search\r\n
    Accept-Encoding: gzip, deflate\r\n
    Accept-Language: en-US,en;q=0.8,zh-TW;q=0.6,zh;q=0.4\r\n
     [truncated]Cookie: QC005=46484ba4d09a483ea32b78d74a6e505c; __uuid=73affa95-ea22-4f2e-9268-e2e73c490c6f; P00004=1929324555.1498821483.447e84bfe3; QIYUECK=qy_pc_bc5060f111fb494892ae0a8b355afea4; QC911=%2Ca%2C; QC008=1487765188.1498820504.14
    \r\n
    [Full request URI: http://www.iqiyi.com/v_19rrhxx5lg.html]
    [HTTP request 1/5]
    [Response in frame: 1831]
    [Next request in frame: 2188]

No.     Time               Source                Destination           Protocol Length Info
   1823 01:59:56.758693    124.192.153.31        10.106.129.54         HTTP     199    HTTP/1.1 200 OK 

Frame 1823: 199 bytes on wire (1592 bits), 199 bytes captured (1592 bits) on interface 0
Ethernet II, Src: Hangzhou_75:c8:f5 (74:25:8a:75:c8:f5), Dst: AsustekC_34:f3:aa (9c:5c:8e:34:f3:aa)
Internet Protocol Version 4, Src: 124.192.153.31, Dst: 10.106.129.54
Transmission Control Protocol, Src Port: 80 (80), Dst Port: 40640 (40640), Seq: 146, Ack: 1238, Len: 145
Hypertext Transfer Protocol
    HTTP/1.1 200 OK\r\n
    Server: nginx/1.8.0\r\n
    Date: Sun, 16 Jul 2017 01:59:54 GMT\r\n
    Content-Type: image/gif\r\n
    Content-Length: 0\r\n
    Connection: keep-alive\r\n
    \r\n
    [HTTP response 2/13]
    [Time since request: 0.005707000 seconds]
    [Prev request in frame: 1809]
    [Prev response in frame: 1811]
    [Request in frame: 1815]
    [Next request in frame: 2609]
    [Next response in frame: 2610]

No.     Time               Source                Destination           Protocol Length Info
   1826 01:59:56.759137    10.106.129.54         123.125.111.85        HTTP     1430   GET /apis/movie/loginPlayRecord/add?qipuId=207733514&videoName=%E8%BF%B7%E5%A4%B1%E4%B8%9C%E4%BA%AC&videoUrl=http%3A%2F%2Fwww.iqiyi.com%2Flib%2Fm_207733514.html%3Fsrc%3Dsearch&channelId=1&showInfo=%E7%94%B5%E5%BD%B1&agentType=1&uid=1427323987&callback=window.Q.__callbacks__.cbybrzot HTTP/1.1 

Frame 1826: 1430 bytes on wire (11440 bits), 1430 bytes captured (11440 bits) on interface 0
Ethernet II, Src: AsustekC_34:f3:aa (9c:5c:8e:34:f3:aa), Dst: Hangzhou_75:c8:f5 (74:25:8a:75:c8:f5)
Internet Protocol Version 4, Src: 10.106.129.54, Dst: 123.125.111.85
Transmission Control Protocol, Src Port: 40642 (40642), Dst Port: 80 (80), Seq: 1449, Ack: 1, Len: 1376
[2 Reassembled TCP Segments (2824 bytes): #1825(1448), #1826(1376)]
Hypertext Transfer Protocol
     [truncated]GET /apis/movie/loginPlayRecord/add?qipuId=207733514&videoName=%E8%BF%B7%E5%A4%B1%E4%B8%9C%E4%BA%AC&videoUrl=http%3A%2F%2Fwww.iqiyi.com%2Flib%2Fm_207733514.html%3Fsrc%3Dsearch&channelId=1&showInfo=%E7%94%B5%E5%BD%B1&agentType=1
    Host: subscription.iqiyi.com\r\n
    Connection: keep-alive\r\n
    User-Agent: Mozilla/5.0 (Windows NT 10.0; Win64; x64) AppleWebKit/537.36 (KHTML, like Gecko) Chrome/59.0.3071.115 Safari/537.36\r\n
    Accept: */*\r\n
    Referer: http://www.iqiyi.com/lib/m_207733514.html?src=search\r\n
    Accept-Encoding: gzip, deflate\r\n
    Accept-Language: en-US,en;q=0.8,zh-TW;q=0.6,zh;q=0.4\r\n
     [truncated]Cookie: QC005=46484ba4d09a483ea32b78d74a6e505c; P00004=1929324555.1498821483.447e84bfe3; QIYUECK=qy_pc_bc5060f111fb494892ae0a8b355afea4; QC911=%2Ca%2C; QC008=1487765188.1498820504.1499998100.9; QP001=1; T00700=EgcIkMDtIRABEgcIz
    \r\n
    [Full request URI [truncated]: http://subscription.iqiyi.com/apis/movie/loginPlayRecord/add?qipuId=207733514&videoName=%E8%BF%B7%E5%A4%B1%E4%B8%9C%E4%BA%AC&videoUrl=http%3A%2F%2Fwww.iqiyi.com%2Flib%2Fm_207733514.html%3Fsrc%3Dsearch&channelI]
    [HTTP request 1/3]
    [Response in frame: 1837]
    [Next request in frame: 5347]

No.     Time               Source                Destination           Protocol Length Info
   1831 01:59:56.772748    124.193.229.74        10.106.129.54         HTTP     1514   HTTP/1.1 200 OK [Malformed Packet]

Frame 1831: 1514 bytes on wire (12112 bits), 1514 bytes captured (12112 bits) on interface 0
Ethernet II, Src: Hangzhou_75:c8:f5 (74:25:8a:75:c8:f5), Dst: AsustekC_34:f3:aa (9c:5c:8e:34:f3:aa)
Internet Protocol Version 4, Src: 124.193.229.74, Dst: 10.106.129.54
Transmission Control Protocol, Src Port: 80 (80), Dst Port: 40643 (40643), Seq: 1, Ack: 2721, Len: 1460
Hypertext Transfer Protocol
    HTTP/1.1 200 OK\r\n
    Date: Sun, 16 Jul 2017 01:59:54 GMT\r\n
    Content-Type: text/html\r\n
    Transfer-Encoding: chunked\r\n
    Connection: keep-alive\r\n
    Vary: Accept-Encoding\r\n
    Expires: Sun, 16 Jul 2017 02:04:54 GMT\r\n
    Cache-Control: max-age=300\r\n
    Last-Modified: Sat, 15 Jul 2017 19:16:45 GMT\r\n
    Server: Apache 1.3.29\r\n
    X-Cache: MISS from 10.10.131.242\r\n
    Content-Encoding: gzip\r\n
    X-Cache: MISS from 124.193.229.74\r\n
    \r\n
    [HTTP response 1/5]
    [Time since request: 0.017246000 seconds]
    [Request in frame: 1819]
    [Next request in frame: 2188]
    [Next response in frame: 2205]
    HTTP chunked response
[Malformed Packet: HTTP]

No.     Time               Source                Destination           Protocol Length Info
   1837 01:59:56.776855    123.125.111.85        10.106.129.54         HTTP     331    HTTP/1.1 200 OK  (text/plain)

Frame 1837: 331 bytes on wire (2648 bits), 331 bytes captured (2648 bits) on interface 0
Ethernet II, Src: Hangzhou_75:c8:f5 (74:25:8a:75:c8:f5), Dst: AsustekC_34:f3:aa (9c:5c:8e:34:f3:aa)
Internet Protocol Version 4, Src: 123.125.111.85, Dst: 10.106.129.54
Transmission Control Protocol, Src Port: 80 (80), Dst Port: 40642 (40642), Seq: 1, Ack: 2825, Len: 277
Hypertext Transfer Protocol
    HTTP/1.1 200 OK\r\n
    Server: Tengine\r\n
    Date: Sun, 16 Jul 2017 01:59:54 GMT\r\n
    Content-Type: text/plain;charset=UTF-8\r\n
    Content-Length: 97\r\n
    Connection: keep-alive\r\n
    Accept-Charset: utf-8\r\n
    \r\n
    [HTTP response 1/3]
    [Time since request: 0.017718000 seconds]
    [Request in frame: 1826]
    [Next request in frame: 5347]
    [Next response in frame: 5383]
Line-based text data: text/plain

No.     Time               Source                Destination           Protocol Length Info
   1843 01:59:56.797223    10.106.129.54         124.193.231.139       HTTP     447    GET /css/common/v3-basic/v3-basic_new.css HTTP/1.1 

Frame 1843: 447 bytes on wire (3576 bits), 447 bytes captured (3576 bits) on interface 0
