No.     Time               Source                Destination           Protocol Length Info
     22 08:53:18.171477    10.106.129.54         124.193.229.70        HTTP     481    GET /common/fix/site/index-arrR-v.png HTTP/1.1 

Frame 22: 481 bytes on wire (3848 bits), 481 bytes captured (3848 bits) on interface 0
Ethernet II, Src: AsustekC_34:f3:aa (9c:5c:8e:34:f3:aa), Dst: Hangzhou_75:c8:f5 (74:25:8a:75:c8:f5)
Internet Protocol Version 4, Src: 10.106.129.54, Dst: 124.193.229.70
Transmission Control Protocol, Src Port: 57400 (57400), Dst Port: 80 (80), Seq: 1, Ack: 1, Len: 427
Hypertext Transfer Protocol
    GET /common/fix/site/index-arrR-v.png HTTP/1.1\r\n
    Host: www.qiyipic.com\r\n
    Connection: keep-alive\r\n
    User-Agent: Mozilla/5.0 (X11; Linux x86_64) AppleWebKit/537.36 (KHTML, like Gecko) Chrome/59.0.3071.104 Safari/537.36\r\n
    Accept: image/webp,image/apng,image/*,*/*;q=0.8\r\n
    Referer: http://static.iqiyi.com/css/common/v3-index-iqiyi/index-iqiyi.css\r\n
    Accept-Encoding: gzip, deflate\r\n
    Accept-Language: en-US,en;q=0.8,zh-TW;q=0.6,zh;q=0.4\r\n
    \r\n
    [Full request URI: http://www.qiyipic.com/common/fix/site/index-arrR-v.png]
    [HTTP request 1/2]
    [Response in frame: 33]
    [Next request in frame: 40]

No.     Time               Source                Destination           Protocol Length Info
     33 08:53:18.175819    124.193.229.70        10.106.129.54         HTTP     866    HTTP/1.1 200 OK  (PNG)

Frame 33: 866 bytes on wire (6928 bits), 866 bytes captured (6928 bits) on interface 0
Ethernet II, Src: Hangzhou_75:c8:f5 (74:25:8a:75:c8:f5), Dst: AsustekC_34:f3:aa (9c:5c:8e:34:f3:aa)
Internet Protocol Version 4, Src: 124.193.229.70, Dst: 10.106.129.54
Transmission Control Protocol, Src Port: 80 (80), Dst Port: 57400 (57400), Seq: 1, Ack: 428, Len: 812
Hypertext Transfer Protocol
    HTTP/1.1 200 OK\r\n
    Server: QWS\r\n
    Date: Wed, 28 Jun 2017 08:53:18 GMT\r\n
    Content-Type: image/png\r\n
    Content-Length: 465\r\n
    Connection: keep-alive\r\n
    Expires: Tue, 03 Oct 2017 20:48:21 GMT\r\n
    Cache-Control: max-age=31536000\r\n
    Last-Modified: Fri, 04 Mar 2016 05:15:37 GMT\r\n
    X-Cache: HIT from 10.10.131.242\r\n
    X-Cache: HIT from 124.193.229.70\r\n
    Accept-Ranges: bytes\r\n
    \r\n
    [HTTP response 1/2]
    [Time since request: 0.004342000 seconds]
    [Request in frame: 22]
    [Next request in frame: 40]
    [Next response in frame: 41]
Portable Network Graphics

No.     Time               Source                Destination           Protocol Length Info
     40 08:53:18.235476    10.106.129.54         124.193.229.70        HTTP     481    GET /common/fix/site/index-arrL-v.png HTTP/1.1 

Frame 40: 481 bytes on wire (3848 bits), 481 bytes captured (3848 bits) on interface 0
Ethernet II, Src: AsustekC_34:f3:aa (9c:5c:8e:34:f3:aa), Dst: Hangzhou_75:c8:f5 (74:25:8a:75:c8:f5)
Internet Protocol Version 4, Src: 10.106.129.54, Dst: 124.193.229.70
Transmission Control Protocol, Src Port: 57400 (57400), Dst Port: 80 (80), Seq: 428, Ack: 813, Len: 427
Hypertext Transfer Protocol
    GET /common/fix/site/index-arrL-v.png HTTP/1.1\r\n
    Host: www.qiyipic.com\r\n
    Connection: keep-alive\r\n
    User-Agent: Mozilla/5.0 (X11; Linux x86_64) AppleWebKit/537.36 (KHTML, like Gecko) Chrome/59.0.3071.104 Safari/537.36\r\n
    Accept: image/webp,image/apng,image/*,*/*;q=0.8\r\n
    Referer: http://static.iqiyi.com/css/common/v3-index-iqiyi/index-iqiyi.css\r\n
    Accept-Encoding: gzip, deflate\r\n
    Accept-Language: en-US,en;q=0.8,zh-TW;q=0.6,zh;q=0.4\r\n
    \r\n
    [Full request URI: http://www.qiyipic.com/common/fix/site/index-arrL-v.png]
    [HTTP request 2/2]
    [Prev request in frame: 22]
    [Response in frame: 41]

No.     Time               Source                Destination           Protocol Length Info
     41 08:53:18.241293    124.193.229.70        10.106.129.54         HTTP     872    HTTP/1.1 200 OK  (PNG)

Frame 41: 872 bytes on wire (6976 bits), 872 bytes captured (6976 bits) on interface 0
Ethernet II, Src: Hangzhou_75:c8:f5 (74:25:8a:75:c8:f5), Dst: AsustekC_34:f3:aa (9c:5c:8e:34:f3:aa)
Internet Protocol Version 4, Src: 124.193.229.70, Dst: 10.106.129.54
Transmission Control Protocol, Src Port: 80 (80), Dst Port: 57400 (57400), Seq: 813, Ack: 855, Len: 818
Hypertext Transfer Protocol
    HTTP/1.1 200 OK\r\n
    Server: QWS\r\n
    Date: Wed, 28 Jun 2017 08:53:18 GMT\r\n
    Content-Type: image/png\r\n
    Content-Length: 471\r\n
    Connection: keep-alive\r\n
    Expires: Tue, 10 Oct 2017 21:06:59 GMT\r\n
    Cache-Control: max-age=31536000\r\n
    Last-Modified: Fri, 04 Mar 2016 05:15:37 GMT\r\n
    X-Cache: HIT from 10.10.131.240\r\n
    X-Cache: HIT from 124.193.229.70\r\n
    Accept-Ranges: bytes\r\n
    \r\n
    [HTTP response 2/2]
    [Time since request: 0.005817000 seconds]
    [Prev request in frame: 22]
    [Prev response in frame: 33]
    [Request in frame: 40]
Portable Network Graphics

No.     Time               Source                Destination           Protocol Length Info
     91 08:53:19.788752    10.106.129.54         124.192.153.31        HTTP     804    GET /b?t=20&p=10&p1=101&pf=1&block=D&rt=e&r=%E5%8C%97%E5%A4%A7%E5%A5%B3%E7%A1%95%E5%A3%AB%E5%9C%A8%E7%BE%8E%E5%A4%B1%E8%81%9419%E5%A4%A9%20%E8%AD%A6%E6%96%B9%E5%B7%B2%E9%94%81%E5%AE%9A%E6%B6%89%E6%A1%88%E8%BD%A6%E8%BE%86&rlink=&pu=&u=e8c09fbe7d54fb987314ae319820248a&jsuid=s4vwt4ttoduoan3z5v1ja5u6&ce=fb41dc9ae25d97e92e38fa73e24c8c22&re=1306*8287&clkx=150&clky=715&mod=cn_s&tm=170434&rseat=f3-1&_=1498639999782 HTTP/1.1 

Frame 91: 804 bytes on wire (6432 bits), 804 bytes captured (6432 bits) on interface 0
Ethernet II, Src: AsustekC_34:f3:aa (9c:5c:8e:34:f3:aa), Dst: Hangzhou_75:c8:f5 (74:25:8a:75:c8:f5)
Internet Protocol Version 4, Src: 10.106.129.54, Dst: 124.192.153.31
Transmission Control Protocol, Src Port: 43346 (43346), Dst Port: 80 (80), Seq: 1, Ack: 1, Len: 750
Hypertext Transfer Protocol
     [truncated]GET /b?t=20&p=10&p1=101&pf=1&block=D&rt=e&r=%E5%8C%97%E5%A4%A7%E5%A5%B3%E7%A1%95%E5%A3%AB%E5%9C%A8%E7%BE%8E%E5%A4%B1%E8%81%9419%E5%A4%A9%20%E8%AD%A6%E6%96%B9%E5%B7%B2%E9%94%81%E5%AE%9A%E6%B6%89%E6%A1%88%E8%BD%A6%E8%BE%86&rlink=
    Host: msg.71.am\r\n
    Connection: keep-alive\r\n
    User-Agent: Mozilla/5.0 (X11; Linux x86_64) AppleWebKit/537.36 (KHTML, like Gecko) Chrome/59.0.3071.104 Safari/537.36\r\n
    Accept: image/webp,image/apng,image/*,*/*;q=0.8\r\n
    Referer: http://www.iqiyi.com/\r\n
    Accept-Encoding: gzip, deflate\r\n
    Accept-Language: en-US,en;q=0.8,zh-TW;q=0.6,zh;q=0.4\r\n
    \r\n
    [Full request URI [truncated]: http://msg.71.am/b?t=20&p=10&p1=101&pf=1&block=D&rt=e&r=%E5%8C%97%E5%A4%A7%E5%A5%B3%E7%A1%95%E5%A3%AB%E5%9C%A8%E7%BE%8E%E5%A4%B1%E8%81%9419%E5%A4%A9%20%E8%AD%A6%E6%96%B9%E5%B7%B2%E9%94%81%E5%AE%9A%E6%B6%89%E6%]
    [HTTP request 1/24]
    [Response in frame: 93]
    [Next request in frame: 110]

No.     Time               Source                Destination           Protocol Length Info
     93 08:53:19.792934    124.192.153.31        10.106.129.54         HTTP     199    HTTP/1.1 200 OK 

Frame 93: 199 bytes on wire (1592 bits), 199 bytes captured (1592 bits) on interface 0
Ethernet II, Src: Hangzhou_75:c8:f5 (74:25:8a:75:c8:f5), Dst: AsustekC_34:f3:aa (9c:5c:8e:34:f3:aa)
Internet Protocol Version 4, Src: 124.192.153.31, Dst: 10.106.129.54
Transmission Control Protocol, Src Port: 80 (80), Dst Port: 43346 (43346), Seq: 1, Ack: 751, Len: 145
Hypertext Transfer Protocol
    HTTP/1.1 200 OK\r\n
    Server: nginx/1.8.0\r\n
    Date: Wed, 28 Jun 2017 08:53:19 GMT\r\n
    Content-Type: text/html\r\n
    Content-Length: 0\r\n
    Connection: keep-alive\r\n
    \r\n
    [HTTP response 1/24]
    [Time since request: 0.004182000 seconds]
    [Request in frame: 91]
    [Next request in frame: 110]
    [Next response in frame: 112]

No.     Time               Source                Destination           Protocol Length Info
     99 08:53:19.963282    10.106.129.54         202.108.23.152        HTTP     1018   GET /hm.gif?cc=0&ck=1&cl=24-bit&ds=1366x768&ep=%5B%7Bx%3A-510.5%2Cy%3A715%2Ct%3Aa%2Cu%3Ahttp%253A%252F%252Fwww.iqiyi.com%252Fv_19rr7t3118.html%7D%5D&et=2&fl=26.0&ja=0&ln=zh-cn&lo=0&nv=1&rnd=349070787&si=53b7374a63c37483e5dd97d78d9bb36e&st=3&su=https%3A%2F%2Fwww.baidu.com%2Flink%3Furl%3D3UWAzf35gFxSMN0zOKptkvWc8DGL_F4K2rZJr4sbVaK%26wd%3D%26eqid%3D9316040300014b630000000359536dce&v=1.2.14&lv=1 HTTP/1.1 

Frame 99: 1018 bytes on wire (8144 bits), 1018 bytes captured (8144 bits) on interface 0
Ethernet II, Src: AsustekC_34:f3:aa (9c:5c:8e:34:f3:aa), Dst: Hangzhou_75:c8:f5 (74:25:8a:75:c8:f5)
Internet Protocol Version 4, Src: 10.106.129.54, Dst: 202.108.23.152
Transmission Control Protocol, Src Port: 58848 (58848), Dst Port: 80 (80), Seq: 1, Ack: 1, Len: 964
Hypertext Transfer Protocol
     [truncated]GET /hm.gif?cc=0&ck=1&cl=24-bit&ds=1366x768&ep=%5B%7Bx%3A-510.5%2Cy%3A715%2Ct%3Aa%2Cu%3Ahttp%253A%252F%252Fwww.iqiyi.com%252Fv_19rr7t3118.html%7D%5D&et=2&fl=26.0&ja=0&ln=zh-cn&lo=0&nv=1&rnd=349070787&si=53b7374a63c37483e5dd97d7
    Host: hm.baidu.com\r\n
    Connection: keep-alive\r\n
    User-Agent: Mozilla/5.0 (X11; Linux x86_64) AppleWebKit/537.36 (KHTML, like Gecko) Chrome/59.0.3071.104 Safari/537.36\r\n
    Accept: image/webp,image/apng,image/*,*/*;q=0.8\r\n
    Referer: http://www.iqiyi.com/\r\n
    Accept-Encoding: gzip, deflate\r\n
    Accept-Language: en-US,en;q=0.8,zh-TW;q=0.6,zh;q=0.4\r\n
    Cookie: PSTM=1482159164; BAIDUID=55E54FEF557AE260A52AC1F4D226E27A:FG=1; BIDUPSID=55E54FEF557AE260A52AC1F4D226E27A; HMACCOUNT=604266149DC2FA00; BDORZ=B490B5EBF6F3CD402E515D22BCDA1598; PSINO=1; H_PS_PSSID=1447_21119_23632_20928\r\n
    \r\n
    [Full request URI [truncated]: http://hm.baidu.com/hm.gif?cc=0&ck=1&cl=24-bit&ds=1366x768&ep=%5B%7Bx%3A-510.5%2Cy%3A715%2Ct%3Aa%2Cu%3Ahttp%253A%252F%252Fwww.iqiyi.com%252Fv_19rr7t3118.html%7D%5D&et=2&fl=26.0&ja=0&ln=zh-cn&lo=0&nv=1&rnd=3490]
    [HTTP request 1/3]
    [Response in frame: 101]
    [Next request in frame: 145]

No.     Time               Source                Destination           Protocol Length Info
    101 08:53:19.995940    202.108.23.152        10.106.129.54         HTTP     310    HTTP/1.1 200 OK  (GIF89a)

Frame 101: 310 bytes on wire (2480 bits), 310 bytes captured (2480 bits) on interface 0
Ethernet II, Src: Hangzhou_75:c8:f5 (74:25:8a:75:c8:f5), Dst: AsustekC_34:f3:aa (9c:5c:8e:34:f3:aa)
Internet Protocol Version 4, Src: 202.108.23.152, Dst: 10.106.129.54
Transmission Control Protocol, Src Port: 80 (80), Dst Port: 58848 (58848), Seq: 1, Ack: 965, Len: 256
Hypertext Transfer Protocol
    HTTP/1.1 200 OK\r\n
    Cache-Control: private, max-age=0, no-cache\r\n
    Content-Length: 43\r\n
    Content-Type: image/gif\r\n
    Date: Wed, 28 Jun 2017 08:53:19 GMT\r\n
    Pragma: no-cache\r\n
    Server: apache\r\n
    X-Content-Type-Options: nosniff\r\n
    \r\n
    [HTTP response 1/3]
    [Time since request: 0.032658000 seconds]
    [Request in frame: 99]
    [Next request in frame: 145]
    [Next response in frame: 147]
Compuserve GIF, Version: GIF89a

No.     Time               Source                Destination           Protocol Length Info
    110 08:53:20.264681    10.106.129.54         124.192.153.31        HTTP     705    GET /tmpstats.gif?type=jspfmc140109&pla=11&uid=e8c09fbe7d54fb987314ae319820248a&ppuid=&brs=CHROME&pgtype=play&purl=http:%2F%2Fwww.iqiyi.com%2Fv_19rr7t3118.html&cid=25&tmplt=&tm1=155,0&tm13=499&tm11=308,497&tm3=824,516&tm7=862,500&tm8=18,1363&tm9=108,1400&tm10=23,1508&tm6=3826,0&_=1498640000258 HTTP/1.1 

Frame 110: 705 bytes on wire (5640 bits), 705 bytes captured (5640 bits) on interface 0
Ethernet II, Src: AsustekC_34:f3:aa (9c:5c:8e:34:f3:aa), Dst: Hangzhou_75:c8:f5 (74:25:8a:75:c8:f5)
Internet Protocol Version 4, Src: 10.106.129.54, Dst: 124.192.153.31
Transmission Control Protocol, Src Port: 43346 (43346), Dst Port: 80 (80), Seq: 751, Ack: 146, Len: 651
Hypertext Transfer Protocol
     [truncated]GET /tmpstats.gif?type=jspfmc140109&pla=11&uid=e8c09fbe7d54fb987314ae319820248a&ppuid=&brs=CHROME&pgtype=play&purl=http:%2F%2Fwww.iqiyi.com%2Fv_19rr7t3118.html&cid=25&tmplt=&tm1=155,0&tm13=499&tm11=308,497&tm3=824,516&tm7=862,5
    Host: msg.71.am\r\n
    Connection: keep-alive\r\n
    User-Agent: Mozilla/5.0 (X11; Linux x86_64) AppleWebKit/537.36 (KHTML, like Gecko) Chrome/59.0.3071.104 Safari/537.36\r\n
    Accept: image/webp,image/apng,image/*,*/*;q=0.8\r\n
    Referer: http://www.iqiyi.com/v_19rr7t3118.html\r\n
    Accept-Encoding: gzip, deflate\r\n
    Accept-Language: en-US,en;q=0.8,zh-TW;q=0.6,zh;q=0.4\r\n
    \r\n
    [Full request URI [truncated]: http://msg.71.am/tmpstats.gif?type=jspfmc140109&pla=11&uid=e8c09fbe7d54fb987314ae319820248a&ppuid=&brs=CHROME&pgtype=play&purl=http:%2F%2Fwww.iqiyi.com%2Fv_19rr7t3118.html&cid=25&tmplt=&tm1=155,0&tm13=499&tm11]
    [HTTP request 2/24]
    [Prev request in frame: 91]
    [Response in frame: 112]
    [Next request in frame: 135]

No.     Time               Source                Destination           Protocol Length Info
    112 08:53:20.269264    124.192.153.31        10.106.129.54         HTTP     199    HTTP/1.1 200 OK 

Frame 112: 199 bytes on wire (1592 bits), 199 bytes captured (1592 bits) on interface 0
Ethernet II, Src: Hangzhou_75:c8:f5 (74:25:8a:75:c8:f5), Dst: AsustekC_34:f3:aa (9c:5c:8e:34:f3:aa)
Internet Protocol Version 4, Src: 124.192.153.31, Dst: 10.106.129.54
Transmission Control Protocol, Src Port: 80 (80), Dst Port: 43346 (43346), Seq: 146, Ack: 1402, Len: 145
Hypertext Transfer Protocol
    HTTP/1.1 200 OK\r\n
    Server: nginx/1.8.0\r\n
    Date: Wed, 28 Jun 2017 08:53:20 GMT\r\n
    Content-Type: image/gif\r\n
    Content-Length: 0\r\n
    Connection: keep-alive\r\n
    \r\n
    [HTTP response 2/24]
    [Time since request: 0.004583000 seconds]
    [Prev request in frame: 91]
    [Prev response in frame: 93]
    [Request in frame: 110]
    [Next request in frame: 135]
    [Next response in frame: 136]

No.     Time               Source                Destination           Protocol Length Info
    116 08:53:20.350267    10.106.129.54         123.125.111.70        HTTP     93     GET /apis/urc/getvplay?tvId=710490000&agent_type=1&ckuid=s4vwt4ttoduoan3z5v1ja5u6&callback=QiyiPlayerLoader.__callbacks__.Qce18f2f4398b5d6744875f62165039a9 HTTP/1.1 

Frame 116: 93 bytes on wire (744 bits), 93 bytes captured (744 bits) on interface 0
Ethernet II, Src: AsustekC_34:f3:aa (9c:5c:8e:34:f3:aa), Dst: Hangzhou_75:c8:f5 (74:25:8a:75:c8:f5)
Internet Protocol Version 4, Src: 10.106.129.54, Dst: 123.125.111.70
Transmission Control Protocol, Src Port: 37666 (37666), Dst Port: 80 (80), Seq: 1449, Ack: 1, Len: 39
[2 Reassembled TCP Segments (1487 bytes): #115(1448), #116(39)]
Hypertext Transfer Protocol
    GET /apis/urc/getvplay?tvId=710490000&agent_type=1&ckuid=s4vwt4ttoduoan3z5v1ja5u6&callback=QiyiPlayerLoader.__callbacks__.Qce18f2f4398b5d6744875f62165039a9 HTTP/1.1\r\n
    Host: nl.rcd.iqiyi.com\r\n
    Connection: keep-alive\r\n
    User-Agent: Mozilla/5.0 (X11; Linux x86_64) AppleWebKit/537.36 (KHTML, like Gecko) Chrome/59.0.3071.104 Safari/537.36\r\n
    Accept: */*\r\n
    Referer: http://www.iqiyi.com/v_19rr7t3118.html\r\n
    Accept-Encoding: gzip, deflate\r\n
    Accept-Language: en-US,en;q=0.8,zh-TW;q=0.6,zh;q=0.4\r\n
     [truncated]Cookie: QC008=1498639831.1498639831.1498639831.1; QC005=e8c09fbe7d54fb987314ae319820248a; QC001=1; QILINPUSH=1; T00700=EgcIz7-tIRABEgcI4b-tIRABEgcIhcDtIRABEgcIkMDtIRABEgcI0b-tIRACEgcI1L-tIRABEgcIwMDtIRAB; Hm_lvt_53b7374a63c3748
    \r\n
    [Full request URI: http://nl.rcd.iqiyi.com/apis/urc/getvplay?tvId=710490000&agent_type=1&ckuid=s4vwt4ttoduoan3z5v1ja5u6&callback=QiyiPlayerLoader.__callbacks__.Qce18f2f4398b5d6744875f62165039a9]
    [HTTP request 1/1]
    [Response in frame: 124]

No.     Time               Source                Destination           Protocol Length Info
    120 08:53:20.356902    10.106.129.54         124.192.153.13        HTTP     514    GET /jp/vi/710490000/517ae127bec48788916fb3e1f54ae96b/?callback=QiyiPlayerLoader.__callbacks__.Qa8ca23b7ef8fc76ed555aa1f4ab42d4e HTTP/1.1 

Frame 120: 514 bytes on wire (4112 bits), 514 bytes captured (4112 bits) on interface 0
Ethernet II, Src: AsustekC_34:f3:aa (9c:5c:8e:34:f3:aa), Dst: Hangzhou_75:c8:f5 (74:25:8a:75:c8:f5)
Internet Protocol Version 4, Src: 10.106.129.54, Dst: 124.192.153.13
Transmission Control Protocol, Src Port: 37604 (37604), Dst Port: 80 (80), Seq: 1, Ack: 1, Len: 460
Hypertext Transfer Protocol
    GET /jp/vi/710490000/517ae127bec48788916fb3e1f54ae96b/?callback=QiyiPlayerLoader.__callbacks__.Qa8ca23b7ef8fc76ed555aa1f4ab42d4e HTTP/1.1\r\n
    Host: cache.video.qiyi.com\r\n
    Connection: keep-alive\r\n
    User-Agent: Mozilla/5.0 (X11; Linux x86_64) AppleWebKit/537.36 (KHTML, like Gecko) Chrome/59.0.3071.104 Safari/537.36\r\n
    Accept: */*\r\n
    Referer: http://www.iqiyi.com/v_19rr7t3118.html\r\n
    Accept-Encoding: gzip, deflate\r\n
    Accept-Language: en-US,en;q=0.8,zh-TW;q=0.6,zh;q=0.4\r\n
    \r\n
    [Full request URI: http://cache.video.qiyi.com/jp/vi/710490000/517ae127bec48788916fb3e1f54ae96b/?callback=QiyiPlayerLoader.__callbacks__.Qa8ca23b7ef8fc76ed555aa1f4ab42d4e]
    [HTTP request 1/2]
    [Response in frame: 126]
    [Next request in frame: 2884]

No.     Time               Source                Destination           Protocol Length Info
    124 08:53:20.363637    123.125.111.70        10.106.129.54         HTTP     415    HTTP/1.1 200 OK  (text/plain)

Frame 124: 415 bytes on wire (3320 bits), 415 bytes captured (3320 bits) on interface 0
Ethernet II, Src: Hangzhou_75:c8:f5 (74:25:8a:75:c8:f5), Dst: AsustekC_34:f3:aa (9c:5c:8e:34:f3:aa)
Internet Protocol Version 4, Src: 123.125.111.70, Dst: 10.106.129.54
Transmission Control Protocol, Src Port: 80 (80), Dst Port: 37666 (37666), Seq: 1, Ack: 1488, Len: 361
Hypertext Transfer Protocol
    HTTP/1.1 200 OK\r\n
    Date: Wed, 28 Jun 2017 08:53:20 GMT\r\n
    Content-Type: text/plain;charset=UTF-8\r\n
    Content-Length: 180\r\n
    Connection: keep-alive\r\n
    Access-Control-Allow-Credentials: true\r\n
    \r\n
    [HTTP response 1/1]
    [Time since request: 0.013370000 seconds]
    [Request in frame: 116]
Line-based text data: text/plain

No.     Time               Source                Destination           Protocol Length Info
    126 08:53:20.364311    124.192.153.13        10.106.129.54         HTTP     1777   HTTP/1.1 200 OK  (application/json)

Frame 126: 1777 bytes on wire (14216 bits), 1777 bytes captured (14216 bits) on interface 0
Ethernet II, Src: Hangzhou_75:c8:f5 (74:25:8a:75:c8:f5), Dst: AsustekC_34:f3:aa (9c:5c:8e:34:f3:aa)
Internet Protocol Version 4, Src: 124.192.153.13, Dst: 10.106.129.54
Transmission Control Protocol, Src Port: 80 (80), Dst Port: 37604 (37604), Seq: 1, Ack: 461, Len: 1723
Hypertext Transfer Protocol
    HTTP/1.1 200 OK\r\n
    Server: openresty\r\n
    Date: Wed, 28 Jun 2017 08:53:20 GMT\r\n
    Content-Type: application/json; charset=utf-8\r\n
    Transfer-Encoding: chunked\r\n
    Connection: keep-alive\r\n
    Cache-Control: no-cache\r\n
    Content-Encoding: gzip\r\n
    \r\n
    [HTTP response 1/2]
    [Time since request: 0.007409000 seconds]
    [Request in frame: 120]
    [Next request in frame: 2884]
    [Next response in frame: 2885]
    HTTP chunked response
    Content-encoded entity body (gzip): 1488 bytes -> 3208 bytes
JavaScript Object Notation: application/json
Line-based text data: application/json

No.     Time               Source                Destination           Protocol Length Info
    132 08:53:20.404090    10.106.129.54         124.192.153.13        HTTP     327    GET /jp/vms?tvId=710490000&vid=517ae127bec48788916fb3e1f54ae96b&key=fvip&src=01010031010000000000&vinfo=1&tm=1498640000349&puid=&qyid=s4vwt4ttoduoan3z5v1ja5u6&authKey=a774320f084d42dea25bf04d48209cf0&um=0&pf=b6c13e26323c537d&thdk=&thdt=&rs=1&k_tag=1&qdv=1&tn=0.38174899900550585&callback=QiyiPlayerLoader.__callbacks__.Q14a6169c4f9beca044569ab0faaf8da9&vf=8202ac983a8e560c5169ef4e302240ab HTTP/1.1 

Frame 132: 327 bytes on wire (2616 bits), 327 bytes captured (2616 bits) on interface 0
Ethernet II, Src: AsustekC_34:f3:aa (9c:5c:8e:34:f3:aa), Dst: Hangzhou_75:c8:f5 (74:25:8a:75:c8:f5)
Internet Protocol Version 4, Src: 10.106.129.54, Dst: 124.192.153.13
Transmission Control Protocol, Src Port: 37606 (37606), Dst Port: 80 (80), Seq: 1453, Ack: 1, Len: 273
[2 Reassembled TCP Segments (1725 bytes): #131(1452), #132(273)]
Hypertext Transfer Protocol
     [truncated]GET /jp/vms?tvId=710490000&vid=517ae127bec48788916fb3e1f54ae96b&key=fvip&src=01010031010000000000&vinfo=1&tm=1498640000349&puid=&qyid=s4vwt4ttoduoan3z5v1ja5u6&authKey=a774320f084d42dea25bf04d48209cf0&um=0&pf=b6c13e26323c537d&th
    Host: cache.video.iqiyi.com\r\n
    Connection: keep-alive\r\n
    User-Agent: Mozilla/5.0 (X11; Linux x86_64) AppleWebKit/537.36 (KHTML, like Gecko) Chrome/59.0.3071.104 Safari/537.36\r\n
    Accept: */*\r\n
    Referer: http://www.iqiyi.com/v_19rr7t3118.html\r\n
    Accept-Encoding: gzip, deflate\r\n
    Accept-Language: en-US,en;q=0.8,zh-TW;q=0.6,zh;q=0.4\r\n
     [truncated]Cookie: QC008=1498639831.1498639831.1498639831.1; QC005=e8c09fbe7d54fb987314ae319820248a; QC001=1; QILINPUSH=1; T00700=EgcIz7-tIRABEgcI4b-tIRABEgcIhcDtIRABEgcIkMDtIRABEgcI0b-tIRACEgcI1L-tIRABEgcIwMDtIRAB; Hm_lvt_53b7374a63c3748
    \r\n
    [Full request URI [truncated]: http://cache.video.iqiyi.com/jp/vms?tvId=710490000&vid=517ae127bec48788916fb3e1f54ae96b&key=fvip&src=01010031010000000000&vinfo=1&tm=1498640000349&puid=&qyid=s4vwt4ttoduoan3z5v1ja5u6&authKey=a774320f084d42dea2]
    [HTTP request 1/5]
    [Response in frame: 139]
    [Next request in frame: 1693]

No.     Time               Source                Destination           Protocol Length Info
    135 08:53:20.426099    10.106.129.54         124.192.153.31        HTTP     560    GET /tmpstats.gif?type=1503191_hder&rdm=191401414&qtcurl=http%3A%2F%2Fwww.iqiyi.com%2Fv_19rr7t3118.html&rfr=http%3A%2F%2Fwww.iqiyi.com%2F&platform=11 HTTP/1.1 

Frame 135: 560 bytes on wire (4480 bits), 560 bytes captured (4480 bits) on interface 0
Ethernet II, Src: AsustekC_34:f3:aa (9c:5c:8e:34:f3:aa), Dst: Hangzhou_75:c8:f5 (74:25:8a:75:c8:f5)
Internet Protocol Version 4, Src: 10.106.129.54, Dst: 124.192.153.31
Transmission Control Protocol, Src Port: 43346 (43346), Dst Port: 80 (80), Seq: 1402, Ack: 291, Len: 506
Hypertext Transfer Protocol
    GET /tmpstats.gif?type=1503191_hder&rdm=191401414&qtcurl=http%3A%2F%2Fwww.iqiyi.com%2Fv_19rr7t3118.html&rfr=http%3A%2F%2Fwww.iqiyi.com%2F&platform=11 HTTP/1.1\r\n
    Host: msg.71.am\r\n
    Connection: keep-alive\r\n
    User-Agent: Mozilla/5.0 (X11; Linux x86_64) AppleWebKit/537.36 (KHTML, like Gecko) Chrome/59.0.3071.104 Safari/537.36\r\n
    Accept: image/webp,image/apng,image/*,*/*;q=0.8\r\n
    Referer: http://www.iqiyi.com/v_19rr7t3118.html\r\n
    Accept-Encoding: gzip, deflate\r\n
    Accept-Language: en-US,en;q=0.8,zh-TW;q=0.6,zh;q=0.4\r\n
    \r\n
    [Full request URI: http://msg.71.am/tmpstats.gif?type=1503191_hder&rdm=191401414&qtcurl=http%3A%2F%2Fwww.iqiyi.com%2Fv_19rr7t3118.html&rfr=http%3A%2F%2Fwww.iqiyi.com%2F&platform=11]
    [HTTP request 3/24]
    [Prev request in frame: 110]
    [Response in frame: 136]
    [Next request in frame: 165]

No.     Time               Source                Destination           Protocol Length Info
    136 08:53:20.429734    124.192.153.31        10.106.129.54         HTTP     199    HTTP/1.1 200 OK 

Frame 136: 199 bytes on wire (1592 bits), 199 bytes captured (1592 bits) on interface 0
Ethernet II, Src: Hangzhou_75:c8:f5 (74:25:8a:75:c8:f5), Dst: AsustekC_34:f3:aa (9c:5c:8e:34:f3:aa)
Internet Protocol Version 4, Src: 124.192.153.31, Dst: 10.106.129.54
Transmission Control Protocol, Src Port: 80 (80), Dst Port: 43346 (43346), Seq: 291, Ack: 1908, Len: 145
Hypertext Transfer Protocol
    HTTP/1.1 200 OK\r\n
    Server: nginx/1.8.0\r\n
    Date: Wed, 28 Jun 2017 08:53:20 GMT\r\n
    Content-Type: image/gif\r\n
    Content-Length: 0\r\n
    Connection: keep-alive\r\n
    \r\n
    [HTTP response 3/24]
    [Time since request: 0.003635000 seconds]
    [Prev request in frame: 110]
    [Prev response in frame: 112]
    [Request in frame: 135]
    [Next request in frame: 165]
    [Next response in frame: 166]

No.     Time               Source                Destination           Protocol Length Info
    139 08:53:20.484139    124.192.153.13        10.106.129.54         HTTP     1506   HTTP/1.1 200 OK [Malformed Packet]

Frame 139: 1506 bytes on wire (12048 bits), 1506 bytes captured (12048 bits) on interface 0
Ethernet II, Src: Hangzhou_75:c8:f5 (74:25:8a:75:c8:f5), Dst: AsustekC_34:f3:aa (9c:5c:8e:34:f3:aa)
Internet Protocol Version 4, Src: 124.192.153.13, Dst: 10.106.129.54
Transmission Control Protocol, Src Port: 80 (80), Dst Port: 37606 (37606), Seq: 1, Ack: 1726, Len: 1452
Hypertext Transfer Protocol
    HTTP/1.1 200 OK\r\n
    Server: openresty\r\n
    Date: Wed, 28 Jun 2017 08:53:20 GMT\r\n
    Content-Type: application/json; charset=utf-8\r\n
    Transfer-Encoding: chunked\r\n
    Connection: keep-alive\r\n
    Cache-Control: no-cache\r\n
    Content-Encoding: gzip\r\n
    \r\n
    [HTTP response 1/5]
    [Time since request: 0.080049000 seconds]
    [Request in frame: 132]
    [Next request in frame: 1693]
    [Next response in frame: 1738]
    HTTP chunked response
[Malformed Packet: HTTP]

No.     Time               Source                Destination           Protocol Length Info
    145 08:53:20.546463    10.106.129.54         202.108.23.152        HTTP     697    GET /hm.js?53b7374a63c37483e5dd97d78d9bb36e HTTP/1.1 

Frame 145: 697 bytes on wire (5576 bits), 697 bytes captured (5576 bits) on interface 0
Ethernet II, Src: AsustekC_34:f3:aa (9c:5c:8e:34:f3:aa), Dst: Hangzhou_75:c8:f5 (74:25:8a:75:c8:f5)
Internet Protocol Version 4, Src: 10.106.129.54, Dst: 202.108.23.152
Transmission Control Protocol, Src Port: 58848 (58848), Dst Port: 80 (80), Seq: 965, Ack: 257, Len: 643
Hypertext Transfer Protocol
    GET /hm.js?53b7374a63c37483e5dd97d78d9bb36e HTTP/1.1\r\n
    Host: hm.baidu.com\r\n
    Connection: keep-alive\r\n
    User-Agent: Mozilla/5.0 (X11; Linux x86_64) AppleWebKit/537.36 (KHTML, like Gecko) Chrome/59.0.3071.104 Safari/537.36\r\n
    Accept: */*\r\n
    Referer: http://www.iqiyi.com/v_19rr7t3118.html\r\n
    Accept-Encoding: gzip, deflate\r\n
    Accept-Language: en-US,en;q=0.8,zh-TW;q=0.6,zh;q=0.4\r\n
    Cookie: PSTM=1482159164; BAIDUID=55E54FEF557AE260A52AC1F4D226E27A:FG=1; BIDUPSID=55E54FEF557AE260A52AC1F4D226E27A; HMACCOUNT=604266149DC2FA00; BDORZ=B490B5EBF6F3CD402E515D22BCDA1598; PSINO=1; H_PS_PSSID=1447_21119_23632_20928\r\n
    If-None-Match: 46bea8bbab552f70bf1649997cfea7e1\r\n
    \r\n
    [Full request URI: http://hm.baidu.com/hm.js?53b7374a63c37483e5dd97d78d9bb36e]
    [HTTP request 2/3]
    [Prev request in frame: 99]
    [Response in frame: 147]
    [Next request in frame: 223]

No.     Time               Source                Destination           Protocol Length Info
    147 08:53:20.554037    202.108.23.152        10.106.129.54         HTTP     219    HTTP/1.1 304 Not Modified 

Frame 147: 219 bytes on wire (1752 bits), 219 bytes captured (1752 bits) on interface 0
Ethernet II, Src: Hangzhou_75:c8:f5 (74:25:8a:75:c8:f5), Dst: AsustekC_34:f3:aa (9c:5c:8e:34:f3:aa)
Internet Protocol Version 4, Src: 202.108.23.152, Dst: 10.106.129.54
Transmission Control Protocol, Src Port: 80 (80), Dst Port: 58848 (58848), Seq: 257, Ack: 1608, Len: 165
Hypertext Transfer Protocol
    HTTP/1.1 304 Not Modified\r\n
    Cache-Control: max-age=0, must-revalidate\r\n
    Date: Wed, 28 Jun 2017 08:53:20 GMT\r\n
    Etag: 46bea8bbab552f70bf1649997cfea7e1\r\n
    Server: apache\r\n
    \r\n
    [HTTP response 2/3]
    [Time since request: 0.007574000 seconds]
    [Prev request in frame: 99]
    [Prev response in frame: 101]
    [Request in frame: 145]
    [Next request in frame: 223]
    [Next response in frame: 230]

No.     Time               Source                Destination           Protocol Length Info
    152 08:53:20.562134    10.106.129.54         124.193.231.165       HTTP     1432   GET /js/qiyiV2/playShortVideoV2_ver.js?2ciinp7 HTTP/1.1 

Frame 152: 1432 bytes on wire (11456 bits), 1432 bytes captured (11456 bits) on interface 0
Ethernet II, Src: AsustekC_34:f3:aa (9c:5c:8e:34:f3:aa), Dst: Hangzhou_75:c8:f5 (74:25:8a:75:c8:f5)
Internet Protocol Version 4, Src: 10.106.129.54, Dst: 124.193.231.165
Transmission Control Protocol, Src Port: 45246 (45246), Dst Port: 80 (80), Seq: 1, Ack: 1, Len: 1378
Hypertext Transfer Protocol
    GET /js/qiyiV2/playShortVideoV2_ver.js?2ciinp7 HTTP/1.1\r\n
    Host: static.iqiyi.com\r\n
    Connection: keep-alive\r\n
    User-Agent: Mozilla/5.0 (X11; Linux x86_64) AppleWebKit/537.36 (KHTML, like Gecko) Chrome/59.0.3071.104 Safari/537.36\r\n
    Accept: */*\r\n
    Referer: http://www.iqiyi.com/v_19rr7t3118.html\r\n
    Accept-Encoding: gzip, deflate\r\n
    Accept-Language: en-US,en;q=0.8,zh-TW;q=0.6,zh;q=0.4\r\n
     [truncated]Cookie: QC008=1498639831.1498639831.1498639831.1; QC005=e8c09fbe7d54fb987314ae319820248a; QC001=1; QILINPUSH=1; T00700=EgcIz7-tIRABEgcI4b-tIRABEgcIhcDtIRABEgcIkMDtIRABEgcI0b-tIRACEgcI1L-tIRABEgcIwMDtIRAB; Hm_lvt_53b7374a63c3748
    \r\n
    [Full request URI: http://static.iqiyi.com/js/qiyiV2/playShortVideoV2_ver.js?2ciinp7]
    [HTTP request 1/1]

No.     Time               Source                Destination           Protocol Length Info
    165 08:53:20.832860    10.106.129.54         124.192.153.31        HTTP     1245   POST /core?bstp=6&ptid=01010021010000000000&pf=1&p=10&p1=101&c1=25&r=710490000&aid=710490000&u=s4vwt4ttoduoan3z5v1ja5u6&pu=&os=window&v=4.1.1&ra=NaN&nu=0&ve=8355610783f557d6431185f06ecb94ab&ce=91aedbbe4a4ce47eaf47dd3234830501&hu=-1&ht=0&ispre=0&mod=cn_s&z=&diaoduuip=&server_ip=&stime=1498640000738&purl=http%3A%2F%2Fwww.iqiyi.com%2Fv_19rr7t3118.html&rfr=http%3A%2F%2Fwww.iqiyi.com%2F&lrfr=https%253A%252F%252Fwww.baidu.com%252Flink%253Furl%253D3UWAzf35gFxSMN0zOKptkvWc8DGL_F4K2rZJr4sbVaK%2526wd%253D%2526eqid%253D9316040300014b630000000359536dce&vfm=&vvfrom=lianbo&vfrm=&plyrtp=0&coop=&isdm=0&videotp=0&rn=0.1334219914107979&dfp=a03ee09fb56ab345de8f949bfc9ff5f1fd1ea12a7eea0da18fd7a0d7216aac7e1e&as=419ad06f2f90f71235adcff708fba5db&t=init&_=1498640000828 HTTP/1.1 

Frame 165: 1245 bytes on wire (9960 bits), 1245 bytes captured (9960 bits) on interface 0
Ethernet II, Src: AsustekC_34:f3:aa (9c:5c:8e:34:f3:aa), Dst: Hangzhou_75:c8:f5 (74:25:8a:75:c8:f5)
Internet Protocol Version 4, Src: 10.106.129.54, Dst: 124.192.153.31
Transmission Control Protocol, Src Port: 43346 (43346), Dst Port: 80 (80), Seq: 1908, Ack: 436, Len: 1191
Hypertext Transfer Protocol
     [truncated]POST /core?bstp=6&ptid=01010021010000000000&pf=1&p=10&p1=101&c1=25&r=710490000&aid=710490000&u=s4vwt4ttoduoan3z5v1ja5u6&pu=&os=window&v=4.1.1&ra=NaN&nu=0&ve=8355610783f557d6431185f06ecb94ab&ce=91aedbbe4a4ce47eaf47dd3234830501&h
    Host: msg.71.am\r\n
    Connection: keep-alive\r\n
    Content-Length: 0\r\n
    Cache-Control: max-age=0\r\n
    Origin: http://www.iqiyi.com\r\n
    User-Agent: Mozilla/5.0 (X11; Linux x86_64) AppleWebKit/537.36 (KHTML, like Gecko) Chrome/59.0.3071.104 Safari/537.36\r\n
    Content-Type: text/plain;charset=UTF-8\r\n
    Accept: */*\r\n
    Referer: http://www.iqiyi.com/v_19rr7t3118.html\r\n
    Accept-Encoding: gzip, deflate\r\n
    Accept-Language: en-US,en;q=0.8,zh-TW;q=0.6,zh;q=0.4\r\n
    \r\n
    [Full request URI [truncated]: http://msg.71.am/core?bstp=6&ptid=01010021010000000000&pf=1&p=10&p1=101&c1=25&r=710490000&aid=710490000&u=s4vwt4ttoduoan3z5v1ja5u6&pu=&os=window&v=4.1.1&ra=NaN&nu=0&ve=8355610783f557d6431185f06ecb94ab&ce=91aed]
    [HTTP request 4/24]
    [Prev request in frame: 135]
    [Response in frame: 166]
    [Next request in frame: 169]

No.     Time               Source                Destination           Protocol Length Info
    166 08:53:20.836626    124.192.153.31        10.106.129.54         HTTP     199    HTTP/1.1 200 OK 

Frame 166: 199 bytes on wire (1592 bits), 199 bytes captured (1592 bits) on interface 0
Ethernet II, Src: Hangzhou_75:c8:f5 (74:25:8a:75:c8:f5), Dst: AsustekC_34:f3:aa (9c:5c:8e:34:f3:aa)
Internet Protocol Version 4, Src: 124.192.153.31, Dst: 10.106.129.54
Transmission Control Protocol, Src Port: 80 (80), Dst Port: 43346 (43346), Seq: 436, Ack: 3099, Len: 145
Hypertext Transfer Protocol
    HTTP/1.1 200 OK\r\n
    Server: nginx/1.8.0\r\n
    Date: Wed, 28 Jun 2017 08:53:20 GMT\r\n
    Content-Type: text/html\r\n
    Content-Length: 0\r\n
    Connection: keep-alive\r\n
    \r\n
    [HTTP response 4/24]
    [Time since request: 0.003766000 seconds]
    [Prev request in frame: 135]
    [Prev response in frame: 136]
    [Request in frame: 165]
    [Next request in frame: 169]
    [Next response in frame: 174]

No.     Time               Source                Destination           Protocol Length Info
    169 08:53:20.854996    10.106.129.54         124.192.153.31        HTTP     577    GET /tmpstats.gif?type=piaoshhtestmayttf&job=playshortvideov2&des=findpagebyjob&url=http%3A%2F%2Fwww.iqiyi.com%2Fv_19rr7t3118.html&entry=Q.load&prj=qiyiV2&_=484400927 HTTP/1.1 

Frame 169: 577 bytes on wire (4616 bits), 577 bytes captured (4616 bits) on interface 0
Ethernet II, Src: AsustekC_34:f3:aa (9c:5c:8e:34:f3:aa), Dst: Hangzhou_75:c8:f5 (74:25:8a:75:c8:f5)
Internet Protocol Version 4, Src: 10.106.129.54, Dst: 124.192.153.31
Transmission Control Protocol, Src Port: 43346 (43346), Dst Port: 80 (80), Seq: 3099, Ack: 581, Len: 523
Hypertext Transfer Protocol
    GET /tmpstats.gif?type=piaoshhtestmayttf&job=playshortvideov2&des=findpagebyjob&url=http%3A%2F%2Fwww.iqiyi.com%2Fv_19rr7t3118.html&entry=Q.load&prj=qiyiV2&_=484400927 HTTP/1.1\r\n
    Host: msg.71.am\r\n
    Connection: keep-alive\r\n
    User-Agent: Mozilla/5.0 (X11; Linux x86_64) AppleWebKit/537.36 (KHTML, like Gecko) Chrome/59.0.3071.104 Safari/537.36\r\n
    Accept: image/webp,image/apng,image/*,*/*;q=0.8\r\n
    Referer: http://www.iqiyi.com/v_19rr7t3118.html\r\n
    Accept-Encoding: gzip, deflate\r\n
    Accept-Language: en-US,en;q=0.8,zh-TW;q=0.6,zh;q=0.4\r\n
    \r\n
    [Full request URI: http://msg.71.am/tmpstats.gif?type=piaoshhtestmayttf&job=playshortvideov2&des=findpagebyjob&url=http%3A%2F%2Fwww.iqiyi.com%2Fv_19rr7t3118.html&entry=Q.load&prj=qiyiV2&_=484400927]
    [HTTP request 5/24]
    [Prev request in frame: 165]
    [Response in frame: 174]
    [Next request in frame: 254]

No.     Time               Source                Destination           Protocol Length Info
    173 08:53:20.857350    10.106.129.54         124.193.229.70        HTTP     87     GET /player/cupid/common/clear.swf?r=q4xrdk HTTP/1.1 

Frame 173: 87 bytes on wire (696 bits), 87 bytes captured (696 bits) on interface 0
Ethernet II, Src: AsustekC_34:f3:aa (9c:5c:8e:34:f3:aa), Dst: Hangzhou_75:c8:f5 (74:25:8a:75:c8:f5)
Internet Protocol Version 4, Src: 10.106.129.54, Dst: 124.193.229.70
Transmission Control Protocol, Src Port: 57462 (57462), Dst Port: 80 (80), Seq: 1461, Ack: 1, Len: 33
[2 Reassembled TCP Segments (1493 bytes): #172(1460), #173(33)]
Hypertext Transfer Protocol
    GET /player/cupid/common/clear.swf?r=q4xrdk HTTP/1.1\r\n
    Host: www.iqiyi.com\r\n
    Connection: keep-alive\r\n
    User-Agent: Mozilla/5.0 (X11; Linux x86_64) AppleWebKit/537.36 (KHTML, like Gecko) Chrome/59.0.3071.104 Safari/537.36\r\n
    X-Requested-With: ShockwaveFlash/26.0.0.131\r\n
    Accept: */*\r\n
    Referer: http://www.iqiyi.com/v_19rr7t3118.html\r\n
    Accept-Encoding: gzip, deflate\r\n
    Accept-Language: en-US,en;q=0.8,zh-TW;q=0.6,zh;q=0.4\r\n
     [truncated]Cookie: QC008=1498639831.1498639831.1498639831.1; QC110=0; __uuid=b1d5af38-9899-975f-3638-e9804431bcfe; QC005=e8c09fbe7d54fb987314ae319820248a; QC001=1; QCUser=true; QILINPUSH=1; T00700=EgcIz7-tIRABEgcI4b-tIRABEgcIhcDtIRABEgcIk
    \r\n
    [Full request URI: http://www.iqiyi.com/player/cupid/common/clear.swf?r=q4xrdk]
    [HTTP request 1/1]
    [Response in frame: 177]

No.     Time               Source                Destination           Protocol Length Info
    174 08:53:20.858135    124.192.153.31        10.106.129.54         HTTP     199    HTTP/1.1 200 OK 

Frame 174: 199 bytes on wire (1592 bits), 199 bytes captured (1592 bits) on interface 0
Ethernet II, Src: Hangzhou_75:c8:f5 (74:25:8a:75:c8:f5), Dst: AsustekC_34:f3:aa (9c:5c:8e:34:f3:aa)
Internet Protocol Version 4, Src: 124.192.153.31, Dst: 10.106.129.54
Transmission Control Protocol, Src Port: 80 (80), Dst Port: 43346 (43346), Seq: 581, Ack: 3622, Len: 145
Hypertext Transfer Protocol
    HTTP/1.1 200 OK\r\n
    Server: nginx/1.8.0\r\n
    Date: Wed, 28 Jun 2017 08:53:20 GMT\r\n
    Content-Type: image/gif\r\n
    Content-Length: 0\r\n
    Connection: keep-alive\r\n
    \r\n
    [HTTP response 5/24]
    [Time since request: 0.003139000 seconds]
    [Prev request in frame: 165]
    [Prev response in frame: 166]
    [Request in frame: 169]
    [Next request in frame: 254]
    [Next response in frame: 255]

No.     Time               Source                Destination           Protocol Length Info
    177 08:53:20.863194    124.193.229.70        10.106.129.54         HTTP     1514   HTTP/1.1 200 OK  (application/x-shockwave-flash)

Frame 177: 1514 bytes on wire (12112 bits), 1514 bytes captured (12112 bits) on interface 0
Ethernet II, Src: Hangzhou_75:c8:f5 (74:25:8a:75:c8:f5), Dst: AsustekC_34:f3:aa (9c:5c:8e:34:f3:aa)
Internet Protocol Version 4, Src: 124.193.229.70, Dst: 10.106.129.54
Transmission Control Protocol, Src Port: 80 (80), Dst Port: 57462 (57462), Seq: 1, Ack: 1494, Len: 1460
Hypertext Transfer Protocol
    HTTP/1.1 200 OK\r\n
    Date: Wed, 28 Jun 2017 08:53:20 GMT\r\n
    Content-Type: application/x-shockwave-flash\r\n
    Content-Length: 30365\r\n
    Connection: keep-alive\r\n
    Expires: Wed, 28 Jun 2017 09:39:08 GMT\r\n
    Cache-Control: max-age=172800\r\n
    Last-Modified: Thu, 02 Mar 2017 01:29:48 GMT\r\n
    Server: Apache 1.3.29\r\n
    X-Cache: MISS from 10.10.131.242\r\n
    X-Cache: HIT from 124.193.229.70\r\n
    Accept-Ranges: bytes\r\n
    \r\n
    [HTTP response 1/1]
    [Time since request: 0.005844000 seconds]
    [Request in frame: 173]
Media Type

No.     Time               Source                Destination           Protocol Length Info
    205 08:53:20.870829    124.193.229.70        10.106.129.54         HTTP     1514   Continuation

Frame 205: 1514 bytes on wire (12112 bits), 1514 bytes captured (12112 bits) on interface 0
Ethernet II, Src: Hangzhou_75:c8:f5 (74:25:8a:75:c8:f5), Dst: AsustekC_34:f3:aa (9c:5c:8e:34:f3:aa)
Internet Protocol Version 4, Src: 124.193.229.70, Dst: 10.106.129.54
Transmission Control Protocol, Src Port: 80 (80), Dst Port: 57462 (57462), Seq: 20441, Ack: 1494, Len: 1460
Hypertext Transfer Protocol
     [truncated]:\363\251\367\335'\331r\270\362}R\302U]\371\270\235\320P7\034[\341\263\022cY\350\202\311\366Uw\231\325\335f\366\025i\361\027\314\v\276@{\372\2752)i0\273G\036\221;\207\262\253\271\345\332\v\2565\372\33559|\225Y\335k^b\034\177N\3
    Data (1300 bytes)

0000  24 f7 a7 b0 f1 01 e3 fb a6 d1 1a 32 7e 60 1a d6   $..........2~`..
0010  a8 f1 43 44 57 c3 f8 91 69 b4 3f 42 90 46 43 d0   ..CDW...i.?B.FC.
0020  bc 4f 98 c6 f0 b5 c6 10 1e 34 fa 7d 41 8a be c9   .O.......4.}A...
0030  7f a5 6f f2 f1 a1 6a fd f8 4f 4c 53 8e 93 43 d5   ..o...j..OLS..C.
0040  86 c5 e3 0d 87 aa 53 16 8f 37 1e aa dc c5 e3 87   ......S..7......
0050  1d aa bc c5 e3 f4 50 e5 2c 1e bb 87 aa d3 16 8f   ......P.,.......
0060  bd 43 d5 e9 8b c7 eb 0f 55 0f 5d 3c 7e f8 a1 ca   .C......U.]<~...
0070  5f 3c de 74 a8 0a 16 8f cf 38 54 9d b8 78 7c f6   _<.t.....8T..x|.
0080  a1 2a 5c 3c be a5 21 ee 28 47 af ae 8f 56 d8 0f   .*\<..!.(G...V..
0090  f4 f5 05 57 55 4b bc df 1c f9 90 fa 98 fa a9 f9   ...WUK..........
