No.     Time               Source                Destination           Protocol Length Info
     53 07:20:44.891683    10.106.129.54         124.192.145.71        HTTP     1206   GET /m3u8/lb_movie_350/desc.m3u8?stream_id=lb_movie_350&path=124.192.145.76,211.162.209.44,211.162.209.7&amltag=27&mltag=27&platid=10&splatid=1001&qos=4&fcheck=0&uid=2093663310.rp&keyitem=dpoOd-l3AnupIUuBI8VtFwmKzWltcfnZpngeV5Yo3I1Oleh6yGrbVeKRoRQ.&ntm=1498738800&nkey2=32f5dc59870aea9315b55fed8ab4676f&nkey=d87bb4ae4b06bdedc77d890f6d6ded56&tag=live&video_type=m3u8&useloc=0&mslice=5&ver=live_3&uidx=0&errc=0&gn=398&ndtype=0&lrtmcd=107&buss=27&cips=124.202.196.78&geo=CN-1-12-16&tmn=1498720499&pnl=398,398,1937,536&ext=m3u8&termid=1&hwtype=un&playid=1&sign=live_web&ostype=Linux&p1=1&p2=10&p3=-&uuid=A94FB6803E929657537BC439513EE0F91BE8AE93_0&vkit=20170511&station=224&tm=1498720499863&key=522a85facf91993f9f11e584594a39f0&abtimeshift=1498719071&rdm=1498720844885&r=1498720844886&appid=500 HTTP/1.1 

Frame 53: 1206 bytes on wire (9648 bits), 1206 bytes captured (9648 bits) on interface 0
Ethernet II, Src: AsustekC_34:f3:aa (9c:5c:8e:34:f3:aa), Dst: Hangzhou_75:c8:f5 (74:25:8a:75:c8:f5)
Internet Protocol Version 4, Src: 10.106.129.54, Dst: 124.192.145.71
Transmission Control Protocol, Src Port: 56626 (56626), Dst Port: 80 (80), Seq: 1, Ack: 1, Len: 1140
Hypertext Transfer Protocol
     [truncated]GET /m3u8/lb_movie_350/desc.m3u8?stream_id=lb_movie_350&path=124.192.145.76,211.162.209.44,211.162.209.7&amltag=27&mltag=27&platid=10&splatid=1001&qos=4&fcheck=0&uid=2093663310.rp&keyitem=dpoOd-l3AnupIUuBI8VtFwmKzWltcfnZpngeV5Y
    Host: 124.192.145.71\r\n
    Connection: keep-alive\r\n
    User-Agent: Mozilla/5.0 (X11; Linux x86_64) AppleWebKit/537.36 (KHTML, like Gecko) Chrome/59.0.3071.104 Safari/537.36\r\n
    X-Requested-With: ShockwaveFlash/26.0.0.131\r\n
    Accept: */*\r\n
    Referer: http://www.le.com/\r\n
    Accept-Encoding: gzip, deflate\r\n
    Accept-Language: en-US,en;q=0.8,zh-TW;q=0.6,zh;q=0.4\r\n
    \r\n
    [Full request URI [truncated]: http://124.192.145.71/m3u8/lb_movie_350/desc.m3u8?stream_id=lb_movie_350&path=124.192.145.76,211.162.209.44,211.162.209.7&amltag=27&mltag=27&platid=10&splatid=1001&qos=4&fcheck=0&uid=2093663310.rp&keyitem=dpoO]
    [HTTP request 1/43]
    [Response in frame: 68]
    [Next request in frame: 183]

No.     Time               Source                Destination           Protocol Length Info
     68 07:20:44.935445    124.192.145.71        10.106.129.54         HTTP     1092   HTTP/1.1 200 OK  (application/vnd.apple.mpegurl)

Frame 68: 1092 bytes on wire (8736 bits), 1092 bytes captured (8736 bits) on interface 0
Ethernet II, Src: Hangzhou_75:c8:f5 (74:25:8a:75:c8:f5), Dst: AsustekC_34:f3:aa (9c:5c:8e:34:f3:aa)
Internet Protocol Version 4, Src: 124.192.145.71, Dst: 10.106.129.54
Transmission Control Protocol, Src Port: 80 (80), Dst Port: 56626 (56626), Seq: 5793, Ack: 1141, Len: 1026
[5 Reassembled TCP Segments (6818 bytes): #60(1448), #62(1448), #64(1448), #66(1448), #68(1026)]
Hypertext Transfer Protocol
    HTTP/1.1 200 OK\r\n
    Date: Thu, 29 Jun 2017 07:20:44 GMT\r\n
    Content-Type: application/vnd.apple.mpegurl\r\n
    Content-Length: 6596\r\n
    Connection: keep-alive\r\n
    Last-Modified: Thu, 29 Jun 2017 07:20:44 GMT\r\n
    Server: LeCloud Cache V2.43\r\n
    \r\n
    [HTTP response 1/43]
    [Time since request: 0.043762000 seconds]
    [Request in frame: 53]
    [Next request in frame: 183]
    [Next response in frame: 189]
Media Type

No.     Time               Source                Destination           Protocol Length Info
    183 07:20:46.427689    10.106.129.54         124.192.145.71        HTTP     1206   GET /m3u8/lb_movie_350/desc.m3u8?stream_id=lb_movie_350&path=124.192.145.76,211.162.209.44,211.162.209.7&amltag=27&mltag=27&platid=10&splatid=1001&qos=4&fcheck=0&uid=2093663310.rp&keyitem=dpoOd-l3AnupIUuBI8VtFwmKzWltcfnZpngeV5Yo3I1Oleh6yGrbVeKRoRQ.&ntm=1498738800&nkey2=32f5dc59870aea9315b55fed8ab4676f&nkey=d87bb4ae4b06bdedc77d890f6d6ded56&tag=live&video_type=m3u8&useloc=0&mslice=5&ver=live_3&uidx=0&errc=0&gn=398&ndtype=0&lrtmcd=107&buss=27&cips=124.202.196.78&geo=CN-1-12-16&tmn=1498720499&pnl=398,398,1937,536&ext=m3u8&termid=1&hwtype=un&playid=1&sign=live_web&ostype=Linux&p1=1&p2=10&p3=-&uuid=A94FB6803E929657537BC439513EE0F91BE8AE93_0&vkit=20170511&station=224&tm=1498720499863&key=522a85facf91993f9f11e584594a39f0&abtimeshift=1498719071&rdm=1498720846423&r=1498720846424&appid=500 HTTP/1.1 

Frame 183: 1206 bytes on wire (9648 bits), 1206 bytes captured (9648 bits) on interface 0
Ethernet II, Src: AsustekC_34:f3:aa (9c:5c:8e:34:f3:aa), Dst: Hangzhou_75:c8:f5 (74:25:8a:75:c8:f5)
Internet Protocol Version 4, Src: 10.106.129.54, Dst: 124.192.145.71
Transmission Control Protocol, Src Port: 56626 (56626), Dst Port: 80 (80), Seq: 1141, Ack: 6819, Len: 1140
Hypertext Transfer Protocol
     [truncated]GET /m3u8/lb_movie_350/desc.m3u8?stream_id=lb_movie_350&path=124.192.145.76,211.162.209.44,211.162.209.7&amltag=27&mltag=27&platid=10&splatid=1001&qos=4&fcheck=0&uid=2093663310.rp&keyitem=dpoOd-l3AnupIUuBI8VtFwmKzWltcfnZpngeV5Y
    Host: 124.192.145.71\r\n
    Connection: keep-alive\r\n
    User-Agent: Mozilla/5.0 (X11; Linux x86_64) AppleWebKit/537.36 (KHTML, like Gecko) Chrome/59.0.3071.104 Safari/537.36\r\n
    X-Requested-With: ShockwaveFlash/26.0.0.131\r\n
    Accept: */*\r\n
    Referer: http://www.le.com/\r\n
    Accept-Encoding: gzip, deflate\r\n
    Accept-Language: en-US,en;q=0.8,zh-TW;q=0.6,zh;q=0.4\r\n
    \r\n
    [Full request URI [truncated]: http://124.192.145.71/m3u8/lb_movie_350/desc.m3u8?stream_id=lb_movie_350&path=124.192.145.76,211.162.209.44,211.162.209.7&amltag=27&mltag=27&platid=10&splatid=1001&qos=4&fcheck=0&uid=2093663310.rp&keyitem=dpoO]
    [HTTP request 2/43]
    [Prev request in frame: 53]
    [Response in frame: 189]
    [Next request in frame: 352]

No.     Time               Source                Destination           Protocol Length Info
    189 07:20:46.469863    124.192.145.71        10.106.129.54         HTTP     2962   HTTP/1.1 200 OK  (application/vnd.apple.mpegurl)

Frame 189: 2962 bytes on wire (23696 bits), 2962 bytes captured (23696 bits) on interface 0
Ethernet II, Src: Hangzhou_75:c8:f5 (74:25:8a:75:c8:f5), Dst: AsustekC_34:f3:aa (9c:5c:8e:34:f3:aa)
Internet Protocol Version 4, Src: 124.192.145.71, Dst: 10.106.129.54
Transmission Control Protocol, Src Port: 80 (80), Dst Port: 56626 (56626), Seq: 6819, Ack: 2281, Len: 2896
Hypertext Transfer Protocol
    HTTP/1.1 200 OK\r\n
    Date: Thu, 29 Jun 2017 07:20:46 GMT\r\n
    Content-Type: application/vnd.apple.mpegurl\r\n
    Content-Length: 6596\r\n
    Connection: keep-alive\r\n
    Last-Modified: Thu, 29 Jun 2017 07:20:46 GMT\r\n
    Server: LeCloud Cache V2.43\r\n
    \r\n
    [HTTP response 2/43]
    [Time since request: 0.042174000 seconds]
    [Prev request in frame: 53]
    [Prev response in frame: 68]
    [Request in frame: 183]
    [Next request in frame: 352]
    [Next response in frame: 366]
Media Type

No.     Time               Source                Destination           Protocol Length Info
    259 07:20:47.143726    10.106.129.54         124.192.153.42        HTTP     555    GET /show2?e=AF48RQoHHEpYZQAAAAEFA0FTbwEABgYWRDMMWERFRQleTChGRx5ZQVgmWB5TXlgcBzxuCEJCB0NcPEtTHllBXh1FPQwHAQEHCG4GAAAXWQ5BRSkMABZARgx5QUINARNQB15rHwEeARZCKQwDHgMEHUFOPkNVQwMWVisMARZBVg5XBj4MARZGVVg7DFRRCQdQQVY8AVECCAMJOVUBAlVXChVUZgQEBgcJBGgBFkBFCANXEzBYDQUAAAFvAQAJBwQBRVJzBAAAAAABbwgGAAYHBVcTLAwAFl4NAXlIDQAXQg5CU3lSUQ0DABc8VQ0E&h=1498720847135&a=qc_100001_100153&u=e8c09fbe7d54fb987314ae319820248a&p=&s=ce9e20ce7cbac589afeeeee23a11b8aa&cb=jQuery112405120801484253488_1498720808563&_=1498720808567 HTTP/1.1 

Frame 259: 555 bytes on wire (4440 bits), 555 bytes captured (4440 bits) on interface 0
Ethernet II, Src: AsustekC_34:f3:aa (9c:5c:8e:34:f3:aa), Dst: Hangzhou_75:c8:f5 (74:25:8a:75:c8:f5)
Internet Protocol Version 4, Src: 10.106.129.54, Dst: 124.192.153.42
Transmission Control Protocol, Src Port: 60594 (60594), Dst Port: 80 (80), Seq: 1453, Ack: 1, Len: 501
[2 Reassembled TCP Segments (1953 bytes): #258(1452), #259(501)]
Hypertext Transfer Protocol
     [truncated]GET /show2?e=AF48RQoHHEpYZQAAAAEFA0FTbwEABgYWRDMMWERFRQleTChGRx5ZQVgmWB5TXlgcBzxuCEJCB0NcPEtTHllBXh1FPQwHAQEHCG4GAAAXWQ5BRSkMABZARgx5QUINARNQB15rHwEeARZCKQwDHgMEHUFOPkNVQwMWVisMARZBVg5XBj4MARZGVVg7DFRRCQdQQVY8AVECCAMJOVUBAlVXCh
    Host: t7z.cupid.iqiyi.com\r\n
    Connection: keep-alive\r\n
    User-Agent: Mozilla/5.0 (X11; Linux x86_64) AppleWebKit/537.36 (KHTML, like Gecko) Chrome/59.0.3071.104 Safari/537.36\r\n
    Accept: */*\r\n
    Referer: http://www.iqiyi.com/v_19rr7smczc.html\r\n
    Accept-Encoding: gzip, deflate\r\n
    Accept-Language: en-US,en;q=0.8,zh-TW;q=0.6,zh;q=0.4\r\n
     [truncated]Cookie: QC008=1498639831.1498639831.1498639831.1; QC005=e8c09fbe7d54fb987314ae319820248a; QC001=1; T00700=EgcIz7-tIRACEgcI4b-tIRABEgcIhcDtIRABEgcIkMDtIRABEgcI0b-tIRACEgcI1L-tIRABEgcIwMDtIRABEgcI6L-tIRABEgcI6b-tIRABEgcI67-tIRACE
    \r\n
    [Full request URI [truncated]: http://t7z.cupid.iqiyi.com/show2?e=AF48RQoHHEpYZQAAAAEFA0FTbwEABgYWRDMMWERFRQleTChGRx5ZQVgmWB5TXlgcBzxuCEJCB0NcPEtTHllBXh1FPQwHAQEHCG4GAAAXWQ5BRSkMABZARgx5QUINARNQB15rHwEeARZCKQwDHgMEHUFOPkNVQwMWVisMARZBVg5XBj]
    [HTTP request 1/2]
    [Response in frame: 262]
    [Next request in frame: 269]

No.     Time               Source                Destination           Protocol Length Info
    262 07:20:47.159417    124.192.153.42        10.106.129.54         HTTP     1125   HTTP/1.1 200 OK  (text/plain)

Frame 262: 1125 bytes on wire (9000 bits), 1125 bytes captured (9000 bits) on interface 0
Ethernet II, Src: Hangzhou_75:c8:f5 (74:25:8a:75:c8:f5), Dst: AsustekC_34:f3:aa (9c:5c:8e:34:f3:aa)
Internet Protocol Version 4, Src: 124.192.153.42, Dst: 10.106.129.54
Transmission Control Protocol, Src Port: 80 (80), Dst Port: 60594 (60594), Seq: 1, Ack: 1954, Len: 1071
Hypertext Transfer Protocol
    HTTP/1.1 200 OK\r\n
    Server: nginx/1.8.0\r\n
    Date: Thu, 29 Jun 2017 07:20:47 GMT\r\n
    Content-Type: text/plain; charset=utf-8\r\n
    Transfer-Encoding: chunked\r\n
    Connection: keep-alive\r\n
    Vary: Accept-Encoding\r\n
    Set-Cookie: T00404=b90911778140c4ea6bfe722d27c4eb00; Version=1; Expires=Sun, 24 Jun 2018 07:20:47 GMT; Max-Age=31104000; Domain=.iqiyi.com; Path=/\r\n
    Access-Control-Allow-Credentials: true\r\n
    Cache-Control: no-cache\r\n
    P3P: CP="ALL DSP COR NID"\r\n
    Content-Encoding: gzip\r\n
    \r\n
    [HTTP response 1/2]
    [Time since request: 0.015691000 seconds]
    [Request in frame: 259]
    [Next request in frame: 269]
    [Next response in frame: 282]
    HTTP chunked response
    Content-encoded entity body (gzip): 607 bytes -> 1110 bytes
Line-based text data: text/plain

No.     Time               Source                Destination           Protocol Length Info
    269 07:20:47.167376    10.106.129.54         124.192.153.42        HTTP     580    GET /track2?w=1&dts=1%3A1001%3A&nr=&c=b39e8c854702845fca46497f81248dd3&f=b90911778140c4ea6bfe722d27c4eb00&g=e8c09fbe7d54fb987314ae319820248a&h=&i=qc_100001_100153&j=25&n=711791700&ri=ce9e20ce7cbac589afeeeee23a11b8aa&o=7&t=1000000001913&p=1000000000066&dr=265&as=1&rt=1498720847&d=1000000000071&a=0&kp=b90911778140c4ea6bfe722d27c4eb00&iv=0&ivm=0&ve=1&cv=4.1.1&sv=3.21.0-ares3&r=da82c05c0a2838fd12db9d7954679570&st=0&b=1498720847&s=f93fe56a845905376e64e080b07d359b&cb=jQuery112405120801484253488_1498720808563&_=1498720808568 HTTP/1.1 

Frame 269: 580 bytes on wire (4640 bits), 580 bytes captured (4640 bits) on interface 0
Ethernet II, Src: AsustekC_34:f3:aa (9c:5c:8e:34:f3:aa), Dst: Hangzhou_75:c8:f5 (74:25:8a:75:c8:f5)
Internet Protocol Version 4, Src: 10.106.129.54, Dst: 124.192.153.42
Transmission Control Protocol, Src Port: 60594 (60594), Dst Port: 80 (80), Seq: 3406, Ack: 1092, Len: 526
[2 Reassembled TCP Segments (1978 bytes): #268(1452), #269(526)]
Hypertext Transfer Protocol
     [truncated]GET /track2?w=1&dts=1%3A1001%3A&nr=&c=b39e8c854702845fca46497f81248dd3&f=b90911778140c4ea6bfe722d27c4eb00&g=e8c09fbe7d54fb987314ae319820248a&h=&i=qc_100001_100153&j=25&n=711791700&ri=ce9e20ce7cbac589afeeeee23a11b8aa&o=7&t=10000
    Host: t7z.cupid.iqiyi.com\r\n
    Connection: keep-alive\r\n
    User-Agent: Mozilla/5.0 (X11; Linux x86_64) AppleWebKit/537.36 (KHTML, like Gecko) Chrome/59.0.3071.104 Safari/537.36\r\n
    Accept: */*\r\n
    Referer: http://www.iqiyi.com/v_19rr7smczc.html\r\n
    Accept-Encoding: gzip, deflate\r\n
    Accept-Language: en-US,en;q=0.8,zh-TW;q=0.6,zh;q=0.4\r\n
     [truncated]Cookie: QC008=1498639831.1498639831.1498639831.1; QC005=e8c09fbe7d54fb987314ae319820248a; QC001=1; T00700=EgcIz7-tIRACEgcI4b-tIRABEgcIhcDtIRABEgcIkMDtIRABEgcI0b-tIRACEgcI1L-tIRABEgcIwMDtIRABEgcI6L-tIRABEgcI6b-tIRABEgcI67-tIRACE
    \r\n
    [Full request URI [truncated]: http://t7z.cupid.iqiyi.com/track2?w=1&dts=1%3A1001%3A&nr=&c=b39e8c854702845fca46497f81248dd3&f=b90911778140c4ea6bfe722d27c4eb00&g=e8c09fbe7d54fb987314ae319820248a&h=&i=qc_100001_100153&j=25&n=711791700&ri=ce9e]
    [HTTP request 2/2]
    [Prev request in frame: 259]
    [Response in frame: 282]

No.     Time               Source                Destination           Protocol Length Info
    273 07:20:47.168287    10.106.129.54         124.192.153.31        HTTP     694    GET /cp2.gif?p=s&rd=24&rc=-1&t=s&e=da82c05c0a2838fd12db9d7954679570&y=qc_100001_100153&u=e8c09fbe7d54fb987314ae319820248a&a=b90911778140c4ea6bfe722d27c4eb00&av=3.21.0-ares3&vv=4.1.1&g=0&d=265&rid=ce9e20ce7cbac589afeeeee23a11b8aa&s=1498720847000&c=25&h=0&l=MTI0LjIwMi4xOTYuNzg%3D&ps=0 HTTP/1.1 

Frame 273: 694 bytes on wire (5552 bits), 694 bytes captured (5552 bits) on interface 0
Ethernet II, Src: AsustekC_34:f3:aa (9c:5c:8e:34:f3:aa), Dst: Hangzhou_75:c8:f5 (74:25:8a:75:c8:f5)
Internet Protocol Version 4, Src: 10.106.129.54, Dst: 124.192.153.31
Transmission Control Protocol, Src Port: 42612 (42612), Dst Port: 80 (80), Seq: 1, Ack: 1, Len: 640
Hypertext Transfer Protocol
     [truncated]GET /cp2.gif?p=s&rd=24&rc=-1&t=s&e=da82c05c0a2838fd12db9d7954679570&y=qc_100001_100153&u=e8c09fbe7d54fb987314ae319820248a&a=b90911778140c4ea6bfe722d27c4eb00&av=3.21.0-ares3&vv=4.1.1&g=0&d=265&rid=ce9e20ce7cbac589afeeeee23a11b8a
    Host: msg.71.am\r\n
    Connection: keep-alive\r\n
    User-Agent: Mozilla/5.0 (X11; Linux x86_64) AppleWebKit/537.36 (KHTML, like Gecko) Chrome/59.0.3071.104 Safari/537.36\r\n
    Accept: image/webp,image/apng,image/*,*/*;q=0.8\r\n
    Referer: http://www.iqiyi.com/v_19rr7smczc.html\r\n
    Accept-Encoding: gzip, deflate\r\n
    Accept-Language: en-US,en;q=0.8,zh-TW;q=0.6,zh;q=0.4\r\n
    \r\n
    [Full request URI [truncated]: http://msg.71.am/cp2.gif?p=s&rd=24&rc=-1&t=s&e=da82c05c0a2838fd12db9d7954679570&y=qc_100001_100153&u=e8c09fbe7d54fb987314ae319820248a&a=b90911778140c4ea6bfe722d27c4eb00&av=3.21.0-ares3&vv=4.1.1&g=0&d=265&rid=c]
    [HTTP request 1/2]
    [Response in frame: 280]
    [Next request in frame: 285]

No.     Time               Source                Destination           Protocol Length Info
    277 07:20:47.172646    10.106.129.54         124.192.153.31        HTTP     760    GET /cp2.gif?p=i&t=s&oi=7%3An1%3A1000000001913%3B&ri=7%3An1%3A1000000001913%3B&di=&e=da82c05c0a2838fd12db9d7954679570&y=qc_100001_100153&u=e8c09fbe7d54fb987314ae319820248a&a=b90911778140c4ea6bfe722d27c4eb00&av=3.21.0-ares3&vv=4.1.1&g=0&d=265&rid=ce9e20ce7cbac589afeeeee23a11b8aa&v=711791700&b=0&s=1498720847004&c=25&h=0&l=MTI0LjIwMi4xOTYuNzg%3D&ps=0 HTTP/1.1 

Frame 277: 760 bytes on wire (6080 bits), 760 bytes captured (6080 bits) on interface 0
Ethernet II, Src: AsustekC_34:f3:aa (9c:5c:8e:34:f3:aa), Dst: Hangzhou_75:c8:f5 (74:25:8a:75:c8:f5)
Internet Protocol Version 4, Src: 10.106.129.54, Dst: 124.192.153.31
Transmission Control Protocol, Src Port: 42614 (42614), Dst Port: 80 (80), Seq: 1, Ack: 1, Len: 706
Hypertext Transfer Protocol
     [truncated]GET /cp2.gif?p=i&t=s&oi=7%3An1%3A1000000001913%3B&ri=7%3An1%3A1000000001913%3B&di=&e=da82c05c0a2838fd12db9d7954679570&y=qc_100001_100153&u=e8c09fbe7d54fb987314ae319820248a&a=b90911778140c4ea6bfe722d27c4eb00&av=3.21.0-ares3&vv=4
    Host: msg.71.am\r\n
    Connection: keep-alive\r\n
    User-Agent: Mozilla/5.0 (X11; Linux x86_64) AppleWebKit/537.36 (KHTML, like Gecko) Chrome/59.0.3071.104 Safari/537.36\r\n
    Accept: image/webp,image/apng,image/*,*/*;q=0.8\r\n
    Referer: http://www.iqiyi.com/v_19rr7smczc.html\r\n
    Accept-Encoding: gzip, deflate\r\n
    Accept-Language: en-US,en;q=0.8,zh-TW;q=0.6,zh;q=0.4\r\n
    \r\n
    [Full request URI [truncated]: http://msg.71.am/cp2.gif?p=i&t=s&oi=7%3An1%3A1000000001913%3B&ri=7%3An1%3A1000000001913%3B&di=&e=da82c05c0a2838fd12db9d7954679570&y=qc_100001_100153&u=e8c09fbe7d54fb987314ae319820248a&a=b90911778140c4ea6bfe722]
    [HTTP request 1/1]
    [Response in frame: 286]

No.     Time               Source                Destination           Protocol Length Info
    280 07:20:47.172893    124.192.153.31        10.106.129.54         HTTP     199    HTTP/1.1 200 OK 

Frame 280: 199 bytes on wire (1592 bits), 199 bytes captured (1592 bits) on interface 0
Ethernet II, Src: Hangzhou_75:c8:f5 (74:25:8a:75:c8:f5), Dst: AsustekC_34:f3:aa (9c:5c:8e:34:f3:aa)
Internet Protocol Version 4, Src: 124.192.153.31, Dst: 10.106.129.54
Transmission Control Protocol, Src Port: 80 (80), Dst Port: 42612 (42612), Seq: 1, Ack: 641, Len: 145
Hypertext Transfer Protocol
    HTTP/1.1 200 OK\r\n
    Server: nginx/1.8.0\r\n
    Date: Thu, 29 Jun 2017 07:20:47 GMT\r\n
    Content-Type: image/gif\r\n
    Content-Length: 0\r\n
    Connection: keep-alive\r\n
    \r\n
    [HTTP response 1/2]
    [Time since request: 0.004606000 seconds]
    [Request in frame: 273]
    [Next request in frame: 285]
    [Next response in frame: 290]

No.     Time               Source                Destination           Protocol Length Info
    282 07:20:47.175286    124.192.153.42        10.106.129.54         HTTP     353    HTTP/1.1 200 OK  (text/html)

Frame 282: 353 bytes on wire (2824 bits), 353 bytes captured (2824 bits) on interface 0
Ethernet II, Src: Hangzhou_75:c8:f5 (74:25:8a:75:c8:f5), Dst: AsustekC_34:f3:aa (9c:5c:8e:34:f3:aa)
Internet Protocol Version 4, Src: 124.192.153.42, Dst: 10.106.129.54
Transmission Control Protocol, Src Port: 80 (80), Dst Port: 60594 (60594), Seq: 1092, Ack: 3932, Len: 299
Hypertext Transfer Protocol
    HTTP/1.1 200 OK\r\n
    Server: nginx/1.8.0\r\n
    Date: Thu, 29 Jun 2017 07:20:47 GMT\r\n
    Content-Type: text/html; charset=utf-8\r\n
    Content-Length: 48\r\n
    Connection: keep-alive\r\n
    Cache-Control: no-cache\r\n
    Access-Control-Allow-Credentials: true\r\n
    Cache-Control: no-cache\r\n
    \r\n
    [HTTP response 2/2]
    [Time since request: 0.007910000 seconds]
    [Prev request in frame: 259]
    [Prev response in frame: 262]
    [Request in frame: 269]
Line-based text data: text/html

No.     Time               Source                Destination           Protocol Length Info
    285 07:20:47.178989    10.106.129.54         124.192.153.31        HTTP     723    GET /cp2.gif?p=t&t=s&rc=-1&rd=13&ai=7%7C%7C%7C%7C%7C%7C%7C%7C&e=da82c05c0a2838fd12db9d7954679570&y=qc_100001_100153&u=e8c09fbe7d54fb987314ae319820248a&a=b90911778140c4ea6bfe722d27c4eb00&av=3.21.0-ares3&vv=4.1.1&g=0&d=265&rid=ce9e20ce7cbac589afeeeee23a11b8aa&s=1498720847015&c=25&h=0&l=MTI0LjIwMi4xOTYuNzg%3D&ps=0 HTTP/1.1 

Frame 285: 723 bytes on wire (5784 bits), 723 bytes captured (5784 bits) on interface 0
Ethernet II, Src: AsustekC_34:f3:aa (9c:5c:8e:34:f3:aa), Dst: Hangzhou_75:c8:f5 (74:25:8a:75:c8:f5)
Internet Protocol Version 4, Src: 10.106.129.54, Dst: 124.192.153.31
Transmission Control Protocol, Src Port: 42612 (42612), Dst Port: 80 (80), Seq: 641, Ack: 146, Len: 669
Hypertext Transfer Protocol
     [truncated]GET /cp2.gif?p=t&t=s&rc=-1&rd=13&ai=7%7C%7C%7C%7C%7C%7C%7C%7C&e=da82c05c0a2838fd12db9d7954679570&y=qc_100001_100153&u=e8c09fbe7d54fb987314ae319820248a&a=b90911778140c4ea6bfe722d27c4eb00&av=3.21.0-ares3&vv=4.1.1&g=0&d=265&rid=ce
    Host: msg.71.am\r\n
    Connection: keep-alive\r\n
    User-Agent: Mozilla/5.0 (X11; Linux x86_64) AppleWebKit/537.36 (KHTML, like Gecko) Chrome/59.0.3071.104 Safari/537.36\r\n
    Accept: image/webp,image/apng,image/*,*/*;q=0.8\r\n
    Referer: http://www.iqiyi.com/v_19rr7smczc.html\r\n
    Accept-Encoding: gzip, deflate\r\n
    Accept-Language: en-US,en;q=0.8,zh-TW;q=0.6,zh;q=0.4\r\n
    \r\n
    [Full request URI [truncated]: http://msg.71.am/cp2.gif?p=t&t=s&rc=-1&rd=13&ai=7%7C%7C%7C%7C%7C%7C%7C%7C&e=da82c05c0a2838fd12db9d7954679570&y=qc_100001_100153&u=e8c09fbe7d54fb987314ae319820248a&a=b90911778140c4ea6bfe722d27c4eb00&av=3.21.0-a]
    [HTTP request 2/2]
    [Prev request in frame: 273]
    [Response in frame: 290]

No.     Time               Source                Destination           Protocol Length Info
    286 07:20:47.183709    124.192.153.31        10.106.129.54         HTTP     199    HTTP/1.1 200 OK 

Frame 286: 199 bytes on wire (1592 bits), 199 bytes captured (1592 bits) on interface 0
Ethernet II, Src: Hangzhou_75:c8:f5 (74:25:8a:75:c8:f5), Dst: AsustekC_34:f3:aa (9c:5c:8e:34:f3:aa)
Internet Protocol Version 4, Src: 124.192.153.31, Dst: 10.106.129.54
Transmission Control Protocol, Src Port: 80 (80), Dst Port: 42614 (42614), Seq: 1, Ack: 707, Len: 145
Hypertext Transfer Protocol
    HTTP/1.1 200 OK\r\n
    Server: nginx/1.8.0\r\n
    Date: Thu, 29 Jun 2017 07:20:47 GMT\r\n
    Content-Type: image/gif\r\n
    Content-Length: 0\r\n
    Connection: keep-alive\r\n
    \r\n
    [HTTP response 1/1]
    [Time since request: 0.011063000 seconds]
    [Request in frame: 277]

No.     Time               Source                Destination           Protocol Length Info
    290 07:20:47.184556    124.192.153.31        10.106.129.54         HTTP     199    HTTP/1.1 200 OK 

Frame 290: 199 bytes on wire (1592 bits), 199 bytes captured (1592 bits) on interface 0
Ethernet II, Src: Hangzhou_75:c8:f5 (74:25:8a:75:c8:f5), Dst: AsustekC_34:f3:aa (9c:5c:8e:34:f3:aa)
Internet Protocol Version 4, Src: 124.192.153.31, Dst: 10.106.129.54
Transmission Control Protocol, Src Port: 80 (80), Dst Port: 42612 (42612), Seq: 146, Ack: 1310, Len: 145
Hypertext Transfer Protocol
    HTTP/1.1 200 OK\r\n
    Server: nginx/1.8.0\r\n
    Date: Thu, 29 Jun 2017 07:20:47 GMT\r\n
    Content-Type: image/gif\r\n
    Content-Length: 0\r\n
    Connection: keep-alive\r\n
    \r\n
    [HTTP response 2/2]
    [Time since request: 0.005567000 seconds]
    [Prev request in frame: 273]
    [Prev response in frame: 280]
    [Request in frame: 285]

No.     Time               Source                Destination           Protocol Length Info
    352 07:20:47.963555    10.106.129.54         124.192.145.71        HTTP     1206   GET /m3u8/lb_movie_350/desc.m3u8?stream_id=lb_movie_350&path=124.192.145.76,211.162.209.44,211.162.209.7&amltag=27&mltag=27&platid=10&splatid=1001&qos=4&fcheck=0&uid=2093663310.rp&keyitem=dpoOd-l3AnupIUuBI8VtFwmKzWltcfnZpngeV5Yo3I1Oleh6yGrbVeKRoRQ.&ntm=1498738800&nkey2=32f5dc59870aea9315b55fed8ab4676f&nkey=d87bb4ae4b06bdedc77d890f6d6ded56&tag=live&video_type=m3u8&useloc=0&mslice=5&ver=live_3&uidx=0&errc=0&gn=398&ndtype=0&lrtmcd=107&buss=27&cips=124.202.196.78&geo=CN-1-12-16&tmn=1498720499&pnl=398,398,1937,536&ext=m3u8&termid=1&hwtype=un&playid=1&sign=live_web&ostype=Linux&p1=1&p2=10&p3=-&uuid=A94FB6803E929657537BC439513EE0F91BE8AE93_0&vkit=20170511&station=224&tm=1498720499863&key=522a85facf91993f9f11e584594a39f0&abtimeshift=1498719071&rdm=1498720847957&r=1498720847957&appid=500 HTTP/1.1 

Frame 352: 1206 bytes on wire (9648 bits), 1206 bytes captured (9648 bits) on interface 0
Ethernet II, Src: AsustekC_34:f3:aa (9c:5c:8e:34:f3:aa), Dst: Hangzhou_75:c8:f5 (74:25:8a:75:c8:f5)
Internet Protocol Version 4, Src: 10.106.129.54, Dst: 124.192.145.71
Transmission Control Protocol, Src Port: 56626 (56626), Dst Port: 80 (80), Seq: 2281, Ack: 13637, Len: 1140
Hypertext Transfer Protocol
     [truncated]GET /m3u8/lb_movie_350/desc.m3u8?stream_id=lb_movie_350&path=124.192.145.76,211.162.209.44,211.162.209.7&amltag=27&mltag=27&platid=10&splatid=1001&qos=4&fcheck=0&uid=2093663310.rp&keyitem=dpoOd-l3AnupIUuBI8VtFwmKzWltcfnZpngeV5Y
    Host: 124.192.145.71\r\n
    Connection: keep-alive\r\n
    User-Agent: Mozilla/5.0 (X11; Linux x86_64) AppleWebKit/537.36 (KHTML, like Gecko) Chrome/59.0.3071.104 Safari/537.36\r\n
    X-Requested-With: ShockwaveFlash/26.0.0.131\r\n
    Accept: */*\r\n
    Referer: http://www.le.com/\r\n
    Accept-Encoding: gzip, deflate\r\n
    Accept-Language: en-US,en;q=0.8,zh-TW;q=0.6,zh;q=0.4\r\n
    \r\n
    [Full request URI [truncated]: http://124.192.145.71/m3u8/lb_movie_350/desc.m3u8?stream_id=lb_movie_350&path=124.192.145.76,211.162.209.44,211.162.209.7&amltag=27&mltag=27&platid=10&splatid=1001&qos=4&fcheck=0&uid=2093663310.rp&keyitem=dpoO]
    [HTTP request 3/43]
    [Prev request in frame: 183]
    [Response in frame: 366]
    [Next request in frame: 512]

No.     Time               Source                Destination           Protocol Length Info
    366 07:20:48.007054    124.192.145.71        10.106.129.54         HTTP     1092   HTTP/1.1 200 OK  (application/vnd.apple.mpegurl)

Frame 366: 1092 bytes on wire (8736 bits), 1092 bytes captured (8736 bits) on interface 0
Ethernet II, Src: Hangzhou_75:c8:f5 (74:25:8a:75:c8:f5), Dst: AsustekC_34:f3:aa (9c:5c:8e:34:f3:aa)
Internet Protocol Version 4, Src: 124.192.145.71, Dst: 10.106.129.54
Transmission Control Protocol, Src Port: 80 (80), Dst Port: 56626 (56626), Seq: 19429, Ack: 3421, Len: 1026
[5 Reassembled TCP Segments (6818 bytes): #358(1448), #360(1448), #362(1448), #364(1448), #366(1026)]
Hypertext Transfer Protocol
    HTTP/1.1 200 OK\r\n
    Date: Thu, 29 Jun 2017 07:20:47 GMT\r\n
    Content-Type: application/vnd.apple.mpegurl\r\n
    Content-Length: 6596\r\n
    Connection: keep-alive\r\n
    Last-Modified: Thu, 29 Jun 2017 07:20:47 GMT\r\n
    Server: LeCloud Cache V2.43\r\n
    \r\n
    [HTTP response 3/43]
    [Time since request: 0.043499000 seconds]
    [Prev request in frame: 183]
    [Prev response in frame: 189]
    [Request in frame: 352]
    [Next request in frame: 512]
    [Next response in frame: 523]
Media Type

No.     Time               Source                Destination           Protocol Length Info
    466 07:20:48.980055    10.106.129.54         36.110.223.223        HTTP     950    GET /op/?acode=41&ap=ch%3Dwww%26pg%3Dindex%26bk%3Dfocus%26link%3D4&ar=0&cid=99&pid=-&vid=-&uid=-&uuid=-_14986410079625928782&lc=c30e888580fdf03b9c233103a9656e66&cur_url=http%3A%2F%2Fwww.le.com%2F&auid=-&targeturl=-&app=2017.3.1&app_name=Le_PC_Web&apprunid=c30e888580fdf03b9c233103a9656e66_1498718686630&nt=none&p1=1&p2=10&stime=1498720848971&ctime=1498720848971&r=149052292550 HTTP/1.1 

Frame 466: 950 bytes on wire (7600 bits), 950 bytes captured (7600 bits) on interface 0
Ethernet II, Src: AsustekC_34:f3:aa (9c:5c:8e:34:f3:aa), Dst: Hangzhou_75:c8:f5 (74:25:8a:75:c8:f5)
Internet Protocol Version 4, Src: 10.106.129.54, Dst: 36.110.223.223
Transmission Control Protocol, Src Port: 34484 (34484), Dst Port: 80 (80), Seq: 1, Ack: 1, Len: 884
Hypertext Transfer Protocol
     [truncated]GET /op/?acode=41&ap=ch%3Dwww%26pg%3Dindex%26bk%3Dfocus%26link%3D4&ar=0&cid=99&pid=-&vid=-&uid=-&uuid=-_14986410079625928782&lc=c30e888580fdf03b9c233103a9656e66&cur_url=http%3A%2F%2Fwww.le.com%2F&auid=-&targeturl=-&app=2017.3.1
    Host: dc.letv.com\r\n
    Connection: keep-alive\r\n
    User-Agent: Mozilla/5.0 (X11; Linux x86_64) AppleWebKit/537.36 (KHTML, like Gecko) Chrome/59.0.3071.104 Safari/537.36\r\n
    Accept: image/webp,image/apng,image/*,*/*;q=0.8\r\n
    Referer: http://www.le.com/\r\n
    Accept-Encoding: gzip, deflate\r\n
    Accept-Language: en-US,en;q=0.8,zh-TW;q=0.6,zh;q=0.4\r\n
    Cookie: uid=JG7b+FlTcm+DXXt7AwXLAg==; ark_uuid=b1ee590380524342b96daec6bebd673b; IPX_EX_1=1498641009330; ARK_IPX=124.202.196.78X218.241.251.150; IPX_EX_0=1498641009342\r\n
    \r\n
    [Full request URI [truncated]: http://dc.letv.com/op/?acode=41&ap=ch%3Dwww%26pg%3Dindex%26bk%3Dfocus%26link%3D4&ar=0&cid=99&pid=-&vid=-&uid=-&uuid=-_14986410079625928782&lc=c30e888580fdf03b9c233103a9656e66&cur_url=http%3A%2F%2Fwww.le.com%2F]
    [HTTP request 1/1]
    [Response in frame: 469]

No.     Time               Source                Destination           Protocol Length Info
    469 07:20:48.988354    36.110.223.223        10.106.129.54         HTTP     266    HTTP/1.1 200 OK 

Frame 469: 266 bytes on wire (2128 bits), 266 bytes captured (2128 bits) on interface 0
Ethernet II, Src: Hangzhou_75:c8:f5 (74:25:8a:75:c8:f5), Dst: AsustekC_34:f3:aa (9c:5c:8e:34:f3:aa)
Internet Protocol Version 4, Src: 36.110.223.223, Dst: 10.106.129.54
Transmission Control Protocol, Src Port: 80 (80), Dst Port: 34484 (34484), Seq: 1, Ack: 885, Len: 200
Hypertext Transfer Protocol
    HTTP/1.1 200 OK\r\n
    Server: nginx/1.2.9\r\n
    Date: Thu, 29 Jun 2017 07:20:48 GMT\r\n
    Content-Type: text/html; charset=ISO-8859-1\r\n
    Content-Length: 0\r\n
    Connection: keep-alive\r\n
    Cache-Control: no-cache,max-age=0\r\n
    \r\n
    [HTTP response 1/1]
    [Time since request: 0.008299000 seconds]
    [Request in frame: 466]

No.     Time               Source                Destination           Protocol Length Info
    512 07:20:49.491746    10.106.129.54         124.192.145.71        HTTP     1206   GET /m3u8/lb_movie_350/desc.m3u8?stream_id=lb_movie_350&path=124.192.145.76,211.162.209.44,211.162.209.7&amltag=27&mltag=27&platid=10&splatid=1001&qos=4&fcheck=0&uid=2093663310.rp&keyitem=dpoOd-l3AnupIUuBI8VtFwmKzWltcfnZpngeV5Yo3I1Oleh6yGrbVeKRoRQ.&ntm=1498738800&nkey2=32f5dc59870aea9315b55fed8ab4676f&nkey=d87bb4ae4b06bdedc77d890f6d6ded56&tag=live&video_type=m3u8&useloc=0&mslice=5&ver=live_3&uidx=0&errc=0&gn=398&ndtype=0&lrtmcd=107&buss=27&cips=124.202.196.78&geo=CN-1-12-16&tmn=1498720499&pnl=398,398,1937,536&ext=m3u8&termid=1&hwtype=un&playid=1&sign=live_web&ostype=Linux&p1=1&p2=10&p3=-&uuid=A94FB6803E929657537BC439513EE0F91BE8AE93_0&vkit=20170511&station=224&tm=1498720499863&key=522a85facf91993f9f11e584594a39f0&abtimeshift=1498719071&rdm=1498720849488&r=1498720849488&appid=500 HTTP/1.1 

Frame 512: 1206 bytes on wire (9648 bits), 1206 bytes captured (9648 bits) on interface 0
Ethernet II, Src: AsustekC_34:f3:aa (9c:5c:8e:34:f3:aa), Dst: Hangzhou_75:c8:f5 (74:25:8a:75:c8:f5)
Internet Protocol Version 4, Src: 10.106.129.54, Dst: 124.192.145.71
Transmission Control Protocol, Src Port: 56626 (56626), Dst Port: 80 (80), Seq: 3421, Ack: 20455, Len: 1140
Hypertext Transfer Protocol
     [truncated]GET /m3u8/lb_movie_350/desc.m3u8?stream_id=lb_movie_350&path=124.192.145.76,211.162.209.44,211.162.209.7&amltag=27&mltag=27&platid=10&splatid=1001&qos=4&fcheck=0&uid=2093663310.rp&keyitem=dpoOd-l3AnupIUuBI8VtFwmKzWltcfnZpngeV5Y
    Host: 124.192.145.71\r\n
    Connection: keep-alive\r\n
    User-Agent: Mozilla/5.0 (X11; Linux x86_64) AppleWebKit/537.36 (KHTML, like Gecko) Chrome/59.0.3071.104 Safari/537.36\r\n
    X-Requested-With: ShockwaveFlash/26.0.0.131\r\n
    Accept: */*\r\n
    Referer: http://www.le.com/\r\n
    Accept-Encoding: gzip, deflate\r\n
    Accept-Language: en-US,en;q=0.8,zh-TW;q=0.6,zh;q=0.4\r\n
    \r\n
    [Full request URI [truncated]: http://124.192.145.71/m3u8/lb_movie_350/desc.m3u8?stream_id=lb_movie_350&path=124.192.145.76,211.162.209.44,211.162.209.7&amltag=27&mltag=27&platid=10&splatid=1001&qos=4&fcheck=0&uid=2093663310.rp&keyitem=dpoO]
    [HTTP request 4/43]
    [Prev request in frame: 352]
    [Response in frame: 523]
    [Next request in frame: 623]

No.     Time               Source                Destination           Protocol Length Info
    523 07:20:49.533796    124.192.145.71        10.106.129.54         HTTP     2540   HTTP/1.1 200 OK  (application/vnd.apple.mpegurl)

Frame 523: 2540 bytes on wire (20320 bits), 2540 bytes captured (20320 bits) on interface 0
Ethernet II, Src: Hangzhou_75:c8:f5 (74:25:8a:75:c8:f5), Dst: AsustekC_34:f3:aa (9c:5c:8e:34:f3:aa)
Internet Protocol Version 4, Src: 124.192.145.71, Dst: 10.106.129.54
Transmission Control Protocol, Src Port: 80 (80), Dst Port: 56626 (56626), Seq: 24799, Ack: 4561, Len: 2474
[4 Reassembled TCP Segments (6818 bytes): #517(1448), #519(1448), #521(1448), #523(2474)]
Hypertext Transfer Protocol
    HTTP/1.1 200 OK\r\n
    Date: Thu, 29 Jun 2017 07:20:49 GMT\r\n
    Content-Type: application/vnd.apple.mpegurl\r\n
    Content-Length: 6596\r\n
    Connection: keep-alive\r\n
    Last-Modified: Thu, 29 Jun 2017 07:20:49 GMT\r\n
    Server: LeCloud Cache V2.43\r\n
    \r\n
    [HTTP response 4/43]
    [Time since request: 0.042050000 seconds]
    [Prev request in frame: 352]
    [Prev response in frame: 366]
    [Request in frame: 512]
    [Next request in frame: 623]
    [Next response in frame: 630]
Media Type

No.     Time               Source                Destination           Protocol Length Info
    623 07:20:51.034917    10.106.129.54         124.192.145.71        HTTP     1206   GET /m3u8/lb_movie_350/desc.m3u8?stream_id=lb_movie_350&path=124.192.145.76,211.162.209.44,211.162.209.7&amltag=27&mltag=27&platid=10&splatid=1001&qos=4&fcheck=0&uid=2093663310.rp&keyitem=dpoOd-l3AnupIUuBI8VtFwmKzWltcfnZpngeV5Yo3I1Oleh6yGrbVeKRoRQ.&ntm=1498738800&nkey2=32f5dc59870aea9315b55fed8ab4676f&nkey=d87bb4ae4b06bdedc77d890f6d6ded56&tag=live&video_type=m3u8&useloc=0&mslice=5&ver=live_3&uidx=0&errc=0&gn=398&ndtype=0&lrtmcd=107&buss=27&cips=124.202.196.78&geo=CN-1-12-16&tmn=1498720499&pnl=398,398,1937,536&ext=m3u8&termid=1&hwtype=un&playid=1&sign=live_web&ostype=Linux&p1=1&p2=10&p3=-&uuid=A94FB6803E929657537BC439513EE0F91BE8AE93_0&vkit=20170511&station=224&tm=1498720499863&key=522a85facf91993f9f11e584594a39f0&abtimeshift=1498719071&rdm=1498720851030&r=1498720851031&appid=500 HTTP/1.1 

Frame 623: 1206 bytes on wire (9648 bits), 1206 bytes captured (9648 bits) on interface 0
Ethernet II, Src: AsustekC_34:f3:aa (9c:5c:8e:34:f3:aa), Dst: Hangzhou_75:c8:f5 (74:25:8a:75:c8:f5)
Internet Protocol Version 4, Src: 10.106.129.54, Dst: 124.192.145.71
Transmission Control Protocol, Src Port: 56626 (56626), Dst Port: 80 (80), Seq: 4561, Ack: 27273, Len: 1140
Hypertext Transfer Protocol
     [truncated]GET /m3u8/lb_movie_350/desc.m3u8?stream_id=lb_movie_350&path=124.192.145.76,211.162.209.44,211.162.209.7&amltag=27&mltag=27&platid=10&splatid=1001&qos=4&fcheck=0&uid=2093663310.rp&keyitem=dpoOd-l3AnupIUuBI8VtFwmKzWltcfnZpngeV5Y
    Host: 124.192.145.71\r\n
    Connection: keep-alive\r\n
    User-Agent: Mozilla/5.0 (X11; Linux x86_64) AppleWebKit/537.36 (KHTML, like Gecko) Chrome/59.0.3071.104 Safari/537.36\r\n
    X-Requested-With: ShockwaveFlash/26.0.0.131\r\n
    Accept: */*\r\n
    Referer: http://www.le.com/\r\n
    Accept-Encoding: gzip, deflate\r\n
    Accept-Language: en-US,en;q=0.8,zh-TW;q=0.6,zh;q=0.4\r\n
    \r\n
    [Full request URI [truncated]: http://124.192.145.71/m3u8/lb_movie_350/desc.m3u8?stream_id=lb_movie_350&path=124.192.145.76,211.162.209.44,211.162.209.7&amltag=27&mltag=27&platid=10&splatid=1001&qos=4&fcheck=0&uid=2093663310.rp&keyitem=dpoO]
    [HTTP request 5/43]
    [Prev request in frame: 512]
    [Response in frame: 630]
    [Next request in frame: 740]

No.     Time               Source                Destination           Protocol Length Info
    630 07:20:51.078145    124.192.145.71        10.106.129.54         HTTP     1514   HTTP/1.1 200 OK  (application/vnd.apple.mpegurl)

Frame 630: 1514 bytes on wire (12112 bits), 1514 bytes captured (12112 bits) on interface 0
Ethernet II, Src: Hangzhou_75:c8:f5 (74:25:8a:75:c8:f5), Dst: AsustekC_34:f3:aa (9c:5c:8e:34:f3:aa)
Internet Protocol Version 4, Src: 124.192.145.71, Dst: 10.106.129.54
Transmission Control Protocol, Src Port: 80 (80), Dst Port: 56626 (56626), Seq: 27273, Ack: 5701, Len: 1448
Hypertext Transfer Protocol
    HTTP/1.1 200 OK\r\n
    Date: Thu, 29 Jun 2017 07:20:50 GMT\r\n
    Content-Type: application/vnd.apple.mpegurl\r\n
    Content-Length: 6596\r\n
    Connection: keep-alive\r\n
    Last-Modified: Thu, 29 Jun 2017 07:20:50 GMT\r\n
    Server: LeCloud Cache V2.43\r\n
    \r\n
    [HTTP response 5/43]
    [Time since request: 0.043228000 seconds]
    [Prev request in frame: 512]
    [Prev response in frame: 523]
    [Request in frame: 623]
    [Next request in frame: 740]
    [Next response in frame: 745]
Media Type

No.     Time               Source                Destination           Protocol Length Info
    740 07:20:52.557670    10.106.129.54         124.192.145.71        HTTP     1206   GET /m3u8/lb_movie_350/desc.m3u8?stream_id=lb_movie_350&path=124.192.145.76,211.162.209.44,211.162.209.7&amltag=27&mltag=27&platid=10&splatid=1001&qos=4&fcheck=0&uid=2093663310.rp&keyitem=dpoOd-l3AnupIUuBI8VtFwmKzWltcfnZpngeV5Yo3I1Oleh6yGrbVeKRoRQ.&ntm=1498738800&nkey2=32f5dc59870aea9315b55fed8ab4676f&nkey=d87bb4ae4b06bdedc77d890f6d6ded56&tag=live&video_type=m3u8&useloc=0&mslice=5&ver=live_3&uidx=0&errc=0&gn=398&ndtype=0&lrtmcd=107&buss=27&cips=124.202.196.78&geo=CN-1-12-16&tmn=1498720499&pnl=398,398,1937,536&ext=m3u8&termid=1&hwtype=un&playid=1&sign=live_web&ostype=Linux&p1=1&p2=10&p3=-&uuid=A94FB6803E929657537BC439513EE0F91BE8AE93_0&vkit=20170511&station=224&tm=1498720499863&key=522a85facf91993f9f11e584594a39f0&abtimeshift=1498719071&rdm=1498720852553&r=1498720852553&appid=500 HTTP/1.1 

Frame 740: 1206 bytes on wire (9648 bits), 1206 bytes captured (9648 bits) on interface 0
Ethernet II, Src: AsustekC_34:f3:aa (9c:5c:8e:34:f3:aa), Dst: Hangzhou_75:c8:f5 (74:25:8a:75:c8:f5)
Internet Protocol Version 4, Src: 10.106.129.54, Dst: 124.192.145.71
Transmission Control Protocol, Src Port: 56626 (56626), Dst Port: 80 (80), Seq: 5701, Ack: 34091, Len: 1140
Hypertext Transfer Protocol
     [truncated]GET /m3u8/lb_movie_350/desc.m3u8?stream_id=lb_movie_350&path=124.192.145.76,211.162.209.44,211.162.209.7&amltag=27&mltag=27&platid=10&splatid=1001&qos=4&fcheck=0&uid=2093663310.rp&keyitem=dpoOd-l3AnupIUuBI8VtFwmKzWltcfnZpngeV5Y
    Host: 124.192.145.71\r\n
    Connection: keep-alive\r\n
    User-Agent: Mozilla/5.0 (X11; Linux x86_64) AppleWebKit/537.36 (KHTML, like Gecko) Chrome/59.0.3071.104 Safari/537.36\r\n
    X-Requested-With: ShockwaveFlash/26.0.0.131\r\n
    Accept: */*\r\n
    Referer: http://www.le.com/\r\n
    Accept-Encoding: gzip, deflate\r\n
    Accept-Language: en-US,en;q=0.8,zh-TW;q=0.6,zh;q=0.4\r\n
    \r\n
    [Full request URI [truncated]: http://124.192.145.71/m3u8/lb_movie_350/desc.m3u8?stream_id=lb_movie_350&path=124.192.145.76,211.162.209.44,211.162.209.7&amltag=27&mltag=27&platid=10&splatid=1001&qos=4&fcheck=0&uid=2093663310.rp&keyitem=dpoO]
    [HTTP request 6/43]
    [Prev request in frame: 623]
    [Response in frame: 745]
    [Next request in frame: 867]

No.     Time               Source                Destination           Protocol Length Info
    745 07:20:52.600184    124.192.145.71        10.106.129.54         HTTP     2962   HTTP/1.1 200 OK  (application/vnd.apple.mpegurl)

Frame 745: 2962 bytes on wire (23696 bits), 2962 bytes captured (23696 bits) on interface 0
Ethernet II, Src: Hangzhou_75:c8:f5 (74:25:8a:75:c8:f5), Dst: AsustekC_34:f3:aa (9c:5c:8e:34:f3:aa)
Internet Protocol Version 4, Src: 124.192.145.71, Dst: 10.106.129.54
Transmission Control Protocol, Src Port: 80 (80), Dst Port: 56626 (56626), Seq: 34091, Ack: 6841, Len: 2896
Hypertext Transfer Protocol
    HTTP/1.1 200 OK\r\n
    Date: Thu, 29 Jun 2017 07:20:52 GMT\r\n
    Content-Type: application/vnd.apple.mpegurl\r\n
    Content-Length: 6596\r\n
    Connection: keep-alive\r\n
    Last-Modified: Thu, 29 Jun 2017 07:20:52 GMT\r\n
    Server: LeCloud Cache V2.43\r\n
    \r\n
    [HTTP response 6/43]
    [Time since request: 0.042514000 seconds]
    [Prev request in frame: 623]
    [Prev response in frame: 630]
    [Request in frame: 740]
    [Next request in frame: 867]
    [Next response in frame: 888]
Media Type

