No.     Time               Source                Destination           Protocol Length Info
     55 10:53:23.584320    10.106.129.54         10.106.129.246        SSDP     480    HTTP/1.1 200 OK 

Frame 55: 480 bytes on wire (3840 bits), 480 bytes captured (3840 bits) on interface 0
Ethernet II, Src: AsustekC_34:f3:aa (9c:5c:8e:34:f3:aa), Dst: 58:ef:68:e4:96:59 (58:ef:68:e4:96:59)
Internet Protocol Version 4, Src: 10.106.129.54, Dst: 10.106.129.246
User Datagram Protocol, Src Port: 1900 (1900), Dst Port: 2974 (2974)
Hypertext Transfer Protocol
    HTTP/1.1 200 OK\r\n
    ST: upnp:rootdevice\r\n
    USN: uuid:3ced1185-a624-4fc1-be23-ce28fc76a1b5::upnp:rootdevice\r\n
    Location: http://10.106.129.54:2869/upnphost/udhisapi.dll?content=uuid:3ced1185-a624-4fc1-be23-ce28fc76a1b5\r\n
    OPT:"http://schemas.upnp.org/upnp/1/0/"; ns=01\r\n
    01-NLS: 778349a09ed83ae83c506b0acb1a4ffc\r\n
    Cache-Control: max-age=900\r\n
    Server: Microsoft-Windows/10.0 UPnP/1.0 UPnP-Device-Host/1.0\r\n
    Ext: \r\n
    Date: Fri, 18 May 2018 06:46:37 GMT\r\n
    \r\n
    [HTTP response 1/318]
    [Next response in frame: 368]

No.     Time               Source                Destination           Protocol Length Info
    166 10:53:23.992443    10.106.129.54         125.39.213.73         HTTP     545    GET /livemsg?o=392&adtype=LD&soid=+jbGb0wAWv8hGQEncAD/d4BMAXMn&r90=1&l=4018&refluence=4018&requestl=4018&tagid=0&pf=in&si=236051210&ev=6.0.408.408&aver_flag=6148&traffic=&ip_filter=0&ufc_filter=55&ufc_stra=0&ufc_match=55&backfunnel=401&use_axp=0&axpheader=1&use_txp=0&txpheader=1&st_id_t=0&flow_reuse=1&ping_data=dXBfdmVyc2lvbj1WNi4wLjQwOC40MDg=&vid=y0516qhrpw8&pf_ex=pc&live=0&channelId=1&page=coolOpen&aid_tpid=28&aid_tpid2=11670&aid_tpid3=11671&aid_dura=80&aid_vid_drm=0&aid_copyright=107&aid_vip_type=1&url=https://v.qq.com/tech&from=0&pf=in&v=3.5.52&dura=&coverid=&vptag=www_baidu_com|v_tech_new:img&oadid=4018&lcount=1&t=0&pf_ex=pc&tpid=28&chid=0 HTTP/1.1 

Frame 166: 545 bytes on wire (4360 bits), 545 bytes captured (4360 bits) on interface 0
Ethernet II, Src: AsustekC_34:f3:aa (9c:5c:8e:34:f3:aa), Dst: Hangzhou_75:c8:f5 (74:25:8a:75:c8:f5)
Internet Protocol Version 4, Src: 10.106.129.54, Dst: 125.39.213.73
Transmission Control Protocol, Src Port: 24984 (24984), Dst Port: 80 (80), Seq: 2881, Ack: 1, Len: 491
[3 Reassembled TCP Segments (3371 bytes): #164(1440), #165(1440), #166(491)]
Hypertext Transfer Protocol
     [truncated]GET /livemsg?o=392&adtype=LD&soid=+jbGb0wAWv8hGQEncAD/d4BMAXMn&r90=1&l=4018&refluence=4018&requestl=4018&tagid=0&pf=in&si=236051210&ev=6.0.408.408&aver_flag=6148&traffic=&ip_filter=0&ufc_filter=55&ufc_stra=0&ufc_match=55&backfu
    Host: livep.l.qq.com\r\n
    Connection: keep-alive\r\n
    User-Agent: Mozilla/5.0 (Windows NT 10.0; Win64; x64) AppleWebKit/537.36 (KHTML, like Gecko) Chrome/66.0.3359.139 Safari/537.36\r\n
    Accept: image/webp,image/apng,image/*,*/*;q=0.8\r\n
    Accept-Encoding: gzip, deflate\r\n
    Accept-Language: en-US,en;q=0.9,zh-TW;q=0.8,zh;q=0.7\r\n
     [truncated]Cookie: pgv_pvi=7659522048; pgv_si=s3813394432; RK=Olbs95KBUg; ptcz=2544f6f4ae92c346d1b59688e6f45a925ec0f9f8ef06a7a39332f6f8fe201348; _qpsvr_localtk=0.32806539237918764; tvfe_boss_uuid=3cdb9e54c3859a7f; appuser=3B22E15EAE54C942
    \r\n
    [Full request URI [truncated]: http://livep.l.qq.com/livemsg?o=392&adtype=LD&soid=+jbGb0wAWv8hGQEncAD/d4BMAXMn&r90=1&l=4018&refluence=4018&requestl=4018&tagid=0&pf=in&si=236051210&ev=6.0.408.408&aver_flag=6148&traffic=&ip_filter=0&ufc_filte]
    [HTTP request 1/2]
    [Response in frame: 172]
    [Next request in frame: 191]

No.     Time               Source                Destination           Protocol Length Info
    172 10:53:24.001373    125.39.213.73         10.106.129.54         HTTP     326    HTTP/1.1 200 OK  (text/html)

Frame 172: 326 bytes on wire (2608 bits), 326 bytes captured (2608 bits) on interface 0
Ethernet II, Src: Hangzhou_75:c8:f5 (74:25:8a:75:c8:f5), Dst: AsustekC_34:f3:aa (9c:5c:8e:34:f3:aa)
Internet Protocol Version 4, Src: 125.39.213.73, Dst: 10.106.129.54
Transmission Control Protocol, Src Port: 80 (80), Dst Port: 24984 (24984), Seq: 1, Ack: 3372, Len: 272
Hypertext Transfer Protocol
    HTTP/1.1 200 OK\r\n
    Date: Fri, 18 May 2018 10:53:13 GMT\r\n
    Content-Type: text/html; charset=GB2312\r\n
    Transfer-Encoding: chunked\r\n
    Connection: keep-alive\r\n
    Cache-Control: no-cache\r\n
    Set-Cookie: short_video=; Domain=.l.qq.com; Path=/; Expires=Thu, 01 Jan 1970 08:00:00 GMT;\r\n
    \r\n
    [HTTP response 1/2]
    [Time since request: 0.008930000 seconds]
    [Request in frame: 166]
    [Next request in frame: 191]
    [Next response in frame: 245]
    HTTP chunked response
Line-based text data: text/html

No.     Time               Source                Destination           Protocol Length Info
    181 10:53:24.004195    10.106.129.54         125.39.213.73         HTTP     518    GET /livemsg?o=392&adtype=LD&soid=+jbGb0wAWv8hGQEncAGn92KbAXMn&r90=1&l=4018&refluence=4018&requestl=4018&tagid=0&pf=in&si=236051210&ev=6.0.408.408&aver_flag=0&traffic=&ip_filter=0&ufc_filter=55&backfunnel=401&use_axp=0&axpheader=1&use_txp=0&txpheader=1&st_id_t=0&flow_reuse=1&ping_data=dXBfdmVyc2lvbj1WNi4wLjQwOC40MDg=&vid=y0516qhrpw8&pf_ex=pc&live=0&channelId=1&page=coolOpen&aid_tpid=28&aid_tpid2=11670&aid_tpid3=11671&aid_dura=80&aid_vid_drm=0&aid_copyright=107&aid_vip_type=1&url=https://v.qq.com/tech&from=0&pf=in&v=3.5.52&dura=&coverid=&vptag=www_baidu_com|v_tech_new:img&oadid=4018&lcount=2&t=0&pf_ex=pc&tpid=28&chid=0 HTTP/1.1 

Frame 181: 518 bytes on wire (4144 bits), 518 bytes captured (4144 bits) on interface 0
Ethernet II, Src: AsustekC_34:f3:aa (9c:5c:8e:34:f3:aa), Dst: Hangzhou_75:c8:f5 (74:25:8a:75:c8:f5)
Internet Protocol Version 4, Src: 10.106.129.54, Dst: 125.39.213.73
Transmission Control Protocol, Src Port: 24992 (24992), Dst Port: 80 (80), Seq: 2881, Ack: 1, Len: 464
[3 Reassembled TCP Segments (3344 bytes): #179(1440), #180(1440), #181(464)]
Hypertext Transfer Protocol
     [truncated]GET /livemsg?o=392&adtype=LD&soid=+jbGb0wAWv8hGQEncAGn92KbAXMn&r90=1&l=4018&refluence=4018&requestl=4018&tagid=0&pf=in&si=236051210&ev=6.0.408.408&aver_flag=0&traffic=&ip_filter=0&ufc_filter=55&backfunnel=401&use_axp=0&axpheade
    Host: livep.l.qq.com\r\n
    Connection: keep-alive\r\n
    User-Agent: Mozilla/5.0 (Windows NT 10.0; Win64; x64) AppleWebKit/537.36 (KHTML, like Gecko) Chrome/66.0.3359.139 Safari/537.36\r\n
    Accept: image/webp,image/apng,image/*,*/*;q=0.8\r\n
    Accept-Encoding: gzip, deflate\r\n
    Accept-Language: en-US,en;q=0.9,zh-TW;q=0.8,zh;q=0.7\r\n
     [truncated]Cookie: pgv_pvi=7659522048; pgv_si=s3813394432; RK=Olbs95KBUg; ptcz=2544f6f4ae92c346d1b59688e6f45a925ec0f9f8ef06a7a39332f6f8fe201348; _qpsvr_localtk=0.32806539237918764; tvfe_boss_uuid=3cdb9e54c3859a7f; appuser=3B22E15EAE54C942
    \r\n
    [Full request URI [truncated]: http://livep.l.qq.com/livemsg?o=392&adtype=LD&soid=+jbGb0wAWv8hGQEncAGn92KbAXMn&r90=1&l=4018&refluence=4018&requestl=4018&tagid=0&pf=in&si=236051210&ev=6.0.408.408&aver_flag=0&traffic=&ip_filter=0&ufc_filter=5]
    [HTTP request 1/6]
    [Response in frame: 200]
    [Next request in frame: 223]

No.     Time               Source                Destination           Protocol Length Info
    191 10:53:24.011791    10.106.129.54         125.39.213.73         HTTP     518    GET /livemsg?o=392&adtype=LD&soid=+jbGb0wAWv8hGQEncAIOcTQ4AXMn&r90=1&l=4018&refluence=4018&requestl=4018&tagid=0&pf=in&si=236051210&ev=6.0.408.408&aver_flag=0&traffic=&ip_filter=0&ufc_filter=55&backfunnel=401&use_axp=0&axpheader=1&use_txp=0&txpheader=1&st_id_t=0&flow_reuse=1&ping_data=dXBfdmVyc2lvbj1WNi4wLjQwOC40MDg=&vid=y0516qhrpw8&pf_ex=pc&live=0&channelId=1&page=coolOpen&aid_tpid=28&aid_tpid2=11670&aid_tpid3=11671&aid_dura=80&aid_vid_drm=0&aid_copyright=107&aid_vip_type=1&url=https://v.qq.com/tech&from=0&pf=in&v=3.5.52&dura=&coverid=&vptag=www_baidu_com|v_tech_new:img&oadid=4018&lcount=3&t=0&pf_ex=pc&tpid=28&chid=0 HTTP/1.1 

Frame 191: 518 bytes on wire (4144 bits), 518 bytes captured (4144 bits) on interface 0
Ethernet II, Src: AsustekC_34:f3:aa (9c:5c:8e:34:f3:aa), Dst: Hangzhou_75:c8:f5 (74:25:8a:75:c8:f5)
Internet Protocol Version 4, Src: 10.106.129.54, Dst: 125.39.213.73
Transmission Control Protocol, Src Port: 24984 (24984), Dst Port: 80 (80), Seq: 6252, Ack: 278, Len: 464
[3 Reassembled TCP Segments (3344 bytes): #189(1440), #190(1440), #191(464)]
Hypertext Transfer Protocol
     [truncated]GET /livemsg?o=392&adtype=LD&soid=+jbGb0wAWv8hGQEncAIOcTQ4AXMn&r90=1&l=4018&refluence=4018&requestl=4018&tagid=0&pf=in&si=236051210&ev=6.0.408.408&aver_flag=0&traffic=&ip_filter=0&ufc_filter=55&backfunnel=401&use_axp=0&axpheade
    Host: livep.l.qq.com\r\n
    Connection: keep-alive\r\n
    User-Agent: Mozilla/5.0 (Windows NT 10.0; Win64; x64) AppleWebKit/537.36 (KHTML, like Gecko) Chrome/66.0.3359.139 Safari/537.36\r\n
    Accept: image/webp,image/apng,image/*,*/*;q=0.8\r\n
    Accept-Encoding: gzip, deflate\r\n
    Accept-Language: en-US,en;q=0.9,zh-TW;q=0.8,zh;q=0.7\r\n
     [truncated]Cookie: pgv_pvi=7659522048; pgv_si=s3813394432; RK=Olbs95KBUg; ptcz=2544f6f4ae92c346d1b59688e6f45a925ec0f9f8ef06a7a39332f6f8fe201348; _qpsvr_localtk=0.32806539237918764; tvfe_boss_uuid=3cdb9e54c3859a7f; appuser=3B22E15EAE54C942
    \r\n
    [Full request URI [truncated]: http://livep.l.qq.com/livemsg?o=392&adtype=LD&soid=+jbGb0wAWv8hGQEncAIOcTQ4AXMn&r90=1&l=4018&refluence=4018&requestl=4018&tagid=0&pf=in&si=236051210&ev=6.0.408.408&aver_flag=0&traffic=&ip_filter=0&ufc_filter=5]
    [HTTP request 2/2]
    [Prev request in frame: 166]
    [Response in frame: 245]

No.     Time               Source                Destination           Protocol Length Info
    194 10:53:24.012118    10.106.129.54         125.39.213.73         HTTP     518    GET /livemsg?o=392&adtype=LD&soid=+jbGb0wAWv8hGQEncANW8dbvAXMn&r90=1&l=4018&refluence=4018&requestl=4018&tagid=0&pf=in&si=236051210&ev=6.0.408.408&aver_flag=0&traffic=&ip_filter=0&ufc_filter=55&backfunnel=401&use_axp=0&axpheader=1&use_txp=0&txpheader=1&st_id_t=0&flow_reuse=1&ping_data=dXBfdmVyc2lvbj1WNi4wLjQwOC40MDg=&vid=y0516qhrpw8&pf_ex=pc&live=0&channelId=1&page=coolOpen&aid_tpid=28&aid_tpid2=11670&aid_tpid3=11671&aid_dura=80&aid_vid_drm=0&aid_copyright=107&aid_vip_type=1&url=https://v.qq.com/tech&from=0&pf=in&v=3.5.52&dura=&coverid=&vptag=www_baidu_com|v_tech_new:img&oadid=4018&lcount=4&t=0&pf_ex=pc&tpid=28&chid=0 HTTP/1.1 

Frame 194: 518 bytes on wire (4144 bits), 518 bytes captured (4144 bits) on interface 0
Ethernet II, Src: AsustekC_34:f3:aa (9c:5c:8e:34:f3:aa), Dst: Hangzhou_75:c8:f5 (74:25:8a:75:c8:f5)
Internet Protocol Version 4, Src: 10.106.129.54, Dst: 125.39.213.73
Transmission Control Protocol, Src Port: 24993 (24993), Dst Port: 80 (80), Seq: 2881, Ack: 1, Len: 464
[3 Reassembled TCP Segments (3344 bytes): #192(1440), #193(1440), #194(464)]
Hypertext Transfer Protocol
     [truncated]GET /livemsg?o=392&adtype=LD&soid=+jbGb0wAWv8hGQEncANW8dbvAXMn&r90=1&l=4018&refluence=4018&requestl=4018&tagid=0&pf=in&si=236051210&ev=6.0.408.408&aver_flag=0&traffic=&ip_filter=0&ufc_filter=55&backfunnel=401&use_axp=0&axpheade
    Host: livep.l.qq.com\r\n
    Connection: keep-alive\r\n
    User-Agent: Mozilla/5.0 (Windows NT 10.0; Win64; x64) AppleWebKit/537.36 (KHTML, like Gecko) Chrome/66.0.3359.139 Safari/537.36\r\n
    Accept: image/webp,image/apng,image/*,*/*;q=0.8\r\n
    Accept-Encoding: gzip, deflate\r\n
    Accept-Language: en-US,en;q=0.9,zh-TW;q=0.8,zh;q=0.7\r\n
     [truncated]Cookie: pgv_pvi=7659522048; pgv_si=s3813394432; RK=Olbs95KBUg; ptcz=2544f6f4ae92c346d1b59688e6f45a925ec0f9f8ef06a7a39332f6f8fe201348; _qpsvr_localtk=0.32806539237918764; tvfe_boss_uuid=3cdb9e54c3859a7f; appuser=3B22E15EAE54C942
    \r\n
    [Full request URI [truncated]: http://livep.l.qq.com/livemsg?o=392&adtype=LD&soid=+jbGb0wAWv8hGQEncANW8dbvAXMn&r90=1&l=4018&refluence=4018&requestl=4018&tagid=0&pf=in&si=236051210&ev=6.0.408.408&aver_flag=0&traffic=&ip_filter=0&ufc_filter=5]
    [HTTP request 1/1]
    [Response in frame: 233]

No.     Time               Source                Destination           Protocol Length Info
    200 10:53:24.013279    125.39.213.73         10.106.129.54         HTTP     234    HTTP/1.1 200 OK  (text/html)

Frame 200: 234 bytes on wire (1872 bits), 234 bytes captured (1872 bits) on interface 0
Ethernet II, Src: Hangzhou_75:c8:f5 (74:25:8a:75:c8:f5), Dst: AsustekC_34:f3:aa (9c:5c:8e:34:f3:aa)
Internet Protocol Version 4, Src: 125.39.213.73, Dst: 10.106.129.54
Transmission Control Protocol, Src Port: 80 (80), Dst Port: 24992 (24992), Seq: 1, Ack: 3345, Len: 180
Hypertext Transfer Protocol
    HTTP/1.1 200 OK\r\n
    Date: Fri, 18 May 2018 10:53:13 GMT\r\n
    Content-Type: text/html; charset=GB2312\r\n
    Transfer-Encoding: chunked\r\n
    Connection: keep-alive\r\n
    Cache-Control: no-cache\r\n
    \r\n
    [HTTP response 1/6]
    [Time since request: 0.009084000 seconds]
    [Request in frame: 181]
    [Next request in frame: 223]
    HTTP chunked response
Line-based text data: text/html

No.     Time               Source                Destination           Protocol Length Info
    205 10:53:24.013501    10.106.129.54         125.39.213.73         HTTP     518    GET /livemsg?o=392&adtype=LD&soid=+jbGb0wAWv8hGQEncAQdeuilAXMn&r90=1&l=4018&refluence=4018&requestl=4018&tagid=0&pf=in&si=236051210&ev=6.0.408.408&aver_flag=0&traffic=&ip_filter=0&ufc_filter=55&backfunnel=401&use_axp=0&axpheader=1&use_txp=0&txpheader=1&st_id_t=0&flow_reuse=1&ping_data=dXBfdmVyc2lvbj1WNi4wLjQwOC40MDg=&vid=y0516qhrpw8&pf_ex=pc&live=0&channelId=1&page=coolOpen&aid_tpid=28&aid_tpid2=11670&aid_tpid3=11671&aid_dura=80&aid_vid_drm=0&aid_copyright=107&aid_vip_type=1&url=https://v.qq.com/tech&from=0&pf=in&v=3.5.52&dura=&coverid=&vptag=www_baidu_com|v_tech_new:img&oadid=4018&lcount=5&t=0&pf_ex=pc&tpid=28&chid=0 HTTP/1.1 

Frame 205: 518 bytes on wire (4144 bits), 518 bytes captured (4144 bits) on interface 0
Ethernet II, Src: AsustekC_34:f3:aa (9c:5c:8e:34:f3:aa), Dst: Hangzhou_75:c8:f5 (74:25:8a:75:c8:f5)
Internet Protocol Version 4, Src: 10.106.129.54, Dst: 125.39.213.73
Transmission Control Protocol, Src Port: 24994 (24994), Dst Port: 80 (80), Seq: 2881, Ack: 1, Len: 464
[3 Reassembled TCP Segments (3344 bytes): #203(1440), #204(1440), #205(464)]
Hypertext Transfer Protocol
     [truncated]GET /livemsg?o=392&adtype=LD&soid=+jbGb0wAWv8hGQEncAQdeuilAXMn&r90=1&l=4018&refluence=4018&requestl=4018&tagid=0&pf=in&si=236051210&ev=6.0.408.408&aver_flag=0&traffic=&ip_filter=0&ufc_filter=55&backfunnel=401&use_axp=0&axpheade
    Host: livep.l.qq.com\r\n
    Connection: keep-alive\r\n
    User-Agent: Mozilla/5.0 (Windows NT 10.0; Win64; x64) AppleWebKit/537.36 (KHTML, like Gecko) Chrome/66.0.3359.139 Safari/537.36\r\n
    Accept: image/webp,image/apng,image/*,*/*;q=0.8\r\n
    Accept-Encoding: gzip, deflate\r\n
    Accept-Language: en-US,en;q=0.9,zh-TW;q=0.8,zh;q=0.7\r\n
     [truncated]Cookie: pgv_pvi=7659522048; pgv_si=s3813394432; RK=Olbs95KBUg; ptcz=2544f6f4ae92c346d1b59688e6f45a925ec0f9f8ef06a7a39332f6f8fe201348; _qpsvr_localtk=0.32806539237918764; tvfe_boss_uuid=3cdb9e54c3859a7f; appuser=3B22E15EAE54C942
    \r\n
    [Full request URI [truncated]: http://livep.l.qq.com/livemsg?o=392&adtype=LD&soid=+jbGb0wAWv8hGQEncAQdeuilAXMn&r90=1&l=4018&refluence=4018&requestl=4018&tagid=0&pf=in&si=236051210&ev=6.0.408.408&aver_flag=0&traffic=&ip_filter=0&ufc_filter=5]
    [HTTP request 1/2]
    [Response in frame: 249]
    [Next request in frame: 45161]

No.     Time               Source                Destination           Protocol Length Info
    211 10:53:24.015327    10.106.129.54         125.39.213.73         HTTP     518    GET /livemsg?o=392&adtype=LD&soid=+jbGb0wAWv8hGQEncAVF+gpyAXMn&r90=1&l=4018&refluence=4018&requestl=4018&tagid=0&pf=in&si=236051210&ev=6.0.408.408&aver_flag=0&traffic=&ip_filter=0&ufc_filter=55&backfunnel=401&use_axp=0&axpheader=1&use_txp=0&txpheader=1&st_id_t=0&flow_reuse=1&ping_data=dXBfdmVyc2lvbj1WNi4wLjQwOC40MDg=&vid=y0516qhrpw8&pf_ex=pc&live=0&channelId=1&page=coolOpen&aid_tpid=28&aid_tpid2=11670&aid_tpid3=11671&aid_dura=80&aid_vid_drm=0&aid_copyright=107&aid_vip_type=1&url=https://v.qq.com/tech&from=0&pf=in&v=3.5.52&dura=&coverid=&vptag=www_baidu_com|v_tech_new:img&oadid=4018&lcount=6&t=0&pf_ex=pc&tpid=28&chid=0 HTTP/1.1 

Frame 211: 518 bytes on wire (4144 bits), 518 bytes captured (4144 bits) on interface 0
Ethernet II, Src: AsustekC_34:f3:aa (9c:5c:8e:34:f3:aa), Dst: Hangzhou_75:c8:f5 (74:25:8a:75:c8:f5)
Internet Protocol Version 4, Src: 10.106.129.54, Dst: 125.39.213.73
Transmission Control Protocol, Src Port: 24995 (24995), Dst Port: 80 (80), Seq: 2881, Ack: 1, Len: 464
[3 Reassembled TCP Segments (3344 bytes): #209(1440), #210(1440), #211(464)]
Hypertext Transfer Protocol
     [truncated]GET /livemsg?o=392&adtype=LD&soid=+jbGb0wAWv8hGQEncAVF+gpyAXMn&r90=1&l=4018&refluence=4018&requestl=4018&tagid=0&pf=in&si=236051210&ev=6.0.408.408&aver_flag=0&traffic=&ip_filter=0&ufc_filter=55&backfunnel=401&use_axp=0&axpheade
    Host: livep.l.qq.com\r\n
    Connection: keep-alive\r\n
    User-Agent: Mozilla/5.0 (Windows NT 10.0; Win64; x64) AppleWebKit/537.36 (KHTML, like Gecko) Chrome/66.0.3359.139 Safari/537.36\r\n
    Accept: image/webp,image/apng,image/*,*/*;q=0.8\r\n
    Accept-Encoding: gzip, deflate\r\n
    Accept-Language: en-US,en;q=0.9,zh-TW;q=0.8,zh;q=0.7\r\n
     [truncated]Cookie: pgv_pvi=7659522048; pgv_si=s3813394432; RK=Olbs95KBUg; ptcz=2544f6f4ae92c346d1b59688e6f45a925ec0f9f8ef06a7a39332f6f8fe201348; _qpsvr_localtk=0.32806539237918764; tvfe_boss_uuid=3cdb9e54c3859a7f; appuser=3B22E15EAE54C942
    \r\n
    [Full request URI [truncated]: http://livep.l.qq.com/livemsg?o=392&adtype=LD&soid=+jbGb0wAWv8hGQEncAVF+gpyAXMn&r90=1&l=4018&refluence=4018&requestl=4018&tagid=0&pf=in&si=236051210&ev=6.0.408.408&aver_flag=0&traffic=&ip_filter=0&ufc_filter=5]
    [HTTP request 1/2]
    [Response in frame: 253]
    [Next request in frame: 45152]

No.     Time               Source                Destination           Protocol Length Info
    223 10:53:24.017334    10.106.129.54         125.39.213.73         HTTP     545    GET /livemsg?o=392&adtype=KB&soid=+jbGb0wAWv8hGQEncAANRKLqAXMn&r90=1&l=4018&refluence=4018&requestl=4018&tagid=0&pf=in&si=236051210&ev=6.0.408.408&aver_flag=6148&traffic=&ip_filter=0&ufc_filter=63&ufc_stra=0&ufc_match=63&backfunnel=401&use_axp=0&axpheader=1&use_txp=0&txpheader=1&st_id_t=0&flow_reuse=1&ping_data=dXBfdmVyc2lvbj1WNi4wLjQwOC40MDg=&vid=y0516qhrpw8&pf_ex=pc&live=0&channelId=1&page=coolOpen&aid_tpid=28&aid_tpid2=11670&aid_tpid3=11671&aid_dura=80&aid_vid_drm=0&aid_copyright=107&aid_vip_type=1&url=https://v.qq.com/tech&from=0&pf=in&v=3.5.52&dura=&coverid=&vptag=www_baidu_com|v_tech_new:img&oadid=4018&lcount=1&t=0&pf_ex=pc&tpid=28&chid=0 HTTP/1.1 

Frame 223: 545 bytes on wire (4360 bits), 545 bytes captured (4360 bits) on interface 0
Ethernet II, Src: AsustekC_34:f3:aa (9c:5c:8e:34:f3:aa), Dst: Hangzhou_75:c8:f5 (74:25:8a:75:c8:f5)
Internet Protocol Version 4, Src: 10.106.129.54, Dst: 125.39.213.73
Transmission Control Protocol, Src Port: 24992 (24992), Dst Port: 80 (80), Seq: 6225, Ack: 186, Len: 491
[3 Reassembled TCP Segments (3371 bytes): #221(1440), #222(1440), #223(491)]
Hypertext Transfer Protocol
     [truncated]GET /livemsg?o=392&adtype=KB&soid=+jbGb0wAWv8hGQEncAANRKLqAXMn&r90=1&l=4018&refluence=4018&requestl=4018&tagid=0&pf=in&si=236051210&ev=6.0.408.408&aver_flag=6148&traffic=&ip_filter=0&ufc_filter=63&ufc_stra=0&ufc_match=63&backfu
    Host: livep.l.qq.com\r\n
    Connection: keep-alive\r\n
    User-Agent: Mozilla/5.0 (Windows NT 10.0; Win64; x64) AppleWebKit/537.36 (KHTML, like Gecko) Chrome/66.0.3359.139 Safari/537.36\r\n
    Accept: image/webp,image/apng,image/*,*/*;q=0.8\r\n
    Accept-Encoding: gzip, deflate\r\n
    Accept-Language: en-US,en;q=0.9,zh-TW;q=0.8,zh;q=0.7\r\n
     [truncated]Cookie: pgv_pvi=7659522048; pgv_si=s3813394432; RK=Olbs95KBUg; ptcz=2544f6f4ae92c346d1b59688e6f45a925ec0f9f8ef06a7a39332f6f8fe201348; _qpsvr_localtk=0.32806539237918764; tvfe_boss_uuid=3cdb9e54c3859a7f; appuser=3B22E15EAE54C942
    \r\n
    [Full request URI [truncated]: http://livep.l.qq.com/livemsg?o=392&adtype=KB&soid=+jbGb0wAWv8hGQEncAANRKLqAXMn&r90=1&l=4018&refluence=4018&requestl=4018&tagid=0&pf=in&si=236051210&ev=6.0.408.408&aver_flag=6148&traffic=&ip_filter=0&ufc_filte]
    [HTTP request 2/6]
    [Prev request in frame: 181]
    [Next request in frame: 8939]

No.     Time               Source                Destination           Protocol Length Info
    233 10:53:24.019778    125.39.213.73         10.106.129.54         HTTP     234    HTTP/1.1 200 OK  (text/html)

Frame 233: 234 bytes on wire (1872 bits), 234 bytes captured (1872 bits) on interface 0
Ethernet II, Src: Hangzhou_75:c8:f5 (74:25:8a:75:c8:f5), Dst: AsustekC_34:f3:aa (9c:5c:8e:34:f3:aa)
Internet Protocol Version 4, Src: 125.39.213.73, Dst: 10.106.129.54
Transmission Control Protocol, Src Port: 80 (80), Dst Port: 24993 (24993), Seq: 1, Ack: 3345, Len: 180
Hypertext Transfer Protocol
    HTTP/1.1 200 OK\r\n
    Date: Fri, 18 May 2018 10:53:13 GMT\r\n
    Content-Type: text/html; charset=GB2312\r\n
    Transfer-Encoding: chunked\r\n
    Connection: keep-alive\r\n
    Cache-Control: no-cache\r\n
    \r\n
    [HTTP response 1/1]
    [Time since request: 0.007660000 seconds]
    [Request in frame: 194]
    HTTP chunked response
Line-based text data: text/html

No.     Time               Source                Destination           Protocol Length Info
    245 10:53:24.021526    125.39.213.73         10.106.129.54         HTTP     234    HTTP/1.1 200 OK  (text/html)

Frame 245: 234 bytes on wire (1872 bits), 234 bytes captured (1872 bits) on interface 0
Ethernet II, Src: Hangzhou_75:c8:f5 (74:25:8a:75:c8:f5), Dst: AsustekC_34:f3:aa (9c:5c:8e:34:f3:aa)
Internet Protocol Version 4, Src: 125.39.213.73, Dst: 10.106.129.54
Transmission Control Protocol, Src Port: 80 (80), Dst Port: 24984 (24984), Seq: 278, Ack: 6716, Len: 180
Hypertext Transfer Protocol
    HTTP/1.1 200 OK\r\n
    Date: Fri, 18 May 2018 10:53:13 GMT\r\n
    Content-Type: text/html; charset=GB2312\r\n
    Transfer-Encoding: chunked\r\n
    Connection: keep-alive\r\n
    Cache-Control: no-cache\r\n
    \r\n
    [HTTP response 2/2]
    [Time since request: 0.009735000 seconds]
    [Prev request in frame: 166]
    [Prev response in frame: 172]
    [Request in frame: 191]
    HTTP chunked response
Line-based text data: text/html

No.     Time               Source                Destination           Protocol Length Info
    249 10:53:24.023106    125.39.213.73         10.106.129.54         HTTP     234    HTTP/1.1 200 OK  (text/html)

Frame 249: 234 bytes on wire (1872 bits), 234 bytes captured (1872 bits) on interface 0
Ethernet II, Src: Hangzhou_75:c8:f5 (74:25:8a:75:c8:f5), Dst: AsustekC_34:f3:aa (9c:5c:8e:34:f3:aa)
Internet Protocol Version 4, Src: 125.39.213.73, Dst: 10.106.129.54
Transmission Control Protocol, Src Port: 80 (80), Dst Port: 24994 (24994), Seq: 1, Ack: 3345, Len: 180
Hypertext Transfer Protocol
    HTTP/1.1 200 OK\r\n
    Date: Fri, 18 May 2018 10:53:13 GMT\r\n
    Content-Type: text/html; charset=GB2312\r\n
    Transfer-Encoding: chunked\r\n
    Connection: keep-alive\r\n
    Cache-Control: no-cache\r\n
    \r\n
    [HTTP response 1/2]
    [Time since request: 0.009605000 seconds]
    [Request in frame: 205]
    [Next request in frame: 45161]
    [Next response in frame: 45170]
    HTTP chunked response
Line-based text data: text/html

No.     Time               Source                Destination           Protocol Length Info
    253 10:53:24.024769    125.39.213.73         10.106.129.54         HTTP     234    HTTP/1.1 200 OK  (text/html)

Frame 253: 234 bytes on wire (1872 bits), 234 bytes captured (1872 bits) on interface 0
Ethernet II, Src: Hangzhou_75:c8:f5 (74:25:8a:75:c8:f5), Dst: AsustekC_34:f3:aa (9c:5c:8e:34:f3:aa)
Internet Protocol Version 4, Src: 125.39.213.73, Dst: 10.106.129.54
Transmission Control Protocol, Src Port: 80 (80), Dst Port: 24995 (24995), Seq: 1, Ack: 3345, Len: 180
Hypertext Transfer Protocol
    HTTP/1.1 200 OK\r\n
    Date: Fri, 18 May 2018 10:53:13 GMT\r\n
    Content-Type: text/html; charset=GB2312\r\n
    Transfer-Encoding: chunked\r\n
    Connection: keep-alive\r\n
    Cache-Control: no-cache\r\n
    \r\n
    [HTTP response 1/2]
    [Time since request: 0.009442000 seconds]
    [Request in frame: 211]
    [Next request in frame: 45152]
    [Next response in frame: 45167]
    HTTP chunked response
Line-based text data: text/html

No.     Time               Source                Destination           Protocol Length Info
    368 10:53:24.396396    10.106.129.54         10.106.129.246        SSDP     480    HTTP/1.1 200 OK 

Frame 368: 480 bytes on wire (3840 bits), 480 bytes captured (3840 bits) on interface 0
Ethernet II, Src: AsustekC_34:f3:aa (9c:5c:8e:34:f3:aa), Dst: 58:ef:68:e4:96:59 (58:ef:68:e4:96:59)
Internet Protocol Version 4, Src: 10.106.129.54, Dst: 10.106.129.246
User Datagram Protocol, Src Port: 1900 (1900), Dst Port: 2974 (2974)
Hypertext Transfer Protocol
    HTTP/1.1 200 OK\r\n
    ST: upnp:rootdevice\r\n
    USN: uuid:3ced1185-a624-4fc1-be23-ce28fc76a1b5::upnp:rootdevice\r\n
    Location: http://10.106.129.54:2869/upnphost/udhisapi.dll?content=uuid:3ced1185-a624-4fc1-be23-ce28fc76a1b5\r\n
    OPT:"http://schemas.upnp.org/upnp/1/0/"; ns=01\r\n
    01-NLS: 778349a09ed83ae83c506b0acb1a4ffc\r\n
    Cache-Control: max-age=900\r\n
    Server: Microsoft-Windows/10.0 UPnP/1.0 UPnP-Device-Host/1.0\r\n
    Ext: \r\n
    Date: Fri, 18 May 2018 06:46:37 GMT\r\n
    \r\n
    [HTTP response 2/318]
    [Prev response in frame: 55]
    [Next response in frame: 369]

No.     Time               Source                Destination           Protocol Length Info
    369 10:53:24.542290    10.106.129.54         10.106.129.246        SSDP     480    HTTP/1.1 200 OK 

Frame 369: 480 bytes on wire (3840 bits), 480 bytes captured (3840 bits) on interface 0
Ethernet II, Src: AsustekC_34:f3:aa (9c:5c:8e:34:f3:aa), Dst: 58:ef:68:e4:96:59 (58:ef:68:e4:96:59)
Internet Protocol Version 4, Src: 10.106.129.54, Dst: 10.106.129.246
User Datagram Protocol, Src Port: 1900 (1900), Dst Port: 2974 (2974)
Hypertext Transfer Protocol
    HTTP/1.1 200 OK\r\n
    ST: upnp:rootdevice\r\n
    USN: uuid:3ced1185-a624-4fc1-be23-ce28fc76a1b5::upnp:rootdevice\r\n
    Location: http://10.106.129.54:2869/upnphost/udhisapi.dll?content=uuid:3ced1185-a624-4fc1-be23-ce28fc76a1b5\r\n
    OPT:"http://schemas.upnp.org/upnp/1/0/"; ns=01\r\n
    01-NLS: 778349a09ed83ae83c506b0acb1a4ffc\r\n
    Cache-Control: max-age=900\r\n
    Server: Microsoft-Windows/10.0 UPnP/1.0 UPnP-Device-Host/1.0\r\n
    Ext: \r\n
    Date: Fri, 18 May 2018 06:46:37 GMT\r\n
    \r\n
    [HTTP response 3/318]
    [Prev response in frame: 368]
    [Next response in frame: 487]

No.     Time               Source                Destination           Protocol Length Info
    450 10:53:29.556319    10.106.129.54         111.202.99.22         HTTP     198    GET /house/ HTTP/1.1 

Frame 450: 198 bytes on wire (1584 bits), 198 bytes captured (1584 bits) on interface 0
Ethernet II, Src: AsustekC_34:f3:aa (9c:5c:8e:34:f3:aa), Dst: Hangzhou_75:c8:f5 (74:25:8a:75:c8:f5)
Internet Protocol Version 4, Src: 10.106.129.54, Dst: 111.202.99.22
Transmission Control Protocol, Src Port: 25000 (25000), Dst Port: 80 (80), Seq: 1461, Ack: 1, Len: 144
[2 Reassembled TCP Segments (1604 bytes): #449(1460), #450(144)]
Hypertext Transfer Protocol
    GET /house/ HTTP/1.1\r\n
    Host: v.qq.com\r\n
    Connection: keep-alive\r\n
    Upgrade-Insecure-Requests: 1\r\n
    User-Agent: Mozilla/5.0 (Windows NT 10.0; Win64; x64) AppleWebKit/537.36 (KHTML, like Gecko) Chrome/66.0.3359.139 Safari/537.36\r\n
    Accept: text/html,application/xhtml+xml,application/xml;q=0.9,image/webp,image/apng,*/*;q=0.8\r\n
    Accept-Encoding: gzip, deflate\r\n
    Accept-Language: en-US,en;q=0.9,zh-TW;q=0.8,zh;q=0.7\r\n
     [truncated]Cookie: pgv_pvi=7659522048; pgv_si=s3813394432; RK=Olbs95KBUg; ptcz=2544f6f4ae92c346d1b59688e6f45a925ec0f9f8ef06a7a39332f6f8fe201348; _qpsvr_localtk=0.32806539237918764; tvfe_boss_uuid=3cdb9e54c3859a7f; pgv_info=ssid=s368989600
    \r\n
    [Full request URI: http://v.qq.com/house/]
    [HTTP request 1/1]

No.     Time               Source                Destination           Protocol Length Info
    487 10:53:31.473687    10.106.129.54         10.106.129.246        SSDP     480    HTTP/1.1 200 OK 

Frame 487: 480 bytes on wire (3840 bits), 480 bytes captured (3840 bits) on interface 0
Ethernet II, Src: AsustekC_34:f3:aa (9c:5c:8e:34:f3:aa), Dst: 58:ef:68:e4:96:59 (58:ef:68:e4:96:59)
Internet Protocol Version 4, Src: 10.106.129.54, Dst: 10.106.129.246
User Datagram Protocol, Src Port: 1900 (1900), Dst Port: 2974 (2974)
Hypertext Transfer Protocol
    HTTP/1.1 200 OK\r\n
    ST: upnp:rootdevice\r\n
    USN: uuid:3ced1185-a624-4fc1-be23-ce28fc76a1b5::upnp:rootdevice\r\n
    Location: http://10.106.129.54:2869/upnphost/udhisapi.dll?content=uuid:3ced1185-a624-4fc1-be23-ce28fc76a1b5\r\n
    OPT:"http://schemas.upnp.org/upnp/1/0/"; ns=01\r\n
    01-NLS: 778349a09ed83ae83c506b0acb1a4ffc\r\n
    Cache-Control: max-age=900\r\n
    Server: Microsoft-Windows/10.0 UPnP/1.0 UPnP-Device-Host/1.0\r\n
    Ext: \r\n
    Date: Fri, 18 May 2018 06:46:37 GMT\r\n
    \r\n
    [HTTP response 4/318]
    [Prev response in frame: 369]
    [Next response in frame: 1434]

No.     Time               Source                Destination           Protocol Length Info
    560 10:53:31.796304    10.106.129.54         123.125.9.24          HTTP     453    GET /c/=/tencentvideo/vstyle/web/v4/style/base.css,channel_base.css HTTP/1.1 

Frame 560: 453 bytes on wire (3624 bits), 453 bytes captured (3624 bits) on interface 0
Ethernet II, Src: AsustekC_34:f3:aa (9c:5c:8e:34:f3:aa), Dst: Hangzhou_75:c8:f5 (74:25:8a:75:c8:f5)
Internet Protocol Version 4, Src: 10.106.129.54, Dst: 123.125.9.24
Transmission Control Protocol, Src Port: 25003 (25003), Dst Port: 80 (80), Seq: 1, Ack: 1, Len: 399
Hypertext Transfer Protocol
    GET /c/=/tencentvideo/vstyle/web/v4/style/base.css,channel_base.css HTTP/1.1\r\n
    Host: vm.gtimg.cn\r\n
    Connection: keep-alive\r\n
    User-Agent: Mozilla/5.0 (Windows NT 10.0; Win64; x64) AppleWebKit/537.36 (KHTML, like Gecko) Chrome/66.0.3359.139 Safari/537.36\r\n
    Accept: text/css,*/*;q=0.1\r\n
    Referer: http://v.qq.com/house/\r\n
    Accept-Encoding: gzip, deflate\r\n
    Accept-Language: en-US,en;q=0.9,zh-TW;q=0.8,zh;q=0.7\r\n
    \r\n
    [Full request URI: http://vm.gtimg.cn/c/=/tencentvideo/vstyle/web/v4/style/base.css,channel_base.css]
    [HTTP request 1/3]
    [Response in frame: 573]
    [Next request in frame: 684]

No.     Time               Source                Destination           Protocol Length Info
    561 10:53:31.796407    10.106.129.54         123.125.9.24          HTTP     438    GET /tencentvideo_v1/vstyle/web/v3/style/base_v0.css HTTP/1.1 

Frame 561: 438 bytes on wire (3504 bits), 438 bytes captured (3504 bits) on interface 0
Ethernet II, Src: AsustekC_34:f3:aa (9c:5c:8e:34:f3:aa), Dst: Hangzhou_75:c8:f5 (74:25:8a:75:c8:f5)
Internet Protocol Version 4, Src: 10.106.129.54, Dst: 123.125.9.24
Transmission Control Protocol, Src Port: 25004 (25004), Dst Port: 80 (80), Seq: 1, Ack: 1, Len: 384
Hypertext Transfer Protocol
    GET /tencentvideo_v1/vstyle/web/v3/style/base_v0.css HTTP/1.1\r\n
    Host: vm.gtimg.cn\r\n
    Connection: keep-alive\r\n
    User-Agent: Mozilla/5.0 (Windows NT 10.0; Win64; x64) AppleWebKit/537.36 (KHTML, like Gecko) Chrome/66.0.3359.139 Safari/537.36\r\n
    Accept: text/css,*/*;q=0.1\r\n
    Referer: http://v.qq.com/house/\r\n
    Accept-Encoding: gzip, deflate\r\n
    Accept-Language: en-US,en;q=0.9,zh-TW;q=0.8,zh;q=0.7\r\n
    \r\n
    [Full request URI: http://vm.gtimg.cn/tencentvideo_v1/vstyle/web/v3/style/base_v0.css]
    [HTTP request 1/3]
    [Response in frame: 611]
    [Next request in frame: 676]

No.     Time               Source                Destination           Protocol Length Info
    565 10:53:31.798244    10.106.129.54         111.202.99.19         HTTP     431    GET /v/2015vchannel/css/channel_v1.min.css HTTP/1.1 

Frame 565: 431 bytes on wire (3448 bits), 431 bytes captured (3448 bits) on interface 0
Ethernet II, Src: AsustekC_34:f3:aa (9c:5c:8e:34:f3:aa), Dst: Hangzhou_75:c8:f5 (74:25:8a:75:c8:f5)
Internet Protocol Version 4, Src: 10.106.129.54, Dst: 111.202.99.19
Transmission Control Protocol, Src Port: 25005 (25005), Dst Port: 80 (80), Seq: 1, Ack: 1, Len: 377
Hypertext Transfer Protocol
    GET /v/2015vchannel/css/channel_v1.min.css HTTP/1.1\r\n
    Host: mat1.gtimg.com\r\n
    Connection: keep-alive\r\n
    User-Agent: Mozilla/5.0 (Windows NT 10.0; Win64; x64) AppleWebKit/537.36 (KHTML, like Gecko) Chrome/66.0.3359.139 Safari/537.36\r\n
    Accept: text/css,*/*;q=0.1\r\n
    Referer: http://v.qq.com/house/\r\n
    Accept-Encoding: gzip, deflate\r\n
    Accept-Language: en-US,en;q=0.9,zh-TW;q=0.8,zh;q=0.7\r\n
    \r\n
    [Full request URI: http://mat1.gtimg.com/v/2015vchannel/css/channel_v1.min.css]
    [HTTP request 1/2]
    [Response in frame: 639]
    [Next request in frame: 2057]

No.     Time               Source                Destination           Protocol Length Info
    570 10:53:31.799091    10.106.129.54         111.202.99.19         HTTP     437    GET /v/2015vchannel/css/channel_house_v1.min.css HTTP/1.1 

Frame 570: 437 bytes on wire (3496 bits), 437 bytes captured (3496 bits) on interface 0
Ethernet II, Src: AsustekC_34:f3:aa (9c:5c:8e:34:f3:aa), Dst: Hangzhou_75:c8:f5 (74:25:8a:75:c8:f5)
Internet Protocol Version 4, Src: 10.106.129.54, Dst: 111.202.99.19
Transmission Control Protocol, Src Port: 25006 (25006), Dst Port: 80 (80), Seq: 1, Ack: 1, Len: 383
Hypertext Transfer Protocol
    GET /v/2015vchannel/css/channel_house_v1.min.css HTTP/1.1\r\n
    Host: mat1.gtimg.com\r\n
    Connection: keep-alive\r\n
    User-Agent: Mozilla/5.0 (Windows NT 10.0; Win64; x64) AppleWebKit/537.36 (KHTML, like Gecko) Chrome/66.0.3359.139 Safari/537.36\r\n
    Accept: text/css,*/*;q=0.1\r\n
    Referer: http://v.qq.com/house/\r\n
    Accept-Encoding: gzip, deflate\r\n
    Accept-Language: en-US,en;q=0.9,zh-TW;q=0.8,zh;q=0.7\r\n
    \r\n
    [Full request URI: http://mat1.gtimg.com/v/2015vchannel/css/channel_house_v1.min.css]
    [HTTP request 1/4]
    [Response in frame: 668]
    [Next request in frame: 687]

No.     Time               Source                Destination           Protocol Length Info
    573 10:53:31.799668    123.125.9.24          10.106.129.54         HTTP     591    HTTP/1.1 200 OK 

Frame 573: 591 bytes on wire (4728 bits), 591 bytes captured (4728 bits) on interface 0
Ethernet II, Src: Hangzhou_75:c8:f5 (74:25:8a:75:c8:f5), Dst: AsustekC_34:f3:aa (9c:5c:8e:34:f3:aa)
Internet Protocol Version 4, Src: 123.125.9.24, Dst: 10.106.129.54
Transmission Control Protocol, Src Port: 80 (80), Dst Port: 25003 (25003), Seq: 1, Ack: 400, Len: 537
Hypertext Transfer Protocol
    HTTP/1.1 200 OK\r\n
    Server: NWS_UGC_HY\r\n
    Connection: keep-alive\r\n
    Date: Fri, 18 May 2018 10:53:20 GMT\r\n
    Cache-Control: max-age=3600\r\n
    Expires: Fri, 18 May 2018 11:53:20 GMT\r\n
    Last-Modified: Thu, 02 Nov 2017 07:06:21 GMT\r\n
    Content-Type: text/css\r\n
    Content-Length: 22573\r\n
    Content-Encoding: gzip\r\n
    Access-Control-Expose-Headers: X-Client-Ip \r\n
    Access-Control-Expose-Headers: X-Server-Ip \r\n
    Access-Control-Expose-Headers: X-Upstream-Ip \r\n
    X-Client-Ip: 111.198.54.250 \r\n
    X-Server-Ip: 123.125.9.24 \r\n
    X-Upstream-Ip:  \r\n
    X-Cache-Lookup: Hit From Disktank Gz\r\n
    \r\n
    [HTTP response 1/3]
    [Time since request: 0.003364000 seconds]
    [Request in frame: 560]
    [Next request in frame: 684]
    [Next response in frame: 723]

No.     Time               Source                Destination           Protocol Length Info
    611 10:53:31.802398    123.125.9.24          10.106.129.54         HTTP     591    HTTP/1.1 200 OK 

Frame 611: 591 bytes on wire (4728 bits), 591 bytes captured (4728 bits) on interface 0
Ethernet II, Src: Hangzhou_75:c8:f5 (74:25:8a:75:c8:f5), Dst: AsustekC_34:f3:aa (9c:5c:8e:34:f3:aa)
Internet Protocol Version 4, Src: 123.125.9.24, Dst: 10.106.129.54
Transmission Control Protocol, Src Port: 80 (80), Dst Port: 25004 (25004), Seq: 1, Ack: 385, Len: 537
Hypertext Transfer Protocol
    HTTP/1.1 200 OK\r\n
    Server: NWS_UGC_HY\r\n
    Connection: keep-alive\r\n
    Date: Fri, 18 May 2018 10:53:20 GMT\r\n
    Cache-Control: max-age=3600\r\n
    Expires: Fri, 18 May 2018 11:53:20 GMT\r\n
    Last-Modified: Fri, 09 Mar 2018 08:38:07 GMT\r\n
    Content-Type: text/css\r\n
    Content-Length: 14557\r\n
    Content-Encoding: gzip\r\n
    Access-Control-Expose-Headers: X-Client-Ip \r\n
    Access-Control-Expose-Headers: X-Server-Ip \r\n
    Access-Control-Expose-Headers: X-Upstream-Ip \r\n
    X-Client-Ip: 111.198.54.250 \r\n
    X-Server-Ip: 123.125.9.24 \r\n
    X-Upstream-Ip:  \r\n
    X-Cache-Lookup: Hit From Disktank Gz\r\n
    \r\n
    [HTTP response 1/3]
    [Time since request: 0.005991000 seconds]
    [Request in frame: 561]
    [Next request in frame: 676]
    [Next response in frame: 693]

No.     Time               Source                Destination           Protocol Length Info
    639 10:53:31.803599    111.202.99.19         10.106.129.54         HTTP     678    HTTP/1.1 200 OK 

Frame 639: 678 bytes on wire (5424 bits), 678 bytes captured (5424 bits) on interface 0
Ethernet II, Src: Hangzhou_75:c8:f5 (74:25:8a:75:c8:f5), Dst: AsustekC_34:f3:aa (9c:5c:8e:34:f3:aa)
Internet Protocol Version 4, Src: 111.202.99.19, Dst: 10.106.129.54
Transmission Control Protocol, Src Port: 80 (80), Dst Port: 25005 (25005), Seq: 1, Ack: 378, Len: 624
Hypertext Transfer Protocol
    HTTP/1.1 200 OK\r\n
    Server: X2_Platform\r\n
    Connection: keep-alive\r\n
    Date: Fri, 18 May 2018 10:53:20 GMT\r\n
    Cache-Control: max-age=600\r\n
    Expires: Fri, 18 May 2018 11:03:20 GMT\r\n
    Last-Modified: Mon, 21 Nov 2016 06:43:20 GMT\r\n
    Content-Type: text/css\r\n
    Content-Length: 6827\r\n
    Content-Encoding: gzip\r\n
    X-NWS-LOG-UUID: eea4d705-1a47-4687-92ca-1db2e8675b4c f37965e839b2a0ab8de933a87d1c06d2\r\n
    Access-Control-Expose-Headers: X-Client-Ip \r\n
    Access-Control-Expose-Headers: X-Server-Ip \r\n
    Access-Control-Expose-Headers: X-Upstream-Ip \r\n
    X-Client-Ip: 111.198.54.250 \r\n
    X-Server-Ip: 111.202.99.19 \r\n
    X-Upstream-Ip:  \r\n
    X-Cache-Lookup: Hit From Disktank Gz\r\n
    \r\n
    [HTTP response 1/2]
    [Time since request: 0.005355000 seconds]
    [Request in frame: 565]
    [Next request in frame: 2057]
    [Next response in frame: 2064]

No.     Time               Source                Destination           Protocol Length Info
    653 10:53:31.804805    111.202.99.19         10.106.129.54         HTTP     74     Continuation

Frame 653: 74 bytes on wire (592 bits), 74 bytes captured (592 bits) on interface 0
Ethernet II, Src: Hangzhou_75:c8:f5 (74:25:8a:75:c8:f5), Dst: AsustekC_34:f3:aa (9c:5c:8e:34:f3:aa)
Internet Protocol Version 4, Src: 111.202.99.19, Dst: 10.106.129.54
Transmission Control Protocol, Src Port: 80 (80), Dst Port: 25005 (25005), Seq: 5005, Ack: 378, Len: 1460
Hypertext Transfer Protocol
    :\005Z\n
    Data (1456 bytes)

0000  49 06 a3 3f d7 af 35 e2 36 51 2c 24 94 6d 23 e8   I..?..5.6Q,$.m#.
0010  55 fe 68 3f 5c c3 82 9d ae a9 4e 24 8c 22 67 d4   U.h?\.....N$."g.
0020  6c 65 64 7a cf be 1c 6a 95 60 04 5b 33 1a ad be   ledz...j.`.[3...
0030  a2 c9 42 c8 5f ce 68 c9 30 fb 44 ac a5 54 c9 ba   ..B._.h.0.D..T..
0040  99 27 a8 64 55 4d 19 77 10 af 74 7f a9 f8 ad 00   .'.dUM.w..t.....
0050  64 8f fb d0 00 4d c3 1b ea ca 44 c2 b1 34 21 b4   d....M....D..4!.
