No.     Time               Source                Destination           Protocol Length Info
    372 13:08:44.675607    10.210.66.82          182.254.93.101        HTTP     413    GET /vpic/0/m0014naeehw_160_90_3.jpg/0 HTTP/1.1 

Frame 372: 413 bytes on wire (3304 bits), 413 bytes captured (3304 bits) on interface 0
Ethernet II, Src: AsustekC_34:f3:aa (9c:5c:8e:34:f3:aa), Dst: Hangzhou_d2:34:0d (3c:e5:a6:d2:34:0d)
Internet Protocol Version 4, Src: 10.210.66.82, Dst: 182.254.93.101
Transmission Control Protocol, Src Port: 29301 (29301), Dst Port: 80 (80), Seq: 1, Ack: 1, Len: 359
Hypertext Transfer Protocol
    GET /vpic/0/m0014naeehw_160_90_3.jpg/0 HTTP/1.1\r\n
    Host: puui.qpic.cn\r\n
    Connection: keep-alive\r\n
    User-Agent: Mozilla/5.0 (Windows NT 10.0; Win64; x64) AppleWebKit/537.36 (KHTML, like Gecko) Chrome/66.0.3359.139 Safari/537.36\r\n
    Accept: image/webp,image/apng,image/*,*/*;q=0.8\r\n
    Accept-Encoding: gzip, deflate\r\n
    Accept-Language: en-US,en;q=0.9,zh-TW;q=0.8,zh;q=0.7\r\n
    \r\n
    [Full request URI: http://puui.qpic.cn/vpic/0/m0014naeehw_160_90_3.jpg/0]
    [HTTP request 1/1]
    [Response in frame: 397]

No.     Time               Source                Destination           Protocol Length Info
    375 13:08:44.676416    10.210.66.82          182.254.93.101        HTTP     413    GET /vpic/0/s00205ceebk_160_90_3.jpg/0 HTTP/1.1 

Frame 375: 413 bytes on wire (3304 bits), 413 bytes captured (3304 bits) on interface 0
Ethernet II, Src: AsustekC_34:f3:aa (9c:5c:8e:34:f3:aa), Dst: Hangzhou_d2:34:0d (3c:e5:a6:d2:34:0d)
Internet Protocol Version 4, Src: 10.210.66.82, Dst: 182.254.93.101
Transmission Control Protocol, Src Port: 29300 (29300), Dst Port: 80 (80), Seq: 1, Ack: 1, Len: 359
Hypertext Transfer Protocol
    GET /vpic/0/s00205ceebk_160_90_3.jpg/0 HTTP/1.1\r\n
    Host: puui.qpic.cn\r\n
    Connection: keep-alive\r\n
    User-Agent: Mozilla/5.0 (Windows NT 10.0; Win64; x64) AppleWebKit/537.36 (KHTML, like Gecko) Chrome/66.0.3359.139 Safari/537.36\r\n
    Accept: image/webp,image/apng,image/*,*/*;q=0.8\r\n
    Accept-Encoding: gzip, deflate\r\n
    Accept-Language: en-US,en;q=0.9,zh-TW;q=0.8,zh;q=0.7\r\n
    \r\n
    [Full request URI: http://puui.qpic.cn/vpic/0/s00205ceebk_160_90_3.jpg/0]
    [HTTP request 1/1]
    [Response in frame: 403]

No.     Time               Source                Destination           Protocol Length Info
    397 13:08:44.782748    182.254.93.101        10.210.66.82          HTTP     1494   HTTP/1.1 200 OK  (image/jpeg)

Frame 397: 1494 bytes on wire (11952 bits), 1494 bytes captured (11952 bits) on interface 0
Ethernet II, Src: Hangzhou_d2:34:0d (3c:e5:a6:d2:34:0d), Dst: AsustekC_34:f3:aa (9c:5c:8e:34:f3:aa)
Internet Protocol Version 4, Src: 182.254.93.101, Dst: 10.210.66.82
Transmission Control Protocol, Src Port: 80 (80), Dst Port: 29301 (29301), Seq: 1, Ack: 360, Len: 1440
Hypertext Transfer Protocol
Media Type

No.     Time               Source                Destination           Protocol Length Info
    403 13:08:44.787193    182.254.93.101        10.210.66.82          HTTP     1494   HTTP/1.1 200 OK  (image/jpeg)

Frame 403: 1494 bytes on wire (11952 bits), 1494 bytes captured (11952 bits) on interface 0
Ethernet II, Src: Hangzhou_d2:34:0d (3c:e5:a6:d2:34:0d), Dst: AsustekC_34:f3:aa (9c:5c:8e:34:f3:aa)
Internet Protocol Version 4, Src: 182.254.93.101, Dst: 10.210.66.82
Transmission Control Protocol, Src Port: 80 (80), Dst Port: 29300 (29300), Seq: 1, Ack: 360, Len: 1440
Hypertext Transfer Protocol
Media Type

No.     Time               Source                Destination           Protocol Length Info
    413 13:08:44.789861    10.210.66.82          182.254.106.36        HTTP     553    GET /livemsg?o=392&adtype=HT&soid=d4FAO1EAWv9A0Qj4PwB7pJ6oAVD4&r90=1&l=4007&refluence=4007&requestl=4007&tagid=0&pf=in&si=3952277002&ev=6.0.408.408&aver_flag=0&traffic=&ip_filter=0&ufc_filter=0&ufc_stra=0&ufc_match=0&backfunnel=401&use_axp=0&axpheader=1&use_txp=0&txpheader=1&st_id_t=0&flow_reuse=1&ping_data=dXBfdmVyc2lvbj1WNi4wLjQwOC40MDg=&vid=h00225afto4&pf_ex=pc&live=0&aid_tpid=24&aid_tpid2=11634&aid_tpid3=11650&aid_dura=99&aid_vid_drm=0&aid_cid_drm=0&aid_copyright=218&aid_cover=hww99lj3r5ap157&aid_column=33&aid_vip_type=1&url=https://v.qq.com/x/cover/hww99lj3r5ap157/h00225afto4.html&from=0&pf=in&v=3.5.52&dura=&coverid=hww99lj3r5ap157&vptag=www_baidu_com|house&oadid=4007&lcount=1&t=0&pf_ex=pc&tpid=24&chid=0 HTTP/1.1 

Frame 413: 553 bytes on wire (4424 bits), 553 bytes captured (4424 bits) on interface 0
Ethernet II, Src: AsustekC_34:f3:aa (9c:5c:8e:34:f3:aa), Dst: Hangzhou_d2:34:0d (3c:e5:a6:d2:34:0d)
Internet Protocol Version 4, Src: 10.210.66.82, Dst: 182.254.106.36
Transmission Control Protocol, Src Port: 29302 (29302), Dst Port: 80 (80), Seq: 2881, Ack: 1, Len: 499
[3 Reassembled TCP Segments (3379 bytes): #411(1440), #412(1440), #413(499)]
Hypertext Transfer Protocol
     [truncated]GET /livemsg?o=392&adtype=HT&soid=d4FAO1EAWv9A0Qj4PwB7pJ6oAVD4&r90=1&l=4007&refluence=4007&requestl=4007&tagid=0&pf=in&si=3952277002&ev=6.0.408.408&aver_flag=0&traffic=&ip_filter=0&ufc_filter=0&ufc_stra=0&ufc_match=0&backfunnel
    Host: livep.l.qq.com\r\n
    Connection: keep-alive\r\n
    User-Agent: Mozilla/5.0 (Windows NT 10.0; Win64; x64) AppleWebKit/537.36 (KHTML, like Gecko) Chrome/66.0.3359.139 Safari/537.36\r\n
    Accept: image/webp,image/apng,image/*,*/*;q=0.8\r\n
    Accept-Encoding: gzip, deflate\r\n
    Accept-Language: en-US,en;q=0.9,zh-TW;q=0.8,zh;q=0.7\r\n
     [truncated]Cookie: pgv_pvi=7659522048; pgv_si=s3813394432; RK=Olbs95KBUg; ptcz=2544f6f4ae92c346d1b59688e6f45a925ec0f9f8ef06a7a39332f6f8fe201348; _qpsvr_localtk=0.32806539237918764; tvfe_boss_uuid=3cdb9e54c3859a7f; appuser=3B22E15EAE54C942
    \r\n
    [Full request URI [truncated]: http://livep.l.qq.com/livemsg?o=392&adtype=HT&soid=d4FAO1EAWv9A0Qj4PwB7pJ6oAVD4&r90=1&l=4007&refluence=4007&requestl=4007&tagid=0&pf=in&si=3952277002&ev=6.0.408.408&aver_flag=0&traffic=&ip_filter=0&ufc_filter=]
    [HTTP request 1/3]
    [Response in frame: 417]
    [Next request in frame: 581]

No.     Time               Source                Destination           Protocol Length Info
    417 13:08:44.871578    182.254.106.36        10.210.66.82          HTTP     326    HTTP/1.1 200 OK  (text/html)

Frame 417: 326 bytes on wire (2608 bits), 326 bytes captured (2608 bits) on interface 0
Ethernet II, Src: Hangzhou_d2:34:0d (3c:e5:a6:d2:34:0d), Dst: AsustekC_34:f3:aa (9c:5c:8e:34:f3:aa)
Internet Protocol Version 4, Src: 182.254.106.36, Dst: 10.210.66.82
Transmission Control Protocol, Src Port: 80 (80), Dst Port: 29302 (29302), Seq: 1, Ack: 3380, Len: 272
Hypertext Transfer Protocol
    HTTP/1.1 200 OK\r\n
    Date: Fri, 18 May 2018 13:08:34 GMT\r\n
    Content-Type: text/html; charset=GB2312\r\n
    Transfer-Encoding: chunked\r\n
    Connection: keep-alive\r\n
    Cache-Control: no-cache\r\n
    Set-Cookie: short_video=; Domain=.l.qq.com; Path=/; Expires=Thu, 01 Jan 1970 08:00:00 GMT;\r\n
    \r\n
    [HTTP response 1/3]
    [Time since request: 0.081717000 seconds]
    [Request in frame: 413]
    [Next request in frame: 581]
    [Next response in frame: 624]
    HTTP chunked response
Line-based text data: text/html

No.     Time               Source                Destination           Protocol Length Info
    581 13:08:48.832847    10.210.66.82          182.254.106.36        HTTP     556    GET /livemsg?o=392&adtype=LD&soid=d4FAO4AAWv9A1QoYqwDnnF8qAcAY&r90=1&l=4007&refluence=4007&requestl=4007&tagid=0&pf=in&si=2081548810&ev=6.0.428.428&aver_flag=6148&traffic=&ip_filter=0&ufc_filter=0&ufc_stra=0&ufc_match=0&backfunnel=403&use_axp=0&axpheader=1&use_txp=0&txpheader=1&st_id_t=0&flow_reuse=1&ping_data=dXBfdmVyc2lvbj1WNi4wLjQyOC40Mjg=&vid=c0022feo2h3&pf_ex=pc&live=0&aid_tpid=24&aid_tpid2=11634&aid_tpid3=11650&aid_dura=49&aid_vid_drm=0&aid_cid_drm=0&aid_copyright=218&aid_cover=hww99lj3r5ap157&aid_column=33&aid_vip_type=1&url=https://v.qq.com/x/cover/hww99lj3r5ap157/c0022feo2h3.html&from=0&pf=in&v=3.5.52&dura=&coverid=hww99lj3r5ap157&vptag=www_baidu_com|house&oadid=4007&lcount=1&t=0&pf_ex=pc&tpid=24&chid=0 HTTP/1.1 

Frame 581: 556 bytes on wire (4448 bits), 556 bytes captured (4448 bits) on interface 0
Ethernet II, Src: AsustekC_34:f3:aa (9c:5c:8e:34:f3:aa), Dst: Hangzhou_d2:34:0d (3c:e5:a6:d2:34:0d)
Internet Protocol Version 4, Src: 10.210.66.82, Dst: 182.254.106.36
Transmission Control Protocol, Src Port: 29302 (29302), Dst Port: 80 (80), Seq: 6260, Ack: 278, Len: 502
[3 Reassembled TCP Segments (3382 bytes): #579(1440), #580(1440), #581(502)]
Hypertext Transfer Protocol
     [truncated]GET /livemsg?o=392&adtype=LD&soid=d4FAO4AAWv9A1QoYqwDnnF8qAcAY&r90=1&l=4007&refluence=4007&requestl=4007&tagid=0&pf=in&si=2081548810&ev=6.0.428.428&aver_flag=6148&traffic=&ip_filter=0&ufc_filter=0&ufc_stra=0&ufc_match=0&backfun
    Host: livep.l.qq.com\r\n
    Connection: keep-alive\r\n
    User-Agent: Mozilla/5.0 (Windows NT 10.0; Win64; x64) AppleWebKit/537.36 (KHTML, like Gecko) Chrome/66.0.3359.139 Safari/537.36\r\n
    Accept: image/webp,image/apng,image/*,*/*;q=0.8\r\n
    Accept-Encoding: gzip, deflate\r\n
    Accept-Language: en-US,en;q=0.9,zh-TW;q=0.8,zh;q=0.7\r\n
     [truncated]Cookie: pgv_pvi=7659522048; pgv_si=s3813394432; RK=Olbs95KBUg; ptcz=2544f6f4ae92c346d1b59688e6f45a925ec0f9f8ef06a7a39332f6f8fe201348; _qpsvr_localtk=0.32806539237918764; tvfe_boss_uuid=3cdb9e54c3859a7f; appuser=3B22E15EAE54C942
    \r\n
    [Full request URI [truncated]: http://livep.l.qq.com/livemsg?o=392&adtype=LD&soid=d4FAO4AAWv9A1QoYqwDnnF8qAcAY&r90=1&l=4007&refluence=4007&requestl=4007&tagid=0&pf=in&si=2081548810&ev=6.0.428.428&aver_flag=6148&traffic=&ip_filter=0&ufc_filt]
    [HTTP request 2/3]
    [Prev request in frame: 413]
    [Response in frame: 624]
    [Next request in frame: 662]

No.     Time               Source                Destination           Protocol Length Info
    618 13:08:48.919427    10.210.66.82          182.254.106.36        HTTP     530    GET /livemsg?o=392&adtype=LD&soid=d4FAO4AAWv9A1QoYqwG/HL39AcAY&r90=1&l=4007&refluence=4007&requestl=4007&tagid=0&pf=in&si=2081548810&ev=6.0.428.428&aver_flag=0&traffic=&ip_filter=0&ufc_filter=0&backfunnel=403&use_axp=0&axpheader=1&use_txp=0&txpheader=1&st_id_t=0&flow_reuse=1&ping_data=dXBfdmVyc2lvbj1WNi4wLjQyOC40Mjg=&vid=c0022feo2h3&pf_ex=pc&live=0&aid_tpid=24&aid_tpid2=11634&aid_tpid3=11650&aid_dura=49&aid_vid_drm=0&aid_cid_drm=0&aid_copyright=218&aid_cover=hww99lj3r5ap157&aid_column=33&aid_vip_type=1&url=https://v.qq.com/x/cover/hww99lj3r5ap157/c0022feo2h3.html&from=0&pf=in&v=3.5.52&dura=&coverid=hww99lj3r5ap157&vptag=www_baidu_com|house&oadid=4007&lcount=2&t=0&pf_ex=pc&tpid=24&chid=0 HTTP/1.1 

Frame 618: 530 bytes on wire (4240 bits), 530 bytes captured (4240 bits) on interface 0
Ethernet II, Src: AsustekC_34:f3:aa (9c:5c:8e:34:f3:aa), Dst: Hangzhou_d2:34:0d (3c:e5:a6:d2:34:0d)
Internet Protocol Version 4, Src: 10.210.66.82, Dst: 182.254.106.36
Transmission Control Protocol, Src Port: 29309 (29309), Dst Port: 80 (80), Seq: 2881, Ack: 1, Len: 476
[3 Reassembled TCP Segments (3356 bytes): #616(1440), #617(1440), #618(476)]
Hypertext Transfer Protocol
     [truncated]GET /livemsg?o=392&adtype=LD&soid=d4FAO4AAWv9A1QoYqwG/HL39AcAY&r90=1&l=4007&refluence=4007&requestl=4007&tagid=0&pf=in&si=2081548810&ev=6.0.428.428&aver_flag=0&traffic=&ip_filter=0&ufc_filter=0&backfunnel=403&use_axp=0&axpheade
    Host: livep.l.qq.com\r\n
    Connection: keep-alive\r\n
    User-Agent: Mozilla/5.0 (Windows NT 10.0; Win64; x64) AppleWebKit/537.36 (KHTML, like Gecko) Chrome/66.0.3359.139 Safari/537.36\r\n
    Accept: image/webp,image/apng,image/*,*/*;q=0.8\r\n
    Accept-Encoding: gzip, deflate\r\n
    Accept-Language: en-US,en;q=0.9,zh-TW;q=0.8,zh;q=0.7\r\n
     [truncated]Cookie: pgv_pvi=7659522048; pgv_si=s3813394432; RK=Olbs95KBUg; ptcz=2544f6f4ae92c346d1b59688e6f45a925ec0f9f8ef06a7a39332f6f8fe201348; _qpsvr_localtk=0.32806539237918764; tvfe_boss_uuid=3cdb9e54c3859a7f; appuser=3B22E15EAE54C942
    \r\n
    [Full request URI [truncated]: http://livep.l.qq.com/livemsg?o=392&adtype=LD&soid=d4FAO4AAWv9A1QoYqwG/HL39AcAY&r90=1&l=4007&refluence=4007&requestl=4007&tagid=0&pf=in&si=2081548810&ev=6.0.428.428&aver_flag=0&traffic=&ip_filter=0&ufc_filter=]
    [HTTP request 1/1]
    [Response in frame: 679]

No.     Time               Source                Destination           Protocol Length Info
    623 13:08:48.921462    10.210.66.82          182.254.106.36        HTTP     530    GET /livemsg?o=392&adtype=LD&soid=d4FAO4AAWv9A1QoYqwIWmuteAcAY&r90=1&l=4007&refluence=4007&requestl=4007&tagid=0&pf=in&si=2081548810&ev=6.0.428.428&aver_flag=0&traffic=&ip_filter=0&ufc_filter=0&backfunnel=403&use_axp=0&axpheader=1&use_txp=0&txpheader=1&st_id_t=0&flow_reuse=1&ping_data=dXBfdmVyc2lvbj1WNi4wLjQyOC40Mjg=&vid=c0022feo2h3&pf_ex=pc&live=0&aid_tpid=24&aid_tpid2=11634&aid_tpid3=11650&aid_dura=49&aid_vid_drm=0&aid_cid_drm=0&aid_copyright=218&aid_cover=hww99lj3r5ap157&aid_column=33&aid_vip_type=1&url=https://v.qq.com/x/cover/hww99lj3r5ap157/c0022feo2h3.html&from=0&pf=in&v=3.5.52&dura=&coverid=hww99lj3r5ap157&vptag=www_baidu_com|house&oadid=4007&lcount=3&t=0&pf_ex=pc&tpid=24&chid=0 HTTP/1.1 

Frame 623: 530 bytes on wire (4240 bits), 530 bytes captured (4240 bits) on interface 0
Ethernet II, Src: AsustekC_34:f3:aa (9c:5c:8e:34:f3:aa), Dst: Hangzhou_d2:34:0d (3c:e5:a6:d2:34:0d)
Internet Protocol Version 4, Src: 10.210.66.82, Dst: 182.254.106.36
Transmission Control Protocol, Src Port: 29310 (29310), Dst Port: 80 (80), Seq: 2881, Ack: 1, Len: 476
[3 Reassembled TCP Segments (3356 bytes): #621(1440), #622(1440), #623(476)]
Hypertext Transfer Protocol
     [truncated]GET /livemsg?o=392&adtype=LD&soid=d4FAO4AAWv9A1QoYqwIWmuteAcAY&r90=1&l=4007&refluence=4007&requestl=4007&tagid=0&pf=in&si=2081548810&ev=6.0.428.428&aver_flag=0&traffic=&ip_filter=0&ufc_filter=0&backfunnel=403&use_axp=0&axpheade
    Host: livep.l.qq.com\r\n
    Connection: keep-alive\r\n
    User-Agent: Mozilla/5.0 (Windows NT 10.0; Win64; x64) AppleWebKit/537.36 (KHTML, like Gecko) Chrome/66.0.3359.139 Safari/537.36\r\n
    Accept: image/webp,image/apng,image/*,*/*;q=0.8\r\n
    Accept-Encoding: gzip, deflate\r\n
    Accept-Language: en-US,en;q=0.9,zh-TW;q=0.8,zh;q=0.7\r\n
     [truncated]Cookie: pgv_pvi=7659522048; pgv_si=s3813394432; RK=Olbs95KBUg; ptcz=2544f6f4ae92c346d1b59688e6f45a925ec0f9f8ef06a7a39332f6f8fe201348; _qpsvr_localtk=0.32806539237918764; tvfe_boss_uuid=3cdb9e54c3859a7f; appuser=3B22E15EAE54C942
    \r\n
    [Full request URI [truncated]: http://livep.l.qq.com/livemsg?o=392&adtype=LD&soid=d4FAO4AAWv9A1QoYqwIWmuteAcAY&r90=1&l=4007&refluence=4007&requestl=4007&tagid=0&pf=in&si=2081548810&ev=6.0.428.428&aver_flag=0&traffic=&ip_filter=0&ufc_filter=]
    [HTTP request 1/1]
    [Response in frame: 689]

No.     Time               Source                Destination           Protocol Length Info
    624 13:08:48.923195    182.254.106.36        10.210.66.82          HTTP     326    HTTP/1.1 200 OK  (text/html)

Frame 624: 326 bytes on wire (2608 bits), 326 bytes captured (2608 bits) on interface 0
Ethernet II, Src: Hangzhou_d2:34:0d (3c:e5:a6:d2:34:0d), Dst: AsustekC_34:f3:aa (9c:5c:8e:34:f3:aa)
Internet Protocol Version 4, Src: 182.254.106.36, Dst: 10.210.66.82
Transmission Control Protocol, Src Port: 80 (80), Dst Port: 29302 (29302), Seq: 278, Ack: 6762, Len: 272
Hypertext Transfer Protocol
    HTTP/1.1 200 OK\r\n
    Date: Fri, 18 May 2018 13:08:38 GMT\r\n
    Content-Type: text/html; charset=GB2312\r\n
    Transfer-Encoding: chunked\r\n
    Connection: keep-alive\r\n
    Cache-Control: no-cache\r\n
    Set-Cookie: short_video=; Domain=.l.qq.com; Path=/; Expires=Thu, 01 Jan 1970 08:00:00 GMT;\r\n
    \r\n
    [HTTP response 2/3]
    [Time since request: 0.090348000 seconds]
    [Prev request in frame: 413]
    [Prev response in frame: 417]
    [Request in frame: 581]
    [Next request in frame: 662]
    [Next response in frame: 724]
    HTTP chunked response
Line-based text data: text/html

No.     Time               Source                Destination           Protocol Length Info
    644 13:08:48.933672    10.210.66.82          182.254.106.36        HTTP     530    GET /livemsg?o=392&adtype=LD&soid=d4FAO4AAWv9A1QoYqwNOGgmJAcAY&r90=1&l=4007&refluence=4007&requestl=4007&tagid=0&pf=in&si=2081548810&ev=6.0.428.428&aver_flag=0&traffic=&ip_filter=0&ufc_filter=0&backfunnel=403&use_axp=0&axpheader=1&use_txp=0&txpheader=1&st_id_t=0&flow_reuse=1&ping_data=dXBfdmVyc2lvbj1WNi4wLjQyOC40Mjg=&vid=c0022feo2h3&pf_ex=pc&live=0&aid_tpid=24&aid_tpid2=11634&aid_tpid3=11650&aid_dura=49&aid_vid_drm=0&aid_cid_drm=0&aid_copyright=218&aid_cover=hww99lj3r5ap157&aid_column=33&aid_vip_type=1&url=https://v.qq.com/x/cover/hww99lj3r5ap157/c0022feo2h3.html&from=0&pf=in&v=3.5.52&dura=&coverid=hww99lj3r5ap157&vptag=www_baidu_com|house&oadid=4007&lcount=4&t=0&pf_ex=pc&tpid=24&chid=0 HTTP/1.1 

Frame 644: 530 bytes on wire (4240 bits), 530 bytes captured (4240 bits) on interface 0
Ethernet II, Src: AsustekC_34:f3:aa (9c:5c:8e:34:f3:aa), Dst: Hangzhou_d2:34:0d (3c:e5:a6:d2:34:0d)
Internet Protocol Version 4, Src: 10.210.66.82, Dst: 182.254.106.36
Transmission Control Protocol, Src Port: 29311 (29311), Dst Port: 80 (80), Seq: 2881, Ack: 1, Len: 476
[3 Reassembled TCP Segments (3356 bytes): #642(1440), #643(1440), #644(476)]
Hypertext Transfer Protocol
     [truncated]GET /livemsg?o=392&adtype=LD&soid=d4FAO4AAWv9A1QoYqwNOGgmJAcAY&r90=1&l=4007&refluence=4007&requestl=4007&tagid=0&pf=in&si=2081548810&ev=6.0.428.428&aver_flag=0&traffic=&ip_filter=0&ufc_filter=0&backfunnel=403&use_axp=0&axpheade
    Host: livep.l.qq.com\r\n
    Connection: keep-alive\r\n
    User-Agent: Mozilla/5.0 (Windows NT 10.0; Win64; x64) AppleWebKit/537.36 (KHTML, like Gecko) Chrome/66.0.3359.139 Safari/537.36\r\n
    Accept: image/webp,image/apng,image/*,*/*;q=0.8\r\n
    Accept-Encoding: gzip, deflate\r\n
    Accept-Language: en-US,en;q=0.9,zh-TW;q=0.8,zh;q=0.7\r\n
     [truncated]Cookie: pgv_pvi=7659522048; pgv_si=s3813394432; RK=Olbs95KBUg; ptcz=2544f6f4ae92c346d1b59688e6f45a925ec0f9f8ef06a7a39332f6f8fe201348; _qpsvr_localtk=0.32806539237918764; tvfe_boss_uuid=3cdb9e54c3859a7f; appuser=3B22E15EAE54C942
    \r\n
    [Full request URI [truncated]: http://livep.l.qq.com/livemsg?o=392&adtype=LD&soid=d4FAO4AAWv9A1QoYqwNOGgmJAcAY&r90=1&l=4007&refluence=4007&requestl=4007&tagid=0&pf=in&si=2081548810&ev=6.0.428.428&aver_flag=0&traffic=&ip_filter=0&ufc_filter=]
    [HTTP request 1/1]
    [Response in frame: 708]

No.     Time               Source                Destination           Protocol Length Info
    647 13:08:48.934147    10.210.66.82          182.254.106.36        HTTP     530    GET /livemsg?o=392&adtype=LD&soid=d4FAO4AAWv9A1QoYqwQFkTfDAcAY&r90=1&l=4007&refluence=4007&requestl=4007&tagid=0&pf=in&si=2081548810&ev=6.0.428.428&aver_flag=0&traffic=&ip_filter=0&ufc_filter=0&backfunnel=403&use_axp=0&axpheader=1&use_txp=0&txpheader=1&st_id_t=0&flow_reuse=1&ping_data=dXBfdmVyc2lvbj1WNi4wLjQyOC40Mjg=&vid=c0022feo2h3&pf_ex=pc&live=0&aid_tpid=24&aid_tpid2=11634&aid_tpid3=11650&aid_dura=49&aid_vid_drm=0&aid_cid_drm=0&aid_copyright=218&aid_cover=hww99lj3r5ap157&aid_column=33&aid_vip_type=1&url=https://v.qq.com/x/cover/hww99lj3r5ap157/c0022feo2h3.html&from=0&pf=in&v=3.5.52&dura=&coverid=hww99lj3r5ap157&vptag=www_baidu_com|house&oadid=4007&lcount=5&t=0&pf_ex=pc&tpid=24&chid=0 HTTP/1.1 

Frame 647: 530 bytes on wire (4240 bits), 530 bytes captured (4240 bits) on interface 0
Ethernet II, Src: AsustekC_34:f3:aa (9c:5c:8e:34:f3:aa), Dst: Hangzhou_d2:34:0d (3c:e5:a6:d2:34:0d)
Internet Protocol Version 4, Src: 10.210.66.82, Dst: 182.254.106.36
Transmission Control Protocol, Src Port: 29312 (29312), Dst Port: 80 (80), Seq: 2881, Ack: 1, Len: 476
[3 Reassembled TCP Segments (3356 bytes): #645(1440), #646(1440), #647(476)]
Hypertext Transfer Protocol
     [truncated]GET /livemsg?o=392&adtype=LD&soid=d4FAO4AAWv9A1QoYqwQFkTfDAcAY&r90=1&l=4007&refluence=4007&requestl=4007&tagid=0&pf=in&si=2081548810&ev=6.0.428.428&aver_flag=0&traffic=&ip_filter=0&ufc_filter=0&backfunnel=403&use_axp=0&axpheade
    Host: livep.l.qq.com\r\n
    Connection: keep-alive\r\n
    User-Agent: Mozilla/5.0 (Windows NT 10.0; Win64; x64) AppleWebKit/537.36 (KHTML, like Gecko) Chrome/66.0.3359.139 Safari/537.36\r\n
    Accept: image/webp,image/apng,image/*,*/*;q=0.8\r\n
    Accept-Encoding: gzip, deflate\r\n
    Accept-Language: en-US,en;q=0.9,zh-TW;q=0.8,zh;q=0.7\r\n
     [truncated]Cookie: pgv_pvi=7659522048; pgv_si=s3813394432; RK=Olbs95KBUg; ptcz=2544f6f4ae92c346d1b59688e6f45a925ec0f9f8ef06a7a39332f6f8fe201348; _qpsvr_localtk=0.32806539237918764; tvfe_boss_uuid=3cdb9e54c3859a7f; appuser=3B22E15EAE54C942
    \r\n
    [Full request URI [truncated]: http://livep.l.qq.com/livemsg?o=392&adtype=LD&soid=d4FAO4AAWv9A1QoYqwQFkTfDAcAY&r90=1&l=4007&refluence=4007&requestl=4007&tagid=0&pf=in&si=2081548810&ev=6.0.428.428&aver_flag=0&traffic=&ip_filter=0&ufc_filter=]
    [HTTP request 1/1]
    [Response in frame: 712]

No.     Time               Source                Destination           Protocol Length Info
    652 13:08:48.936321    10.210.66.82          182.254.106.36        HTTP     530    GET /livemsg?o=392&adtype=LD&soid=d4FAO4AAWv9A1QoYqwVdEdUUAcAY&r90=1&l=4007&refluence=4007&requestl=4007&tagid=0&pf=in&si=2081548810&ev=6.0.428.428&aver_flag=0&traffic=&ip_filter=0&ufc_filter=0&backfunnel=403&use_axp=0&axpheader=1&use_txp=0&txpheader=1&st_id_t=0&flow_reuse=1&ping_data=dXBfdmVyc2lvbj1WNi4wLjQyOC40Mjg=&vid=c0022feo2h3&pf_ex=pc&live=0&aid_tpid=24&aid_tpid2=11634&aid_tpid3=11650&aid_dura=49&aid_vid_drm=0&aid_cid_drm=0&aid_copyright=218&aid_cover=hww99lj3r5ap157&aid_column=33&aid_vip_type=1&url=https://v.qq.com/x/cover/hww99lj3r5ap157/c0022feo2h3.html&from=0&pf=in&v=3.5.52&dura=&coverid=hww99lj3r5ap157&vptag=www_baidu_com|house&oadid=4007&lcount=6&t=0&pf_ex=pc&tpid=24&chid=0 HTTP/1.1 

Frame 652: 530 bytes on wire (4240 bits), 530 bytes captured (4240 bits) on interface 0
Ethernet II, Src: AsustekC_34:f3:aa (9c:5c:8e:34:f3:aa), Dst: Hangzhou_d2:34:0d (3c:e5:a6:d2:34:0d)
Internet Protocol Version 4, Src: 10.210.66.82, Dst: 182.254.106.36
Transmission Control Protocol, Src Port: 29313 (29313), Dst Port: 80 (80), Seq: 2881, Ack: 1, Len: 476
[3 Reassembled TCP Segments (3356 bytes): #650(1440), #651(1440), #652(476)]
Hypertext Transfer Protocol
     [truncated]GET /livemsg?o=392&adtype=LD&soid=d4FAO4AAWv9A1QoYqwVdEdUUAcAY&r90=1&l=4007&refluence=4007&requestl=4007&tagid=0&pf=in&si=2081548810&ev=6.0.428.428&aver_flag=0&traffic=&ip_filter=0&ufc_filter=0&backfunnel=403&use_axp=0&axpheade
    Host: livep.l.qq.com\r\n
    Connection: keep-alive\r\n
    User-Agent: Mozilla/5.0 (Windows NT 10.0; Win64; x64) AppleWebKit/537.36 (KHTML, like Gecko) Chrome/66.0.3359.139 Safari/537.36\r\n
    Accept: image/webp,image/apng,image/*,*/*;q=0.8\r\n
    Accept-Encoding: gzip, deflate\r\n
    Accept-Language: en-US,en;q=0.9,zh-TW;q=0.8,zh;q=0.7\r\n
     [truncated]Cookie: pgv_pvi=7659522048; pgv_si=s3813394432; RK=Olbs95KBUg; ptcz=2544f6f4ae92c346d1b59688e6f45a925ec0f9f8ef06a7a39332f6f8fe201348; _qpsvr_localtk=0.32806539237918764; tvfe_boss_uuid=3cdb9e54c3859a7f; appuser=3B22E15EAE54C942
    \r\n
    [Full request URI [truncated]: http://livep.l.qq.com/livemsg?o=392&adtype=LD&soid=d4FAO4AAWv9A1QoYqwVdEdUUAcAY&r90=1&l=4007&refluence=4007&requestl=4007&tagid=0&pf=in&si=2081548810&ev=6.0.428.428&aver_flag=0&traffic=&ip_filter=0&ufc_filter=]
    [HTTP request 1/1]
    [Response in frame: 715]

No.     Time               Source                Destination           Protocol Length Info
    662 13:08:48.983523    10.210.66.82          182.254.106.36        HTTP     555    GET /livemsg?o=90&adtype=KB&soid=d4FAO4AAWv9A1QoYqwCI3iBUAcAY&r90=1&l=4007&refluence=4007&requestl=4007&tagid=0&pf=in&si=2081548810&ev=6.0.428.428&aver_flag=6148&traffic=&ip_filter=0&ufc_filter=0&ufc_stra=0&ufc_match=0&backfunnel=201&use_axp=0&axpheader=1&use_txp=0&txpheader=1&st_id_t=0&flow_reuse=1&ping_data=dXBfdmVyc2lvbj1WNi4wLjQyOC40Mjg=&vid=c0022feo2h3&pf_ex=pc&live=0&aid_tpid=24&aid_tpid2=11634&aid_tpid3=11650&aid_dura=49&aid_vid_drm=0&aid_cid_drm=0&aid_copyright=218&aid_cover=hww99lj3r5ap157&aid_column=33&aid_vip_type=1&url=https://v.qq.com/x/cover/hww99lj3r5ap157/c0022feo2h3.html&from=0&pf=in&v=3.5.52&dura=&coverid=hww99lj3r5ap157&vptag=www_baidu_com|house&oadid=4007&lcount=1&t=0&pf_ex=pc&tpid=24&chid=0 HTTP/1.1 

Frame 662: 555 bytes on wire (4440 bits), 555 bytes captured (4440 bits) on interface 0
Ethernet II, Src: AsustekC_34:f3:aa (9c:5c:8e:34:f3:aa), Dst: Hangzhou_d2:34:0d (3c:e5:a6:d2:34:0d)
Internet Protocol Version 4, Src: 10.210.66.82, Dst: 182.254.106.36
Transmission Control Protocol, Src Port: 29302 (29302), Dst Port: 80 (80), Seq: 9642, Ack: 555, Len: 501
[3 Reassembled TCP Segments (3381 bytes): #660(1440), #661(1440), #662(501)]
Hypertext Transfer Protocol
     [truncated]GET /livemsg?o=90&adtype=KB&soid=d4FAO4AAWv9A1QoYqwCI3iBUAcAY&r90=1&l=4007&refluence=4007&requestl=4007&tagid=0&pf=in&si=2081548810&ev=6.0.428.428&aver_flag=6148&traffic=&ip_filter=0&ufc_filter=0&ufc_stra=0&ufc_match=0&backfunn
    Host: livep.l.qq.com\r\n
    Connection: keep-alive\r\n
    User-Agent: Mozilla/5.0 (Windows NT 10.0; Win64; x64) AppleWebKit/537.36 (KHTML, like Gecko) Chrome/66.0.3359.139 Safari/537.36\r\n
    Accept: image/webp,image/apng,image/*,*/*;q=0.8\r\n
    Accept-Encoding: gzip, deflate\r\n
    Accept-Language: en-US,en;q=0.9,zh-TW;q=0.8,zh;q=0.7\r\n
     [truncated]Cookie: pgv_pvi=7659522048; pgv_si=s3813394432; RK=Olbs95KBUg; ptcz=2544f6f4ae92c346d1b59688e6f45a925ec0f9f8ef06a7a39332f6f8fe201348; _qpsvr_localtk=0.32806539237918764; tvfe_boss_uuid=3cdb9e54c3859a7f; appuser=3B22E15EAE54C942
    \r\n
    [Full request URI [truncated]: http://livep.l.qq.com/livemsg?o=90&adtype=KB&soid=d4FAO4AAWv9A1QoYqwCI3iBUAcAY&r90=1&l=4007&refluence=4007&requestl=4007&tagid=0&pf=in&si=2081548810&ev=6.0.428.428&aver_flag=6148&traffic=&ip_filter=0&ufc_filte]
    [HTTP request 3/3]
    [Prev request in frame: 581]
    [Response in frame: 724]

No.     Time               Source                Destination           Protocol Length Info
    679 13:08:49.013823    182.254.106.36        10.210.66.82          HTTP     234    HTTP/1.1 200 OK  (text/html)

Frame 679: 234 bytes on wire (1872 bits), 234 bytes captured (1872 bits) on interface 0
Ethernet II, Src: Hangzhou_d2:34:0d (3c:e5:a6:d2:34:0d), Dst: AsustekC_34:f3:aa (9c:5c:8e:34:f3:aa)
Internet Protocol Version 4, Src: 182.254.106.36, Dst: 10.210.66.82
Transmission Control Protocol, Src Port: 80 (80), Dst Port: 29309 (29309), Seq: 1, Ack: 3357, Len: 180
Hypertext Transfer Protocol
    HTTP/1.1 200 OK\r\n
    Date: Fri, 18 May 2018 13:08:38 GMT\r\n
    Content-Type: text/html; charset=GB2312\r\n
    Transfer-Encoding: chunked\r\n
    Connection: keep-alive\r\n
    Cache-Control: no-cache\r\n
    \r\n
    [HTTP response 1/1]
    [Time since request: 0.094396000 seconds]
    [Request in frame: 618]
    HTTP chunked response
Line-based text data: text/html

No.     Time               Source                Destination           Protocol Length Info
    689 13:08:49.017267    182.254.106.36        10.210.66.82          HTTP     234    HTTP/1.1 200 OK  (text/html)

Frame 689: 234 bytes on wire (1872 bits), 234 bytes captured (1872 bits) on interface 0
Ethernet II, Src: Hangzhou_d2:34:0d (3c:e5:a6:d2:34:0d), Dst: AsustekC_34:f3:aa (9c:5c:8e:34:f3:aa)
Internet Protocol Version 4, Src: 182.254.106.36, Dst: 10.210.66.82
Transmission Control Protocol, Src Port: 80 (80), Dst Port: 29310 (29310), Seq: 1, Ack: 3357, Len: 180
Hypertext Transfer Protocol
    HTTP/1.1 200 OK\r\n
    Date: Fri, 18 May 2018 13:08:38 GMT\r\n
    Content-Type: text/html; charset=GB2312\r\n
    Transfer-Encoding: chunked\r\n
    Connection: keep-alive\r\n
    Cache-Control: no-cache\r\n
    \r\n
    [HTTP response 1/1]
    [Time since request: 0.095805000 seconds]
    [Request in frame: 623]
    HTTP chunked response
Line-based text data: text/html

No.     Time               Source                Destination           Protocol Length Info
    708 13:08:49.027833    182.254.106.36        10.210.66.82          HTTP     234    HTTP/1.1 200 OK  (text/html)

Frame 708: 234 bytes on wire (1872 bits), 234 bytes captured (1872 bits) on interface 0
Ethernet II, Src: Hangzhou_d2:34:0d (3c:e5:a6:d2:34:0d), Dst: AsustekC_34:f3:aa (9c:5c:8e:34:f3:aa)
Internet Protocol Version 4, Src: 182.254.106.36, Dst: 10.210.66.82
Transmission Control Protocol, Src Port: 80 (80), Dst Port: 29311 (29311), Seq: 1, Ack: 3357, Len: 180
Hypertext Transfer Protocol
    HTTP/1.1 200 OK\r\n
    Date: Fri, 18 May 2018 13:08:38 GMT\r\n
    Content-Type: text/html; charset=GB2312\r\n
    Transfer-Encoding: chunked\r\n
    Connection: keep-alive\r\n
    Cache-Control: no-cache\r\n
    \r\n
    [HTTP response 1/1]
    [Time since request: 0.094161000 seconds]
    [Request in frame: 644]
    HTTP chunked response
Line-based text data: text/html

No.     Time               Source                Destination           Protocol Length Info
    712 13:08:49.028862    182.254.106.36        10.210.66.82          HTTP     234    HTTP/1.1 200 OK  (text/html)

Frame 712: 234 bytes on wire (1872 bits), 234 bytes captured (1872 bits) on interface 0
Ethernet II, Src: Hangzhou_d2:34:0d (3c:e5:a6:d2:34:0d), Dst: AsustekC_34:f3:aa (9c:5c:8e:34:f3:aa)
Internet Protocol Version 4, Src: 182.254.106.36, Dst: 10.210.66.82
Transmission Control Protocol, Src Port: 80 (80), Dst Port: 29312 (29312), Seq: 1, Ack: 3357, Len: 180
Hypertext Transfer Protocol
    HTTP/1.1 200 OK\r\n
    Date: Fri, 18 May 2018 13:08:38 GMT\r\n
    Content-Type: text/html; charset=GB2312\r\n
    Transfer-Encoding: chunked\r\n
    Connection: keep-alive\r\n
    Cache-Control: no-cache\r\n
    \r\n
    [HTTP response 1/1]
    [Time since request: 0.094715000 seconds]
    [Request in frame: 647]
    HTTP chunked response
Line-based text data: text/html

No.     Time               Source                Destination           Protocol Length Info
    715 13:08:49.029833    182.254.106.36        10.210.66.82          HTTP     234    HTTP/1.1 200 OK  (text/html)

Frame 715: 234 bytes on wire (1872 bits), 234 bytes captured (1872 bits) on interface 0
Ethernet II, Src: Hangzhou_d2:34:0d (3c:e5:a6:d2:34:0d), Dst: AsustekC_34:f3:aa (9c:5c:8e:34:f3:aa)
Internet Protocol Version 4, Src: 182.254.106.36, Dst: 10.210.66.82
Transmission Control Protocol, Src Port: 80 (80), Dst Port: 29313 (29313), Seq: 1, Ack: 3357, Len: 180
Hypertext Transfer Protocol
    HTTP/1.1 200 OK\r\n
    Date: Fri, 18 May 2018 13:08:38 GMT\r\n
    Content-Type: text/html; charset=GB2312\r\n
    Transfer-Encoding: chunked\r\n
    Connection: keep-alive\r\n
    Cache-Control: no-cache\r\n
    \r\n
    [HTTP response 1/1]
    [Time since request: 0.093512000 seconds]
    [Request in frame: 652]
    HTTP chunked response
Line-based text data: text/html

No.     Time               Source                Destination           Protocol Length Info
    724 13:08:49.071107    182.254.106.36        10.210.66.82          HTTP     326    HTTP/1.1 200 OK  (text/html)

Frame 724: 326 bytes on wire (2608 bits), 326 bytes captured (2608 bits) on interface 0
Ethernet II, Src: Hangzhou_d2:34:0d (3c:e5:a6:d2:34:0d), Dst: AsustekC_34:f3:aa (9c:5c:8e:34:f3:aa)
Internet Protocol Version 4, Src: 182.254.106.36, Dst: 10.210.66.82
Transmission Control Protocol, Src Port: 80 (80), Dst Port: 29302 (29302), Seq: 555, Ack: 10143, Len: 272
Hypertext Transfer Protocol
    HTTP/1.1 200 OK\r\n
    Date: Fri, 18 May 2018 13:08:38 GMT\r\n
    Content-Type: text/html; charset=GB2312\r\n
    Transfer-Encoding: chunked\r\n
    Connection: keep-alive\r\n
    Cache-Control: no-cache\r\n
    Set-Cookie: short_video=; Domain=.l.qq.com; Path=/; Expires=Thu, 01 Jan 1970 08:00:00 GMT;\r\n
    \r\n
    [HTTP response 3/3]
    [Time since request: 0.087584000 seconds]
    [Prev request in frame: 581]
    [Prev response in frame: 624]
    [Request in frame: 662]
    HTTP chunked response
Line-based text data: text/html

No.     Time               Source                Destination           Protocol Length Info
   3335 13:10:07.693942    10.210.66.82          182.254.106.36        HTTP     553    GET /livemsg?o=392&adtype=HT&soid=d4FAO5wAWv9BJAchrQDhQVsNAbwh&r90=1&l=4007&refluence=4007&requestl=4007&tagid=0&pf=in&si=3579310090&ev=6.0.428.428&aver_flag=0&traffic=&ip_filter=0&ufc_filter=0&ufc_stra=0&ufc_match=0&backfunnel=401&use_axp=0&axpheader=1&use_txp=0&txpheader=1&st_id_t=0&flow_reuse=1&ping_data=dXBfdmVyc2lvbj1WNi4wLjQyOC40Mjg=&vid=c0022feo2h3&pf_ex=pc&live=0&aid_tpid=24&aid_tpid2=11634&aid_tpid3=11650&aid_dura=49&aid_vid_drm=0&aid_cid_drm=0&aid_copyright=218&aid_cover=hww99lj3r5ap157&aid_column=33&aid_vip_type=1&url=https://v.qq.com/x/cover/hww99lj3r5ap157/c0022feo2h3.html&from=0&pf=in&v=3.5.52&dura=&coverid=hww99lj3r5ap157&vptag=www_baidu_com|house&oadid=4007&lcount=1&t=0&pf_ex=pc&tpid=24&chid=0 HTTP/1.1 

Frame 3335: 553 bytes on wire (4424 bits), 553 bytes captured (4424 bits) on interface 0
Ethernet II, Src: AsustekC_34:f3:aa (9c:5c:8e:34:f3:aa), Dst: Hangzhou_d2:34:0d (3c:e5:a6:d2:34:0d)
Internet Protocol Version 4, Src: 10.210.66.82, Dst: 182.254.106.36
Transmission Control Protocol, Src Port: 29343 (29343), Dst Port: 80 (80), Seq: 2881, Ack: 1, Len: 499
[3 Reassembled TCP Segments (3379 bytes): #3333(1440), #3334(1440), #3335(499)]
Hypertext Transfer Protocol
     [truncated]GET /livemsg?o=392&adtype=HT&soid=d4FAO5wAWv9BJAchrQDhQVsNAbwh&r90=1&l=4007&refluence=4007&requestl=4007&tagid=0&pf=in&si=3579310090&ev=6.0.428.428&aver_flag=0&traffic=&ip_filter=0&ufc_filter=0&ufc_stra=0&ufc_match=0&backfunnel
    Host: livep.l.qq.com\r\n
    Connection: keep-alive\r\n
    User-Agent: Mozilla/5.0 (Windows NT 10.0; Win64; x64) AppleWebKit/537.36 (KHTML, like Gecko) Chrome/66.0.3359.139 Safari/537.36\r\n
    Accept: image/webp,image/apng,image/*,*/*;q=0.8\r\n
    Accept-Encoding: gzip, deflate\r\n
    Accept-Language: en-US,en;q=0.9,zh-TW;q=0.8,zh;q=0.7\r\n
     [truncated]Cookie: pgv_pvi=7659522048; pgv_si=s3813394432; RK=Olbs95KBUg; ptcz=2544f6f4ae92c346d1b59688e6f45a925ec0f9f8ef06a7a39332f6f8fe201348; _qpsvr_localtk=0.32806539237918764; tvfe_boss_uuid=3cdb9e54c3859a7f; appuser=3B22E15EAE54C942
    \r\n
    [Full request URI [truncated]: http://livep.l.qq.com/livemsg?o=392&adtype=HT&soid=d4FAO5wAWv9BJAchrQDhQVsNAbwh&r90=1&l=4007&refluence=4007&requestl=4007&tagid=0&pf=in&si=3579310090&ev=6.0.428.428&aver_flag=0&traffic=&ip_filter=0&ufc_filter=]
    [HTTP request 1/1]
    [Response in frame: 3339]

No.     Time               Source                Destination           Protocol Length Info
   3339 13:10:07.771164    182.254.106.36        10.210.66.82          HTTP     326    HTTP/1.1 200 OK  (text/html)

Frame 3339: 326 bytes on wire (2608 bits), 326 bytes captured (2608 bits) on interface 0
Ethernet II, Src: Hangzhou_d2:34:0d (3c:e5:a6:d2:34:0d), Dst: AsustekC_34:f3:aa (9c:5c:8e:34:f3:aa)
Internet Protocol Version 4, Src: 182.254.106.36, Dst: 10.210.66.82
Transmission Control Protocol, Src Port: 80 (80), Dst Port: 29343 (29343), Seq: 1, Ack: 3380, Len: 272
Hypertext Transfer Protocol
    HTTP/1.1 200 OK\r\n
    Date: Fri, 18 May 2018 13:09:57 GMT\r\n
    Content-Type: text/html; charset=GB2312\r\n
    Transfer-Encoding: chunked\r\n
    Connection: keep-alive\r\n
    Cache-Control: no-cache\r\n
    Set-Cookie: short_video=; Domain=.l.qq.com; Path=/; Expires=Thu, 01 Jan 1970 08:00:00 GMT;\r\n
    \r\n
    [HTTP response 1/1]
    [Time since request: 0.077222000 seconds]
    [Request in frame: 3335]
    HTTP chunked response
Line-based text data: text/html

No.     Time               Source                Destination           Protocol Length Info
   3377 13:10:09.798069    10.210.66.82          182.254.93.101        HTTP     413    GET /vpic/0/w0022r9q7cx_160_90_3.jpg/0 HTTP/1.1 

Frame 3377: 413 bytes on wire (3304 bits), 413 bytes captured (3304 bits) on interface 0
Ethernet II, Src: AsustekC_34:f3:aa (9c:5c:8e:34:f3:aa), Dst: Hangzhou_d2:34:0d (3c:e5:a6:d2:34:0d)
Internet Protocol Version 4, Src: 10.210.66.82, Dst: 182.254.93.101
Transmission Control Protocol, Src Port: 29345 (29345), Dst Port: 80 (80), Seq: 1, Ack: 1, Len: 359
Hypertext Transfer Protocol
    GET /vpic/0/w0022r9q7cx_160_90_3.jpg/0 HTTP/1.1\r\n
    Host: puui.qpic.cn\r\n
    Connection: keep-alive\r\n
    User-Agent: Mozilla/5.0 (Windows NT 10.0; Win64; x64) AppleWebKit/537.36 (KHTML, like Gecko) Chrome/66.0.3359.139 Safari/537.36\r\n
    Accept: image/webp,image/apng,image/*,*/*;q=0.8\r\n
    Accept-Encoding: gzip, deflate\r\n
    Accept-Language: en-US,en;q=0.9,zh-TW;q=0.8,zh;q=0.7\r\n
    \r\n
    [Full request URI: http://puui.qpic.cn/vpic/0/w0022r9q7cx_160_90_3.jpg/0]
    [HTTP request 1/1]
    [Response in frame: 3380]

No.     Time               Source                Destination           Protocol Length Info
   3378 13:10:09.798169    10.210.66.82          182.254.93.101        HTTP     413    GET /vpic/0/p0020ru2jon_160_90_3.jpg/0 HTTP/1.1 

Frame 3378: 413 bytes on wire (3304 bits), 413 bytes captured (3304 bits) on interface 0
Ethernet II, Src: AsustekC_34:f3:aa (9c:5c:8e:34:f3:aa), Dst: Hangzhou_d2:34:0d (3c:e5:a6:d2:34:0d)
Internet Protocol Version 4, Src: 10.210.66.82, Dst: 182.254.93.101
Transmission Control Protocol, Src Port: 29344 (29344), Dst Port: 80 (80), Seq: 1, Ack: 1, Len: 359
Hypertext Transfer Protocol
    GET /vpic/0/p0020ru2jon_160_90_3.jpg/0 HTTP/1.1\r\n
    Host: puui.qpic.cn\r\n
    Connection: keep-alive\r\n
    User-Agent: Mozilla/5.0 (Windows NT 10.0; Win64; x64) AppleWebKit/537.36 (KHTML, like Gecko) Chrome/66.0.3359.139 Safari/537.36\r\n
    Accept: image/webp,image/apng,image/*,*/*;q=0.8\r\n
    Accept-Encoding: gzip, deflate\r\n
    Accept-Language: en-US,en;q=0.9,zh-TW;q=0.8,zh;q=0.7\r\n
    \r\n
    [Full request URI: http://puui.qpic.cn/vpic/0/p0020ru2jon_160_90_3.jpg/0]
    [HTTP request 1/1]
    [Response in frame: 3385]

No.     Time               Source                Destination           Protocol Length Info
   3380 13:10:09.875231    182.254.93.101        10.210.66.82          HTTP     1494   HTTP/1.1 200 OK  (image/jpeg)

Frame 3380: 1494 bytes on wire (11952 bits), 1494 bytes captured (11952 bits) on interface 0
Ethernet II, Src: Hangzhou_d2:34:0d (3c:e5:a6:d2:34:0d), Dst: AsustekC_34:f3:aa (9c:5c:8e:34:f3:aa)
Internet Protocol Version 4, Src: 182.254.93.101, Dst: 10.210.66.82
Transmission Control Protocol, Src Port: 80 (80), Dst Port: 29345 (29345), Seq: 1, Ack: 360, Len: 1440
Hypertext Transfer Protocol
Media Type

No.     Time               Source                Destination           Protocol Length Info
   3385 13:10:09.918255    182.254.93.101        10.210.66.82          HTTP     1494   HTTP/1.1 200 OK  (image/jpeg)

Frame 3385: 1494 bytes on wire (11952 bits), 1494 bytes captured (11952 bits) on interface 0
Ethernet II, Src: Hangzhou_d2:34:0d (3c:e5:a6:d2:34:0d), Dst: AsustekC_34:f3:aa (9c:5c:8e:34:f3:aa)
Internet Protocol Version 4, Src: 182.254.93.101, Dst: 10.210.66.82
Transmission Control Protocol, Src Port: 80 (80), Dst Port: 29344 (29344), Seq: 1, Ack: 360, Len: 1440
Hypertext Transfer Protocol
Media Type

No.     Time               Source                Destination           Protocol Length Info
   8199 13:12:20.173868    10.210.66.82          182.254.90.189        HTTP     413    GET /vpic/0/x0369mevx5a_160_90_3.jpg/0 HTTP/1.1 

Frame 8199: 413 bytes on wire (3304 bits), 413 bytes captured (3304 bits) on interface 0
Ethernet II, Src: AsustekC_34:f3:aa (9c:5c:8e:34:f3:aa), Dst: Hangzhou_d2:34:0d (3c:e5:a6:d2:34:0d)
Internet Protocol Version 4, Src: 10.210.66.82, Dst: 182.254.90.189
Transmission Control Protocol, Src Port: 29419 (29419), Dst Port: 80 (80), Seq: 1, Ack: 1, Len: 359
Hypertext Transfer Protocol
    GET /vpic/0/x0369mevx5a_160_90_3.jpg/0 HTTP/1.1\r\n
    Host: puui.qpic.cn\r\n
    Connection: keep-alive\r\n
