No.     Time               Source                Destination           Protocol Length Info
    137 09:15:26.764923    10.106.129.54         125.39.213.73         HTTP     565    GET /livemsg?o=392&adtype=LD&soid=+jbGb5AAWv8KIw0aHQDJ1EUKATga&r90=1&l=4018&refluence=4018&requestl=4018&tagid=0&pf=in&si=2047535882&ev=6.0.427.427&aver_flag=6148&traffic=&ip_filter=0&ufc_filter=55&ufc_stra=0&ufc_match=55&backfunnel=401&use_axp=0&axpheader=1&use_txp=0&txpheader=1&st_id_t=0&flow_reuse=1&ping_data=dXBfdmVyc2lvbj1WNi4wLjQyNy40Mjc=&vid=t065456rrrg&pf_ex=pc&live=0&channelId=1&page=coolOpen&aid_tpid=28&aid_tpid2=1150&aid_tpid3=11668&aid_dura=39&aid_vid_drm=0&aid_copyright=107&aid_vip_type=1&url=https://v.qq.com/tech&from=0&pf=in&v=3.5.52&dura=&coverid=&vptag=www_baidu_com|v_tech_new:img&oadid=4018&lcount=1&t=0&pf_ex=pc&tpid=28&chid=0 HTTP/1.1 

Frame 137: 565 bytes on wire (4520 bits), 565 bytes captured (4520 bits) on interface 0
Ethernet II, Src: AsustekC_34:f3:aa (9c:5c:8e:34:f3:aa), Dst: Hangzhou_75:c8:f5 (74:25:8a:75:c8:f5)
Internet Protocol Version 4, Src: 10.106.129.54, Dst: 125.39.213.73
Transmission Control Protocol, Src Port: 20695 (20695), Dst Port: 80 (80), Seq: 2881, Ack: 1, Len: 511
[3 Reassembled TCP Segments (3391 bytes): #135(1440), #136(1440), #137(511)]
Hypertext Transfer Protocol
     [truncated]GET /livemsg?o=392&adtype=LD&soid=+jbGb5AAWv8KIw0aHQDJ1EUKATga&r90=1&l=4018&refluence=4018&requestl=4018&tagid=0&pf=in&si=2047535882&ev=6.0.427.427&aver_flag=6148&traffic=&ip_filter=0&ufc_filter=55&ufc_stra=0&ufc_match=55&backf
    Host: livep.l.qq.com\r\n
    Connection: keep-alive\r\n
    User-Agent: Mozilla/5.0 (Windows NT 10.0; Win64; x64) AppleWebKit/537.36 (KHTML, like Gecko) Chrome/66.0.3359.139 Safari/537.36\r\n
    Accept: image/webp,image/apng,image/*,*/*;q=0.8\r\n
    Accept-Encoding: gzip, deflate\r\n
    Accept-Language: en-US,en;q=0.9,zh-TW;q=0.8,zh;q=0.7\r\n
     [truncated]Cookie: pgv_pvi=7659522048; pgv_si=s3813394432; RK=Olbs95KBUg; ptcz=2544f6f4ae92c346d1b59688e6f45a925ec0f9f8ef06a7a39332f6f8fe201348; _qpsvr_localtk=0.32806539237918764; tvfe_boss_uuid=3cdb9e54c3859a7f; appuser=3B22E15EAE54C942
    \r\n
    [Full request URI [truncated]: http://livep.l.qq.com/livemsg?o=392&adtype=LD&soid=+jbGb5AAWv8KIw0aHQDJ1EUKATga&r90=1&l=4018&refluence=4018&requestl=4018&tagid=0&pf=in&si=2047535882&ev=6.0.427.427&aver_flag=6148&traffic=&ip_filter=0&ufc_filt]
    [HTTP request 1/1]

No.     Time               Source                Destination           Protocol Length Info
    140 09:15:26.765101    10.106.129.54         125.39.213.73         HTTP     538    GET /livemsg?o=392&adtype=LD&soid=+jbGb5AAWv8KIw0aHQGRVKfdATga&r90=1&l=4018&refluence=4018&requestl=4018&tagid=0&pf=in&si=2047535882&ev=6.0.427.427&aver_flag=0&traffic=&ip_filter=0&ufc_filter=55&backfunnel=401&use_axp=0&axpheader=1&use_txp=0&txpheader=1&st_id_t=0&flow_reuse=1&ping_data=dXBfdmVyc2lvbj1WNi4wLjQyNy40Mjc=&vid=t065456rrrg&pf_ex=pc&live=0&channelId=1&page=coolOpen&aid_tpid=28&aid_tpid2=1150&aid_tpid3=11668&aid_dura=39&aid_vid_drm=0&aid_copyright=107&aid_vip_type=1&url=https://v.qq.com/tech&from=0&pf=in&v=3.5.52&dura=&coverid=&vptag=www_baidu_com|v_tech_new:img&oadid=4018&lcount=2&t=0&pf_ex=pc&tpid=28&chid=0 HTTP/1.1 

Frame 140: 538 bytes on wire (4304 bits), 538 bytes captured (4304 bits) on interface 0
Ethernet II, Src: AsustekC_34:f3:aa (9c:5c:8e:34:f3:aa), Dst: Hangzhou_75:c8:f5 (74:25:8a:75:c8:f5)
Internet Protocol Version 4, Src: 10.106.129.54, Dst: 125.39.213.73
Transmission Control Protocol, Src Port: 20693 (20693), Dst Port: 80 (80), Seq: 2881, Ack: 1, Len: 484
[3 Reassembled TCP Segments (3364 bytes): #138(1440), #139(1440), #140(484)]
Hypertext Transfer Protocol
     [truncated]GET /livemsg?o=392&adtype=LD&soid=+jbGb5AAWv8KIw0aHQGRVKfdATga&r90=1&l=4018&refluence=4018&requestl=4018&tagid=0&pf=in&si=2047535882&ev=6.0.427.427&aver_flag=0&traffic=&ip_filter=0&ufc_filter=55&backfunnel=401&use_axp=0&axphead
    Host: livep.l.qq.com\r\n
    Connection: keep-alive\r\n
    User-Agent: Mozilla/5.0 (Windows NT 10.0; Win64; x64) AppleWebKit/537.36 (KHTML, like Gecko) Chrome/66.0.3359.139 Safari/537.36\r\n
    Accept: image/webp,image/apng,image/*,*/*;q=0.8\r\n
    Accept-Encoding: gzip, deflate\r\n
    Accept-Language: en-US,en;q=0.9,zh-TW;q=0.8,zh;q=0.7\r\n
     [truncated]Cookie: pgv_pvi=7659522048; pgv_si=s3813394432; RK=Olbs95KBUg; ptcz=2544f6f4ae92c346d1b59688e6f45a925ec0f9f8ef06a7a39332f6f8fe201348; _qpsvr_localtk=0.32806539237918764; tvfe_boss_uuid=3cdb9e54c3859a7f; appuser=3B22E15EAE54C942
    \r\n
    [Full request URI [truncated]: http://livep.l.qq.com/livemsg?o=392&adtype=LD&soid=+jbGb5AAWv8KIw0aHQGRVKfdATga&r90=1&l=4018&refluence=4018&requestl=4018&tagid=0&pf=in&si=2047535882&ev=6.0.427.427&aver_flag=0&traffic=&ip_filter=0&ufc_filter=]
    [HTTP request 1/1]
    [Response in frame: 179]

No.     Time               Source                Destination           Protocol Length Info
    156 09:15:26.769184    10.106.129.54         125.39.213.73         HTTP     538    GET /livemsg?o=392&adtype=LD&soid=+jbGb5AAWv8KIw0aHQI40vF+ATga&r90=1&l=4018&refluence=4018&requestl=4018&tagid=0&pf=in&si=2047535882&ev=6.0.427.427&aver_flag=0&traffic=&ip_filter=0&ufc_filter=55&backfunnel=401&use_axp=0&axpheader=1&use_txp=0&txpheader=1&st_id_t=0&flow_reuse=1&ping_data=dXBfdmVyc2lvbj1WNi4wLjQyNy40Mjc=&vid=t065456rrrg&pf_ex=pc&live=0&channelId=1&page=coolOpen&aid_tpid=28&aid_tpid2=1150&aid_tpid3=11668&aid_dura=39&aid_vid_drm=0&aid_copyright=107&aid_vip_type=1&url=https://v.qq.com/tech&from=0&pf=in&v=3.5.52&dura=&coverid=&vptag=www_baidu_com|v_tech_new:img&oadid=4018&lcount=3&t=0&pf_ex=pc&tpid=28&chid=0 HTTP/1.1 

Frame 156: 538 bytes on wire (4304 bits), 538 bytes captured (4304 bits) on interface 0
Ethernet II, Src: AsustekC_34:f3:aa (9c:5c:8e:34:f3:aa), Dst: Hangzhou_75:c8:f5 (74:25:8a:75:c8:f5)
Internet Protocol Version 4, Src: 10.106.129.54, Dst: 125.39.213.73
Transmission Control Protocol, Src Port: 20696 (20696), Dst Port: 80 (80), Seq: 2881, Ack: 1, Len: 484
[3 Reassembled TCP Segments (3364 bytes): #154(1440), #155(1440), #156(484)]
Hypertext Transfer Protocol
     [truncated]GET /livemsg?o=392&adtype=LD&soid=+jbGb5AAWv8KIw0aHQI40vF+ATga&r90=1&l=4018&refluence=4018&requestl=4018&tagid=0&pf=in&si=2047535882&ev=6.0.427.427&aver_flag=0&traffic=&ip_filter=0&ufc_filter=55&backfunnel=401&use_axp=0&axphead
    Host: livep.l.qq.com\r\n
    Connection: keep-alive\r\n
    User-Agent: Mozilla/5.0 (Windows NT 10.0; Win64; x64) AppleWebKit/537.36 (KHTML, like Gecko) Chrome/66.0.3359.139 Safari/537.36\r\n
    Accept: image/webp,image/apng,image/*,*/*;q=0.8\r\n
    Accept-Encoding: gzip, deflate\r\n
    Accept-Language: en-US,en;q=0.9,zh-TW;q=0.8,zh;q=0.7\r\n
     [truncated]Cookie: pgv_pvi=7659522048; pgv_si=s3813394432; RK=Olbs95KBUg; ptcz=2544f6f4ae92c346d1b59688e6f45a925ec0f9f8ef06a7a39332f6f8fe201348; _qpsvr_localtk=0.32806539237918764; tvfe_boss_uuid=3cdb9e54c3859a7f; appuser=3B22E15EAE54C942
    \r\n
    [Full request URI [truncated]: http://livep.l.qq.com/livemsg?o=392&adtype=LD&soid=+jbGb5AAWv8KIw0aHQI40vF+ATga&r90=1&l=4018&refluence=4018&requestl=4018&tagid=0&pf=in&si=2047535882&ev=6.0.427.427&aver_flag=0&traffic=&ip_filter=0&ufc_filter=]
    [HTTP request 1/1]
    [Response in frame: 191]

No.     Time               Source                Destination           Protocol Length Info
    159 09:15:26.769346    10.106.129.54         125.39.213.73         HTTP     538    GET /livemsg?o=392&adtype=LD&soid=+jbGb5AAWv8KIw0aHQNgUhOpATga&r90=1&l=4018&refluence=4018&requestl=4018&tagid=0&pf=in&si=2047535882&ev=6.0.427.427&aver_flag=0&traffic=&ip_filter=0&ufc_filter=55&backfunnel=401&use_axp=0&axpheader=1&use_txp=0&txpheader=1&st_id_t=0&flow_reuse=1&ping_data=dXBfdmVyc2lvbj1WNi4wLjQyNy40Mjc=&vid=t065456rrrg&pf_ex=pc&live=0&channelId=1&page=coolOpen&aid_tpid=28&aid_tpid2=1150&aid_tpid3=11668&aid_dura=39&aid_vid_drm=0&aid_copyright=107&aid_vip_type=1&url=https://v.qq.com/tech&from=0&pf=in&v=3.5.52&dura=&coverid=&vptag=www_baidu_com|v_tech_new:img&oadid=4018&lcount=4&t=0&pf_ex=pc&tpid=28&chid=0 HTTP/1.1 

Frame 159: 538 bytes on wire (4304 bits), 538 bytes captured (4304 bits) on interface 0
Ethernet II, Src: AsustekC_34:f3:aa (9c:5c:8e:34:f3:aa), Dst: Hangzhou_75:c8:f5 (74:25:8a:75:c8:f5)
Internet Protocol Version 4, Src: 10.106.129.54, Dst: 125.39.213.73
Transmission Control Protocol, Src Port: 20694 (20694), Dst Port: 80 (80), Seq: 2881, Ack: 1, Len: 484
[3 Reassembled TCP Segments (3364 bytes): #157(1440), #158(1440), #159(484)]
Hypertext Transfer Protocol
     [truncated]GET /livemsg?o=392&adtype=LD&soid=+jbGb5AAWv8KIw0aHQNgUhOpATga&r90=1&l=4018&refluence=4018&requestl=4018&tagid=0&pf=in&si=2047535882&ev=6.0.427.427&aver_flag=0&traffic=&ip_filter=0&ufc_filter=55&backfunnel=401&use_axp=0&axphead
    Host: livep.l.qq.com\r\n
    Connection: keep-alive\r\n
    User-Agent: Mozilla/5.0 (Windows NT 10.0; Win64; x64) AppleWebKit/537.36 (KHTML, like Gecko) Chrome/66.0.3359.139 Safari/537.36\r\n
    Accept: image/webp,image/apng,image/*,*/*;q=0.8\r\n
    Accept-Encoding: gzip, deflate\r\n
    Accept-Language: en-US,en;q=0.9,zh-TW;q=0.8,zh;q=0.7\r\n
     [truncated]Cookie: pgv_pvi=7659522048; pgv_si=s3813394432; RK=Olbs95KBUg; ptcz=2544f6f4ae92c346d1b59688e6f45a925ec0f9f8ef06a7a39332f6f8fe201348; _qpsvr_localtk=0.32806539237918764; tvfe_boss_uuid=3cdb9e54c3859a7f; appuser=3B22E15EAE54C942
    \r\n
    [Full request URI [truncated]: http://livep.l.qq.com/livemsg?o=392&adtype=LD&soid=+jbGb5AAWv8KIw0aHQNgUhOpATga&r90=1&l=4018&refluence=4018&requestl=4018&tagid=0&pf=in&si=2047535882&ev=6.0.427.427&aver_flag=0&traffic=&ip_filter=0&ufc_filter=]
    [HTTP request 1/1]
    [Response in frame: 194]

No.     Time               Source                Destination           Protocol Length Info
    162 09:15:26.769692    10.106.129.54         125.39.213.73         HTTP     538    GET /livemsg?o=392&adtype=LD&soid=+jbGb5AAWv8KIw0aHQQr2S3jATga&r90=1&l=4018&refluence=4018&requestl=4018&tagid=0&pf=in&si=2047535882&ev=6.0.427.427&aver_flag=0&traffic=&ip_filter=0&ufc_filter=55&backfunnel=401&use_axp=0&axpheader=1&use_txp=0&txpheader=1&st_id_t=0&flow_reuse=1&ping_data=dXBfdmVyc2lvbj1WNi4wLjQyNy40Mjc=&vid=t065456rrrg&pf_ex=pc&live=0&channelId=1&page=coolOpen&aid_tpid=28&aid_tpid2=1150&aid_tpid3=11668&aid_dura=39&aid_vid_drm=0&aid_copyright=107&aid_vip_type=1&url=https://v.qq.com/tech&from=0&pf=in&v=3.5.52&dura=&coverid=&vptag=www_baidu_com|v_tech_new:img&oadid=4018&lcount=5&t=0&pf_ex=pc&tpid=28&chid=0 HTTP/1.1 

Frame 162: 538 bytes on wire (4304 bits), 538 bytes captured (4304 bits) on interface 0
Ethernet II, Src: AsustekC_34:f3:aa (9c:5c:8e:34:f3:aa), Dst: Hangzhou_75:c8:f5 (74:25:8a:75:c8:f5)
Internet Protocol Version 4, Src: 10.106.129.54, Dst: 125.39.213.73
Transmission Control Protocol, Src Port: 20697 (20697), Dst Port: 80 (80), Seq: 2881, Ack: 1, Len: 484
[3 Reassembled TCP Segments (3364 bytes): #160(1440), #161(1440), #162(484)]
Hypertext Transfer Protocol
     [truncated]GET /livemsg?o=392&adtype=LD&soid=+jbGb5AAWv8KIw0aHQQr2S3jATga&r90=1&l=4018&refluence=4018&requestl=4018&tagid=0&pf=in&si=2047535882&ev=6.0.427.427&aver_flag=0&traffic=&ip_filter=0&ufc_filter=55&backfunnel=401&use_axp=0&axphead
    Host: livep.l.qq.com\r\n
    Connection: keep-alive\r\n
    User-Agent: Mozilla/5.0 (Windows NT 10.0; Win64; x64) AppleWebKit/537.36 (KHTML, like Gecko) Chrome/66.0.3359.139 Safari/537.36\r\n
    Accept: image/webp,image/apng,image/*,*/*;q=0.8\r\n
    Accept-Encoding: gzip, deflate\r\n
    Accept-Language: en-US,en;q=0.9,zh-TW;q=0.8,zh;q=0.7\r\n
     [truncated]Cookie: pgv_pvi=7659522048; pgv_si=s3813394432; RK=Olbs95KBUg; ptcz=2544f6f4ae92c346d1b59688e6f45a925ec0f9f8ef06a7a39332f6f8fe201348; _qpsvr_localtk=0.32806539237918764; tvfe_boss_uuid=3cdb9e54c3859a7f; appuser=3B22E15EAE54C942
    \r\n
    [Full request URI [truncated]: http://livep.l.qq.com/livemsg?o=392&adtype=LD&soid=+jbGb5AAWv8KIw0aHQQr2S3jATga&r90=1&l=4018&refluence=4018&requestl=4018&tagid=0&pf=in&si=2047535882&ev=6.0.427.427&aver_flag=0&traffic=&ip_filter=0&ufc_filter=]
    [HTTP request 1/1]

No.     Time               Source                Destination           Protocol Length Info
    165 09:15:26.769820    10.106.129.54         125.39.213.73         HTTP     538    GET /livemsg?o=392&adtype=LD&soid=+jbGb5AAWv8KIw0aHQVzWc80ATga&r90=1&l=4018&refluence=4018&requestl=4018&tagid=0&pf=in&si=2047535882&ev=6.0.427.427&aver_flag=0&traffic=&ip_filter=0&ufc_filter=55&backfunnel=401&use_axp=0&axpheader=1&use_txp=0&txpheader=1&st_id_t=0&flow_reuse=1&ping_data=dXBfdmVyc2lvbj1WNi4wLjQyNy40Mjc=&vid=t065456rrrg&pf_ex=pc&live=0&channelId=1&page=coolOpen&aid_tpid=28&aid_tpid2=1150&aid_tpid3=11668&aid_dura=39&aid_vid_drm=0&aid_copyright=107&aid_vip_type=1&url=https://v.qq.com/tech&from=0&pf=in&v=3.5.52&dura=&coverid=&vptag=www_baidu_com|v_tech_new:img&oadid=4018&lcount=6&t=0&pf_ex=pc&tpid=28&chid=0 HTTP/1.1 

Frame 165: 538 bytes on wire (4304 bits), 538 bytes captured (4304 bits) on interface 0
Ethernet II, Src: AsustekC_34:f3:aa (9c:5c:8e:34:f3:aa), Dst: Hangzhou_75:c8:f5 (74:25:8a:75:c8:f5)
Internet Protocol Version 4, Src: 10.106.129.54, Dst: 125.39.213.73
Transmission Control Protocol, Src Port: 20698 (20698), Dst Port: 80 (80), Seq: 2881, Ack: 1, Len: 484
[3 Reassembled TCP Segments (3364 bytes): #163(1440), #164(1440), #165(484)]
Hypertext Transfer Protocol
     [truncated]GET /livemsg?o=392&adtype=LD&soid=+jbGb5AAWv8KIw0aHQVzWc80ATga&r90=1&l=4018&refluence=4018&requestl=4018&tagid=0&pf=in&si=2047535882&ev=6.0.427.427&aver_flag=0&traffic=&ip_filter=0&ufc_filter=55&backfunnel=401&use_axp=0&axphead
    Host: livep.l.qq.com\r\n
    Connection: keep-alive\r\n
    User-Agent: Mozilla/5.0 (Windows NT 10.0; Win64; x64) AppleWebKit/537.36 (KHTML, like Gecko) Chrome/66.0.3359.139 Safari/537.36\r\n
    Accept: image/webp,image/apng,image/*,*/*;q=0.8\r\n
    Accept-Encoding: gzip, deflate\r\n
    Accept-Language: en-US,en;q=0.9,zh-TW;q=0.8,zh;q=0.7\r\n
     [truncated]Cookie: pgv_pvi=7659522048; pgv_si=s3813394432; RK=Olbs95KBUg; ptcz=2544f6f4ae92c346d1b59688e6f45a925ec0f9f8ef06a7a39332f6f8fe201348; _qpsvr_localtk=0.32806539237918764; tvfe_boss_uuid=3cdb9e54c3859a7f; appuser=3B22E15EAE54C942
    \r\n
    [Full request URI [truncated]: http://livep.l.qq.com/livemsg?o=392&adtype=LD&soid=+jbGb5AAWv8KIw0aHQVzWc80ATga&r90=1&l=4018&refluence=4018&requestl=4018&tagid=0&pf=in&si=2047535882&ev=6.0.427.427&aver_flag=0&traffic=&ip_filter=0&ufc_filter=]
    [HTTP request 1/8]
    [Response in frame: 198]
    [Next request in frame: 206]

No.     Time               Source                Destination           Protocol Length Info
    179 09:15:26.774981    125.39.213.73         10.106.129.54         HTTP     234    HTTP/1.1 200 OK  (text/html)

Frame 179: 234 bytes on wire (1872 bits), 234 bytes captured (1872 bits) on interface 0
Ethernet II, Src: Hangzhou_75:c8:f5 (74:25:8a:75:c8:f5), Dst: AsustekC_34:f3:aa (9c:5c:8e:34:f3:aa)
Internet Protocol Version 4, Src: 125.39.213.73, Dst: 10.106.129.54
Transmission Control Protocol, Src Port: 80 (80), Dst Port: 20693 (20693), Seq: 1, Ack: 3365, Len: 180
Hypertext Transfer Protocol
    HTTP/1.1 200 OK\r\n
    Date: Fri, 18 May 2018 09:15:15 GMT\r\n
    Content-Type: text/html; charset=GB2312\r\n
    Transfer-Encoding: chunked\r\n
    Connection: keep-alive\r\n
    Cache-Control: no-cache\r\n
    \r\n
    [HTTP response 1/1]
    [Time since request: 0.009880000 seconds]
    [Request in frame: 140]
    HTTP chunked response
Line-based text data: text/html

No.     Time               Source                Destination           Protocol Length Info
    191 09:15:26.777587    125.39.213.73         10.106.129.54         HTTP     234    HTTP/1.1 200 OK  (text/html)

Frame 191: 234 bytes on wire (1872 bits), 234 bytes captured (1872 bits) on interface 0
Ethernet II, Src: Hangzhou_75:c8:f5 (74:25:8a:75:c8:f5), Dst: AsustekC_34:f3:aa (9c:5c:8e:34:f3:aa)
Internet Protocol Version 4, Src: 125.39.213.73, Dst: 10.106.129.54
Transmission Control Protocol, Src Port: 80 (80), Dst Port: 20696 (20696), Seq: 1, Ack: 3365, Len: 180
Hypertext Transfer Protocol
    HTTP/1.1 200 OK\r\n
    Date: Fri, 18 May 2018 09:15:15 GMT\r\n
    Content-Type: text/html; charset=GB2312\r\n
    Transfer-Encoding: chunked\r\n
    Connection: keep-alive\r\n
    Cache-Control: no-cache\r\n
    \r\n
    [HTTP response 1/1]
    [Time since request: 0.008403000 seconds]
    [Request in frame: 156]
    HTTP chunked response
Line-based text data: text/html

No.     Time               Source                Destination           Protocol Length Info
    194 09:15:26.778463    125.39.213.73         10.106.129.54         HTTP     234    HTTP/1.1 200 OK  (text/html)

Frame 194: 234 bytes on wire (1872 bits), 234 bytes captured (1872 bits) on interface 0
Ethernet II, Src: Hangzhou_75:c8:f5 (74:25:8a:75:c8:f5), Dst: AsustekC_34:f3:aa (9c:5c:8e:34:f3:aa)
Internet Protocol Version 4, Src: 125.39.213.73, Dst: 10.106.129.54
Transmission Control Protocol, Src Port: 80 (80), Dst Port: 20694 (20694), Seq: 1, Ack: 3365, Len: 180
Hypertext Transfer Protocol
    HTTP/1.1 200 OK\r\n
    Date: Fri, 18 May 2018 09:15:16 GMT\r\n
    Content-Type: text/html; charset=GB2312\r\n
    Transfer-Encoding: chunked\r\n
    Connection: keep-alive\r\n
    Cache-Control: no-cache\r\n
    \r\n
    [HTTP response 1/1]
    [Time since request: 0.009117000 seconds]
    [Request in frame: 159]
    HTTP chunked response
Line-based text data: text/html

No.     Time               Source                Destination           Protocol Length Info
    198 09:15:26.778466    125.39.213.73         10.106.129.54         HTTP     234    HTTP/1.1 200 OK  (text/html)

Frame 198: 234 bytes on wire (1872 bits), 234 bytes captured (1872 bits) on interface 0
Ethernet II, Src: Hangzhou_75:c8:f5 (74:25:8a:75:c8:f5), Dst: AsustekC_34:f3:aa (9c:5c:8e:34:f3:aa)
Internet Protocol Version 4, Src: 125.39.213.73, Dst: 10.106.129.54
Transmission Control Protocol, Src Port: 80 (80), Dst Port: 20698 (20698), Seq: 1, Ack: 3365, Len: 180
Hypertext Transfer Protocol
    HTTP/1.1 200 OK\r\n
    Date: Fri, 18 May 2018 09:15:15 GMT\r\n
    Content-Type: text/html; charset=GB2312\r\n
    Transfer-Encoding: chunked\r\n
    Connection: keep-alive\r\n
    Cache-Control: no-cache\r\n
    \r\n
    [HTTP response 1/8]
    [Time since request: 0.008646000 seconds]
    [Request in frame: 165]
    [Next request in frame: 206]
    HTTP chunked response
Line-based text data: text/html

No.     Time               Source                Destination           Protocol Length Info
    206 09:15:26.787907    10.106.129.54         125.39.213.73         HTTP     565    GET /livemsg?o=392&adtype=KB&soid=+jbGb5AAWv8KIw0aHQA752esATga&r90=1&l=4018&refluence=4018&requestl=4018&tagid=0&pf=in&si=2047535882&ev=6.0.427.427&aver_flag=6148&traffic=&ip_filter=0&ufc_filter=63&ufc_stra=0&ufc_match=63&backfunnel=401&use_axp=0&axpheader=1&use_txp=0&txpheader=1&st_id_t=0&flow_reuse=1&ping_data=dXBfdmVyc2lvbj1WNi4wLjQyNy40Mjc=&vid=t065456rrrg&pf_ex=pc&live=0&channelId=1&page=coolOpen&aid_tpid=28&aid_tpid2=1150&aid_tpid3=11668&aid_dura=39&aid_vid_drm=0&aid_copyright=107&aid_vip_type=1&url=https://v.qq.com/tech&from=0&pf=in&v=3.5.52&dura=&coverid=&vptag=www_baidu_com|v_tech_new:img&oadid=4018&lcount=1&t=0&pf_ex=pc&tpid=28&chid=0 HTTP/1.1 

Frame 206: 565 bytes on wire (4520 bits), 565 bytes captured (4520 bits) on interface 0
Ethernet II, Src: AsustekC_34:f3:aa (9c:5c:8e:34:f3:aa), Dst: Hangzhou_75:c8:f5 (74:25:8a:75:c8:f5)
Internet Protocol Version 4, Src: 10.106.129.54, Dst: 125.39.213.73
Transmission Control Protocol, Src Port: 20698 (20698), Dst Port: 80 (80), Seq: 6245, Ack: 186, Len: 511
[3 Reassembled TCP Segments (3391 bytes): #204(1440), #205(1440), #206(511)]
Hypertext Transfer Protocol
     [truncated]GET /livemsg?o=392&adtype=KB&soid=+jbGb5AAWv8KIw0aHQA752esATga&r90=1&l=4018&refluence=4018&requestl=4018&tagid=0&pf=in&si=2047535882&ev=6.0.427.427&aver_flag=6148&traffic=&ip_filter=0&ufc_filter=63&ufc_stra=0&ufc_match=63&backf
    Host: livep.l.qq.com\r\n
    Connection: keep-alive\r\n
    User-Agent: Mozilla/5.0 (Windows NT 10.0; Win64; x64) AppleWebKit/537.36 (KHTML, like Gecko) Chrome/66.0.3359.139 Safari/537.36\r\n
    Accept: image/webp,image/apng,image/*,*/*;q=0.8\r\n
    Accept-Encoding: gzip, deflate\r\n
    Accept-Language: en-US,en;q=0.9,zh-TW;q=0.8,zh;q=0.7\r\n
     [truncated]Cookie: pgv_pvi=7659522048; pgv_si=s3813394432; RK=Olbs95KBUg; ptcz=2544f6f4ae92c346d1b59688e6f45a925ec0f9f8ef06a7a39332f6f8fe201348; _qpsvr_localtk=0.32806539237918764; tvfe_boss_uuid=3cdb9e54c3859a7f; appuser=3B22E15EAE54C942
    \r\n
    [Full request URI [truncated]: http://livep.l.qq.com/livemsg?o=392&adtype=KB&soid=+jbGb5AAWv8KIw0aHQA752esATga&r90=1&l=4018&refluence=4018&requestl=4018&tagid=0&pf=in&si=2047535882&ev=6.0.427.427&aver_flag=6148&traffic=&ip_filter=0&ufc_filt]
    [HTTP request 2/8]
    [Prev request in frame: 165]
    [Next request in frame: 4090]

No.     Time               Source                Destination           Protocol Length Info
    239 09:15:26.845516    10.106.129.54         61.149.22.9           HTTP     696    GET /t065456rrrg.p703.1.mp4?sdtfrom=v1105&guid=8cac8c1cdb2011882bd4fa2e4f586fc0&vkey=F0598E3B675022B5730FAA76FF8FBF533CE88ECE789123DE881E443E78FAC762FB81A42ECBB18FCE8494EFA6CC4AF7FE1AB54AA3E23EABE5682063E1C40D180ED6B4272271ED7C47860E3328B76AADBFF232EF00F2547EF9F12264BA5C44308B778D351CA8689E417632A78F1A5570C66AD96E8F04790092 HTTP/1.1 

Frame 239: 696 bytes on wire (5568 bits), 696 bytes captured (5568 bits) on interface 0
Ethernet II, Src: AsustekC_34:f3:aa (9c:5c:8e:34:f3:aa), Dst: Hangzhou_75:c8:f5 (74:25:8a:75:c8:f5)
Internet Protocol Version 4, Src: 10.106.129.54, Dst: 61.149.22.9
Transmission Control Protocol, Src Port: 20699 (20699), Dst Port: 80 (80), Seq: 1, Ack: 1, Len: 642
Hypertext Transfer Protocol
     [truncated]GET /t065456rrrg.p703.1.mp4?sdtfrom=v1105&guid=8cac8c1cdb2011882bd4fa2e4f586fc0&vkey=F0598E3B675022B5730FAA76FF8FBF533CE88ECE789123DE881E443E78FAC762FB81A42ECBB18FCE8494EFA6CC4AF7FE1AB54AA3E23EABE5682063E1C40D180ED6B4272271ED7C
    Host: ugcws.video.gtimg.com\r\n
    Connection: keep-alive\r\n
    Accept-Encoding: identity;q=1, *;q=0\r\n
    User-Agent: Mozilla/5.0 (Windows NT 10.0; Win64; x64) AppleWebKit/537.36 (KHTML, like Gecko) Chrome/66.0.3359.139 Safari/537.36\r\n
    Accept: */*\r\n
    Accept-Language: en-US,en;q=0.9,zh-TW;q=0.8,zh;q=0.7\r\n
    Range: bytes=0-\r\n
    \r\n
    [Full request URI [truncated]: http://ugcws.video.gtimg.com/t065456rrrg.p703.1.mp4?sdtfrom=v1105&guid=8cac8c1cdb2011882bd4fa2e4f586fc0&vkey=F0598E3B675022B5730FAA76FF8FBF533CE88ECE789123DE881E443E78FAC762FB81A42ECBB18FCE8494EFA6CC4AF7FE1AB5]
    [HTTP request 1/1]
    [Response in frame: 442]

No.     Time               Source                Destination           Protocol Length Info
    271 09:15:26.918562    10.106.129.54         123.125.9.39          HTTP     415    GET /qqvideo_ori/0/u0654c8mibm_228_128/0 HTTP/1.1 

Frame 271: 415 bytes on wire (3320 bits), 415 bytes captured (3320 bits) on interface 0
Ethernet II, Src: AsustekC_34:f3:aa (9c:5c:8e:34:f3:aa), Dst: Hangzhou_75:c8:f5 (74:25:8a:75:c8:f5)
Internet Protocol Version 4, Src: 10.106.129.54, Dst: 123.125.9.39
Transmission Control Protocol, Src Port: 20701 (20701), Dst Port: 80 (80), Seq: 1, Ack: 1, Len: 361
Hypertext Transfer Protocol
    GET /qqvideo_ori/0/u0654c8mibm_228_128/0 HTTP/1.1\r\n
    Host: puui.qpic.cn\r\n
    Connection: keep-alive\r\n
    User-Agent: Mozilla/5.0 (Windows NT 10.0; Win64; x64) AppleWebKit/537.36 (KHTML, like Gecko) Chrome/66.0.3359.139 Safari/537.36\r\n
    Accept: image/webp,image/apng,image/*,*/*;q=0.8\r\n
    Accept-Encoding: gzip, deflate\r\n
    Accept-Language: en-US,en;q=0.9,zh-TW;q=0.8,zh;q=0.7\r\n
    \r\n
    [Full request URI: http://puui.qpic.cn/qqvideo_ori/0/u0654c8mibm_228_128/0]
    [HTTP request 1/1]
    [Response in frame: 396]

No.     Time               Source                Destination           Protocol Length Info
    396 09:15:26.998966    123.125.9.39          10.106.129.54         TCP      74     [TCP segment of a reassembled PDU]

Frame 396: 74 bytes on wire (592 bits), 74 bytes captured (592 bits) on interface 0
Ethernet II, Src: Hangzhou_75:c8:f5 (74:25:8a:75:c8:f5), Dst: AsustekC_34:f3:aa (9c:5c:8e:34:f3:aa)
Internet Protocol Version 4, Src: 123.125.9.39, Dst: 10.106.129.54
Transmission Control Protocol, Src Port: 80 (80), Dst Port: 20701 (20701), Seq: 1, Ack: 362, Len: 1460

No.     Time               Source                Destination           Protocol Length Info
    442 09:15:27.619961    61.149.22.9           10.106.129.54         HTTP     750    HTTP/1.1 206 Partial Content 

Frame 442: 750 bytes on wire (6000 bits), 750 bytes captured (6000 bits) on interface 0
Ethernet II, Src: Hangzhou_75:c8:f5 (74:25:8a:75:c8:f5), Dst: AsustekC_34:f3:aa (9c:5c:8e:34:f3:aa)
Internet Protocol Version 4, Src: 61.149.22.9, Dst: 10.106.129.54
Transmission Control Protocol, Src Port: 80 (80), Dst Port: 20699 (20699), Seq: 1, Ack: 643, Len: 696
Hypertext Transfer Protocol
    HTTP/1.1 206 Partial Content\r\n
    Date: Fri, 18 May 2018 09:15:16 GMT\r\n
    Last-Modified: Tue, 15 May 2018 09:05:31 GMT\r\n
    Cache-Control: max-age=7200\r\n
    E-tag: c160dc274eb911d8f35a6c53ef8bec6e4226a321\r\n
    Accept-Ranges: bytes\r\n
    X-ServerIp: 223.167.152.104\r\n
    XCall-Server: vochttp_0x00102030\r\n
    Client-Ip: 124.132.144.86\r\n
    Content-Type: video/mp4\r\n
    Access-Control-Allow-Origin: *\r\n
    Access-Control-Expose-Headers: Content-Length,Content-Range\r\n
    Content-Range: bytes 0-1375622/1375623\r\n
    Content-Length: 1375623\r\n
    X-Via: 1.1 PSsdzzwt2hu86:9 (Cdn Cache Server V2.0)[736 200 2], 1.1 PSbjlgwthm77:5 (Cdn Cache Server V2.0)[771 200 2]\r\n
    X-Ws-Request-Id: 5afe99a4_PSbjlgwtuc75_23468-41602\r\n
    Connection: keep-alive\r\n
    cache: state\r\n
    \r\n
    [HTTP response 1/1]
    [Time since request: 0.774445000 seconds]
    [Request in frame: 239]

No.     Time               Source                Destination           Protocol Length Info
    536 09:15:27.676167    61.149.22.9           10.106.129.54         HTTP     74     Continuation

Frame 536: 74 bytes on wire (592 bits), 74 bytes captured (592 bits) on interface 0
Ethernet II, Src: Hangzhou_75:c8:f5 (74:25:8a:75:c8:f5), Dst: AsustekC_34:f3:aa (9c:5c:8e:34:f3:aa)
Internet Protocol Version 4, Src: 61.149.22.9, Dst: 10.106.129.54
Transmission Control Protocol, Src Port: 80 (80), Dst Port: 20699 (20699), Seq: 53621, Ack: 643, Len: 1460
Hypertext Transfer Protocol
     [truncated]:\211<\274\016\bt\356\305\001\000w\374\205\344n\240_p\275\341\0372\312\332,b{pc\213)\036w\226\303\017\355\234\256\373U\270\t\004\313\356\213\350?\331\364\352b\371\344H?\201s\020$\367\005p\261\v>)\346\374\2367o\304 %\354\307\323
    Data (1354 bytes)

0000  c1 f5 30 d3 0a b0 54 d3 c9 99 90 5b 3b d6 15 4a   ..0...T....[;..J
0010  4e 22 51 9c a4 e2 35 93 5a ab a1 8b 09 aa cd ce   N"Q...5.Z.......
0020  13 57 06 46 44 15 72 8f 3e 49 a8 b2 bc b7 00 25   .W.FD.r.>I.....%
0030  25 f3 c3 2b b7 1c 4c 99 d6 1b 88 df af e3 ea 83   %..+..L.........
0040  29 31 6b cb 41 7c b6 82 df 7a e0 d6 25 de 48 04   )1k.A|...z..%.H.
0050  b4 f5 1f 0e da 97 0f 07 c5 13 17 7c ee e9 6d 00   ...........|..m.
0060  e9 30 b3 94 74 8c 10 82 b5 57 64 ad 74 73 c7 e8   .0..t....Wd.ts..
0070  d8 a8 a6 85 99 d8 0e 29 b7 e2 20 5d 14 a5 9c 5c   .......).. ]...\
0080  28 d1 e0 6a f0 13 65 5e d2 72 da 92 32 b4 b9 04   (..j..e^.r..2...
0090  6a 3c bb 55 b8 f7 4d ae 39 21 dd 52 0c 5c ab 5d   j<.U..M.9!.R.\.]
00a0  9c cd f0 55 af 83 3b 7f ab 59 e0 01 07 6f f7 21   ...U..;..Y...o.!
00b0  e1 78 a8 86 bc 0e ba e3 6f 52 f9 64 40 f7 08 f2   .x......oR.d@...
00c0  67 67 32 eb e9 d3 00 d9 85 47 0d 64 3f f1 4b 76   gg2......G.d?.Kv
00d0  64 0a d3 0e c1 f6 68 05 91 a0 05 17 a8 20 71 27   d.....h...... q'
00e0  12 c9 c6 72 e7 b9 8d 49 71 3e 6a 1f 2f c8 70 ad   ...r...Iq>j./.p.
00f0  17 f9 2e 9d 46 ec d0 e5 f2 1b cf b6 09 66 b4 cb   ....F........f..
0100  ed 96 6b 22 df 3e 0f 13 73 d3 15 ac 54 10 28 cf   ..k".>..s...T.(.
0110  e7 0d 74 83 71 17 27 29 0e f0 30 e5 9e ac 89 df   ..t.q.')..0.....
0120  2c 9a cf 2e 10 80 7d 4a ed 24 14 00 ff 4f c8 1c   ,.....}J.$...O..
0130  b9 38 37 4b 26 06 54 77 58 04 de 69 cd 1c fb 88   .87K&.TwX..i....
0140  34 3f c7 68 1a 9f 92 44 27 18 0a e4 cd ac 63 1c   4?.h...D'.....c.
0150  cb bb a7 de 8a d0 e6 20 50 ca 69 ea 30 e2 8f 4f   ....... P.i.0..O
0160  54 21 6c bc 39 69 42 4d 7b 5e b0 c8 07 0a 01 ac   T!l.9iBM{^......
0170  02 e5 d4 c3 4f 5a 98 fe cb e9 b9 58 38 23 c0 00   ....OZ.....X8#..
0180  00 00 2d 01 9e 4b 35 26 b7 b5 e1 89 3f 85 b8 f7   ..-..K5&....?...
0190  68 4d 70 2d e5 70 ec 31 69 c2 09 ec 70 96 f6 97   hMp-.p.1i...p...
01a0  d6 82 db 14 eb 46 e0 61 3f f8 5f 9a 63 f2 be df   .....F.a?._.c...
01b0  00 00 15 9e 41 9a 4e a4 f0 85 29 32 98 17 6f a7   ....A.N...)2..o.
01c0  65 85 0e dd fc 00 83 bb 66 22 43 a6 56 67 07 a8   e.......f"C.Vg..
01d0  b9 b8 fa ab 50 7e de fc b9 be a1 7e 0e c5 c9 cc   ....P~.....~....
01e0  f4 57 d7 ab 0b 96 e7 94 98 bd b4 4a d1 d2 97 53   .W.........J...S
01f0  86 74 fc b1 6b 84 e6 85 67 ff 8a 48 1a 0a 22 a0   .t..k...g..H..".
0200  f7 5d 61 5d 6a a0 00 11 53 b2 61 8e 5f f8 7e fb   .]a]j...S.a._.~.
0210  1c 43 34 c7 e7 79 e6 ae 7b bd 19 ea 3a 76 3d e7   .C4..y..{...:v=.
0220  d1 3e e7 be e8 74 54 b5 7a e7 0d 06 e8 2b b3 12   .>...tT.z....+..
0230  f9 9e 53 99 b1 61 78 8f 2e 46 9d d4 d8 a5 53 03   ..S..ax..F....S.
0240  9d a1 f5 97 2c c2 f2 4f fa 0e 6a 25 db 5f fc 07   ....,..O..j%._..
0250  6d 74 82 bd 37 39 db 7b 97 bc f7 db 04 17 58 33   mt..79.{......X3
0260  4a 49 37 6b 5c a9 75 b1 34 99 d7 63 c9 53 01 68   JI7k\.u.4..c.S.h
0270  48 16 d3 73 cd 63 d7 63 8f 08 01 6e bb 62 2a c8   H..s.c.c...n.b*.
0280  17 7e 31 85 49 97 96 6a de 2b a5 3d 09 b1 68 b0   .~1.I..j.+.=..h.
0290  98 bc 12 b7 9c 4b 8c d3 14 3c fa 63 c5 a1 a2 8a   .....K...<.c....
02a0  97 ff fb 0b 5f 3e 47 a4 89 6e 9e 37 2d 7f 2a 40   ...._>G..n.7-.*@
02b0  f7 7a d0 2d 91 f3 d0 91 ee a5 d3 39 cf 88 17 4e   .z.-.......9...N
02c0  74 82 65 d8 82 89 80 9f 83 1f 53 0c 4e 0c e4 9c   t.e.......S.N...
02d0  0b a7 14 e5 18 c7 81 aa b1 4a 58 79 b7 33 6e 79   .........JXy.3ny
02e0  a9 70 ee c2 18 0c d2 c7 16 c3 3e c3 b6 a1 40 3f   .p........>...@?
02f0  6a 8f 7c 20 81 81 62 12 c1 73 c1 ae f8 bf 6c 28   j.| ..b..s....l(
0300  55 22 d0 25 5e c7 72 b0 65 79 ca 79 50 e0 e4 03   U".%^.r.ey.yP...
0310  d0 77 ec 6a 65 16 7b da fe 62 56 a4 26 0d 78 e0   .w.je.{..bV.&.x.
0320  0d d9 6f 93 f7 14 0a e7 32 b6 e3 c2 68 ec 0c ff   ..o.....2...h...
0330  44 26 97 11 59 bd c4 ed 21 c3 a9 c9 49 c8 02 7c   D&..Y...!...I..|
0340  c2 ba 33 18 fe 2d 77 5f 0a 3f a7 da 00 f6 82 b3   ..3..-w_.?......
0350  a2 14 22 fc f5 30 4b fe 3f 5b d6 4a 32 8e 58 2c   .."..0K.?[.J2.X,
0360  91 ea cc 62 81 85 e8 e5 e2 ca 4c 64 a1 9f 4a 35   ...b......Ld..J5
0370  c5 3e 34 7d 6d a2 95 6e 42 b7 48 a9 05 a3 99 02   .>4}m..nB.H.....
0380  63 6c e2 d8 b7 49 36 a9 09 fc 3a 2b 4d e2 48 f6   cl...I6...:+M.H.
0390  2c 12 44 30 b3 7b d1 02 01 ae 3c 15 60 9a a6 38   ,.D0.{....<.`..8
03a0  74 f1 f4 81 5f ae fb 4e 72 42 84 66 46 e3 52 8d   t..._..NrB.fF.R.
03b0  cb 12 ab ee f5 2d 3a e9 ea 34 74 97 2d 32 e0 38   .....-:..4t.-2.8
03c0  87 bb e9 6a 5a 51 a3 0a 2c 98 73 3f 99 79 1c f4   ...jZQ..,.s?.y..
03d0  9f ea 44 fc 98 c3 9f 50 58 2a 91 f6 32 01 d5 47   ..D....PX*..2..G
03e0  34 95 1d cf 5f e1 67 a2 99 93 b1 48 80 9c 2c b0   4..._.g....H..,.
03f0  cf 69 2b af 4d 91 39 d5 30 f2 6f d1 c7 cb e4 47   .i+.M.9.0.o....G
0400  3c aa d7 29 13 c0 0a 11 b9 6b 96 36 73 bb 2b f5   <..).....k.6s.+.
0410  ea 57 a9 d4 11 bb 30 45 68 98 fa a5 82 f1 3b 95   .W....0Eh.....;.
0420  78 e2 48 91 fd be 71 6e e5 48 fb 41 b0 5d e9 5a   x.H...qn.H.A.].Z
0430  67 f7 a2 54 31 8c e7 45 94 10 b8 ea 5e 0e 2a 59   g..T1..E....^.*Y
0440  c3 fe 2d 0d b3 e4 4f 20 d5 a1 59 1a 99 01 c3 b8   ..-...O ..Y.....
0450  29 78 8b 10 f4 7c a4 c7 21 60 e3 4a 92 cf 98 b9   )x...|..!`.J....
0460  b7 6b d8 17 40 65 79 6e ae 0c 55 f3 7e 5e 3a 45   .k..@eyn..U.~^:E
0470  b6 ae 7e d3 fd b3 0c 65 1a 57 02 40 bd d8 40 13   ..~....e.W.@..@.
0480  14 db b6 02 af 53 fc 2c c0 ed 7b 6d 42 ce 2d 57   .....S.,..{mB.-W
0490  93 ca 4d 60 01 78 ac f8 a9 0e c7 d8 d5 4c 7f b3   ..M`.x.......L..
04a0  ff 3c 57 4b b2 3f 80 25 f9 0b 93 74 7a 38 b4 93   .<WK.?.%...tz8..
04b0  a7 a3 8f 5f 72 05 7f 26 be a9 46 6a d8 d8 14 7b   ..._r..&..Fj...{
04c0  6a 89 0c 22 45 78 da 13 b5 eb 00 fc d7 0d 6a dc   j.."Ex........j.
04d0  66 e4 cd a6 0d 8f 8e 11 c5 8b b1 d5 da 76 4b 8f   f............vK.
04e0  18 3e 7f b1 c4 88 59 40 1f 96 28 f7 82 dd 7a 9e   .>....Y@..(...z.
04f0  36 e9 05 1f 5e 09 b2 c9 d9 71 69 1e 03 27 6d 64   6...^....qi..'md
0500  1a 10 1a 5e ec 47 6c 17 86 5f 7d 13 6f 5a 86 86   ...^.Gl.._}.oZ..
0510  f2 e0 98 a0 2a 7c e1 f7 b4 72 1e f7 74 2f 7a de   ....*|...r..t/z.
0520  39 d4 76 56 c3 4f 40 e9 f9 3e b8 58 3a 5f 43 35   9.vV.O@..>.X:_C5
0530  51 90 6f 98 d5 e3 14 1c 27 b9 1b 3f c6 69 9e 40   Q.o.....'..?.i.@
0540  a2 c6 85 40 97 7e 94 98 54 be                     ...@.~..T.

No.     Time               Source                Destination           Protocol Length Info
   1783 09:15:27.909193    61.149.22.9           10.106.129.54         HTTP     74     Continuation

Frame 1783: 74 bytes on wire (592 bits), 74 bytes captured (592 bits) on interface 0
Ethernet II, Src: Hangzhou_75:c8:f5 (74:25:8a:75:c8:f5), Dst: AsustekC_34:f3:aa (9c:5c:8e:34:f3:aa)
Internet Protocol Version 4, Src: 61.149.22.9, Dst: 10.106.129.54
Transmission Control Protocol, Src Port: 80 (80), Dst Port: 20699 (20699), Seq: 721189, Ack: 643, Len: 1460
Hypertext Transfer Protocol
     [truncated]:J\222'1\202\037\033X\t\034\213\365\240bf\202%w\004"s\256\fX\250\357\354)[\234\326\240\254(\211\217Ak,\252|\246dr\222\275J#\354e^t\260\021\362\275\200{\232A\375\331\303\223kS'\262\342\034U\331\264\323\273/\314=\377;k\351\217*\3
    Data (1369 bytes)

0000  37 2a 9c 5f 84 34 3a 00 aa a1 81 a5 42 bd 42 e2   7*._.4:.....B.B.
0010  b8 6b a0 4f d4 47 3e b6 9e 7b db c5 40 b6 b0 05   .k.O.G>..{..@...
0020  6d f5 9f a8 e5 24 fd b9 3f f6 5f c2 53 1a bc bd   m....$..?._.S...
0030  65 37 c8 c8 35 bd 0c e9 7b cf 59 93 aa cd 83 57   e7..5...{.Y....W
0040  ec c9 27 68 af c5 be af b4 c9 8a 4d 1b 52 9e e4   ..'h.......M.R..
0050  80 97 ee 83 d5 3d 71 55 78 7a e6 48 10 0b db 5a   .....=qUxz.H...Z
0060  ce 78 6e 5d c3 4a ef da 2e 7f 03 16 a0 18 29 55   .xn].J........)U
0070  7e f8 93 f6 da e5 bd 36 df 61 fd f1 18 af 2f b8   ~......6.a..../.
0080  fa 73 94 af c5 08 42 8e 2d 78 9a 2e 0b fb a9 43   .s....B.-x.....C
0090  93 de de b1 1c 2c f0 98 cf 08 4a 92 31 d4 6a a1   .....,....J.1.j.
00a0  12 14 f5 43 f8 5a d9 6f 83 7b 79 f5 4d 9c 07 38   ...C.Z.o.{y.M..8
00b0  9c 2f f4 02 62 79 b4 dd 19 27 64 9c ab a3 0f 0c   ./..by...'d.....
00c0  a0 6b 64 58 97 1f ae fa 42 22 94 1a 44 36 06 09   .kdX....B"..D6..
00d0  35 0a 71 e9 19 c5 49 a6 21 99 0c b8 dc 84 5f a0   5.q...I.!....._.
00e0  9e 83 0b 74 00 99 84 b9 69 28 cd 7d 42 ec 74 dc   ...t....i(.}B.t.
00f0  05 32 41 2e 39 e7 23 0e 55 4d 1b 81 83 81 72 32   .2A.9.#.UM....r2
0100  bf e7 ce f7 5c 44 09 46 ef 1f ee 98 a7 64 c4 67   ....\D.F.....d.g
0110  93 4b 75 b1 7c 42 90 5f ee 2c da 14 1e 52 fc 59   .Ku.|B._.,...R.Y
0120  c9 72 a1 f9 ee 34 8c ff c5 e6 62 a1 75 91 a8 02   .r...4....b.u...
0130  6a 95 1a a9 21 d9 2f 54 e1 d4 9a 0c af 7f 0f bc   j...!./T........
0140  9e b3 4a eb 1a 95 b9 17 7d 50 bc 31 ba 08 85 e0   ..J.....}P.1....
0150  6c 1f 42 30 74 5d d8 cd 50 9e f5 b7 cf 8c f8 22   l.B0t]..P......"
0160  2c 6d 1e 93 a3 7d 13 bd a0 67 c1 14 72 ff bd 21   ,m...}...g..r..!
0170  30 93 bd b2 6f 93 f2 9a f2 38 6d 97 f1 92 10 b9   0...o....8m.....
0180  78 36 f6 26 45 b6 da 0e 96 ec 49 48 cb b6 2e 59   x6.&E.....IH...Y
0190  e7 30 8b 4c 06 0d 99 c4 ac 89 ae c9 88 e4 36 7e   .0.L..........6~
01a0  6d a7 6d 89 1a bc 08 d6 5b 6d 6c 12 e8 d1 50 dc   m.m.....[ml...P.
01b0  9c c2 74 90 28 a5 1c 45 1b 14 8e 0c 5a aa 80 07   ..t.(..E....Z...
01c0  3b db 02 6b 8c ab 9b 94 fe cf de 6e 38 3b 91 5f   ;..k.......n8;._
01d0  bf 49 23 1d 9b 73 59 01 7c e7 04 a6 d6 ee 1b 47   .I#..sY.|......G
01e0  8e 04 55 26 3d 70 34 8f 01 d6 30 39 7a 4c 15 1b   ..U&=p4...09zL..
01f0  64 45 7e d0 b9 b3 1f 44 13 0f 85 9a 7f 4c 5c ed   dE~....D.....L\.
0200  c3 6f 8e 71 fb 07 52 d9 eb 39 e8 d5 11 68 48 bb   .o.q..R..9...hH.
0210  e9 e7 41 a4 f6 09 6f 7a dc 5b 27 34 2c 70 41 11   ..A...oz.['4,pA.
0220  e3 b1 70 5e d4 a7 a3 5d b4 b5 7f c8 7c 02 fe 5c   ..p^...]....|..\
0230  8a 5e ee ff 81 8a 4d 43 f5 9f 44 d8 9d de 4e e5   .^....MC..D...N.
0240  39 ad a3 98 2c d2 36 cb d1 b4 57 17 c2 02 f5 fe   9...,.6...W.....
0250  c6 1f bc 0e 44 33 f7 d1 bf 46 5e ed c9 59 7c 96   ....D3...F^..Y|.
0260  a7 95 34 8b 4f df 31 2b f1 3a 42 e6 73 41 7c 93   ..4.O.1+.:B.sA|.
0270  15 38 b8 48 ec 56 79 5b 28 56 26 dc 49 e0 b4 3a   .8.H.Vy[(V&.I..:
0280  4e f8 be 85 96 e0 aa 04 3a 4c 7c ab 28 7f 77 18   N.......:L|.(.w.
0290  d3 f7 fe 88 29 ae cd 59 f3 9c 50 cb 86 de 1c 55   ....)..Y..P....U
02a0  0d 73 76 0f 94 59 30 48 e7 46 bd 9e 11 5e 73 d2   .sv..Y0H.F...^s.
02b0  53 95 67 18 5d 0d 36 2c 1c de 45 8f 63 a6 86 1f   S.g.].6,..E.c...
02c0  40 46 67 a9 50 72 1d a3 93 d8 37 cd ba 3a c8 c9   @Fg.Pr....7..:..
02d0  30 f9 fb b1 c2 7a 2f 7d 79 13 9b b8 a9 13 7a 0c   0....z/}y.....z.
02e0  46 4e 4b 1b 71 c9 d3 25 35 48 28 99 99 fd f6 a1   FNK.q..%5H(.....
02f0  23 57 6d e1 1c ea 86 ea 66 52 61 3b 30 b1 b6 c8   #Wm.....fRa;0...
0300  81 1d 59 1e 9c 4f f4 ba 36 2f c3 09 b6 67 81 5e   ..Y..O..6/...g.^
0310  02 fa c7 56 02 5b 75 a8 c9 24 83 0d 99 c1 9d dd   ...V.[u..$......
0320  ea 13 2b 92 2f 13 f4 e7 f5 9a 40 cc 4a 24 9e fc   ..+./.....@.J$..
0330  a0 d3 95 6f e5 6d f4 50 95 b1 8a da f5 08 07 92   ...o.m.P........
0340  e1 cb b9 7d c2 d0 a2 dc c8 44 8c 79 54 3b 65 cc   ...}.....D.yT;e.
0350  77 a4 1a b4 21 b7 ec 89 aa e2 f1 3d a6 fa 12 ba   w...!......=....
0360  f9 e0 33 58 3d b1 96 ce 82 1a d7 3b 66 a0 51 1b   ..3X=......;f.Q.
0370  d8 75 b6 d3 87 a8 19 39 ad fb ff 4e dd 10 a8 e6   .u.....9...N....
0380  e2 7d 8b 27 8f 71 f6 13 ee 97 bc b6 db 35 73 c6   .}.'.q.......5s.
0390  15 9d 47 cf 72 28 2d 52 07 a7 a8 68 a1 eb e1 9b   ..G.r(-R...h....
03a0  ec 1f 2e 27 99 65 64 fb f8 b2 3f ab 66 1f 77 f5   ...'.ed...?.f.w.
03b0  8b 3f c9 44 48 e8 75 f1 1b 32 7a 25 34 60 21 59   .?.DH.u..2z%4`!Y
03c0  63 e0 27 62 bb de ed 30 9d 82 cf d7 70 6f ee 20   c.'b...0....po. 
03d0  cc 5e 11 33 23 59 0c 37 d7 76 7c 3b 03 af 74 1b   .^.3#Y.7.v|;..t.
03e0  c6 e2 4c 03 c6 e2 68 c0 2e 80 d1 38 44 45 26 c3   ..L...h....8DE&.
03f0  66 73 8e 36 ce df c5 1a 4b 9d f0 af a4 b0 75 9d   fs.6....K.....u.
0400  96 d5 23 af d6 52 f5 1c 7c 1c 40 b5 3b bc 23 45   ..#..R..|.@.;.#E
0410  fa 2a 33 1d 17 51 34 fc 18 0a 04 ec ab 1e d5 4b   .*3..Q4........K
0420  b2 5c 7a db 8f 7a f4 d9 8f 30 60 f8 af 82 ee a1   .\z..z...0`.....
0430  c3 86 f6 7d 0e 3b 79 f8 23 4f 0f d4 fe f8 87 7b   ...}.;y.#O.....{
0440  8a 06 2f 6d 8e a7 26 7b fc f7 d5 a2 15 9d 97 16   ../m..&{........
0450  36 44 0e d1 5c 1b 6e 09 17 33 93 aa b7 18 bc 18   6D..\.n..3......
0460  93 d4 17 36 af d4 07 5c 04 bb 08 19 42 43 c3 0d   ...6...\....BC..
0470  3c 52 81 55 35 c3 c3 b2 fb 9e 47 07 12 4e de 91   <R.U5.....G..N..
0480  70 99 b8 75 ec f8 04 db 7e 6c 6b 0c d8 c1 f6 0f   p..u....~lk.....
0490  bb 09 f8 e1 88 86 28 43 02 35 ce d0 f6 e4 d1 3d   ......(C.5.....=
04a0  5f fb 30 3c 64 60 5a e9 ef c1 12 25 15 9b fd 56   _.0<d`Z....%...V
04b0  a7 84 f9 01 80 b6 c3 34 df e6 4c 90 ab 73 2d 59   .......4..L..s-Y
04c0  af 0c e8 59 d2 39 68 8d de dd 34 b3 79 d3 0e 93   ...Y.9h...4.y...
04d0  df fc 94 dd d3 93 a0 2f 82 5f ef d8 4e 3f d5 df   ......./._..N?..
04e0  b8 4f 8c 55 3d 00 3c b9 74 f9 2d 58 91 f7 04 59   .O.U=.<.t.-X...Y
04f0  f3 6b 33 c4 fb 93 88 27 41 58 20 11 52 d6 22 fc   .k3....'AX .R.".
0500  13 2f d1 4d 94 23 f0 7c bc 51 ea 48 3c 68 7a 68   ./.M.#.|.Q.H<hzh
0510  3d d6 46 90 f9 52 8d 41 a8 18 a0 02 88 ba 1b 9e   =.F..R.A........
