No.     Time               Source                Destination           Protocol Length Info
     14 01:58:55.878300    10.106.129.54         10.106.128.55         SSDP     480    HTTP/1.1 200 OK 

Frame 14: 480 bytes on wire (3840 bits), 480 bytes captured (3840 bits) on interface 0
Ethernet II, Src: AsustekC_34:f3:aa (9c:5c:8e:34:f3:aa), Dst: LcfcHefe_dd:cc:e7 (28:d2:44:dd:cc:e7)
Internet Protocol Version 4, Src: 10.106.129.54, Dst: 10.106.128.55
User Datagram Protocol, Src Port: 1900 (1900), Dst Port: 63911 (63911)
Hypertext Transfer Protocol
    HTTP/1.1 200 OK\r\n
    ST: upnp:rootdevice\r\n
    USN: uuid:3ced1185-a624-4fc1-be23-ce28fc76a1b5::upnp:rootdevice\r\n
    Location: http://10.106.129.54:2869/upnphost/udhisapi.dll?content=uuid:3ced1185-a624-4fc1-be23-ce28fc76a1b5\r\n
    OPT:"http://schemas.upnp.org/upnp/1/0/"; ns=01\r\n
    01-NLS: 3fca7df4a9594a241129c800108660dc\r\n
    Cache-Control: max-age=900\r\n
    Server: Microsoft-Windows/10.0 UPnP/1.0 UPnP-Device-Host/1.0\r\n
    Ext: \r\n
    Date: Thu, 13 Jul 2017 00:46:04 GMT\r\n
    \r\n
    [HTTP response 1/246]
    [Next response in frame: 390]

No.     Time               Source                Destination           Protocol Length Info
    132 01:58:57.967215    10.106.129.54         220.181.61.173        HTTP     1139   GET /lm.gif?fuid=14879437015831626650&refer=https%3A//www.baidu.com/link%3Furl%3D1Fy-uJmNYdS3izYAC3SaX-VH2LTXsmqpupJlhox2sVu%26wd%3D%26eqid%3D96fc21eb00055e56000000035966d3b8&vid=&sid=&curl=http://tv.sohu.com/s2015/newslist/?vid=3887740&txid=tv_focus_13_4 HTTP/1.1 

Frame 132: 1139 bytes on wire (9112 bits), 1139 bytes captured (9112 bits) on interface 0
Ethernet II, Src: AsustekC_34:f3:aa (9c:5c:8e:34:f3:aa), Dst: Hangzhou_75:c8:f5 (74:25:8a:75:c8:f5)
Internet Protocol Version 4, Src: 10.106.129.54, Dst: 220.181.61.173
Transmission Control Protocol, Src Port: 41946 (41946), Dst Port: 80 (80), Seq: 1, Ack: 1, Len: 1085
Hypertext Transfer Protocol
     [truncated]GET /lm.gif?fuid=14879437015831626650&refer=https%3A//www.baidu.com/link%3Furl%3D1Fy-uJmNYdS3izYAC3SaX-VH2LTXsmqpupJlhox2sVu%26wd%3D%26eqid%3D96fc21eb00055e56000000035966d3b8&vid=&sid=&curl=http://tv.sohu.com/s2015/newslist/?vi
    Host: pv.hd.sohu.com\r\n
    Connection: keep-alive\r\n
    User-Agent: Mozilla/5.0 (Windows NT 10.0; Win64; x64) AppleWebKit/537.36 (KHTML, like Gecko) Chrome/59.0.3071.115 Safari/537.36\r\n
    Accept: image/webp,image/apng,image/*,*/*;q=0.8\r\n
    Referer: http://tv.sohu.com/\r\n
    Accept-Encoding: gzip, deflate\r\n
    Accept-Language: en-US,en;q=0.8,zh-TW;q=0.6,zh;q=0.4\r\n
     [truncated]Cookie: beans_dmp=%7B%22admaster%22%3A1499855777%2C%22shunfei%22%3A1499855777%2C%22reachmax%22%3A1499855777%2C%22lingji%22%3A1499855777%2C%22yoyi%22%3A1499855777%2C%22ipinyou%22%3A1499855777%2C%22ipinyou_admaster%22%3A149985577
    \r\n
    [Full request URI [truncated]: http://pv.hd.sohu.com/lm.gif?fuid=14879437015831626650&refer=https%3A//www.baidu.com/link%3Furl%3D1Fy-uJmNYdS3izYAC3SaX-VH2LTXsmqpupJlhox2sVu%26wd%3D%26eqid%3D96fc21eb00055e56000000035966d3b8&vid=&sid=&curl=ht]
    [HTTP request 1/1]
    [Response in frame: 135]

No.     Time               Source                Destination           Protocol Length Info
    135 01:58:57.972768    220.181.61.173        10.106.129.54         HTTP     354    HTTP/1.1 200 OK 

Frame 135: 354 bytes on wire (2832 bits), 354 bytes captured (2832 bits) on interface 0
Ethernet II, Src: Hangzhou_75:c8:f5 (74:25:8a:75:c8:f5), Dst: AsustekC_34:f3:aa (9c:5c:8e:34:f3:aa)
Internet Protocol Version 4, Src: 220.181.61.173, Dst: 10.106.129.54
Transmission Control Protocol, Src Port: 80 (80), Dst Port: 41946 (41946), Seq: 1, Ack: 1086, Len: 300
Hypertext Transfer Protocol
    HTTP/1.1 200 OK\r\n
    Server: nginx/SohuTv-N2162\r\n
    Date: Thu, 13 Jul 2017 01:58:54 GMT\r\n
    Content-Type: image/gif\r\n
    Content-Length: 0\r\n
    Last-Modified: Wed, 04 Sep 2013 07:45:09 GMT\r\n
    Connection: close\r\n
    ETag: "5226e505-0"\r\n
    Expires: Thu, 13 Jul 2017 01:58:53 GMT\r\n
    Cache-Control: no-cache\r\n
    Accept-Ranges: bytes\r\n
    \r\n
    [HTTP response 1/1]
    [Time since request: 0.005553000 seconds]
    [Request in frame: 132]

No.     Time               Source                Destination           Protocol Length Info
    151 01:58:57.999516    10.106.129.54         118.244.253.68        HTTP     122    GET /s2015/newslist/?vid=3887740 HTTP/1.1 

Frame 151: 122 bytes on wire (976 bits), 122 bytes captured (976 bits) on interface 0
Ethernet II, Src: AsustekC_34:f3:aa (9c:5c:8e:34:f3:aa), Dst: Hangzhou_75:c8:f5 (74:25:8a:75:c8:f5)
Internet Protocol Version 4, Src: 10.106.129.54, Dst: 118.244.253.68
Transmission Control Protocol, Src Port: 41947 (41947), Dst Port: 80 (80), Seq: 1461, Ack: 1, Len: 68
[2 Reassembled TCP Segments (1528 bytes): #150(1460), #151(68)]
Hypertext Transfer Protocol
    GET /s2015/newslist/?vid=3887740 HTTP/1.1\r\n
    Host: tv.sohu.com\r\n
    Connection: keep-alive\r\n
    Upgrade-Insecure-Requests: 1\r\n
    User-Agent: Mozilla/5.0 (Windows NT 10.0; Win64; x64) AppleWebKit/537.36 (KHTML, like Gecko) Chrome/59.0.3071.115 Safari/537.36\r\n
    Accept: text/html,application/xhtml+xml,application/xml;q=0.9,image/webp,image/apng,*/*;q=0.8\r\n
    Referer: http://tv.sohu.com/\r\n
    Accept-Encoding: gzip, deflate\r\n
    Accept-Language: en-US,en;q=0.8,zh-TW;q=0.6,zh;q=0.4\r\n
     [truncated]Cookie: beans_dmp=%7B%22admaster%22%3A1499855777%2C%22shunfei%22%3A1499855777%2C%22reachmax%22%3A1499855777%2C%22lingji%22%3A1499855777%2C%22yoyi%22%3A1499855777%2C%22ipinyou%22%3A1499855777%2C%22ipinyou_admaster%22%3A149985577
    \r\n
    [Full request URI: http://tv.sohu.com/s2015/newslist/?vid=3887740]
    [HTTP request 1/3]
    [Response in frame: 162]
    [Next request in frame: 249]

No.     Time               Source                Destination           Protocol Length Info
    162 01:58:58.024335    118.244.253.68        10.106.129.54         HTTP     1514   HTTP/1.1 200 OK  (text/html)

Frame 162: 1514 bytes on wire (12112 bits), 1514 bytes captured (12112 bits) on interface 0
Ethernet II, Src: Hangzhou_75:c8:f5 (74:25:8a:75:c8:f5), Dst: AsustekC_34:f3:aa (9c:5c:8e:34:f3:aa)
Internet Protocol Version 4, Src: 118.244.253.68, Dst: 10.106.129.54
Transmission Control Protocol, Src Port: 80 (80), Dst Port: 41947 (41947), Seq: 1, Ack: 1529, Len: 1460
Hypertext Transfer Protocol
    HTTP/1.1 200 OK\r\n
    Content-Type: text/html\r\n
    Content-Length: 9274\r\n
    Connection: keep-alive\r\n
    Date: Thu, 13 Jul 2017 01:58:55 GMT\r\n
    Server: SWS\r\n
    Vary: Accept-Encoding\r\n
    Cache-Control: no-transform, max-age=120\r\n
    Expires: Thu, 13 Jul 2017 02:00:55 GMT\r\n
    Last-Modified: Thu, 13 Jul 2017 01:49:16 GMT\r\n
    Content-Encoding: gzip\r\n
    X-RS: 10587158.19762208.11340962\r\n
    FSS-Cache: EXPIRED from 8736951.15814849.9736739\r\n
    FSS-Proxy: Powered by 2969695.4280425.3969395\r\n
    \r\n
    [HTTP response 1/3]
    [Time since request: 0.024819000 seconds]
    [Request in frame: 151]
    [Next request in frame: 249]
    [Next response in frame: 252]
    Content-encoded entity body (gzip): 1014 bytes -> 2336 bytes
Line-based text data: text/html

No.     Time               Source                Destination           Protocol Length Info
    180 01:58:58.045293    10.106.129.54         118.244.253.68        HTTP     892    GET /sohuflash_1.js HTTP/1.1 

Frame 180: 892 bytes on wire (7136 bits), 892 bytes captured (7136 bits) on interface 0
Ethernet II, Src: AsustekC_34:f3:aa (9c:5c:8e:34:f3:aa), Dst: Hangzhou_75:c8:f5 (74:25:8a:75:c8:f5)
Internet Protocol Version 4, Src: 10.106.129.54, Dst: 118.244.253.68
Transmission Control Protocol, Src Port: 41948 (41948), Dst Port: 80 (80), Seq: 1, Ack: 1, Len: 838
Hypertext Transfer Protocol
    GET /sohuflash_1.js HTTP/1.1\r\n
    Host: www.sohu.com\r\n
    Connection: keep-alive\r\n
    User-Agent: Mozilla/5.0 (Windows NT 10.0; Win64; x64) AppleWebKit/537.36 (KHTML, like Gecko) Chrome/59.0.3071.115 Safari/537.36\r\n
    Accept: */*\r\n
    Referer: http://tv.sohu.com/s2015/newslist/?vid=3887740\r\n
    Accept-Encoding: gzip, deflate\r\n
    Accept-Language: en-US,en;q=0.8,zh-TW;q=0.6,zh;q=0.4\r\n
     [truncated]Cookie: beans_dmp=%7B%22admaster%22%3A1499855777%2C%22shunfei%22%3A1499855777%2C%22reachmax%22%3A1499855777%2C%22lingji%22%3A1499855777%2C%22yoyi%22%3A1499855777%2C%22ipinyou%22%3A1499855777%2C%22ipinyou_admaster%22%3A149985577
    \r\n
    [Full request URI: http://www.sohu.com/sohuflash_1.js]
    [HTTP request 1/1]
    [Response in frame: 199]

No.     Time               Source                Destination           Protocol Length Info
    187 01:58:58.048399    10.106.129.54         118.244.253.69        HTTP     524    GET /global/global201302.css HTTP/1.1 

Frame 187: 524 bytes on wire (4192 bits), 524 bytes captured (4192 bits) on interface 0
Ethernet II, Src: AsustekC_34:f3:aa (9c:5c:8e:34:f3:aa), Dst: Hangzhou_75:c8:f5 (74:25:8a:75:c8:f5)
Internet Protocol Version 4, Src: 10.106.129.54, Dst: 118.244.253.69
Transmission Control Protocol, Src Port: 41950 (41950), Dst Port: 80 (80), Seq: 1, Ack: 1, Len: 470
Hypertext Transfer Protocol
    GET /global/global201302.css HTTP/1.1\r\n
    Host: css.tv.itc.cn\r\n
    Connection: keep-alive\r\n
    User-Agent: Mozilla/5.0 (Windows NT 10.0; Win64; x64) AppleWebKit/537.36 (KHTML, like Gecko) Chrome/59.0.3071.115 Safari/537.36\r\n
    Accept: text/css,*/*;q=0.1\r\n
    Referer: http://tv.sohu.com/s2015/newslist/?vid=3887740\r\n
    Accept-Encoding: gzip, deflate\r\n
    Accept-Language: en-US,en;q=0.8,zh-TW;q=0.6,zh;q=0.4\r\n
    If-None-Match: W/"58a3f85a-2a60"\r\n
    If-Modified-Since: Wed, 15 Feb 2017 06:42:34 GMT\r\n
    \r\n
    [Full request URI: http://css.tv.itc.cn/global/global201302.css]
    [HTTP request 1/2]
    [Response in frame: 203]
    [Next request in frame: 2178]

No.     Time               Source                Destination           Protocol Length Info
    190 01:58:58.049474    10.106.129.54         118.244.253.69        HTTP     435    GET /channel/nav_v1.css HTTP/1.1 

Frame 190: 435 bytes on wire (3480 bits), 435 bytes captured (3480 bits) on interface 0
Ethernet II, Src: AsustekC_34:f3:aa (9c:5c:8e:34:f3:aa), Dst: Hangzhou_75:c8:f5 (74:25:8a:75:c8:f5)
Internet Protocol Version 4, Src: 10.106.129.54, Dst: 118.244.253.69
Transmission Control Protocol, Src Port: 41949 (41949), Dst Port: 80 (80), Seq: 1, Ack: 1, Len: 381
Hypertext Transfer Protocol
    GET /channel/nav_v1.css HTTP/1.1\r\n
    Host: css.tv.itc.cn\r\n
    Connection: keep-alive\r\n
    User-Agent: Mozilla/5.0 (Windows NT 10.0; Win64; x64) AppleWebKit/537.36 (KHTML, like Gecko) Chrome/59.0.3071.115 Safari/537.36\r\n
    Accept: text/css,*/*;q=0.1\r\n
    Referer: http://tv.sohu.com/s2015/newslist/?vid=3887740\r\n
    Accept-Encoding: gzip, deflate\r\n
    Accept-Language: en-US,en;q=0.8,zh-TW;q=0.6,zh;q=0.4\r\n
    \r\n
    [Full request URI: http://css.tv.itc.cn/channel/nav_v1.css]
    [HTTP request 1/3]
    [Response in frame: 207]
    [Next request in frame: 2175]

No.     Time               Source                Destination           Protocol Length Info
    197 01:58:58.050240    10.106.129.54         118.244.253.69        HTTP     436    GET /channel/play_v3.css HTTP/1.1 

Frame 197: 436 bytes on wire (3488 bits), 436 bytes captured (3488 bits) on interface 0
Ethernet II, Src: AsustekC_34:f3:aa (9c:5c:8e:34:f3:aa), Dst: Hangzhou_75:c8:f5 (74:25:8a:75:c8:f5)
Internet Protocol Version 4, Src: 10.106.129.54, Dst: 118.244.253.69
Transmission Control Protocol, Src Port: 41952 (41952), Dst Port: 80 (80), Seq: 1, Ack: 1, Len: 382
Hypertext Transfer Protocol
    GET /channel/play_v3.css HTTP/1.1\r\n
    Host: css.tv.itc.cn\r\n
    Connection: keep-alive\r\n
    User-Agent: Mozilla/5.0 (Windows NT 10.0; Win64; x64) AppleWebKit/537.36 (KHTML, like Gecko) Chrome/59.0.3071.115 Safari/537.36\r\n
    Accept: text/css,*/*;q=0.1\r\n
    Referer: http://tv.sohu.com/s2015/newslist/?vid=3887740\r\n
    Accept-Encoding: gzip, deflate\r\n
    Accept-Language: en-US,en;q=0.8,zh-TW;q=0.6,zh;q=0.4\r\n
    \r\n
    [Full request URI: http://css.tv.itc.cn/channel/play_v3.css]
    [HTTP request 1/5]
    [Response in frame: 217]
    [Next request in frame: 262]

No.     Time               Source                Destination           Protocol Length Info
    198 01:58:58.050359    10.106.129.54         118.244.253.69        HTTP     438    GET /special/news/news.css HTTP/1.1 

Frame 198: 438 bytes on wire (3504 bits), 438 bytes captured (3504 bits) on interface 0
Ethernet II, Src: AsustekC_34:f3:aa (9c:5c:8e:34:f3:aa), Dst: Hangzhou_75:c8:f5 (74:25:8a:75:c8:f5)
Internet Protocol Version 4, Src: 10.106.129.54, Dst: 118.244.253.69
Transmission Control Protocol, Src Port: 41951 (41951), Dst Port: 80 (80), Seq: 1, Ack: 1, Len: 384
Hypertext Transfer Protocol
    GET /special/news/news.css HTTP/1.1\r\n
    Host: css.tv.itc.cn\r\n
    Connection: keep-alive\r\n
    User-Agent: Mozilla/5.0 (Windows NT 10.0; Win64; x64) AppleWebKit/537.36 (KHTML, like Gecko) Chrome/59.0.3071.115 Safari/537.36\r\n
    Accept: text/css,*/*;q=0.1\r\n
    Referer: http://tv.sohu.com/s2015/newslist/?vid=3887740\r\n
    Accept-Encoding: gzip, deflate\r\n
    Accept-Language: en-US,en;q=0.8,zh-TW;q=0.6,zh;q=0.4\r\n
    \r\n
    [Full request URI: http://css.tv.itc.cn/special/news/news.css]
    [HTTP request 1/5]
    [Response in frame: 228]
    [Next request in frame: 375]

No.     Time               Source                Destination           Protocol Length Info
    199 01:58:58.051363    118.244.253.68        10.106.129.54         HTTP     1514   HTTP/1.1 200 OK  (application/x-javascript)

Frame 199: 1514 bytes on wire (12112 bits), 1514 bytes captured (12112 bits) on interface 0
Ethernet II, Src: Hangzhou_75:c8:f5 (74:25:8a:75:c8:f5), Dst: AsustekC_34:f3:aa (9c:5c:8e:34:f3:aa)
Internet Protocol Version 4, Src: 118.244.253.68, Dst: 10.106.129.54
Transmission Control Protocol, Src Port: 80 (80), Dst Port: 41948 (41948), Seq: 1, Ack: 839, Len: 1460
Hypertext Transfer Protocol
    HTTP/1.1 200 OK\r\n
    Content-Type: application/x-javascript\r\n
    Content-Length: 2355\r\n
    Connection: keep-alive\r\n
    Date: Thu, 13 Jul 2017 00:35:24 GMT\r\n
    Server: SWS\r\n
    Vary: Accept-Encoding\r\n
    Cache-Control: no-transform, max-age=3600\r\n
    Expires: Thu, 13 Jul 2017 01:35:24 GMT\r\n
    Last-Modified: Mon, 17 Mar 2008 06:57:35 GMT\r\n
    Content-Encoding: gzip\r\n
    X-RS: 10652695.19893281.11406500\r\n
    FSS-Cache: HIT from 8474803.15290557.9474587\r\n
    Accept-Ranges: bytes\r\n
    FSS-Proxy: Powered by 2969695.4280425.3969395\r\n
    \r\n
    [HTTP response 1/1]
    [Time since request: 0.006070000 seconds]
    [Request in frame: 180]
    Content-encoded entity body (gzip): 980 bytes -> 2787 bytes
Line-based text data: application/x-javascript

No.     Time               Source                Destination           Protocol Length Info
    203 01:58:58.053865    118.244.253.69        10.106.129.54         HTTP     434    HTTP/1.1 304 Not Modified 

Frame 203: 434 bytes on wire (3472 bits), 434 bytes captured (3472 bits) on interface 0
Ethernet II, Src: Hangzhou_75:c8:f5 (74:25:8a:75:c8:f5), Dst: AsustekC_34:f3:aa (9c:5c:8e:34:f3:aa)
Internet Protocol Version 4, Src: 118.244.253.69, Dst: 10.106.129.54
Transmission Control Protocol, Src Port: 80 (80), Dst Port: 41950 (41950), Seq: 1, Ack: 471, Len: 380
Hypertext Transfer Protocol
    HTTP/1.1 304 Not Modified\r\n
    Connection: keep-alive\r\n
    Server: SohuTv-N/1273392\r\n
    Date: Thu, 13 Jul 2017 01:32:55 GMT\r\n
    Last-Modified: Wed, 15 Feb 2017 06:42:34 GMT\r\n
    ETag: W/"58a3f85a-2a60"\r\n
    Expires: Thu, 13 Jul 2017 02:02:55 GMT\r\n
    Cache-Control: max-age=1800\r\n
    X-Cache-Hit: by css.tv.itc.cn\r\n
    FSS-Cache: HIT from 8671414.15683776.9671201\r\n
    FSS-Proxy: Powered by 3035232.4411498.4034933\r\n
    \r\n
    [HTTP response 1/2]
    [Time since request: 0.005466000 seconds]
    [Request in frame: 187]
    [Next request in frame: 2178]
    [Next response in frame: 2214]

No.     Time               Source                Destination           Protocol Length Info
    207 01:58:58.054870    118.244.253.69        10.106.129.54         HTTP     1514   HTTP/1.1 200 OK [Malformed Packet]

Frame 207: 1514 bytes on wire (12112 bits), 1514 bytes captured (12112 bits) on interface 0
Ethernet II, Src: Hangzhou_75:c8:f5 (74:25:8a:75:c8:f5), Dst: AsustekC_34:f3:aa (9c:5c:8e:34:f3:aa)
Internet Protocol Version 4, Src: 118.244.253.69, Dst: 10.106.129.54
Transmission Control Protocol, Src Port: 80 (80), Dst Port: 41949 (41949), Seq: 1, Ack: 382, Len: 1460
Hypertext Transfer Protocol
    HTTP/1.1 200 OK\r\n
    Content-Type: text/css\r\n
    Transfer-Encoding: chunked\r\n
    Connection: keep-alive\r\n
    Server: SohuTv-N/1273392\r\n
    Date: Thu, 13 Jul 2017 01:33:14 GMT\r\n
    Last-Modified: Fri, 25 Nov 2016 10:34:43 GMT\r\n
    ETag: W/"583813c3-660a"\r\n
    Expires: Thu, 13 Jul 2017 02:03:14 GMT\r\n
    Cache-Control: max-age=1800\r\n
    X-Cache-Hit: by css.tv.itc.cn\r\n
    Content-Encoding: gzip\r\n
    FSS-Cache: HIT from 8605877.15552703.9605663\r\n
    FSS-Proxy: Powered by 3035232.4411498.4034933\r\n
    \r\n
    [HTTP response 1/3]
    [Time since request: 0.005396000 seconds]
    [Request in frame: 190]
    [Next request in frame: 2175]
    [Next response in frame: 2233]
    HTTP chunked response
[Malformed Packet: HTTP]

No.     Time               Source                Destination           Protocol Length Info
    217 01:58:58.055863    118.244.253.69        10.106.129.54         HTTP     1514   HTTP/1.1 200 OK [Malformed Packet]

Frame 217: 1514 bytes on wire (12112 bits), 1514 bytes captured (12112 bits) on interface 0
Ethernet II, Src: Hangzhou_75:c8:f5 (74:25:8a:75:c8:f5), Dst: AsustekC_34:f3:aa (9c:5c:8e:34:f3:aa)
Internet Protocol Version 4, Src: 118.244.253.69, Dst: 10.106.129.54
Transmission Control Protocol, Src Port: 80 (80), Dst Port: 41952 (41952), Seq: 1, Ack: 383, Len: 1460
Hypertext Transfer Protocol
    HTTP/1.1 200 OK\r\n
    Content-Type: text/css\r\n
    Transfer-Encoding: chunked\r\n
    Connection: keep-alive\r\n
    Server: SohuTv-N/1273392\r\n
    Date: Thu, 13 Jul 2017 01:51:32 GMT\r\n
    Last-Modified: Thu, 01 Jun 2017 06:42:10 GMT\r\n
    ETag: W/"592fb742-18ab0"\r\n
    Expires: Thu, 13 Jul 2017 02:21:32 GMT\r\n
    Cache-Control: max-age=1800\r\n
    X-Cache-Hit: by css.tv.itc.cn\r\n
    Content-Encoding: gzip\r\n
    FSS-Cache: HIT from 8343729.15028411.9343511\r\n
    FSS-Proxy: Powered by 3035232.4411498.4034933\r\n
    \r\n
    [HTTP response 1/5]
    [Time since request: 0.005623000 seconds]
    [Request in frame: 197]
    [Next request in frame: 262]
    [Next response in frame: 263]
    HTTP chunked response
[Malformed Packet: HTTP]

No.     Time               Source                Destination           Protocol Length Info
    228 01:58:58.057873    118.244.253.69        10.106.129.54         HTTP     1514   HTTP/1.1 200 OK [Malformed Packet]

Frame 228: 1514 bytes on wire (12112 bits), 1514 bytes captured (12112 bits) on interface 0
Ethernet II, Src: Hangzhou_75:c8:f5 (74:25:8a:75:c8:f5), Dst: AsustekC_34:f3:aa (9c:5c:8e:34:f3:aa)
Internet Protocol Version 4, Src: 118.244.253.69, Dst: 10.106.129.54
Transmission Control Protocol, Src Port: 80 (80), Dst Port: 41951 (41951), Seq: 1, Ack: 385, Len: 1460
Hypertext Transfer Protocol
    HTTP/1.1 200 OK\r\n
    Content-Type: text/css\r\n
    Transfer-Encoding: chunked\r\n
    Connection: keep-alive\r\n
    Server: SohuTv-N/1273392\r\n
    Date: Thu, 13 Jul 2017 01:42:04 GMT\r\n
    Last-Modified: Wed, 16 Mar 2016 07:13:18 GMT\r\n
    ETag: W/"56e9078e-2893"\r\n
    Expires: Thu, 13 Jul 2017 02:12:04 GMT\r\n
    Cache-Control: max-age=1800\r\n
    X-Cache-Hit: by css.tv.itc.cn\r\n
    Content-Encoding: gzip\r\n
    FSS-Cache: HIT from 8671414.15683776.9671201\r\n
    FSS-Proxy: Powered by 3035232.4411498.4034933\r\n
    \r\n
    [HTTP response 1/5]
    [Time since request: 0.007514000 seconds]
    [Request in frame: 198]
    [Next request in frame: 375]
    [Next response in frame: 379]
    HTTP chunked response
[Malformed Packet: HTTP]

No.     Time               Source                Destination           Protocol Length Info
    249 01:58:58.097959    10.106.129.54         118.244.253.68        HTTP     1495   GET /upload/jq_plugin/share.js HTTP/1.1 

Frame 249: 1495 bytes on wire (11960 bits), 1495 bytes captured (11960 bits) on interface 0
Ethernet II, Src: AsustekC_34:f3:aa (9c:5c:8e:34:f3:aa), Dst: Hangzhou_75:c8:f5 (74:25:8a:75:c8:f5)
Internet Protocol Version 4, Src: 10.106.129.54, Dst: 118.244.253.68
Transmission Control Protocol, Src Port: 41947 (41947), Dst Port: 80 (80), Seq: 1529, Ack: 9721, Len: 1441
Hypertext Transfer Protocol
    GET /upload/jq_plugin/share.js HTTP/1.1\r\n
    Host: tv.sohu.com\r\n
    Connection: keep-alive\r\n
    User-Agent: Mozilla/5.0 (Windows NT 10.0; Win64; x64) AppleWebKit/537.36 (KHTML, like Gecko) Chrome/59.0.3071.115 Safari/537.36\r\n
    Accept: */*\r\n
    Referer: http://tv.sohu.com/s2015/newslist/?vid=3887740\r\n
    Accept-Encoding: gzip, deflate\r\n
    Accept-Language: en-US,en;q=0.8,zh-TW;q=0.6,zh;q=0.4\r\n
     [truncated]Cookie: beans_dmp=%7B%22admaster%22%3A1499855777%2C%22shunfei%22%3A1499855777%2C%22reachmax%22%3A1499855777%2C%22lingji%22%3A1499855777%2C%22yoyi%22%3A1499855777%2C%22ipinyou%22%3A1499855777%2C%22ipinyou_admaster%22%3A149985577
    \r\n
    [Full request URI: http://tv.sohu.com/upload/jq_plugin/share.js]
    [HTTP request 2/3]
    [Prev request in frame: 151]
    [Response in frame: 252]
    [Next request in frame: 275]

No.     Time               Source                Destination           Protocol Length Info
    252 01:58:58.103897    118.244.253.68        10.106.129.54         HTTP     1514   HTTP/1.1 200 OK  (application/x-javascript)

Frame 252: 1514 bytes on wire (12112 bits), 1514 bytes captured (12112 bits) on interface 0
Ethernet II, Src: Hangzhou_75:c8:f5 (74:25:8a:75:c8:f5), Dst: AsustekC_34:f3:aa (9c:5c:8e:34:f3:aa)
Internet Protocol Version 4, Src: 118.244.253.68, Dst: 10.106.129.54
Transmission Control Protocol, Src Port: 80 (80), Dst Port: 41947 (41947), Seq: 9721, Ack: 2970, Len: 1460
Hypertext Transfer Protocol
    HTTP/1.1 200 OK\r\n
    Content-Type: application/x-javascript\r\n
    Content-Length: 2700\r\n
    Connection: keep-alive\r\n
    Date: Thu, 13 Jul 2017 01:25:01 GMT\r\n
    Server: SWS\r\n
    Vary: Accept-Encoding\r\n
    Cache-Control: no-transform, max-age=3600\r\n
    Expires: Thu, 13 Jul 2017 02:25:01 GMT\r\n
    Last-Modified: Tue, 17 May 2016 06:36:31 GMT\r\n
    Content-Encoding: gzip\r\n
    X-RS: 10587158.19762208.11340962\r\n
    FSS-Cache: HIT from 8278192.14897338.9277973\r\n
    Accept-Ranges: bytes\r\n
    FSS-Proxy: Powered by 2969695.4280425.3969395\r\n
    \r\n
    [HTTP response 2/3]
    [Time since request: 0.005938000 seconds]
    [Prev request in frame: 151]
    [Prev response in frame: 162]
    [Request in frame: 249]
    [Next request in frame: 275]
    [Next response in frame: 310]
    Content-encoded entity body (gzip): 980 bytes -> 1691 bytes
Line-based text data: application/x-javascript

No.     Time               Source                Destination           Protocol Length Info
    259 01:58:58.111657    10.106.129.54         118.244.253.69        HTTP     425    GET /site/special/news/inc.js HTTP/1.1 

Frame 259: 425 bytes on wire (3400 bits), 425 bytes captured (3400 bits) on interface 0
Ethernet II, Src: AsustekC_34:f3:aa (9c:5c:8e:34:f3:aa), Dst: Hangzhou_75:c8:f5 (74:25:8a:75:c8:f5)
Internet Protocol Version 4, Src: 10.106.129.54, Dst: 118.244.253.69
Transmission Control Protocol, Src Port: 41953 (41953), Dst Port: 80 (80), Seq: 1, Ack: 1, Len: 371
Hypertext Transfer Protocol
    GET /site/special/news/inc.js HTTP/1.1\r\n
    Host: js.tv.itc.cn\r\n
    Connection: keep-alive\r\n
    User-Agent: Mozilla/5.0 (Windows NT 10.0; Win64; x64) AppleWebKit/537.36 (KHTML, like Gecko) Chrome/59.0.3071.115 Safari/537.36\r\n
    Accept: */*\r\n
    Referer: http://tv.sohu.com/s2015/newslist/?vid=3887740\r\n
    Accept-Encoding: gzip, deflate\r\n
    Accept-Language: en-US,en;q=0.8,zh-TW;q=0.6,zh;q=0.4\r\n
    \r\n
    [Full request URI: http://js.tv.itc.cn/site/special/news/inc.js]
    [HTTP request 1/6]
    [Response in frame: 261]
    [Next request in frame: 376]

No.     Time               Source                Destination           Protocol Length Info
    261 01:58:58.116910    118.244.253.69        10.106.129.54         HTTP     744    HTTP/1.1 200 OK  (application/x-javascript)

Frame 261: 744 bytes on wire (5952 bits), 744 bytes captured (5952 bits) on interface 0
Ethernet II, Src: Hangzhou_75:c8:f5 (74:25:8a:75:c8:f5), Dst: AsustekC_34:f3:aa (9c:5c:8e:34:f3:aa)
Internet Protocol Version 4, Src: 118.244.253.69, Dst: 10.106.129.54
Transmission Control Protocol, Src Port: 80 (80), Dst Port: 41953 (41953), Seq: 1, Ack: 372, Len: 690
Hypertext Transfer Protocol
    HTTP/1.1 200 OK\r\n
    Content-Type: application/x-javascript\r\n
    Content-Length: 223\r\n
    Connection: keep-alive\r\n
    Server: SohuTv-N/1273392\r\n
    Date: Thu, 13 Jul 2017 01:42:04 GMT\r\n
    Last-Modified: Tue, 11 Jul 2017 08:05:36 GMT\r\n
    ETag: "596486d0-df"\r\n
    Expires: Thu, 13 Jul 2017 02:12:04 GMT\r\n
    Cache-Control: max-age=1800\r\n
    Access-Control-Allow-Origin: http://tv.sohu.com\r\n
    FSS-Cache: HIT from 8540340.15421630.9540125\r\n
    Accept-Ranges: bytes\r\n
    FSS-Proxy: Powered by 3035232.4411498.4034933\r\n
    \r\n
    [HTTP response 1/6]
    [Time since request: 0.005253000 seconds]
    [Request in frame: 259]
    [Next request in frame: 376]
    [Next response in frame: 378]
Line-based text data: application/x-javascript

No.     Time               Source                Destination           Protocol Length Info
    262 01:58:58.122083    10.106.129.54         118.244.253.69        HTTP     557    GET /channel/header-images/logo-tv-mini.gif HTTP/1.1 

Frame 262: 557 bytes on wire (4456 bits), 557 bytes captured (4456 bits) on interface 0
Ethernet II, Src: AsustekC_34:f3:aa (9c:5c:8e:34:f3:aa), Dst: Hangzhou_75:c8:f5 (74:25:8a:75:c8:f5)
Internet Protocol Version 4, Src: 10.106.129.54, Dst: 118.244.253.69
Transmission Control Protocol, Src Port: 41952 (41952), Dst Port: 80 (80), Seq: 383, Ack: 27969, Len: 503
Hypertext Transfer Protocol
    GET /channel/header-images/logo-tv-mini.gif HTTP/1.1\r\n
    Host: css.tv.itc.cn\r\n
    Connection: keep-alive\r\n
    User-Agent: Mozilla/5.0 (Windows NT 10.0; Win64; x64) AppleWebKit/537.36 (KHTML, like Gecko) Chrome/59.0.3071.115 Safari/537.36\r\n
    Accept: image/webp,image/apng,image/*,*/*;q=0.8\r\n
    Referer: http://tv.sohu.com/s2015/newslist/?vid=3887740\r\n
    Accept-Encoding: gzip, deflate\r\n
    Accept-Language: en-US,en;q=0.8,zh-TW;q=0.6,zh;q=0.4\r\n
    If-None-Match: "516e6ce4-79d"\r\n
    If-Modified-Since: Wed, 17 Apr 2013 09:35:32 GMT\r\n
    \r\n
    [Full request URI: http://css.tv.itc.cn/channel/header-images/logo-tv-mini.gif]
    [HTTP request 2/5]
    [Prev request in frame: 197]
    [Response in frame: 263]
    [Next request in frame: 348]

No.     Time               Source                Destination           Protocol Length Info
    263 01:58:58.127007    118.244.253.69        10.106.129.54         HTTP     431    HTTP/1.1 304 Not Modified 

Frame 263: 431 bytes on wire (3448 bits), 431 bytes captured (3448 bits) on interface 0
Ethernet II, Src: Hangzhou_75:c8:f5 (74:25:8a:75:c8:f5), Dst: AsustekC_34:f3:aa (9c:5c:8e:34:f3:aa)
Internet Protocol Version 4, Src: 118.244.253.69, Dst: 10.106.129.54
Transmission Control Protocol, Src Port: 80 (80), Dst Port: 41952 (41952), Seq: 27969, Ack: 886, Len: 377
Hypertext Transfer Protocol
    HTTP/1.1 304 Not Modified\r\n
    Connection: keep-alive\r\n
    Server: SohuTv-N/1273392\r\n
    Date: Thu, 13 Jul 2017 01:41:52 GMT\r\n
    Last-Modified: Wed, 17 Apr 2013 09:35:32 GMT\r\n
    ETag: "516e6ce4-79d"\r\n
    Expires: Thu, 13 Jul 2017 02:11:52 GMT\r\n
    Cache-Control: max-age=1800\r\n
    X-Cache-Hit: by css.tv.itc.cn\r\n
    FSS-Cache: HIT from 8736951.15814849.9736739\r\n
    FSS-Proxy: Powered by 3035232.4411498.4034933\r\n
    \r\n
    [HTTP response 2/5]
    [Time since request: 0.004924000 seconds]
    [Prev request in frame: 197]
    [Prev response in frame: 217]
    [Request in frame: 262]
    [Next request in frame: 348]
    [Next response in frame: 360]

No.     Time               Source                Destination           Protocol Length Info
    271 01:58:58.177781    10.106.129.54         211.162.54.145        HTTP     489    GET /20170713/70b_f7a34c13_fbf3_3fc7_10db_8eac503d1a4c_1.jpg HTTP/1.1 

Frame 271: 489 bytes on wire (3912 bits), 489 bytes captured (3912 bits) on interface 0
Ethernet II, Src: AsustekC_34:f3:aa (9c:5c:8e:34:f3:aa), Dst: Hangzhou_75:c8:f5 (74:25:8a:75:c8:f5)
Internet Protocol Version 4, Src: 10.106.129.54, Dst: 211.162.54.145
Transmission Control Protocol, Src Port: 41850 (41850), Dst Port: 80 (80), Seq: 1, Ack: 1, Len: 435
Hypertext Transfer Protocol
    GET /20170713/70b_f7a34c13_fbf3_3fc7_10db_8eac503d1a4c_1.jpg HTTP/1.1\r\n
    Host: i1.itc.cn\r\n
    Connection: keep-alive\r\n
    User-Agent: Mozilla/5.0 (Windows NT 10.0; Win64; x64) AppleWebKit/537.36 (KHTML, like Gecko) Chrome/59.0.3071.115 Safari/537.36\r\n
    Accept: image/webp,image/apng,image/*,*/*;q=0.8\r\n
    Referer: http://tv.sohu.com/s2015/newslist/?vid=3887740\r\n
    Accept-Encoding: gzip, deflate\r\n
    Accept-Language: en-US,en;q=0.8,zh-TW;q=0.6,zh;q=0.4\r\n
    \r\n
    [Full request URI: http://i1.itc.cn/20170713/70b_f7a34c13_fbf3_3fc7_10db_8eac503d1a4c_1.jpg]
    [HTTP request 1/1]
    [Response in frame: 350]

No.     Time               Source                Destination           Protocol Length Info
    272 01:58:58.177943    10.106.129.54         219.238.2.185         HTTP     489    GET /20170710/70b_021ed84b_55b3_34f4_54e3_377f011193c7_1.jpg HTTP/1.1 

Frame 272: 489 bytes on wire (3912 bits), 489 bytes captured (3912 bits) on interface 0
Ethernet II, Src: AsustekC_34:f3:aa (9c:5c:8e:34:f3:aa), Dst: Hangzhou_75:c8:f5 (74:25:8a:75:c8:f5)
Internet Protocol Version 4, Src: 10.106.129.54, Dst: 219.238.2.185
Transmission Control Protocol, Src Port: 41842 (41842), Dst Port: 80 (80), Seq: 1, Ack: 1, Len: 435
Hypertext Transfer Protocol
    GET /20170710/70b_021ed84b_55b3_34f4_54e3_377f011193c7_1.jpg HTTP/1.1\r\n
    Host: i3.itc.cn\r\n
    Connection: keep-alive\r\n
    User-Agent: Mozilla/5.0 (Windows NT 10.0; Win64; x64) AppleWebKit/537.36 (KHTML, like Gecko) Chrome/59.0.3071.115 Safari/537.36\r\n
    Accept: image/webp,image/apng,image/*,*/*;q=0.8\r\n
    Referer: http://tv.sohu.com/s2015/newslist/?vid=3887740\r\n
    Accept-Encoding: gzip, deflate\r\n
    Accept-Language: en-US,en;q=0.8,zh-TW;q=0.6,zh;q=0.4\r\n
    \r\n
    [Full request URI: http://i3.itc.cn/20170710/70b_021ed84b_55b3_34f4_54e3_377f011193c7_1.jpg]
    [HTTP request 1/1]
    [Response in frame: 285]

No.     Time               Source                Destination           Protocol Length Info
    273 01:58:58.178533    10.106.129.54         219.238.2.185         HTTP     489    GET /20161219/70b_7db9fe95_6050_837a_b4d4_a58e6d11ff43_1.jpg HTTP/1.1 

Frame 273: 489 bytes on wire (3912 bits), 489 bytes captured (3912 bits) on interface 0
Ethernet II, Src: AsustekC_34:f3:aa (9c:5c:8e:34:f3:aa), Dst: Hangzhou_75:c8:f5 (74:25:8a:75:c8:f5)
Internet Protocol Version 4, Src: 10.106.129.54, Dst: 219.238.2.185
Transmission Control Protocol, Src Port: 41846 (41846), Dst Port: 80 (80), Seq: 1, Ack: 1, Len: 435
Hypertext Transfer Protocol
    GET /20161219/70b_7db9fe95_6050_837a_b4d4_a58e6d11ff43_1.jpg HTTP/1.1\r\n
    Host: i2.itc.cn\r\n
    Connection: keep-alive\r\n
    User-Agent: Mozilla/5.0 (Windows NT 10.0; Win64; x64) AppleWebKit/537.36 (KHTML, like Gecko) Chrome/59.0.3071.115 Safari/537.36\r\n
    Accept: image/webp,image/apng,image/*,*/*;q=0.8\r\n
    Referer: http://tv.sohu.com/s2015/newslist/?vid=3887740\r\n
    Accept-Encoding: gzip, deflate\r\n
    Accept-Language: en-US,en;q=0.8,zh-TW;q=0.6,zh;q=0.4\r\n
    \r\n
    [Full request URI: http://i2.itc.cn/20161219/70b_7db9fe95_6050_837a_b4d4_a58e6d11ff43_1.jpg]
    [HTTP request 1/1]
    [Response in frame: 298]

No.     Time               Source                Destination           Protocol Length Info
    275 01:58:58.180280    10.106.129.54         118.244.253.68        HTTP     90     GET /commonfrag/vrs_flashPlayer.inc HTTP/1.1 

Frame 275: 90 bytes on wire (720 bits), 90 bytes captured (720 bits) on interface 0
Ethernet II, Src: AsustekC_34:f3:aa (9c:5c:8e:34:f3:aa), Dst: Hangzhou_75:c8:f5 (74:25:8a:75:c8:f5)
Internet Protocol Version 4, Src: 10.106.129.54, Dst: 118.244.253.68
Transmission Control Protocol, Src Port: 41947 (41947), Dst Port: 80 (80), Seq: 4430, Ack: 12901, Len: 36
[2 Reassembled TCP Segments (1496 bytes): #274(1460), #275(36)]
Hypertext Transfer Protocol
    GET /commonfrag/vrs_flashPlayer.inc HTTP/1.1\r\n
    Host: tv.sohu.com\r\n
    Connection: keep-alive\r\n
    If-Modified-Since: Thu, 06 Jul 2017 09:51:20 GMT\r\n
    User-Agent: Mozilla/5.0 (Windows NT 10.0; Win64; x64) AppleWebKit/537.36 (KHTML, like Gecko) Chrome/59.0.3071.115 Safari/537.36\r\n
    Accept: */*\r\n
    Referer: http://tv.sohu.com/s2015/newslist/?vid=3887740\r\n
    Accept-Encoding: gzip, deflate\r\n
    Accept-Language: en-US,en;q=0.8,zh-TW;q=0.6,zh;q=0.4\r\n
     [truncated]Cookie: beans_dmp=%7B%22admaster%22%3A1499855777%2C%22shunfei%22%3A1499855777%2C%22reachmax%22%3A1499855777%2C%22lingji%22%3A1499855777%2C%22yoyi%22%3A1499855777%2C%22ipinyou%22%3A1499855777%2C%22ipinyou_admaster%22%3A149985577
    \r\n
    [Full request URI: http://tv.sohu.com/commonfrag/vrs_flashPlayer.inc]
    [HTTP request 3/3]
    [Prev request in frame: 249]
    [Response in frame: 310]

No.     Time               Source                Destination           Protocol Length Info
    282 01:58:58.181347    10.106.129.54         118.244.253.70        HTTP     489    GET /20170710/70b_770f6e01_ce53_db83_c616_28088e8543a8_1.jpg HTTP/1.1 

Frame 282: 489 bytes on wire (3912 bits), 489 bytes captured (3912 bits) on interface 0
Ethernet II, Src: AsustekC_34:f3:aa (9c:5c:8e:34:f3:aa), Dst: Hangzhou_75:c8:f5 (74:25:8a:75:c8:f5)
Internet Protocol Version 4, Src: 10.106.129.54, Dst: 118.244.253.70
Transmission Control Protocol, Src Port: 41955 (41955), Dst Port: 80 (80), Seq: 1, Ack: 1, Len: 435
Hypertext Transfer Protocol
    GET /20170710/70b_770f6e01_ce53_db83_c616_28088e8543a8_1.jpg HTTP/1.1\r\n
    Host: i0.itc.cn\r\n
    Connection: keep-alive\r\n
    User-Agent: Mozilla/5.0 (Windows NT 10.0; Win64; x64) AppleWebKit/537.36 (KHTML, like Gecko) Chrome/59.0.3071.115 Safari/537.36\r\n
    Accept: image/webp,image/apng,image/*,*/*;q=0.8\r\n
    Referer: http://tv.sohu.com/s2015/newslist/?vid=3887740\r\n
    Accept-Encoding: gzip, deflate\r\n
    Accept-Language: en-US,en;q=0.8,zh-TW;q=0.6,zh;q=0.4\r\n
    \r\n
    [Full request URI: http://i0.itc.cn/20170710/70b_770f6e01_ce53_db83_c616_28088e8543a8_1.jpg]
    [HTTP request 1/1]
    [Response in frame: 317]

No.     Time               Source                Destination           Protocol Length Info
    283 01:58:58.181876    10.106.129.54         118.244.253.70        HTTP     489    GET /20170710/70b_bab3663c_01ab_ca52_1bad_ac9edb400fa2_1.jpg HTTP/1.1 

Frame 283: 489 bytes on wire (3912 bits), 489 bytes captured (3912 bits) on interface 0
Ethernet II, Src: AsustekC_34:f3:aa (9c:5c:8e:34:f3:aa), Dst: Hangzhou_75:c8:f5 (74:25:8a:75:c8:f5)
Internet Protocol Version 4, Src: 10.106.129.54, Dst: 118.244.253.70
Transmission Control Protocol, Src Port: 41957 (41957), Dst Port: 80 (80), Seq: 1, Ack: 1, Len: 435
Hypertext Transfer Protocol
    GET /20170710/70b_bab3663c_01ab_ca52_1bad_ac9edb400fa2_1.jpg HTTP/1.1\r\n
    Host: i0.itc.cn\r\n
    Connection: keep-alive\r\n
    User-Agent: Mozilla/5.0 (Windows NT 10.0; Win64; x64) AppleWebKit/537.36 (KHTML, like Gecko) Chrome/59.0.3071.115 Safari/537.36\r\n
    Accept: image/webp,image/apng,image/*,*/*;q=0.8\r\n
    Referer: http://tv.sohu.com/s2015/newslist/?vid=3887740\r\n
    Accept-Encoding: gzip, deflate\r\n
    Accept-Language: en-US,en;q=0.8,zh-TW;q=0.6,zh;q=0.4\r\n
    \r\n
    [Full request URI: http://i0.itc.cn/20170710/70b_bab3663c_01ab_ca52_1bad_ac9edb400fa2_1.jpg]
    [HTTP request 1/1]
    [Response in frame: 326]

No.     Time               Source                Destination           Protocol Length Info
    284 01:58:58.182739    10.106.129.54         118.244.253.70        HTTP     489    GET /20170710/70b_f99c4f3b_fbc2_c7d1_98f3_c5bc72426eaa_1.jpg HTTP/1.1 

Frame 284: 489 bytes on wire (3912 bits), 489 bytes captured (3912 bits) on interface 0
Ethernet II, Src: AsustekC_34:f3:aa (9c:5c:8e:34:f3:aa), Dst: Hangzhou_75:c8:f5 (74:25:8a:75:c8:f5)
Internet Protocol Version 4, Src: 10.106.129.54, Dst: 118.244.253.70
Transmission Control Protocol, Src Port: 41956 (41956), Dst Port: 80 (80), Seq: 1, Ack: 1, Len: 435
Hypertext Transfer Protocol
    GET /20170710/70b_f99c4f3b_fbc2_c7d1_98f3_c5bc72426eaa_1.jpg HTTP/1.1\r\n
    Host: i0.itc.cn\r\n
    Connection: keep-alive\r\n
    User-Agent: Mozilla/5.0 (Windows NT 10.0; Win64; x64) AppleWebKit/537.36 (KHTML, like Gecko) Chrome/59.0.3071.115 Safari/537.36\r\n
    Accept: image/webp,image/apng,image/*,*/*;q=0.8\r\n
    Referer: http://tv.sohu.com/s2015/newslist/?vid=3887740\r\n
    Accept-Encoding: gzip, deflate\r\n
    Accept-Language: en-US,en;q=0.8,zh-TW;q=0.6,zh;q=0.4\r\n
    \r\n
    [Full request URI: http://i0.itc.cn/20170710/70b_f99c4f3b_fbc2_c7d1_98f3_c5bc72426eaa_1.jpg]
    [HTTP request 1/1]
    [Response in frame: 332]

No.     Time               Source                Destination           Protocol Length Info
    285 01:58:58.183530    219.238.2.185         10.106.129.54         HTTP     1514   HTTP/1.1 200 OK  (JPEG JFIF image)[Malformed Packet]

Frame 285: 1514 bytes on wire (12112 bits), 1514 bytes captured (12112 bits) on interface 0
Ethernet II, Src: Hangzhou_75:c8:f5 (74:25:8a:75:c8:f5), Dst: AsustekC_34:f3:aa (9c:5c:8e:34:f3:aa)
Internet Protocol Version 4, Src: 219.238.2.185, Dst: 10.106.129.54
Transmission Control Protocol, Src Port: 80 (80), Dst Port: 41842 (41842), Seq: 1, Ack: 436, Len: 1460
Hypertext Transfer Protocol
    HTTP/1.1 200 OK\r\n
    Expires: Sun, 08 Oct 2017 06:13:31 GMT\r\n
    Date: Mon, 10 Jul 2017 06:13:31 GMT\r\n
    Content-Type: image/jpeg\r\n
    Content-Length: 5935\r\n
    Server: FSS\r\n
    Last-Modified: Mon, 10 Jul 2017 06:03:21 GMT\r\n
    Cache-Control: max-age=7776000\r\n
    X-RS: 10511343.19686393.11189627\r\n
    FSS-Cache: HIT from 8227826.15043580.8981594\r\n
    Accept-Ranges: bytes\r\n
    FSS-Proxy: Powered by 2788255.4164521.3541940\r\n
    Age: 1\r\n
    X-Via: 1.1 hangkuan195:5 (Cdn Cache Server V2.0), 1.1 chk25:2 (Cdn Cache Server V2.0)\r\n
    Connection: keep-alive\r\n
    \r\n
    [HTTP response 1/1]
    [Time since request: 0.005587000 seconds]
    [Request in frame: 272]
JPEG File Interchange Format
[Malformed Packet: JFIF (JPEG) image]

No.     Time               Source                Destination           Protocol Length Info
    297 01:58:58.184413    10.106.129.54         220.181.11.61         HTTP     519    GET /irt?_iwt_UA=UA-sohu-000001&jsonp=_410RZ HTTP/1.1 

Frame 297: 519 bytes on wire (4152 bits), 519 bytes captured (4152 bits) on interface 0
Ethernet II, Src: AsustekC_34:f3:aa (9c:5c:8e:34:f3:aa), Dst: Hangzhou_75:c8:f5 (74:25:8a:75:c8:f5)
Internet Protocol Version 4, Src: 10.106.129.54, Dst: 220.181.11.61
Transmission Control Protocol, Src Port: 41958 (41958), Dst Port: 80 (80), Seq: 1, Ack: 1, Len: 465
Hypertext Transfer Protocol
    GET /irt?_iwt_UA=UA-sohu-000001&jsonp=_410RZ HTTP/1.1\r\n
    Host: sohu.irs01.com\r\n
