No.     Time               Source                Destination           Protocol Length Info
      1 14:07:47.634631    10.210.66.82          140.205.94.19         HTTP     892    GET /yt/vp.vtslog?version=0.5.44&vid=707161202&uid=&type=h5&cf=0&cpt=29&full=0&pc=0&clb=0&playersid=15266524370371cdpp70he6g2VPzyNRzfQVv&abtest=b&sn=6&pt=30&hi=5&vvid=ed3fb292a12322f46c03132abf8a10bc&lang=1&r=1043313000&cna=WnjsEmreO3oCAd7TtqYtFE7Z&speed=1 HTTP/1.1 

Frame 1: 892 bytes on wire (7136 bits), 892 bytes captured (7136 bits) on interface 0
Ethernet II, Src: AsustekC_34:f3:aa (9c:5c:8e:34:f3:aa), Dst: Hangzhou_d2:34:0d (3c:e5:a6:d2:34:0d)
Internet Protocol Version 4, Src: 10.210.66.82, Dst: 140.205.94.19
Transmission Control Protocol, Src Port: 31676 (31676), Dst Port: 80 (80), Seq: 1, Ack: 1, Len: 838
Hypertext Transfer Protocol
     [truncated]GET /yt/vp.vtslog?version=0.5.44&vid=707161202&uid=&type=h5&cf=0&cpt=29&full=0&pc=0&clb=0&playersid=15266524370371cdpp70he6g2VPzyNRzfQVv&abtest=b&sn=6&pt=30&hi=5&vvid=ed3fb292a12322f46c03132abf8a10bc&lang=1&r=1043313000&cna=Wnj
    Host: yt.mmstat.com\r\n
    Connection: keep-alive\r\n
    User-Agent: Mozilla/5.0 (Windows NT 10.0; Win64; x64) AppleWebKit/537.36 (KHTML, like Gecko) Chrome/66.0.3359.139 Safari/537.36\r\n
    Accept: image/webp,image/apng,image/*,*/*;q=0.8\r\n
    Referer: http://v.youku.com/v_show/id_XMjgyODY0NDgwOA==.html?spm=a2h0j.11185381.0.11185381\r\n
    Accept-Encoding: gzip, deflate\r\n
    Accept-Language: en-US,en;q=0.9,zh-TW;q=0.8,zh;q=0.7\r\n
    Cookie: cna=WnjsEmreO3oCAd7TtqYtFE7Z; sca=57c7c60f; yunpk=1235994412436795; tbsa=5cef25164a63168536774494_1522742466_2; atpsida=4efe74594bbbcce4b63c6504_1526652423_10\r\n
    \r\n
    [Full request URI [truncated]: http://yt.mmstat.com/yt/vp.vtslog?version=0.5.44&vid=707161202&uid=&type=h5&cf=0&cpt=29&full=0&pc=0&clb=0&playersid=15266524370371cdpp70he6g2VPzyNRzfQVv&abtest=b&sn=6&pt=30&hi=5&vvid=ed3fb292a12322f46c03132abf]
    [HTTP request 1/2]
    [Response in frame: 2]
    [Next request in frame: 21]

No.     Time               Source                Destination           Protocol Length Info
      2 14:07:47.664708    140.205.94.19         10.210.66.82          HTTP     373    HTTP/1.1 200 OK  (GIF89a)

Frame 2: 373 bytes on wire (2984 bits), 373 bytes captured (2984 bits) on interface 0
Ethernet II, Src: Hangzhou_d2:34:0d (3c:e5:a6:d2:34:0d), Dst: AsustekC_34:f3:aa (9c:5c:8e:34:f3:aa)
Internet Protocol Version 4, Src: 140.205.94.19, Dst: 10.210.66.82
Transmission Control Protocol, Src Port: 80 (80), Dst Port: 31676 (31676), Seq: 1, Ack: 839, Len: 319
Hypertext Transfer Protocol
    HTTP/1.1 200 OK\r\n
    Date: Fri, 18 May 2018 14:07:36 GMT\r\n
    Content-Type: image/gif\r\n
    Content-Length: 43\r\n
    Connection: keep-alive\r\n
    P3P: CP="NOI DSP COR CURa ADMa DEVa PSAa PSDa OUR IND UNI PUR NAV"\r\n
    Expires: Thu, 01 Jan 1970 00:00:01 GMT\r\n
    Cache-Control: no-cache\r\n
    Pragma: no-cache\r\n
    \r\n
    [HTTP response 1/2]
    [Time since request: 0.030077000 seconds]
    [Request in frame: 1]
    [Next request in frame: 21]
Compuserve GIF, Version: GIF89a

No.     Time               Source                Destination           Protocol Length Info
     21 14:07:52.647302    10.210.66.82          140.205.94.19         HTTP     892    GET /yt/vp.vtslog?version=0.5.44&vid=707161202&uid=&type=h5&cf=0&cpt=34&full=0&pc=0&clb=0&playersid=15266524370371cdpp70he6g2VPzyNRzfQVv&abtest=b&sn=7&pt=35&hi=5&vvid=ed3fb292a12322f46c03132abf8a10bc&lang=1&r=1046334482&cna=WnjsEmreO3oCAd7TtqYtFE7Z&speed=1 HTTP/1.1 

Frame 21: 892 bytes on wire (7136 bits), 892 bytes captured (7136 bits) on interface 0
Ethernet II, Src: AsustekC_34:f3:aa (9c:5c:8e:34:f3:aa), Dst: Hangzhou_d2:34:0d (3c:e5:a6:d2:34:0d)
Internet Protocol Version 4, Src: 10.210.66.82, Dst: 140.205.94.19
Transmission Control Protocol, Src Port: 31676 (31676), Dst Port: 80 (80), Seq: 839, Ack: 320, Len: 838
Hypertext Transfer Protocol
     [truncated]GET /yt/vp.vtslog?version=0.5.44&vid=707161202&uid=&type=h5&cf=0&cpt=34&full=0&pc=0&clb=0&playersid=15266524370371cdpp70he6g2VPzyNRzfQVv&abtest=b&sn=7&pt=35&hi=5&vvid=ed3fb292a12322f46c03132abf8a10bc&lang=1&r=1046334482&cna=Wnj
    Host: yt.mmstat.com\r\n
    Connection: keep-alive\r\n
    User-Agent: Mozilla/5.0 (Windows NT 10.0; Win64; x64) AppleWebKit/537.36 (KHTML, like Gecko) Chrome/66.0.3359.139 Safari/537.36\r\n
    Accept: image/webp,image/apng,image/*,*/*;q=0.8\r\n
    Referer: http://v.youku.com/v_show/id_XMjgyODY0NDgwOA==.html?spm=a2h0j.11185381.0.11185381\r\n
    Accept-Encoding: gzip, deflate\r\n
    Accept-Language: en-US,en;q=0.9,zh-TW;q=0.8,zh;q=0.7\r\n
    Cookie: cna=WnjsEmreO3oCAd7TtqYtFE7Z; sca=57c7c60f; yunpk=1235994412436795; tbsa=5cef25164a63168536774494_1522742466_2; atpsida=4efe74594bbbcce4b63c6504_1526652423_10\r\n
    \r\n
    [Full request URI [truncated]: http://yt.mmstat.com/yt/vp.vtslog?version=0.5.44&vid=707161202&uid=&type=h5&cf=0&cpt=34&full=0&pc=0&clb=0&playersid=15266524370371cdpp70he6g2VPzyNRzfQVv&abtest=b&sn=7&pt=35&hi=5&vvid=ed3fb292a12322f46c03132abf]
    [HTTP request 2/2]
    [Prev request in frame: 1]

No.     Time               Source                Destination           Protocol Length Info
     31 14:07:52.692000    10.210.66.82          140.205.94.19         HTTP     892    GET /yt/vp.vtslog?version=0.5.44&vid=707161202&uid=&type=h5&cf=0&cpt=34&full=0&pc=0&clb=0&playersid=15266524370371cdpp70he6g2VPzyNRzfQVv&abtest=b&sn=7&pt=35&hi=5&vvid=ed3fb292a12322f46c03132abf8a10bc&lang=1&r=1046334482&cna=WnjsEmreO3oCAd7TtqYtFE7Z&speed=1 HTTP/1.1 

Frame 31: 892 bytes on wire (7136 bits), 892 bytes captured (7136 bits) on interface 0
Ethernet II, Src: AsustekC_34:f3:aa (9c:5c:8e:34:f3:aa), Dst: Hangzhou_d2:34:0d (3c:e5:a6:d2:34:0d)
Internet Protocol Version 4, Src: 10.210.66.82, Dst: 140.205.94.19
Transmission Control Protocol, Src Port: 31679 (31679), Dst Port: 80 (80), Seq: 1, Ack: 1, Len: 838
Hypertext Transfer Protocol
     [truncated]GET /yt/vp.vtslog?version=0.5.44&vid=707161202&uid=&type=h5&cf=0&cpt=34&full=0&pc=0&clb=0&playersid=15266524370371cdpp70he6g2VPzyNRzfQVv&abtest=b&sn=7&pt=35&hi=5&vvid=ed3fb292a12322f46c03132abf8a10bc&lang=1&r=1046334482&cna=Wnj
    Host: yt.mmstat.com\r\n
    Connection: keep-alive\r\n
    User-Agent: Mozilla/5.0 (Windows NT 10.0; Win64; x64) AppleWebKit/537.36 (KHTML, like Gecko) Chrome/66.0.3359.139 Safari/537.36\r\n
    Accept: image/webp,image/apng,image/*,*/*;q=0.8\r\n
    Referer: http://v.youku.com/v_show/id_XMjgyODY0NDgwOA==.html?spm=a2h0j.11185381.0.11185381\r\n
    Accept-Encoding: gzip, deflate\r\n
    Accept-Language: en-US,en;q=0.9,zh-TW;q=0.8,zh;q=0.7\r\n
    Cookie: cna=WnjsEmreO3oCAd7TtqYtFE7Z; sca=57c7c60f; yunpk=1235994412436795; tbsa=5cef25164a63168536774494_1522742466_2; atpsida=4efe74594bbbcce4b63c6504_1526652423_10\r\n
    \r\n
    [Full request URI [truncated]: http://yt.mmstat.com/yt/vp.vtslog?version=0.5.44&vid=707161202&uid=&type=h5&cf=0&cpt=34&full=0&pc=0&clb=0&playersid=15266524370371cdpp70he6g2VPzyNRzfQVv&abtest=b&sn=7&pt=35&hi=5&vvid=ed3fb292a12322f46c03132abf]
    [HTTP request 1/3]
    [Response in frame: 35]
    [Next request in frame: 383]

No.     Time               Source                Destination           Protocol Length Info
     35 14:07:52.716294    140.205.94.19         10.210.66.82          HTTP     373    HTTP/1.1 200 OK  (GIF89a)

Frame 35: 373 bytes on wire (2984 bits), 373 bytes captured (2984 bits) on interface 0
Ethernet II, Src: Hangzhou_d2:34:0d (3c:e5:a6:d2:34:0d), Dst: AsustekC_34:f3:aa (9c:5c:8e:34:f3:aa)
Internet Protocol Version 4, Src: 140.205.94.19, Dst: 10.210.66.82
Transmission Control Protocol, Src Port: 80 (80), Dst Port: 31679 (31679), Seq: 1, Ack: 839, Len: 319
Hypertext Transfer Protocol
    HTTP/1.1 200 OK\r\n
    Date: Fri, 18 May 2018 14:07:41 GMT\r\n
    Content-Type: image/gif\r\n
    Content-Length: 43\r\n
    Connection: keep-alive\r\n
    P3P: CP="NOI DSP COR CURa ADMa DEVa PSAa PSDa OUR IND UNI PUR NAV"\r\n
    Expires: Thu, 01 Jan 1970 00:00:01 GMT\r\n
    Cache-Control: no-cache\r\n
    Pragma: no-cache\r\n
    \r\n
    [HTTP response 1/3]
    [Time since request: 0.024294000 seconds]
    [Request in frame: 31]
    [Next request in frame: 383]
    [Next response in frame: 402]
Compuserve GIF, Version: GIF89a

No.     Time               Source                Destination           Protocol Length Info
     40 14:07:55.451815    10.210.66.82          222.22.29.84          HTTP     876    GET /696BE4850C39716A5D56562D/03000A010059C2D334B8C8000000017E7F784C-BAF8-ECA4-0150-694FEB7BA827.mp4.ts?ccode=0502&duration=66&expire=18000&psid=ed3fb292a12322f46c03132abf8a10bc&ups_client_netip=6a78ce92&ups_ts=1526652426&ups_userid=&utid=WnjsEmreO3oCAd7TtqYtFE7Z&vid=XMjgyODY0NDgwOA%3D%3D&s=13acada89b2c11e6bdbb&vkey=Ae819eb6c6e53ee832052f9db28466c16&ts_start=47.3&ts_end=55.967&ts_seg_no=6&ts_keyframe=1 HTTP/1.1 

Frame 40: 876 bytes on wire (7008 bits), 876 bytes captured (7008 bits) on interface 0
Ethernet II, Src: AsustekC_34:f3:aa (9c:5c:8e:34:f3:aa), Dst: Hangzhou_d2:34:0d (3c:e5:a6:d2:34:0d)
Internet Protocol Version 4, Src: 10.210.66.82, Dst: 222.22.29.84
Transmission Control Protocol, Src Port: 31468 (31468), Dst Port: 80 (80), Seq: 1, Ack: 1, Len: 822
Hypertext Transfer Protocol
     [truncated]GET /696BE4850C39716A5D56562D/03000A010059C2D334B8C8000000017E7F784C-BAF8-ECA4-0150-694FEB7BA827.mp4.ts?ccode=0502&duration=66&expire=18000&psid=ed3fb292a12322f46c03132abf8a10bc&ups_client_netip=6a78ce92&ups_ts=1526652426&ups_u
    Host: vali.cp31.ott.cibntv.net\r\n
    Connection: keep-alive\r\n
    Origin: http://v.youku.com\r\n
    User-Agent: Mozilla/5.0 (Windows NT 10.0; Win64; x64) AppleWebKit/537.36 (KHTML, like Gecko) Chrome/66.0.3359.139 Safari/537.36\r\n
    Accept: */*\r\n
    Referer: http://v.youku.com/v_show/id_XMjgyODY0NDgwOA==.html?spm=a2h0j.11185381.0.11185381\r\n
    Accept-Encoding: gzip, deflate\r\n
    Accept-Language: en-US,en;q=0.9,zh-TW;q=0.8,zh;q=0.7\r\n
    \r\n
    [Full request URI [truncated]: http://vali.cp31.ott.cibntv.net/696BE4850C39716A5D56562D/03000A010059C2D334B8C8000000017E7F784C-BAF8-ECA4-0150-694FEB7BA827.mp4.ts?ccode=0502&duration=66&expire=18000&psid=ed3fb292a12322f46c03132abf8a10bc&ups_]
    [HTTP request 1/37]
    [Response in frame: 43]
    [Next request in frame: 471]

No.     Time               Source                Destination           Protocol Length Info
     43 14:07:55.505720    222.22.29.84          10.210.66.82          HTTP     1494   HTTP/1.1 200 OK  (video/mp4)

Frame 43: 1494 bytes on wire (11952 bits), 1494 bytes captured (11952 bits) on interface 0
Ethernet II, Src: Hangzhou_d2:34:0d (3c:e5:a6:d2:34:0d), Dst: AsustekC_34:f3:aa (9c:5c:8e:34:f3:aa)
Internet Protocol Version 4, Src: 222.22.29.84, Dst: 10.210.66.82
Transmission Control Protocol, Src Port: 80 (80), Dst Port: 31468 (31468), Seq: 1, Ack: 823, Len: 1440
Hypertext Transfer Protocol
Media Type

No.     Time               Source                Destination           Protocol Length Info
    149 14:07:55.522730    222.22.29.84          10.210.66.82          HTTP     1494   Continuation

Frame 149: 1494 bytes on wire (11952 bits), 1494 bytes captured (11952 bits) on interface 0
Ethernet II, Src: Hangzhou_d2:34:0d (3c:e5:a6:d2:34:0d), Dst: AsustekC_34:f3:aa (9c:5c:8e:34:f3:aa)
Internet Protocol Version 4, Src: 222.22.29.84, Dst: 10.210.66.82
Transmission Control Protocol, Src Port: 80 (80), Dst Port: 31468 (31468), Seq: 133921, Ack: 823, Len: 1440
Hypertext Transfer Protocol
     [truncated]:V\016\221\002Y\t\315\242\371\271\306)o\323u)~\304\265\2646\3626l\364\230k\0269\260\243\377\314 \227\222\323;*\006k\226\274+\376D@\350\341\262\331H\000\220V\247\f\t\206\207S\316\370W\307\370x\224\315\251>\3157\217\203)C\2001Z0\
    Data (1063 bytes)

0000  76 64 6d 85 20 cb 3e 1f 03 12 11 f0 e4 c8 83 e4   vdm. .>.........
0010  4e 33 e4 85 1a 15 75 c1 7d b9 9f 57 43 91 f4 63   N3....u.}..WC..c
0020  f3 f4 a4 ef fe 79 e2 9c 00 a3 1a b7 96 d7 77 8d   .....y........w.
0030  8b 01 d8 b1 ff 10 10 77 56 7d 3a 5c b4 d8 da 28   .......wV}:\...(
0040  d9 bc 45 8b 5b d0 f4 91 7c 82 af 17 14 cf 43 83   ..E.[...|.....C.
0050  31 e7 b1 22 e6 14 6a 71 11 89 9a ec 99 dd 06 00   1.."..jq........
0060  b4 6d 6f 98 93 8f 89 03 34 b3 20 33 3d cc dd 2a   .mo.....4. 3=..*
0070  14 ce 9c 68 59 47 01 01 16 1e 2f db 38 e0 e0 1b   ...hYG..../.8...
0080  af 23 05 4c 20 b4 c4 82 7f a7 f6 93 a2 6c 90 d8   .#.L ........l..
0090  a1 10 74 73 3e f0 c6 00 f5 fe 15 c4 23 89 1f eb   ..ts>.......#...
00a0  71 20 f9 13 47 98 f7 c9 61 40 7d d5 b2 fe b8 37   q ..G...a@}....7
00b0  c5 87 2e 64 ca 87 0f 32 af 42 ff f1 05 8c 98 8d   ...d...2.B......
00c0  47 73 02 03 6d f4 e6 c6 27 fb 40 6d 95 08 7e 7f   Gs..m...'.@m..~.
00d0  0d c4 bc 86 96 9c 91 68 2e db db dd 1a 75 3e ee   .......h.....u>.
00e0  51 79 34 5c 63 fd 9c a4 c1 d5 54 d6 c1 50 a3 ef   Qy4\c.....T..P..
00f0  05 d6 96 7d b0 a8 d4 d7 5c 16 11 31 9e 2c 2d 2c   ...}....\..1.,-,
0100  64 76 4a c7 9c 2f 7e a1 aa 1a 7e 2f 22 8a 3e 89   dvJ../~...~/".>.
0110  04 c9 89 14 d9 f8 3f f5 77 d6 d6 a5 91 c6 41 eb   ......?.w.....A.
0120  52 5e 85 a8 52 10 88 2c 3f 43 8f 62 3e ec f8 58   R^..R..,?C.b>..X
0130  62 47 41 01 37 07 10 00 29 90 50 80 ef 00 00 01   bGA.7...).P.....
0140  e0 00 00 80 c0 0a 31 01 4f 5b 87 11 01 4d 9f c1   ......1.O[...M..
0150  93 8c 87 ef 8a b0 de 37 39 57 ae fd 62 e2 e0 bd   .......79W..b...
0160  a4 71 c1 ac 57 00 00 00 01 09 f0 00 00 00 01 41   .q..W..........A
0170  9b b3 34 a4 c1 27 fa 36 07 98 88 c0 94 f2 02 2c   ..4..'.6.......,
0180  08 07 16 11 bc b7 ae 54 de 50 ab 86 98 9f 23 97   .......T.P....#.
0190  b0 0b 50 fe f2 5e 16 d2 f2 b1 7a 1a b4 d9 21 bf   ..P..^....z...!.
01a0  0f 86 86 e6 15 e1 d7 cf db 07 c0 a5 0c 4d b9 44   .............M.D
01b0  8a bc b9 ff e6 17 13 74 1b ed 0f 13 3a 0b d2 c8   .......t....:...
01c0  be ee 42 00 05 e5 b6 44 cf 43 c1 e5 be 0a 8a b9   ..B....D.C......
01d0  e4 46 46 cc 2a a5 b2 39 62 b7 2a 1d ec ec 81 9b   .FF.*..9b.*.....
01e0  37 77 7a d2 83 3f c5 fb 85 56 de e7 5e 47 41 02   7wz..?...V..^GA.
01f0  1f 00 00 01 c0 02 e2 84 80 05 21 01 4d af a3 ff   ..........!.M...
0200  f1 50 80 17 9f fc 21 19 8f ff ff ff ff f3 d6 c6   .P....!.........
0210  42 12 05 a2 81 50 74 6c 1d 18 53 2d 52 e2 a8 d0   B....Ptl..S-R...
0220  56 90 51 2f 8a 9a b8 06 77 be 1b b5 fc 16 60 76   V.Q/....w.....`v
0230  31 53 dd 9c e7 3a 28 c5 96 7d 04 2d 1e d1 38 0c   1S...:(..}.-..8.
0240  80 00 29 ca 12 e9 74 0d 72 2a d7 49 45 1c 10 81   ..)...t.r*.IE...
0250  57 26 aa a0 b8 cc 0a 7c e1 cf 2d 35 10 b8 fd 09   W&.....|..-5....
0260  05 e8 f3 35 16 a4 d9 38 00 84 44 25 62 01 18 0b   ...5...8..D%b...
0270  25 ad 89 6d b6 16 0a f4 55 a2 9e d6 5b 9f b7 6e   %..m....U...[..n
0280  76 cb 2b f1 94 ca 2c 80 94 e8 96 0b aa c5 35 f3   v.+...,.......5.
0290  cd 9e 02 6c 3f 3d 69 af 74 05 55 f9 d5 f9 41 8c   ...l?=i.t.U...A.
02a0  c7 56 9b 97 af 0f 8b 49 10 47 01 02 10 4f 7e 5f   .V.....I.G...O~_
02b0  f8 da d0 35 a2 01 e8 c0 3a 37 7a f8 ad 5c 1c ff   ...5....:7z..\..
02c0  f1 50 80 16 ff fc 21 19 8f ff ff ff ff f4 50 b6   .P....!.......P.
02d0  7e 8e 09 a4 40 ac 81 cb a8 54 96 2a f6 81 48 5d   ~...@....T.*..H]
02e0  5d b5 03 a1 88 ae ce ce 79 9c 0a 86 61 71 62 1c   ].......y...aqb.
02f0  67 2f ab 68 07 45 d7 1c 91 d7 7c 89 3e ad 02 23   g/.h.E....|.>..#
0300  46 f9 1e b5 dd 71 69 56 a3 4c 71 b3 9c b5 57 33   F....qiV.Lq...W3
0310  96 6d 7c a9 55 79 c8 8b 71 44 50 d7 43 5c 85 05   .m|.Uy..qDP.C\..
0320  28 8c 5f 94 a8 95 15 d1 6c e4 ac 10 30 0e c5 5d   (._.....l...0..]
0330  3f 69 a7 18 06 63 a6 02 9b 15 81 b3 c6 25 14 64   ?i...c.......%.d
0340  5a 70 2b ea d0 d7 97 94 27 44 03 c4 82 7e ad 60   Zp+.....'D...~.`
0350  75 41 5b d8 e8 ef d0 64 87 10 f6 a0 9e 21 8e fc   uA[....d.....!..
0360  50 90 13 26 8c 47 01 02 11 29 cd 71 02 00 6f 68   P..&.G...).q..oh
0370  1a d1 81 34 80 17 84 97 6d 0e ff f1 50 80 17 5f   ...4....m...P.._
0380  fc 21 19 8f ff ff ff ff f3 d0 b6 6e 8a 85 a4 81   .!.........n....
0390  e8 cd f0 d8 ba b5 12 51 71 00 c2 a8 55 f5 2c 2f   .......Qq...U.,/
03a0  e3 fc d6 08 d7 55 45 6f 4f 74 5b 84 b7 39 02 0d   .....UEoOt[..9..
03b0  f0 da a0 ec ed 3b d6 21 a6 6c b5 a4 5f 24 97 5d   .....;.!.l.._$.]
03c0  d3 74 f4 3f 77 86 58 fc b0 05 ea e1 05 73 5f 02   .t.?w.X......s_.
03d0  e8 97 d5 04 11 34 f3 11 eb 7b ae d0 49 e7 06 1a   .....4...{..I...
03e0  e1 a3 67 ae 96 af e2 ff 3d f0 b4 74 d9 27 8c a5   ..g.....=..t.'..
03f0  1d b7 15 80 0a b9 6b 5f 72 99 57 4f 2d 09 0c e2   ......k_r.WO-...
0400  f1 52 19 04 bd 82 75 89 33 80 89 8d 04 2b 18 74   .R....u.3....+.t
0410  22 35 1b d1 9f 52 24 ca 00 10 d8 bc 4d 19 36 97   "5...R$.....M.6.
0420  e9 47 01 01 18 fc bd                              .G.....

No.     Time               Source                Destination           Protocol Length Info
    178 14:07:55.526010    222.22.29.84          10.210.66.82          HTTP     1494   Continuation

Frame 178: 1494 bytes on wire (11952 bits), 1494 bytes captured (11952 bits) on interface 0
Ethernet II, Src: Hangzhou_d2:34:0d (3c:e5:a6:d2:34:0d), Dst: AsustekC_34:f3:aa (9c:5c:8e:34:f3:aa)
Internet Protocol Version 4, Src: 222.22.29.84, Dst: 10.210.66.82
Transmission Control Protocol, Src Port: 80 (80), Dst Port: 31468 (31468), Seq: 169921, Ack: 823, Len: 1440
Hypertext Transfer Protocol
    :\(~\361f~A@\000#\213\373t\332@\267\340\254sh\376\003\265\020,G\001\001\024\233\356\343R\234\324y\216a\351#\270\213\2079*\342\374\272\236\222\254\310\333t\355FA\314\316\203S+\225\337e\307\365}\n
    Data (1370 bytes)

0000  97 56 81 1e f1 31 04 b9 c1 c8 fc 2d bc 68 70 fb   .V...1.....-.hp.
0010  70 25 20 9c 42 21 b4 ed fa 4e c2 d2 95 9b 06 d4   p% .B!...N......
0020  31 18 c5 18 95 e2 67 9f af 75 c5 e3 a5 61 02 6f   1.....g..u...a.o
0030  8d c3 cc 6a 77 ae 71 af 09 d5 ed f8 8b eb d7 a9   ...jw.q.........
0040  34 e7 a4 aa 0e 7a 02 aa 0d 41 9c 84 4a 5a f5 24   4....z...A..JZ.$
0050  7c 56 7d 95 94 53 0e d9 e5 3a ea 03 15 4b ff 30   |V}..S...:...K.0
0060  1e 50 1d 2b ed 01 58 31 7c 6d b1 f3 e2 07 3c 1b   .P.+..X1|m....<.
0070  d7 38 2e 7c 65 08 ce e2 0f c0 9f 98 1d eb 46 d9   .8.|e.........F.
0080  9b ba b5 69 d4 5b 39 76 86 d5 86 57 14 fb 6f 48   ...i.[9v...W..oH
0090  47 01 01 15 3a a7 31 0c c9 36 0f ae c1 60 b2 ba   G...:.1..6...`..
00a0  44 95 ac 77 ea 22 9d a5 ff 4c 94 77 90 58 76 1d   D..w."...L.w.Xv.
00b0  ed 14 ba 5c 0e 50 94 51 d5 6c 5b ed 2a ba fe 43   ...\.P.Q.l[.*..C
00c0  67 bc ee 0c 30 f7 e7 0b 38 c4 3b 2e 56 05 20 86   g...0...8.;.V. .
00d0  a0 17 46 1a 82 52 34 da 8b f8 8a de de a7 97 22   ..F..R4........"
00e0  98 3f fe de 6b ad 19 00 c3 fc 81 6b 2b 35 4b bc   .?..k......k+5K.
00f0  dd de 25 4a 4c 6d 85 48 1c 7e c8 8d d5 13 b9 e2   ..%JLm.H.~......
0100  55 35 55 2e c8 93 f3 d4 56 ea 24 ca 10 46 2e e4   U5U.....V.$..F..
0110  cd dc ff 57 ba 63 5f 71 0a ca 47 54 4f bc bc 3c   ...W.c_q..GTO..<
0120  2f 70 a2 a1 b0 eb be 7a ad a2 fe 1e 92 be 2a 17   /p.....z......*.
0130  f3 dd 8a 49 37 32 b1 72 57 87 45 64 1b 8c 23 2b   ...I72.rW.Ed..#+
0140  21 73 23 e0 e1 69 1e 8c 12 89 8e 05 47 01 01 16   !s#..i......G...
0150  42 90 51 d6 cb a6 9e 63 de d1 69 c4 67 11 4c 4d   B.Q....c..i.g.LM
0160  03 e7 95 e2 19 51 86 ba f5 e8 dc b5 1d d7 67 ac   .....Q........g.
0170  fa 39 1f cc e5 2a e7 4a 4b 45 aa b9 16 7a 2a 93   .9...*.JKE...z*.
0180  a0 ee 67 66 d8 91 45 45 c5 c8 60 d8 ef dc dd 82   ..gf..EE..`.....
0190  ed 4d 37 60 ea 6b ad 25 1c ea 03 f1 c7 d7 b8 a3   .M7`.k.%........
01a0  21 81 e6 13 92 65 b8 31 57 a6 20 ff 2d 0b cd fa   !....e.1W. .-...
01b0  7f 7d 51 41 4c af 1c 4e 8c 47 11 0c d8 c2 2e b8   .}QAL..N.G......
01c0  0b c0 b0 ff 9d ca 8c 9b fa 77 19 a1 22 de d4 19   .........w.."...
01d0  d0 5e 81 3f 7b 60 f8 fc 22 6b 9e de b3 c7 81 5b   .^.?{`.."k.....[
01e0  f8 dc 5d 77 ce 99 9b 28 73 ed bb 80 e4 f6 14 67   ..]w...(s......g
01f0  94 9b 91 7d dd fe 9d 21 bb ba e1 b3 8f 39 47 19   ...}...!.....9G.
0200  2f 6a de ff ac 48 30 03 47 01 01 17 12 f7 36 f2   /j...H0.G.....6.
0210  2a f3 26 5c a4 bf d8 ad 3c 6b 57 07 71 0d b7 b1   *.&\....<kW.q...
0220  4d b5 14 d4 b7 66 f5 8d a7 84 41 cc 7e 7e b3 23   M....f....A.~~.#
0230  fc 1a 83 44 cf 21 16 2d cd da 71 53 70 7f 3c 9a   ...D.!.-..qSp.<.
0240  cc 70 78 6d 53 ff 96 c1 a4 cf e1 b9 80 44 8d 93   .pxmS........D..
0250  be b0 29 6e 25 2b f1 d0 1c 5b 56 bc bb 47 9f 8d   ..)n%+...[V..G..
0260  01 a8 ef fd d3 37 b7 38 98 09 8c 83 b8 98 1c 50   .....7.8.......P
0270  40 c7 dd 58 5f 8d 9d 2c 16 ed 34 de fb ca 20 88   @..X_..,..4... .
0280  09 4b 58 69 ed 3f 8e 1c b6 f9 c6 92 3e a5 77 9a   .KXi.?......>.w.
0290  48 5b b3 55 68 d8 36 3f 03 60 d5 df f2 07 6c 4a   H[.Uh.6?.`....lJ
02a0  32 2c 5f 52 42 1f 4c f0 21 2c 0c f6 2d f7 b2 89   2,_RB.L.!,..-...
02b0  a1 d0 2f e6 92 7b 39 4c 12 ce 24 67 d3 d5 f9 04   ../..{9L..$g....
02c0  51 65 16 1d 47 41 01 38 07 10 00 2a 27 05 81 10   Qe..GA.8...*'...
02d0  00 00 01 e0 00 00 80 c0 0a 31 01 53 30 81 11 01   .........1.S0...
02e0  53 01 67 12 e7 86 50 db c4 ae 1f 8d 00 00 00 01   S.g...P.........
02f0  09 f0 00 00 00 01 01 9e dd 45 7f cd ce da f2 13   .........E......
0300  77 7e c7 14 b8 3c 38 29 65 0c b4 ef 80 00 e4 95   w~...<8)e.......
0310  c2 52 4d ee 42 fe 2d 53 64 c5 9b 0d 88 7a 92 9c   .RM.B.-Sd....z..
0320  f8 08 50 5d a2 4e 3e 05 e0 6a 92 28 02 b9 93 d5   ..P].N>..j.(....
0330  22 16 3b af 20 ae 60 a3 4b c9 c8 5a ac da 56 db   ".;. .`.K..Z..V.
0340  df ac 6a 4e fd 76 9e 07 f9 28 33 b9 af e2 f7 23   ..jN.v...(3....#
0350  67 52 9c f3 82 2e 30 e8 db 1d 77 85 eb e3 6e 9d   gR....0...w...n.
0360  24 20 bd ad f4 c8 84 23 89 81 cf c1 91 aa 45 83   $ .....#......E.
0370  ba f7 4b bf 62 32 bd 6d a4 06 92 92 02 22 6d af   ..K.b2.m....."m.
0380  47 01 02 1e 8a 40 33 1c 30 12 19 c5 ce 93 5d 57   G....@3.0.....]W
0390  ef 40 b1 5b 53 10 80 a3 ad 08 60 0d ac 0a 0b 56   .@.[S.....`....V
03a0  55 ac 2c e8 52 11 82 f0 00 1b d8 76 bd 8f bb 79   U.,.R......v...y
03b0  ed 10 05 80 7c e3 07 ff f1 50 80 17 9f fc 21 19   ....|....P....!.
03c0  8f ff ff ff ff f2 b6 7a 6c 13 50 84 51 08 b1 2c   .......zl.P.Q..,
03d0  29 5a 56 a1 f9 6c e3 3a 9a 94 03 76 09 98 30 60   )ZV..l.:...v..0`
03e0  fe 4b 06 47 d6 a5 c3 c7 38 dc e7 59 9a 98 de 1b   .K.G....8..Y....
03f0  a1 5b 9d 73 2c de 7d 25 95 cb 6c 84 83 a1 ce 03   .[.s,.}%..l.....
0400  8e 92 d3 a5 59 6d af e8 70 f0 44 95 56 81 82 80   ....Ym..p.D.V...
0410  77 55 4c d8 12 e0 81 42 15 83 f4 c4 cd 1a 3c 30   wUL....B......<0
0420  22 57 0b ad 78 cc 35 a8 12 3a 92 5e 7c 2e bb 9e   "W..x.5..:.^|...
0430  38 80 cb 40 04 54 6c 5c d3 d8 66 3d 47 01 02 1f   8..@.Tl\..f=G...
0440  24 68 47 5c 17 45 0b 5b e6 a4 d1 fd 47 43 da 97   $hG\.E.[....GC..
0450  a6 b2 71 2a 04 a5 5d f3 53 35 94 d3 6c cf 98 c5   ..q*..].S5..l...
0460  cd 6b 1d 5e 1a ad 6c 0c 25 51 ad cc 6d 60 18 d4   .k.^..l.%Q..m`..
0470  01 9c 36 ce 33 a8 38 ff f1 50 80 16 9f fc 21 19   ..6.3.8..P....!.
0480  8f ff ff ff ff f3 54 b8 76 89 83 a2 41 08 74 66   ......T.v...A.tf
0490  25 6a af 46 f8 22 58 85 68 f6 b4 a1 f1 25 02 0f   %j.F."X.h....%..
04a0  b8 14 b9 a7 15 ea 3a 45 49 9f 95 d4 af 2a b7 87   ......:EI....*..
04b0  b9 63 43 af ef d2 82 b2 57 d9 3e 5c 5a 5f 29 f5   .cC.....W.>\Z_).
04c0  53 71 2f d3 b6 45 53 e9 ec a3 fb 52 af be 57 85   Sq/..ES....R..W.
04d0  42 9d ca 10 c5 9f 41 7a fc 2c e8 68 a6 c0 18 b9   B.....Az.,.h....
04e0  5b 50 9a e9 18 40 02 26 ad ce 73 07 7a 3a df c8   [P...@.&..s.z:..
04f0  6e 7a 26 a7 7a 7d 53 c0 47 01 02 30 84 00 ff ff   nz&.z}S.G..0....
0500  ff ff ff ff ff ff ff ff ff ff ff ff ff ff ff ff   ................
0510  ff ff ff ff ff ff ff ff ff ff ff ff ff ff ff ff   ................
0520  ff ff ff ff ff ff ff ff ff ff ff ff ff ff ff ff   ................
0530  ff ff ff ff ff ff ff ff ff ff ff ff ff ff ff ff   ................
0540  ff ff ff ff ff ff ff ff ff ff ff ff ff ff ff ff   ................
0550  ff ff ff ff ff ff ff ff ff ff                     ..........

No.     Time               Source                Destination           Protocol Length Info
    383 14:07:57.662510    10.210.66.82          140.205.94.19         HTTP     892    GET /yt/vp.vtslog?version=0.5.44&vid=707161202&uid=&type=h5&cf=0&cpt=39&full=0&pc=0&clb=0&playersid=15266524370371cdpp70he6g2VPzyNRzfQVv&abtest=b&sn=8&pt=40&hi=5&vvid=ed3fb292a12322f46c03132abf8a10bc&lang=1&r=1046733652&cna=WnjsEmreO3oCAd7TtqYtFE7Z&speed=1 HTTP/1.1 

Frame 383: 892 bytes on wire (7136 bits), 892 bytes captured (7136 bits) on interface 0
Ethernet II, Src: AsustekC_34:f3:aa (9c:5c:8e:34:f3:aa), Dst: Hangzhou_d2:34:0d (3c:e5:a6:d2:34:0d)
Internet Protocol Version 4, Src: 10.210.66.82, Dst: 140.205.94.19
Transmission Control Protocol, Src Port: 31679 (31679), Dst Port: 80 (80), Seq: 839, Ack: 320, Len: 838
Hypertext Transfer Protocol
     [truncated]GET /yt/vp.vtslog?version=0.5.44&vid=707161202&uid=&type=h5&cf=0&cpt=39&full=0&pc=0&clb=0&playersid=15266524370371cdpp70he6g2VPzyNRzfQVv&abtest=b&sn=8&pt=40&hi=5&vvid=ed3fb292a12322f46c03132abf8a10bc&lang=1&r=1046733652&cna=Wnj
    Host: yt.mmstat.com\r\n
    Connection: keep-alive\r\n
    User-Agent: Mozilla/5.0 (Windows NT 10.0; Win64; x64) AppleWebKit/537.36 (KHTML, like Gecko) Chrome/66.0.3359.139 Safari/537.36\r\n
    Accept: image/webp,image/apng,image/*,*/*;q=0.8\r\n
    Referer: http://v.youku.com/v_show/id_XMjgyODY0NDgwOA==.html?spm=a2h0j.11185381.0.11185381\r\n
    Accept-Encoding: gzip, deflate\r\n
    Accept-Language: en-US,en;q=0.9,zh-TW;q=0.8,zh;q=0.7\r\n
    Cookie: cna=WnjsEmreO3oCAd7TtqYtFE7Z; sca=57c7c60f; yunpk=1235994412436795; tbsa=5cef25164a63168536774494_1522742466_2; atpsida=4efe74594bbbcce4b63c6504_1526652423_10\r\n
    \r\n
    [Full request URI [truncated]: http://yt.mmstat.com/yt/vp.vtslog?version=0.5.44&vid=707161202&uid=&type=h5&cf=0&cpt=39&full=0&pc=0&clb=0&playersid=15266524370371cdpp70he6g2VPzyNRzfQVv&abtest=b&sn=8&pt=40&hi=5&vvid=ed3fb292a12322f46c03132abf]
    [HTTP request 2/3]
    [Prev request in frame: 31]
    [Response in frame: 402]
    [Next request in frame: 455]

No.     Time               Source                Destination           Protocol Length Info
    402 14:07:57.689395    140.205.94.19         10.210.66.82          HTTP     373    HTTP/1.1 200 OK  (GIF89a)

Frame 402: 373 bytes on wire (2984 bits), 373 bytes captured (2984 bits) on interface 0
Ethernet II, Src: Hangzhou_d2:34:0d (3c:e5:a6:d2:34:0d), Dst: AsustekC_34:f3:aa (9c:5c:8e:34:f3:aa)
Internet Protocol Version 4, Src: 140.205.94.19, Dst: 10.210.66.82
Transmission Control Protocol, Src Port: 80 (80), Dst Port: 31679 (31679), Seq: 320, Ack: 1677, Len: 319
Hypertext Transfer Protocol
    HTTP/1.1 200 OK\r\n
    Date: Fri, 18 May 2018 14:07:46 GMT\r\n
    Content-Type: image/gif\r\n
    Content-Length: 43\r\n
    Connection: keep-alive\r\n
    P3P: CP="NOI DSP COR CURa ADMa DEVa PSAa PSDa OUR IND UNI PUR NAV"\r\n
    Expires: Thu, 01 Jan 1970 00:00:01 GMT\r\n
    Cache-Control: no-cache\r\n
    Pragma: no-cache\r\n
    \r\n
    [HTTP response 2/3]
    [Time since request: 0.026885000 seconds]
    [Prev request in frame: 31]
    [Prev response in frame: 35]
    [Request in frame: 383]
    [Next request in frame: 455]
Compuserve GIF, Version: GIF89a

No.     Time               Source                Destination           Protocol Length Info
    455 14:08:02.674374    10.210.66.82          140.205.94.19         HTTP     892    GET /yt/vp.vtslog?version=0.5.44&vid=707161202&uid=&type=h5&cf=0&cpt=44&full=0&pc=0&clb=0&playersid=15266524370371cdpp70he6g2VPzyNRzfQVv&abtest=b&sn=9&pt=45&hi=5&vvid=ed3fb292a12322f46c03132abf8a10bc&lang=1&r=1049755134&cna=WnjsEmreO3oCAd7TtqYtFE7Z&speed=1 HTTP/1.1 

Frame 455: 892 bytes on wire (7136 bits), 892 bytes captured (7136 bits) on interface 0
Ethernet II, Src: AsustekC_34:f3:aa (9c:5c:8e:34:f3:aa), Dst: Hangzhou_d2:34:0d (3c:e5:a6:d2:34:0d)
Internet Protocol Version 4, Src: 10.210.66.82, Dst: 140.205.94.19
Transmission Control Protocol, Src Port: 31679 (31679), Dst Port: 80 (80), Seq: 1677, Ack: 639, Len: 838
Hypertext Transfer Protocol
     [truncated]GET /yt/vp.vtslog?version=0.5.44&vid=707161202&uid=&type=h5&cf=0&cpt=44&full=0&pc=0&clb=0&playersid=15266524370371cdpp70he6g2VPzyNRzfQVv&abtest=b&sn=9&pt=45&hi=5&vvid=ed3fb292a12322f46c03132abf8a10bc&lang=1&r=1049755134&cna=Wnj
    Host: yt.mmstat.com\r\n
    Connection: keep-alive\r\n
    User-Agent: Mozilla/5.0 (Windows NT 10.0; Win64; x64) AppleWebKit/537.36 (KHTML, like Gecko) Chrome/66.0.3359.139 Safari/537.36\r\n
    Accept: image/webp,image/apng,image/*,*/*;q=0.8\r\n
    Referer: http://v.youku.com/v_show/id_XMjgyODY0NDgwOA==.html?spm=a2h0j.11185381.0.11185381\r\n
    Accept-Encoding: gzip, deflate\r\n
    Accept-Language: en-US,en;q=0.9,zh-TW;q=0.8,zh;q=0.7\r\n
    Cookie: cna=WnjsEmreO3oCAd7TtqYtFE7Z; sca=57c7c60f; yunpk=1235994412436795; tbsa=5cef25164a63168536774494_1522742466_2; atpsida=4efe74594bbbcce4b63c6504_1526652423_10\r\n
    \r\n
    [Full request URI [truncated]: http://yt.mmstat.com/yt/vp.vtslog?version=0.5.44&vid=707161202&uid=&type=h5&cf=0&cpt=44&full=0&pc=0&clb=0&playersid=15266524370371cdpp70he6g2VPzyNRzfQVv&abtest=b&sn=9&pt=45&hi=5&vvid=ed3fb292a12322f46c03132abf]
    [HTTP request 3/3]
    [Prev request in frame: 383]

No.     Time               Source                Destination           Protocol Length Info
    465 14:08:02.712056    10.210.66.82          140.205.94.19         HTTP     892    GET /yt/vp.vtslog?version=0.5.44&vid=707161202&uid=&type=h5&cf=0&cpt=44&full=0&pc=0&clb=0&playersid=15266524370371cdpp70he6g2VPzyNRzfQVv&abtest=b&sn=9&pt=45&hi=5&vvid=ed3fb292a12322f46c03132abf8a10bc&lang=1&r=1049755134&cna=WnjsEmreO3oCAd7TtqYtFE7Z&speed=1 HTTP/1.1 

Frame 465: 892 bytes on wire (7136 bits), 892 bytes captured (7136 bits) on interface 0
Ethernet II, Src: AsustekC_34:f3:aa (9c:5c:8e:34:f3:aa), Dst: Hangzhou_d2:34:0d (3c:e5:a6:d2:34:0d)
Internet Protocol Version 4, Src: 10.210.66.82, Dst: 140.205.94.19
Transmission Control Protocol, Src Port: 31682 (31682), Dst Port: 80 (80), Seq: 1, Ack: 1, Len: 838
Hypertext Transfer Protocol
     [truncated]GET /yt/vp.vtslog?version=0.5.44&vid=707161202&uid=&type=h5&cf=0&cpt=44&full=0&pc=0&clb=0&playersid=15266524370371cdpp70he6g2VPzyNRzfQVv&abtest=b&sn=9&pt=45&hi=5&vvid=ed3fb292a12322f46c03132abf8a10bc&lang=1&r=1049755134&cna=Wnj
    Host: yt.mmstat.com\r\n
    Connection: keep-alive\r\n
    User-Agent: Mozilla/5.0 (Windows NT 10.0; Win64; x64) AppleWebKit/537.36 (KHTML, like Gecko) Chrome/66.0.3359.139 Safari/537.36\r\n
    Accept: image/webp,image/apng,image/*,*/*;q=0.8\r\n
    Referer: http://v.youku.com/v_show/id_XMjgyODY0NDgwOA==.html?spm=a2h0j.11185381.0.11185381\r\n
    Accept-Encoding: gzip, deflate\r\n
    Accept-Language: en-US,en;q=0.9,zh-TW;q=0.8,zh;q=0.7\r\n
    Cookie: cna=WnjsEmreO3oCAd7TtqYtFE7Z; sca=57c7c60f; yunpk=1235994412436795; tbsa=5cef25164a63168536774494_1522742466_2; atpsida=4efe74594bbbcce4b63c6504_1526652423_10\r\n
    \r\n
    [Full request URI [truncated]: http://yt.mmstat.com/yt/vp.vtslog?version=0.5.44&vid=707161202&uid=&type=h5&cf=0&cpt=44&full=0&pc=0&clb=0&playersid=15266524370371cdpp70he6g2VPzyNRzfQVv&abtest=b&sn=9&pt=45&hi=5&vvid=ed3fb292a12322f46c03132abf]
    [HTTP request 1/3]
    [Response in frame: 467]
    [Next request in frame: 747]

No.     Time               Source                Destination           Protocol Length Info
    467 14:08:02.737362    140.205.94.19         10.210.66.82          HTTP     373    HTTP/1.1 200 OK  (GIF89a)

Frame 467: 373 bytes on wire (2984 bits), 373 bytes captured (2984 bits) on interface 0
Ethernet II, Src: Hangzhou_d2:34:0d (3c:e5:a6:d2:34:0d), Dst: AsustekC_34:f3:aa (9c:5c:8e:34:f3:aa)
Internet Protocol Version 4, Src: 140.205.94.19, Dst: 10.210.66.82
Transmission Control Protocol, Src Port: 80 (80), Dst Port: 31682 (31682), Seq: 1, Ack: 839, Len: 319
Hypertext Transfer Protocol
    HTTP/1.1 200 OK\r\n
    Date: Fri, 18 May 2018 14:07:51 GMT\r\n
    Content-Type: image/gif\r\n
    Content-Length: 43\r\n
    Connection: keep-alive\r\n
    P3P: CP="NOI DSP COR CURa ADMa DEVa PSAa PSDa OUR IND UNI PUR NAV"\r\n
    Expires: Thu, 01 Jan 1970 00:00:01 GMT\r\n
    Cache-Control: no-cache\r\n
    Pragma: no-cache\r\n
    \r\n
    [HTTP response 1/3]
    [Time since request: 0.025306000 seconds]
    [Request in frame: 465]
    [Next request in frame: 747]
    [Next response in frame: 748]
Compuserve GIF, Version: GIF89a

No.     Time               Source                Destination           Protocol Length Info
    471 14:08:04.159743    10.210.66.82          222.22.29.84          HTTP     878    GET /696BE4850C39716A5D56562D/03000A010059C2D334B8C8000000017E7F784C-BAF8-ECA4-0150-694FEB7BA827.mp4.ts?ccode=0502&duration=66&expire=18000&psid=ed3fb292a12322f46c03132abf8a10bc&ups_client_netip=6a78ce92&ups_ts=1526652426&ups_userid=&utid=WnjsEmreO3oCAd7TtqYtFE7Z&vid=XMjgyODY0NDgwOA%3D%3D&s=13acada89b2c11e6bdbb&vkey=Ae819eb6c6e53ee832052f9db28466c16&ts_start=55.967&ts_end=66.366&ts_seg_no=7&ts_keyframe=1 HTTP/1.1 

Frame 471: 878 bytes on wire (7024 bits), 878 bytes captured (7024 bits) on interface 0
Ethernet II, Src: AsustekC_34:f3:aa (9c:5c:8e:34:f3:aa), Dst: Hangzhou_d2:34:0d (3c:e5:a6:d2:34:0d)
Internet Protocol Version 4, Src: 10.210.66.82, Dst: 222.22.29.84
Transmission Control Protocol, Src Port: 31468 (31468), Dst Port: 80 (80), Seq: 823, Ack: 353059, Len: 824
Hypertext Transfer Protocol
     [truncated]GET /696BE4850C39716A5D56562D/03000A010059C2D334B8C8000000017E7F784C-BAF8-ECA4-0150-694FEB7BA827.mp4.ts?ccode=0502&duration=66&expire=18000&psid=ed3fb292a12322f46c03132abf8a10bc&ups_client_netip=6a78ce92&ups_ts=1526652426&ups_u
    Host: vali.cp31.ott.cibntv.net\r\n
    Connection: keep-alive\r\n
    Origin: http://v.youku.com\r\n
    User-Agent: Mozilla/5.0 (Windows NT 10.0; Win64; x64) AppleWebKit/537.36 (KHTML, like Gecko) Chrome/66.0.3359.139 Safari/537.36\r\n
    Accept: */*\r\n
    Referer: http://v.youku.com/v_show/id_XMjgyODY0NDgwOA==.html?spm=a2h0j.11185381.0.11185381\r\n
    Accept-Encoding: gzip, deflate\r\n
    Accept-Language: en-US,en;q=0.9,zh-TW;q=0.8,zh;q=0.7\r\n
    \r\n
    [Full request URI [truncated]: http://vali.cp31.ott.cibntv.net/696BE4850C39716A5D56562D/03000A010059C2D334B8C8000000017E7F784C-BAF8-ECA4-0150-694FEB7BA827.mp4.ts?ccode=0502&duration=66&expire=18000&psid=ed3fb292a12322f46c03132abf8a10bc&ups_]
    [HTTP request 2/37]
    [Prev request in frame: 40]
    [Response in frame: 473]
    [Next request in frame: 1893]

No.     Time               Source                Destination           Protocol Length Info
    473 14:08:04.223142    222.22.29.84          10.210.66.82          HTTP     1494   HTTP/1.1 200 OK  (video/mp4)

Frame 473: 1494 bytes on wire (11952 bits), 1494 bytes captured (11952 bits) on interface 0
Ethernet II, Src: Hangzhou_d2:34:0d (3c:e5:a6:d2:34:0d), Dst: AsustekC_34:f3:aa (9c:5c:8e:34:f3:aa)
Internet Protocol Version 4, Src: 222.22.29.84, Dst: 10.210.66.82
Transmission Control Protocol, Src Port: 80 (80), Dst Port: 31468 (31468), Seq: 353059, Ack: 1647, Len: 1440
Hypertext Transfer Protocol
Media Type

No.     Time               Source                Destination           Protocol Length Info
    743 14:08:06.695707    10.210.66.82          121.194.7.222         HTTP     470    GET /api/data/v2/0a3ffc1f4a8b455a9d7421d6d90ecefb.js?t=1526652486691&callback=hangMarkCallkack HTTP/1.1 

Frame 743: 470 bytes on wire (3760 bits), 470 bytes captured (3760 bits) on interface 0
Ethernet II, Src: AsustekC_34:f3:aa (9c:5c:8e:34:f3:aa), Dst: Hangzhou_d2:34:0d (3c:e5:a6:d2:34:0d)
Internet Protocol Version 4, Src: 10.210.66.82, Dst: 121.194.7.222
Transmission Control Protocol, Src Port: 31229 (31229), Dst Port: 80 (80), Seq: 1, Ack: 1, Len: 416
Hypertext Transfer Protocol
    GET /api/data/v2/0a3ffc1f4a8b455a9d7421d6d90ecefb.js?t=1526652486691&callback=hangMarkCallkack HTTP/1.1\r\n
    Host: hudong.alicdn.com\r\n
    Connection: keep-alive\r\n
    User-Agent: Mozilla/5.0 (Windows NT 10.0; Win64; x64) AppleWebKit/537.36 (KHTML, like Gecko) Chrome/66.0.3359.139 Safari/537.36\r\n
    Accept: */*\r\n
    Referer: http://www.youku.com/\r\n
    Accept-Encoding: gzip, deflate\r\n
    Accept-Language: en-US,en;q=0.9,zh-TW;q=0.8,zh;q=0.7\r\n
    \r\n
    [Full request URI: http://hudong.alicdn.com/api/data/v2/0a3ffc1f4a8b455a9d7421d6d90ecefb.js?t=1526652486691&callback=hangMarkCallkack]
    [HTTP request 1/59]
    [Response in frame: 744]
    [Next request in frame: 813]

No.     Time               Source                Destination           Protocol Length Info
    744 14:08:06.697123    121.194.7.222         10.210.66.82          HTTP     939    HTTP/1.1 200 OK  (application/json)

Frame 744: 939 bytes on wire (7512 bits), 939 bytes captured (7512 bits) on interface 0
Ethernet II, Src: Hangzhou_d2:34:0d (3c:e5:a6:d2:34:0d), Dst: AsustekC_34:f3:aa (9c:5c:8e:34:f3:aa)
Internet Protocol Version 4, Src: 121.194.7.222, Dst: 10.210.66.82
Transmission Control Protocol, Src Port: 80 (80), Dst Port: 31229 (31229), Seq: 1, Ack: 417, Len: 885
Hypertext Transfer Protocol
    HTTP/1.1 200 OK\r\n
    Server: Tengine\r\n
    Content-Type: application/json;charset=UTF-8\r\n
    Content-Length: 235\r\n
    Connection: keep-alive\r\n
    Date: Fri, 18 May 2018 14:04:31 GMT\r\n
    Last-Modified: Fri, 18 May 2018 14:04:31 GMT\r\n
    Cache-Control: max-age=120, s-maxage=300\r\n
    Security-Checksum: d2b7190d607bcf220618a0ebeaf4fa80\r\n
    Content-Language: zh-CN\r\n
    Via: cache43.l2nu17-1[0,200-0,H], cache41.l2nu17-1[3,0], cache7.cn17[0,200-0,H], cache1.cn17[0,0]\r\n
    Age: 204\r\n
    X-Cache: HIT TCP_MEM_HIT dirn:-2:-2 mlen:-1\r\n
    X-Swift-SaveTime: Fri, 18 May 2018 14:06:30 GMT\r\n
    X-Swift-CacheTime: 181\r\n
    Access-Control-Allow-Origin: *\r\n
    Timing-Allow-Origin: *\r\n
    EagleId: 79c207c915266524758151666e\r\n
    \r\n
    [HTTP response 1/59]
    [Time since request: 0.001416000 seconds]
    [Request in frame: 743]
    [Next request in frame: 813]
    [Next response in frame: 814]
JavaScript Object Notation: application/json
Line-based text data: application/json

No.     Time               Source                Destination           Protocol Length Info
    747 14:08:07.688091    10.210.66.82          140.205.94.19         HTTP     893    GET /yt/vp.vtslog?version=0.5.44&vid=707161202&uid=&type=h5&cf=0&cpt=49&full=0&pc=0&clb=0&playersid=15266524370371cdpp70he6g2VPzyNRzfQVv&abtest=b&sn=10&pt=50&hi=5&vvid=ed3fb292a12322f46c03132abf8a10bc&lang=1&r=5156634733&cna=WnjsEmreO3oCAd7TtqYtFE7Z&speed=1 HTTP/1.1 

Frame 747: 893 bytes on wire (7144 bits), 893 bytes captured (7144 bits) on interface 0
Ethernet II, Src: AsustekC_34:f3:aa (9c:5c:8e:34:f3:aa), Dst: Hangzhou_d2:34:0d (3c:e5:a6:d2:34:0d)
Internet Protocol Version 4, Src: 10.210.66.82, Dst: 140.205.94.19
Transmission Control Protocol, Src Port: 31682 (31682), Dst Port: 80 (80), Seq: 839, Ack: 320, Len: 839
Hypertext Transfer Protocol
     [truncated]GET /yt/vp.vtslog?version=0.5.44&vid=707161202&uid=&type=h5&cf=0&cpt=49&full=0&pc=0&clb=0&playersid=15266524370371cdpp70he6g2VPzyNRzfQVv&abtest=b&sn=10&pt=50&hi=5&vvid=ed3fb292a12322f46c03132abf8a10bc&lang=1&r=5156634733&cna=Wn
    Host: yt.mmstat.com\r\n
    Connection: keep-alive\r\n
    User-Agent: Mozilla/5.0 (Windows NT 10.0; Win64; x64) AppleWebKit/537.36 (KHTML, like Gecko) Chrome/66.0.3359.139 Safari/537.36\r\n
    Accept: image/webp,image/apng,image/*,*/*;q=0.8\r\n
    Referer: http://v.youku.com/v_show/id_XMjgyODY0NDgwOA==.html?spm=a2h0j.11185381.0.11185381\r\n
    Accept-Encoding: gzip, deflate\r\n
    Accept-Language: en-US,en;q=0.9,zh-TW;q=0.8,zh;q=0.7\r\n
    Cookie: cna=WnjsEmreO3oCAd7TtqYtFE7Z; sca=57c7c60f; yunpk=1235994412436795; tbsa=5cef25164a63168536774494_1522742466_2; atpsida=4efe74594bbbcce4b63c6504_1526652423_10\r\n
    \r\n
    [Full request URI [truncated]: http://yt.mmstat.com/yt/vp.vtslog?version=0.5.44&vid=707161202&uid=&type=h5&cf=0&cpt=49&full=0&pc=0&clb=0&playersid=15266524370371cdpp70he6g2VPzyNRzfQVv&abtest=b&sn=10&pt=50&hi=5&vvid=ed3fb292a12322f46c03132ab]
    [HTTP request 2/3]
    [Prev request in frame: 465]
    [Response in frame: 748]
    [Next request in frame: 783]

