No.     Time               Source                Destination           Protocol Length Info
     31 13:55:45.604111    10.210.66.82          140.205.94.22         HTTP     1146   GET /yt/preclk?eid=2&pid=1cdpo5q6pa04&cid=dz-1-00-NaN-707195416&uid=0&juid=01cbiuiidj293o&sid=01cdpn91of2tqo&sw=1366&sh=768&bw=1349&bh=662&bx=-570&by=470&px=-570&py=530&pc=%23ykPlayer~5~5!2~5!2~5~10&url=http%3A%2F%2Fv.youku.com%2Fv_show%2Fid_XMjgyODc4MTY2NA%3D%3D.html%3Ffrom%3Dy1.2-1-97.4.1-1.1-1-2-0-0%2526source%253Dautoclick&rurl=http%3A%2F%2Fv.youku.com%2Fv_show%2Fid_XMjgyODY4NTY0NA%3D%3D.html%3Ffrom%3Dy1.2-1-97.4.1-1.1-1-2-0-0%2526source%253Dautoclick&ext=undefined&r=1526651745566 HTTP/1.1 

Frame 31: 1146 bytes on wire (9168 bits), 1146 bytes captured (9168 bits) on interface 0
Ethernet II, Src: AsustekC_34:f3:aa (9c:5c:8e:34:f3:aa), Dst: Hangzhou_d2:34:0d (3c:e5:a6:d2:34:0d)
Internet Protocol Version 4, Src: 10.210.66.82, Dst: 140.205.94.22
Transmission Control Protocol, Src Port: 31083 (31083), Dst Port: 80 (80), Seq: 1, Ack: 1, Len: 1092
Hypertext Transfer Protocol
     [truncated]GET /yt/preclk?eid=2&pid=1cdpo5q6pa04&cid=dz-1-00-NaN-707195416&uid=0&juid=01cbiuiidj293o&sid=01cdpn91of2tqo&sw=1366&sh=768&bw=1349&bh=662&bx=-570&by=470&px=-570&py=530&pc=%23ykPlayer~5~5!2~5!2~5~10&url=http%3A%2F%2Fv.youku.com
    Host: gm.mmstat.com\r\n
    Connection: keep-alive\r\n
    User-Agent: Mozilla/5.0 (Windows NT 10.0; Win64; x64) AppleWebKit/537.36 (KHTML, like Gecko) Chrome/66.0.3359.139 Safari/537.36\r\n
    Accept: image/webp,image/apng,image/*,*/*;q=0.8\r\n
    Referer: http://v.youku.com/v_show/id_XMjgyODc4MTY2NA==.html?from=y1.2-1-97.4.1-1.1-1-2-0-0%26source%3Dautoclick\r\n
    Accept-Encoding: gzip, deflate\r\n
    Accept-Language: en-US,en;q=0.9,zh-TW;q=0.8,zh;q=0.7\r\n
    Cookie: cna=WnjsEmreO3oCAd7TtqYtFE7Z; sca=57c7c60f; yunpk=1235994412436795; tbsa=5cef25164a63168536774494_1522742466_2; atpsida=4efe74594bbbcce4b63c6504_1526651338_5\r\n
    \r\n
    [Full request URI [truncated]: http://gm.mmstat.com/yt/preclk?eid=2&pid=1cdpo5q6pa04&cid=dz-1-00-NaN-707195416&uid=0&juid=01cbiuiidj293o&sid=01cdpn91of2tqo&sw=1366&sh=768&bw=1349&bh=662&bx=-570&by=470&px=-570&py=530&pc=%23ykPlayer~5~5!2~5!2]
    [HTTP request 1/1]
    [Response in frame: 37]

No.     Time               Source                Destination           Protocol Length Info
     35 13:55:45.604843    10.210.66.82          140.205.94.22         HTTP     880    GET /yt/preclk.a2h0j.11185381.ykPlayer.5~5!2~5!2~5~10?logtype=2&title=%u6C5F%u57CE%u8B66%u4E8B%20%u7B2C25%u96C6%20%u4E25%u8001%u677F%u8D38%u7136%u9001%u793C%20%u6768%u5148%u5BDF%u89C9%u9664%u9690%u60A3%u2014%u5728%u7EBF%u64AD%u653E%u2014%u300A%u6C5F%u57CE%u8B66%u4E8B%20%u7B2C25%u96C6%20%u4E25%u8001%u677F%u8D38%u7136%u9001%u793C%20%u6768%u5148%u5BDF%u89C9%u9664%u9690%u60A3%u300B%u2014%u7535%u89C6%u5267%u2014%u4F18%u9177%u7F51%uFF0C%u89C6%u9891%u9AD8%u6E05%u5728%u7EBF%u89C2%u770B&pre=http%3A%2F%2Fv.youku.com%2Fv_show%2Fid_XMjgyODY4NTY0NA%3D%3D.html%3Ffrom%3Dy1.2-1-97.4.1-1.1-1-2-0-0%2526source%253Dautoclick&cache=2f219dc&scr=1366x768&cna=WnjsEmreO3oCAd7TtqYtFE7Z&spm-cnt=a2h0j.11185381.0.0.3dba528frhVNfO&uidaplus=&aplus&sidx=FXqfjLU+lWn+qb1vE8/ZIpY4ypNC7eNb2YHt2djAP2t54aahDzpJR0haHLeoGh4OEW0tcHSRp2SuLiIi/Vu7c9Lv7MzVdTN/Fbf6TINoVNyyhlyTpXpl5uGwCJMJj3fH8/IKtyMOvl+zcycPkjdxIfwfnp2lH5yh1HyGWccsTH1Lr+5wgQ7La6HaDHoq1JPx+oVRe7/3mcKfyo8BqHtL5P87AmuLbqJzL1bflA9TNSy5m/fFvH+7XnLWsu0m9kifOOHY/E7BvMgDwg8p4tD2BFb8VzJoxa5E25QkkrT4P5FVYgRLdUudGnQ9tN++K5/Qhz8GKhjdoonwaz0239jnqw==&p=1&o=win10&b=chrome66&s=1366x768&w=webkit&ism=pc&lver=8.4.4&jsver=aplus_o&pver=0.4.0&l_v=3&p_v=3&dmid=1&pc_i=1516942106895WxV&pu_i=&extd=yft%3D1520235721321%26ysid%3D15266504070564RZ%26pvid%3D1526651349144NyEsDR%26rpvid%3D1526651166243eOEaS1%26ycid%3Ddz-1-00%26rycid%3Ddz-1-00%26ypstp%3D11%26yspstp%3D5%26yscnt%3D4%26ycms%3Ddz-1-00%26rcms%3Ddz-1-00%26unc%3D0%26frame%3D0%26ikuins%3D0%26dev%3DWin32%26mtype%3Doth%26from%3Dy1.2-1-97.4.1-1.1-1-2-0-0%26source%3Dautoclick%26abt%3Doth%26cpid%3D&tag=1&stag=-1&lstag=-1&_slog=0&autosend=1&pos_co=%23ykPlayer~5~5!2~5!2~5~10&eventtype=mousedown HTTP/1.1 

Frame 35: 880 bytes on wire (7040 bits), 880 bytes captured (7040 bits) on interface 0
Ethernet II, Src: AsustekC_34:f3:aa (9c:5c:8e:34:f3:aa), Dst: Hangzhou_d2:34:0d (3c:e5:a6:d2:34:0d)
Internet Protocol Version 4, Src: 10.210.66.82, Dst: 140.205.94.22
Transmission Control Protocol, Src Port: 31084 (31084), Dst Port: 80 (80), Seq: 1441, Ack: 1, Len: 826
[2 Reassembled TCP Segments (2266 bytes): #34(1440), #35(826)]
Hypertext Transfer Protocol
     [truncated]GET /yt/preclk.a2h0j.11185381.ykPlayer.5~5!2~5!2~5~10?logtype=2&title=%u6C5F%u57CE%u8B66%u4E8B%20%u7B2C25%u96C6%20%u4E25%u8001%u677F%u8D38%u7136%u9001%u793C%20%u6768%u5148%u5BDF%u89C9%u9664%u9690%u60A3%u2014%u5728%u7EBF%u64AD%u
    Host: gm.mmstat.com\r\n
    Connection: keep-alive\r\n
    User-Agent: Mozilla/5.0 (Windows NT 10.0; Win64; x64) AppleWebKit/537.36 (KHTML, like Gecko) Chrome/66.0.3359.139 Safari/537.36\r\n
    Accept: image/webp,image/apng,image/*,*/*;q=0.8\r\n
    Referer: http://v.youku.com/v_show/id_XMjgyODc4MTY2NA==.html?from=y1.2-1-97.4.1-1.1-1-2-0-0%26source%3Dautoclick\r\n
    Accept-Encoding: gzip, deflate\r\n
    Accept-Language: en-US,en;q=0.9,zh-TW;q=0.8,zh;q=0.7\r\n
    Cookie: cna=WnjsEmreO3oCAd7TtqYtFE7Z; sca=57c7c60f; yunpk=1235994412436795; tbsa=5cef25164a63168536774494_1522742466_2; atpsida=4efe74594bbbcce4b63c6504_1526651338_5\r\n
    \r\n
    [Full request URI [truncated]: http://gm.mmstat.com/yt/preclk.a2h0j.11185381.ykPlayer.5~5!2~5!2~5~10?logtype=2&title=%u6C5F%u57CE%u8B66%u4E8B%20%u7B2C25%u96C6%20%u4E25%u8001%u677F%u8D38%u7136%u9001%u793C%20%u6768%u5148%u5BDF%u89C9%u9664%u96]
    [HTTP request 1/2]
    [Response in frame: 40]
    [Next request in frame: 43]

No.     Time               Source                Destination           Protocol Length Info
     37 13:55:45.634610    140.205.94.22         10.210.66.82          HTTP     373    HTTP/1.1 200 OK  (GIF89a)

Frame 37: 373 bytes on wire (2984 bits), 373 bytes captured (2984 bits) on interface 0
Ethernet II, Src: Hangzhou_d2:34:0d (3c:e5:a6:d2:34:0d), Dst: AsustekC_34:f3:aa (9c:5c:8e:34:f3:aa)
Internet Protocol Version 4, Src: 140.205.94.22, Dst: 10.210.66.82
Transmission Control Protocol, Src Port: 80 (80), Dst Port: 31083 (31083), Seq: 1, Ack: 1093, Len: 319
Hypertext Transfer Protocol
    HTTP/1.1 200 OK\r\n
    Date: Fri, 18 May 2018 13:55:34 GMT\r\n
    Content-Type: image/gif\r\n
    Content-Length: 43\r\n
    Connection: keep-alive\r\n
    P3P: CP="NOI DSP COR CURa ADMa DEVa PSAa PSDa OUR IND UNI PUR NAV"\r\n
    Expires: Thu, 01 Jan 1970 00:00:01 GMT\r\n
    Cache-Control: no-cache\r\n
    Pragma: no-cache\r\n
    \r\n
    [HTTP response 1/1]
    [Time since request: 0.030499000 seconds]
    [Request in frame: 31]
Compuserve GIF, Version: GIF89a

No.     Time               Source                Destination           Protocol Length Info
     40 13:55:45.635384    140.205.94.22         10.210.66.82          HTTP     373    HTTP/1.1 200 OK  (GIF89a)

Frame 40: 373 bytes on wire (2984 bits), 373 bytes captured (2984 bits) on interface 0
Ethernet II, Src: Hangzhou_d2:34:0d (3c:e5:a6:d2:34:0d), Dst: AsustekC_34:f3:aa (9c:5c:8e:34:f3:aa)
Internet Protocol Version 4, Src: 140.205.94.22, Dst: 10.210.66.82
Transmission Control Protocol, Src Port: 80 (80), Dst Port: 31084 (31084), Seq: 1, Ack: 2267, Len: 319
Hypertext Transfer Protocol
    HTTP/1.1 200 OK\r\n
    Date: Fri, 18 May 2018 13:55:34 GMT\r\n
    Content-Type: image/gif\r\n
    Content-Length: 43\r\n
    Connection: keep-alive\r\n
    P3P: CP="NOI DSP COR CURa ADMa DEVa PSAa PSDa OUR IND UNI PUR NAV"\r\n
    Expires: Thu, 01 Jan 1970 00:00:01 GMT\r\n
    Cache-Control: no-cache\r\n
    Pragma: no-cache\r\n
    \r\n
    [HTTP response 1/2]
    [Time since request: 0.030541000 seconds]
    [Request in frame: 35]
    [Next request in frame: 43]
    [Next response in frame: 52]
Compuserve GIF, Version: GIF89a

No.     Time               Source                Destination           Protocol Length Info
     43 13:55:45.684516    10.210.66.82          140.205.94.22         HTTP     1382   GET /yt/youkuplayer.fdl.h5send?cache=323cbee&gmkey=EXP&gokey=version%3D0.5.44%26vid%3D707195416%26cna%3DWnjsEmreO3oCAd7TtqYtFE7Z%26uid%3D%26vip%3D0%26ccode%3D0502%26log_type%3D3%26fileid%3D%26psid%3D885c6b655274e9cd580e9e8e527d2180%26ups_client_netip%3D106.120.206.146%26title%3D%25E6%25B1%259F%25E5%259F%258E%25E8%25AD%25A6%25E4%25BA%258B%2520%25E7%25AC%25AC25%25E9%259B%2586%2520%25E4%25B8%25A5%25E8%2580%2581%25E6%259D%25BF%25E8%25B4%25B8%25E7%2584%25B6%25E9%2580%2581%25E7%25A4%25BC%2520%25E6%259D%25A8%25E5%2585%2588%25E5%25AF%259F%25E8%25A7%2589%25E9%2599%25A4%25E9%259A%2590%25E6%2582%25A3%26pc_i%3D1516942106895WxV%26pu_i%3D%26_slog%3D0&cna=WnjsEmreO3oCAd7TtqYtFE7Z&spm-cnt=a2h0j.11185381.0.0.3dba528frhVNfO&logtype=2 HTTP/1.1 

Frame 43: 1382 bytes on wire (11056 bits), 1382 bytes captured (11056 bits) on interface 0
Ethernet II, Src: AsustekC_34:f3:aa (9c:5c:8e:34:f3:aa), Dst: Hangzhou_d2:34:0d (3c:e5:a6:d2:34:0d)
Internet Protocol Version 4, Src: 10.210.66.82, Dst: 140.205.94.22
Transmission Control Protocol, Src Port: 31084 (31084), Dst Port: 80 (80), Seq: 2267, Ack: 320, Len: 1328
Hypertext Transfer Protocol
     [truncated]GET /yt/youkuplayer.fdl.h5send?cache=323cbee&gmkey=EXP&gokey=version%3D0.5.44%26vid%3D707195416%26cna%3DWnjsEmreO3oCAd7TtqYtFE7Z%26uid%3D%26vip%3D0%26ccode%3D0502%26log_type%3D3%26fileid%3D%26psid%3D885c6b655274e9cd580e9e8e527d
    Host: gm.mmstat.com\r\n
    Connection: keep-alive\r\n
    User-Agent: Mozilla/5.0 (Windows NT 10.0; Win64; x64) AppleWebKit/537.36 (KHTML, like Gecko) Chrome/66.0.3359.139 Safari/537.36\r\n
    Accept: image/webp,image/apng,image/*,*/*;q=0.8\r\n
    Referer: http://v.youku.com/v_show/id_XMjgyODc4MTY2NA==.html?from=y1.2-1-97.4.1-1.1-1-2-0-0%26source%3Dautoclick\r\n
    Accept-Encoding: gzip, deflate\r\n
    Accept-Language: en-US,en;q=0.9,zh-TW;q=0.8,zh;q=0.7\r\n
    Cookie: cna=WnjsEmreO3oCAd7TtqYtFE7Z; sca=57c7c60f; yunpk=1235994412436795; tbsa=5cef25164a63168536774494_1522742466_2; atpsida=4efe74594bbbcce4b63c6504_1526651338_5\r\n
    \r\n
    [Full request URI [truncated]: http://gm.mmstat.com/yt/youkuplayer.fdl.h5send?cache=323cbee&gmkey=EXP&gokey=version%3D0.5.44%26vid%3D707195416%26cna%3DWnjsEmreO3oCAd7TtqYtFE7Z%26uid%3D%26vip%3D0%26ccode%3D0502%26log_type%3D3%26fileid%3D%26p]
    [HTTP request 2/2]
    [Prev request in frame: 35]
    [Response in frame: 52]

No.     Time               Source                Destination           Protocol Length Info
     51 13:55:45.715431    10.210.66.82          106.11.92.29          HTTP     1130   GET /yt/vp.event?t=1002&e=play&v=c&d=Zj1vbiZxPWY%3D&x=dj0wLjUuNDQmdmVyPTEuMC4wJmFidGVzdD1iJnZpZD03MDcxOTU0MTYmdWlkPSZzc2lkPTg4NWM2YjY1NTI3NGU5Y2Q1ODBlOWU4ZTUyN2QyMTgwJnNpZD0wJmN0PTk3JmNzPTIwNzQmdGM9MQ%3D%3D&pc_u=&url=http%3A%2F%2Fv.youku.com%2Fv_show%2Fid_XMjgyODc4MTY2NA%3D%3D.html%3Ffrom%3Dy1.2-1-97.4.1-1.1-1-2-0-0%2526source%253Dautoclick&rurl=http%3A%2F%2Fv.youku.com%2Fv_show%2Fid_XMjgyODY4NTY0NA%3D%3D.html%3Ffrom%3Dy1.2-1-97.4.1-1.1-1-2-0-0%2526source%253Dautoclick HTTP/1.1 

Frame 51: 1130 bytes on wire (9040 bits), 1130 bytes captured (9040 bits) on interface 0
Ethernet II, Src: AsustekC_34:f3:aa (9c:5c:8e:34:f3:aa), Dst: Hangzhou_d2:34:0d (3c:e5:a6:d2:34:0d)
Internet Protocol Version 4, Src: 10.210.66.82, Dst: 106.11.92.29
Transmission Control Protocol, Src Port: 31085 (31085), Dst Port: 80 (80), Seq: 1, Ack: 1, Len: 1076
Hypertext Transfer Protocol
     [truncated]GET /yt/vp.event?t=1002&e=play&v=c&d=Zj1vbiZxPWY%3D&x=dj0wLjUuNDQmdmVyPTEuMC4wJmFidGVzdD1iJnZpZD03MDcxOTU0MTYmdWlkPSZzc2lkPTg4NWM2YjY1NTI3NGU5Y2Q1ODBlOWU4ZTUyN2QyMTgwJnNpZD0wJmN0PTk3JmNzPTIwNzQmdGM9MQ%3D%3D&pc_u=&url=http%3A%2F
    Host: yt.mmstat.com\r\n
    Connection: keep-alive\r\n
    User-Agent: Mozilla/5.0 (Windows NT 10.0; Win64; x64) AppleWebKit/537.36 (KHTML, like Gecko) Chrome/66.0.3359.139 Safari/537.36\r\n
    Accept: image/webp,image/apng,image/*,*/*;q=0.8\r\n
    Referer: http://v.youku.com/v_show/id_XMjgyODc4MTY2NA==.html?from=y1.2-1-97.4.1-1.1-1-2-0-0%26source%3Dautoclick\r\n
    Accept-Encoding: gzip, deflate\r\n
    Accept-Language: en-US,en;q=0.9,zh-TW;q=0.8,zh;q=0.7\r\n
    Cookie: cna=WnjsEmreO3oCAd7TtqYtFE7Z; sca=57c7c60f; yunpk=1235994412436795; tbsa=5cef25164a63168536774494_1522742466_2; atpsida=4efe74594bbbcce4b63c6504_1526651338_5\r\n
    \r\n
    [Full request URI [truncated]: http://yt.mmstat.com/yt/vp.event?t=1002&e=play&v=c&d=Zj1vbiZxPWY%3D&x=dj0wLjUuNDQmdmVyPTEuMC4wJmFidGVzdD1iJnZpZD03MDcxOTU0MTYmdWlkPSZzc2lkPTg4NWM2YjY1NTI3NGU5Y2Q1ODBlOWU4ZTUyN2QyMTgwJnNpZD0wJmN0PTk3JmNzPTIwNzQ]
    [HTTP request 1/1]
    [Response in frame: 54]

No.     Time               Source                Destination           Protocol Length Info
     52 13:55:45.716861    140.205.94.22         10.210.66.82          HTTP     373    HTTP/1.1 200 OK  (GIF89a)

Frame 52: 373 bytes on wire (2984 bits), 373 bytes captured (2984 bits) on interface 0
Ethernet II, Src: Hangzhou_d2:34:0d (3c:e5:a6:d2:34:0d), Dst: AsustekC_34:f3:aa (9c:5c:8e:34:f3:aa)
Internet Protocol Version 4, Src: 140.205.94.22, Dst: 10.210.66.82
Transmission Control Protocol, Src Port: 80 (80), Dst Port: 31084 (31084), Seq: 320, Ack: 3595, Len: 319
Hypertext Transfer Protocol
    HTTP/1.1 200 OK\r\n
    Date: Fri, 18 May 2018 13:55:34 GMT\r\n
    Content-Type: image/gif\r\n
    Content-Length: 43\r\n
    Connection: keep-alive\r\n
    P3P: CP="NOI DSP COR CURa ADMa DEVa PSAa PSDa OUR IND UNI PUR NAV"\r\n
    Expires: Thu, 01 Jan 1970 00:00:01 GMT\r\n
    Cache-Control: no-cache\r\n
    Pragma: no-cache\r\n
    \r\n
    [HTTP response 2/2]
    [Time since request: 0.032345000 seconds]
    [Prev request in frame: 35]
    [Prev response in frame: 40]
    [Request in frame: 43]
Compuserve GIF, Version: GIF89a

No.     Time               Source                Destination           Protocol Length Info
     54 13:55:45.743789    106.11.92.29          10.210.66.82          HTTP     373    HTTP/1.1 200 OK  (GIF89a)

Frame 54: 373 bytes on wire (2984 bits), 373 bytes captured (2984 bits) on interface 0
Ethernet II, Src: Hangzhou_d2:34:0d (3c:e5:a6:d2:34:0d), Dst: AsustekC_34:f3:aa (9c:5c:8e:34:f3:aa)
Internet Protocol Version 4, Src: 106.11.92.29, Dst: 10.210.66.82
Transmission Control Protocol, Src Port: 80 (80), Dst Port: 31085 (31085), Seq: 1, Ack: 1077, Len: 319
Hypertext Transfer Protocol
    HTTP/1.1 200 OK\r\n
    Date: Fri, 18 May 2018 13:55:34 GMT\r\n
    Content-Type: image/gif\r\n
    Content-Length: 43\r\n
    Connection: keep-alive\r\n
    P3P: CP="NOI DSP COR CURa ADMa DEVa PSAa PSDa OUR IND UNI PUR NAV"\r\n
    Expires: Thu, 01 Jan 1970 00:00:01 GMT\r\n
    Cache-Control: no-cache\r\n
    Pragma: no-cache\r\n
    \r\n
    [HTTP response 1/1]
    [Time since request: 0.028358000 seconds]
    [Request in frame: 51]
Compuserve GIF, Version: GIF89a

No.     Time               Source                Destination           Protocol Length Info
     58 13:55:46.802377    10.210.66.82          121.194.7.221         HTTP     470    GET /api/data/v2/0a3ffc1f4a8b455a9d7421d6d90ecefb.js?t=1526651746798&callback=hangMarkCallkack HTTP/1.1 

Frame 58: 470 bytes on wire (3760 bits), 470 bytes captured (3760 bits) on interface 0
Ethernet II, Src: AsustekC_34:f3:aa (9c:5c:8e:34:f3:aa), Dst: Hangzhou_d2:34:0d (3c:e5:a6:d2:34:0d)
Internet Protocol Version 4, Src: 10.210.66.82, Dst: 121.194.7.221
Transmission Control Protocol, Src Port: 30213 (30213), Dst Port: 80 (80), Seq: 1, Ack: 1, Len: 416
Hypertext Transfer Protocol
    GET /api/data/v2/0a3ffc1f4a8b455a9d7421d6d90ecefb.js?t=1526651746798&callback=hangMarkCallkack HTTP/1.1\r\n
    Host: hudong.alicdn.com\r\n
    Connection: keep-alive\r\n
    User-Agent: Mozilla/5.0 (Windows NT 10.0; Win64; x64) AppleWebKit/537.36 (KHTML, like Gecko) Chrome/66.0.3359.139 Safari/537.36\r\n
    Accept: */*\r\n
    Referer: http://www.youku.com/\r\n
    Accept-Encoding: gzip, deflate\r\n
    Accept-Language: en-US,en;q=0.9,zh-TW;q=0.8,zh;q=0.7\r\n
    \r\n
    [Full request URI: http://hudong.alicdn.com/api/data/v2/0a3ffc1f4a8b455a9d7421d6d90ecefb.js?t=1526651746798&callback=hangMarkCallkack]
    [HTTP request 1/10]
    [Response in frame: 59]
    [Next request in frame: 1339]

No.     Time               Source                Destination           Protocol Length Info
     59 13:55:46.804060    121.194.7.221         10.210.66.82          HTTP     935    HTTP/1.1 200 OK  (application/json)

Frame 59: 935 bytes on wire (7480 bits), 935 bytes captured (7480 bits) on interface 0
Ethernet II, Src: Hangzhou_d2:34:0d (3c:e5:a6:d2:34:0d), Dst: AsustekC_34:f3:aa (9c:5c:8e:34:f3:aa)
Internet Protocol Version 4, Src: 121.194.7.221, Dst: 10.210.66.82
Transmission Control Protocol, Src Port: 80 (80), Dst Port: 30213 (30213), Seq: 1, Ack: 417, Len: 881
Hypertext Transfer Protocol
    HTTP/1.1 200 OK\r\n
    Server: Tengine\r\n
    Content-Type: application/json;charset=UTF-8\r\n
    Content-Length: 235\r\n
    Connection: keep-alive\r\n
    Date: Fri, 18 May 2018 13:51:30 GMT\r\n
    Last-Modified: Fri, 18 May 2018 13:51:30 GMT\r\n
    Cache-Control: max-age=120, s-maxage=300\r\n
    Security-Checksum: d2b7190d607bcf220618a0ebeaf4fa80\r\n
    Content-Language: zh-CN\r\n
    Via: cache3.l2et2-2[0,200-0,H], cache3.l2et2-2[1,0], cache7.cn17[0,200-0,H], cache4.cn17[0,0]\r\n
    Age: 245\r\n
    X-Cache: HIT TCP_MEM_HIT dirn:-2:-2 mlen:-1\r\n
    X-Swift-SaveTime: Fri, 18 May 2018 13:51:30 GMT\r\n
    X-Swift-CacheTime: 300\r\n
    Access-Control-Allow-Origin: *\r\n
    Timing-Allow-Origin: *\r\n
    EagleId: 79c207cc15266517359151263e\r\n
    \r\n
    [HTTP response 1/10]
    [Time since request: 0.001683000 seconds]
    [Request in frame: 58]
    [Next request in frame: 1339]
    [Next response in frame: 1341]
JavaScript Object Notation: application/json
Line-based text data: application/json

No.     Time               Source                Destination           Protocol Length Info
     68 13:55:47.534728    10.210.66.82          222.22.29.85          HTTP     876    GET /69726A68B3339716A5D45270E/03000A010059C25A820B5600000001C41BD53E-5089-291E-36CC-4D02F768B59D.mp4.ts?ccode=0502&duration=66&expire=18000&psid=885c6b655274e9cd580e9e8e527d2180&ups_client_netip=6a78ce92&ups_ts=1526651341&ups_userid=&utid=WnjsEmreO3oCAd7TtqYtFE7Z&vid=XMjgyODc4MTY2NA%3D%3D&vkey=A15396191bb6edc7b4469104c0c2c7b6c&ts_start=12.767&ts_end=23.9&ts_seg_no=3&ts_keyframe=1 HTTP/1.1 

Frame 68: 876 bytes on wire (7008 bits), 876 bytes captured (7008 bits) on interface 0
Ethernet II, Src: AsustekC_34:f3:aa (9c:5c:8e:34:f3:aa), Dst: Hangzhou_d2:34:0d (3c:e5:a6:d2:34:0d)
Internet Protocol Version 4, Src: 10.210.66.82, Dst: 222.22.29.85
Transmission Control Protocol, Src Port: 31086 (31086), Dst Port: 80 (80), Seq: 1, Ack: 1, Len: 822
Hypertext Transfer Protocol
     [truncated]GET /69726A68B3339716A5D45270E/03000A010059C25A820B5600000001C41BD53E-5089-291E-36CC-4D02F768B59D.mp4.ts?ccode=0502&duration=66&expire=18000&psid=885c6b655274e9cd580e9e8e527d2180&ups_client_netip=6a78ce92&ups_ts=1526651341&ups_
    Host: vali.cp31.ott.cibntv.net\r\n
    Connection: keep-alive\r\n
    Origin: http://v.youku.com\r\n
    User-Agent: Mozilla/5.0 (Windows NT 10.0; Win64; x64) AppleWebKit/537.36 (KHTML, like Gecko) Chrome/66.0.3359.139 Safari/537.36\r\n
    Accept: */*\r\n
    Referer: http://v.youku.com/v_show/id_XMjgyODc4MTY2NA==.html?from=y1.2-1-97.4.1-1.1-1-2-0-0%26source%3Dautoclick\r\n
    Accept-Encoding: gzip, deflate\r\n
    Accept-Language: en-US,en;q=0.9,zh-TW;q=0.8,zh;q=0.7\r\n
    \r\n
    [Full request URI [truncated]: http://vali.cp31.ott.cibntv.net/69726A68B3339716A5D45270E/03000A010059C25A820B5600000001C41BD53E-5089-291E-36CC-4D02F768B59D.mp4.ts?ccode=0502&duration=66&expire=18000&psid=885c6b655274e9cd580e9e8e527d2180&ups]
    [HTTP request 1/36]
    [Response in frame: 70]
    [Next request in frame: 582]

No.     Time               Source                Destination           Protocol Length Info
     70 13:55:47.598612    222.22.29.85          10.210.66.82          HTTP     1494   HTTP/1.1 200 OK  (video/mp4)

Frame 70: 1494 bytes on wire (11952 bits), 1494 bytes captured (11952 bits) on interface 0
Ethernet II, Src: Hangzhou_d2:34:0d (3c:e5:a6:d2:34:0d), Dst: AsustekC_34:f3:aa (9c:5c:8e:34:f3:aa)
Internet Protocol Version 4, Src: 222.22.29.85, Dst: 10.210.66.82
Transmission Control Protocol, Src Port: 80 (80), Dst Port: 31086 (31086), Seq: 1, Ack: 823, Len: 1440
Hypertext Transfer Protocol
Media Type

No.     Time               Source                Destination           Protocol Length Info
    531 13:55:50.950764    10.210.66.82          106.11.92.29          HTTP     912    GET /yt/vp.vtslog?version=0.5.44&vid=707195416&uid=&type=h5&cf=0&cpt=6&full=0&pc=0&clb=0&playersid=15266513519341cdpo5sru2btdRSphKjYcclm&abtest=b&sn=1&pt=5&hi=5&vvid=885c6b655274e9cd580e9e8e527d2180&lang=1&r=2169472478&cna=WnjsEmreO3oCAd7TtqYtFE7Z&speed=1 HTTP/1.1 

Frame 531: 912 bytes on wire (7296 bits), 912 bytes captured (7296 bits) on interface 0
Ethernet II, Src: AsustekC_34:f3:aa (9c:5c:8e:34:f3:aa), Dst: Hangzhou_d2:34:0d (3c:e5:a6:d2:34:0d)
Internet Protocol Version 4, Src: 10.210.66.82, Dst: 106.11.92.29
Transmission Control Protocol, Src Port: 31087 (31087), Dst Port: 80 (80), Seq: 1, Ack: 1, Len: 858
Hypertext Transfer Protocol
     [truncated]GET /yt/vp.vtslog?version=0.5.44&vid=707195416&uid=&type=h5&cf=0&cpt=6&full=0&pc=0&clb=0&playersid=15266513519341cdpo5sru2btdRSphKjYcclm&abtest=b&sn=1&pt=5&hi=5&vvid=885c6b655274e9cd580e9e8e527d2180&lang=1&r=2169472478&cna=Wnjs
    Host: yt.mmstat.com\r\n
    Connection: keep-alive\r\n
    User-Agent: Mozilla/5.0 (Windows NT 10.0; Win64; x64) AppleWebKit/537.36 (KHTML, like Gecko) Chrome/66.0.3359.139 Safari/537.36\r\n
    Accept: image/webp,image/apng,image/*,*/*;q=0.8\r\n
    Referer: http://v.youku.com/v_show/id_XMjgyODc4MTY2NA==.html?from=y1.2-1-97.4.1-1.1-1-2-0-0%26source%3Dautoclick\r\n
    Accept-Encoding: gzip, deflate\r\n
    Accept-Language: en-US,en;q=0.9,zh-TW;q=0.8,zh;q=0.7\r\n
    Cookie: cna=WnjsEmreO3oCAd7TtqYtFE7Z; sca=57c7c60f; yunpk=1235994412436795; tbsa=5cef25164a63168536774494_1522742466_2; atpsida=4efe74594bbbcce4b63c6504_1526651338_5\r\n
    \r\n
    [Full request URI [truncated]: http://yt.mmstat.com/yt/vp.vtslog?version=0.5.44&vid=707195416&uid=&type=h5&cf=0&cpt=6&full=0&pc=0&clb=0&playersid=15266513519341cdpo5sru2btdRSphKjYcclm&abtest=b&sn=1&pt=5&hi=5&vvid=885c6b655274e9cd580e9e8e527]
    [HTTP request 1/3]
    [Response in frame: 536]
    [Next request in frame: 562]

No.     Time               Source                Destination           Protocol Length Info
    536 13:55:50.978221    106.11.92.29          10.210.66.82          HTTP     373    HTTP/1.1 200 OK  (GIF89a)

Frame 536: 373 bytes on wire (2984 bits), 373 bytes captured (2984 bits) on interface 0
Ethernet II, Src: Hangzhou_d2:34:0d (3c:e5:a6:d2:34:0d), Dst: AsustekC_34:f3:aa (9c:5c:8e:34:f3:aa)
Internet Protocol Version 4, Src: 106.11.92.29, Dst: 10.210.66.82
Transmission Control Protocol, Src Port: 80 (80), Dst Port: 31087 (31087), Seq: 1, Ack: 859, Len: 319
Hypertext Transfer Protocol
    HTTP/1.1 200 OK\r\n
    Date: Fri, 18 May 2018 13:55:40 GMT\r\n
    Content-Type: image/gif\r\n
    Content-Length: 43\r\n
    Connection: keep-alive\r\n
    P3P: CP="NOI DSP COR CURa ADMa DEVa PSAa PSDa OUR IND UNI PUR NAV"\r\n
    Expires: Thu, 01 Jan 1970 00:00:01 GMT\r\n
    Cache-Control: no-cache\r\n
    Pragma: no-cache\r\n
    \r\n
    [HTTP response 1/3]
    [Time since request: 0.027457000 seconds]
    [Request in frame: 531]
    [Next request in frame: 562]
    [Next response in frame: 563]
Compuserve GIF, Version: GIF89a

No.     Time               Source                Destination           Protocol Length Info
    562 13:55:55.934301    10.210.66.82          106.11.92.29          HTTP     914    GET /yt/vp.vtslog?version=0.5.44&vid=707195416&uid=&type=h5&cf=0&cpt=11&full=0&pc=0&clb=0&playersid=15266513519341cdpo5sru2btdRSphKjYcclm&abtest=b&sn=2&pt=10&hi=5&vvid=885c6b655274e9cd580e9e8e527d2180&lang=1&r=1337201903&cna=WnjsEmreO3oCAd7TtqYtFE7Z&speed=1 HTTP/1.1 

Frame 562: 914 bytes on wire (7312 bits), 914 bytes captured (7312 bits) on interface 0
Ethernet II, Src: AsustekC_34:f3:aa (9c:5c:8e:34:f3:aa), Dst: Hangzhou_d2:34:0d (3c:e5:a6:d2:34:0d)
Internet Protocol Version 4, Src: 10.210.66.82, Dst: 106.11.92.29
Transmission Control Protocol, Src Port: 31087 (31087), Dst Port: 80 (80), Seq: 859, Ack: 320, Len: 860
Hypertext Transfer Protocol
     [truncated]GET /yt/vp.vtslog?version=0.5.44&vid=707195416&uid=&type=h5&cf=0&cpt=11&full=0&pc=0&clb=0&playersid=15266513519341cdpo5sru2btdRSphKjYcclm&abtest=b&sn=2&pt=10&hi=5&vvid=885c6b655274e9cd580e9e8e527d2180&lang=1&r=1337201903&cna=Wn
    Host: yt.mmstat.com\r\n
    Connection: keep-alive\r\n
    User-Agent: Mozilla/5.0 (Windows NT 10.0; Win64; x64) AppleWebKit/537.36 (KHTML, like Gecko) Chrome/66.0.3359.139 Safari/537.36\r\n
    Accept: image/webp,image/apng,image/*,*/*;q=0.8\r\n
    Referer: http://v.youku.com/v_show/id_XMjgyODc4MTY2NA==.html?from=y1.2-1-97.4.1-1.1-1-2-0-0%26source%3Dautoclick\r\n
    Accept-Encoding: gzip, deflate\r\n
    Accept-Language: en-US,en;q=0.9,zh-TW;q=0.8,zh;q=0.7\r\n
    Cookie: cna=WnjsEmreO3oCAd7TtqYtFE7Z; sca=57c7c60f; yunpk=1235994412436795; tbsa=5cef25164a63168536774494_1522742466_2; atpsida=4efe74594bbbcce4b63c6504_1526651338_5\r\n
    \r\n
    [Full request URI [truncated]: http://yt.mmstat.com/yt/vp.vtslog?version=0.5.44&vid=707195416&uid=&type=h5&cf=0&cpt=11&full=0&pc=0&clb=0&playersid=15266513519341cdpo5sru2btdRSphKjYcclm&abtest=b&sn=2&pt=10&hi=5&vvid=885c6b655274e9cd580e9e8e5]
    [HTTP request 2/3]
    [Prev request in frame: 531]
    [Response in frame: 563]
    [Next request in frame: 914]

No.     Time               Source                Destination           Protocol Length Info
    563 13:55:55.961498    106.11.92.29          10.210.66.82          HTTP     373    HTTP/1.1 200 OK  (GIF89a)

Frame 563: 373 bytes on wire (2984 bits), 373 bytes captured (2984 bits) on interface 0
Ethernet II, Src: Hangzhou_d2:34:0d (3c:e5:a6:d2:34:0d), Dst: AsustekC_34:f3:aa (9c:5c:8e:34:f3:aa)
Internet Protocol Version 4, Src: 106.11.92.29, Dst: 10.210.66.82
Transmission Control Protocol, Src Port: 80 (80), Dst Port: 31087 (31087), Seq: 320, Ack: 1719, Len: 319
Hypertext Transfer Protocol
    HTTP/1.1 200 OK\r\n
    Date: Fri, 18 May 2018 13:55:45 GMT\r\n
    Content-Type: image/gif\r\n
    Content-Length: 43\r\n
    Connection: keep-alive\r\n
    P3P: CP="NOI DSP COR CURa ADMa DEVa PSAa PSDa OUR IND UNI PUR NAV"\r\n
    Expires: Thu, 01 Jan 1970 00:00:01 GMT\r\n
    Cache-Control: no-cache\r\n
    Pragma: no-cache\r\n
    \r\n
    [HTTP response 2/3]
    [Time since request: 0.027197000 seconds]
    [Prev request in frame: 531]
    [Prev response in frame: 536]
    [Request in frame: 562]
    [Next request in frame: 914]
Compuserve GIF, Version: GIF89a

No.     Time               Source                Destination           Protocol Length Info
    582 13:55:58.719283    10.210.66.82          222.22.29.85          HTTP     876    GET /69726A68B3339716A5D45270E/03000A010059C25A820B5600000001C41BD53E-5089-291E-36CC-4D02F768B59D.mp4.ts?ccode=0502&duration=66&expire=18000&psid=885c6b655274e9cd580e9e8e527d2180&ups_client_netip=6a78ce92&ups_ts=1526651341&ups_userid=&utid=WnjsEmreO3oCAd7TtqYtFE7Z&vid=XMjgyODc4MTY2NA%3D%3D&vkey=A15396191bb6edc7b4469104c0c2c7b6c&ts_start=23.9&ts_end=31.567&ts_seg_no=4&ts_keyframe=1 HTTP/1.1 

Frame 582: 876 bytes on wire (7008 bits), 876 bytes captured (7008 bits) on interface 0
Ethernet II, Src: AsustekC_34:f3:aa (9c:5c:8e:34:f3:aa), Dst: Hangzhou_d2:34:0d (3c:e5:a6:d2:34:0d)
Internet Protocol Version 4, Src: 10.210.66.82, Dst: 222.22.29.85
Transmission Control Protocol, Src Port: 31086 (31086), Dst Port: 80 (80), Seq: 823, Ack: 488418, Len: 822
Hypertext Transfer Protocol
     [truncated]GET /69726A68B3339716A5D45270E/03000A010059C25A820B5600000001C41BD53E-5089-291E-36CC-4D02F768B59D.mp4.ts?ccode=0502&duration=66&expire=18000&psid=885c6b655274e9cd580e9e8e527d2180&ups_client_netip=6a78ce92&ups_ts=1526651341&ups_
    Host: vali.cp31.ott.cibntv.net\r\n
    Connection: keep-alive\r\n
    Origin: http://v.youku.com\r\n
    User-Agent: Mozilla/5.0 (Windows NT 10.0; Win64; x64) AppleWebKit/537.36 (KHTML, like Gecko) Chrome/66.0.3359.139 Safari/537.36\r\n
    Accept: */*\r\n
    Referer: http://v.youku.com/v_show/id_XMjgyODc4MTY2NA==.html?from=y1.2-1-97.4.1-1.1-1-2-0-0%26source%3Dautoclick\r\n
    Accept-Encoding: gzip, deflate\r\n
    Accept-Language: en-US,en;q=0.9,zh-TW;q=0.8,zh;q=0.7\r\n
    \r\n
    [Full request URI [truncated]: http://vali.cp31.ott.cibntv.net/69726A68B3339716A5D45270E/03000A010059C25A820B5600000001C41BD53E-5089-291E-36CC-4D02F768B59D.mp4.ts?ccode=0502&duration=66&expire=18000&psid=885c6b655274e9cd580e9e8e527d2180&ups]
    [HTTP request 2/36]
    [Prev request in frame: 68]
    [Response in frame: 584]
    [Next request in frame: 1088]

No.     Time               Source                Destination           Protocol Length Info
    584 13:55:58.796999    222.22.29.85          10.210.66.82          HTTP     1494   HTTP/1.1 200 OK  (video/mp4)

Frame 584: 1494 bytes on wire (11952 bits), 1494 bytes captured (11952 bits) on interface 0
Ethernet II, Src: Hangzhou_d2:34:0d (3c:e5:a6:d2:34:0d), Dst: AsustekC_34:f3:aa (9c:5c:8e:34:f3:aa)
Internet Protocol Version 4, Src: 222.22.29.85, Dst: 10.210.66.82
Transmission Control Protocol, Src Port: 80 (80), Dst Port: 31086 (31086), Seq: 488418, Ack: 1645, Len: 1440
Hypertext Transfer Protocol
Media Type

No.     Time               Source                Destination           Protocol Length Info
    773 13:55:59.021948    222.22.29.85          10.210.66.82          HTTP     1494   Continuation

Frame 773: 1494 bytes on wire (11952 bits), 1494 bytes captured (11952 bits) on interface 0
Ethernet II, Src: Hangzhou_d2:34:0d (3c:e5:a6:d2:34:0d), Dst: AsustekC_34:f3:aa (9c:5c:8e:34:f3:aa)
Internet Protocol Version 4, Src: 222.22.29.85, Dst: 10.210.66.82
Transmission Control Protocol, Src Port: 80 (80), Dst Port: 31086 (31086), Seq: 688578, Ack: 1645, Len: 1440
Hypertext Transfer Protocol
     [truncated]:\333x\352*\214\334\274\210e\034`\306Yj\377\236\347\207\351\346a\016W\341D\201\325\216O,\300\251\020K}C!L\354\260\274\251C\243\230\2540\313`\023\337Fn\3405A\020\220\276\206T\361n+G\001\001\020J\237\025\333\315\335\265\326\255?Q
    Data (1230 bytes)

0000  aa ab 44 49 99 34 15 c3 49 37 57 61 26 b9 04 8a   ..DI.4..I7Wa&...
0010  5d 92 b2 bb a9 29 23 ba b7 5e c1 63 18 af bc 7c   ]....)#..^.c...|
0020  ce 3b ae 51 7a 51 b8 0e f5 50 6a 47 01 01 11 76   .;.QzQ...PjG...v
0030  82 f7 14 88 20 b9 09 3b 2d a4 c7 e2 a5 85 9b 4a   .... ..;-......J
0040  80 69 77 2c 70 ec 16 23 94 4d d1 cd ed 29 6c 69   .iw,p..#.M...)li
0050  53 97 7e 02 4b a2 7b c0 3e c5 03 9b 1c f1 35 8a   S.~.K.{.>.....5.
0060  8a 30 ad e2 73 9d b2 0e a4 28 e3 f2 68 f1 1c d2   .0..s....(..h...
0070  22 cf 37 d0 94 bc b0 d7 d9 09 51 b2 dd b4 93 1a   ".7.......Q.....
0080  a7 c9 6e 9d ce a8 6a b9 08 91 7c 5f d3 83 c6 63   ..n...j...|_...c
0090  f5 bd 8d 48 32 f7 2e db 31 6b 45 51 22 9b 6f 34   ...H2...1kEQ".o4
00a0  8f 32 df 37 28 86 97 98 79 34 81 bf 64 fd 95 dc   .2.7(...y4..d...
00b0  d5 7b 6e da 3a c7 f8 cd 6e e3 af 59 94 37 da b4   .{n.:...n..Y.7..
00c0  f8 2d 43 0d e7 25 18 60 2c 41 a7 fe 83 5f 91 2d   .-C..%.`,A..._.-
00d0  f4 96 b0 3c 0e 7e 20 bc 98 dd 4d 28 3f f3 5b 47   ...<.~ ...M(?.[G
00e0  c1 d1 38 91 32 c7 51 47 01 01 12 3a b5 8a 39 71   ..8.2.QG...:..9q
00f0  03 5c f0 8b 73 15 09 59 4d 54 96 60 30 21 2a da   .\..s..YMT.`0!*.
0100  54 ae c2 e9 39 81 86 7a 55 45 4e 63 99 ce 79 78   T...9..zUENc..yx
0110  84 91 5c 7d c0 a9 53 96 1c dc 2a b2 b2 a6 0f 13   ..\}..S...*.....
0120  20 f0 b3 ca ec 73 09 e4 ab 5b 10 38 cd b8 bc 9a    ....s...[.8....
0130  76 a5 1c 88 43 53 ce 35 d6 db 66 48 ca 7e cc 1d   v...CS.5..fH.~..
0140  a8 ef 37 b4 52 28 c6 56 41 97 70 9b 47 0a 29 93   ..7.R(.VA.p.G.).
0150  e4 5e 10 3e c6 ef 5d 08 8c 1b 66 5c cc c8 91 15   .^.>..]...f\....
0160  1e 82 4b 5e 42 b9 03 8e e8 65 ba 46 4b 5a b5 ee   ..K^B....e.FKZ..
0170  f3 c7 b6 dc 1d bd a3 78 aa b3 9e ba 43 18 e8 54   .......x....C..T
0180  e4 45 9b b6 47 a4 79 74 fe 3b e0 4a 19 76 99 66   .E..G.yt.;.J.v.f
0190  73 1b 61 cb 0d a1 0b b9 54 77 c2 be cc b9 53 62   s.a.....Tw....Sb
01a0  e8 46 fe 47 01 01 13 ff 15 51 66 56 3e 9e c2 21   .F.G.....QfV>..!
01b0  3c a2 df 7e 32 ec d4 e6 ce 19 2e 5b 56 d0 d7 c0   <..~2......[V...
01c0  ae 0c c3 a9 ee 71 0e 69 72 09 67 17 9f 02 72 7d   .....q.ir.g...r}
01d0  8b d4 82 10 ee 19 ab 25 b8 9f db dd a0 a9 a0 02   .......%........
01e0  7c 4f 26 37 6d bf 54 c0 97 57 26 db 09 56 2d 44   |O&7m.T..W&..V-D
01f0  db 11 81 49 6e d0 07 3b 55 bb 71 11 d7 7f 2d ba   ...In..;U.q...-.
0200  a7 ba e0 9f a4 35 48 d1 d0 85 87 c0 06 9d 6c 03   .....5H.......l.
0210  1f bb 2b d5 63 dc 43 05 2b 7b f9 3f f0 88 44 21   ..+.c.C.+{.?..D!
0220  41 ca 5b c6 22 18 0b 0a 5e ae 07 b8 49 f3 25 2a   A.[."...^...I.%*
0230  1f 29 35 de 67 a2 73 87 30 09 c4 74 61 89 d0 3e   .)5.g.s.0..ta..>
0240  a1 1e 65 95 7c 9e f4 4a 74 e2 79 52 27 37 09 b4   ..e.|..Jt.yR'7..
0250  41 fa a5 ba bc d6 e9 b8 ad 84 2a 90 a1 ac d8 47   A.........*....G
0260  41 01 34 07 10 00 1a b8 0a 80 a9 00 00 01 e0 00   A.4.............
0270  00 80 c0 0a 31 00 d7 aa 81 11 00 d7 4c 41 64 38   ....1.......LAd8
0280  1e e8 9d ee e6 b9 b9 69 85 b8 aa e4 ca 6b 35 6a   .......i.....k5j
0290  b1 e1 0d 1e 81 cf 86 77 df e3 df 83 31 78 62 88   .......w....1xb.
02a0  e8 ef b2 3c bf e4 d6 d6 cd f6 e6 1b e1 8b f2 39   ...<...........9
02b0  1a 37 e9 32 57 fa d1 f8 93 fc 76 d9 a7 41 b4 a9   .7.2W.....v..A..
02c0  22 0f 80 00 00 00 01 09 f0 00 00 00 01 41 9b b5   "............A..
02d0  18 26 ff f5 68 2f 35 aa 0c 08 db 46 89 82 56 ce   .&..h/5....F..V.
02e0  7a b8 65 d0 07 c5 c5 aa f6 bb f0 70 1d d2 c2 6e   z.e........p...n
02f0  13 0b 8a 84 3f 9e ed 14 c8 3e 01 b0 d5 94 fe a6   ....?....>......
0300  d7 dd e2 a0 70 b9 6f b7 32 a7 6c 11 f4 d4 75 8e   ....p.o.2.l...u.
0310  2e 01 fa eb a0 e9 a7 52 fb 42 77 47 41 02 13 00   .......R.BwGA...
0320  00 01 c0 03 04 84 80 05 21 00 d7 5b 01 ff f1 50   ........!..[...P
0330  80 18 9f fc 21 19 8f ff ff ff ff f2 b6 8a 25 99   ....!.........%.
0340  8f a2 40 e8 90 46 44 13 b5 8b 45 c0 b5 e2 e1 ed   ..@..FD...E.....
0350  57 00 38 10 27 cc 9e 4a c8 2d 50 05 4b 16 57 ae   W.8.'..J.-P.K.W.
0360  b6 7c 8d 66 9f c7 c0 23 16 0d 0e 28 19 56 5b 2d   .|.f...#...(.V[-
0370  bb e8 6f 6a 66 c2 1c 62 50 56 7f 7a 53 bf 26 bf   ..ojf..bPV.zS.&.
0380  2a ba cc 65 00 55 54 1f 2e c8 73 40 28 c7 ac 89   *..e.UT...s@(...
0390  49 98 66 f3 6e df 25 4d 96 bc 66 d6 f9 57 13 1d   I.f.n.%M..f..W..
03a0  b2 09 cc c1 50 e3 4e 20 04 65 03 75 37 74 81 51   ....P.N .e.u7t.Q
03b0  58 66 50 7a de ff 4b d0 04 9a ec fc 34 24 62 2c   XfPz..K.....4$b,
03c0  70 ec f5 41 af 25 a0 2c 1b 01 ee ef 79 62 72 56   p..A.%.,....ybrV
03d0  8a ca 48 c2 8b c4 a6 47 01 02 14 8d cb 2e 2b 31   ..H....G......+1
03e0  2b 0d 96 b9 20 30 ff 1a 98 80 95 dc 06 74 40 1d   +... 0.......t@.
03f0  10 21 a7 50 38 ff f1 50 80 17 7f fc 21 19 8f ff   .!.P8..P....!...
0400  ff ff ff f2 96 d8 25 15 87 a8 42 a9 8a dc 9c 38   ......%...B....8
0410  55 67 4d 17 57 8f 74 55 71 5c 00 5d bd ab 98 d5   UgM.W.tUq\.]....
0420  93 ba cb 4e f7 42 23 0d c7 ed 3b f0 d4 92 88 a8   ...N.B#...;.....
0430  a3 46 48 87 38 df a6 7c 41 fc 29 e4 71 86 72 94   .FH.8..|A.).q.r.
0440  97 4c be 1e f4 4f 47 17 b8 18 15 03 c6 f5 98 96   .L...OG.........
0450  30 8c 57 a0 e8 eb 83 05 a8 ca 60 15 92 ea 00 22   0.W.......`...."
0460  5a ba 64 9a ae e8 c1 a0 de 92 a8 4c 24 85 5f 91   Z.d........L$._.
0470  9f 29 27 88 e5 3f 7f 4d 19 dd bb 3d 40 2b 34 60   .)'..?.M...=@+4`
0480  54 b0 71 e1 08 43 ce 82 0a 14 68 3c 60 04 96 6a   T.q..C....h<`..j
0490  7a f6 f5 47 01 02 15 9d 4f e7 db fc 43 d9 e5 fa   z..G....O...C...
04a0  f5 69 16 03 6d 74 d4 33 7c 5a 6e d0 33 a8 02 b5   .i..mt.3|Zn.3...
04b0  d1 55 c5 0e ff f1 50 80 17 7f fc 21 19 8f ff ff   .U....P....!....
04c0  ff ff f2 b7 28 36 89 07 a7 41 00 0f 24 53         ....(6...A..$S

No.     Time               Source                Destination           Protocol Length Info
    914 13:56:00.942486    10.210.66.82          106.11.92.29          HTTP     914    GET /yt/vp.vtslog?version=0.5.44&vid=707195416&uid=&type=h5&cf=0&cpt=16&full=0&pc=0&clb=0&playersid=15266513519341cdpo5sru2btdRSphKjYcclm&abtest=b&sn=3&pt=15&hi=5&vvid=885c6b655274e9cd580e9e8e527d2180&lang=1&r=1337599654&cna=WnjsEmreO3oCAd7TtqYtFE7Z&speed=1 HTTP/1.1 

Frame 914: 914 bytes on wire (7312 bits), 914 bytes captured (7312 bits) on interface 0
Ethernet II, Src: AsustekC_34:f3:aa (9c:5c:8e:34:f3:aa), Dst: Hangzhou_d2:34:0d (3c:e5:a6:d2:34:0d)
Internet Protocol Version 4, Src: 10.210.66.82, Dst: 106.11.92.29
Transmission Control Protocol, Src Port: 31087 (31087), Dst Port: 80 (80), Seq: 1719, Ack: 639, Len: 860
Hypertext Transfer Protocol
     [truncated]GET /yt/vp.vtslog?version=0.5.44&vid=707195416&uid=&type=h5&cf=0&cpt=16&full=0&pc=0&clb=0&playersid=15266513519341cdpo5sru2btdRSphKjYcclm&abtest=b&sn=3&pt=15&hi=5&vvid=885c6b655274e9cd580e9e8e527d2180&lang=1&r=1337599654&cna=Wn
    Host: yt.mmstat.com\r\n
    Connection: keep-alive\r\n
    User-Agent: Mozilla/5.0 (Windows NT 10.0; Win64; x64) AppleWebKit/537.36 (KHTML, like Gecko) Chrome/66.0.3359.139 Safari/537.36\r\n
    Accept: image/webp,image/apng,image/*,*/*;q=0.8\r\n
    Referer: http://v.youku.com/v_show/id_XMjgyODc4MTY2NA==.html?from=y1.2-1-97.4.1-1.1-1-2-0-0%26source%3Dautoclick\r\n
    Accept-Encoding: gzip, deflate\r\n
    Accept-Language: en-US,en;q=0.9,zh-TW;q=0.8,zh;q=0.7\r\n
    Cookie: cna=WnjsEmreO3oCAd7TtqYtFE7Z; sca=57c7c60f; yunpk=1235994412436795; tbsa=5cef25164a63168536774494_1522742466_2; atpsida=4efe74594bbbcce4b63c6504_1526651338_5\r\n
    \r\n
    [Full request URI [truncated]: http://yt.mmstat.com/yt/vp.vtslog?version=0.5.44&vid=707195416&uid=&type=h5&cf=0&cpt=16&full=0&pc=0&clb=0&playersid=15266513519341cdpo5sru2btdRSphKjYcclm&abtest=b&sn=3&pt=15&hi=5&vvid=885c6b655274e9cd580e9e8e5]
    [HTTP request 3/3]
    [Prev request in frame: 562]

No.     Time               Source                Destination           Protocol Length Info
    924 13:56:00.990792    10.210.66.82          106.11.92.29          HTTP     914    GET /yt/vp.vtslog?version=0.5.44&vid=707195416&uid=&type=h5&cf=0&cpt=16&full=0&pc=0&clb=0&playersid=15266513519341cdpo5sru2btdRSphKjYcclm&abtest=b&sn=3&pt=15&hi=5&vvid=885c6b655274e9cd580e9e8e527d2180&lang=1&r=1337599654&cna=WnjsEmreO3oCAd7TtqYtFE7Z&speed=1 HTTP/1.1 

Frame 924: 914 bytes on wire (7312 bits), 914 bytes captured (7312 bits) on interface 0
Ethernet II, Src: AsustekC_34:f3:aa (9c:5c:8e:34:f3:aa), Dst: Hangzhou_d2:34:0d (3c:e5:a6:d2:34:0d)
Internet Protocol Version 4, Src: 10.210.66.82, Dst: 106.11.92.29
Transmission Control Protocol, Src Port: 31092 (31092), Dst Port: 80 (80), Seq: 1, Ack: 1, Len: 860
Hypertext Transfer Protocol
     [truncated]GET /yt/vp.vtslog?version=0.5.44&vid=707195416&uid=&type=h5&cf=0&cpt=16&full=0&pc=0&clb=0&playersid=15266513519341cdpo5sru2btdRSphKjYcclm&abtest=b&sn=3&pt=15&hi=5&vvid=885c6b655274e9cd580e9e8e527d2180&lang=1&r=1337599654&cna=Wn
    Host: yt.mmstat.com\r\n
    Connection: keep-alive\r\n
    User-Agent: Mozilla/5.0 (Windows NT 10.0; Win64; x64) AppleWebKit/537.36 (KHTML, like Gecko) Chrome/66.0.3359.139 Safari/537.36\r\n
    Accept: image/webp,image/apng,image/*,*/*;q=0.8\r\n
    Referer: http://v.youku.com/v_show/id_XMjgyODc4MTY2NA==.html?from=y1.2-1-97.4.1-1.1-1-2-0-0%26source%3Dautoclick\r\n
    Accept-Encoding: gzip, deflate\r\n
    Accept-Language: en-US,en;q=0.9,zh-TW;q=0.8,zh;q=0.7\r\n
    Cookie: cna=WnjsEmreO3oCAd7TtqYtFE7Z; sca=57c7c60f; yunpk=1235994412436795; tbsa=5cef25164a63168536774494_1522742466_2; atpsida=4efe74594bbbcce4b63c6504_1526651338_5\r\n
    \r\n
